,name,address,sort,menu,mean_price,score,people_give_score,review_count,review_list
0,카페노티드 안국,서울 종로구 북촌로 6-3 1층 (우)03059,카페,"AMERICANO,CAFE LATTE",4500,3.3,185,1051,"맛있음 줄 맨날 김/금요일 3시쯤 가서 20분정도 줄섰음. 종류별로 다 구매해서 먹었는데 전체적으로 빵이 엄청 부드럽고 크림이 많이 들어가있는데 많이 달지 않아서 좋았음. 도넛을 좋아하지 않는 편인데도 맛있게 잘 먹음. 바닐라 초코 우유 딸기가 젤로 맛있었음. 대기을 30분이내에 한다면 또 사먹고 싶음/맛은 있다.근데 그돈 주고 기다려가면서 사먹을정도는.../노티드는 역시 최고임 ㅎㅎ 기다릴만함! 크림도 맛있고 빵도 맛있음 지점 어디가도 다 사람 많아서 대기는 어쩔 수 없는듯/인당 50개씩 팔던데.. (되팔 것도 아니고) 덕분에 줄은 줄지도 않고.. 손님을 생각하는 기본 자세는 아니네요.  인당 20개 정도로 줄이고, 그게 부족한 분들은 한번더 줄서서 먹으면 전체적인 줄도 줄고 기분 좋게 사먹을텐데..  별로입니다~~/브랜드 마케팅만 열심히 하셨나봅니다, 던킨보다 못한 수준의 도넛과 서비스 소양 전혀 없는 직원들. 손님들한테 짜증내지마세요/우유크림최고/안국역 가면 스마일 그려진 작은 박스 넣어진 긴 비닐 들고 다니는 사람들 천지라 맛이 궁금했는데 너무 평범해서 어리둥절했음.  사람 별로 없는데도 줄은 길던데 살펴 보니 직원 손이 느리고 빨리 대기를 줄이려는 마음이 없어보임.  길게 늘어선 줄도 일종의 광고 효과가 있을 테니 그런 노림수라면 성공한 듯.  /노티드는 진리입니다./도넛 원탑/줄서서 먹을 정도는 아님 유독 이 지점만 줄이 늦게 줄어드는데 그 이유가 있음 남자 카운터 직원이 말귀를 못알아들음 그리곤 한숨 푹푹 쉬면서 사람 꼽줌 옆에 있던 여자 직원분이 나서야 해결되고 남직원은 주문 받겠다는 의지가 없음  사오면서 기분만 나빠짐/오늘도 맛깔나게 먹고 갑니다./이렇게기다릴정도는 아닌데 스티커 받으러 가야댐 /30분 기다려서 먹음  한번의 경험은 좋을듯 ㅋㅋ  배달도 되는거 같아서 배달이 더 나을듯/기다렸다 먹어도 맛있어요/테이크아웃 해서 옵니다 도넛은 노티드 !!!/레몬솔트 ?? 그거 빼고 다 마싯음!!!/맛은 좋은데 웨이팅이 길고 기다리는 길이 좁네여 ㅜㅜ/노티드는 항상 맛있긴 한데 웨이팅 너무 김.../도넛이 도넛이지/살은 찌는데, 도넛 가격이 좀 사악한건 맞는데 당 당기는날에는 무조건 이런종류의 도넛을. 두개 정도 먹고 나면 세상 행복한 사람이 된 기분임. /웨이팅을 무조건 해야하는 곳! 늦게 가면, 많은 도넛이 존재 하지 않는... 아쉬움/보통. 평일 2시때쯤 줄 있음. 대신 회전 빠른편. 주문길게끈다는데 전혀 옆에 담아주는 사람이있어서 주문즉시 담아서 빠르게 회전됨. 옆에 스티커 꼭 뜯어오시길. 귀여우니깐/종류가 너무 적지만 맛있어요~ 친절하고~/얼마나 맛있길래 줄이 이렇게 늘어섰나해서 사봤더니 직원 넷이 있는데 한명만 주문받고 포장하면서 주문 하나에 3-5분정도 끄네요 느릿느릿^^/직원들 친절하고 가게도 이쁘고 도넛도 맛있고... 달다구리한거 좋아한다면 꼭 가보셔요/던킨도넛이랑 맛이  똑같음 여친한테 혼남 ㅜ/큰 기대 안했는데 기대 없이 먹으니 맛있네요 크림이 달고 시원하고 넘 맛있어요 빵은 조금 느끼해용/줄 서기 전에 먹어봤는데 안국역 길 지나갈 때마다 그 정도인가 싶음.. 무난합니다./평범합니다. 유행따라 그냥 한번 먹어보았으니 됬습니다."
1,어니언 안국점,서울 종로구 계동길 5 (우)03059,카페,"Americano,Cafe latte,Peppermint Tea,Chamomile Tea,White Tea",5500,3.3,171,1270,"넓고 분위기 좋음 줄은 김/빵 생각보다 괜찮았고, 건물도 예쁨. 직원분들 친절하심./여기 직원분들이 너무너무너무 친절하십니다! 사소한 부분들일수도 있지만 말투가 다 이쁘시고 행동에서도 모든분들이 상냥하셔서 기분 좋은 시간 보내고 왔습니다  보통 계산할때 받는 서비스 응대는 짜증만 안섞여 있으면 괜찮다고 생각하는데 여기는 모두 다 밝고 긍정적이셨던게 정말 기억에 남습니다..!! 남은 빵 포장 부탁했을때도 너무 친절하셔서ㅜㅜㅜ 처음부터 끝까지...더보기/A really beautiful and traditional café place I really liked. We sit on a cushion on the floor, korean style its really nice. Theres a lot of choice of cakes thats really good /분위기는 좋으나 좌식으로 앉는 자리였으면 더 좋았을거 같아요. 유명하데서 웨이팅을 거의 한시간 했는데 빵 맛은 기대이하 그냥 밀가루 씹는맛/카페가 분위기 이쁘지만 빵을 세균과 바이러스 으로부터 덮을 수 있다면 더 좋을 것어요./팡도르는 빵에서 오래된 냄새나고 바나나커스터드 빵은 바나나에서 상한냄새나고 소금버터빵이 제일 ㄱㅊ/직원분들 친절하시고 인테리어 예쁘고 빵 맛있음 /단발머리 여성 직원분 너무 친절해서 인상적이었어요. 유명한 카페 많이 가 봤는데 서비스까지 인상적인 곳은 드물어서 더 기억나네요. 오전에 이미 커피를 마셔서 주문할 때 샷 하나만 넣어달라고 부탁드렸는데, 남은 샷 하나를 예쁜 머그에 따로 주시더라구요. 연한 커피도 고객마다 취향이 달라 혹시 밍밍하면 더 부어 먹으라구요~ 큰 규모의 북적이는 카페에서 이런 작...더보기/다 맛있어요  대기시간이 길어서 그렇지 공간이 넓어서 분위기 넘 좋아요!!/금요일 한낮 카페가 붐비는데도 직원분들이 한명한명 정말 친절 상냥하고 활기 가득이었어요 응대받는 손님이 기분이 좋아질 정도였음! 팡도르는 신세계였고 빵 자체가 담백쫄깃했음 다른 빵들도 빵 자체의 맛이 뛰어났고, 버터 가득이어도 부담스럽거나 느끼하지 않았어요.  초코케이크는 꾸덕해보이는 것에 비해 설탕대신 카카오를 많이 쓰시는지 덜 달고 건강한 맛ㅋㅋ 빵 포...더보기/평일 오후 한옥에서 즐기는 여유. 커피도 빵도 괜찮고 음악도 적절하다. 그러나 지속가능성(sustainable)을 이야기하면서 일회용 컵과 포크, 나이프를 내어주는 것은 어딘가 모순적이다./참새,,/고즈넉한 한옥의 감성과 잔잔한 음악이 좋았던 곳이었습니다. 아메리카노도 슴슴해서 빵과 잘 어울릴 것 같았어요.  비오는 날 한옥 감성 제대로 느끼고 갑니다./괜찮은 카페라며 한번 가보라해서 가봤더니 괜찮네요...한옥카페라 색다른 분위기도있고 모두 먹어볼순 없었지만 내가 고른빵들은 맛있었음! 앉아있는데 평일임에도 계속 사람들이 줄줄이 들어오는데 주말엔 대기줄이 길듯...직원들 반갑게 인사도하고 친절해서 더욱 좋았음~/한옥카페라 힐링되는 기분였네요..디저트 커피도 맛있었습니다^^/가격과 명성에 비해서는 빵 맛이 별로에요.. 카페 인테리어나 분위기는 좋습니다!/hmm.../빵 비싼데 맛있어요/분위기 진짜 좋아요!! 좌식인 것도 매력적이네용 근데 늦게 가서 그런건지 빵이 다 팔리고 없더라구요! 빨리 가셔야 합니당T-T 커피는 역시나 맛있고 빵은 쏘쏘,..? 몇 개는 맛있고 몇 개는 별로여서 잘 골라드세용~!/1. 토요일오후 4-5시 기준 30분 정도 대기했지만, 안내 전용 직원이 있었고 친절해서 좋았다. 체계적으로 대기 가능. 앉아서도 대기 가능. 기다리면서 열심히 일하는 대여섯명의 직원들 구경 및 커피와 빵 냄새를 맡다보면 어느새 내 차례.  2. 아이스 아메리카노, 플랫화이트 및 빵 네개 먹었다. 커피는 맛이 별로였다. 다음에 온다면 그냥 아메리카노만 먹을...더보기/기대를 품고 방문했는데 실망을 많이 했습니다ㅜㅜ 카페는 넓은 거 같은데 코로롱 때문인지 추워서인지 자리를 많이 치워놨고, 빵 종류도 생각한것보다 많이 없어서 고르는데 애먹었어요 명란아보카도바게트는 먹을만했어요 문제는 저 하얀빵이 젤 잘 나간다고 들어서 시켰는데 이건 대체 무슨 맛인지... 그냥 설탕 잔뜩 뿌린 안에는 아무것도 없는 딱딱한 공갈빵 그리고 한옥...더보기/허니매생이감태빵이 굉장히 맛있었고 커피는 평범했다 (개인적으로 커피 맛을 잘 모름..) 사람이 엄청 많긴 하지만 한옥 공간과 분위기가 좋아서 한 번쯤 가볼만 한 것 같다/빵 맛이 좀 아쉬워요 직원분들은 굉장히 친절하십니다 또 아쉬운점은 몇몇 자리는 너무 추워요/드립커피 진짜 최고 빵도 괜찮음/웨이팅만 없다면 빵도 커피도 좋다/밤라떼 생각보다 덜 달고 맛있었음 직원분들이 상당히 친절하심 분위기 좋음 근데 핫플이라 그런지 사람이 짱많음/빵 맛없냐구요? 아니언, 뚱인데요?/직원분들은 너무 친절했고 한옥카페라 이뻣습니다 하지만... 카페란 자고로 음료와 디저트가 맛있어야되는데ㅠㅜ 드셔보고 레시피 만든거 맞죠??ㅠㅜ 아이스초코. 밤라떼 흰색가루 올라가있는빵(그나마괜찮았어요)카라멜케익 먹었습니다/공주밤빵이랑 감태빵 맛있어요^^  밤빵에는 밤이 한가득 있습니다.   직원분들이 정말 친절하세요.   제가 실수로 유리에 부딪혀 커피가 바닥에 쏟아졌는데 바로 처리해주시고 빵과 음료도 무료로 다시 주셨어요. 계속 괜찮은지 확인하시구요.   혹시 이 글 읽으실지는 모르겠지만  정말 감사합니다^^ /혼자카페도 나쁘지않았던 곳 그래도 주변에는 커플이나 모임사람들 대부분 시그니처빵은 기대안하고먹으면 맛있고 초코스콘이 너무단데 바삭해서 좋았어요 직원분들 친절하셔서 기분좋게 다녀가요/빵 음료 평범 한번쯤 가볼만한 한옥 카페"
2,다운타우너 안국,서울 종로구 북촌로 6-4 1층 (우)03059,햄버거,"치즈버거,오리지널 프라이즈,치즈프라이즈,제네럴 쏘치킨,바질 크림 치킨,핫 앤 스파이시 치킨",6383,4.0,183,956,"존맛탱 원조맛/회식 때 첫 수제버거를 먹어보고 맛나서 포장해서 먹고있어요~!!/근처 들릴 때마다 가는 맛집 ㅎㅎ 감자튀김 최고!/번과 패티 모두 훌륭 기본 치즈버거도 여느 수제버거 못지않게 맛있다 서빙 속도가 빠르지 않아서 웨이팅 뚫고 들어가서도 한참 기다려야함  노티드와 같은 사장님(?)이라 그런지 번이 노티드 빵과 비슷한 느낌으로 쫄깃부들 오리지널 감자튀김은 평범/- 토요일 오픈 5분 전에 도착했는데 내 앞으로 13명 있음 - 바깥이 보이는 자리에 앉거든 절대 바깥에 줄 서있는 사람들과 눈을 마주쳐선 안 된다 (노려보고 잇슴)/치즈 감튀 빼고 다 존맛.. 치즈 감튀는 느끼한음식에 환장하는 저도 세 입 먹고 남김 아! 그리고 화장실 냄새 너무 심해요 매장 입구쪽에서 햄버거 먹다보면 화장실 냄새가 코를 찌를 정도예요/한결같은 맛. 가성비가 좋다 /다른 지점과는 다르게 안국의 느낌을 살린 점 좋음 아보카도 버거는 내 최애다./수제버거다운 임팩트가 없고 감자튀김은 ㅋㅋ 너무 비싸고 퍽퍽/미미/그냥 무난한 수제버거 .감튀가 맛있다./먹어본 수제버거 중에 제일 맛있어요 패티 육즙 미쳤어요/넘 맛있어요 진짜/보통 이런 매장 인스타 인증용이라고 맛은 큰 기대안하는데... 일단 먹어본 수제버거류 중에 제일 맛있었음. 애매한 수제버거집에서 비싸게 먹을바에 여기가 가격도 차라리 합리적임. 개인적으로 쉑쉑에 쉑스택 엄청나게 좋아하는데 그 급으로 다운타우너 안국 버거들 다 맛있었음... 3가지 먹어봤는데 다 맛있음 ㅇㅇ/여기서 먹은 햄버거가 진심 가장 맛있음 제주도에도 있길래 가봤는데..좀 뭔가 맛이 없는... 안국점이 제일 괜찮은듯/맛있어요! 새우버거 약간 지금껏 못먹어봤던 맛/베이컨치즈버거랑 치즈프라이즈 먹었는데 진짜 맛있었어요!! 쉑쉑보다 맛있음!! 내부 인테리어도 독특하구요 아주 깨끗한 편은 아니지만 더러운 건 아니에요 사람이 많아서 그런 것 같아요 다만 양파피클을 담는 그릇이 작아서 담을 때 불편하구요 포크로 먹어야하는데 계속 긴 양파가 포크 사이로 흘러내려서 먹기가 좀 불편하네요 햄버거 담는 실리콘이 다회용이라 친환경적이...더보기/햄버거랑 프라이 모두 맛있었는데 화장실이 남녀공용이고 너무 더러워요. 정말 많은 사람들이 오고 가는만큼 금방 더러워지는건 이해하지만 그만큼 관리 제대로 하셔야 할 듯 해요. 변기, 세면대, 바닥 모든게 비위생적이라 문고리도 만지고 싶지 않았어요. 매장 내에서 이상한 냄새가 계속 풍겼는데 화장실 들어가보고 그게 화장실 냄새였다는 걸 알게 됐어요,,,, 화장실...더보기/가끔 진짜 버거가 먹고싶을때/맛있지만 실내가 너무너무 추워요 테이크아웃해서 급하게 먹는 기분.. 여러 손님들이 패딩입고 음식 드시더군요 햄버거 홀더에 기름이 많이 묻어있고 안쪽에도 음식물이 있어요 두번 다 그래서 찝찝했어요 홀더가 먹기 편리해서 좋지만 여러 사람 손과 음식이 닿으니 제발 설거지해주세요.../일단 본인이 주말에난 시간잇다 이러면 포기하삼/수십명 줄서서 먹을 맛?? 코로나 방역은???/맛있어서 계속 찾게 되긴하지만 점심시간엔 테이크아웃도 기본 30분 기다려야해요. 미리 네이버 주문하고 가는거 추천합니다./말모 존맛ㅜ 아보카도 들어간거 개쌉존맛/수제버거는 원래 다 맛있어서 맛나게 먹었어요 막 특별한 맛은 아니었긴 해두,,/쏘쏘했어요ㅠ.ㅠ/노티드갔다가 여기도 유명하대서 포장해가려고 들어감. 포장은 먼저라고 해서 먼저 주문했는데, 나보다 늦게 들어온 착석손님보다 늦게 나와서 항의했더니 포장 주문은 늦게 들어간다고 기다리라고 함. 알고보니 이미 나왔는데 그걸 모르고 안 줘서 쓸데없이 거의 40분 기다림. 직원의 질이 떨어짐. 매장 운영 체계가 없음./맛은 그냥 그렇고 직원이 불친절/베이컨치즈 아보카도 오리지널 프라이즈/치킨버거 포장했는데 안에 치킨패티가 다 탔어요 상태봐서 사이즈 안나오면 다시 튀겨서 오더 빼던가 해야지 짜증나네요 /jmt 우리나라에서 햄ㄱ버거 젤마싯숨/줄 서서 먹을만 함 쉑쉑대신 다운타우너로 다 바꾸쟈 마시쏘~/그냥 수제햄버거맛 기다릴 핗욘 없을듯 맛있긴한데 특별함은 모르겟다/인테리어도 참신했고 써빙도 친절했다 하지만 화장실문을 열자마자 곰팡내가 진동해서 첫이미지를 완전히 구겼다 화장실까지가 가게의 모든 이미지가 된다는걸 아셨으면 좋겠다 "
3,소금집 델리 안국점,서울 종로구 북촌로4길 19 신영빌딩 1층 103호 (우)03056,샌드위치,"잠봉 뵈르 샌드위치,제주 흑돼지로 만든 잠봉과 프렌치 이즈니 버터로 가득 채운 소금집의 시그니쳐,14,000,파스트라미 샌드위치,비프 파스트라미에 치즈와 피클, 머스터드를 곁들인 아메리칸 사워도우 샌드위치,14,000,모르티 샌드위치,모르타델라, 아이올리소스, 루꼴라, 어니언 피클로 맛을 낸 포카치아 샌드위치,17,000",14333,3.6,174,643,"맛있어요. 특히 하우스 맥주가 정말 향긋하고 좋았어요! 직원 불친절 걱정하고 갔는데 바뀌셨는지 개인적으로 불친절한 응대는 없었어요 /아란치니 맛있어요. 처음 맛본 짭잘한 샌드위치 둘다 맛있었어요. 다음엔 플래터랑 오늘의 스프를 맛보고 싶어요. 분위기 괜찮아요. 맥주 하시기도  좋아요/안국동에 가면 저절로 이끌려 가는 맛집/망원동보다 매장이 훨씬 넓고 쾌적하다. 오늘의수프(브로콜리?), 잠봉뵈르 샌드위치, 소시지 플래터, 맥주 두 잔 둘이서 먹었는데 사이드 메뉴도 감튀여서 그랬는지 처음에 모자랄 수도 있겠다 생각한 것과 달리 양이 충분했다. 샤퀴테리 전문이라 소시지가 정말 굿. 여긴 전에도 느꼈지만 정말 맥주 필수 같다./샤퀴테리 찐 맛집 인정/잠봉뵈르를 처음 먹어봐서 맛 평가는 못하겠지만 기다려서 먹을 정도는 확실히 아님 웨이팅 없이 무난하게 먹을 수 있는 맛/잠봉뵈르, 감튀 맛있다 파스트라미는 피클의 시큼함과 머스타드의 코끝 찡함이 강해서 내취향 아니었다/잠봉뵈르, 요새 잠봉뵈르 파는곳이 많아져서 잠봉 자체로는 무난한데 버터와 잠봉 조합이 좋다. 버터가 맛있다/평일 오전에 갔더니 웨이팅은 없었어요. 징짜 너무 마시써요. 잠봉뵈르 사랑해!/괜찮았던 것 같다. 맥주든 콜라든 음료는 필수였던 느낌 직접 가서 메뉴 주문하고 선결제였다. 잠봉뵈르 나쁘지 않았음 /잠봉뵈르 너무 맛있어요. 1시간 기다려서 너무 힘들엇는데 기분 좋아져서 포장도 해갑니다!/루벤은 사우어크라우트 덕에 보기보다 기름지지 않다. 맛있지만 사워도우 자체도 단단한데 바짝 구운데다 샌드위치 속이 워낙 푸짐해서 먹기 조금 불편함. 햄스테이크 플레터는 짜고 육즙 폭발하는 햄이 맥주를 부르는 맛. 이날 시킨 메뉴 중(맥주 포함) 가장 맛있게 먹었다. 매시드포테이토가 사이드인 이유는 알겠으나 햄이 맛있으니 단독으로 먹는 것이 더 맛있었다. 오...더보기/역대급 불친절 안국이라는 위치만 제외하면 왜가는지 1도 이해안감 기분때문인지 맛도^.^; 22년도 들어서 처음으로 기분 잡친 날 웨이팅 기다리자고 한 친구 명치에 인생펀치 꼽을뻔했습니다^.^/응대 불친절하고, 심지어 값어치만큼 맛있지도 않았습니다 맛은 그렇다치고, 그런 응대말투는 처음 들어보고요, 갑질당하는 느낌이었어요  오래오래 기다려 들어온 식당에서 상당히 기분 나빴어요/개점 초부터 간혹 들리는 곳이긴 하지만, 서비스에 대한 기대는 크지 않은 곳. 점점 불친절이 직원들 사이에서 조직문화로 잡은 듯.../주문받는 파마 남자 알바 무례해요../굳이 그렇게까지 불친절할 필요가 있나요? 직원분들의 응대에 상당히 불쾌함을 느낍니다. 샤퀴테리 맛집은 많아요./I’ve been to two different locations for Salt House deli and I’ve never been disappointed.  /맛은있으나 웨이팅+비싼 값어치까지 하는진 모르겠어요. /잠봉뵈르/여긴 확실히 인스타 맛집; 사이드로 나온 감자랑 하얀소스는 괜찮아서 별 2개. /오늘 11시 16분쯤 방문하였구요 앞에 10팀 대기 있었습니다 많이 기다리지 않았고 30~40분 후에 들어갔어요 여기 리뷰에는 직원분들 불친절 하다는 글이 많았는데 주문 받는 분은 물론이고 입구에서 QR체크인과 온도체크 도와주는 직원분들 전부 친절했습니다 음식 맛도 아주 좋았구요 개인적으로 직원이 불친절 하다는 의견정도야... 충분히 남길수 있다고 생각합니...더보기/맛은 괜찮은데 저만 불쾌하다고 느낀건 아니였네요.. 제돈주고 사먹는데 왜 갑질당하는 기분이 드는지.. 서비스마인드좀 챙기시길.. 요즘 잠봉맛있는 다른곳도 많아요^^/음식 나오는 속도 미쳐 버렸습니다 너무 잘 먹었습니다 당근샐러드도 맛있고 이게 잠봉뵈르 군요 아란치니도 토마토 소스가 정말 맛있어요 피자도 잘만드실듯/기다릴 정도는 아니고 안경 쓰신 남자분? 틱틱대세요 주문 받는 시간이 짧은데도 느껴졌어요/안경쓴 카운터에 있는 남자분…때문에 기분도 맛도 떨어졌어요…이 분이 오너같지는 않은데…사장님 리뷰 보고계시나요?/가르마펌 남자직원인지 사장인지 서비스고 뭐고 기본적으로 매너가 없습니다. 그뿐이네요./유럽 현지맛!/직원 매니저 가리지 않고 매우 불친절한 응대를 서너번 정도 경험하고 나왔더니 다신 가고 싶지 않아짐..ㅋㅋ 망원점으로 가야지/기다리면서 먹을만하진 않음 개비싸/짜기만 해/맛있어욤!!! 수제소세지랑 햄 좋음~"
