,name,address,sort,menu,mean_price,score,people_give_score,review_count,review_list
0,구복만두,서울 용산구 두텁바위로 7 1층 (우)04335,분식,"구복전통만두,통새우만두,김치만두,샤오롱바오",6500,3.8,210,393,"그나마 생강채라도 있어서 별 드립니다.  미지근한 보리차… 샤오롱바오 육즙 없는 기름진 고기만두느낌  역근처나 번화가에 있는 한국식 손만두가 짱이네요.  비비고 기름져서 안좋아하는데 새우만두 먹을바에  비비고 만두 먹겠다 싶었네요.  홍콩이랑 싱가포르에서 먹던 딤섬 맛은 아니에요.  한국 딘타이펑이랑 팀호완은 안가봤는데 비싸도 그냥 거기 가야겠다 싶었네요....더보기/맛이 담백하고 괜찮네요. 친절하시고./애정하는 맛집입니다./구복맨두 가성비 애지구요 맛도 지리구욤 /여기 딤섬 다먹어봣는데 내입맛엔 새우만두가 취향저격/처음먹은 그순간부터 영원히 내 최애만두집.../1년전 방송을보고 방문했는데 그사이 바로 길건너 이사를 하셨다고 함 확장오픈!! 샤오롱바우만두와 새우만두주문 샤오롱만두 식기전에 먹을것을 추천  식으면 달라붙어 먹기가 어려워질수도 있는것 주의할것       단백한 육즙이 인상적임 특제소스간장에 생강채썰어놓은것 고추가루  파   썩어  찍어먹으면 맛을 더  풍부하게 해준다    /맛있다 새우만두  남자가 먹어도 괜찮은 양이다/김치만두를 제외한 만두3가지를 먹었다.   맛은 다 평균이상. 가격이 양에비하면 비싸서 사실상 4점 정도.  하지만 미지근한 찻물?과 얇은 생강에 직접만든것 같은 간장. 이런 사소한것들이 더 맛있게 해줬다. /맛있어요~!/샤오롱바오보다는 딴 만두가 더 맛있네요/만두 맛있어요/[3/5] 새우만두:향이 너무 쌔서 별로였음 소룡포:살짝 매콤한 맛이 있어서 신기했지만 피가 두꺼워서 취향에 안맞음 고기만두: 가장 나았음  하지만 미슐랭 연속 선정이라고 찾아가서 먹을 정도는 아닌 것 같다고 생각/중국 현지의 맛 그대로~♡/새우만두 극극극호. 양념장이 감칠맛을 더한다. 집 근처라 감사한 마음…!/전통 만두만 먹어봤지만 맛이 준수 했다/만두란 이런것이다./구복만두가 젤 맛있당/중국식으로 만들어서 싫어하는사람들은 싫어할겁니다. 우리는 얇게해서 잘못건들면 톡터질것같은 만두인데 중국은 만두피가 많이 두껍습니다. 그래서 우리가 먹는 간장에 그냥 식초랑 같이먹으면 맛이안살아요. 중국식 찐한식초랑 간장 이런거랑같이먹어야 만두피안에 간이 입혀지면서 먹을만해요.  최근에 다시방문했는데 맛이 예전만큼 맛있지않아요.  특히 샤롱바오는 안에 돼지고...더보기/맛있어요~/호불호 나뉠거같아요  만두피 두껍고 엄청 슴슴해요.../맛있어요~!/갔는데 휴업중이시네요.../마시쩡~ 꼭 가보길^^/만두는 구복만두. 인정./인생 만두집.따봉./진짜 너무 맛있어요.. 자주갑니다/다시 찾고 싶은 맛집입니다./깔끔한데 버섯향이 좀 역해서 저는 맛있는줄 몰랐네요 ㅎㅎ/가격이 깡패./만두 맛있어요 줄서서먹는집/깔끔하고 친절함 만두는 뜨거울 때 먹어야 제일 맛있다 호다닥 먹고 나오기 좋다 샤오롱바오가 그릇에서 눌러붙어서 육즙이 새긴 하지만, 소실되진 않아 촉촉하다/군만두>>찐만두 새우에 버섯향 큰알새우 기대하면 실망.,.! 샤오룽바오 굳이? 근데가면 전메뉴 다먹게됌 ㅋㅋ! 메뉴는 딱 네개!! 술안팔아요!! 비오는날엔 딤섬땡김 "
1,마구로참치,서울 용산구 한강대로 271 2층 (우)04321,참치회,"마구로스페셜,마구로골드스페셜,명품혼마구로스페셜,혼마구로스페셜정식,참치초밥",46600,5.0,10,51,"와... 생참치는 처음인데 정말 너무 맛있게 먹었어요!! 서빙하시는 분들도 사장님도 정말 친절하셔서 먹는내내 대만족이었습니다ㅎㅎ 식전 죽도, 구이도, 칼국수도, 샐러드도, 무 조림도.. 너무 완벽했습니다ㅜㅜ 감사히 잘 먹었습니다! 재방문 의사 1000%!!/벌써 세번째 방문했어요! 생참치 = 마구로참치 공식임/1. 맛 생참치 진짜 입에서 녹아요.. 무조건 생참치로 드시는거 추천 그리고 여기 코스 반찬중에 간장새우랑 칼국수가 도른놈입니다 ㅋㅋㅋ 간장새우는 탱글하고 칼국수가 칼칼하니 진짜 소주가 그냥 들어가는 맛.. 2. 친절 사장님 직원분들 다 너무 친절하셔서 기분좋게 먹고왔습니다 3. 가격 콜키지가 한병당 만원이면 혜자아닙니까,, 와인 좋아하시는분은 와인 가져가...더보기/직원 분들 모두 친절하시고 생참치 퀄리티도 너무 좋아서 좋았어요! 코로나 시국으로 룸에서 먹었는데 좌식이 아니라서 편했습니당☺️/일단 넘 맛있어요 ,,, 여기 ,, 남는 장사 아닌듯 ,, 대마끼 매번 추가 요구를 하는데 ,, 최고 임 ,,/사장님 친절하시고, 참치도 너무 신선해서 술을 참을 수 없었네요. 전반적인 곁들임 요리가 다 맛이 좋았어요. 마지막으로 나오는 칼국수도 너무 좋았어요. 앞으로도 번창하시길./이춘복 본점 건너편임에도 불구하고 장사가 잘되는 건 다 이유가 있음. /서비스, 맛, 분위기 셋 다 만족함. 건너편 이춘복 보다는 여기로 오는걸 추천함./맛과 친절모두 갖추웠어요. 강추 ☆☆☆☆☆☆/일단 넘 맛있어요 ,,, 여기 ,, 남는 장사 아닌듯 ,, 대마끼 매번 추가 요구를 하는데 ,, 최고 임 ,,/사장님 친절하시고, 참치도 너무 신선해서 술을 참을 수 없었네요. 전반적인 곁들임 요리가 다 맛이 좋았어요. 마지막으로 나오는 칼국수도 너무 좋았어요. 앞으로도 번창하시길./이춘복 본점 건너편임에도 불구하고 장사가 잘되는 건 다 이유가 있음. /서비스, 맛, 분위기 셋 다 만족함. 건너편 이춘복 보다는 여기로 오는걸 추천함./맛과 친절모두 갖추웠어요. 강추 ☆☆☆☆☆☆/일단 넘 맛있어요 ,,, 여기 ,, 남는 장사 아닌듯 ,, 대마끼 매번 추가 요구를 하는데 ,, 최고 임 ,,/사장님 친절하시고, 참치도 너무 신선해서 술을 참을 수 없었네요. 전반적인 곁들임 요리가 다 맛이 좋았어요. 마지막으로 나오는 칼국수도 너무 좋았어요. 앞으로도 번창하시길./이춘복 본점 건너편임에도 불구하고 장사가 잘되는 건 다 이유가 있음. /서비스, 맛, 분위기 셋 다 만족함. 건너편 이춘복 보다는 여기로 오는걸 추천함./맛과 친절모두 갖추웠어요. 강추 ☆☆☆☆☆☆/일단 넘 맛있어요 ,,, 여기 ,, 남는 장사 아닌듯 ,, 대마끼 매번 추가 요구를 하는데 ,, 최고 임 ,,/사장님 친절하시고, 참치도 너무 신선해서 술을 참을 수 없었네요. 전반적인 곁들임 요리가 다 맛이 좋았어요. 마지막으로 나오는 칼국수도 너무 좋았어요. 앞으로도 번창하시길./이춘복 본점 건너편임에도 불구하고 장사가 잘되는 건 다 이유가 있음. /서비스, 맛, 분위기 셋 다 만족함. 건너편 이춘복 보다는 여기로 오는걸 추천함./맛과 친절모두 갖추웠어요. 강추 ☆☆☆☆☆☆/일단 넘 맛있어요 ,,, 여기 ,, 남는 장사 아닌듯 ,, 대마끼 매번 추가 요구를 하는데 ,, 최고 임 ,,/사장님 친절하시고, 참치도 너무 신선해서 술을 참을 수 없었네요. 전반적인 곁들임 요리가 다 맛이 좋았어요. 마지막으로 나오는 칼국수도 너무 좋았어요. 앞으로도 번창하시길./이춘복 본점 건너편임에도 불구하고 장사가 잘되는 건 다 이유가 있음. /서비스, 맛, 분위기 셋 다 만족함. 건너편 이춘복 보다는 여기로 오는걸 추천함./맛과 친절모두 갖추웠어요. 강추 ☆☆☆☆☆☆/일단 넘 맛있어요 ,,, 여기 ,, 남는 장사 아닌듯 ,, 대마끼 매번 추가 요구를 하는데 ,, 최고 임 ,,/사장님 친절하시고, 참치도 너무 신선해서 술을 참을 수 없었네요. 전반적인 곁들임 요리가 다 맛이 좋았어요. 마지막으로 나오는 칼국수도 너무 좋았어요. 앞으로도 번창하시길./이춘복 본점 건너편임에도 불구하고 장사가 잘되는 건 다 이유가 있음. /서비스, 맛, 분위기 셋 다 만족함. 건너편 이춘복 보다는 여기로 오는걸 추천함./맛과 친절모두 갖추웠어요. 강추 ☆☆☆☆☆☆"
2,하라케이크 숙대본점,서울 용산구 한강대로 279 1층 (우)04321,"제과,베이커리","마카롱,다쿠아즈,컵케이크(레몬),초코송이,파베 초콜릿",3500,3.3,21,6,"너무 실망스럽네요. 거의 4년 동안 이용했고, 수제라 맛도 좋고, 가격도 2만원 미만이라 좋았습니다. 그런데  같은 사이즈에 겉 디자인만 다른 걸 4만 5천원에 팔다니요. 아무리 크리스마스 시즌이라도 그렇지.. 그리고 크리스마스라 느낌을 내려고 했다곤 하지만 음식에 털 모자는 뭔가요?? ㅠㅠ (예전 가격대를 모르시는 거 보니 사장이 바뀐 신 건지.. 아무튼...더보기/마카롱 맛있어요 :) 선물하기 딱 좋아요/마카롱 종류 다양하고 맛있더라고요 케이크 가격도 다른 곳 생각하면 저렴해서 좋았어요~ 직원분들도 친절하시고요/뚱카롱 별로 안좋아하는데 여기는 괜찮더라고요/이렇게 장사해도 장사가 되나보네요 ㅋㅋㅋ/미니레터링 한개, 주문제작케이크 하나 구매했어요!!!다른 주문제작 케이크에 비해 가격도 저렴하고 맛도 있고 정말 맛있어요!!! 강추합니다!/성격이 둔해서 리뷰 잘 안쓰는데 이건 좀 아닌것 같아서 올려요! 21일에 파베초콜릿 사서 먹었어요 그때도 하얀색 점이 있길래 슈가파우더인줄 알고 그냥 먹었는데 일주일도 안돼서 곰팡이가 피어있어요.. 만드신지 오래된지 잘 모르겠는데 배탈은 안났지만 이런건 확인하고 폐기하셨으면 좋겠네요ㅠㅡㅠ 8000원이나 주고 샀는데 아쉬워요 ㅠㅠ 제조일자라도 표기해주셨으면 ...더보기/작년 클스마스에 케익을 삿는데..겉은 예뻐 보이는데 안에는 크림(그마저 느끼해서 못먹음)으로 가득 차 있었다. 그냥 관상용으로 볼거면 사시고 먹을려고 한다면 안사시는게..../도시락 케이크(8000)랑 조개마카롱(5000) 선물용으로 조금 급하게 샀는데 너무 예뻐서 다들 만족했어요!ㅎㅎ 버터크림 케이크라서 큰 기대는 안하고 사진용으로 가져간 느낌이었는데 맛도 괜찮았어요 이렇겠거니~ 생각하던 그 맛! 크기도 딱 셋~넷이서 빠르게 두세입씩 먹으면 될 크기였습니당 마카롱은 직접 먹어보진 못해서 정확히 적기 어렵지만 선물받은 친구가 너...더보기/미니 케이크 비추. 당일 생산 아니고 오래 된 미니케이크를 정가에 팔고 있어요. 뒤 냉장고에 더 최근에 생산한 미니케이크 있는데. 그렇게 판매할거면 오래된거는 할인해서 팔거나 다른 케이크 전시를 하지 말거나... 비양심적임. 다른 제품도 언제 생산 된 것들인지 믿을 수 없네요 / 좀 많이 불친절함 표정이나 말투에서 느껴지는게있음 처음느낀게 아니라 거의 매번 그렇고 다 다른사람인데도 그럼 맛은 생긴것만 예쁘고 맛있진 않음..솔직히 싼것도 잘은...ㅋㅋ/초코칩도 들어있구 맛나서 생일파티 잘 했어요 :)/스쿱쿠키 가격 가장 합리적. 맛은 약간 랜덤임. 어떤 건 밀가루 군내 어떤 건 맛있고/별루........다남겨서 버림/레터링케이크 이가격에 못사죠 매번 주문해서씁니다. 맛도 부담없이 편하구요(전문베이커리맛은아녀도.버리는정도절대아니구요)/쿠키진짜 맛있어요 추천합니다짱짱/딱 그 가격대입니다. 축하하는데 사용후 맛이없어 다 버렸어요."
3,양문,서울 용산구 한강대로81길 8 1층 (우)04321,갈비,"생소갈비(400g),양념소갈비(1인분),한우염통주물럭(180g),육회(150g),백골라면(한봉)",22200,2.9,28,58,"사장님 진지하게 뒷광고 그만 ㅠㅠ!!! 협찬표기 꼭 해야해요ㅠㅠㅠ /사이드 많이 나오고 가성비 괜찮음 사진찍기 좋음/정말 최악의 고기집이었습니다. 위생상태도 엉망이고, 고기질도 형편없고, 백골라면에 들어 있는 골수도 뼈에 지방 넣은 느낌이었습니다. 다른건 몰라도 스펀지 씹는 느낌의 아무맛 없는 고기는 정말 너무했어요. 아무리 수입 갈비라도 심한 맛이었어요. 재방문 의사 절대 없습니다./사장님도~ 유머스러우시고 ㅎㅎ 조용하니   친구들과 맛있게 먹고 갑니다^^ /정말 맛나요/생소갈비랑 육회 완전 소주친구네요 다음엔 백골라면까지 먹으러 올게요/이번 설연휴에 처음 방문했습니다. 이집은 음식 장사를 해서는 안되는 집입니다./인생 최악의 고깃집   불친절하고 고기에서 누린내 나고  특히 백골라면은 그냥 사리곰탕 스프맛밖에 안나네요.   정말 서빙하는 사람들 하나같이 불친절하고 손님한테 소리지르고 화내더라구요.  아니 숟가락통 옆으로 옮겨놓은게 그렇게 잘못한건가요? 저한테 막 화내시고, 뭐라고 하시는데  정말 불쾌했습니다.   SNS광고에 속아서 갔다가  내돈쓰고 기분 더러워지고...더보기/사장님도 유쾌하시고 맛있게 먹었어요! 선지해장국도 맛있어요/육즙어디감 육향 어디감 솔찍히 좀 돈이 아깝지만 사이드가 많이 나와서 별하나 추가 백골라면 완전 비추/12시 예약을 했어요 친절하게 전화번호까지 받으면서 해주시더라구요 들어가서 예약했다하고 말씀드리고 셋팅된 자리로 안내받으니 주방안에 레게머리한 남자분이 엄청 귀찮고 짜증나는표정으로 이모님한테 확인하라는 손짓을 하더라고요 왜그러냐고 물어보니 두분다 그에 대한 대답도 안하시고 이곳은 예약셋팅된 자리라서 안된자리로 안내해드린다고하고,  저희도 분명 12시에 예약...더보기/여긴 아주 불친절하게 2시간이내에 나가라고 하네요. 맛이 엄청나게 맛있거나 가격이 아주 저렴하지도 않음에도 이런 처우를 받으면서 먹고 싶지 않네요. 바로 앞에 계산하던 팀도 기분 나쁘다고 하면서 나가더라구요. 처음이었지만 다신 가고 싶지 않네요. 얼굴에 피어싱도 혐오감이 있구요..ㅠ/비싸고  좁고 시끄러워서 빡셉니다/미국산 생갈비 600g 69000원?뭐 그냥그냥 먹었는데요 양념갈비 시켰는데 지방 부분 손질은 하고 주셔야죠.. 다 잘라네서 먹고 못 자른 부분들 질겨서 퉤퉤 진짜 최악 이었습니다 다른 분들 사진보면 고기상태 괜찮던데 진심 최악이네요 십만원정도 나왔느데 돈 버리고갑니다/빵점 입니다 기분좋게 친한분들이랑 주말에 먹으려고 예약하려는데 당일예약만 가능하다해서 당일에 다시 전화했는데 불친절한 직원 왈 10분지나면 취소되고 5명(5명 예약했습니다) 다 모여야 입장가능하다고 무슨 대단한곳에 입장시켜주는듯 거만하게 통화를 하더군요  무슨 군대도 아니고 시간 딱 맞춰서 인원 다 모여서 들어오라는 그런 식당은 오십평생 본적이 없네요 이런...더보기/2021년 10월 20일 방문했었는데 49000원 아니고 59000원이었어요. 가격 올랐다네요. 5.9 가격치고는 불만족스럽습니다. 선지국은 맛있었어요./친절도 최악. 가성비 최악. 49000원짜리 김치맛집./미국산 갈비 400g(뼈 무게 포함) 49,000원? 고기에서 누린내 엄청 나던데 맛있다고 SNS에 올리는 사람들은 도대체 뭔지 광고에 속지 맙시다.  김치는 맛있음/친구 추천받아왔는데 너무 맛있었어요! 분위기도 유쾌하고 ㅎㅎ 생소갈비를 이 가격에 먹는다니 가성비가 미쳤네요. 백골라면 품절되서 대신 소꼬리 라면으로 주셨는데 아는맛인데 짱맛 ㅋㅋ 필수 추천ㅋ/기대하는 손님이 많아질 수록 웨이팅 시스템을  균일하게 정비했으면 하는 바람이 들더라구요 예약은 예약대로 테이블링은 테이블링대로 운영하시니 … 기존에 안내라도 있었으면 모를까  가게 앞 웨이팅 하는 손님들 대다수가 의아해하시는 분들이 많더라구요. 음식맛은 평균은 했고  주관적으로 재방문 의사가 강렬히 드는 곳이  맛집이란 기준으로 봤을 때 근방에 갈 일이 ...더보기/고기 매니아 입니다 이 집 찐입니다 디테일도 넘 좋음!!"
4,진대포 본점,서울 용산구 한강대로77길 11 (우)04322,한식,"목살 (180g),오겹살 (180g),갈매기살 (150g),항정살 (180g),왕갈비 (320g),한우소곱창",14500,4.8,10,18,
5,제일어버이순대 본점,서울 용산구 한강대로71길 52 (우)04322,순대,"순대국,순대정식,뼈해장국,모듬순대 (소),머리고기 (소)",10600,3.6,33,6,
6,크리스피크림도넛 남영역점,"서울 용산구 한강대로77길 15 1,2층 (우)04322",크리스피크림도넛,"러브 투게더 더즌,라즈베리 플라워 1개 + 스윗 아몬드 초코 2개 + 베리 러블리 2개 + 러브 메시지 1개 + OG 6개,12,500,오리지널 더즌,부드럽고 달콤한 크리스피크림의 시그니처 도넛 세트 (12개),17,000",17250,2.5,13,13,결제 잘해주시고 일단 다녀본 서울지역 크리스피크림도넛 중에서는 제일 좋은것 같아요 2층까지도 잘 돼있고/1월 5일 오후 4시반쯤 일하시던 남자 직원분 너무 불친절하네요 혼자 지인 기다리면서 시간 떼울겸 잠깐 들어간건데 저 백신접종자인데 업데이트 안되서 그런건지 띵동 소리가 났습니다. 그게 기분나쁘셨나요?  제가 코로나걸린것도 아닌데 무슨 죄인한테 대하듯 포스기 팍팍팍 치면서 말섞기 싫다는 표정 짜증섞인 말투 진짜 불친절하고 인사고 뭐고 하나도 없고 한손으로 ...더보기/남영역 바로 반대편에 위치해있어서 접근이 용이하고 직원분이 이것저것 원하는대로 친절하게 담아주셨어요 잘 먹었습니다 !! 그리고 역시 글레이즈드는 언제나 옳다/밝고 친절해서 기분 좋았습니다/평일 저녁 7시에 방문  매니저인지 점장인지 알 수 없으나 카드 뺏어 가져가듯 휙 가져가고 고객한테 짜증낸다는 느낌을 다분히 받을 수 있는 매장  내돈내고 불친절함과 직원의 짜증을 느끼고 싶다?  남영점 방문하세요ㅋㅋㅋㅋㅋ  /여기 평이 안좋은 이유를 알겟네요 CS 교육부터 다시 하셔야... /우유 도넛 기대했는데 개실패임...차라리 붕어빵 드셈/쉐이크를 주문했는데 받을때부터 다 녹아서 나왔네요... 그냥 딸기우유 살짝 얼린거 마시는느낌이었습니다. 알바들 교육 다시 해야할듯/알바는 아닌 것 같고 검정 옷 입고 눈 크고 키좀 큰 남자 분이 주문 받았는데 완전 불친절했음 기본 크리스피 도넛주문했는데 봉투에 넣으면서 거의 던지다싶이 줬음 다신안감/사장님이 매우 불친절하시네요
7,스타벅스 숙대입구역점,서울 용산구 한강대로 291 지하 1~3층 (우)04321,스타벅스,"펀치 그래피티 블렌디드,망고,사과,핑크 구아바,파인애플 등 다양한 열대과일로 만든,스트리트 문화의 대표적인 그래피티 벽화처럼 그려진 컬러 드리즐로,롤린 민트 초코 콜드 브루,스타벅스의 콜드 브루와 은은한 민트 초코 베이스로,손목의 스냅을 춤을 추듯 가볍게 돌려 음료를 섞어서,폼폼 유스베리 티,저녁 하늘의 노을이 물드는 듯한 비주얼의 음료.,,아이스 라벤더 카페 브레베,진한 리저브 에스프레소 샷과 은은한 라벤더향이 고급스럽게 어우러진 부드럽고 세련된 풍미의 라벤더 카페 브레베,5,100,밝고 가벼운 풍미의 블론드 원두로 즐기는,폼폼 민트 티,아침 하늘의 구름이 뭉게뭉게 피어나는 것 같은 비주얼의 음료.,",6880,2.1,12,13,바퀴벌레 엄청 큰 거 나왔어요 위생관리 ㅜ/멸공다방 아직도 가는 사람 있나요?/이제부터 불매운동을.../매장 운영 시간이 바뀌었으면 반영 좀 해두세요.  떡하니 토요일 22시까지라고 해놓고 21시에 문닫는건 뭡니까. 기본 정보 제공도 못하는데 친절할리가./주문할때 계속 안좋게 쳐다보시고 손님 받으시기 싫어하시는거 같았습니다^^ /직원 한명이 계속 왔다갔다 거리면서 의자바닥에 끌고 시끄럽게함. 그 거슬리게 의자끄는소리 1분에 한번씩남.. 손님 내쫓으려고 작정한것 같음ㅡㅡ 직원 교육 안시킵니까/여기는 숙대입구역 근처로 조용하고 커피 또한 맛있어요 다른 곳은 첫 맛이 쓰거나 탄 내가 많이 나는데 여긴 늘 언제나 순하면서도 커피 고유의 향긋한 맛이 있구요 크루들도 친절해요 인기가 많아서 자리가 부족하지만 나늑하고 한가롭게 전망을 즐기며 커피 먹을 수있어서 좋아요 아침엔 테이크 아웃하는 차들이 ㅁ줄지어 있어요 아 그리고 최근에 인테리어 리뉴얼해서 일층...더보기/친절하고 화장실도 깨끗해요~/스타벅스 자리 없음
8,스타벅스 남영동,서울 용산구 한강대로 275 (우)04321,스타벅스,"펀치 그래피티 블렌디드,망고,사과,핑크 구아바,파인애플 등 다양한 열대과일로 만든,스트리트 문화의 대표적인 그래피티 벽화처럼 그려진 컬러 드리즐로,롤린 민트 초코 콜드 브루,스타벅스의 콜드 브루와 은은한 민트 초코 베이스로,손목의 스냅을 춤을 추듯 가볍게 돌려 음료를 섞어서,폼폼 유스베리 티,저녁 하늘의 노을이 물드는 듯한 비주얼의 음료.,,아이스 라벤더 카페 브레베,진한 리저브 에스프레소 샷과 은은한 라벤더향이 고급스럽게 어우러진 부드럽고 세련된 풍미의 라벤더 카페 브레베,5,100,밝고 가벼운 풍미의 블론드 원두로 즐기는,폼폼 민트 티,아침 하늘의 구름이 뭉게뭉게 피어나는 것 같은 비주얼의 음료.,",6880,3.4,14,17,오후 7시면 닫아요./스탶분들 너무 친절하시고 좋아요./Bb/불친절 근데 맛있네 ㅎㅎ/30분 간격으로 마스크 착용 검사함 굳굳!!/30분 간격으로 마스크 착용 검사함;/콘센트 자리가 너무 없어 불편해요/화요일 7일오전에 근무하시는 여성분 모두 고객 응대 차분하고 친절하세요/다른곳은 의자옆에 물건두는곳이 있는데..없음 주차시설..없음. 손님들 개념..없음/깨진 잔에 라떼 주더라구요. 마시다가 입술 비어서 피났는데 바빠서 항의는 못했어요. /너무 친절하십니다. 제 잘못으로 커피 사자마자 엎질렀는데 그냥 새 걸로 다시 주셨어요. 서비스에 감동했습니다. ㅠ/주차 안됨...바로 옆건물 주차 30분 무조건 2500원/차이라떼시켰는데 너무 달아서 못마실정도.. 3층에서 일할려구하는데 시끄럽고 사람너무 많구.. 스타벅스라 그려려니 했는데 전기코드가 되는게 없다. 어이가 없는데 이미 라떼 사버려서 그냥 있어야겠네..  스타벅스는 역시 오는게 아니었다. 
