,name,address,sort,menu,mean_price,score,people_give_score,review_count,review_list
0,이문설농탕,서울 종로구 우정국로 38-13 1층 (우)03149,설렁탕,"설농탕,설농탕 (특),도가니탕,도가니탕 (특),머리탕,머리탕 (특)",14833,3.0,152,218,"설렁탕 국밥 싫어하는데 친구따라 가서 잘 먹은편 /양은 되게 많았는데 사알짝 냄새나는 것 같은 느낌? 근데 사실 개인적으론 괜찮았음/왜 자꾸 맛집으로 뜨는지... 비싸고(이건 땅 값 비싼 동네라 어쩔 수 없겠지만) 설농탕은 역하고 맛없음. 비싸도 맛있는 음식과 친절한 환대를 느끼면 만족하게 마련인데 여긴 둘 다 없음./완전히 그냥 평범/제발 가지마 고기 비린맛 나고 육수도 별로 가격만 비싸고 서비스 불친절 왜 진짜 빕구르망 받은지 모르겠음 이래서 무작정 맛있다는 맛녀석 안 믿음  /기대없이 가면 정말 무난 깔끔한 맛. 고기는 질이 좋다.  위생기대X 역사기대X 특별한맛기대X. 굳이 두번은 딱히? 무난해서 3점이나 일반설농탕 12000원에서 가격인상을 멈추기 바라며 2점./그저그런 보통의 설렁탕 기대 했던 만큼 국물도 진하지 않았다./추위에 밖에서 두 시간 정도를 떨다 배고픈 채로 들어와 따뜻한 국물요리 먹기 최적의 상태였음에도 설렁탕 맛은 그냥 그랬다… 이걸 만이천원이나 주고 시킬 필요가 있었을까. 뭔가 있을거야, 하면서 수십번 숟가락으로 국물을 맛보았는데 국물에서 고기가 아니라 미묘하게 곡물 맛이 났다. /120년의 업력만으로도 그 가치가 있는 우리나라에서 가장 오래 된 식당 /자극적인 맛 좋아하는 사람은 비추인데 나같이 내츄럴한것 좋아하면 무조건 여기임/둘이 먹으면 푸짐하고 맛있음 김치도 맛남/별 한개도 아까움 위생은 쓰레기에 먹고 3일 설사함 이사하기전 피맛골 그집하고 완전 다른집이 되었음/본래 서울 맛은 심심하다니 담백하다고 믿고 매장에서 먹었다 물론 서울에서 가장 오래됐다는 스토리 때문이다 어머니 생각이 나서 포장으로 도가니,특설렁탕 가져갔다 나중 어머니 말씀이 도저히 맛이 없어서 버렸다고한다 고기가 특이라는데도 양이  적었다고한다 이 집은 결국 과거의 명성에 기대어 오늘을 소비히는 곳일까 싶기도하다 백년식당 타이틀을 지키려면 푼돈에 명성...더보기/그저 오래되었다고 기대하고 리뷰도 안 읽어보고 온 내 잘못이다. 밥이 말아져 오는데 얼마나 오래 있었는지 밥알이 다 풀어져있고 면은 퍼지다 못해 씹으면 반죽을 그냥 씹는거 같음. 돈이 아까와 억지로 먹고 나왔다. 밑에 리뷰어들 말이 과장이 아님. 아들한테 너무 미안했다./설렁탕 먹다가 국물 남겼습니다. 서울미래유산에 선정된 집이라니.. 맛 때문이 아니라 단순히 오래 존재했던 집이라 그런 것 같군요. 맛은 동네 프랜차이즈 설렁탕집이랑 비슷하거나 못하고 가격은 비싸군요. 재방문 안합니다./맛있어요 ㅋㅋ 김치도 맛있고 자리도 넓고 굿!! 테이블에 파, 소금이 뚜껑 열린채로 있는데,이건 좀 비위생적이었어요 ㅎㅎ/근처 호텔에서 숙박하고 호텔에 조식 식당을 문의해서 방문했습니다. 역사가 많은곳이리 기대했는데. 먼저 다녀오신 선배분들의 리뷰를 보고 혹시나 했는데..바로 경험했습니다. 영하권 날씨에 아주 시원한 보리차와 구멍에 찌든때가 많이 보이는 파 연필통을 보고 깜놀했습니다. 간을 안보고 첫 시식을 했는데 갑자기 역대 선배님들의 리뷰 생각이..간이 하나도 안되어서 나...더보기/맛집 아니고 그냥 평범한 설농탕이다. 이게 12,000원이다. 걍 월세값이다. 동네에서 먹는 8천원짜리 설농탕 맛이랑 별반 차이 없다. 보통 맛집이 평점이 갈려도 리뷰한 사람이 수백명 천명 넘어가면 대략 의견이 모인다. 진짜 맛집인 경우 평점은 3.5점 전후가 나오지. 4.0 넘으면 그건 댓글로 조작했을 가능성이 있는거고. 그런데 여기 평점이 3.0이길래 ...더보기/리뷰에 지저분하고 불친절한데다가 맛없다그러는데.. 잘먹었습니다. 팁도 안주는데 뭐 얼마나 친절해야 합니까../대한민국 최고(오래된)의 노포식당이면 세월의 깊이가 더해져야 하는데 가면 갈수록 맛은 형편없어지고 가격은 천정부지로 올라가네요! 예전에 비해 국물맛이 너무 무맛으로 변했구요. 설농탕 안에 들어가는 고기의 질도 형편없어졌습니다./지인이 유명하다고해서 갔습니다. 누린내는 생각보다 심하지 않았고요 (군포식당이 좀 심한편)  국물이 밍밍하니 간이 전혀 안되어 나와서 좋았습니다. 그대로 설렁탕을 맛볼수 있다고 해야하나요. 고기양은 조금 더 주면 좋겠다 생각했습니다. 도나니 탕도 먹었는데 쫄깃하고 뽀애서 몸보신한 느낌이 납니다. 그냥 설렁탕의 정석 느낌? MSG에 맛들린 사람은 여기와서 맛...더보기/찜/노랑내 나는 것을 특설렁 으로 시켰으니.망함    에휴 신림동에서 찾아간 내가 ♬♪♩. 허접한 동네 싸구려 와.  거의 비슷 함   70평생  제대로 사기당했다  캭 퇘 엑 ~ ~/오래된곳이라 위생 기대안하고 포장했는데 포장용기가 치킨플러스ㅋㅋㅋㅋㅋㅋㅋㅋㅋㅋㅋ 헛웃음이 나와요ㅋ/백년된 설렁탕집. 옛풍경도 정겹고 맛도 좋아요. 세련된 인테리어는 아니지만 정겹더라고요. 추천합니다/국물이 진하네요. 설농탕의 기본을 맛볼수 있는 집… 가격은 비싼 편이지만, 설농탕은 수준 이상인거 같아서 만족합니다./오래된 집이라지만 가격이 매미없고 맛이 밍밍함/서울에서 이런 퀄리티 설농탕 감동입니다.... 연중무휴던데 직원분들 너무 고생하시는건 아닐지..ㅠ 여튼 앞으로도 많이 사먹을게요/헐 ~ 가격이 미쳤네 12.000./가격이 12000원 가성비도 없고 맛이 맹탕이네요.맛도 맛이지만 코로나랑 상관없는 식당분위기.. 빽빽한 좌석에 왜이렇게 떠들면서 식사들을 하는지 식탁위에 파담은통은 오픈되있고 백반기행 맛집에 속았네요/비추 후기를 이해 할수 없는 맛"
1,교대이층집 광화문점,서울 종로구 삼봉로 95 (우)03150,삼겹살,"꽃삼겹,국내산,16,000,통목살,국내산,16,000,항정살,국내산,27,000",16666,4.1,67,57,"밑반찬도 맛있고 알바생 분들 다 친절하세용ㅠㅠ/서비스 좋은데... 살짝 비싼 감이 있음. 그리고 볶음밥은 기대 이하/회식하기 좋아요/친절하게 구워줘서 맛있게 먹었어요/바쁘신 직원분들... 그럼에도 불구하고 친절을 잃지 않아서 놀랐습니다!! 고기도 맛있고 반찬도 맛있고 직원분들도 친절하시고... 앞으로 광화문에서 돼지고기 먹고 싶을땐 여기로 !!!/고퀄리티 삼겹살과 다양한 밑반찬이 어우러지는 조화가 아름다운 집입니다/점장인지 직원인지 불친절함. /목살 존맛 삼겹살은 대존맛/교대이층집은 언제나 옳아욬ㅋㅋ/점심 좋아요/삼겹살 맛있게 구워주시고 종업원 분들이 친절했습니다. 볶음밥은 양이 많으니 주문하실 때 주의하시면 되겠습니다!/리뷰조작 상당히 의심스러움/현재까지 봉우이층집과 삼겹살 쌍두마차./고기 직접 구워주고 다른 식당에서 해주는 서비스들 다 해줍니다. 고기 질도 무난하게 괜찮아요.  하지만 여기보다 고기 값은 싸면서 더 나은 서비스를 제공해주는 식당도 많기 때문에, 굳이?? 고기 먹으려고 여기 찾아오는 건 별로입니다. 차라리 합정에 가지..../최고예요/고기도 맛있고 반찬도 맛있고 서비스도 친절하고 여러모로 만족했어요~/꽃삼겹 예술입니다/이층집 분위기도 맛도 너무 좋아해서 자주 가는데 갈 때마다 만족스럽네요. 직원분들도 친절하고 고기 잘 구워주십니다. 어제 다녀왔는데 글 쓰다보니까 또 삼겹이랑 꽃삼겹 먹고싶네요.../직원분들이 아주 친절하게 해주시고, 가성비도 무척 좋았던 식사였습니다. 나름 만족스러웠어요./직원분들도 친절하고, 맛도 좋네요 즐거운 저녁 식사였어요:)/아주 맛있었어요!/너무 맛있게 잘 먹었습니다^^/직원분들이 정말 친절하세요~ 너무 맛있게 잘 먹었습니다^^/맛은 있지만 가격에 비하면 아쉬워요/엄청 바쁘신 와중에도 엄청 친절하셔서 맛있게 잘 먹고 갑니다~!! /비싸지만~ 맛은 있네요. /여기 한번 가본 이후로 다른 삼겹살 집을 거의 안가는듯.. 맛도 최고 서비스도 최고.  삼겹살 치곤 살짝 비싸긴 한데 맛과 서비스로 다 커버됨. 주말에 또 가야지/처음 가봤는데 너무 깨끗하고 친절하고 양도 적당 가격대비. 깔끔해서 좋았어요. 통상겹 강추! 된장국 강추! /가족회식하기 좋네요. 가성비도 좋고, 연휴 마지막날이라 손님은 많고 직원이 많이 없었는데도 친절하고 빠른 서비스에 감사했어요. 꽃삼겹이랑 볶음밥이 기억에 남아요~/편안한 분위기, 편안한 인테리어. 주말에 가도록 하자./최고예요/다음에는 가족들과 함께 갈 생각 입니다."
2,아지오,서울 종로구 인사동11길 23 (우)03145,양식,"문어샐러드,살치살스테이크,추천,24,500,새우 비스큐 크림소스 파스타,폭립 바베큐,(토마호크,티본)스테이크10g당",19060,3.2,43,184,"로제파스타랑 앤쵸비파스타 시켰어요.. 사진 저게 다먹은겁니당ㅋㅋㅋㅋ 로제..맛없기 어려운거아닌가요?ㅎㅎ 거의 무맛상태 앤쵸비는 처음 먹어봐서 원래이런맛인가 하지만..특별한 맛도안나면서 짜기만 했습니다  저녁에 갔는데 2층 남자직원분 서비스가 좀…여자분들은 친절하셨지만요ㅎㅎ 아무튼 맛이없었어요! 재방문의사0 리뷰가 도움이 되기를 ~이제 네이버 블로그 믿거 합...더보기/폭립스테이크? 강추여 파스타는 싱거웠어요 화덕피자도 진짜진짜 맛있어용/여기 화덕피자 엄청 맛있어요 직원들도 친절하고 파스타도 맛잇어요 ~~  인사동 오면 또올래여~~  근데피자를안찍엇네...  /유튜브 보고 기대하고 갔는데 좀 실망했어요. 새우가 안 익은 채로 나왔어요. 다행히 어렵지 않게 새로 받았어요. 배탈 안 나길 바랄 뿐이에요. 건물이 오래된 건지 이상한 냄새가 났고 난방이 잘 안돼서 춥게 먹었어요. 특히 화장실에 찬물만 나와서 손 시려웠어요. 겨울에는 추천하지 않아요./연말에 급하게 안국 근처에서 약속 장소를 잡다가 맛집이라고 해서 방문했는데 예약이 가능해서 다행이었네요~ 분위기도 좋고 특히 직원분들이 친절하셔서 너무 즐겁고 맛있는 식사 하다가 갑니다^^ 담에 부모님이랑 가려구요~/7:30 저녁 예약하고 갔는데, 이미 8시 음식 나오고 부터는 마감하는 분위기였음. 식기 정리하는 소리가 엄청났고 2층에서는 거의 서버가 오지 않음. 음식 맛은.....음.... 맛없... 그래도 약간 인사동 옛스러운 양식당 느낌 났고 재료가 충실하게 많이 들어있었음. 한번정도는 방문해도 되지만 자극적인 파스타 맛은 아님 살짝 밍밍/어떤 음식은 너무 짜고 어떤 음식은 너무 싱겁고 리조또는 맛없기 힘든데 리조또가 맛없었어요 위생상태도 별로고 돈 아깝다고 생각한 음식들은 정말 오랜만이네요 사람마다 입맛음 다르겠지만 같이 간 일행들 다 맛없다고 했어요.../원래 맛집인데 요즘 좀 변한 것 같아요~ 사장님이 좀 살펴 보셔야 할 듯요 2층 서빙 젊은 친구는 화가 나서 하는 듯한 인상이네요 격려의 의미 별 두개 입니다/까르보나라에서 계란거품 맛만 나요. 피자에 뿌려먹는 매운 소스는 또 셔요. 아이셔같아요..•••흑흑‼️‼️/흠... 생각보다 맛은 별로였어요 스테이크도 질겼구요ㅠㅠ/다른 소비자들의 알 권리를 위해 씁니다.  돈은 돈대로쓰고 가족들한테 이런데 데려와서 미안하다고 했네요;; 네## 평좋아서 갔다가 직전에 카카오맵 평보고 가지말까하다 그냥 들어간게 어제 최대의 실수.   #주문  살치살스테이크, 라자냐 시켰는데 둘다 안된다 하더군요. 그래서 다른메뉴 시켰더니 그것도 안된다고. 웃긴건 저녁에 간게 아니라 점심때였음. 등갈비 ...더보기/평범... /전반적으로 맛은 무난한데 직원 응대가 서투르고  불친절함. 키크고 덩치있는 직원이요/네이버 블로거지들 믿지마시길 ㅎ 부모님 모시고 갔다가 돈만날림 ㅎㅎ 세명에서 스테이크 샐러드 피자 파스타 시켯는데  크림새우파스타?  ㄴ 하얀 파스타가 아닌 로제 파스타에 크림 섞음 느낌 엄청 싱거워서 새우 내장 특유의 비릿한 맛만 강함 엄청 싱거움  프로슈토 샐러드 ㄴ 이건 엄청 짜고 나름 본연에 맛을 잘 냈음 이 샐러드만 엄청 짜서 파스타에 행궈먹음  ...더보기/굳이 ..?  약간 분위기가 신기하긴 한데 찾아가서 기다릴 만큼 대단한 건 아닌거 같아요. 약간 어르신 (?) 취향입니다. 직원 응대나 음식 나오는데 좀 걸려요/버섯 피자 최고/넓고 안락하며 고풍스러운 인테리어가 돼있어, 다양한 음식들과 함께 친구들과 편안하게 이야기하며 식사할 수 있는 곳이다/파스타에 간간히 씹히는 향이 쎈 무엇인가가 저에게는 별로였습니다... 그 맛이 입을 지배해서 다른 맛을 못 느끼게 했어요.. 고르곤졸라 피자는 맛있었습니다 다만 가게에 나무 태우는 냄새인지 향 피운 냄새처럼 견디기가 좀 힘들었습니다../직원분들도 친절하고 가게도 넓직하고 좋았으나 음식맛이...그냥 그래요ㅠㅜ 많이 아쉬운 맛.../분위기 좋구 맛도좋았어요 ㅎ /종로 인사동에 이런 맛집이 숨어있는줄 몰랐어요 전반적으로 간도 딱 맞고 피클도 수제인게 너무 맘에 들어요 특히나 가장 기억에 남는건 큰새우가 서있는 파스타를 먹었는데 다른곳에서 본적없는 이색적인 파스타를 눈으로보고 입으로 즐겨서 기분 UP! 곧 닭으로만든 삼계리조또를 하신다는데 부모님 모시고 꼭 같이 방문해보려구요~ 외식외식!! 오예~ 무엇보다도 직원분들도...더보기/가격도 적당하고 생면파스타 너무맛있었어요/보통 이런 집오면 평타는 하는데..이집은 너무 맛 이없어요. 진짜 맛이없어요..이런 종류의 음식 먹고 이렇게 맛 없던 적은  몇년만인듯....못먹겠다/오래된 좋은 식당. 분위기가 아주 좋고 맛도 평균 이상입니다./예전에는 괜찮았는데 점점 맛이 별로고 오늘은 정말 정점을 찍었죠. 다시는 안가도 될 듯합니다./짜지 않은 적정한 맛. 싱싱한 토마토 소스. 얇은 두께의 피자 과하거나 부족하지 않은 직원 응대 전체적으로 만족스러운 곳/이탈리안 레스토랑"
3,택이네조개전골 종로점,서울 종로구 삼봉로 95 대성스카이렉스 205호 (우)03150,조개,"조개칼국수,2인이상,12,000,모듬칼국수,2인이상,14,000,스페샬조개전골,4인전골 + 토핑1종,120,000",41666,0.0,0,0,
4,발우공양,서울 종로구 우정국로 56 템플스테이 통합정보센터 5층 (우)03145,한식,"원식,술적심,죽상,상미,담미,숭소,유미,입가심,65,000,모듬버섯강정,버섯전골,사찰부각",30000,3.3,18,32,"10년전에 참 맛있게 먹었던 기억이 있는데 최근에 갔을 땐 영 아니네요… 돈이 좀 아까웠음 ㅜㅜ/음식이 다소 달고 일부 음식맛은 좀 애매하지만 가격대비 무난/1. 전통사찰문화 경험 측면에서 가볼만함 2. 맛 자체는 미슐랭 1스타급 수준은 아닌듯. (미슐랭 1스타 가격도 아니긴 함) 3. 직원들은 친절하고 인테리어는 고급스럽고 깔끔함 4. 고기를 못쓴다는 점에서 핸디캡이 있겠지만서도 전통도 좋지만 보다 맛을 추구하면 좋겠습니다  /네명이가서 식사했는데 아무도 만족을 못했어요. 맛도, 음식양도 칭찬못하겠어요. 고기만 없으면 사찰음식인지? /저렴한 가격으로 미쉐린가이드를 맛볼수 있다. 채식이라 육식파는 싫어할듯/맛이 기대이하였습니다. 디저트는 좋았습니다. 미슐랭이라고 자랑하고 가족을 모시고 간 식사였는데 조금 안타깝습니다./예약하고 갔더니 휴무래요. 기가 막혔습니다. 홈페이지 문의했더니 메일로 죄송하다 한마디로 끝. /사찰요리. 어른들 모시고 고급스러운 대접하고 싶을 때 좋음./Guide Michelin ⭐️  Temple Cuisine by 김 지영 Chef/분위기 좋음 음식맛은 음~ 건강한 맛"
5,소진담 안녕인사동점,서울 종로구 인사동길 49 5층 502호 (우)03145,디저트카페,"아메리카노,카페라떼,소진담 라떼 (ICE),딸기라떼 (ICE),토피넛 라떼 (HOT),홀케이크",6600,3.5,18,139,"넓고 분위기 좋음/케익은 못 먹어봤지만 그냥 루프탑 분위기 보고 가면 될 듯/케이크도 맛나구 분위기도 좋았어요! 날이 추웠어서 야외공간으로는 못 나갔는데 날 좋을 때 다시 방문하고 싶네요ㅎㅎ/조각케익 포장박스가 작아서 크림이 다 뭉개졌어요/가격은비싸지만 비싼만큼 맛있어요!/가격에 비해 커피 맛이 별로네요./하이드아웃라떼를 시켰는데 아무리 맛을 봐도 아카시아꿀 향이 안느껴져요. 걍 바닐라라떼 같네요. /라떼는 살짝 비싼듯. 맛에 비해. 인사동에서 테라스는 여기가 젤 나은듯/케이크고 맛있고 야외테라스가 넓직하고 좋아요!!/케잌 맛있음. 근데, 아이스아메리카노인데 미지근함. 얼음이 다 녹게 줌.  이런 부분 아쉽. 음료양이 적은편. 분위기는 깔끔해서 좋음. /분위기도 좋고 위치도 좋지만 케이크가 매우 아쉽다..  다행인건 쑥라떼는 생각보다 맛있었다/남자알바 불친절해요 가격에 비해 티라미수 케이크는 너무 맛없어요 하지만 의자가 편하고 뷰가 좋아 괜찮았습니다 베리에이드인가 상큼하고 맛있어요/맛 2~3 분위기 3~3.5 가격1/비싸서 가성비는 떨어지지만 예쁘고 아주 예쁜... 카페 케익 맛있고 비주얼도 훌륭  레드벨벳: 제법 진한 치즈 누텔라딸기: 크림하고 생딸기... 예상외로 너무 맛있었음 토피넛라떼: 정체불명의 엄청난 음료. 사실 캐러멜초코인것 소진담 레몬청: 진짜 수제 레몬청인 맛. 만족 /인사동길 북쪽에 있는 안녕인사동 5층에 위치한 인사동길이 내려다보이는 전망이 있는 카페입니다 모던하고 심플한 인테리가 인상적인 카페입니다. 봄 가을에는 루프탑에서 커피를 즐길 수 있는 곳입니다./쑥케이크 맛있음 근데 건물 상층에 있어 위치가 썩 좋진 않음 여름에 루프탑에서 먹으면 좋을듯 라떼는 달지만 맛있음"
6,마라공방,서울 종로구 우정국로 38-1 2층 (우)03149,중식,"마라탕 (100g),마라샹궈 (100g),마라반 (100g),꿔바로우,지삼선",8020,2.7,21,81,
7,홍성원 본점,서울 종로구 삼봉로 95 대성스카이렉스 2층 (우)03150,중식,표기안함,표기안함,3.7,19,10,
8,의정부부대찌개&돈까스,서울 종로구 우정국로 45-7 2층 (우)03150,"찌개,전골",표기안함,표기안함,4.1,14,9,so so/20년도 더 다닌 맛집!! 부대찌개는 이집이 최고!!!/평점 좋아서 가봤는데 부대찌개 빼고 다 맛있는집 평점 왜높은지 모르겠음 /종각역 근처 부찌중에 제일 맛있는집 육수 추가할때 양념같이 안주는집 많은데 여기는 양념+야채도 추가로 주셔서 새로 일인분 시켜먹는것 같았음 맛도 최고! 센스도 최고!/어묵을 직접 하시는거 같아요. 따끈따끈하니 겁내게 맛있습니다. 진짜 뜨끄-은 한 국물 딱! 한숟갈 마시고 밥한술 크게 떠서 입에 넣으먼 이 세상 모든 행복이 다 내꺼/이가게 평점 2.5는 억울하시겠다 만들어놓지않고 매번 막볶아서 내주시는 오뎅볶음 하나만으로도 충분히 먹을만하다(정성도...) 더불어 계란후라이도 주시고...^^ 부대찌개 맛은 엄청 찾아갈만한 맛은 아니고 그래도 한끼의 식사로는 맛나게 먹을 수 있는 집 /구미에서 왔는데 니맛도 내맛도 아니네  이게 머야 참나
