,name,address,sort,menu,mean_price,score,people_give_score,review_count,review_list
0,비파티세리 공덕점,서울 마포구 마포대로14길 4 1층 (우)04211,카페,"아메리카노,라떼,초콜릿 밀크,카푸치노,아포가토,퀸아망 클래식",5966,4.1,88,325,"단층의 넓은 공간에 비파티세리, 쿠도스 커피가 공존. 빵과 커피. 둘 다 수준급. /자주 방문하는 카페/애정 카페. 그리고 빵집./기분좋은곳 널찍널찍하고 커피맛있다/추천합니다./다시 방문하고 싶은 곳/분위기 좋고 맛은 더욱 좋고/퀸아망 맛있어요. 커피는 비싼편입니다.  그리고 공간이 널찍한 편이지만 사람이 아주 매우 많아요.../직원분들도 친절하고 스콘도 겉바속촉에 맛있었어요. 자리가 없는건 아쉬웠어요 ㅠㅠ  시그니처 퀸아망?? 은 너무 딱딱한것 같아요. 입천장 까졌다며.../디저트,빵,케익, 쿠키 모두다 너무 맛있어요 커피도 가격이비싼 편이지만 너무 맛있어요/넓고 쾌적한 공간에 맛있는 빵! 그러나  지나치게 단 쿠키, 산미 강한 커피,  주변인들 말소리가 울려퍼져 소란스러움...  /공간은 좋으나 천고가 높아서인지 소리가 울려서 시끄러워요. 겨울엔 손발이 시립니다./카페분위기 4점  홍차 4점 까눌레 5점 퀸아망 3점   퀸아망 하도맛있대서 크림치즈베리랑 얼그레이 포장해봤는데 그냥그래요 그냥 페스츄리맛 /가격대는 좀 있는 편인데 디저트랑 빵이 너무 맛있어요! 특히 퀸아망이 최고입니다!/맛있어요/토마토스프 굿 /Coffee/공간 널찍하고 외국 여행 온 느낌이라 아주 마음에 드는 곳입니다. 아메리카노 원두는 약간 밍밍한 감이 있고, 드립 원두는 고르는 것에 따라 특색이 또렷해요. 드립 아주 맛있게 마셨습니다.   리뷰 찾아보고 간건 아니라 가서 그냥 고른 퀸아망 맛있다고 생각했는데 아래 후기들 보니 유명한 퀸아망 맛집이었군요… 맛있습니다 동네서 넘 맘에 드는 카페에요 /퀸아망 찐맛집 인정합니다. 추천이요./건물이 낡았지만 경사로 통해 휠체어 출입할 수 있어요. 커피랑 타르트도 맛있고 공간이 넓어서 좋네요. (소리는 울려요.) 따뜻한 음료 뚜껑도 100% 분해되는 재질입니다./커피도 맛있고 빵도 맛있고 분위기도 좋고!/분위기 시설 좋음 /편안한 분위기가 좋음/퀸아망 별 열개 주고 싶은 맛.. 버터러버에겐 환상의 맛이었습니다.. 하지만 사진에 빵 두개는 무난! 퀸아망은 꼭 드세요/자리도 넓고 좋은 카페! 디저트도 되게 많네요!/넘 좋아서 재방문인데. 좀 이상한점이.. 드립커피 시켜서 음료 기다리던중에 오픈형 주방인지라 바리스타모습이 보였는데요.   다 만든 커피를(테이크아웃컵 뚜껑닫기전) 다른 유리컵?에 담아서 마시고 또 개인적으로 드시려는듯이 따로 빼두는 모습이 포착되어서.. 너무나 당당해서 이해해보려고 노력했네요. 왜 그러신건지 너무 궁금했어요..   사무실와서 몇모금 마시니...더보기/치킨크로와상 샌드위치랑 토마토스프 환상,,, 어설픈 브런치가 아니고 찐 미국 유럽에서 먹던 재료간의 조화로운 맛,, 아묻따 퀸아망으로 디저트 입가심까지 굿,, 다만 커피도 그렇고 좀 비싸요,,,/존맛 디카페인 추가금도없고 옥수수빨대랑 옥수수컵 씀/퀸아망 난리나요 2년전에 한번 갔는데 며칠전 꿈에 나왔을 정도로 인상적이었음/- 퀸아망 존맛 - 커피는 비싼편 - 그래도 퀸아망 존맛/퀸아망 굳"
1,진미식당,서울 마포구 마포대로 186-6 (우)04207,"게,대게","게장정식,간장게장 (포장)",39500,3.6,116,139,
2,마포진짜원조최대포 본점,서울 마포구 마포대로 112-4 (우)04213,"육류,고기",표기안함,표기안함,2.4,64,91,
3,황금콩밭,서울 마포구 마포대로16길 9 (우)04205,두부전문점,"두부짜글이,돼지짜글이,시래기비지탕,두부젓국,짜박두부",16400,3.6,83,127,"맛만보고 별점 드립니다./유명해서 기대를 많이했는데 대한민국 손꼽히는 대박맛집 이런 느낌은 아니다 하지만 맛이 건강하고 든든함/이렇게 싸가지 없게 손님 대접하는 곳이 어떻게 미쉐린 가이드일까요?  평소에 두부 좋아해서 여자친구와 함께 기대를 하며 방문했습니다. 사람이 많을까봐 일부러 12시 이전에 갔습니다. 하지만 들어가니깐 QR 찍으라는 말도 없고 손님을 봐도 본체만체 하더라고요. 한 1분~2분정도 기다렸다가 아무 말도 없길래 그냥 빈자리에 앉았습니다. 당시 테이블의 반정는 비워...더보기/생두부가 정말 맛있었어요 다른 음식들은 무난하고 부담없는 맛/두부짜글이, 두부완자 주문했습니다 정말 맛있었어요 . 남자 사장님도 친절하시고 두부가 이렇게 맛있는건지 몰랐어요. 정말 부드럽고 고소하고 은은한 두부본연의 단맛이 좋았어요. 맛집이에요 재방문의사있습니다 두부짜글이는 김치찌개와 부대찌개를 섞은 칼칼하면서 조미료 들어가지 않은 약간 밍밍한 찌개였어요 두부완자는 손바닥만한 큰사이즈로 4덩이가 있었는데  바삭하고 ...더보기/두부성애자로써 인정입니다. 맛있어요!!!!!!!!!/직원들 너무 시끄러워요/두부가 맛나요 ㅎㅎ 전골도 국물이 진해서 좋았어요!! /보쌈도 맛있어요. /두부좋구요 저는 두부완자 너무 좋더라구욤 전체적으로 슴슴해서 밥없이도 먹었어요!/두부 최고/서비스 안좋구요. 맛이 없어요.. 김치도 너무 맛없고 왜 미슐랭인지 1도 모르겠어요….; 보쌈에 김치를 먹었는데 김치 리필은 되면서 포장할땐 상에 차려진 음식만 된다하네요 김치 리필하고 포장할걸그랬어요…참고하세요…/2층 마르고 나이있으신 홀직원분 진짜 불친절합니다. 1층 젊은 직원분은 친절하신데 2층갔다가 이거 싸우자는 건가 싶더라구요. 다른 테이플 응대하는거 듣는데 싸움날까 조마조마. 가격도 괜찮고 맛도 있으니 방문은 할건데 2층은 안갈거에요./맛은 좋은데 가격과 서비스는 아쉬워요./같이 가기로한 한 명이 부득이하게 밀접접촉자로 분류되어 자가격리에 들어가서 같이 못갔는데, 그 한 명 밥값까지 다 내라고 하네요. 말투도 공격적이어서 놀랐습니다. /가슴이 웅장해지는 맛/괜찮아요 맛있음/한번 더 가서 다를것도 맛보고 와야겠어요 잘먹었습니다 /최근에 이전해서 더 좋아짐.미슐랭 빕 구르망에 뽑혔던 집인 이유가 있음./내 인생 최고의 두부맛/너무 맛있어요 두부도 맛있고 무엇보다 밑반찬이 최고네요 집에서 한 맛있는 맛 ㅠㅠ 전반적으로 모든 음식이 간이 강하지 않고 담백하고 좋아요 버드나무 브루어리 맥주를 팔아서 더 좋아요 탁주도 진하고 좋네요 /두부짜글이랑 불고기 먹었는데 집밥 같이 자극적이지 않고 밑반찬까지 맛있어요. 가게도 깨끗한 거 같고 서빙하시는 분도 친절하세요. 정식이 4인부터 가능해서 좀 아쉽네요. 2인용 정식도 있으면 좋겠어요. /그냥 두부만 먹어도 맛있다/두부짜글이 맛있네요/코로나때문에, 포장 주문했는데, 밑반찬없이 주방에 준비된 두부, 두부젓국만 달랑!!!  참!!!  요즘 가져와서 데워먹어야하는 포장주문에 밑반찬없이 주는 곳은 별로입니다. 상차리는 일안하는데, 가격만큼 푸드박스 채워주시죠. /순하고 맛있습니다/두부,청국장,짜글이 시켰고 곧 밑찬이랑 밥 2개 나왔어요. 나온거 먹고 있는데 오셔서 짜글이가 다 나갔다고(11시 40분이었는데..) 50분 기다리면 해준다고 하더라구요. 평일인데 50분 기다릴 사람이 어디있나요. 그냥 청국장이랑 두부만 먹기로 했어요. 계산하는데 천원이 추가되었길래 뭐냐고 물었더니 짜글이 안먹었으니까 밥 1개 값을 추가한거라고 하네요. 제...더보기/두부짜글이 맛이 순하고 두부 고소해서 맛있는데 청국장은 좀 시큼한 느낌이예요. 반찬도 나물종류로 나와서 건강한 식사한 기분이었어요. 두부완자는.존맛탱/두부도 고소하고 전골도 맛났다!/두부김치 전골 먹었는데 전골 자체는 쏘쏘했어요 근데 두부는 진짜 보드라우니 정말 맛있었어요! 다음번엔 버섯두부전골 먹어야겟네요/무난한 백반집./두부가 진하고 맛있습니다. /그냥 무난해요/식사 주문하고 20분 동안 반찬도 안 나오고 벨 눌러도 안오시고.. 서비스는 최악이었습니다. 두부 자체는 맛이 괜찮은데, 짜글이는 밍밍한 고추장국이었어요. 절대로 시키지 마세요. 휴가 1일차인데 덕분에 기분 망쳤어요. "
4,진대감 마포점,서울 마포구 마포대로12길 54 (우)04211,"육류,고기","날치알볶음밥,한우차돌삼합,한우차돌박이,시원한 묵사발,한우꽃게된장찌개,키조개관자장비빔밥",13500,4.4,98,95,분위기 좋고 맛좋고/차돌삼합 맛있네욤 ㅎㅎ 요즘 고기가 너무 땡겨서 갔더니 친절하게 응대해주시고 고기도 질이 좋아서 맛있게 먹었습니다  입에서 사르르 녹는걸 확인했네요 ㅋㅋ /차돌삼합 밖에 보이지 않네요! 메뉴도 독특하고 정말 맛있네요! 고기도 부들부들하고 냄새도 안 나고 반찬도 맛있고 알차요~/회사 근처라 병원 쌤들이랑 자주가는 맛집이에요ㅋㅋ직원분들도 친절하시고 차돌삼합 진짜 입에서 살살 녹는 맛ㅠㅠ 가격도 한우인데 저렴해서 넘 좋아요ㅎㅎ 잘못 맞추면 웨이팅 있지만 웨이팅 할만한 곳!!!></차돌삼합 부들부들하면서 야들하니 맛있어요 볶음밥까지 K-디저트로 깔끔하니 마무리했습니다!!/마지막 날치알볶음밥까지 아주 맛나게 먹었음 ㅋㅋ 꼬들빼기랑 갓김치가 맛있어서 맛있는 삼합먹고옴 ㅋㅋ/지인추천으로 왔는데 고기양도 많은편인이고 직원분들도 친절했어요 또 올게영!/직접 다 구워주셔서 편히 먹었어요  다먹고 마지막에 날치알 볶음밥도 넘넘 맛있어요/너무 맛있어요 ㅎㅎ 차돌삼합 조합 굿이고 고기도 신선하고 기본 반찬들도 잘 나와서 좋아요 ㅎㅎ 고기도 너무 부드럽고 냄새안나구요 ㅎㅎ 술한잔 하면서 먹으니 행복해요/맛집오브 맛집이네요 ㅎㅎ웨이팅 좀 했지만 맛나게 먹었습니다 회식장소로 최고네요ㅎㅎ 볶음밥까지 해먹으니 배터지겠네요 ㅋㅋㅋ/차돌삼합이랑 차돌박이 먹었는데 진짜 부들부들 너무 맛있어요 주말 데이트 장소로 추천합니다./차돌삼합이 이렇게 맛있는 줄 몰랐어요!  분위기도 좋고 사이드 메뉴들도 성공적이었어요/진대감 차돌삼합 진심 진짜 진리..차돌삼합이 뭔가했었는데 이 극강의 조합을 어찌 생각하셨는지 신기하실따름 ㅠㅠ 왜 지금까지 이걸 몰랐는디 한스럽기까지!! 너무 맛나요!!/볶음밥이랑 차돌박이 존맛탱...  반찬도 맛있고 친절하게 구워줘서 좋았어요!! 주말에 친구랑 재방문 할게요!!!/존맛탱..안먹어본사람잇어도 한번만 먹은 사람은 없울듯ㅎㅎ꿀맛입니다/회사 근처라 소개 받고 저녁식사 하러 갔는데 삼합 맛있네요! 차돌박이도 질기지 않고 입에서 살살 녹고 전반적으로 양도 꽤 괜찮고 구성도 알차네요!! 매장도 깔끔해서 식사 대접하기 좋은 식당같아요 /첨 가본곳인데 매장 깔끔하고 고기 맛있어요!! 반찬도 맛있어서 재방문의사 있습니다!/오랜만에 친구랑 고기 맛있게 잘 먹었습니다!!/차돌박이가 입에서 살살 녹아요 삼합도 유명하던데 이름값 하더라구요 맛나요/차돌삼합이라는거 처음 먹어봤는데 엄청 중독성 있더라구요.  차돌 초밥도 먹어보고 너무 신기하면서 맛있어서 마구마구 들어갔어요. ㅋ 마지막 볶음밥 꼭 추가하세요 JMT임 /굿굿 고기질이 좋고 친절해서 서비스받는 느낌받고 너무맛있게 먹었어요 ᆢ)/너무 맛있어요~ 가격도 착하고 양도 많아서 완전 잘먹고 왔습니다.ᐟ/한우차돌삼합 먹었는데 입에서 살살 녹네요~^^ 쵝오에요/차돌삼합이 맛있는 진대감 ! 직원들도 친절하고 맛나요/이영자님 맛집으로 추천받고 왔는데 차돌삼합이 진짜 예술이네요. 직원 분도 친절하시고 마무리로 볶음밥까지 꼭 필수입니다 ㅎㅎ ! /오랜만에 가족들이랑 외식 나왔습니다! 외식 메뉴 고르는 도중 아버지께서 저번에 여기 왔었는데 만족스러웠다고 하시더라구요. 그래서 와봤는데 좋았어요ㅎ/비주얼 갑!! 보는 눈이 맛있어서 지는 느낌을 주었던 가게는 여기가 처음인거 같네요! 다음에 또 가고 싶어요/지인들이랑 오랜만에 만나서 먹으러 갔는데 너무 맛있어서 놀랬습니다! 여기만의 개성이 드러나있어서 좋았어요 ㅎㅎ 굿!!/지인소개로 갔는데 너무 맛있어요~볶음밥 꼭드세요!!/너무 맛잇게 잘 먹었어요 완전 맛잇네용 직원분들 다 친절하시고 좋아여~ 차돌 삼합 꼭 드세욧!!
5,신성각,서울 마포구 임정로 55-1 (우)04190,중화요리,"자장면,간짜장,만두,탕수육",7500,3.2,65,74,
6,이요이요스시 공덕1호점,서울 마포구 마포대로 167 공덕래미안5차아파트 상가 106호 (우)04131,"초밥,롤","스시,런치,60,000,사시미,타마고,후토마끼",32000,4.0,99,112,"오마카세 멋집 맛집/기대했던 것보다는 그냥 그저그랬어요 평일 디너로 7만원 먹었는데 배는 엄청 불렀는데 다먹고 나니 딱히 뭐가 진짜 맛있었다는 생각은 안드네요 ㅎㅎ 다음엔 다른 곳 갈래요 ㅎㅎ 한번쯤 먹어볼 만 합니다/리뷰가 너무 좋아서 먹어봤는데  생각 보다 너무 별루였어요.  구지 이집에서 스시 먹어야하나? 여기보다 잘하는집 많아요/런치 4.5만원으로 인상, 회가 너무 얇아 식감 밥과 밸런스가 안맞았다. 초창기 방문땐 정말 대존맛이었는데, 점점 명성을 잃어가는 듯하다. /엔트리급 스시야로 최고! /최고입니다 후회하지않을 맛집/가성비좋음, 예약시간정각에 입장가능하니 지금처럼 추울때는 너무 빨리가면 밖에서 덜덜떨어야함! /ㅋㅋㅋ/맛은 있는데 홀에 계시던 여자 직원분이 너무 불친절함 걍 귀찮아 보였음 말하는것도 서비스도 설명도 너무 대충하고 원래 식사시간 고려해서 서빙해야하는데 한번에 음식 여러개 내올때도 있고 그냥 안오느니만 못했음  3호점에서 첨 먹고 너무 만족해서 1호점도 와봤는데 다신 안올예정…/가격대비 진짜 좋은집. 디너 오마카세 양 많고 다양함. 너무 많아서 저녁먹고 한시간 이상 산책함. 바 테이블에 앉았는데, 음식 만드는거 보는 재미도 있고 디쉬 하나하나 친절하게 설명해주시는 쉐프님 매우 친절하셨음./안키모 굿/가성비 좋은 스시집입니다 예약금 걸어야하는 번거로움있고 부산스럽게 우르르 몰려가서 일렬로나오는것들 쭉쭉 먹고 나오는게 정신없지만 음식 퀄리티가 다커버칩니다 조금 조용히 천천히 나왔으면 좋았을텐데 옆테이블 손님은 늦는다고 불만이더군요/분위기 좋고 맛 좋고/삼일전 예약하고 오늘 점심12시 방문 카톡으로 연락오면 계좌로 완불후 예약완료라는데 카톡은 오지않고 예약취소인지 확인문자나 연락도 없이 결제 안됐다고 취소시킴 12시정각에 기대와 배고품으로 딸과 함께 갔다가 너무 황당해서 그냥 나올 수 밖에 없었슴/양은 많은데 질은 그닥.. 숙성도 되다 만듯한 느낌이고 음식에 시간이 부족한 느낌을 받았네요..:( 그리고 스시 플레이트 안닦아주셔서 좀 그랬음../먹는 내내 사람을 기분 나쁘게 쳐다보던 곳.. 옆의 지인은 몰랐겠지만 음식 확인과는 다른 눈빛 댚눈빛으로.. 그리고 대충, 빠르고 못 알아들을 메뉴 설명과 한 메뉴가 두번 나오는 실수와 하도 급하게 주느라 사시미회를 떨어트렸다가 다시 올려주신다던가.. 8시 디너에 8시5분쯤 앉았고 그 점은 미리 전화해서 양해 구했는데, 정해진 디너 시간 15분이 남았음에도...더보기/가격에 적당한 맛과 서비스 부담스러운 것을 견딜 수만 있다면 바에 앉는 걸 추천해요 정말 1시간동안 좋았습니다/유명하던데 ㅎㅎ 맛잇더라구요/2,3호점만 가다가 1호점은 처음인데 1호점도 역시 굿. 가성비 정말 좋은 오마카세에요  근데 개인적으로 분위기는 2호점이 나은듯/오마카세가 익숙하지 않은데, 기념일이라 좋은 식사를 하고 싶었어요. 이전의 다른 곳에서의 경험이 즐겁지만은 않아 이런저런 고민과 걱정을 안고 방문했습니다. 그런데 김효종 쉐프님께서 무척 친절하게 재료들을 설명해주셔서 긴장하지않고(!) 편안한 분위기에서 맛있고 즐거운 경험을 했습니다. 내어주시는 음식에 감칠맛이 잘 살아있어 입이 즐거웠어요!! 감사합니다 /<2021년 3월 주말 오후 방문> Upside: 가격대가 괜찮다...? Downside: 그저 그랬던, 어디서 먹어본듯한 코스의 향연. 카운터 제외 너무 많아 음식에 집중할 수 없음./맛잇어요짱입니다/그냥그래요.../오마카세가 처음이어서 잘모르지만 맛있었고, 전체적으로 만족하고 나왔습니다^^/최고/셰프는 친절하고 추가 피스도 먹었어요~ 가성비/음...예전이랑 다르네요. 친구 불러서 갔는데.. 무슨 공장인듯 똑같이 쭈르륵 나오고. 빨리먹으라는 식으로 닥달하더라구요. /유명하던데 ㅋㅋ 맛있네용/비교적 싼 가격에 맛있고 잘 짜여진 코스/맛있어요~ 식당 공간이 좁아서 정신 없는 것과 서비스가 아쉽습니다."
7,락희옥 마포본점,서울 마포구 백범로 170 공덕더샾 101동 1호 (우)04148,한식,"락희옥불고기,한우등심 불고기의 원조는 락희옥. 앞다릿살을 쓰는 일반 불고기와 차원이 다릅니다. 고기 본연의 맛을 위해 양념과 숙성 시간을 절제했습니다.,38,000,문어숙회,쫄깃하고 야들야들한 문어숙회를 미나리, 초장, 기름장과 곁들여 드시는 요리입니다.,38,000,추천,40,000,차돌박이구이,고급 한우만 씁니다. 질기지 않고 야들야들하게 0.2mm로 얇게 썰고, 양념에 설탕 대신 파인애플즙을 사용합니다. 새콤달콤매콤한 부추 무침과 곁들여 먹습니다.",37666,2.8,52,89,"가격 보소 ㅋㅋㅋㅋㅋㅋㅋㅋㅋㅋㅋㅋㅋㅋㅋㅋㅋㅋㅋㅋㅋㅋㅋㅋㅋㅋㅋㅋㅋㅋㅋㅋㅋㅋㅋㅋㅋㅋㅋㅋㅋㅋㅋㅋㅋㅋㅋㅋㅋㅋㅋㅋㅋㅋㅋㅋㅋㅋㅋㅋㅋ/가야는이유 : 콜키지프리 명소로 유명한 안가는이유 : 가격은 좀 아쉬운 부분  보쌈,육전,김치말이국수 : 대표메뉴인 보쌈은 냄새는 덜하고 큼직큼직하게 썰리는 편인데 큰 감흥까진 없고 비계가 부담스럽긴한, 육전은 반대로 고기가 살짝 두께가 있으니 씹는 맛 나는, 김치말이국수는 고기육수 느낌이 있고 양념맛도 좋았지만 면이 별로, 전체적으로 먹다보니 양이 적진 ...더보기/믿기지않을만큼 싱겁고 맛이 없어요 진짜 돈 개아까워요 수요미식회 돈주고 나간건가요;;/맛 괜찮아요/가격대비의 양이 작은건 맞는데 음식 괜찮은 편이고, 친절하다. 게다가 콜키지프리.  여기 와인가격도 시중 와인샵 대비 저렴한 것들도 있어서 꼭 와인 준비해오지 않아도 될듯하다. /곧 없어질 것 같은데, 한번 가보시는 것도 추천드립니다. 사장님인지 매니저님인지 굉장히 불친절하시네요./가격 대비 별로,,/가격 대비 그닥… 일반 소주는 없음/비싸긴 비싸군 ~~강남에서도 만원짜리 국수는 없는데/좋은재료. 보쌈 맛있어요/콜키지프리인 것이 가장 큰 메리트  하지만 와인이랑 페어링하기 좋은 안주는 많이 없네요ㅜㅜ/으아...음식점이 서비스업종 아닌가요 눈치보고 먹게 만드네여 짜증 팍!!!! 별하나도 아깝네여/가성비 정말 별로 그렇다고 특별히 맛있는것도 아니고 평범한 안주도 너무 비싸게 받네요/워우 ... 음식이 맛은 있는데 엄청 비싸고 주문과 서빙도 고객이 눈치를 봐야하는 분위기. 메뉴 중에 실제로 없는 것도 많고. 화장실도 열쇠 갖고 밖으로 가야 함. 장점이 거의 없음. 다시는 안 감./가성비 최악중에 최악인듯요. 바로옆인데 한번 가고는 절대 안가기로 다짐을하게 만드네요../와..../이번에 갔다가 매우 실망했습니다. 가격, 맛, 양, 서비스 모두 별로네요./맛도 별로인데 양은 쥐꼬리.. 제일 별로인것은 손님대하는 거만하고 불친절한 태도!/콜키지프리 한식/서울에서 가장 가성비 안나오는 음식점일듯 창렬지수 만점/마포술집 중 창렬의 대명사. 퀄리티가 떨어지는 건 아니지만, 그가격에 음식 쥐밥만큼 나옴. 여럿이가면 안주 앞에서 서로 눈치보게 되는 곳./김치말이국수, 된장국수 시켰는데...  후식용인줄알았어요.. 고명도 거의없고../가성비가 매~우 아쉬움  멍게비빔밥은 ok  차돌구이는 정말 고무줄같이 질긴 저질 고기를 사용  가격대에 비해 질 나쁜 고기 사용으로 실망함 /괜찮으면서 안괜찮은집. 세명이가면 메인 최소2개~3개를 시키면 좋더군요... 콜키지 프리 장점이 있지만 안주에서 장점이 무색해지는느낌이 좀 있습니다:) -호불호/이 장소로 옮기기 전에 3번정도 방문 식사메뉴만 먹어보았음 가성비는 그닥... 제일 저렴한 메뉴조차 양을 보면 그 값을 못함 맛은 그럭저럭 건강한 맛 하지만 그 돈주고 가기엔.../음식은 전반적으로 괜찮으나 가격이 의문이 듬 와인콜키지 무료는 매우 좋음/2018.03.23 마님과 /맛은 깔끔하나 가성비 떨어짐/음식이 맛보다 가격이 너무 비싸다 생각 드는게 맛이 없는거겠죠? 명성에 비해 완전 실망한 곳/이전부터 가고싶었는데 본점을 공덕으로 이전하면서 급방문! 역시 명성에 맞게 보쌈이 엄지척이었다 오겹살을 보쌈으로 만든것같은데 정말 살은 부드럽고 비계랑껍질은 쫄깃하고 너무맛있었음 ㅠㅠ!! 육전이랑 다른 식사들도 괜찮구(다만 양이 적음) 와인콜키지프리라 우리테이블을 제외한 모든 테이블이 와인을 먹고있었다 나도 다음에 와인들고 방문예정!!"
