,name,address,sort,menu,mean_price,score,people_give_score,review_count,review_list
0,꽃밥에피다,서울 종로구 인사동16길 3-6 1층 (우)03146,한식,"해질녘 텃밭상 (저녁코스),스프 또는 죽+수퍼푸드 샐러드+모듬전+겉절이+새우찜+생선요리+현미밥+된장국+송화버섯비빔+된장국-(후식) 무농약 우리밀 브라우이&유기농아이스크림 or 따뜻한 Tea,42,000,한우불고기상,수프 또는 죽 + 수퍼푸드 샐러드 + 모듬전 + 새우찜 +한우 불고기 + 생선요리 +현미밥 + 된장국 + (후식) 무농약 우리밀 브라우니 & 유기농아이스크림 or 따뜻한 Tea,15,000,15,000",45500,3.7,37,106,"미식을 원한다면 코스 추천 배부름 근데 비쌈/채식이라 코스 2개 (72000원)로는 부족해서 떡불고기 (4만원)는 추가해야 둘이서 알맞음 가격 생각 안 하면 특별한 날 특색있게 즐기기엔 괜찮음/할머님이 맘에 들어하셨어요 친절하시고 감사합니다!!/가야는이유 : 빕구르망에 오른 우리나라 식재료와 주류라인업을 갖춘 안가는이유 : 한끼로 하기엔 가격대비 아쉬운, 매장이 좀 더 정돈됐으면  보자기비빔밥,맥적제육비빔밥 : 코스와 일품요리가 있지만 낮에는 식사메뉴도 주문 가능, 보자기비빔밥은 비트와 나물 등 몇가지 독특한 맛을 내는 재료가 있어 평범하지 않았던, 맥적제육은 재료별로 먹을때보다 한 입에 같이 먹...더보기/잘 먹었습니다. /건강한 맛! /항상 좋은 음식과 분위기에 만족스런 시간 보내고 옵니다~ 감사해요~/외구인 칭구와 여러가지를 시켰는대요 일단 유기농이라는 메리트외엔 가격이나 맛이 터무니없이 비쌉니다 비쥬얼위주의 음식이긴 했으나 나물밥은 돌가루같은게 있어서 뱉었구요 유기농이란 컨셉외엔 가격대비 너무 아쉬웠어요 직원도 일본인 같은데 응대가 아쉬웠어요 외국인 모시고갈곳은아닙니다  갈곳없는 비건하시는분은 괜찮을거같어요/훌륭한 점심 식사였습니다. 식전 죽?으로 나온 비트는 건강한 맛이였는데 올려져있는 볶은 메밀과 같이 먹으면 엄청 고소합니다. 매력적이였어요. 모든 음식이 나올때마다 친절하고 자세히 설명해 주셨고 맛도 아주 좋았습니다. 또 가고 싶어요. 매장은 조금 좁긴 하지만 경사로로 되어 있어서 휠체어도 충분히 갈 수 있습니다./가벼운 초록 꽃밥 코스로주문했습니다. 분위기 좋습니다.예쁘게 잘꾸며져있어요 처음에나온 호박죽과 샐러드. 호박죽은 그냥 호박맛이 낫고, 샐러드는 싱싱한채소와 새콤달콤한 드레싱소스, 오독오독한 보리가 조화로워 맛있었습니다.  그다음에 꽃빵이 나왔어요 한식을 주로 하는걸로알고있는데 중식인 꽃빵이 나와서 의아했어요 맛은 있었습니다 고기는 없지만 버섯의 산미덕에 고...더보기/가성비가 너무 떨어짐. /최고의 한끼 식사.. 재료 따지는 저한테는 정말 최고 최고 최고입니다!!/야채를 싫어하는 제가 먹었습니다.  여자친구 손길에 이끌려 세트로 + 흑산도 우럭 을 추가로 먹었는데 전혀 아깝지 않았습니다/건강한 유기농 밥상/친절,주차불가 /외국인 눈탱이 치는 집이지 한국인이 여길 왜 갈까하는 생각이 듬/진짜 내가 다녀본 음식점 중에서 최악이었음  1인 4만 2천원이란 돈을 주고 먹기에는 정말 돈 아까워 죽는 줄 알았음.  입안에서 겉도는 밥이며 냄새 안 좋은 된장국 냄새는 기분 나쁜 마음의 마지막 정점을 찍게 해주었음.  손님이 많으니 메뉴판에 있던 후식도 없다하고 내쫓 듯이 손님을 보내는 ....서비스는 더 엉망  다시는 가고 싶지  아니  다시는 못 ...더보기/양적고 부실/왜 평점이 높은지 모르겠다 외국인 친구 데려갔는데 너무 맛이 없어서 미안했다 말만 자꾸 유기농강조하고 전체적으로 맛이 없고 사찰음식같았다/믿을 수 있는 친환경 식재료를 사용해서 식사비가 아깝지 않았습니다.  환상적인 맛입니다./친절하고 서비스 최고에요. 제육덮밥이 상큼한건 처음이네요. 디저트로 브라우니 앤드 초코아이스크림 맛있었어요. 다음에 또 가고싶어요/친절하고 맛있어요 일요일도 영업해요/가격대비 별로에요 :( 비빔밥은 재료가 너무 적어 고추장 맛에 먹어야하구 계란을 지단처럼 만들어서 밥을 감쌌는데 모양을 내는거라 그런지 부드럽지 않아요. 풍성한 비빔밥의 맛을 느낄 수 없었어요. :( /お洒落な韓定食が楽しめるお店です。/Korean"
1,도마 인사점,서울 종로구 인사동8길 6-1 (우)03148,한식,"갈비솥밥 (단품),갈비본살 (150g),돼지목살 (200g),닭다리살 150g",14250,4.0,127,68,"진또배기 맛집, 이베리코 목살이 환상적/조오오오오온맛 넘 마싯어여/웨이팅 있음 오픈시간 맞춰갔는데 내 앞에 10팀정도 있었음 근데 기다릴만 함 존맛임/제발 다시 예약 만들어주세요 고기랑 된장 찌개는  국가에서 보존시켜야함/돈 아까워 그냥 .동대문.종로 생선거리가  싸고 푸짐합니다 /내가 여길 잊고있었네 바보같다 한때 정말정말 자주 갔던 집 제육에 된장찌개 조합은 미친거같다/인사동에 약속 만들어서라도 가는 집! 너무너무 맛있어요ㅠㅠㅜㅜㅜㅜㅜ/맛있어요 이베리코 정식, 막걸리, 가지솥밥 마약 된장찌개도 맛있는데 저는 맵찔이라 고추가 너무 많아 다 건져내고 먹었네요 다 건져내고 먹으니 맵진 않았어요 재방문의사 충만합니다/소문대로 된장찌개가 넘 맛나여~/안국역 맛집 인정! 웨이팅 할 수도 있는고! 가성비는 아쉽지만, 맛집 인정!/솔직히 진짜 진짜 비싼데 맛있음 돼지목살도 맛있고 삼계영양솥밥도 맛있고 된찌도 맛있음/맛있는데 2만원이라는 가격은 너무 사악하다/된찌 맛집 고기도 맛있음 개인적으로 이베리코보다 삼계가 더 맛있음/완전 단골인데..최근 돼지고기 바꾸셨나요? 비리고 딱딱하고 육즙없어요 초심잃지마세요 ㅠ/가야는이유 : 마약된장찌개와 유즈라멘으로 유명한 도마의 인사동점 안가는이유 : 솥밥자체는 평이  목살구이,곤드레 : 솥밥을 하는 곳이 급격히 늘어나고 있지만 밥 자체는 맛이 있어도 솥밥의 매력은 좀 덜한 기분, 고기집이기도해서 목살구이를 기대했는데 불맛을 낸 것 외에는 딱히, 초장맛이 나는듯한 김치도 특이  토요일 1시경 15분 정도 대기했는데 메뉴나오는데...더보기/The price of the food is very expensive but not delicious.  Just come only once and don't come back for the second time./갈비솥밥 정식  맛있게  잘  먹었습니다.   가격이  좀  쎈 편인듯..   오픈시간  11시인줄 알고  갔는데  11시반이네요../수정) 마약 맞습니다 자꾸 생각나요  점심시간 방문 하였고 11시 40분 전에 일행이 자리를 잡아 웨이팅 없었습니다. 식사는 약 15-20분 소요되는 정도로 준비시간이 좀 긴편입니다.  확실히 맛은 있습니다. 1000원 더 내고 먹는 솥밥, 마약 된장찌개 맛이 아주 좋습니다. 다만 마약 된장찌개라고 해서 특별한 느낌은 아니고 (당연히 조미료 맛이 안나는 것...더보기/맛있긴 한데 너무 정신없는 분위기, 가격도 2만원이어서 좀 세긴 함/너무 맛있는 된장찌개 ㅠ 오래오래 잘되는 이유가 있음/진짜 맛집이네요 직원분이 추천해주신 곤드레밥이 의외로 제일 맛있었어요! 친절하고 밥도 맛있고 간만에 돈값하는 음식점 발견입니다/웨이팅과 가격대가 좀 있는 편이지만 갈비솥밥과 찌개 모두 정갈하고 맛깔나요 건강하고 든든한 정식/5시까지 브레이크타임이라 4시 40분까지 갔더니 5시 오픈 때 바로 들어갈 수 있었어요. 맛은 있는데 갈비랑 밥 양이 너무 적어서 아쉬웠어요/근 몇년간 외식한 식당중에 제일 맛있어요 밥은 쫀득쫀득 너무 맛있고 된장찌개 묵직하면서도 프레시한 느낌! 고등어랑 허브솔트 와사비에 찍어먹는 목살도 넘 맛있어요 너무 맛있어서 먹다말고 리뷰 남깁니다 인사동 오면 꼭 들러야 할 맛집입니다/음식 맛있어요!! 컵들 엄청 흘렸는데 직원분들도 엄청 친절해용/고기랑 된장 모두 환장하면서 먹었습니다. 자취를 오래해서 집밥이 그리운 날이 많은데, 이 날 식사를 통해서 만족했습니다. 원래는 술도 마시면 안되는 날이였는데 각 1병씩 마셨네요. 저녁에 반주하기도 좋은 식당이라 생각합니다./마약된장이라니... 얼마나 맛없는 름식들을 먹고 다녔길래 이런 돤장에...마약돤장이라니... 식당은 돗데기시장/대기하는데 지들 빨리 주문시키게 자리고 없는데  구석에  앉혀놓고 도망가지말게 주문받네요 좀 그렇네요 /인사동스러운 집. 데이트코스/점심식사 했는데, 맛있게 잘 먹었어요. 전체적으로 잘 신경 쓴 음식들이란 인상이 강했습니다. 근데 마약된장찌개가 딱히 마약은 아닌 듯/솥밥정식에 함께 나오는 찌개가 존맛. 솥밥은 평범./주방장이 바꼈는지, 마약된장찌개 맛이 변해도 너무 많이 변한 듯 하네요... 몇 해 전 왔을 때에는, 매콤하고 구수한 된장맛과 향긋한 달래향에 진짜 마약을 넣었나 싶을 정도로 환상적이었는데... 오늘은 왠 육계장 맛 국이었다 -_-; "
2,소진담 안녕인사동점,서울 종로구 인사동길 49 5층 502호 (우)03145,디저트카페,"아메리카노,카페라떼,소진담 라떼 (ICE),딸기라떼 (ICE),토피넛 라떼 (HOT),홀케이크",6600,3.6,19,140,"수제 케이크 맛있지만 가격이 사악! 커피도 맛있고 인테리어 너무 예쁘네요. 야외 테라스석이 아주 좋았습니다 ^^/넓고 분위기 좋음/케익은 못 먹어봤지만 그냥 루프탑 분위기 보고 가면 될 듯/케이크도 맛나구 분위기도 좋았어요! 날이 추웠어서 야외공간으로는 못 나갔는데 날 좋을 때 다시 방문하고 싶네요ㅎㅎ/조각케익 포장박스가 작아서 크림이 다 뭉개졌어요/가격은비싸지만 비싼만큼 맛있어요!/가격에 비해 커피 맛이 별로네요./하이드아웃라떼를 시켰는데 아무리 맛을 봐도 아카시아꿀 향이 안느껴져요. 걍 바닐라라떼 같네요. /라떼는 살짝 비싼듯. 맛에 비해. 인사동에서 테라스는 여기가 젤 나은듯/케이크고 맛있고 야외테라스가 넓직하고 좋아요!!/케잌 맛있음. 근데, 아이스아메리카노인데 미지근함. 얼음이 다 녹게 줌.  이런 부분 아쉽. 음료양이 적은편. 분위기는 깔끔해서 좋음. /분위기도 좋고 위치도 좋지만 케이크가 매우 아쉽다..  다행인건 쑥라떼는 생각보다 맛있었다/남자알바 불친절해요 가격에 비해 티라미수 케이크는 너무 맛없어요 하지만 의자가 편하고 뷰가 좋아 괜찮았습니다 베리에이드인가 상큼하고 맛있어요/맛 2~3 분위기 3~3.5 가격1/비싸서 가성비는 떨어지지만 예쁘고 아주 예쁜... 카페 케익 맛있고 비주얼도 훌륭  레드벨벳: 제법 진한 치즈 누텔라딸기: 크림하고 생딸기... 예상외로 너무 맛있었음 토피넛라떼: 정체불명의 엄청난 음료. 사실 캐러멜초코인것 소진담 레몬청: 진짜 수제 레몬청인 맛. 만족 /인사동길 북쪽에 있는 안녕인사동 5층에 위치한 인사동길이 내려다보이는 전망이 있는 카페입니다 모던하고 심플한 인테리가 인상적인 카페입니다. 봄 가을에는 루프탑에서 커피를 즐길 수 있는 곳입니다./쑥케이크 맛있음 근데 건물 상층에 있어 위치가 썩 좋진 않음 여름에 루프탑에서 먹으면 좋을듯 라떼는 달지만 맛있음"
3,경복궁 관훈점,서울 종로구 인사동5길 38 센터마크호텔 지하 1층 (우)03149,경복궁,"소갈비살 물냉면,평일점심가능,18,000,한우불고기 점심한상(1인분),점심특선 평일점심 주문가능, 2인 이상 주문 가능합니다.,43,000,생갈비 정식(1인분),점심특선 평일점심 주문가능, 2인 이상 주문 가능합니다.",30333,3.3,13,31,"다 좋은데 .. 주차가 불편해용 ㅜ/고기는 싱겁고 반찬 및 국찌개는 짜더군요 서비스는 좋았습니다/종로구청 사거리에서 인사동 들어가는 길의 센터마크 호텔건물 지하에 위치한 한정식집입니다. 점신특선 메뉴가 있어서 손님과 함께할 경우는 추천할만 합니다. 숯불갈비살 한정식을 주문했는데 고기는 미국산이지만 깔끔하고 음식 맛도 아주 좋습니다. 코로나로 인해 큰 룸도 4명이서 사용 가능해서 좋았습니다./옆에 삿뽀로가 나음 누구 내돈주곤 안사먹을듯/식당 분위기 자체가 별로... 룸이라곤 하지만 근처 방 소리 차단 전혀 안돼서 회식하는 사람들 소리에 밖에서 그릇 정리하고 뭐 부르고 하는 정신없는 소리 그냥 다들려서 안에 있는 사람도 정신 없어요. 직원 분들도 너무 바쁘게 일해요. 고기 양도 가격대에 비해 적고 정식은 미리 예약해야 한다는데 그런 것도 사전 안내 없어서 결국 다른거 먹었네요..  이 돈 ...더보기/주메뉴인 고기에 기름이 너무 많고 가격대비 별로예요./여러지점 경복궁에 가봤지만 음식 역시 맛있고 서빙해주시는분들 친절하고 좋았지만 오히려 점장이신분이 별로 였어요. 큰 문제는 없었지만 ..전화했을때도 느꼈는데  말씀하실때도 저희말을 뭔가 말을 딱딱 끊으시고..경복궁에 퀄리티가 있는데 정말 맞지 않는 느낌이에요. 그냥 동네 음식점 사장님같은느낌이랄까 표정 어투 화법 전부..... /3시 예약 가족 모임으로 갔습니다. 식사 끝나고 이야기 하는 중 4시 5분쯤 들어오시더니 5시에 예약있다고 하시더라구요. 15분에 다시 들어오시더니 나가라고ㅋㅋㅋㅋ 그럼 미리 5시에 예약이 있다고 알려주시던지, 적어도 식사 한 시간 만에 나가라고 하는 경우는 좀 아닌 것 같은데요. 가실 분들은 참고하세요~ㅋㅋ"
4,개성만두 궁,서울 종로구 인사동10길 11-3 (우)03146,한식,"서리태콩국수,계절메뉴,17,000,15,000,11,000,11,000,11,000",11000,3.0,64,125,"평소에 밍밍하게 먹는 편인데도 전골의 깊은 맛 없이 엄청 밍밍해요. 걷다가 발도 아프고 미슐랭? 그거 보고 왔는데 왜 3만원이나 주고 먹었는지 모르겠네요. 만두는 큼직하니 나쁘지 않아요./슴슴한 간이 마음에 든다. 채식 버섯만두가 맛있다. 근데 이것만 만두피가 메밀이어서 전골을 버섯만두로 변경하는 건 안 된다고 한다. 이집에서 채식인이 먹을 수 있는 건 오직 버섯만두 단품뿐이다. 그리고 파전은 시키지 마세요./미슐랭 달기 전 예전에 갔을때 맛있었던 기억이 있는데..그때도 비싸긴했어요. 인사동이니까 맛있으니까 그려려니했는데.. 미쉐린 달고 가격이 더 비싸지고 국물도 짜고..밥 말아먹을 국물이 아니예요. 만두도 작아졌구요. 만두 자체 맛은 나쁘진 않은데 평범해요. 요즘 맛집 많아서 이 가격에 먹을 정도는 아닌것 같아요. 분위기도 올드하고....느낌있게 올드한게 하니...더보기/김치만두 개인적으로 불호인데 이집 김치만두는 좋아함 전반적으로 맛있음/맛 디지게 없다 bad. no good. shit/국물, 김치, 떡이 정말 내취향 만두는 삼삼한 편인데 김치만두가 특히 맛있음 나이 제대로 먹고옴/줄서서 먹을 곳은 전혀 아니네요 평범한 동네 만두국집 수준인데 가격은 왜 이리 비싼지....^^;;;;/뭔가 맛집같이 생겼으나..만두에 고기대신 두부만 채워서 개성만두ㅡ>두부만두를 11,000원에 먹는 행운을.. 뒤에 외국인에게 한마디 해주고 싶네요.""이맛없는 만두는 한쿡만두 아니예요.""집에 돌아가 한국만두는 원래 맛이 없나봐 할까봐 걱정까지ㅜ/만두전골. 정말 맛없는 깍두기.김치뿐.  근데 이게 왜 17000원? 7000원 짜리다. 이런가계가 영업한다는건 웃기는거다 주인아 진짜 개성만두집  가서 전골 먹어봐요  어떻게 나오는지. 꼭  배워요  /미쉐린가이드 2021로 맛집 찾아보던 중 두둥!  '개성만두 궁'발견! 여기가 아직까지 영업하다니, 아니 심지어 맛집으로 소개가 되었다니! 잊고있었던 옛 기억이 올라와 몇 자 안적을 수 없네요.  예전맛이 아니다, 점점 변해가는것 같다, 돈내고 먹으면서도 맘상한다 하면서도 온가족이 10년 이상, 포장포함 월 1번이상은 찾았던 곳이었어요.  그 일이 있기 전...더보기/만둣국 맛은 그냥 보통인데 좀 비싸네요. /직원분들 친절하시고.. 만두국 맛은 보통입니다./가격대가 다소 있으나 맛은 있어요. 남녀노소 단골이 많이 와서 드시는 집 같았어요. 전골보다는 국으로 드시는게 조금 더 가성비가 좋은것같아요./전 그냥 보통. 맛도 친절도 분위기도. /주문을 받는데 만두전골 육수가 두 종류 라는 기본적인 내용도 알려주지 않습니다. 절대 바꿔주지 않고 다음에 와서 먹으라는 말 듣습니다. 전 다시 가지 않을테지만 혹시라도 가실 분들은 숙지하세요~ /맛도 없고 가격은 터무니없이 비쌉니다 근래들어 가장 불쾌했습니다/깔끔하고 음식이 고루 맛있었지만 비싸다고 느껴지는 집. /예전에는 맛집.  지금은 글쎄. 많이 아쉽네요.   바이 바이/중용의 도를 아는 간과 감칠맛,  조금심심하다면 김치만두를 조금 풀어 먹는걸 추천/처음 방문해서 조랭이떡만두국, 모둠만두찜을 먹어봤는데 개인적으로는 괜찮았습니다. 강렬하지 않고 담백한 느낌이네요. 강한 양념을 좋아하시는 분은 좀 호불호 갈릴 수는 있을거 같긴 합니다./짜지도 않고 마일드한 맛이 일품/예전 맛 기대하며 몇 년 만에 주문 했는데... 중국인 입맛에 맞춘 건지, 주인이 중국인으로 바뀐 건 지... 이건 내 맛도, 네 맛도 아닌 이상한 식품이 돼 버렸다. 만두 자체가 일부러 넣은 기름으로 느끼하기 짝이 없어 어느 국물에도 혼자 튀는...딱한 맛이 됐더라. 동치미는 원래 설탕물에 무 말아 먹는 거라고 생각 하는 입맛이라면 원츄./몇년전과 맛 확달라지고 떨어진맛. 가격도 너무 비쌈. 진짜 실망이었음.  다신안갈거임....ㅠ /줄서서 먹을맛 절대 아님/사줘서 갔는데, 내 돈내고 먹으러 갈 생각이 안나는 맛./너무 싱거운 간에 1인1메뉴... 더 할말은 없습니다:-(/정말 시원한 맛의 김치만두전골, 만두도 국물도 모두 마음에 듬./1인 1메뉴 필수. 만두 한판 1만1천원. 포장은 좀 저렴한 7~9천원임. 식사 후 갤러리를 다니며 구경하다 어르신들이 출출하다 하셔서 만두한판 가볍게 먹을까 했다. 그런데 실내에 들어가니 붙어있는 안내문.  1인 1메뉴... 좀 불쾌했다. 손님에게 협박하는건지.... 만두도 포장과 홀에서 먹는 가격이 차이나지만...홀 가격이 더 비싸면 차이가 있어야 할텐...더보기/맛있어요/거의 마감 시간에 갔는데 수저를 찾던 저를 보고 미안하다고 살갑게 말하며 챙겨주시던 아주머니가 생각나요. 맛은 쏘쏘 했습니다! 집 근처에 1인분 7천원 하는 손만두 전골집이랑 크게 차이가 없어서 가격적인 메리트가 너무 없는 것 같아요.../갈때마다조금담아주는담백한맛의배추김치에반한다두번시켜먹고싶지만,김치만두전골맛에빠져버린다/비싼 감이 있지만 맛있음/조랭이 떡만두국 좋아요."
