,name,address,sort,menu,mean_price,score,people_give_score,review_count,review_list
0,도꼭지,서울 마포구 백범로10길 30 1층 (우)04110,한식,"고등어구이+계절솥밥,대삼치구이+계절솥밥,제주은갈치구이+계절솥밥,제육볶음+계절솥밥,옥돔구이 한상 (2인),도미솥밥",28800,3.5,66,221,"솥밥 가게 중에서도 가격대가 좀 나가긴하지만 가치가 있는 가격이라는 생각이 듭니다. /간단히 먹기 좋습니다   ~""단점""반찬이 너무 양이 적어요   반찬좀 하세요  반찬이 너무 안나와요   동대문 ""생선 백반가계"" 비해 비추함/깔끔하고 좋은 맛. 군더더기 없는 서비스. /평범하지 않은 솥밥집  가성비 경의선길 레스토랑으로 손색이 없네요  붐비는 식사시간 비껴가시는 걸 추천 /맛있는데 넘 비싸요/예상했던 것보다 깔끔한 맛이었습니다. 간혹 리뷰에 알바생의 서비스가 불친절하다는 걸 많이 읽었습니다만, 그러면 그 서비스를 기대하는 만큼 알바생에게 서비스에 대한 팁을 주신 적 있으신가요? 백화점 판매원 같은 서비스를 기대하시는 분께 묻고 싶습니다. 맛을 보려고 방문하십니까? 대접을 받으려고 방문하십니까? 저는 알바생들이 자신의 일에 충실한 모습을 보았고 ...더보기/고등어구이에 돌솥 2만원에 먹었는데 고등어 반만 나옵니다. 솥밥은 슴슴하고 맛있었는데 생선 양이 좀 아쉽고 남자 종업원이 기분 나쁜 일이 있었는지 존댓말 계속 사용하면서 짜증 엄청 섞인 말투로 계속 응대했습니다. 그 종업원 다시 마주치지 않는 다면 재방문 의사는 있습니다. /음식 맛있고 친절하네요~~^^/맛있어요 큰기대안했는데 괜찮았네요/가격대비 부실하고 맛은 그냥 심심/건강한 맛/가격이 50프로 이상 오른 듯 ... 넘 비쌈/지인들 데려갈 때마다 좋은 평 들음 값은 좀 있지만 특히 어른들 모시고 가면 좋은 곳 이것저것 먹어봤지만 도미솥밥이 최고에요/그냥  보기에  좋은  밥집입니다 깔끔하긴한데  뭔가  부족한맛 고등어구이는  기름기에  느끼하고 제육은  걍  소소 한번가고  끝인  밥집 기다려서  먹을집은  아닌걸로 가격도 음식에비해  비싸요/제주갈치보단 고등어가 더 맛있었어요. 직원분들 모두 친절하세요. 분위기가 좋고 깔끔해서 좋아요/맛이 없는 것은 아니나  푸짐함 없이 정갈함 하나 만으로  이 가격을 지불하자니 조금 머뭇거리게 되는 것이었다/적당히 맛있는 정식을 먹을 수 있는 곳이지만 음식에 비해 가격은 많이 높습니다. 솥밥의 장점도 그리 잘 살리지는 못 함./슴슴허니 건강한맛! 좋은 재료 쓰는게 느껴짐 다만 가격대비 양이 좀ㅎ/맛있음 간이안세서좋음 제육은쏘쏘 도미가적어서아쉽지만 참돔 굳/분위기가 7할 맛은 평범!/손님 모시고 가기 딱 적당함. 웨이팅 필수인것이 가장 아쉬움./백반집 가면 밥 반공기만 먹는데 도꼭지 밥은 한그릇 다 먹고 누룽지까지 먹을정도로 양이 좀 적은편이라 아쉬움 하지만 밥은 진짜 맛있음/런치 디너 가격이 같아졌나봐요. 올라온 사진의 저녁 가격보다 올랐어요. 밑반찬이 괜찮은 것도 아니고 밥 먹을 반찬이 없어요. 생선도 너~~ 무 작아 뭘로 밥을 먹어야할지... 왜 맛집인지 의구심만!! 가격대비 정말 별로입니다. 왠만하면 나쁜평 쓰지 않는데 진짜 심합니다./가야는이유 : 손님 대접하기 좋은 구성 안가는이유 : 대기 있을 수 있고 아주 조용하진 않고  솥밥에 재료들이 매우 다양하고 반찬 가지수도 많은, 찬은 간이 좀 있는 편, 제육보다는 생선이 더 나은듯  옆 돈카츠윤석도 유명하여 대기가 많은, 돈카츠윤석은 태이블링으로 도꼭지는 리스트에 써서 대기/가격에 비해 아쉬워요 밑반찬 초라..../한식땡겨서 갔는데 생각보다 너무 맛있어서 좋았음/여기완전좋아용 ㅋㅋㅋㅋ 대접받는 기분!/음식이 정갈한게 좋아요/한번쯤 줄서서 먹을만 해요! 사진은 도미솥밥/깔끔하고 맛있었는데 추운날 웨이팅은 너무 힘들었던 기억쿠,,, /솥밥 먹으러 갑니다 맛있어요"
1,돈카츠윤석,서울 마포구 백범로10길 30 1층 (우)04110,일식,"등심,특등심,안심,모듬,새우후라이정식,추가 새우후라이",15083,3.8,80,213,"기대가 컸는지 실망도 컸다. 가격에 비해 특별한 맛을 못 느꼈다. 칸막이도 없이 다닥다닥 붙어 있는 자리가 먹는 내내 불편했다./모둠카츠(20,000) + 새우튀김 1개(3,500) 추가  맛에 비해 가격이 좀 비싼 느낌?  안심은 맛있었는데 등심은 좀 별로였음 매장도 좁고 겉옷 놔둘곳도 없고 친절한 느낌도 없음...  옆에 도꼭지는 웨이팅 있던데 여기는 없는 이유를 알겠더라  가까워서 갔지만 굳이 멀리서 찾아올 필요는 없음 다시 갈지는 음... /정말 맛있긴 한데 너무 불친절해요.. 친절까진 바라지도 않으니 불친절하지만 않으면 안될까요 ㅠㅠ/맛은 있는데 홀 직원분이 너무 불친절해요. 젓가락 떨어진거 다 보고 눈도 마주쳤는데 무시하시고 대답도 안하시고,, 불쾌했어요./가격이 쎄긴한데 국/깨끗해요 고기가  두툼하고  기름기를  잘뺐어요 새우튀김이  맛나요/친절과 맛 모두 최상위급이네요 굿~~/최고에요!  맜있어요! 짱!   /웨이팅이 길지만, 맛과 서비스는 확실하게 S급/오늘도 돈가스다./또 올게요./찾았다 내 인생돈까스/맛은 있지만 넘 비쌈 갠적으로는 새우튀김이 ♩♬♪♪임/과거에 비해 너무 퀄리티가 떨어진 것 같습니다... 튀김의 바삭함이나 고기의 촉촉함 등이 많이 부족해졌습니다. 정말 좋아하던 가게였는데 오랜만에 방문했다 크게 실망했네요./프리미엄 돈카츠의 1세대이지만 아직도 꾸준히 많은 사람들이 찾는 곳. 다른 곳에 비해 고기 밑간이 센 것이 특징임. /1시30반이나걸려서먹어야할 맛집은 아닙니다. /돈까스는 돋카츠윤석/도꼭지 웨이팅 심해서 먹어본 돈가스집 안심으로 먹었는데 촉촉하니 맛있었음 등심보다 안심이 더 맛있던거같음 그리고 조금 느끼해서 아쉬움/맛있어요/나쁘진 않은데 그렇다고 또 와서 먹고 싶을 정도는 아님. 일단 딱딱하게까지 느껴지던 튀김옷과 조각마다 다른 익힘 정도는 아주 마이너스임. 그리고 옆에 와서 설명해줄 거면 마스크 제대로 된 거 껴주세요. 허접한 젤리 마스크 끼고 그 좁은 데에서 말을 하시면 난감함. 손님은 숨 안 막혀서 제대로 된 마스크 쓰는 거 아닙니다./돈가스에 대한 제 인식이 바뀔정도로 맛있습니다 스테이크를 먹는 기분이 들정도로 평소 귀한 사람들에게 대접하고 싶은 곳입니다 /조금 아쉽습니다. 너무 느끼함/음.. 항상 웨이팅이 필수인곳... 공간도 너무 작고 엄청 맛있는지도 잘 모르겠음 맛있는 카츠집이 요즘 참 많아서.. 굳이 여기를 안가도되지 않나 라는 생각..  하지만 한번쯤은 추천/소금이랑 트러플 오일과 돈까스의 조화가 좋았어요 특히 트러플 오일! 무난한 돈까스 맛집입니다. 한번쯤 오기 좋은곳 :)/등안심 모두 퍽퍽살에, 튀김은 바삭하기 보다 딱딱 까칠한 느낌에 맛 별로였습니다. 사진 비주얼은 잘 나옵니다./주변에 다른 돈카츠 맛집 보다 육질은 확실히 여기가 두툼하고 맛은 있네요 홀서빙 보시는 직원분 친절하시고 느끼함 없는 고급스런 돈카츠의 맛을 느끼고 왔네요/돈까스 최고. 처음에 들어갈때 홀에 사람 없어도 테이블링으로 대기 걸어놔야됩니다./추운데 50분을 기다렸고 가게 안에 들어가서도 음식이 나오기까지 25분 정도는 기다린거같아요. 대기하는 손님들에 대한 응대도 너무 답답했고 이렇게 늦게줄꺼면서 왜 굳이 주문은 처음부터 받아야하는건지 이해도 안갔고 음식이 나온게 기뻐서 사진도 찍고싶은데 왜 사진도 찍지말고 빨리 먹으라는건지 화도 났지만, 한입 물고는 너무 맛있어서 더 화가 났어영!!!! 너무...더보기/겉바속촉의 정석 깔끔한 식당 분위기/전반적인 메뉴의 맛도 좋은 편이고 서비스도 나쁘지 않은데 다찌 구석에 튀김옷 부스러기나 소스가 튄 곳들이 은근히 있네요 좀더 꼼꼼한 청소가 필요할듯 합니다/안심 추천합니다!/여태까지 먹어본 돈까스가 2D영화였다면  윤석스는 4DX였다/가격에 비해 손님에 대한 배려가 부족. 서비스도 오마카세. 기본 고급 초이스가 있는데 안심고급은 만족하나, 등심은 기본으로도 충분할듯/위치가 아주 좋은곳 예약해두고 경의선 숲길 따라서 산책하다가 가서 먹기 딱 좋다! 정돈정도 퀄리티의 돈까스가 암염, 트러플오일, 유자드레싱같은 특이한 소스들과 함께 나온다 가까우면 자주 올 것 같은데 위치가 섭섭하네.. 흑흑 새우 추가는 꼭하세요 존맛..!"
2,양송이식당,서울 마포구 토정로17안길 9 (우)04088,퓨전한식,"돈까스 카레,왕새우 카레,치킨 가라아게 카레,수제 함박스테이크 카레,반숙 데미그라스",9200,3.9,21,65,"최고에요! 가성비 좋고 맛있어요! 스파게티, 오므라이스, 새우튀김,등등이 맛있어요! /맛: 맛있다 음 하지만 요즘 저런 반숙오므라이스가 워낙 많아서… 말도안하고 그대로 잘라버리시는건 인스타갬성에 맞지않는듯 (사진/동영상 찍으시는분들이 많기때문에) 함박: 맛있다 크다 근데 양파만 너무 든 느낌이라 해야하나 쨋든 고기도 맛있었다 근데 가니쉬가 좀 부족하지않나.. 밥은 말라비틀어져서 돌맹이같았음 ㅠ  오무라이스안에 볶음밥: 베이컨도 많이들었는데 ...더보기/맛있어요.  가게도 아기자기 귀여워요. /함박스테이크가 정말 맛있었고 오무라이스가 맛있습니다 협소한 공간 탓에 약간 불편할 수 있으니 어 손님들의 작은 배려가 필요합니다/옛날엔 맛있었음 (방송 전)/일단은 가게가 좀 작아서... 기다려야하는 점이 있어여... 뭐 그래도 음식은 맛있지만...직원이 2명 밖에 안되서 음식이 늦게 나오는게 문제네요.. 그것 말구는 거의 괜찮은편/사람들이 줄서서 먹길래 맛있는 줄 알고 갔다가 낭패를 본 곳..반숙 오므라이스 시켰는데 결론부터 말하자면   볶음밥:최악,  계란옷: 나쁘지 않음, 소스:너무 달아서 별로.   우선 볶음밥부터 말해보자면, 느끼하다. 볶음밥 볶고 남은 기름이 많다못해 넘쳐서 기름에 밥 말어먹은 느낌   계란옷의 경우, 괜찮았다. 반숙으로 약간 덜 익게 나왔는데 부드럽게 잘 ...더보기/맛잇는편. 끝에가면 느끼함  티비방영후 대기줄 많으나 기다려서먹을만한 가치가없음. 백퍼후회 ㅋㅋ/먹어본 오므라이스중에 진짜 맛있는편이였음 다만 가게가 작음/맛있어서 두번이나 연달아 갔어요:)  젊은 사장님 두분이서 하시는데 자리가 협소해서 방문하시는 분들이 예의를 지켜주셨으면 해요. 불친절하다는 후기가 간혹 보이는데 제 생각에는 충분히 친절하셨어요. /별로 맛있지도 모르겠는데 줄은 길고 손님응대도 x가지가 없네요. 비추./오므라이스,함박스테이크 모두 맛있었어요 위치는 별론데 숨겨진 맛집 같은 느낌 /부드러운거 땡기면 반숙오므라이스를 드시라. 오므라이스라는 음식에 대한 편견을 깨자./여름메뉴 여름채소카레 너무 맛있어요... 맛있어 맛있어♥ 고마워요./맛과 가격은 무난한데 사장님 혼자 일하셔서 엄청 바쁘신 느낌..그게 맛에도 반영되서 가끔 편차가 심합니다/맛있당/맛있어요!!/집앞의 거의 유일무이하다시피한 인스타갬성 식당 맛도 훌륭!!! 여기서 파는 메뉴 다 먹어봤는데 실패한적 한번도 없었음... 근데 카레 같은 경우는 아무래도 매일 컨디션이 다른가보더라 같이간 언니가 화이트카레가 좀 짰다고 했음/서비스 괜찮고 맛도 좋아용 내부는 좀 좁음"
3,호핀치,서울 마포구 광성로6안길 6 (우)04096,카페,"초코바나나푸딩,필터커피,귀리라떼,호지라떼,바나나푸딩,호지커피와 아이스크림",5583,4.9,28,31,"아니 그냥 너무 좋은 곳 어... 마음이 편한 카페  /그런 곳 있잖아요. 선한 사람이 하는 곳이구나~ 느낌이 드는 곳./조용한 분위기 좋네요 공간은 작아서 두시간 이용제한있어요 호지라떼가 좀 달았어요/가야는이유 : 동네사랑방 같았던 정감있는 카페 안가는이유 : 양이 가격대비 적게 느껴진  라떼,호지라떼,바나나푸딩 : 라떼는 양이 좀 적은듯했는데 샷은 그대로인지 상당히 진했던, 호지라떼는 우유 비중이 더 많게 느껴진, 그래도 맛은 모두 만족, 바나나푸딩은 바나나크림이 그대로 느껴지는 진한맛/공간이 조금 협소하긴 하지만 분위기 좋아요/소박한 공간, 따스한 분위기. 쿠키를 한 입 먹고 마시는 플랫 화이트 한 모금의 고소함 /진짜 이카페 분위기. 음악. 커피. 디저트 모든게 조화로운곳이다. 커피 크레마도 굳. 바나나푸딩이랑 휘낭시에 미추어버림....세상촉촉 사장님인 베이커이시자 바리스타센세님은 정말 친절하시당... 공간은 아담하지만 조용하고 아늑한 너낌을 좋아한다면  여러분들도 반할듯  성남에서 멀리찾아온 뿌듯함  #지인아님...진짜 맛있는곳아니면 평도안남기는 사람이 남기는 평/호지차라떼 맛있어요/커피 맛있어요!!! /모든 음료, 특히 커피가 맛있고 공간도 좋고 사장님도 너무 친절 하십니다 재방문 300프로/크리스마스 이브에 커피 마시면서 영화 보고싶은 곳이네요 친절도 하시고 커피도 맛있어요 자주 올게요/아담하고 정겨운 커피를 마시고 싶다면 한번쯤 들러보시길 바랍니다. 주인장의 정성을 느끼시게 됩니다./좁지만 알찬곳이네요 식물이 많아서인지 마음이편해지는 곳 입니다/여기 왜이렇게 좋됴..? 커피도 너무 맛있고 여자사장님도 친절하셔서 반했어요 특히 공간도 너무 좋았습니다 /다소 협소하지만 아기자기하면서도 심플한 감성이 돋보이는 공간. 커피 맛도 준수한 듯./호지커피와 아이스크림이 너무 맛있어요 바나나 푸딩도 맛있어요! 좋은 공간에 사장님까지 친절하셔서 너무 좋았어요/바나나 푸딩이 맛있어요. 호지커피와 아이스크림도 너무 잘 어울리는 조합에 맛도 최고였습니다 •͈˽•͈ 친절하신 사장님과 그에 어울리는 분위기까지 완벽 했어요.. 집 주변에 있다면 매일 방문했을것 같아요. 다음에 서울에 또 가게 된다면 꼭 다시 가고 싶어요 ! /바나나푸딩 진짜 맛있습니다. 과일주스도 맛있고 귀리라떼도 맛있어요!/아기자기하고 넘 좋아용/체고체고! 카페 너무 귀엽고 커피가 너무 맛나요 ㅜㅜ 좋은공간!/동네에 아기자기한 카페가 생긴줄 몰랐네요! 가게 꾸미신 소품들도 어디서 구하신건지 궁금할 정도로 귀여워요ㅋㅋㅋㅋㅋㅋㅋ (그만큼 카페 내부에서 마시긴 좀 공간이 많이 좁아요) 텀블러 가져가시면 천원도 할인한다고 하시니 참고하시구요. 산미 싫어하는 제가 아메리카노 마셨는데 맛있었습니다./커피랑 호지차라떼 넘 맛있어요 쿠키류도 다 맛있었어요!!"
4,요수정,서울 마포구 광성로 28 상가 1층 (우)04097,이탈리안,"믿고맡김,매일 메뉴가 조금 변경 됩니다. 총 6가지, 해산물과 생선 고기류를 포함 하고 있고, 최소 하루 전 예약시 상의가 가능 합니다.,믿고맡김,매일 메뉴가 조금 변경 됩니다. 총 6가지, 해산물과 생선 고기류를 포함 하고 있고, 최소 하루 전 예약시 상의가 가능 합니다.",30000,3.7,51,60,"자리가 조금 맘에 안 들 수는 있는데, 이 가격 대비 오마카세 맛은 충분하다고 생각합니다. 단, 자리가 좀 캐쥬얼하긴 합니다. 그래도 좋아요. /2층 다락방?용도의 테이블로 안내해주셔서 넘 당황했습니다. ㅠ 음식은 맛있었어요/인플루언서 추천 글 보고 갔는데 정말 실망했어요.  자리에 앉아있는데 서빙하는 분이 아무 말 없이 갑자기 음식을 테이블에 툭 가져다 놓고 휙 가버리시더라고요. 황당해서 저희 메뉴 시킨 적 없고 어떤 메뉴인지 설명 부탁드린다고 하니까, 그날 메뉴 적힌 종이 주더라고요.  옆 테이블도 똑같이 그러셔서 그 분들도 황당하다는듯  웃긴 식당이라고 하셨음..ㅋㅋ  맛...더보기/음식들 하나하나 신경쓰신게 느껴졌어요 너무 맛있고 분위기도 좋습니다 :)/음 어렸을 때 san fransisco에서 main chef님이 해주셨던 pasta가 생각나네요. 정말 고급진 맛이였고 seafood based plate임에도 바다향이 기분 좋게 났습니다 felt good! 요리에 관심이 많은 저는 ingredients도 하나하나 신경 써서 가져오신다는 것을 알 수 있었죠. 오늘 아주 fabulous 하고 gorgeous...더보기/너무너무 맛있어요!!!!!!!!!!!!!!!! 분위기 좋아 ㅠㅠ/맛있어요 ㅠㅠㅠ 강추드립니다/회요일 저녁 당일 예약이 돼서 좋은 마음으로 갔는데 조용한 분위기에서 식사가 가능한 자리는 아니였어요 ㅠㅠ 그래도 저렴한 가격에 나오는 멋진 요리들 맛 볼 수 있는 점은 좋았습니다. 사진은 제 기준 가장 맛있었던 스타터와 마지막 요리!! 라비올리 기대하고 있었는데 오늘 코스에는 없어서 이것도 조금 아쉬웠어요 ㅠ 셰프님께서 가게 내부가 시끄러운거 몇번씩 양해...더보기/이 가격에 이 퀄리티라니 진짜 괜찮았어요 /메뉴가 매일 바뀐다는 컨셉은 좋으나, 그런 만큼 맛의 기복도 심함. 맛 없을 땐 진짜 못 먹을 수준일 때도 있음./기념일에 식사를 하러 갔는데 너무 아쉬웠던 점이 많아 리뷰를 남깁니다. '기념일에 가기 좋은 가성비 좋은 코스 요릿집'으로 꽤 소문이 나 있는 것 같아서, 분위기도 중요한 식사를 원하시는 분들은 꼭 참고하시면 좋겠네요.  일주일 전에 예약을 하고 갔는데, 내부에는 자리가 없다고 1층 야외 테이블로 안내받았습니다. 그런데 자리가 최악이었습니다. 제 자리에서는...더보기/너무 맛있어요^^ 사용된 재료들도 싱싱해보이고~ 색다른데 맛도 좋네요^^ 강추입니다 강추!! 아 그리고 콜키지도 4천원이라 가성비가 아주 좋아요! 종업원분이 메뉴 자세하게 설명해 주시는 것도 좋았답니다~/한 3.5점 정도.. 그럭저럭 먹을 만 하나 좀 싱거움 기대를 너무 하고 가서 그랬는지 분위기는 레스토랑 분위기는 아님 가격이 괜찮으니 궁금하면 가 볼 만은 한 듯/단언컨대 서강대 인근 최고의 맛집!! 3만원으로 6가지 고급진 요리들을 맛볼 수 있다는게 엄청난 가성비인데, 심지어 요리가 하나하나 빠짐없이 엄청 맛있습니다..  제철 식재료에 맞게 매번 코스 구성이 바뀌는데 갈때마다 성공하는 곳.. 누구든 방문해본다면 후회하지 않을 겁니다~/흠…일단 네비에는 주차가능이라고 나와있지만 주차 불가능이고, 인플루언서가ㅠ극찬해서 다녀왔는데 너무 실망했습니다. 요리와 서빙을 같이 해주셔서 너무 정신이 없었고 홀에서는 기름 쩔어있는 냄새가 났고, 요리에서도 전반적으로 기름냄새와 비린내가 났어요. 위생과 청결에 조금 더 신경쓰면 더 좋은 가게가 될 것 같습니다. 화이팅…./중요한 약속이라 부러 좋은 곳으로 모시려고 친한 쉐프님께 추천받아 일주일전에 전화로 예약했습니다.  예약시간 15분전에 도착했는데 문이 안열려있어서 전화드렸더니 원래 월요일은 안한다는 황당한 답을 들었습니다. 지도앱에도 오픈시간 고지가 잘못되어있고 전화로 예약받으신분도 월요일로 받으셨는데 너무 어이없습니다. /음식과 서비스는 괜찮았으나 화장실에 비누가 없어서 조리위생이 어떨지 살짝 걱정됐습니다./저렴한 가격에 제대로 된 코스 요리를 즐길 수 있는 곳입니다ㅎㅎ 사진이 코스 순서인데요 처음 먹어보는 음식도 있고 코스에 고기와 해산물이 적절히 구성되어 있어서 너무 잘 먹고 왔어요! 3만원에 뻔하지 않은 믿고맡김을 먹을 수 있다는거 자체가 가성비..♡ 서강대 근처에 이만한 맛집 또 없습니다../두번 방문했는데 첫번이 좋아서 두번째 갔다가 완전 후회했다. 진짜 별로. 불친절하고 양도 적다. 맛도 잘 모르겠다. 애초에 기본기가 부족한 느낌. 인스타용/주인분 위생관념이 부족함/근처에 분위기 있게 먹을 수있는곳 찾다가 맛집리뷰보고 찾아왔는대 진짜 만족했어요~ 좋은재료에 다양하게 메뉴가 나온는대 싼코스 가격이 진짜 가성비 좋은거같에요 음식도 퀄리티가 좋고 corkage가 4000원이라 부담없이 즐기고 온거같에요!/불친절해요/가지마세요 이 시국에 주방 일하는 분 마스크도 안쓰고 말하면서 음식만들고 ㅋㅋㅋ써달라 해도 계속 썼다 벗었다 하시더라구요? 자기들끼리 음식만드는 주방에서 마스크 벗고 웃고 떠들고 먹고 진짜 경악/가성비 갑이네요 병당 4,000원의 합리적인 콜키지 비용..자주 갈려구요~~/최악... 믿고상차림 코스 2인이면 음식이 짝수로 나와야하는거 아닌가요? 진짜 기본부터 안되어있고...  솔직히 음식이 하나같이 맛이 없어요... 무슨 인스타 중독자들이 좋아할거같은 비주얼만 생각한 음식.. 그이상도 그이하도 아님.. 정말비추!!!/메뉴가 그날그날 바뀌는데 이렇게 다 맛있지도 쉽지 않을겁니다/학생때 너무 맛있게 먹었던 기억/생면파스타 먹으러 주기적으로 가줘야해요ㅠ.. 자주 갔더니 얼굴 알아보시고 서비스 주시는데 서비스로 나온 에피타이저가 메인보다 맛있었어요... 흑임자오일에 무친 참외였나?  스테이크위에 직접 절인 송로버섯편이 나왔는데 이런 생각은 어떻게 하신건지..;;;;  암튼 쉐프 라는 타이틀에 걸맞는 매번 창의적인 음식에 감탄합니다.  첨 가시는 분들은 생면파스타 꼭 ...더보기/매우 친절, 그러나 요리기본과 운영철학이 많이 모자란다. 이렇게 작은 식당에선 안바쁠때도 오너쉐프가 직접요리하는 성의가 필요. 대표메뉴인 카르보나라는 거의 차가운수준으로 서빙. /세프 추천코스 먹었어요. 좋은 재료에 맛있었습니다. 재방문 기대됩니다. (17:50까지 브레이크 타임)/진짜 음식도 매일 바뀌고  늘 갈 때마다 기대가 되요~ 지인들 데려가서 실패한 적 한 번도 없어요~/가성비 트러플 파스타/오믈렛은 밥+계란  직원분이 추천해준 흰살생선 파스타는 이맛도 저맛도 아닌맛으로 재방문 의사 없음"
