,name,address,sort,menu,mean_price,score,people_give_score,review_count,review_list
0,아우어베이커리 숭례문점,"서울 중구 세종대로 14 그랜드센트럴 B104,B105호 (우)04527","제과,베이커리","추천,4,800,빨미까레,플레인 크루아상,그린티 더블,바닐라 더블",4575,3.2,5,11,다른 아우어보다 뻥 뚫린 인테리어가 좋고 직원분들과 점장이 친절하게 응대해줘서 좋았네요~^^ 맛있는 빵과 커피 먹고갑니다!/숭레문점 박OO사원님. 멘트만 친절하다고 친절한 게 아닙니다. 저 말고도 아래에 불쾌하게 여기는 분이 계시다니...진짜 문제 사원이신가 보네요. 박OO 대기업 프랜차이즈에서 그런 식으로 해 보세요. 평가 어떻게 나오는지... 그리고 서비스직이 안 맞으시면 어디 다른 데 알아보시는 것도 방법이신 듯 합니다. 당신 같은 분 때문에 이런 좋은 베이커리가 롱런을 ...더보기/여기 근무하는 남자직원 고객응대가 아주 불쾌함...눈빛은 불친절한데 응대 멘트 글자만 친절함. 오픈한지 며칠 되지도 않은 매장인데 갈때마다 이렇게 고객 응대 하는 것도 대단한것 같음. 저렇게 응대해도 사람들이 많이 가서 그런지 모르겠지만..ㅋㅋ 그리고 아침 출근시간 및 점심시간에 가면 특히 지각위기를 면치 못할듯! 일하는 사람들 손이 대체로 느리고 본인이 ...더보기/좋아요!!!!!!!!
1,비스트로미 서울역점,서울 중구 후암로 110 지하 1층 (우)04637,이탈리안,"고르곤졸라피자,프로슈또루꼴라피자,추천,25,000,뚝배기해산물파스타,안심스테이크,스테이크피자",30800,5.0,3,34,서울역 인근에 이렇게 좋은 레스토랑이 있다니.. 잘 머무르다 갑니다./분위기도 좋고 음식도 맛없는 게 없고 다 괜찮았어요! 특히 단체석이 따로 있어서 좋았고 음식도 빨리 나왔어요 다들 너무 괜찮다고 했숩니다~ 추천!
2,서울리스타,서울 중구 퇴계로 19 1층 (우)04527,"호프,요리주점","마약핫도그와 감자튀김,명동 회오리 감자,송점선 떡구이,차돌박이 떡볶이,광장시장 빈대떡,만리동 먹태",14333,3.6,19,40,"루꼴라피자 엄청 맛있고 한바탕 지나간후에 아주 맛있고 재밌게 먹었네요 /시원한 밤바람을 맞으며 시원한 치맥을 즐길 수 있는 멋진 장소 !!! 생맥주도 시원하고 치킨도 겁나게 크고 맛있다 ㅋ  특히 여태까지 먹어본 중 최고로 맛있는 프리첼을 맛볼 수 있었다 ~ 배리 배리 굿 플레이스 ^^ 서울라거, 부산에일 & 버터땡초치킨 /서울라거 생각보다 쓰고 떫었음 서울포터 흑맥주치고 가볍고 맛있었음 댄싱파파 써머스비가 쫌더 맛있는듯..ㅠ  버터땡초치킨 너무 매워요.. 맛있는데 넘매움 맥앤치즈 가루맛나요 먼가 입에서 걸리적../사람은 많지만 그만큼 무난하고 맛나요 바닐라스타우트 원픽:)/맥주도 안주도 맛있고 사람도 적당함. 가게도 청결하고 가격이 저렴하진 않지만 그만큼 맛있다 소개해주기 좋은 무난한 호프 맛집/맥주 종류 많고 맛있어요/나쁘지 않았어요/맥앤치즈. 감바스. 감자튀김 이랑 맥주시켜서 먹었습니다 맛 자체는 다른 곳과 비슷비슷합니다. 저녁에 가시면 분위기가 좋고 펍느낌으로 데이트하기도 좋아요. 밖에 테라스가 있어서 거기서 먹으시는분들도 많았어요/단체 가기 좋음 물, 식기 준비 셀프라 귀찮음 화장실 깨끗하고 서울역 근처 접근성 좋음 맥주 맛있음 안주도 괜찮 직원 친절도는 별로... 재방문 의사는 있음/피자보단 리조또 파스타가 맛남. 맥주도 신선해고 종류도 많아서 좋은듯/점심시간 피맥했어용~ 1시쯤 가서 한산했구요~ 식사는 1층만 가능하대서 2층은 안가봤네요~ 가격이 비싸서 자주는 못갈듯 ㅠ 피자는 쏘쏘~  /11시 30분 오픈이라 해놓고 주말은 12시에 오픈 한다고 함....다들 시간 맞춰가서 시간낭비 하지 마시길. 안내해주는 사람 한명도 없음 서비스 최악/가격이 좀 세지만 특이한 맥주가 많아서 좋았던 곳/돈가스 양은 많은데 맛은 그닥이에요 가격도 비싸고 서비스도 별로../맥주도 좋지만 모든 안주들이 다 맛있어요/Chicken & Bier/서빙하시던 외국인 직원 한국말 정말 잘하던... 물론 맥주도 맛있고!"
3,연타발 서울역점,서울 중구 퇴계로 10 1층 (우)04637,연타발,표기안함,표기안함,3.3,7,7,아니 단발머리 브라운계열 염색한 아줌마 종업원 진짜 너무심함 반찬달라고하면 눈으로 레이저쏘고 진짜 짜증나서 컴플레인걸려다가 말았음 다신안간다/비싸기는 한데 진짜 맛있네요~ 근데 직원분들 추가 채용하셔야 겠어요~ 바빠보이셨어요/비싼데 맛 없음/맛은 좋은데 가격이.../비싼맛큼 맛도 있고 서비스도 좋아요/대창 끝판왕
4,잉꼬,서울 중구 세종대로 22 (우)04527,"초밥,롤","특잉꼬초밥(12pcs),연어초밥(10pcs),호토마키 한줄(10pcs),모듬사시미(M),메로구이",24800,4.3,7,27,"...?/027524142 예약하라/퀄리티짱! 테이블 다닥다닥있는게 살짝 흠/잉꼬 최곱니다. 점심도, 저녁 요리 메뉴도 뭐하나 빠지지 않아요. 분위기까지 굳굳. 서울역과 남대문 근처에 이정도 가성비와 깔끔, 분위기, 맛 되는 식당은 아직 못찾았습니다. 지금 여기 다닌지만 … 어언 3년 넘어갑니다. /깔끔하고 맛있어요!!! "
