,name,address,sort,menu,mean_price,score,people_give_score,review_count,review_list
0,가메골손왕만두 남대문본점,서울 중구 남대문시장4길 42 (우)04528,분식,"고기왕만두 (4개),김치왕만두 (4개),갈비만두(10개),새우만두 (8개),손칼국수",4800,4.1,101,163,"명성에 비해서 그냥 그랬음/예전엔 육즙 팡팡에 맛있었는 데 만두피 너무 두꺼워지고, 만두소는 적다. 예전처럼 줄서서 먹을 게 아니다. 벌레도ㅜㅜㅜ....ㅜ/고기만두 이걸 굳이 사먹으러 찾아간 내 자신이 한심하다. 그냥 동네 만두맛임/만두 안에 당면이 쫄깃하구려 ㅎ/매년 겨울이면 찾아가서 포장해오는 왕만두. 작년부터 피가 점점 두꺼워진다고 느꼈는데, 올해는 영 두꺼워져서 못쓰겄다.. 김치만두 소는 설탕을 어찌나 쳤는지 달아서 맛을 해친다..ㅠ 만두가 아니라 그냥 달디단 소를 저가 꽃빵에 싸먹는 느낌으로 바뀌었다. 피를 두껍게 하고 소를 자극적으로 조리해서 원가조절 하는 것 같은데.. 원래 10개 8천원이었는데 지금은 ...더보기/남대문가면 왠만해선 가메골만두는 포장해옵니다. 고기도 맛있지만 제 입맛엔 김치가 좀 더 맛있어요. 몇년전보다 만두피가 두꺼워져서 별하나 뺍니다. /갠적으로 피두꺼운 왕만두보다 얇은피 보드라운 만두를 좋아하여 평소 왕만두에 대한 기대치가 매우매우 낮고 아무리배가 고파도 선뜻 안사먹는 메뉴인데.. 여기 고기만두는 미쳐씀! 이거먹으러 남대문 찾아올 의사 100푸로  고기만두 5/5 김치만두 4/5 새우만두 3/5 /고기만두 대박/새우만두 너무 맛없음,,, 통새우도 아니고 간새우/가격대비 훌륭  명동 들리면 꼭 사간다는 마감다되서 온 거지아저씨에게  만두 5개 챙겨주시던데/가격&맛 굳/김치만두 안좋아하는데 여기 왕만두는 고기 김치 둘다 훌륭해요 ㅠㅠ 기대 안했던 칼국수도,,,, 최고/legend mandoo/만두 맛집입니다~~/회사 근처라서 갔다가 먹느라고 대화를 못 함 ㅎㅎ/아 맛있다 칼국수도 기대 안했는데 기대이상 직원들도 친절하고 만두도 맛있다/두툼한 만두피  만두의 정석/맛은 최고, 서비스는 꽝 그래서 -1점~^ /한입베어물면 흐르는 즙.... 너무 맛나요/김치왕만두 두번머겅 세번머겅 ♥♥ 개존맛탱/피가 얇아서 제 입맛에 맞더라구요. 5개 45초컷. 쿰~척!/애기때 부터 먹었습니다. 항상 한결같은 맛 감사합니다. /만두의 정석 김치만두가 진짜 맛있음/김치만두 추천합니다. 칼칼한 매운맛아닌 김치+고기라 살짝 매콤한 맛/맛있음 피가 쫄깃함/예전엔 정말 싸고 맛있었음  지금은 중상 정도 수준?  세상이 변하는 것처럼 맛집도 변하는 것인가../고기만두보다 김치만두가 더 맛있었어요/맛있고 가성비 짱. 위생과 시설이 살짝 아쉬움/앙꼬가 맛있네요^~^ 개인적으론 김치만두가 더 맛있었어용-!/평범한 만두집입니다. 명성에 너무 취해서 맛보면 실망할수도~~ 그래도 가성비는 내립니다/피가 얇고 속이 가득찬 내가 조아하는 스타일의 만두는 아닌데 8천원에 12개 충분히 잘먹었음. 담에 또 갈듯"
1,남산돈까스전문점,서울 중구 소파로 23 (우)04635,"돈까스,우동","돈가스,생선가스,반반가스,모듬정식,조선국밥,꽁치김치찌개",8166,4.2,611,137,"8년전 방송 안나왔을때  쌩뚱인데  여기 왜?? 라고했는데  알고보니 사연이 ..  그후로 처음먹어보니  왜 원조인지 알겠네요 맛있어요/그냥그래요~ 추억의맛도 옛날맛도 아닌 잘 모르겠는/워킹코스에서 가장 가까운 돈까스집. 어린이날에 돈까스 먹는 어른이들, 그만큼 추억에 고픈 사람들. 언젠가 부모님처럼 아이들에게 추억을 남겨주겠지~/돈가스 만원, 동네 맛과 차이 없음 , 시설 위생 상태 별로임 줄서서 먹었는데.. 돈 시간 아까움/행복하세요!^^/화이팅!/지극히 평범한집. 사이즈가 커보이지만 매우 얇아서 실제 양은 적음. 웨이팅 있다면 그냥 패스하시길./내 댓글 지워졌네 원조라고 했지 맛있다곤 안했다/김밥천국보다 조금 더 맛있는 정도/맛있어요. 돈까스는 옛날돈가스 맛이 나는데 고추랑 같이 먹으니까 와 정말 맛있더라고요. 왜 여태 고추랑 같이 먹을 생각을 못했나 싶을 정도로 맛있었어요. 평범하다는 분들은 고추랑 같이 드셔보세요. 기가막힙니다./맛있어영~~돈까스는 역시 원조 소파로23번지~~~~김치 깍두기 국내산이라 더 맛있고 꽁치김치찌개도 맛있었어영 /역시, 프렌차이즈 진짜 101번지 남산 돈까스가 최고입니다. 거기 서비스도 괜찮고 맛도 끝내줘요. 여기는 비좁고 간판도 안 예뻐요. 1점 드립니다./돈가스도 작고 맛도 ㄹㅇ 동네보다 못함ㅋㅋㅋㅋ 돈가스니까 맛이 없진않지만 원조라고 굳이굳이 찾아올맛은 절대아님/진짜 이번이 두번째  리뷰 하는겁니다 서비스 엉망 위생상태 불량 불친절 하고 맛도 엉망이다 진짜진짜 비추천 입니다 이럴꺼면 돈가스 뷔페를 가지 진짜  별로다 아이하고 ㅊㅓ음 방문이여서 3명이서 혹시 남을까봐 2개 시켰는데  국물 스프 2명꺼만 줌  그래서 혹시나해서 한개더 주문했는데  2개만 찍혀있다고  주문 두개만 시켰다고 그래서 안준거라는데 그럼 포크 ...더보기/여기가 원조랍니다…./원조가 맞긴한데... 유튜브 여론덕분에 극락가서 별점이 4점대까지 오른거같음.... 맛은 솔직히 개인적으로 더부룩했음 먹고나서..... 난 솔직히 만원내고 이걸 다시 먹진 않을거 같음ㅠ/맛없고 비쌈  기본돈가스가 1만원 오래된 김밥천국집보다 퀄리티도 떨어짐/맛있는데 왜이렇게 평점이 안좋죠.  공원 산책왔다가 들어와봤는데 남산 위에 있는 돈가스집보다 훨씬 맛있어요.  다른 리뷰에는 불친절하다고 써있는데 특별히 불친절한것도 모르겠고 아주 평범하고 오히려 선량해보이시던데요. 돈가스 아느끼하고 진짜 잘튀긴 맛나고 생선가스는 생각보다 더 맛있어서 잘 먹었어요. 제공되는 깍두기도 신선하고 특히 고추는 집에서 키운것같이 ...더보기/일부러 오지 마세요.전에도 지금도 별루.요새 손님들 많이 늘었네요 호기심 있으면 함 와보시구/여기가 원조는 맞는데 다른데 상호 뺏긴거와는 별개로 일단 맛이 ㅈㄴ없음 이 질떨어지는 돈까스 퀄리티 왜 뺏길만하고 망햇는지 알수잇는 대목/지금까지 대한민국 돈까스집들 뭐했노 이기 나도 동양카츠가서 치돈 시켜먹고 그랬는데 심심하면 사람들 불러다가 줄스고 회전율로 관심 받고 했는데 그가게 뭐했어? 퀄리티 좋은 돈까스 못만들어 내놓고  내가 원조집이요! 남산돈까스는 다르다요!  그렇게 별점 올리고 했는데 꺼드럭거리고  가격 내린다라고 하면 안된다고하고 줄줄이 줄서가지고 웨이팅 수기 성명쓰고 가게가...더보기/여기가 진짜 원조입니다. 그러나 맛은 별로입니다. 김밥천국에서 사먹는 돈까스랑 다를게 없어보이는데 만원넘게 받아요. 공산품 냉동 돈까스 쓰는것 같습니다./친절은 하시지만.. 전통있는 만큼 돈까스를 양심있게 제조합시다. 기름기 범벅에 소스는 시판 소스, 먹고 하루종일 속 안좋았어요. /최악의 돈까스 밑에 리뷰대로 김밥천국 돈까스 퀄리티에 가격은 만원에 육박함. 밥을 같이주는데 웃긴게 밥이 찬밥임ㅋㅋㅋㅋㅋ 스프는 나오는데 물을 얼마나 희석했는지 아주 옅은 오뚜기 스프맛임. 원가절감 적당히합시다ㅋㅋㅋ 쉽게 생각해서 CJ 냉동돈까스보다 맛없음. 서버중에 조선족분이 계시는데 메뉴이외에 말 거의 못알아들음. 고객응대는 거의 전무하다고 보면됩니다....더보기/위생 관리안됨   김치 담는 그릇에 고춧가루와 이물질 묻어있어서 바꿔달라고 했더니 물로 대충 씻어서 옴. 그렇게 했는데도 묻어있어서 손가락으로 대충 닦음.  음식관련 돈까스 양 정말 작음. 이게 이 가격 맞나 싶음. 스프 다 식어서 옴. 가루맛 나는 느낌  순두부 뭔가 비릿한 맛이 남   원조라지만 원조가 아닌 곳이 더 맛있는 느낌 유튜브보고 여기가 원조구...더보기/음..친구랑 같이 갔는데 친구는 역대급으로 맛없다고 하고 저는 뭐 평범했어요 그냥 평범.. 근데 생선까스는 진짜 맛없었어요../원조이기만 하다/남산돈까스 유명하길래 기대하고 갔는데 요즘 돈까스가 더 맛있어진건지, 아님 옛날보다 더 맛없어진건지 별로였습니다.  평점 4점 넘는게 이해안되네요/원조인 곳으로 찾아갔음 맛있길 바랐는데 진심으로 맛도 없고 돈도 아까움...  위생도 별로/원조라고 해서 갔는데 이런다면..돈까스는 드시지마세요 차라리 택시 기사님 드시는걸 따라드세요 /맛이 엄청 특별하진 않지만 괜찮았어요 법적분쟁 이기시길 기도할게요!"
2,막내회집 본점,서울 중구 남대문시장2가길 2 2층 (우)04528,회,"광어 (대),광어,우럭,모듬 (대),해삼,멍게,낙지",42500,3.7,51,72,
3,카페피크닉,서울 중구 퇴계로6가길 30 1층 102호 (우)04635,카페,"에스프레소,아메리카노,프키닉 라떼,바닐라 라떼,크림커피",5900,3.0,22,148,"17시 30분 라스트 오더래서 일부러 찾아갔는데 4시 30분에 오더 끝낸 지들 멋대로 영업장이네요. 근처 카페 계단집왔는데 훨 저렴하고 맛있어 다행 /겉보기엔 예쁘지만 서비스는 사람을 불쾌하게 만든다 커피맛도 가격에 비하면 의문이 드는 맛이고 테이블도 아주 길게 만들어서 타인과 강제로 합석하게 만든점이 아주 불편하다 /생각보다 괜찮은데요? 커피맛 괜찮고 디저트 치즈케이크도 부드럽고 상큼하니 좋았음/여기 손소독제 부터 시작해서 분위기 너무 맘에들어요 ~~ 1 층 2 층 3 층 다 괜찮은 식당 . 카페로 둘러쌓인 곳이네요/굿/분위기가 좋고 밀크티도 맛있는데 코로나로 인해 모든 공간이 오픈되지는 않아서 아쉬웠습니다/직원들 불친절해서 다신 가고 싶지 않음 그리고 커피 대체 어떻게 내린 건지 밍밍하고 시고 최악 크레마 하나 없는 미리 내려놓은 맛/ㅋㅋㅋㅋㅋㅋㅋㅋ에스프레소 오천원 실화냐 진짜 이탈리에서도 이렇게 안판다 /카페는 너무 예쁜데 알바인지 직원인지 불친절  너무 친절을 바라는 것도 아닌데 무튼 별로였음/여기 개별로인 이유 알바 때문입니다 10월 9일 수요일 2시쯤 남자알바요 기분 좋게 전시 보러 왔다가 목말라서 카페 왔는데 구좌 당근이 뭔지 모른다고 완전 공격적이네용ㅋㅋㅋ 구좌가 고향이면 인정해드림 남자알바한테 절대 아무것도 질문하지 마시고 모르는 거 티 내지도 마실거면 가도 괜찮음/개별로;커피는 산도가 높아서 못마시겠고...당근주스는 진짜 당근이랑 물 갈은 맛. 직원도 불친절해서 기분 나쁨. 케이크는 맛있지도 맛 없지도 않고...쏘쏘/독특한 분위기가 좋아요. 전시를 보지 않더라도 카페에서 커피 마시고 주변 둘러보고, 좋네요. 크림커피는 7천원!!/케이크가 적당히 달아서 맛있게 먹었다 커피도 잘된 로스팅에 좋은 추출, 바디감은 약간 무겁다;-; 위치때문에 언젠간 맘잡고 가볼것 같은곳이었는데 표지판 덕분인지 생각보단 난해하지않게 찾을 수 있었다/예뻐요 회현역에서 가까워요/예쁜데 접근성이 후져요ㅠ"
4,부원면옥,서울 중구 남대문시장4길 41-6 부원상가 2층 (우)04529,냉면,"물냉면,비빔냉면,냉면(곱),비빔냉면(곱),제육무침,닭무침",11666,3.2,72,129,
5,진주집,서울 중구 남대문시장길 22-2 (우)04528,곰탕,표기안함,표기안함,3.6,51,80,"맛 별로에요.. 맛집 전혀 아님. 재방문의사 없음./대통령 픽/윤석열 대통령이 남대문시장와서 꼬리곰탕 드신 곳 3.14/성지 순례 왔습니다./그냥 꼬리토막에 소주면 끝장나는집 15년 단골./탕 맛있고, 실내 아늑하고 주인분 친절합니다/사장님 친절 하시고 특히 김치가 맛있어요!!~♡/이집은 꼬리인데 육수가 1차인가바요 맹탕 그리고 냄새나서 다데기 달라고 할정도 평생 먹어본 곰탕중 최하/국물이 맹탕입니다./9,000원 해장국은 에러./24시간이라서 자주갔었어요 요즘 장사안되는 가게들이 많아서 24시간 하다가도 안하는 가게 많던데 여긴 어떨지 모르겠네요 밤에 먹을만한거 없을때 가기 좋았어요 설렁탕 드세여/남대문시장의 꼬리곰탕 명가인 '진주집'은 '은호식당'과 함께 자웅을 겨루는, 70년 전통의 노포지만 꼬리토막의 퀄리티나 국물 맛은 '은호'가 낫다. 은호 윈 !!!  /오래된 맛집./경 보통이에요/가성비 최악/비싸고 맛없고 별로입니다. /비싼만큼 맛있는 꼬리토막 비싼만큼... 비싼만큼... 가격 25,000원으로 인상/꼬리곰탕/곰탕전문. 남대문시장안이라 찾기가 약간 힘듬.  꼬리토막 ㅡ 꼬리토막탕. 꼬리곰탕보다 약간 비싸지만 곰탕보다는 실함./꼬리토막이 맛있음~ 비쌈~/(3.6점) 꼬리를 먹을때 연장을 준다. 하지만 포크로 찢는것보다 손으로 들고 뜯는게 내 방식이다. 남자라면 스테이크가 아닌 이상 거룩한 고기에 연장질 하는거 아니다. 고기는 결대로 부드럽게 찢어진다. 함께 나오는 새콤달콤한 부추간장무침도 괜찮다.  - 꼬리곰탕 훌륭하다! 아래쪽 꼬리를 사용한다. 가늘고 길다. 쫀득하고 콜라겐도 많고 더 부드러운 꼬리쪽을 ...더보기/꼬리찜 예술/내장국밥만 먹음. 국물 담백. /꼬리곰탕최고 소스도최고/꼬리토막 맛있어요 /코리곰탕/꼬리찜 ₩65,000 소주 안주로 좋지만 가성비 생각하면 그저 그렇다 딱히 입에 착 달라붙는 맛은 아니지만 국물 괜찮 국물 리필가능 소면추가무료"
6,연길반점,서울 중구 퇴계로 42-2 2층 (우)04634,양꼬치,"마파두부,양꼬치 (10개),탕수육,소위볶음,궁중닭볶음",13400,3.2,73,149,"주문하는데 왜 인상쓰고 짜증내시죠?   /맛없음/음식은 맛있는데 서빙하시는 한분 왜이리 성질을 내시는거죠?  딥빡/기대가 크면 실망도 큰 법이군 ~ 그토록 고대하던 이 집의 어향가지를 마침내 영접했지만 소스가 너무 시큰하고 강한 맛이다. 오히려 고소하게 잘 볶아낸 계란볶음밥이 예술이다 ^^ /중국 현지식 좋아하는 한국인으로서 여기보다 맛있는 중식집 많습니다/별 0점은 없나요? 불친절,  맛없음, 먹고 배아픔, 웨이팅한 내 시간을 돌려줘~!!!/별루...뭐가 좋다는건지 모르겠음 가격만 비싸고/맛있었거든요????엄청~ 뜨겁긴 했지만 불어가면서 먹었어요 근데 어젯밤에 정말 화장실에서 동고가 타버렸어요!!! 제가 맥주랑 같이 먹은 탓도 있지만…. 너무 기름져서 그런 것도 있는 것 같아요! 사장님은 친절했어요~/맛있었은데 담날 속이 너무 안좋네요 같이 먹은 사람들 다 동일해요 ㅜ/  불친절은 어디에서 나온거지^^/어향가지 세계최고 양꼬치 한국최고  분위기 좋고 칭다오와 모든 음식이 잘 맞습니다 사장님 친절 감사합니다~ 또 가고싶어요/분위기도 좋고 맛도 무난하고 술먹기 좋음/어향 가지 맛있어요! 다시 먹을 맛인 것 같아요! 근데 들어오자마자 다섯시 이후로는 두명이 와도 요리 두개 이상 시켜야 한다고 하고 좌식 자리 선호하지 않았는데 다른 데 예약 돼있다고 해서 어쩔 수 없이 좌식 앉았는데 예약 같은 건 안돼있는 것 같더라고요,,, 그래서 어쩔 수 없이 가지랑 동파육, 볶음밥 시키고 동파육 포장 부탁했는데 포장비 천원까지…^^ ...더보기/어향가지는 식초맛이 강한편이라 볶음밥 필수로 시켜서 먹는게 좋을 것 같아요!  볶음밥 진짜 꼭 드세요 존맛…/가지요리 젤루잘함!! 넘. 맛나요 가지요리 강추 탕수육보다 가지 두번 시키는게 더 맛있엉용/양꼬치만 있고 다소 느끼.. 대림동에 비해 별로이나 친절/평점도 아까운 음식점   12시 오픈이라고 써있어서  갔는데  5시 오픈이라고 해서 5시 5분쯤 갔더니 이미  두팀 손님있고 음식 두개씩  시켜 먹고 있었음  자기네들  밥  먹어야 하니까 20분후에  주문가능.... 자리 안내도  없고 아무곳이나  앉았는데 아무말 없이 힐끗 거리면서 밥만  먹더니 예약 손님  오니까  일어나라고 함  황당 뒤에  다른자리...더보기/업장 좀 드릅긴한데 맛있어요/별한개도 아깝다~~리뷰 첨 남겨보는데 리뷰글에속고 사진에 속고 갈까봐~  밑에는 공사하구 들어가자마자 이 지져분한. 느낌 양꼬치는 적당한맛이지만 계란볶음밥 컬리트보면 열을 안다고 어머님 모시고 갔는데 개망함~ㅜㅜ/이집은 양꼬치가 찐이네요. 육즙 장난아닙니다/조선족 아줌마 핵불친절 가스불껐다켰다하기 힘드니까 한꺼번에 시키라고 짜증냄 포장해가려던거 안해감 맛은 무난 가성비가 깡패/어향가지 비건용 양념치킨 느낌 맛은 보통인데 위생이 너무..테이블마다 소독약을 둬도 주방장이 내내 턱스크만 하고 있으면 무슨 소용인지...그리고 어향가지에서 돌 나왔습니다. 다른 직원분들은 친절하십니다. 그리고 16일까지 에어컨 고장나서 엄청 더우니까 그 이후에 가시는 걸 추천/양꼬치랑 꿔바로우 둘다 만족스럽고 양도 적절함 다만 너무 더워서 이번 여름엔 다시 갈생각 없음/통으로 튀긴 가지에 매콤달콤한 소스가 듬뿍 부어 나오는 어향가지. 세 개가 나와서 이 날은 일인일가지했다. 기름가득 머금은 가지를 후후 불며 추운 공기를 밀어내는 기분이 어찌나 좋았는지.  같이 주문한 온면은 따끈하고 부드러운 국수라 잘 어울렸다./어향가지 생각보다 별로. 아래에 어떤분이 위에 뿌리는 양념이 칠리쏘스에 두반장 섞은거 같다고 했는데 적극 동감입니다. /푸짐한 가지튀김이 유명한 집이에요. 가성비 가지로 인정합니다. 가끔식 생각나서 찾아가게 되는 그 맛. 다만 3명 이상이서 가야합니다. 가지가 기름져서 먹다보면 물리거든요./가지튀김 양이 많아요 두명이서 가면 가지튀김에 볶음밥 하나면 충분해요!/어향가지는 칠리소스였던가... 한번의 경험으로 만족함./어향가지 유명하다고 해서 갔는데 둘이가서 그런지 좀 남겼어요. 오래된 건물에서 먹는 나름의 노포의 느낌이고 명동에서 저렴하게 먹을수 있지만 기름진걸 좋아하지 않는다면 비추입니다. /맛있는데 자주는 못갈것같아요 ㅎㅎ/양꼬치, 어향가지 맛있어요. 호불호가 있겠지만. 전 잘먹었습니다. 직원들도 친절했습니다./* 양념치킨 소스같은 달짝지근함 * 위생이 좋아보이진 않음(추정)"
7,중앙식당,서울 중구 남대문시장길 22-12 (우)04528,"해물,생선","갈치조림 2인분,고등어조림 2인분,모듬생선구이,삼치구이,자반구이,청국장",11000,3.8,44,200,"난 별로... 양은냄비에 갈치들이 안 통통함ㅜ/위생은 좀 걱정될 수 있겠지만 맛있는 갈치조림이 먹고싶다면.. 혼밥도 오케이/오랜만에 생산구이와 조림이 생각나서 방문했습니다. 짭조름하니 반찬도 풍성하고 좋네요! 밑찬으로 나물과, 갈치구이, 계란찜이 나옴니다. 갈치조림으로 유명한 골목이지만 이날 고등어 조림을 시켜 먹었네요. 푹익은 김치에 탱글한 고등어가 들어간 조림이었습니다. 전체적으로 간은 조금 짠편이지만, 또 이런게 생각날때가 있잖아요?/살없는 갈치조림은 거기서 거기지만 짭쪼름한 무조림은 굿 !!!/백신 미접종자 1인손님은 식사불가라고 합니다/제가 뽑은 남대문 갈치조림 3대 맛집/여기 악글 후기 다신분들은 재벌집 분들인가 봅니다. 재벌집분이시면 스테이크나 썰러가시지 이런 맛집에 악글 후기 달지 마세요. 이 식당 서울 갈치조림 맛집입니다. 특히 계란찜이 너무 부드럽고 맛있어요. 갈치튀김도 맛있고 가격도 만원이면 적당해요. 진짜진짜 추천하는 맛집입니다. 2인 가시는분은 모듬생선구이와 갈치조림 시키시면 맛있어요./십 수년전애 갔다가...  인터넷에 친절하고 양도 맛도 변했다고 해서 혹시나 해서 갔었는데 역시나.. 기분이 좀 상해서 나왔네요. 일단 맛은 그냥저냥합니다. 특별하지 않아요. 갈치가 수입 냉동인 건 당연합니다만, 그렇게 질 좋은 원양어선 갈치가 아닙니다. 저만 그런줄 알았는데, 옆 테이블에서도 불평의 소리가 들립니다. 양.. 상당히 부족합니다. 2인분이 실...더보기/맛있다고 유명해서 갔어요. 그런데 얼마나 더러운지, 바닥 벽면 의자 식탁 플라스틱 물병 겉면까지 때껴서 미끈 끈지덕하더라고요. 갈치조림은....네.......아가미 안쪽에 기생충 두마리가 돌돌 말려 죽어있는거 보고 숟가락 놨습니다. 자연산은 기생충 나온다고 하긴 하던데 발견된 위치가 너무.... 씻으면서 한번 들춰보기만 해도 발견될 자리였어요. 갈치 엄청 ...더보기/순전히 평점이 높아서 간 곳입니다, 갈치조림 9,000원에 갈치 크지않은것 두조각 있고 무큰것 두조각 있습니다. 간신히 끼니 때울 정도.. 별도로 나오는 작은 갈치는 좀 딱딱한 갈치였습니다. 실망은 포장을 해와서 더합니다. 3인분 포장에 갈치는 거기서 먹는것 보다 더 못한듯 하고 같이 주는 김은 더 어이없는게 큰김을 그냥 접어서만 줍니다. 허탈한 느낌을 지...더보기/맛있어요. 조림, 청국장, 구이 다 좋았습니다. 단점은 화장실이 조금 멀어요. 하지만 깨끗합니다./가성비 좋아요!! ㅎㅎ 조림 양념이 자극적이긴 한데 넘나 맛있써요..계란찜두 짱맛이에여ㅜㅜㅠ 게다가 친절하셔용/골목의 다른집보다 생선두툼하고 양념좋고 무우도 넉넉해요. 담에는 구이류도 먹어봐야겠어요. 그러나 같이나오는 갈치튀김은 심했어요. 하루먼저 해놓은듯./갈치에 국물이 잘 베어있고 국물이 너무 맛있어요 또 갈꺼예요!! 맛집인정/갈치조림 청국장 조합 최고 계란찜은 덤~/재래시장은 싸야한다는 생각이면 다소 비싼 가격일수도 있지만 정말 너무 맛있어서 용서가 됨. 보통 저 공기밥 반정도 밖에 못먹는데 정말 모든반찬까지 억지로 다먹었음! 또가고 싶당~/갈치조림은 푹 조려진 무가 일품이고, 삼치구이는 양이 너무 많아서 다 못먹었어요 ㅋ 가격대비 아주 좋아요 ^^/여러분 여깁니다...가세요. 갈치조림 양념이 맛있고 살이 진짜 부드러워요. 최고! 재방문의사 백프로/넘 맛있네요.  역시 줄서는집이구나/최고/갈치요리 인생맛집/북적거리는 시장에 있는 식당느낌이 물씬 나는 곳이에요. 가격이 저렴해서 다른 단점들 다 잡고갑니다. 맛도 물론 기대이상/남대문 중앙갈치 줄선댜고 해서 11시30분에 갔어요~ 굿굿! 제주도 보다 맛남^^/푸짐하게 나오고 음식은 깔끔함/제일 유명한 식당인 만큼 웨이팅이 있음 갈치조림은 다른곳과 달리 칼칼하고 끝 어중간한 단맛이 없어 끝도없이 삽입가능 생선구이는 그럭저럭이다 계란찜도 살짝 심심/갈치조림 생선구이 하나씩 시켜먹었는데  맛있네요/We ordered 1 Assorted Grilled Fish (9,000 won) and 1 Grilled Mackerel (8,000 won) with rice. The order came with 1 free steamed egg. The fish was delicious, not overly salted as the usual salted grill...더보기/줄서서 먹는집 회전이 빠르고 좌석이 많아서 오래 기다리진 않았네요 맛은 평타는 하는것 같아요^^/가격대비 만족!/남대문 시장 갈치골목 갈치조림 추천/가격대비 푸짐. 갈치조림, 모듬구이 total 16,000원 계란찜도 준다."
