,name,address,sort,menu,mean_price,score,people_give_score,review_count,review_list
0,황소막창,서울 중구 청계천로 30 (우)04521,"곱창,막창","소막창,쭈꾸미,잔치국수",11333,4.3,20,64,"분위기 만점 맛 만점/미국산이지만... 분위기에 취하는.곳/미국산 막창인데 비싸고 질겨요/여긴 진짜 비싸도 꼭 가야하는 맛집 ㅜㅜㅜ소막창 입문하게 해준 가게/분위기로 먹는 곳이네요. 막창 기대했는데 실망이 커요. /가격은 비싸지만 맛있어요/above-average quality and atmosphere/존맛!!!!쭈꾸미는 걍 그럼/늦가을까지가 분위기 즐기기엔 좋다. 맛있다 하지만 비싸다. ㅠㅠ 돈 많이 벌어야지/집에 갈 때 옷에 막창 냄새 다 배어도 좋아! 여름에 가면 숯불 열기에 땀범벅이 되어도 좋아! 양이 적어서 카드값 많이 나와도 좋아!/진짜 존내 맛있다. 2차로 가면 더 좋다. 잔치국수도 맛있다. /끝내줍니다/여름엔 넘 더움 요즘같은 가을에 가면 최고. 막창이 여기보다 맛있는 곳는 없을듯! 소스도 넘나 맛있다ㅠㅠ/막창, 쭈꾸미, 잔치국수 다 맛있는데~ 쫌 비싸다,,/넘 많이 먹게 되서 비싸. "
1,부민옥,서울 중구 다동길 24-12 (우)04522,한식,"육개장,양곰탕,양무침 (소),수육 (소),곱창전골 (소)",24800,3.7,83,85,"점심 한끼 든든히 먹을 수 있어요!/그냥 보통이에요/맛은 있는데 조금 아쉽네요 ~/음식맛은 괜찮은데 서빙하시는 분들이 매번 팁을 요구하시네요. 사장님이 급여를 안주시는지, 너무 적게 드리시는지 궁금하네요. 수고비는 손님이 고맙고 수고하셨다고 드리는건데 자꾸 요구하시니 갈때마다 눈치가 보여 가고싶은 마음이 없어집니다./인생국밥. 이름은 육개장이지만 맛은 경상도식 소고기 국밥. 해운대 소고기 국밥 맛이 나지만 여기가 백배 더 맛있음. 매일 먹고 싶어요. 만원이 아깝지 않을 맛과 양. 국물 마지막 한방울까지 호로록. /시청 뒤, 다동 음식 골목에 위치한 아제 입맛 끌어들이는 오래된 노포입니다. 대표 메뉴는 양무침인데, 소(小)가 33,000원 중(中)이 47,000으로 가격은 비싼 편이지만 양은 많은 편입니다. 재료가 잘 손질되어 냄새도 없고 깔끔합니다. 하지만 자극적이지 않고 다소 심심해서 맛은 아제들도 호불호가 갈립니다.  저는 곱창전골이 술 안주로는 더 좋은 것 같...더보기/옛날맛~!~! 자주갑니다/양무침 절대 고수/추억의 육개장 맛이 그립다면/육개장에 고기도 실하고 맛있는데 뭔가 신맛이 나서 아쉽네요 양무침만 먹으러 와야겠습니다 ~/맛을 떠나 계산할 때 현금유도 하시던 할머님 처음에 좋게 카드하겠다고 말씀드렸는데 가게에 고칠게 있다면서 만원 빼주시겠다며 계속 말끝 흐리셨죠 기분 좋게 가족식사 한거라 정말 싸우기 일보직전까지 갔다가 간신히 계산하고 나왔네요 요즘 어떤 시대인데 현금 유도 하시면서 계산을 그렇게 질질 끄시죠??? 한번은 그럴 수 있어도 두번세번은 아니죠 계산한 금액도 15...더보기/역시 전통있는 맛집이네요 양무침과 육개장이 유명하지만 방아향내나는 부산찜도 별미네요 행복하게 먹고 갑니다~~/점심잘먹엇어용/너무 짰어요 ㅠㅠ/맛있어요/Delicious hole in the wall./양무침은 진짜 예술입니다. 양도 상당히 많습니다. 먹다보면 나도 모르게 소주 1병을 비우고 있습니다. 육개장은 맛은 평범한데 양이 혜자스럽고 안주로 먹을수 있게 국자랑 그릇도 가져다 줍니다.  노포는 오래남는 이유가 있는것 같습니다/Since 1956. 또 하나의 맛집 버킷리스트 달성 !!! 이 집의 시그니처 메뉴인 양무침은 생각보다 가격도 착하고 양도 푸짐해서 소주 안주로 훌륭하다. 하지만 수육은 별로였다.  /양무침 최애메뉴! 맛은 있는데.. 위생에 좀더 신경써주셨으면 ㅠㅠ/양무침을 처음 접한 사람에게는 어려움. 하지만 일행들은 정말 맛있게 먹음. 모듬전은 적극 추천. 양도 많고 정말 맛있음. 탕류는 양곰탕보다 육개장을 추천. 양곰탕에는 선지포함되어있음./육개장 맛있어요/이집 육개장이 참 맛있어요 비빔밥도 맛있어요 비빔밥이 국물은 육개장으로 달라고 하면 둘다 먹을 수 있어요 무엇보다 건더기 양이 정말 많습니다b/양무침, 양곰탕, 육개장 다 맛있음. 대신 양에서 잡내가 조금 나기 때문에 역한거 못 먹는 사람들은 피하는게 좋을듯/양곰탕 선지 먹었는데 맛있음  밥을 다먹을 때까지 선지가 계속됨!/양곰탕먹었는데, 곰탕은 소소 밥은 쌀을 이상한걸 쓰는지 냄새가 나서 식욕이 떨어지네요./육개장에 고기와 파가 듬뿍 들어가있습니다. 별로 맵지 않아서 좋네요. /육개장에 고기와 파가 가득 들어있어 고기만 건져먹어도 배부를 정도. 맑은 육개장. 파도 달아서 맛있게 먹음. 단점은 할아버지 손님이 많아서 엄청 시끄러웠음/고사리랑 토란 있는 육개장 좋아하시는 분들은  근처에 있는 이화수육개장 드시기를~~ 왕 고기와 왕 파 들어있는 육개장이고,  익숙한 맛의 육개장은 아닙니다.  /고기맛 대파맛이 강한 맑은 육개장!/육개장 국물이 짭니다."
2,남포면옥,서울 중구 을지로3길 24 (우)04522,냉면,"냉면,온면,비빔냉면,한우어복쟁반 (소),한우불고기 (150g),한우수육 (소)",24833,2.8,165,236,"1. 어복쟁반- 소세지맛나는 고기가 있어서 호불호 갈릴듯.난 너무너무 불호ㅜㅜ 다른 소고기 역시도 고기냄새...ㅠ 하.. 샤브샤브를 먹는게 더 나을듯한 맛인 가성비 꽝!  2. 냉면 - 평양냉면 두번째인 나에게 참을수없는 향수냄새 같은 것이남....그전에갔던집에서는 잘먹었었는데 평냉매니아인 일행이 그건 메밀향이라고 하였으나 여긴 향이 조금 강하다고 하였음....더보기/을밀대 좋아하는 입맛인데 냉면은 노취향이고 육수가 너무 너무 맛있었습니다... 잊혀지지가 않네여;; 갈비탕 존맛일듯/냉면,한우수육주문했습니다 냉면은 국물이 슴슴하고 단백한 맛 없이 물같아서 너무 아쉬웠습니다.  반면 한우수육은 너무맛있었어요 달콤한간장베이스에 조려져서 간이 딱맞고 밥과먹어도 맛있게 먹을수있는 맛이었어요./하나도 아까운 집 갈비탕은 동네 김밥천국정도 냉면은 진짜 맛없는데 나오는데 30분넘게 걸림.. 왜 미쉐린 맛집이라는지..; 우래옥이 훨씬나음/맛있어용 근데 넘 돗대기시장같아서 아쉽네요ㅠㅠ/솔직히 여기 평양냉면은 아쉽다. 어복쟁반이 맛있다고 한다. 유명해서 대통령들 사인 있다./평일 점심에 방문했는데 직원들은 친절하다. 음식은 전반적으로 달았다. 그외엔 무난무난. 만두가 작은 알로 여러개가 나와서 먹기 편했다는 점은 나름 장점. 대신 아무래도 육즙은 적다./1/19  만둣국 국물이 갈비탕 국물입니다! 제 스타일이라서 너무 맛있게 먹었습니다 !  1/20 너무 맛있어서 2번째 방문 !! 평양냉면을 좋아하는 저로서는 육수 맛이 예술이었습니다! 특히 동치미는 진짜 인생 먹어본 동치미중 제일 맛있네요. 평점 5 주겠습니다. 직원분들도 너무 친절합니다.  1/25 온면은 비추천입니다ㅜㅜ/냉면이나 어복쟁반이 깔끔하고 좋긴한데 가게가 오래된만큼 청결하다는 느낌은 살짝 떨어집니다. 직원분들이 나이가 있다보니 친절한 느낌은 없어요..  그리고 그날따라 가게 들어가자마자 나이지긋한 직원분들이 큰소리내고 홀안에서 다투셔서 ;;;; 마음이 불편해서인지..그것 또한 음식맛에 영향을 미친것 같아요.   /콩이 제일 맛있네요!   미쉐린 콩 맛집 인정합니다~!  /음..맛은 있어요 근데 면을 젓가락으로 덜어먹을 때 긴 면을 잘라 먹고싶어 가위를 달라 요청드렸는데 왜 필요하냐고 물으시며 자기네는 메밀면이라 잘 끊긴다고 그냥 드시라고 하더군요..음식에 대한 자부심이라고 이해해보려 했으나..불친절과 오만함이 가득한 행동이 아니었나 생각합니다./인생 처음이자 마지막 평양냉면/평냉치고도 많이 밍밍한 냉면! 만두랑 먹으면 맛있음 불친절하다는 리뷰많았는데 제가 간 시간대는 한가해서 그런지 엄청 친절하셨어요 /호불호가 있을수 있는 맛이입니다. 육향보다 동치미 향이 강한 평양냉면인것 같습니다. 면 육수 모두 훌륭했습니다. 직원분들도 친절. 다만 적은 인원으로 홀서빙 돌리느라 너무 바쓰신거 같음. 고기집 후식 냉면이나 공장육수를 좋아하는 사람들은 이집 냉면이 안맞을수 있습니다. 물론 저는 냉면이라면 다 좋아하지만 특히 평냉을 가장 좋아합니다./어복쟁반 강추...가격이 세긴 허지만/추억?(기억의 조작)/국물이 정말 싱겁네요.  동치미가 아닌 거죠? ㅋㅋ /기다린 순서도 안지키고 불친절함/잘모르겠어요.. 그래도 육수는 진한듯?갈비탕이 더 맛있을듯 저는 냉면먹음/냉면때문에 맛집은 아닌듯하다/물냉면하고 접시 만두 먹었습니다.  냉면 굳. 만두는 후추 때문에 내 스타일 아님.   그보다 심각한 건 직원 서비스.  다른 테이블은 동치미 바로 주고. 냉면 시키면 식초랑 겨자 주는데,  우리는 끝까지 셋 다 주지 않음.  자기들끼리 하하호호 잡담.  손님이 아니라 불청객 된 기분.   미쉘린 등지 되면 외국인도 많이 올텐데… 부끄러운 수준. /동치미국물맛이 강한 평양냉면 동치미국물 마시는 맛으로 시원하게 먹을만한다 양은 우래옥보다는 적은편/평양 냉면을 20여년 전에 처음 먹은 곳.   이 곳의 장점은 동치미에서 나오는 특유의 냉면 국물 맛. 그르나... 동치미 재료의 품질 변화 때문인지, 때에 따라 변하는 국물 맛 때문에 이 집이 평양냉면 1급 수준 카테고리에 들어가지를 못 한다. 다른 곳들 대비 냉면의 절대적인 품질과 처별적 완성도가 높아서 더욱 품질의 들쭉날쭉함이 아쉽다../직원 교육 다시 시켜야할듯. 좌식룸에서 먹었는데 직원이 방문앞에 냉면 3그릇 쟁반 두고 그위로 발 넘어 룸안으로 들어와 냉면 전달 ㅋㅋ 식당에서 밥상위로 발 건너는 사람이 제정신일까요? 집에서도 안그럽니다. 냉면도 그다지..유명맛집(?) 한번 가본 경험으로 땡칠듯/이게 75000짜리 맞나 고기 직원들이 다 빼먹었니/아..3.5점을 믿을껄..ㅜㅜ 13000원이라고는 절대 믿을수없는 면발과 육수맛.. 평냉이 원래 삼삼해도 이건 너무;; 근처 분식집을 가시거나 맥도날드로 가시기 바랍니다. 미쉐린가이드.....풉 그리고 식당복도에서 화장실 냄새 났어요ㅜㅜ/12000원 갈비탕.  딱 저만큼 들어있습니다  국물안에는 약간의 당면, 파,버섯.  결론: 집에서 비비고 드세요./먹을만한건 육수와 김치 입니다./여기 진짜 맛있었어요 강추!/굉장히 심심합니다. 근데 요즘 현대인들이 워낙 간을 많이 넣어서 먹다보니 심심하게 느낄 수 있는데, 원래 평양냉면은 간이 거의 안되어 있다고 들었거든요. 식초랑 겨자 넣고 싶었지만, 오리지널 그대로 느껴볼려고 계속 먹었는데, 은은하게 베어있는 고기육수는 느껴지더라고요. 근데 면발은 좀 아쉬웠습니다./평양냉면같지 않은 평냉… 너무 달고 별로에요. 제 기준 진미평양냉면, 서관면옥, 우래옥이 훨씬 맛있어요. 을밀대도 굳/밑에 점수 낮은 평점들 완전 공감"
3,청키면가 무교점,서울 중구 다동길 33 효광빌딩 1층 (우)04521,중식,"새우완탕면 (소),완탕 (새우만두 5pcs),초이삼 데침과 굴소스,짜장로미엔,소고기 조림",7600,3.7,77,94,"뭐야 새우완탕 시킬걸 완자 엄청 탱글탱글하네;;;/볶음밥 추천. 새우완탕면과 치킨은 비추./볶음밥 쌀이 안남미라서 외국에서 먹던 맛이 있네요. 완탕면은 아직 익숙하지가 않음../완탕면이 너무 먹고 싶었는데 맛있게 먹었어요~/가끔 새로운 국물맛을 원하면 먹을만 함.  하지만 성인남자인데  새우완탕면+새우완탕튀김 먹었는데도 금방 배가고픔./새우완탕면, 수교 먹을만함. 짜장로미엔 별로. 토요일엔 볶음밥 안됨(토요메뉴판 따로 있음). 직원 불친절. 주방에서 매우 큰 소리로 싸움./음.. 볶음면만 맛있음/먹은것: 새우완탕면, 짜장료미옌과 수교  면이 꼬들한게 인도네시아쪽 꼬들한 컵라면 면보다 더 탄탄하고 꼬들한 맛이에요. 완탕은 국물에서 우려나오는 맛이 있었는데 자주 먹고싶은 정도는 아니였고, 수교는 단단한 맛이 있었습니다. 짜장로미옌과 수교 메뉴는 완탕면의 국물, 수교가 따로 나오고 고기와 소스에 국물없는 면을 말아먹는 맛이였는데 단짠과 고기에서 깊은맛이...더보기/완탕면 먹으러 다니다가 가지볶음에 반해서 요즘엔 가지볶음때문에 가요  볶음밥도 정말 맛있어요/면의 식감이 호불호가 있을 수는 있겠지만 완탕이 너무너무 맛있어서 놀랍네요...!/홍콩 현지의 맛 그대로 느낄 수 있고, 여러 가지 소스맛이 특히나 인상이 깊습니다!! 집 근처였음 생각날 때마다 가는 건데 ㅎ/완전 비추 비싸기만 하고 돈""아까워서  한번 가고 절때 안감 아무 맛도 없더라  /맛은 그냥 저냥 괜찮게 먹었는데 좀 불친절... 말없이 툭 던지고 가시네요.../음식 맛은 나쁘지 않았으나, 다 먹어갈때까지 같이 시킨 음식이 나오지않아 한참을 기다렸습니다. 언제 나오냐고 물어보니 그제서야 아~그거 금방 해드릴게요~ 라고만 해서..유쾌하진 않은 경험이었습니다./최고예요/완탕은 사랑이죠. 홍콩을 못가는 코로나 시대에  유일하게 한국에서 홍콩 여행의 향수를 느끼게 해주는 곳./홍콩에서 먹던 완탕이랑 꽤 비슷해서 놀랐어요. 제가 갔을때는 직원분들 다 친절하셔서 기분좋게 먹고왔네요. 가격은 좀 비싼감이 없지 않아 있어요/점원들이 배달오신 라이더분 험담함...한푼이라도 더벌려고 저런다고. 손님도 욕할까봐 놀라서 먹다말고 나옴./새우완탕 너무 맛있었어요! 소고기보다 새우 추천합니당/사람 별로 없는데 불친절함/보통 제일 유명한 면 식감 진짜 특이하고요  볶음밥은 밥을 하나하나 뒹구는게 제가 좋아하는 그런 아이는 아니었습니다/가격대비 양은 적음 ㅋㅋㅋ 근데 맛있어서 가끔 가게되네여/혼자 가서 먹었는데, 맛있었습니다! 완탕면 식감이 특이했어요. 독특한 맛도 났었고, 혼자 가서 식사해도 부담없었습니다:)/이 가격에 먹을맛은 아닌것같은...  /새우완탕, 청키볶음밥  맛있게 먹었네요.  볶음밥은 보슬보슬한 전통 볶음밥 스타일   완탕국물도 깔끔하고요.   담에 또 올께요/양이 많지는 않아도 면요리 밥요리 딱 맛있게 먹음/저같은 돼지를 배불리기엔 양이 적습니다 그치만 맛은 음~ 나쁘지 않아요/맛있어요 먹어도 먹어도 생각나는 맛/不错啊/혼자 밥먹으러 갔었는데 맛있지만 생각보다 양은 적었어요../꼬독꼬독한 면에 말린새우향 가득한 국물이 좋았다. 하지만 가격은 조금 높은듯..../새우완탕면과 소고기 로미엔이 맛있음. 근데 전체적인 가성비가 항상 아쉬워서 한 번 가면 한동안 안가게 됨./정말 맛있게 먹었습네다/맛이 아쉬움 "
4,무교동북어국집,서울 중구 을지로1길 38 (우)04522,"해물,생선",북어해장국,8500,4.4,117,159,"뽀얀 육수가 깊은 울림으로 해장시켜줌/진정 서울의 맛/북어국 정말 맛있게 먹었어요~! 가성비 짱~/역쉬  여긴  존맛탱이죠/해장을 왜 하는 지 알겠어 - 22.02.10/북어국을 별로 좋아하지 않는데도 맛있게 먹었어요..! 따듯한 국물이 먹고 싶을 때 종종 생각날 거 같아요./약간 비싸지만 단순한데 깔끔하고 개운해서 자꾸 생각나는 맛. 점심시간 직장인들 줄서서 기다리는 엄청난 회전율. /깔끔하고 맛있어요. 밑반찬등 재료도 중국느낌 안나고 집밥같아요./최고!!/역시 잘되는 집/이미 유명할대로 유명한 노포인데 참 친절하시네요. 북엇국도 물론 맛있었고 리필도 해주셔서 배불리 잘먹었습니다./인생 북엇국 !!! 너무 맛나게 먹었습니다!/맑고 깔끔한 북어국 북어가 딱딱하지 않고 부드러워요 양도 많고 같이 나오는 밑반찬 오이지무침+부추무침 맛있어요 국물이랑 건더기 밥 모두 리필되는 친절하고 맛난곳 포장도 가능하며 밥빼고 포장시 국물도 더 많이주심 오래가고 장사 잘 되는 이유가 있는집 무교동 근처오면 꼭 먹습니다 토요일에 오후 3시까지만 영업해서 아쉬움 ㅠ/무한 리필 되는 진한 국물의 북엇국과 잘 어울리는 밑반찬들ᆢ그리고 비벼먹는 새우젓과 초란을 알로 부르는 정겨운 집/인생 북어국!!!!!!/나오자마자 바로 찍어서 국물만 있는 것 처럼 보이지만 북어 살도 두툼하고, 두부도 들어가있어요! (국물에 비해 건더기가 조금 부족(?)한 것 같지만)진국이예요.. 너무 맛있어요! 슴슴하지만 진해서 본연의 맛을 더 느낄 수 있었어요! 싱거우신 분들은 새우젓을 넣으면 됩니다! 배추김치, 부추김치, 오이지도 맛있습니다! 하지만 주방에서 리필을 해주시는게 아니라,...더보기/사골국물로 우려내서 그런지 맛있네요./전통 북어국의 맛   막 줄서서 먹을 정도는 아님/국물양만 많음  맛있는데 후추맛이 강함/너무 시원하게 잘 먹었어요. 지금은 8천원이고 오이지랑 부추무침 배추김치 같이 곁들어 먹으니 너무 좋고 새우젓 넣어 먹으니 그거대로 너무 맛있네요. 먹고 시간 지나니 국밥 먹은 것 처럼 입이 쩍쩍. 사골들어간 게 맞네요. 시원 깔끔. 서울 여행하면서 맛난 점심 먹었네요./북어국 참 시원하네요~/최고. 오이지가 신의 한 수/진하지만 깔끔한 육수때문에 괜시리 해장하는 느낌? 그리고 북어 살도 도톰해서 좋았어요~/속이 편한 걸 넘어 완전히 흐물흐물하게 풀려 버리는 마법! 술 먹은 다음날 가면 해장을 넘어 나를 완전히 새 사람으로 만들어준다./약간 떡국같은 질감있는 국물에 감칠맛과 후추맛이 북어맛보다 더 강하게나면서 북어의시원함도 꽤 잘느껴지는집. 메뉴가 하나뿐이라 앉으면 30초안에 나옴...햄버거보다 더 빠름. 개존맛의 느낌은아니지만 서울한복판에서 가격대비 꽤좋음ㅎ/대단한 맛 아닌데 깔끔하고 구수해서 부담 없이 든든한 느낌/속풀리는집~~근데 점심시간에 사람이 너무 많아요  ㅠㅠ/국물 진하고 해장하고 싶을 때 생각나는 집 점심때는 항상 줄서 있지만 단일 메뉴이기 때문에 금방 나옴/북어국 안 좋아하는데.. 몸 으슬으슬 할 때마다 자꾸 생각 나. 마성의 북어국집. 좋은 재료를 쓰는 게 느껴짐.  국물 안 좋아하는데 이 집 국물은 자꾸 드링킹 하게 되는.. 진짜 맛집./세시마감임 수정좀 해주세요 모르고 간사람들 헛걸음 합니다 /개운해요 메뉴 한개라 빨리나오고요 /맛은 평범하지만 빨리나와서 좋았어요/기대가 커서 그런지 제겐 평범한 맛이였어요 먹어본걸로 만족해요:)/맛은 말할 것도 없고 홀에 계시는 분들도 척하면 척이다. 언제가도 기분좋게 한그릇 뚝딱하고 나올 수 있는 집. "
