,name,address,sort,menu,mean_price,score,people_give_score,review_count,review_list
0,성천막국수,서울 동대문구 답십리로48나길 2 1층 (우)02614,국수,"제육 반접시 (80g),물막국수,비빔막국수,물막국수+제육 (45g),비빔막국수+제육 (45g)",7700,4.0,90,96,"너무나 맛있어서 기분이 좋다~ 개취로 막국수 별5는 고기리막국수, 우이동 춘천막국수 이후 처음~ 호불호가 확실히 갈릴 수 있는 맛 인데, 개인적 취향 최고 좋을 호~ 무 짠지 찬과 그 짠지로 만들어진 물막 육수에서 가장 호불호 갈릴 듯.  면, 일반 막국수 면 스타일로 메밀껍질 위주의 면이고 좋은 맛이다.  무 짠지, 완벽히 숙성되서 진하게 쿰쿰한 맛있는 ...더보기/선주후면의 성지/자극적인 막국수 좋아하면 먹지 말고 평냉 좋아하는 사람은 먹어보세요/한번쯤은 먹을만하나 굳이 찾아올정도는 아닌듯 비빔 양념이 다대기 느낌 면이 매력있음/물 비빔 같이 먹어보시길! 대중적인 맛은 비빔인데 진짜 별거 없는 맛인데 물에 계속 손이 가요 고기는 양이 진짜 작음 ㅠ 물막은 막걸리랑 비빔막은 고기랑 조합이 좋습니당! 평양냉면은 안좋아하는데 사람들이 뒤돌아서면 먹고싶다하는 그맛 저는 여기 물막국수였어요/그냥 심심  왜 맛집인지 이해안감/맛의 깊이가 다른곳입니다. 이런곳을 알게되어 영광이었습니다. 부디 이맛 그대로 오래오래 장사해주시길/고기 잡내 조금 나지만, 막국수는 그냥 도른자/이런 곳에 맛집이?!? 물은 안 먹어봤지만 여긴 비빔이 찐일 것 같아요 비빔면 되게 뭐 안 들어있는데 되게 맛있어요 대체 뭐지? 가끔 생각나는 맛…  고기랑 같이 먹으면 존맛탱탸양ㅌ앵/몇번째 방문인지 모르겠네요 ㅎㅎㅎ 꼭 한번 드셔보세요. 토요일은 브레이크타임 없이 운영하십니다. /제 입맛엔 좀 아닌듯... 고기만 맛있게 먹었어요 함냉 좋아하시는 분들한텐 안맞아요 평냉 좋아하시는 분들은 좋아하실거같은데.. 물막은 그냥 맹물, 비막은 참기름맛... 공영주차장도 한시간 대납해준다더니 30분치만 주고ㅡㅡ 너무함./레전드 of 레전드 돌아서면 생각나는 맛/신기한 맛이에요! 가끔 생각납니다./매력있는 면요리/그냥 면과 양념 면과 육수 끝. 무랑 먹어야하는데 뭐를 먹었는지 기억안남. 우리 평냉 덕후인데… /막국수 맛을 정의하는 곳.  호불호가 갈리는 이유는 마라탕, 평양냉면의 특성과 유사합니다. 결국 나중에는 생각난다는 뜻.  다른 막국수 먹으면 성천이랑 비교하게 됨. 절대 상위 기준입니다.  *평양냉면이 싫다면 비빔 막국수로 드세요./물보단 무조건 비빔을 먹어야하는 곳 수육도 야들야들 순삭 가격 저렴/맛있습니다. 가격도 싸고 전 자주 갈거 같아요/아주아주 맛있습니다./헐 이건 뭐지?  물막을 주문했는데,  맑은 국물에 덜렁 면만 있네요 달걀도 없는 고명도 없는 ... 돌직구 국물을 마셔봤습니다 짭짜름하고 곰삭은 동치미 국물 면을 먹어 보았습니다 마치 쫄면+소바를 먹는 듯한...  근데 계속 먹게 됩니다 이건 어른맛이군... 하면서 둘러봤는데 젊은 손님이 더 많네요 . 막국수 매니아가 처음 맛보는  막국수 입니다 다음에 ...더보기/뭐 때문인지는 모르겠으나 흡입하고 있는 나를 발견. 같이간 일행은 남겼음. 남긴거 내가먹음./처음 먹을땐 뭐 그냥 그런...이라고 생각하는데 계속 생각나는 희한한 매력의 막국수집/비빔막국수 먹으러 가는곳인데 달지않은 유니크한 맛이라 좋다.  다만 마스크 안쓰고 술쳐마시면서 소리지르는 정신병자들은 좀 쫓아냈으면 함. 저녁에가면 한무더기씩 있음/물막 먹었어요 평양냉면을 좋아해서 이것도 제입에 맞네요 별거 안들어간 동치미국물이지만 담백하고 시원해요 짠지랑 먹으면 꿀맛 수육도 맛났어요 다만 저와 신랑은 이런 슴슴하면서 시원한맛을 좋아하는데 사람에 따라서 맹맛이나 이상한맛으로 느낄수도 있을거같아요 호불호를 좀 탈것같네요  사람들이 줄서있곤 하지만 회전율이 빠르고요 주차할곳이 따로 나와있는데 자리가 별로...더보기/성천은 비빔에 제육한쌈과 무한개를 먹으면 고소달달 짭쪼름 우선드시고 겨자나식초 넣고싶으면 넣으세요! 저는 본연의 메밀의 고소함강추/여긴 평점이 상당히 높은곳이라 많은 기대를 하고갔는데.. 일단 반도 못먹고 나왔어요  100%메밀면을 좋아하는데 여긴 밀가루성분이 너무 많이 함유되어있구요  동치미국물이며 짠지가 너무짜서..물을 석어어찌먹으려고 했는데 면반죽에 소금이많이 들어갔는지 면도 너무짜서 못먹겠더라구요. 용인에 있는 고기리처럼 순메밀에 평양냉면식 막국수를 생각하고 왔습니다. 그렇다고...더보기/식당이란 이런곳! 무짠지의 그 삯은 깊은맛 잊지 못합니다. 오래오래 해주세요 /단순하면서 핵심(!)있게 맛있는 집  /맛잇어요/오늘 저희 부모님이(82세78세) 두분이 식사하러 가셨습니다 나이드신 어르신들이라 원래 없던 브레이크 타임이 생긴지 모르시고 2시40분에 방문하였습니다. 미리 말씀안해주시고 주문받고 음식 내주고 그러는 사이에 시간은 지났을텐데 3시부터 브레이크 타임이니 3시까지 먹고 나가라니 먹으라는건지 말라는건지  거기다가 고기에서 냄새나고 육수가 쉬어서 말했더니 사장님...더보기/맛 있음. 근데 호불호 갈릴거같아서 별은 네개. 시고 매콤한 막국수랑 다르게 다데기가 잘 숙성된맛/몇년전 처음 갔을때 우웩 이게 뭐야 했는데, 지금은 중독이 됐습니다. 2주 이상 지나면 금단현상...^^"
1,스시코야,서울 동대문구 황물로 42 (우)02593,"초밥,롤","런치 오마카세,저녁 오마카세",34000,5.0,7,26,"이 가격에 가지 않을 이유가 없을만큼 너무나 만족스러운 식사를 선물받은 날이었습니다.   쪽파나 참깨소스, 영귤소금과 같은 포인트로 식감과 향 그리고 감칠맛을 끌어올려줘 다소 익숙할 수 있는 재료마저도 진부하지 않게 느껴지고 등푸른 생선 특유 비릿내가 고소한 생선 기름으로 느껴질만큼 네타에 상당히 공들인 느낌이 큽니다. 제법 간간했던 샤리는 간도 좋고, 젓...더보기/오마카세 경험이 많지 않지만 이런 가격에  이런 퀄리티는 흔하진 않은거같다 최고 진짜 친절하시고 맛있음 ㅠㅠ/대존맛/이 집 잘함 제가 보증합니다/맛있어요. 만족스럽게 먹고 나왔어요.  다음에 또 갈께요 !/아니 이가격에 이런 밸런스라니 답십리 최고의 맛집이라 자부한다./오마카세로 바뀌었는데 인테리어도 깔끔하고 식사도 깔끔하게 잘나와요♡  다만 주류가 하이볼이나 잔술 할만한게 없어서 아쉬웠어요ㅠㅠ 그리고 안주삼을 요리보다는 초밥에 집중한 느낌이에요"
2,늘봄해물찜손칼국수 답십리본점,서울 동대문구 전농로 39 (우)02600,"해물,생선","낙지볶음,바지락칼국수,들깨칼국수,들깨수제비,해물낙지칼국수,해물전복칼국수",8500,2.3,34,77,별 하나도 아까운 이집 정말 지금까지 먹어본 칼국수 식당중 최악의 맛ㆍ바지락 해감이 제대로 안돼 이물질 씹히고 밍밍한 맛에 같이 주문한 팥칼국수 또한 한번도 경험해 보지 못한 맛ᆢ어떻게 이런 맛으로 돈받고 장사를 하는지 ᆢ오죽허면 일부러 이런 댓글 후기를 남길까ㆍ사장은 반성하시오/왜 별이 0.5개는 안되는걸까 /달기만 하고 양적어요 뻥 조금 보태서 아무것도 없어요 /해물찜 가격은 비싼데 가리비는 껍데기만 잇고 콩나물만 짠득 해물찜에 해물은 별로없고 껍데기만 잔뜩넣어서 나오는 집 너무실망 참고하고 가시길 /3번갔는데  소자 구성  전복 1  가리비1 새우3 꽃게 1 홍합 작은거 여러개  낙지 1  곤이조그만한덩이2개 아귀 살만있는거 1~2개 나머지 껍질뼈 등 끝   방송은 왜나왓는지 이해안감  갈수록 구성품이 형편없어서  3번까지 참았는데  담부터  안가려구요/맛. 좋아요/맛만 좋구만유 요청사항 뿐 아니라 양도 두배로 주시네요 감사하게ㅜㅠ 언제나 맛있게 먹슴다^^/종업원 불친절 해요  그래서  안가요 /오잉 난 맛있고 친절해서 자주 갔는데 여기 평 왜이러지/맛은 있어요 근데 종업원분들 다 말도 없이 음식 휙휙 던져놓고가요 일하기 싫으신것같아요ㅋㅋ 종업원한테 개무시 당하려면 가세요../가보면 별이 왜 한개도 아깝다는걸 알게되는곳/다~~ 중국산 중국산치고  너무비싸요 ㅠ /주인은 마인드가 바뀌었고 주방장은 그런 주인을 멀리 떠났나? 맛이 왜이리 된겨? 좋은것좀 쓰셔? 온통 수입산 쓰면서/검색해서 수유점갔더니 폐점이고 본점갔더니 반찬도 해물찜맛도 가격에 비해선 별루입니다. 괜히 갔네요~ㅠ/어머니 모시고 자주 가던곳인데 6개월전쯤 부터 맛이 변했습니다. 내용물도 뭔가 이것저것 빠진듯 싶고요 점점 안가게 되더라고요./와이프랑 어머님 모시고 오랜만에 방문했는데 맛이 바뀐것 같아요.  저만 그런게 아니라 모두 오잉??  몇달전에 포장해가서 먹은것은 괜찮았는데..  생각보다 손님도 없어진것 같고..  감칠맛이 사라졌고 고추가루 텁텁한 맛만..  저희 멀리 살아서 차몰고 갔던 곳인데  이젠 안갈것 같아요.. 참  아쉽워요~ 손구락 꼽을정도로 해물찜집이었는데.. /별 한개도 아까운 곳은 몇 년만에 처음입니다. 한시간 넘게 기다리고 음식구경은 못하고 나왔습니다.  어버이날에 전화로 문의까지 하고 오면 착석이 가능하다길래 가서 1시간동안 음식을 기다렸습니다. 손님이 많은 날이고 워낙 홀이 정신이 없어 그래도 최대한 웃으면서 기다렸고 오래 기다렸다고 말씀드리니 사장님께서도 확인 후 빨리 드리겠다고 하더라구요.   저희보다...더보기/최악의 음식점. 주인이 왕인곳. 직원이 주문누락해서 거의 한시간 후에 주문들어가도 당당한곳. 주문누락은 사람이니 할수있다고해도 주문이 늦게들어갔으니 빨리 해드리겠다고하는게 정상 아닌가요. 늦게 주문 들어갔어도 계속 기다리라고합니다 배달은 계속 나가고 나중에 온 팀도 음식받았는데 저는 한시간 넘게 기다리고 쫓겨나듯 나왔읍니다 /검색 하고 방송에도 많이 나왔다길래. 더운날 땀 뻘뻘 흘리면서 찾아갔습니다. 시간은 오후 5시가 조금 안되었는데 바깥쪽은 두테이블 손님이 있었고 신발을 벗고 올라가니 네팀정도의 손님이 있더군요. 빈테이블이 4인테이블 붙여놓은거 두군데하고 붙여놓은곳에 한테이블에 손님이 있었답니다. 전철역에서 내려서 걸어갔다보니 너무 더워서 에어컨 앞쪽으로 앉으려고 했더니 아...더보기/낚지볶음 양 많고 맛있습니다. 종각에 유명한 낚지집들보나 훨~~씬 낫습니다. /중짜가 다른곳 대짜 사이즈 맛있습니다/할머니 생신 기념으로 멀리서 포장해갔는데.... 낚시줄비슷한게 나옴. 바늘이라도 있었으면? 해산물 검수안하고 세척안하는구나 라는 생각듦 오늘로 갈아타야겠음 늘봄 ㅃ/맛있는 해물찜 맛녀석들이 다녀갔네~~^^  /생생정보 소개 천연양념 산더미해물찜 연매출 26억이라네요..
3,갈비명가이상 답십리점,서울 동대문구 천호대로 327 (우)02622,갈비,"추천,260,000,궁중갈비 한상,궁중갈비2대(300g),기본반찬6가지,삼색찬,모둠떡,잡채,냉면또는공기밥,75,000,52,000,이상 궁중갈비(300g/2대),이동갈비 (300g/4대)",51333,2.0,23,35,"넘 비싸고 넘 맛있어요,,,,/돈이없어서 1인분만 시킨게 아니에요 남자직원님 맛이 궁금했을뿐.. 말을 참,,, 드실수있겠어요? 그게 맞나요? 다른직원들도 불친절하고 사장부터 마인드가 글러먹었는데.. 에휴 /돼지갈비 먹으러 갔는데 큐알이랑 체온 다 체크하고 자리 앉아서 돼지 갈비 시킬려니깐 다나가고 없다고함 ㅋㅋㅋ 저녁6시반에 갔는데 어이가 없어서 걍 나옴/후기 안 좋아서 걱정했는데 우려했던거에 비해서 맛있고 엄청 친절하셨음!!! 그리고 종업원분 성희롱하는 아저씨들 재수없음. 으 나이값 못하고 가정도 있는 것 같던데... 어쨌든 식사 맛있게해서 좋았습니다./한우 특선 모둠 - 가격은 또 올렸는데 양은 그렇다 치고 맛은…  한우 고유의 감칠맛과 고소함은 전혀 느낄수 없고 질긴 기름 덩어리는 또 뭐임?? 조용히 뱉어냈음 ㅠㅠ /런치 세트나 메뉴가 더 나은듯 저녁에 먹기에는 이정도 주고 먹어야되나 생각 규모가 이정도인데 준비가 안된고기가잇고 룸을 잡앗는데 위에 등이 안들어옴 수리를 못햇다 어쩔수없다 어이없음.. 룸도 못바꾼다해서 그냥 먹을랫는데 일행이 해결해 달라고 다시 요청하니 전구 교환해줘서 해결됨.. 고기구워주고 그런 서비스는 좋았으나 나머지 대응이 미흡함/뭐 이딴곳이 다있나 모르겠네 주문한지 20분이 지나도 식사가 안나와 물어보니 주문도 안넣었네 다른 사람들 다먹고있는데 개판이네 다시는 안간다/제정신인가/코로나 나온곳/지금코로나 확진자나왔다고 재난문자 날라오는데 아직도 영업중？/점심정식은 나름 괜찮고 먹을만함!/비싼 메뉴인 한우를 먹을게 아니라면 미국산이라도 대표메뉴인 궁중갈비와 이상갈비를 적극추천. 생갈비는 기대만 못한듯. 직원분들 매우 친절하고 시설도 깔끔함. 발렛직원분도 친철하심!/비싸고 불친절 다신 안감/맛이 평범한데.. 비쌈 8시에 가면 1+1/별하나도아깝네요...이상갈비직원분들 상전이네요.난서빙의권위가 그리높은줄 몰랐습니다.. 지인들과 만남의자리라 말도못하고 참았네요! 너무나도달라진 반찬에 정말손갈곳도없어지고  직원에게 전에나온 반찬이 더나았다고애기하니 기분나쁘다는듯 ""본사에직접애기""하라는  성의없는대답에 또한번깜놀했음.... 아무리 연말이라지만 인테리어바꾼후 단골(동네 주민들이자주가는곳)인데 ...더보기/오늘 점심때 부모님 등 모시고 식사했는데요. 사실 아래 덧글들 때문에 걱정했지만 위치 등등으로 인해 예약하고 다녀왔는데 전 서비스 진짜 잘받았습니다. 수고비나 팁얘기도 있는데, 공식적으로 안받으시더군요. 드리려고 해도 거절하셨습니다. 물론 직원마다 차이도 있고, 룸과 테이블 차이도 있을 수 있고 손님이 몰리고 등등 케이스는 있겠으나, 토요일 점심시간에 손님...더보기/별 안주고 싶은데 지워지질 않네요, 우리가 늦게 먹는편도 아닌데 중간에 와서 집게로 고기를 막 휘저으며 왜 이렇게 빨리 못먹느냐, 소고기 잘 먹을줄 모르냐며 신경질 부리듯 하는데 깜짝 놀랐어요! 비싼돈 주고 고기 먹으러 왔다가 야단만 맞고 가는 기분이었어요!.. 정말 다신 안가요!!/북악정부터 지금은 잆어진걸로 알고 있지만  정릉 이상갈비를 오랜동안 이용하다가  답십리 이상갈비를 최근 몇번 이용했는데 아주 최악이네요.. 45만원이라는 음식값이 너무 아까운 하루였습니다.. 비싼 쇠고기는 다 태우고 연기가 자욱하고.. 서비스는 엉망이고 수고비 준것 돌려봤고 싶네요.. 이건 뭐~~ 지인들 많이 이용하는데 홍보 많이 해야겠네요.. 쩝쩝../여긴 음식점의 기본이 안되있네요 손님들 모시고 가서 욕 먹고 뭔 이런곳이 다있는지 사람을 더 쓰던가 장사를 하지 말던가 음식 주문 부터 서빙이 먼저 아닌가요 계산은 빨리 하더만... 음식도 달아서 맛도 없고/팁 찔러줘야 친철하려나 봅니다. 고기 구워주는등 마는등 티슈를 던지질 않나.../이틀연속 디너세트 먹어봤는데 친구랑왔을때 가족이랑 왔을때 대우가 다름 가격대비 고기질도 그렇고 서비스도 그렇고 별로임"
4,삼형제김밥 본점,서울 동대문구 전농로11길 65 1층 (우)02540,분식,"원조유부김밥,꼬마유부김밥,참치유부김밥,치즈유부김밥,모듬유부김밥",3700,5.0,9,9,너무 맛있는데..밥도적고 재료 팍팍 넣어주셨는데요! 무엇보다 사장님이 너무 친절해서 감동적이었어요 카카오후기 처음남겨요...그만큼 친절!!/청량리역에서 먹은 김밥이 너무 맛없었어서 기대를 안했는데 본점 김밥은 진짜 진짜 맛있네요! 맛이 완전 달라요... 청량리역도 좀 어떻게 관리를 해주시면 안될까요ㅠㅠ/테이크아웃만 가능한듯요!? 넘 맛있어요! 밥보다 내용물이 더 많은걸 선호하는편인데 딱이에요 유부의 고소함이 찰떡이여서 오히려 부담없이 먹기 좋아요~ 김밥 속재료 계란은 두툼하고 단무지는 많이 달지않고 얼큰장아찌는 라면이랑 먹어도 좋을것같어요! 사장님들께서도 완전 친절하시고 바로바로 만들어주시는게 좋더라구요~ 답십리 맛집 인정입니다. 적게일하고 마니버세요!!/밥보다 내용물이 많은 김밥을 좋아하는데 삼형제김밥이 딱 제 취향이에요! 사장님도 친절하시고 김밥도 너무 맛있습니다~ 가격도 이정도면 저렴해요! 다만 와사비참치가 제기준엔 너무 매워서 다음엔 덜 넣어달라고 부탁드려야겠어요~ /산책중에 들렀는데 정말 맛잇었어요~!!!!! 올해 먹엇던 김밥중에 제일 맛잇었네요:-) 행복한 맛이랄까요? 또 먹고싶어져요~~~/사장님 그냥 친절 그자체 김밥은 말할것도 없어용ㅠㅠ!!!!!!/최애 김밥입니다. 와사비 김밥 한번 먹으면 잊을수가 없습니다.  지난번에 코코와 동네 산책중 발견한 김밥빌딩. 사장님께 들은 얘기론 1층은 매장 2층엔 조리실 3층엔 체인본부사무실 이라는군요.  우연히 먹어보게 되었는데 정말 맛있었습니다. 위생도 철저하시고 아들 셋키우시는 여사장님 음식 솜씨라 최고입니다.  저희 동네에 계셔주셔서 감사합니다. 저는 와시비 ...더보기
