,name,address,sort,menu,mean_price,score,people_give_score,review_count,review_list
0,당산빨간주꾸미,서울 영등포구 당산로45길 7-2 1층 (우)07213,한식,"철판쭈꾸미,치즈쭈꾸미,삼겹쭈꾸미,새우쭈꾸미,오삼쭈꾸미,석쇠쭈꾸미",13166,3.8,21,41,"당산동 최고의 맛집/너무 맛있고, 점심특선은 가성비 너무 좋아요 ㅠㅠ 담에 또 방문할께요 !! /맛있고 쭈꾸미 생각보다 많이 들어있어서 아껴먹을 필요가 없었어요. 콩나물이랑 미나리는 무한리필이어서 많이 넣어서 먹는거 추천하며 마지막에 볶음밥필수입니다! 가게 내부는 꽤 시끄러워요. /노맛탱;;; 심각/맛있어요 볶음밥은 필수/존맛~~ 석쇠볶음밥 꼭드세요! 콩나물국에 콩나물 두개밖에 없어서 아쉬워용 /맛 평타 쭈꾸미 양에 비해서 가격이 비쌈 콩나물과 미나리로 배채우면 배부름/들어갔다가 나중에보니 맛집이였군 맛있다 ! 맵찔이들한텐 매울테지만 맛있음 테이블 따닥따닥인거빼곤 다 좋음 이 근처 갈 때 가면 괜찮을듯/코로나 19 . 철저히 큐알코드 사람마다 체크.^^ 맛도,  친절함도 별 5./가스 안나오고 덜익고 미안한 기색 전혀없고 어이상실/깻잎에 쌈무랑 쭈꾸미 싸서 먹으면 꿀맛/그냥그랬음/여기 사장님도 친절하시고 짱맛!!"
1,맨홀커피,서울 영등포구 당산동5가 43 당산센트럴아파트 상가B동 지하1층,커피전문점,스페셜티 커피(에티오피아 코케허니 G1 내추럴),5500,4.5,26,104,"시그니처 커피도 맛있고 따뜻한 분위기 넘 좋아요! 카페가 진짜 예뻐요/맛있고 분위기 좋은데 쩜 비싸/좋은 인테리어, 친절한 응대. 사람이 금방 몰려서 오픈시간 맞춰 가는게 좋은듯./Coffee/친구추천으로 찾아간 곳~ 인테리어가 예쁘고~ 음악도 좋고~ 책도 많네요~/직원분들 응대 방식 5++ 가격대 4 디저트 다양성 4 인테리어 분위기 4.5  한번 가볼만 합니다./비싸긴한데 맛 분위기는 좋음. 당산에 이만한곳 없음/뭐 안된다는게 많고  제한이 많아서 뭐 이런데가 다 있지? 했는데 추천대로 먹어보면 진짜 맛있음  갓구운 휘낭시에도 짱맛/너무 예쁜 카페 ! Christmas 분위기 물씬 ♡/1인 고객 응대가 아쉽네요 테이블이 다 커서 뒤에있던 2~3팀 먼저 보내고 기다리다 나왔어요 /인테리어가 참 이쁘네요  커피는 제 취향이 아니었지만 괜찮은거같아요  같이 주는 초콜릿이 맛있어요/인테리어에 신경을 많이 쓴 곳이라 음식에는 크게 기대하지 않았는데 커피와 디저트까지 맛이 좋았습니다./분위기 좋고 친절하세요!/분위기 아주 좋아요/동네에서 볼 수 없는 킹스맨분위기 카페에요ㅎㅎ 커피도 넘 맛있고 분위기와 친절함도 쵝오~! 저번 주말에 이어 이번 주말도 갔는데 대기하다 지쳐 다른 카페로 갔습니당 벌써 유명해져 대기가 기네요 흑,,/분위기 좋고, 진짜 나만 알고 싶은 곳이예요! 커피도 진짜 너무 맛있어요 ㅠㅠ/아무도 오지 마요.. 나만 올 거니까... 유명해지는 거 싫어ㅠㅠ/나만 알고싶은 곳!! 짱예ㅠㅠ 직원도 친절하고 커피도 맛있습니다ㅎㅎ/약~간 비싸긴한데 분위기 좋고 맨홀라떼 맛 좋았어요. 손씻으러 들어간 화장실 왕깨끗하고 직원분들 친절하십니다!! 생각보다 크진 않아요/당산에 뉴핫플인스타카페☕킹스맨세트장같고..커피도 맛있습니다..조금 비싼가격이 옥의티ㅎㅎ"
2,롱타임노씨 당산점,"서울 영등포구 당산로45길 13 2, 3층 (우)07213",피자,"롱타임노씨,당산에서 목동까지,사랑하기 좋은날,핫한 만남,길고 진한 우리",16300,4.0,26,161,"피자와 떡볶이는 적당히 맛있고, 감자튀김은 되게되게 맛있었습니다. 3층에 손님이 많은 편은 아니었는데 음식 나오는 속도가 무척 느리고, 코스요리처럼 나와서 아쉬웠어요./피자도 너무 맛있고 생맥도 너무 신선하고 좋아서 원픽 피맥집으로 자주 갔는데 지난번 방문시 손님이 너무 많아서 그런지 주문한 피자 하나는 너무 싱겁고 다른 하나는 페퍼로니에서 냉동냄새가 났어요… 재방문 해볼게요 초심잃지마세요:)/아주 깔끔하고 맛좋음 맛있어서 홀짝홀짝 마시다보면 돈이 뭉탱이로/요즘 이곳처럼 맥주를 각자 받아서(?) 마시는 곳이 유행인듯 하고 여기도 무난히 괜찮음. 피자도 맛있고. 금요일 오후 5시쯤 방문하였는데 알바분이 엄청 스무스하지는 않았던게 조금 아쉽/너무 느림/하프앤 하프에 추가 슈크림 크러스트 주문  피자로 유명한 펍 답게 맛있어요 피자가 짭짤하니 슈크림 크러스트가 단짠단짠~/잘먹고 가용~/맥주종류도많은데 관리도 잘되는느낌이에요/머리카락 나와서 치워달라고 했는데 그냥 치우기만 하고 아무런 피드백이 없어서 당황함/맛있다 근데 콜라가 없음 다음에 올때 콜라한병 가져오기/안주 평범. 맥주 가격이 좀 과하다....../여기 꼭 가셔야합니다! 이런 분위기 영화관 인줄 알았어요!!! 딱 커플이나 모임하기 좋은곳이에요 내가 원하는만큼 맥주먹고 계산하고, 불고기새우피자 먹었는데 이거 예술이네요 다만 하이네켄 먹고싶었는데 없어서 아쉬웠습니다. 하지만 29가지인가 다양한 주류가 있다하니 다음에 레드락 먹으러 가봐야겠어요!/친구가 집 근처에 괜찮은 맥주집을 발견했다고 해서 가봤습니다. 일단 들어서자마자 분위기가 깔끔해서 좋았습니다~  맥주 종류가 매우 많은데 10ml당 금액으로 조금씩 따라서 맛보고 제 입맛에 맞는 맥주를 적은 금액에 찾을 수 있다는 점이 가장 좋았던 것 같습니다~ 안주로 시킨 피자랑 감자튀김도 너무 맛있었습니다!  피자 이름들도 너무 귀여워요!ㅎㅎ 직원분들도...더보기/분위기도 좋고 피자도 맛있네요!!! 간만에 진짜 맛있는 피자 먹었네요 /피자 진짜 맛있고 맥주도 특이한거 원하는 만큼만 먹을 수 있어서 좋았어요~ 10분정도 만석이라 기다린건 쫌 아쉽고요"
3,당산원조곱창,서울 영등포구 당산로45길 9 (우)07213,"곱창,막창","곱(모듬)창 (250g),[곱창,대창,염통,벌집양] 이 같이 나옵니다.,27,000,양깃머리 (250g),대창 (250g),막창 (250g),김치볶음밥",20600,3.7,59,71,"냉국 새콤달콤 맛있음. 부추무침 싱싱함. 곱창이 엄청 통통?하고 맛있네요. 잡내없고 깔끔한 맛이에요. 간장소스 따로 요청해서 먹었는데 완전 맛있네요. 볶음밥먹을때도 살짝씩찍어먹으면 맛있는듯해요!! 벌집양?도 고소한게 전복?같은맛이고 맛있게먹구 갑니당!! :)/역시 원조입니다 ^^ 맛있어요!/맛있고, 간과 천엽은 신선해요. 하지만가격이 좀 나가기때문에 회사돈으로 먹고싶어요..ㅎ/최애…. 나는 왜 당산에 안사는가….. 맨날 먹고 싶은 맛이에요/여기 곱창 진짜 맛있어용 곱창 안좋아하는데도 종종 찾는 곳입니다 :) 곱창도 거의 다 구워져서 나오고 친절해서  기분 좋은 곳이에요~ 추천합니다/쫄깃하고 담백해요/맛집 추천!/곱창이 무슨 대창만해요 엄청 푸짐하고 맛있음  부추 달래 무침이 하이라이트.. 아주머니분들 너무 친절하시고 응대 빠르시고  왜 유명한 맛집인지 알겠어요  항상기분좋게 맛있게 먹고오는곳 번창하세요~!/평타. 곱창은.. 신림동 맛집 곱창집에서도 그랬는데 컨디션이안좋은지 넘 찔겼으나 막창과 대창은 쏘쏘함... 근데 원래 막창 대창은 비슷비슷해서 뭐라 말 못하겠음.  가격이 비싸 가성비는 나쁜듯/당산곱창집으로 최고에요!!/곱창 미쳐따리…. 너무 맛있어여~!!/피크시간이라 많이 시끄럽긴했는데 곱창집은 어딜가나 시끄러운거 같아서 감수할수있어요 ㅎㅎ 완전 맛있게 잘먹었어요~!!/와 찐맛탱... 곱창퀄리티 넘좋아여... 자꾸생각나네요  향긋하고 식감좋고 이모님들 친절하시고  ...!!! /생간, 천엽이 밑반찬으로 나오는 곱창집입니다 :) (리필도 가능!) 곱창을 주문하면 초벌해서 나와서 금방 먹을 수 있습니다. 대신 초벌하는 동안 좀 기다려야 합니다. 모듭곱창(1인분 250g, 22000원)을 주문했는데 다른 곳에 비해 양도 많고 곱창도 맛있었고 무엇보다 염통이 정말 맛있었습니다! 사진은 모듬곱창 2인분, 김치볶음밥 1인분 입니다. 성인 둘...더보기/곱창땡길때 항상 멀리서 가는집!!/이근처에서 최고입니다 곱창도 부드럽고 고소해서  한달에 한번 꼭 들리는 맛집입니다/아주 나쁘진 않지만 요즘 곱창집 맛잇는데가 많아서... 구태여 또가진 않을 것 같아요/느끼하고 불판도 더러웠고 서비스도 별로에요 옛날맛집처럼 생겨서 기대하고갔는데 실망이었어요/가격도 좋은것 같아요 생각보다 저렴~ 맛도 좋아요! 전혀 냄새안나고 곱가득한 곱창 느낄수있어요! 감자는 튀기듯 마지막에 먹는게 존맛 탱이고 부추 세번먹음 ㅠ부추절임존맛 ㅠㅠ 다녀와보세요들/너무 느끼하고 질기고.. 소스라도 좀 바꿨으면 어땠을지/질겨요/소곱창 좋아요/곱창 너무 맛있어요! /쫄깃하고 질기지 않고 너무 맛있었어요/웨이팅있어서 기다리고 먹었는데 더 맛있게먹었네요/먹어본 소곱창 중 젤 맛있었고 소곱창 싫어하는 친구도 좋아했어요 다만 첫입에 먹은게 좀 비릿했고 김볶밥은 그냥 쏘쏘였어요/평범하지만 그래도 찾게 되는집/정말 너무너무 마싯따.... 난 넘 마싯게 친절하게 잘머것눈데 평점 왜구로집 진짜 죤맛입니다ㅎㅅㅎ 파채 꼭꼭 구워드셈 ㅠㅠ/이사와서 한번먹고 맛없어서 원래도 안가려했지만 정리도 안하고 손님들 먹은거 치우지도 않고 다음날 아침까지 그대로 테이블에 있는거보고 소름끼쳐서 다신안감/곱창이 너무 질겼어요 ㅠ 곱창은 다 남기고 김치볶음밥으로 배채웠네요 가격은 싸지가 않던데..별로였어요 /웬만한 곱창은 다 맛있게 먹는데... 여긴 진짜 별로였음..ㅠㅠ 바닥도 기름기 때문이 너무 미끄럽고...ㅠㅠㅠ /기름 너무 튀고 맛도 별로/욕나오게 불친절해서 앉았다가 그냥 나옴   /너무 서비스를 막함. 계산서를 테이블에 던지고. 구워주시는분 손을 많이 탐. 잘못 걸리면 잘 못구워 주셔서 너무 찔겨짐"
4,오도시 당산역본점,"서울 영등포구 양평로 51 1, 2층 (우)07213","초밥,롤","생연어 (10ps),생연어뱃살 (10ps),참치 (10ps),연어덮밥,닭연골 가라아게",15400,2.5,41,136,"연어국수 먹고 싶었는데 가격폭등땜에 안팔아서 아쉬었어요 ㅜㅜ 회알못이라 회는 그냥 맛있었고 튀김이 굉장히 기름졌움니다/생강 덜어 담았는데 손이 찐득거려욧! 스시가 요리사가 아니라 그냥 한달 된 알바생이 쥔 것 같아용 ㅎㅎ 이마트 초밥 나무 접시에 담아놓으니 멋은 있네용 ㅎㅎ/가격은 좀 있지만 초밥 괜찮아요.  아이가 좋아해서 월 1회 이상 갑니다. 메뉴는 언제나 연어초밥10+광어초밥10개. 하루는 주문 시 와사비 빼달라는 걸 깜빡했는데, 음식 나온 후 당황하고 있으니, 먼저 와서 새로 바꿔주셨어요~/아~~~ 내돈 /소고기 초밥에 고기가 식어서 나왓어요  식은 정도도 아니고 살짝 차던데 식어서 조금 마른느낌의고기를 주는게 말이 돼나요?  그게 소스때문일수도 있데요 고기에 손대 보니까 차던데  그래서대펴 달랫더니 다시 해준대서 기다렸더니 똑같이 다식은걸 가져다 주더군요  배고파서 다 먹을래다가 일부러 두개 남겼어요  여덟개에 2만원 짜리인데  지난주에 갔을땐 너무 맛있어...더보기/런치먹고왔는데 회들어간 초밥이 두개 다 크래미2개 유부초밥 백김치 계란 조개? 이렇게 있는데 12000원 ㅋㅋㅋㅋㅋㅋㅋㅋ가성비 최악/퀄리티 대비 개비쌈/맛은 있음 근데 스페셜?4개 시켰는데 피스도 적고 우동도 적고 뭐 젤 많이 나오는게 양배추 샐러드.  배부르게 먹고싶으면 그닥 맛은 보장/초밥도 신선하고 직원들 접객태도도 훌륭합니다/너무 맛있게 잘 먹었는데, 총점이 왜 낮을까요. 물회먹고 싶었는데 2인이상이래서 런치세트 먹었는데 너무 맛있게 잘 먹었어요./제발 가지말자....트라우마 생길 거 같음/왜 별이 한개가 많은지 알겠네요. 음식맛도 위생도 친절도 무엇하나 또 오고싶은 이유가 없는곳./엥 평이 왜이래. 넘 맛있던데/정말 대충 나오는 집/여긴 피해야 함../본점답게 좋네요/회 두께도 두껍고 온도도 밥양도 적당해서 또 생각날것 같아요 맛있게 잘먹었습니다/손님이 30분 넘게 음식을 기다리고 있는데 서버도 홀 매니저도 그 누구도 체크를 안함. 음식이 왜 안 나오냐 타박 했더니 매니저로 보이는 놈은 대꾸없이 꼬라보기나 하고 서버만 사과하고 있음. 총 45분 기다렸고 30분 기다린 시점부터 빈정 다 상하고 꼭지가 돌아 버리는 느낌에 그 기분으로 음식이 안 들어갈 것 같아 그대로 나와버림. 직원 제대로 뽑아라. 주...더보기/여긴 꽝.  인테리어 한지 오래되지는 않았는데 오래 못갈듯 함. 일단 숭어인지 역돔인지 잘 모르겠지만 그런 생선을 모듬회에 올린다는거만 봐도 수준을 알수있음. 가성비 꽝, 일행이 있어 나가자고는 말하지 못했지만 다신 가지 않을듯./맛 그냥그럼 서브로주는 튀김이 진짜 존맛 고구마튀김,,/거리두기 안 지키고 다닥다닥 붙이고 가성비가 너무너무 별로입니다/가격에 비해 맛없음 위치 말고는 볼 것이 없음. 회에서 흙향이 남 /오픈한지 얼마 안됐을때 갔었는데 날파리 날아다니고 뷔페초밥보다 못했음. 스시에 별 관심 없는 어린 친구들이나 갈 듯/일반 초밥세트는 맛 자체는 무난하지만. 동일 가격대로 여의도, 당산동 이내에서 그 이상의 가성비로 초밥을 맛볼 수 있는 일식집이 많음. 꼭 여기를 찾을 이유는 없음. 오도로 초밥은 전문 참치집 7~8만원 선에서 때때로 사장님이 서비스로 쥐어주시는 참치초밥 이하. 즉 이 집에서는 런치초밥이 제일 무난함. 덮밥류는 무조건 피할것./목이 좋다는 것 빼고는 만족할 수가 없던 곳. 오도시초밥이라는 대표 메뉴가 1.7만원인데 서울 시내 캐쥬얼한 초밥집중에 이렇게 내놓는 곳이 얼마나 있을까 싶다. /진짜 맛있음.  사실 아래 평을 읽어보고 순간 멈칫 했으나  초밥 맛은 부정하기 힘듦   매우 깔끔한데 또 맛남ㅋ 회가 도톰하고 질기지 않음. /너무 맛있고 신선/전반적으로  좋습니다!/실망스럽다/밥에 간이 안맞고, 밥자체도 그냥 전기밥솥에 했는지 그냥 김밥집 수준의 밥 컨디션.. 그리고 가장 충격이었던건 우리 일행이 저를 제외하고 다 어린친구들이라서 암것도 모를거라 무시해서인지 참치스시는 빠시로 남은 조각, 조각들을 덮어서 주질않나..  스시에대한 기본 중의 기본도 모르면서 일식한다고들 나름 떠들겠지 제 기준 웨딩홀, 돌잔치 일식코너 수준도 안됩니...더보기"
