,name,address,sort,menu,mean_price,score,people_give_score,review_count,review_list
0,동인동찜갈비,대구 달서구 상화로 300 1층 (우)42839,갈비,표기안함,표기안함,4.1,8,12,동인동보다 훨씬 맛있는 곳 /친절하시고 동인동찜갈비 골목보다 맛도 반찬도 좋습니다 같은 동네로 이전하셔서 넘 좋아요/맛있고 깔끔합니다. 개인적으론 매운맛 추천/좋아요/완전 너무맛있어요!!!!!! 두번가세요 저는 멀리서와서 두번오기힘들것같아 포장해갑니다ㅎㅎ/찜갈비최고!!다먹고 아쉬워서 포장까지 해갑니당☺/맛있습니다. 동인동 원조집 보다 여기가 낫더군요.
1,벌교꼬막정식,대구 달서구 미리샘길 17-13 (우)42838,"해물,생선",표기안함,표기안함,3.9,9,52,
2,안동뒷고기,대구 달서구 미리샘길 80 (우)42838,"육류,고기",표기안함,표기안함,3.8,5,20,"맛있고 맛있습니다/미쳐따..시민뒷고기보다 맛있고, 뒷고기사냥꾼들 가면 참 좋을듯 /4시부터 /맛있고 맛있습니다/미쳐따..시민뒷고기보다 맛있고, 뒷고기사냥꾼들 가면 참 좋을듯 /4시부터 /맛있고 맛있습니다/미쳐따..시민뒷고기보다 맛있고, 뒷고기사냥꾼들 가면 참 좋을듯 /4시부터 /맛있고 맛있습니다/미쳐따..시민뒷고기보다 맛있고, 뒷고기사냥꾼들 가면 참 좋을듯 /4시부터 /맛있고 맛있습니다/미쳐따..시민뒷고기보다 맛있고, 뒷고기사냥꾼들 가면 참 좋을듯 /4시부터 /맛있고 맛있습니다/미쳐따..시민뒷고기보다 맛있고, 뒷고기사냥꾼들 가면 참 좋을듯 /4시부터 /맛있고 맛있습니다/미쳐따..시민뒷고기보다 맛있고, 뒷고기사냥꾼들 가면 참 좋을듯 /4시부터 /맛있고 맛있습니다/미쳐따..시민뒷고기보다 맛있고, 뒷고기사냥꾼들 가면 참 좋을듯 /4시부터 /맛있고 맛있습니다/미쳐따..시민뒷고기보다 맛있고, 뒷고기사냥꾼들 가면 참 좋을듯 /4시부터 /맛있고 맛있습니다/미쳐따..시민뒷고기보다 맛있고, 뒷고기사냥꾼들 가면 참 좋을듯 /4시부터 "
3,도담찜닭 본점,대구 달서구 상화로 320 (우)42839,닭요리,"도담 까만찜닭,도담 빨간찜닭,추천,31,000,도담 크림파스타찜닭,도담 매콤닭갈비,도담 닭볶음탕",29400,4.2,25,70,
4,카모가와 대구본점,대구 달서구 월곡로 8 2층 (우)42835,"초밥,롤","숙성한우채끝타다키,대왕새우튀김 (4P),간사이오뎅나베,메로구이,토마토생모짜렐라샐러드",17800,2.8,9,21,"40분기다려서 먹었는데 밥 양 너무적고 자꾸 부스러져서 젓가락으로 집기도 힘드네요 그리고 간장도 그냥 만든게아닌 그냥 시중에파는 간장 쓰는것처럼 너무 짜네요 다시는 안올것같습니다/ㅜㅜ.... 제 입맛엔 별루... 밥양도 너무 많구... 잘 뭉쳐져있지도 않아서 부스러지구.. 간이 너무 센거 같기도하고... 다시 오지는 않을 것 같아요. /월요일 저녁이었는데, 해도해도 너무늦게 나오는 음식주문에 열받고, 같이간 가족들  때문에 먹기는 먹고 왔지만 기분은 안좋네요. 그것도 앞전에 20분 정도 기다렸다가 먹고와서는 가족들에게 소개할려고 같이간 자리였는데.. 사람이 많아서 밖에서 줄서서 1시간을 기다렸다가 먹었다면 이해를 해요. 기다리는 사람도 없는데 테이블에 앉아서 기다렸다가 먹기까지 50분.....더보기/별점 1점도 아깝네요. 월요일 점심때 갔습니다. 웨이팅시간은 괜찮았어요. 자리에 앉아서 주문을 하니까 시간이 좀 걸린다고 하더라구요. ㅋㅋㅋㅋㅋㅋ40분이나 기다릴줄이얔ㅋㅋㅋㅋ 40분이 좀인가요? 그래요 너무 바쁘셔서 그럴 수 있다고 쳐요.  인기메뉴 스시세트 2개랑 돈까스 시켰는데. 스시는 밥을 젓가락으로 쥐니까 두개로 갈라지더니 밥알이 우수수떨어지고, 돈...더보기/맛도 맛이지만 가성비도 이만하면 정말 좋아요 들★길 쪽의 초밥집 보다 좋습니다 ^^/존맛탱"
5,스타벅스 대구도원DT점,대구 달서구 상화로 314 (우)42839,스타벅스,"펀치 그래피티 블렌디드,망고,사과,핑크 구아바,파인애플 등 다양한 열대과일로 만든,스트리트 문화의 대표적인 그래피티 벽화처럼 그려진 컬러 드리즐로,롤린 민트 초코 콜드 브루,스타벅스의 콜드 브루와 은은한 민트 초코 베이스로,손목의 스냅을 춤을 추듯 가볍게 돌려 음료를 섞어서,폼폼 유스베리 티,저녁 하늘의 노을이 물드는 듯한 비주얼의 음료.,,아이스 라벤더 카페 브레베,진한 리저브 에스프레소 샷과 은은한 라벤더향이 고급스럽게 어우러진 부드럽고 세련된 풍미의 라벤더 카페 브레베,5,100,밝고 가벼운 풍미의 블론드 원두로 즐기는,폼폼 민트 티,아침 하늘의 구름이 뭉게뭉게 피어나는 것 같은 비주얼의 음료.,",6880,3.4,5,20,2층 테이블이 너무 붙어있어 좀 어수선해요.. 그거 외엔 대체적으로 만족합니다!/위생상태 별로고 불친절/2층 테이블이 너무 붙어있어 좀 어수선해요.. 그거 외엔 대체적으로 만족합니다!/위생상태 별로고 불친절/2층 테이블이 너무 붙어있어 좀 어수선해요.. 그거 외엔 대체적으로 만족합니다!/위생상태 별로고 불친절/2층 테이블이 너무 붙어있어 좀 어수선해요.. 그거 외엔 대체적으로 만족합니다!/위생상태 별로고 불친절/2층 테이블이 너무 붙어있어 좀 어수선해요.. 그거 외엔 대체적으로 만족합니다!/위생상태 별로고 불친절/2층 테이블이 너무 붙어있어 좀 어수선해요.. 그거 외엔 대체적으로 만족합니다!/위생상태 별로고 불친절/2층 테이블이 너무 붙어있어 좀 어수선해요.. 그거 외엔 대체적으로 만족합니다!/위생상태 별로고 불친절/2층 테이블이 너무 붙어있어 좀 어수선해요.. 그거 외엔 대체적으로 만족합니다!/위생상태 별로고 불친절/2층 테이블이 너무 붙어있어 좀 어수선해요.. 그거 외엔 대체적으로 만족합니다!/위생상태 별로고 불친절/2층 테이블이 너무 붙어있어 좀 어수선해요.. 그거 외엔 대체적으로 만족합니다!/위생상태 별로고 불친절/2층 테이블이 너무 붙어있어 좀 어수선해요.. 그거 외엔 대체적으로 만족합니다!/위생상태 별로고 불친절/2층 테이블이 너무 붙어있어 좀 어수선해요.. 그거 외엔 대체적으로 만족합니다!/위생상태 별로고 불친절/2층 테이블이 너무 붙어있어 좀 어수선해요.. 그거 외엔 대체적으로 만족합니다!/위생상태 별로고 불친절/2층 테이블이 너무 붙어있어 좀 어수선해요.. 그거 외엔 대체적으로 만족합니다!/위생상태 별로고 불친절/2층 테이블이 너무 붙어있어 좀 어수선해요.. 그거 외엔 대체적으로 만족합니다!/위생상태 별로고 불친절
6,베를린 에스프레소 바,대구 달서구 미리샘길 82 (우)42838,카페,"아메리카노,카페라떼,클래식 카푸치노,레몬차 레몬에이드,레몬에이드 탄산",4000,4.1,15,164,"베를린슈페너 맛있어서 한번씩 가는데 오늘은 사장님이 안 계셔서 그런가 약간 달라진 맛/에스프레소바 라는 컨셉을 달기에는 메뉴구성과 가격정책, 맛 모두 아쉽습니다. 라떼와 아메를 시키신다면 큰 기대는 안하는 게 좋습니다. 스탭들은 친절하고 매장은 단정하며 테이블은 없습니다. /쏘쏘/베를린슈페너앙버터치아바타jmt/아인슈페너 맛있음. 가격 생각하면 자주는 아니고 어쩌다 한번씩 테이크아웃 해가면 좋은 그런 정도 ㅎㅎ/슈패너 테이크아웃 가지고 가야되면 차에서 흐르는데, 뚜껑좀 덮어줬으면.. /7.1.~ 13.까지 휴무에요/시그니처 메뉴는 맛있었지만 라떼나 아메리카노는 기대에 살짝 못미쳐 아쉬웠습니다. 베를린슈페너는 근처 들리면 또 먹고 싶네요~/가성비 별로/피넛 맛이 강한 크림라떼로 생각하시면 될거같아요! 달달구리하이 찐하네예 + 그리고 ㄹㅇ 핫플입니더 사람이 끊임없이 오네/유명해서 찾아가봤는데 맛있네요. 베를린 슈페너가 유명하대서 평소엔 아인슈페너 잘 안먹지만 먹어봤어요. 고소한 느낌. 다음에는 라떼류를 먹어볼까함.  코로나 때문에 매장안에는 못 앉고 밖에 간이 의자에 앉거나 서서 먹어야 함. 정말 커피만 마실분만 가시길/조금 아쉽네요./가성비 별로/피넛 맛이 강한 크림라떼로 생각하시면 될거같아요! 달달구리하이 찐하네예 + 그리고 ㄹㅇ 핫플입니더 사람이 끊임없이 오네/유명해서 찾아가봤는데 맛있네요. 베를린 슈페너가 유명하대서 평소엔 아인슈페너 잘 안먹지만 먹어봤어요. 고소한 느낌. 다음에는 라떼류를 먹어볼까함.  코로나 때문에 매장안에는 못 앉고 밖에 간이 의자에 앉거나 서서 먹어야 함. 정말 커피만 마실분만 가시길/조금 아쉽네요./가성비 별로/피넛 맛이 강한 크림라떼로 생각하시면 될거같아요! 달달구리하이 찐하네예 + 그리고 ㄹㅇ 핫플입니더 사람이 끊임없이 오네/유명해서 찾아가봤는데 맛있네요. 베를린 슈페너가 유명하대서 평소엔 아인슈페너 잘 안먹지만 먹어봤어요. 고소한 느낌. 다음에는 라떼류를 먹어볼까함.  코로나 때문에 매장안에는 못 앉고 밖에 간이 의자에 앉거나 서서 먹어야 함. 정말 커피만 마실분만 가시길/조금 아쉽네요./가성비 별로/피넛 맛이 강한 크림라떼로 생각하시면 될거같아요! 달달구리하이 찐하네예 + 그리고 ㄹㅇ 핫플입니더 사람이 끊임없이 오네/유명해서 찾아가봤는데 맛있네요. 베를린 슈페너가 유명하대서 평소엔 아인슈페너 잘 안먹지만 먹어봤어요. 고소한 느낌. 다음에는 라떼류를 먹어볼까함.  코로나 때문에 매장안에는 못 앉고 밖에 간이 의자에 앉거나 서서 먹어야 함. 정말 커피만 마실분만 가시길/조금 아쉽네요./가성비 별로/피넛 맛이 강한 크림라떼로 생각하시면 될거같아요! 달달구리하이 찐하네예 + 그리고 ㄹㅇ 핫플입니더 사람이 끊임없이 오네/유명해서 찾아가봤는데 맛있네요. 베를린 슈페너가 유명하대서 평소엔 아인슈페너 잘 안먹지만 먹어봤어요. 고소한 느낌. 다음에는 라떼류를 먹어볼까함.  코로나 때문에 매장안에는 못 앉고 밖에 간이 의자에 앉거나 서서 먹어야 함. 정말 커피만 마실분만 가시길/조금 아쉽네요./가성비 별로/피넛 맛이 강한 크림라떼로 생각하시면 될거같아요! 달달구리하이 찐하네예 + 그리고 ㄹㅇ 핫플입니더 사람이 끊임없이 오네/유명해서 찾아가봤는데 맛있네요. 베를린 슈페너가 유명하대서 평소엔 아인슈페너 잘 안먹지만 먹어봤어요. 고소한 느낌. 다음에는 라떼류를 먹어볼까함.  코로나 때문에 매장안에는 못 앉고 밖에 간이 의자에 앉거나 서서 먹어야 함. 정말 커피만 마실분만 가시길/조금 아쉽네요."
7,정자나무집,대구 달서구 수밭길 78 (우)42835,닭요리,"연잎,전복&문어백숙특선,연잎,전복&문어백숙 (3~4인기준),연잎,전복&문어백숙 (2~3인기준),능이한방백숙 (3~4인기준),능이한방백숙 (2~3인기준),상황백숙 (3~4인기준)",71666,0.0,0,31,
8,원풍참한닭,대구 달서구 수밭길 25 (우)42835,닭요리,"건강닭백숙,한방백숙,원풍닭조림,석쇠구이닭숯불 (500g)",39250,4.3,9,52,엄청 맛있다는 아니지만 꽤 괜찮음/맛있었어요 또 생각나는맛../계산서 잘봐야됨 두번이나 오버 계산서~  한번은  회식에서  닭한마리가 더 추가되엇음.ㅡ맛은먹을만/완전 맛있어요~~~!!! 배터짐 예약안하고 가며ㄴ 오래걸림/최고예요맛나고깔끔하고사장님도친절 /맵지만 정말 맛있는 찜닭. /친절하시고 음식 맛있어요 부모님이 만족하셨어요~/맛있어요!
