,name,address,sort,menu,mean_price,score,people_give_score,review_count,review_list
0,훈감동,서울 동작구 동작대로9길 4 1층 (우)07014,일식,"추천,13,500,16,000,사케동 플러스,훈감텐동,사케동",11833,4.3,104,132,"텐동은 너무 짜지도 않고, 느끼하지도 않고 재료도 다양하고 적절하게 튀겨져서 좋았다 사케동도 비리지않고 너무 괜찮았음 국물이랑 연어머리?구이 서비스도 나오고 근데 사장님이 가게 내에서 웨이팅을 관리하시고 일하시느라 어쩔수없긴한데 문 바로 앞 빠자리 좀 정신사나웠음/텐동 먹어본 중에 꽤 맛있는 집 (월욜 휴무인것 같으니 참고)/여기 오늘 처음 방문해서 사케동플러스 주문 했는데 너무 맛있고 특히 계란이 올라간게 플레이팅도 이쁘구 연어랑 찍어먹어도 맛있더라구요 다음에는 텐동 먹으러 한번 더 방문하려구욯ㅎ /방배에 있을 때부터 찾아가던 텐동집 사당으로 이전하셨다길래 오랜만에 방문했습니다. 가게도 더 커지고 직원분들도 늘어나서 우와했습니다. 남이지만 응원합니다~ 다음에 또 갈게요/맛있었어요 소스 싱거운데 난 싱거운 게 더 좋음 소수 더달라고 요청하면 주심/텐동이 눅진해서 느끼하지 않고 먹기 편했어요. 직원들도 너무 친절하고 기분 좋게 즐기다가 갑니다 /다호텐동 먹었는데 음식 나왔을 때부터 튀김이 이미 눅눅해져있었어요 밥 색보면 소스양은 많이 들어간거 같은데 맛은 정말 희미하게 나서 눅눅해진 튀김과 간 안된 밍밍한 밥 먹고 왔습니당,, 튀김 없이 밥만 먹으면 슴슴해서 괜찮은데 그걸 식어서 더 느끼해진 튀김이랑 먹으려니까..ㅠㅠ 특히 김튀김 .. 과장없이 진심으로 기름 덩어리 베어무는 느낌이었어요.. 종류도...더보기/사케동 너무 맛있고, 장국도 푸짐해서 감동이었어요!! 서비스로 튀김도 주셔서 넘넘 감동  완전 친절하세요~~/서비스로 콜라도 주시고 친절하심/사케동 완전 맛있습니다!! 양도 먹다보니 많아요! 연어 신선하고 생새우도 맛있었습니다. 가리비도 하나도 안비려요~/서비스도 좋고 양도 푸짐하네요 잘먹고 갑니다/훈텐동 먹었는데, 장국 맛있었지만 좀 식어서 나와서 뜨겁게 주시면 좋겠다고 생각했어요. 튀김을 서비스를 주셨는데*.* 돼지고기 냄새가.. 다른 건 튀김은 다 맛있었어요! 밥의 간에 대해 이야기가 많은데 저는 간 괜찮았고 튀김은 간장에 찍어먹었어요. 단무지 맛있었음! /18번째 대한민국텐동감별사 다녀갑니다.  이 집 좀 치네요. /여긴 서비스가 너무 감동이에요.. 음식도 맛있어요!/다호텐동2개 시켜먹었는데 튀김의 질은 만족스러우나 소스가 많이아쉬움. 소스가 양이 부족했던것도 아니었는데 그냥 닝닝하며, 일반적으로 기대하는 입에 착 감기는 감칠맛이 하나도 안느껴짐. 버섯튀김의 경우 사장님 마음대로 담아줘서 불만. 같은 메뉴임에도 불구하고 버섯 튀김을 사장님 임의로 제공함(팽이, 느타리? 둘중 하나 랜덤). 적어도 손님한테 뭐 먹을지 물어...더보기/음식도 음식인데 사장님의 주방운영이 정말 카리스마                        /훈감동. 넌감동. /평일 오후에도 웨이팅이 조금 있었지만, 최근에 한 식사 중에 가장 기분 좋았어요.  직원 분도 친절하시고 음식도 깔끔하고./텐동은 튀김 바삭함이 생명인데 미리 만든 튀김을 쓴건지 너무 눅눅했어요...거의 명절에 먹는 전같았음. 간도 좀 애매하고요. 굴카츠는 진짜 맛있었습니다. /텐동과 사케동이 유명한 집인데 방문시에 히든메뉴인 춘하추동을 먹어봤어요. 연어의 부드러움과 적절한 간을 즐길 수 있어요. 웨이팅은 20분정도 해야되고 20대 여자들이 많이 찾는 가게에요. 맥주한잔과 함께 즐기면 한끼 즐겁게 먹을 수 있어요./동네에 최근 텐동집이 생겨 방문했어요. 비교적 다른 텐동 집들과 비교시 저렴한 가격에 푸짐한 구성으로 먹을수 있었어요. 매장도 깔끔하구요. 재방문 하게 될것 같아요!  다만 아무래도 텐동은 튀김요리다 보니 먹다보면 느끼해지는 순간이 오는데, 그런 느끼함을 잡아주는 포인트가 아쉬웠어요.  곁들임반찬으로 있는 무절임도 그 자체로는 간이 되어있지만, 느끼함을 잡...더보기/오징어튀김? 같은거 먹다 토할뻔했습니다 튀김 자체는 괜찮은데 안에 해산물 상태가 많이 안좋은것같습니다 .. /동네에 맛집이 이사왔다길래 가봤어요. 예전에 있던 자리는 좁았었다고 들었는데 지금 자리는 널찍하고 깔끔하니 좋았어요. 메인 메뉴들 물론 다 맛있고 하이볼도 맛나고… 사진에 없는 유자토마토 함께 먹으면 약간의 느끼함 내지 생선의 미끄러운 느낌을 잡아줘서 환상의 궁합!/꽤 맛있어요./텐동 맛있어요! 서비스도 좋아요  :)/맛은 꽤 괜찮은 편임 다만 - 좁은 실내에서 코로나인데 문을 닫아놓고 환기를 안함 - 음식 만드는 사람들이 분위기가 먹는사람을 불편하게 만듦/진심 너무너무 맛..있....다/홍대 유명 텐동집과 다르지 않은 맛에다가 더 많은 양 덕분에 맘에 들었습니다. 가게가 좁은 편 이긴 합니다/솔직히 맛은 4점 주고 싶네요. 텐동 좋아해서 이 집 저 집 가봤는대, 맛만 보면 엄청나다는 맛은 아닙니다. 튀김의 한계겠죠. 이는 다른 모든 텐동집도 마찬가지입니다. 더해서 좁은 실내에서의 기름진 향과 약간은 더운 기운은 어쩔 수 없는 단점이구요.  하지만 구성이 정말 좋습니다. 이 가격에 이 정도의 양과 구성되는 텐동집 매우 드물다 생각합니다. 최근 이...더보기/맛있긴한데 특별한 느낌은 아님 그냥저냥 맛있음 가게 좁아서 먹기 불편함/가게에서 식사했는데 실내가 너무 좁고 테이블도 비좁아서 식사하기 불편했습니다. 게다가 오픈 주방이라 튀김 연기 때문에 눈이 따가웠고 더웠습니다. 에어컨을 보니 실내 온도가 30도라고 나오더라고요. 덥고 눈이 따가워서 제대로 텐동을 음미하지 못해 아쉽습니다. 가게 내부 환경 개선이 필요할 것 같습니다."
1,애플하우스(이수),서울 동작구 동작대로27다길 29 서광시티뷰 2층 201호 (우)07008,떡볶이,"일반떡볶이,즉석떡볶이,라면+쫄면사리,무침군만두(4개),순대볶음",3800,3.0,268,1005,"후기 외 않좋죠 .. 저는 맛있었어요 무침만두랑 즉떡 ! /떡볶이가 불친절하고 직원들이 맛없어요/학교 다닐때 추억이 ㅠ /딱히 대단할 맛 없다고 느꼈지만, 요새 이런 가게가 많이 없어졌다는 점에서 큰 의미 주고 싶습니다./이수로 이사가고 처음 갔는데 넓어지고 쾌적해져서 아주 좋네요. 예전보다 친절해졌구요. 맛은 여전히 그대로! 즉떡은 역시 애플!/반포 학창시절 추억의 장소라서 가산점 엄청 맛있다기보다 옛날감성 가득 느낄수있는곳/진짜 학생때 먹었던 직떡♡♡♡♡ 학생들이 입맛이라 당연히 달달해요! 저는 그래도 그시절 그맛이 그대로라 너무 좋았고 맛났습니당/건물내 주차시 1시간 무료주차가능. 엄청 넓어져서 좀 여유있네요. 맛은 여전하고요ㅎ/무침만두 매력있고 꾸덕한 떡볶이 느낌 좋았어요/직원들 불친절에 너무달아서 반도 안먹고나옴 /포장해서 집와서 먹었었어요. 떡볶이도 괜찮았지만, 만두무침 맛있었습니다./자리 넓고 깨끗하고 정리가 잘돼있는 매장. 떡볶이는 괜찮은 즉떡 정도 맛이고 무침만두만 먹을만 함/즉석떡볶이는 뭔가 땡기지 않는 맛.. 무침만두는 괜찮았는 맛./셋이 갔는데 중간 불호 불호입니다 직원분들은 띠꺼우시고  떡볶이 맛은 자극적인 단맛입니다  저는 어릴적 멋어봤던느낌이라 괜찮게 먹었지만 쉽게 물리고 갈증이 나는건 아쉬웠습니다  친구들은 너무 실망스러운 맛이라 다들 좋아하지않았습니다  만두 기대했는데 자극적이고 차갑고 바삭했습니다 소스는 무난하고 떡볶이랑 먹을수록 잘물립니다  전 나쁘지않은 중간느낌이였고 친...더보기/무침만두 다사랑치킨 양념맛! 차갑지만 빠삭빠삭해서 맛있어요 더시킬걸 그랬음ㅎㅎㅎㅎ 떡볶이도 맛있긴한데 무침만두랑 비슷한?같은? 양념인것도 있고 너무달기도 해서 먹다보면 빨리 질려요. 막판엔 좀 괴로웠음...후.../무침만두는 워낙 유명한 메뉴라 시켜봤는데.. 차갑고, 양념맛도 특별한 건 없는 맛이었어요. 그리고 떡볶이.. 정말 너무 짜서 결국 남기고 왔습니다. 떡은 끓여서 먹을땐 말랑말랑한데.. 식으면 바로 딱딱해 집니다. 그래서 다시 끓이면 또 더 짜지고ㅠㅠ 가까운 곳으로 이전해서 가본건데.. 다시 갈 일은 없을 듯요./그닥 맛있는지 모르게따... 만두무침도.../추억으로 먹었음. 근데 이제 이사가서 추억도 사라짐. 떡볶이보다 무침만두, 순대볶음이 나음./400원짜리라면사리가 2500원이되는마법 식당직원이 불친절해서 불쾌한건 덤 왜 비싼지모를 음식 주문하고 기분상하면서까지 가고싶지않은곳 *반포동에서는 사람다니는 통로에서 양념만들던데 지금은 어떨지../맛은 그냥 그래요 송파 모꼬지애가 훨 나음. 무침군만두는 괜찮음. 주차대수가 적어서 주말엔 좀 힘들듯/[3.5/5] 추억의 맛 떡볶이 양념이 달콤하면서 많이 자극적이지 않아 입에 잘 들어간다. 그 힘없는 떡도 너무 좋음. 먹을게 많아서 마구 담다보면 가격이 비싸지는...예전엔 가격에서 메리트가 컸는데 이제는 그리 메리트가 없는/무침만두 진짜 미친거같음 진짜 너무 맛있엉 헹헹/무침만두 앉은 자리에서 열 개도 쌉가능/만천원에 배부르게 식사가능~ 평일 붐비는시간에 가면 대기후 식사.. 대신 매장넓어서 회전율 빠른편같아요 맛은 그냥저냥 괜찮은편! 재방문의사는 딱히 없는!/중고등학교때 추억도 있고, 이전했다길래 오랜만에 찾아가봤는데… 움.. 떡볶이가 생각보다 그냥저냥 무침만두는 맛있었는데, 웨이팅 하면서 자주 갈 거 같진않아요 ㅠ/즉떡 너무 맛있어요!! 진짜 강추입니다/재슐랭가이드 3.9 1시간 걸리는 거리에서 찾아올 정도 X 30분 걸리는 거리에서 찾아올 정도 O/개인적으로 신당동보다 나음. 둘이 가면 즉떡 2인분에 계란 두개넣고 면사리 하나넣고 무침만두 한접시랑 같이 먹으면 배부릅고 맛있고 저렴함.무침만두는 진짜 추억소환의 맛. 존맛탱~♡ 잘 드시는 분이라면 남은 떡볶이 국물에 볶음밥 볶아먹으면 환상의 마무리. 여친과 혹은 친구들과 이따금씩 가곤 함.  주차는 아파트 단지내 알아서 잘. 타이밍 잘 맞아 운좋으면 식...더보기/종업원이 조선족이어서 싫을 이유는 없다. 하지만 조선족이라는 게 불친절함을 정당화할 수도 없다.  매장은 넓고 쾌적해졌지만 서비스와 맛은 형편없어졌다.  떡볶이는 너무 짜다가 너무 맵다. 즉석떡볶이가 팔팔 끓는데 기물을 두고 아무말이 없다. 갑자기 쥐었다 화상입기 십상이다.  볶음밥도 이제는 셀프로 볶는다. 그건 괜찮다. 하지만 손잡이는 잡을 수 없을만큼 ...더보기/너무 짜요 진짜로.....추억보정빼면 아무것도 없습니다./너무 짜요 전에비해 ㅠㅠ 조리를 한번 해보시고 간을 맞춰주세요/반포에서 이수로 이전하시고 매장 커졌더라고요.  직원분들은 저한테는 친절하셨고. 다 좋은데,  맛이 평이하네요. 그렇게 사람 많이 갈 일인지는 잘… 무튼 잘 먹었습니다. "
2,호요,서울 동작구 동작대로13길 6-7 1층 (우)07014,일본식주점,"살치살 스테이크,갈릭 쉬림프,닭다리살 가라아게,나가사키 짬뽕,리코타 치즈 샐러드",18400,4.1,19,109,"진짜 맛있고 직원분들도 다 친절하신데 사람 엄청 많고 웨이팅 필수예요 오또노미야끼는 또 먹고 싶네요 ㅠㅠ/오꼬노미야끼 자주 생각날듯 ㅠ 근데 오뎅탕은 쩝...맛없음 너무 혼잡함 /돈페야끼 꼭 시키세요/하이볼 대존맛/진-----짜 너어무 맛있습니다 꼭가보세요 볶은야채들도 너무 맛있고 먹느라 정신없어서 사진은 못찍었지만 야끼소바도 최고입니다. 먹어본 야끼소바중에 제일 맛있습니다. 사장님 많이 바쁘셔보였지만 잘챙겨주셔서 감사했습니다/이자카야인거 알겠지만.. 일본술 추천하는건 좀 아쉽네요. 음식은 정말 맛있어요! / 웨이팅 있음 친철 정신없음 맛있다요 화장실 개선시급 /오꼬노미야끼 두툼하고 치즈 추가 해먹으면 진짜 맛있어요. 서비스도 좋아요!!/맛있는데 좀 비싸요,,분위기는 좋습니당 근처 계시면 한번 가보실만도 해요/시끄럽지 않은 분위기에서 여유롭게 먹고 마실 수 있어서 좋아요! 살치살 스테이크 특히 맛있었어요!/안주 맛있어요~/조용조용한 분위기가 좋습니다 여러명 시끄러운 단체는 안받습니다 짬뽕도 무난하고 대체로 음식은 무난합니다/이자카야 기본에 충실하고 직원분들 모두 친절합니다. /사람많고 테라스 석에 앉았는데 선선하고 좋았어요. 사케에 양송이 스테이크랑 탕 먹고있는데 시간 좀 지나니까 먼저 오셔서 국물 데워준다고 하셔서 고마웠네요./이렇게 맛없는 하이볼은 처음. 탄산 다빠짐/한달 전쯤 갔었는데 친절하시고, 대충 만든다는 느낌도 하나도 없었고, 맛도 있었어요. 그래서 이 날 하이볼 두 잔 마시고 기분 좋게 하루를 마물 할 수 있었습니다. 고마움./오픈 부엌이라 먹거리에 믿음직하네요 그리고 직원들이 특히 친절해요"
3,머치커피,서울 동작구 동작대로9길 43 1층 (우)07015,카페,"너티 크림 모카,아메리카노,카페 라떼,아인슈페너",5050,4.4,24,125,"매장이 좁고 매-우 시끄러움 귀에서 피나는 줄/커피 너무 맛있어요!!! 아인슈페너랑 메인메뉴들 추천합니다/군침이 사악 돌아요/국내에서 아인슈페너 제대로 만드는 카페가 드문데(사실 거의 없음) 드디어 만났다! 넘 행복했다 그래서 별 다섯 개 만점 쵝오!!/쏘쏘/조금 작은 카페지만 분위기 좋아요  공부하기 좋은듯 베리 에이드 시켰는데 안에 라즈베리?가 들어있네요 한번쯤 가볼 만한 카페에요/이 동네에서 만나기 힘든 바이브라는 평에 매우 공감 ㅎㅎ/맛이 좋아요/너티 크림 모카 약간 달지만 맛있는 편.  분위기가 좋아요/아인슈페너 맛집..!! 크림 부드럽고 달다구리하다. 그리고 사장님이 되게 친절하셔서 너무 편안. 다음엔 테라스에 앉아서 아메리카노도 먹어보고 싶다./커피 맛이 일정한 편이고 근처에서는 가장 갈만한 동네 카페 여러 번 방문했는데 쿠키는 늘 떨어져있고 가볍게 먹을만한 디저트가 없는 게 아쉬워요/요 근방에서 보기 힘든 바이브.  마침 맞은편 건물까지 조경에 둘러쌓여져 있어 덥지만 외부에 앉아도 뷰가 좋고, 적절한 햇볕, 커피맛도 만족스러웠다.  간결하고 테이블 회전도 좋다.  손님이 끊임없이 온다 ㅋ   주차는 큰길 맞은 편 공영주차장. /3.5점. 맛은 4점 라떼 합격 카라멜라이즈 합격 하지만 주말엔 자리도 없고 사람넘많고 테크아웃하기엔 불편한 커피+주차 안됨. 참고로 손님은 모-두여자뿐 ㅋ/가야는이유 : 블렌딩한 커피가 괜찮은 조용한 카페 안가는이유 : 기대했던 아인슈페너는 아쉽  자체 블렌딩한 원두는 고소한 맛이 있어 라떼로도 괜찮았지만 비주얼은 태*커피와 비슷한 아인슈페너의 크림은 너무 달고 느끼해서 아쉬운 느낌이 많이드는/아인슈페너 맛집 맞는 것 같아요 시크하면서도 편안한 분위기인 게 신기했어요!/코히맛 좋아요 깔끔띠/커피맛도 좋고 분위기도 좋아요! /커피가 너무 맛있고 분위기도 좋고! 디자인도 이뻐요/점주님의 프로페셔널한 자세가 너무 감동적이었어요/꼬수운 커피.. 분위기.. 다 너무너무 조음/커피 맛있어요~"
4,전주전집,서울 동작구 동작대로7길 19 (우)07015,한식,"소고기 안심전,꿀돼지 삼겹전,동그랑땡,전병,감자전,김치전",15500,3.1,123,222,"사당역 전맛집~/맛이 괜찮긴한데 유명해서 정신없음/줄 서있다가 불러서 앉았는데 줄세우는 사람이 잘못불러서 2층 올라갔다가 내려옴.. 안내를 제대로 하지 않은 점을 컴플레인 하니 죄송하단 말은 1도 없이 그렇게 말하지 말라며 대뜸 반말.. 아니 니가 뇌가 우동사리라 안내를 잘못해서 항의한걸 왜 손님한테 화내고 반말함? 줄 세우는 약간 곱슬머리 단발 아줌마.. 평생 그 ♪♩♩~로 사람들 줄이나 세우고 빌어먹다...더보기/유명은 하지만 뭔가의 찝찝함/동네라 친구들이 이쪽오면 여기만 가자고해서 가긴가는데 정작 동네사람들은 잘 안가는…저번에 웨이팅 길어서 건너편갔는데 맛 똑같아요../사람 진짜 많음 막걸리 마시기 좋음/포장주문하고 바로 된다고 해서 30분 운전해서 갔는데 배달주문 밀렸다고 배달포장해논 모듬전은 앞에 깔아놓고 언제 순서될지 모른다고 하염없이 기다리라는데  그와중에 그 골목길에 차대고 차안에 애는 계속 기다리고 좋아하던 가게였는데 맛은 있겠지만 영업은 생각없이 하시는게 참 마음이 아파서 좋은 말이 안나오네요/술맛이 사악 돌아요/직원들 겁나 친절하시던대...뭐 케바케고. 일단 여기서 가기 싫은 사람들 다 안가도 장사 말도 안되게 잘됨...월요일 다섯시에 갔는대도 자리가 거진 다 찼음. 지도 리뷰도 안 볼 듯한 아재들이 일단 절반을 훨씬 넘음. 얼마나 훌륭한 전집을 아시는지는 모르겠지만, 이 가격에 이 양에 이 정도 맛(평범보다 조금 더 낫다)은 가성비 왕임 진짜. 전 생각나면 이 ...더보기/전형적인 전집입니다!!! 사람 엄청 많은데 일행이 와야 안내를 해주시고 안에 북새통이여요… 식사할 메뉴는 딱히 없고 전!!!집입니다. 직원분들이 다들 프로페셔널 하시고 무엇보다 전이 맛있어요^__^ 막걸리 종류도 다양해서 회식하기 좋은 장소인 것 같습니다./맛있어용 유명한 건 이유가 있음/막걸리 메뉴 다양해서 좋아요~ 배불러서 안주는 감자전이랑 육전만 먹었지만 다음에 가면 김치찌개도 먹어보고 싶어요! /존맛탱 느끼하지도 않음 /엄청 푸짐 양도 많고 맛도 있고/개인적으로 잘 모르겠어요~! 그냥 막걸리 먹고 싶으면 2차 3차로 가볍게 하기 좋은듯? 내부는 깨끗한 편은 아니에요 ㅠㅠ 여자 화장실도 밖에있고... 유명하다해서 갔는데 그냥 평범했슴다~! 오래 아늑하게 있을 곳은 아님/2번 갔는데 두번다 만족. 전 맛있고 양도 푸짐/1년치 전 먹고싶으면 여기/음... 생각보다...... 맛있다고는 평가하기가 애매한데~ 먹을 만 합니다~!/☆점수기준표☆ 별5개-일부러라도 간다 / 4개-맛있다! 자주 갈만하다 3개- 적당히 생각날때 한번씩간다 / 2개- 2번방문은 그닥? 1개- 이곳을 선택한 과거의 내가 밉다ㅠㅠ  무난하고 다양한 전, 막걸리를 즐길 수 있음/직원들 서비스 마인드 빵점. . . 기분드러움/장점: 분위기 좋음. 김치찌개 맛남 단점: 녹두전 덜익음. 바삭한 식감을 원했는데 전혀 없고... 감자전은 그나마 나은데 녹두전 정말 별로;/명절대목이여서 그런건지 포장해서 왔는데 생선 비린내가 심하고 동그랑땡의 고기함량이 적어 두부맛만 느꼐집니다./맛은 있는데 불친절하고 화장실 최악. 자리도 너무 붙어있어서 사람 많으면 일행 목소리도 잘 안들림. 그래도 지금까지 먹어본 전집 중에 제일 맛있음./맛, 위생, 서비스 모두 최악/코로나 때문에 거리두기 한다고 1층은 엄청 띄엄띄엄 좌석배치하고 창문도 다 열어서 환기시키는 분위기. 1층에 자리 없다고 해서 2층 올라가보니 코로나 종식된줄 알았습니다. 옆테이블이랑 합석한듯한 테이블 간격에 창문도 없고 다닥다닥 붙어앉아 일행 대화소리도 안들릴정도로 시끄럽고 시장 한복판에 있는 느낌이었네요. 직원분이 1층에서 방문자 명단 받으면서 방역수칙...더보기/정말 최악!!!!!  절대 안감!!!!!!!!!!!!/별하나도 아까움. 사람들이 왜 많은지 도저히 이해안됨 테이블 다닥다닥 옆사람들과 합석한줄  또 들어가자마자 좌석 지정해줌 개짜증. 주문할때 모듬전은 흔해서 해물파전 시켰더니 바삭하지 않아 컨플레인에 환불요청들어오는데 괜찮겠냐면서 전으로 유도함 그래도 설마하며 시켰더니 냉동해물에 오징어는 질겅거리고 이럴꺼면 메뉴에서 아예 빼야하는거 아님?? 별다섯개들은 다 ...더보기/대학생부터 다녔던곳인데 둘이먹으면 넘 많음(포장도해주심) 3-4인 가면 좋을듯/오래걸림/너무 시끄럽고 사람 너무 많고 전은 빨리 나오긴 하는데 솔직히 찾아가서 먹을 만한 정도는 아니었다"
