,name,address,sort,menu,mean_price,score,people_give_score,review_count,review_list
0,우와 대학로점,서울 종로구 동숭길 78 2층 (우)03085,일식,"토마토 야마이모 오코노미야끼 (돼지고기),클래식 야끼소바 (해산물),그릴드쉬림프 샐러드,아보카도멘타마요&바게트 (3ea),철판 꽃갈비살 (100g)",12800,4.1,52,160,"너무너ㅜ너무너무너무너무 시끄러웠지만 오코노미야끼랑 야끼소바가 맛있었던 집. 분위기도 좋고 음식도 맛있고 친절하심! 주말 저녁만 아니었으면 더 좋앗을 듯. 가게는 꽤 좁고 손님은 붐벼서 웨이팅 개쩔/여기만한 오꼬노미야끼 맛집이 없네요  우선 재료도 싱싱하고 소스도 맛있고  자주 올 것 같은 집이에요 ㅎㅎ 잘 먹고갑니다/여기 완전 맛집입니다 가게도 깔끔하고 너무 맛있고 완전 대박 !!/완전 저세상 맛입니다~~~ 이미지로 봤을때도 요리스럽다하고 간건데 오코노미야끼가 이렇게 고급질줄이야~~~ 야끼소바도 맛나고 또 가고싶어지네요!/분위기도 좋고 야끼소바가 맛있어요! 저라면 지인한테 추천할 듯/오꼬노미+토마토로 먹었는데 먹고 나서 느낀건, 채썬양배추를 케찹에 볶은걸 만원넘게 주고 먹고 나왔구나. 이다./진짜 맛있어요. 또 먹고 싶어요 :)/기본 소바 맛있어요!! 토마토소스는 시그니쳐라고 해서 시켜봤는데 넘 그라탕 같아서,, 기본 오코노미야키 추천합니다/기본 상차림 양배추 샐러드_독특해서 맛있지만 너무 짜다.  1.45만원 토마토 오코노미야끼_올해 먹은 음식 중 제일 이도저도 아닌 음식이었다. 이게 시그니처 소스라니.. 오코노미야끼가 아닌 피자도 토마토스프도, 파스타도 아닌 음식. 너무 강한 토마토 소스 때문에 다른 재료들의 맛 역시 느껴지지 않았다.  1.25만원 야끼소바_이 식당에서 제일 무난한 음식,...더보기/분위기 좋고 맛있음 가볍게 한잔하면서 먹기 딱 좋음/그냥 그런 맛.. 직원들은 친절했으나 맛은 인상깊지 않아서 재방문 의사는 x.. /바로 앞에서 구워지는걸 볼 수 있다는 게 장점.. 야끼소바 맛있고 토마토 오코노미야끼는 피자같음/음식수준은 비추! 인스타용 맛집!/오꼬노미야끼랑 야끼소바 시켰는데 개인적으론 야끼소바가 더 맛있었어요! 밀가루대신 마를 사용해서 약간 부서지는 식감이에요 젓가락으로 집기가 힘들더라구요   맛있었지만 저처럼 바삭바삭한 식감을 원하시는 분하고는 잘 안맞을 수도 있어요~ 가게가 정말 깔끔청결하고 친절하셔서 좋았습니다/맛있었어요 대만족~! 여직원분 너무 친절해요/내부 2층인데 깔끔해요. 가구도 그렇고 채광도 약간 어두운 편이에요. 오코노미야끼 2개(기본+닭고기, 토마토+새우2조각)랑 야끼소바 2개(기본+돼지고기, 아보카도바질+돼지고기) 먹었어요. 양은 4명이서 배불리 먹었습니다. 오코노미야끼 토마토+새우는 피자 토핑 먹는 느낌이고 치즈는 적당해요. 기본+닭고기는 데리야끼 맛이였어요. 기본 야끼소바는 데리야끼 볶음국...더보기/분위기 좋고 맛있다 조금 짜다/전반적으로 간이 세고 음식점이 시끄러워요/눈물나게 맛있어요..../맛있었어요!!!/양이 생각보단 많아요 맛있어요/먹을 때 다른 맛으로 드시는 거 추천해요. 같은 맛 두개 시켰더니 양이 너무 많아서 물려요/오꼬노 맛남/안 짜고 맛있었어요/3번이나 방문한곳 퓨전말고 클래식이 맛있음/서비스 분위기 맛 전부 좋아요/SNS보고 가서 기대는 했지만 그래도 맛읎으면 어카지 했는데 맛있음! 첨 먹어봤는데 데이트하면서 즐겁게 먹음ㅋㅋㅋㅋ 직원분들도 친절하시고 내부도 깔끔 ㅋㅋㅋ 웬만하면 평 좋게 안주는데 여긴 인정ㅇㅇ/토마토 오코노미야끼 최고 !!/야키소바 추천. 너어어무 맛있어요 인간적으로 그냥 맛있음. 맥주도 온도 유지되는 컵에 주셔서 좋았고 직원분도 친절했어요^ㅡ^!!/확실히 오꼬노미야끼는 별로 야끼소바는 맛있어요/일하시는분들도친절하시고 생각했던오꼬노미야끼맛은아니었지만 추천메뉴로깔끔하게맛있게먹었습니다 /오꼬노미야끼는 그냥 그저그랬어요 (토마토소스+돼지고기) 오꼬노미야끼는 양배추 얇게 썬거 + 해산물/고기 + 반죽 빈대떡처럼 부친 음식으로 알고있는데 여기는 양배추볶음에 밀가루 아주 약간 느낌,,? 그리고 치즈랑 토마토소스 때문에 오꼬노미야끼 먹는 기분이 아니라 양배추 피자 같았어요  대신에 인생 야끼소바 (오리지널소스+해산물) 소스가 완전 대박이었고 해산물...더보기/인생 맛집이예요"
1,솔트24,서울 종로구 동숭길 36 (우)03087,"제과,베이커리",표기안함,표기안함,4.6,53,135,"빵 잘 안먹는데 진짜 맛있네요 시오빵ㅋㅋㅋㅋ 혜화오면 또 들려야겠습니다/소금빵은 여기껄로 처음먹어봤는데 맛있었어요 근데 먹고나면 입술 짜져서 잘라서 먹어야될듯... 빨미깔레 넘 좋아해서 혜화 갈때마다 사먹어요  생크림크로핀! 진짜 맛있습니다/버터를 많이 넣는 것 같아서 취향탈거같당/크로와상 맛있는집/소금빵이랑 크로와상 최고..../카야가 진짜 존맛이었어요 제원픽은카야입니다 주말에갔다가 그 작은매장에 바글바글 사람이 너무많아서 평일오전에 다시방문했어요 다른빵도 다 먹어볼거예요 맛있어요ㅠㅠ/소금빵 최고예요/시오 빵이 취향저격…!  버터 향과 쫄깃함 그리고 짭짤한 소금 맛까지 조화로웠습니다. 너무 맛있네요!!  자주 사 먹게 됩니다 !!  ./시오빵 3000 아망드 4400 데니쉬식빵 4800 세블락 4500  진짜 다ㅏㅏㅏ 맛있어요ㅠㅠ 시오빵 대박.. 아망드도 대박... 데니쉬도 빵결 최고... 다 너무 맛있어요...미쳤다./여기 크로아상은 찐입니다 짱맛 ㅠㅠ/솔트24만큼 시오빵 잘 만드는 곳 못봤어요 시오빵 식은 상태 말고 에어프라이기에 뜨겁게 2-5분 돌렸다가 한 숨 식히고 물어뜯지 말고 썰어 드시면 맛있어요 왜 다른 곳에선 모닝빵 돌돌 굴려서 굽고선 시오빵이라고 하는지 모르겠더라구요ㅠ!/버터가 너무 많아서 느끼해요. 한입 먹으면 버터 기름 즙이 나와요,,,/시오빵 엄청 질겨요.. 흠 크루와상은 진짜 맛잇더라구요!/존맛, 직원분들도 친절하세요/시오빵이랑 솔트크로와상 먹었는데 시오빵은 밑부분이 기름에 쩔어있었어요 ㅠㅠ 원래 담백한 맛으로 먹는거 아닌가요 무슨 고로케처럼 기름 뭍어나와서 당황.. 크로와상은 맛있긴했는데 이것도 겉에 기름기가 많네요? 신기... /솔티드카라멜 맛있어요/빵돌이에게 아주 굳/소금빵. 크림크리핀 바삭바삭 느끼하지 않고 기분좋은 단맛에 맛있음. 초코 크리핀은 물림. 식사빵 보다는 디저트 빵./소금빵 드셈 진심/와. 크로아상 너무 맛있어요. /존맛 한마디로 설명 끝 앞으로 혜화 갈때마다 들러서 빵 살거임/소금빵이랑 솔트 크로와상 먹었는데 괜찮았어요/여기 시오빵 먹고 다른 곳 절레절레 했어요 아망드랑 말차도 굳 ㅠㅠ/맛있는데 좀 비싸죠 소확행/하..진짜 인생빵집/5번은 넘게 간 것 같다 아망드랑 솔트가 제일 맛있었음/진짜 맛있습니다 ㅠㅠ/2.16(화) 초코묻힌 널쩍한 과자는 쏘쏘. 튀긴 기름이 조금 과하게 느껴졌어요.  담엔 크로와상 먹어봐야지~   /찰지구마 소금 카야잼 햄치즈 고메버터/크로아상도 크로아상이지만 시오빵 정말 맛나요!!!!/유럽에서 먹던 크로와상이랑 꽤 흡사한 맛이에요~ :) (소금/아몬드 먹음) 주식이 아니다보니 가격대가 살짝 높지만 매일 먹는거 아니니 크로와상 생각나면 종종 먹으려고요~ 디저트스럽게 한국 스타일로 하신 것들도 나중에 먹어보고 싶네요. 커피랑 잘어울리고 같이 먹으면 식사로도 가능하겠어요./파리에서 먹은 크루아상들보다 훠어어어얼씬 맛있다 솔트24덕분에 비행기값 벌었다."
2,촌놈,서울 종로구 대학로8가길 48 연경빌딩 2층 (우)03086,삼겹살,"김치찌개,냉국수,계란찜,비빔국수,커플세트(등덧심살2인+눈꽃항정1인+음료1병),1%세트(삼겹살2인+눈꽃항정1인+음료1병)",19666,4.4,71,142,"원래도 가끔 가던곳인데 오늘도 맛있게 잘 먹었습니다 /안내부터 입에 고기를 넣어씹고 나올때까지 왜 여기가 맛집인지 모르겠는 20대임.  고기상태도 손님마다 다르고, 당연 구워주는것 또한 손님마다 다름, 음식마다 먹는 타이밍이란 있는법인데 여긴 그게 바빠서 싸그리 무시되는 시스템. 딱 그런 정신으로 먹는 돈낭비  고기는 또 너무 비싸 ㅜ /맛은 있는데 서비스가 넘 별루/밑에 후기 오바인듯~ 젊은 바이브에 먹기는 좋아요/고기 신선하지 않은듯,  반찬 특히 김치에서 냄새나고 오래된 듯한 식감 기분 나빠요 그리고 알바들 교육을 어떻게 시키는지 수저통 닫아달라 메뉴 보는데 마스크 써다라 모든게 다 별로/진짜 ,,,, 개맛있다/너무 너무 맛있어요!!!/후기가 좋길래 갔는데 맛있는지 모르겠었어요ㅠㅠ 고기도 육즙 없이 질기고 가격은 또 꽤 있고... 그나마 냉국수??는 맛있었어요/등덧심살, 김치찌개 단품으로 시키는거 강력추천 항정살, 통삼겹살 그럭저럭 주말에 가면 제대로 안구워주고 서비스도 엉망 평일에 가면 그냥 행복 그자체/진짜 맛있어요~~ 육즙미 터짐/냠냠냠/세트 먹었는데 등덧심살인가 주력 메뉴로 미는 게 이해될 만큼의 맛이었습니다. 육즙 가득하고 부드럽고 감칠맛도 풍부하더라고요. 삼겹살은 그냥 12,000원 정도 주면 먹는 딱 그 정도의 맛입니다. 반찬 중에는 백김치가 걍 고기도둑이었고, 전체적으로 구성도 좋았어요. 음식과 서비스는 5점. 근데 이 집은 공간 자체가 소리가 너무 울리고 시끄럽게 만들어진듯요. ...더보기/갈비살이랑 등덧심살 먹었는데 등덧심살 정말 맛있었어요!!! :) /넘맛맀어서 눈물흘리면서 머금 ㅜㅅㅜ 제리뷰는 찐입니다 제발드세여/존맛탱/등덧심살 두고두고 생각날듯/등덧심살 진짜맛있어용 다음에 또 방문하겠습니다!/등덧심살 너무맛있게잘먹고 갑니다 ~~ 존맛탱/돼지고기 먹으려면 저는 항상 촌놈와여 구워주시는게 너무 맛있게 구워주시고  너무 친절하세요 직원들끼리 밝고 활기차게 일하시는게 저도 흥이 납니다 다음에 또 올게요~/존맛탱 대학로 돼지고기집은 무조건 촌놈입니다/제 기준 대학로 최고의 고기집 !! 항상 믿고 갑니다 등덧심살 강추 !…!!!!/오랜만에 맛있는 돼지고기 먹었습니다 데이트 코스로 혜화오면 가야하는 고기집!!!/맛있게 먹고 갈게요~ 고기도 정말 맛있는데 고기뿐만 아니라 다른메뉴들까지도 너무 맛있네요 또 직원분들이 직접 고기도 구워주셔서 정말 편하게 먹을수있어요 줄서서 먹은게 아쉽지 않을정도로 정말 나중에도 꼭 갈거같아요 더욱 더 번창하세요!/고깃집 와서 고기먹는게 진짜 오랜만인데 구워주시니까 일단 너무 편하고 육즙이 이렇게 가득한 돼지고기는 처음먹어본 것 같아요.. 게다가 다들 너무 친절하시고 다음에도 고기 생각 나면 여기 또 오고싶네요!! /야무지게 잘 먹엇습니다. 고기도 다 구워주시고 직원분들 모두 친절합니다. 다음에는 뚱라갈비 먹으로 또 찾아가겟습니다~/숙성삼겹살이라 맛나고 초벌해와서 더 맛나요 비빔국수도 굿!!/직원분들 ㄹㅇ 천사 고기는 등덧심살 꼭임 꼭/직원분들 너무너무 친절하시고, 고기도 너무 맛있어요…! 일주일에 세번이나 갔어요,. 내 텅장,, ㅎㅎ/대학로 고기집 한참 검색하며 고민하다가 갔는데 좋은 선택이었어요. 맛있네요. 다 구워줘서 편하고요/등덧심살 맛있어요! 구운 양배추에 소금찍어 드셔보세요! 주말 2시에 가니까 사람없고 좋더라구요 직원분들 서비스 매우 굿.. 고기집에서 이런서비스 처음 ㅜㅜ/등어쩌구살은 부담스러운 육질이었고 항정은 괜찮았고 삼겹살은 평범했어요  대화가 안 되게 시끄러워서 추가주문도 안 하고 나왔습니다 고기에만 집중하실 거 아니면 비추에요/친절도 맛 가격 다좋네요/웬만해서는 후기 안남기는데 너무 맛있고 친절하셔서 좋았어요 sns에 엄청 많이보여서 광고왤케 많냐고 하면서 긴가민가 한상태서 왔는데 진짜 맛잇어서 놀랬어요 강추 진심 "
3,프리모바치오바치 대학로점,서울 종로구 대학로10길 5 2층 (우)03086,이탈리안,"주빠 디 빼세,베지타리아노,마리나라,삐깐떼 감베로니,올리브 봉골레",11800,3.9,28,85,"여전히 맛있네요! 식전빵부터 음식들, 후식 아이스크림까지 항상 갈때마다 맛있게먹고 만족하고 나옵니다ㅎㅎ 빠네랑 뽈로그라탕 최고ㅠㅠ /맛있어요 여느 파스타집과 같이 맛 대비 가격은 조금 비싸요/빠네 맛있고, 다른메뉴도 다 무난 식전빵에 후식까지 챙겨주는 거 만족/비싸고 맛도 별론데 불친절하기까지 해요. 두 번 다시 안 갈래요./조아용/가성비 좋고 맛있어요. 직원분들도 친절하십니다. 다음에 또 가고싶어요./가성비 좋고 음식이 정갈해요/변함없는 맛집/아이스크림까지 주는 곳이에요! 알차게 먹고 싶다면 추천드려요! 근처에 양식 먹을 곳 없으면 이곳!/그냥 그럼../좋은 만남을 위해서라면 가지 않는 걸 추천드립니다. 음식도 둘다 너무 짭니다 ㅠㅠ 직원들의 친절도는 무난하나 기분 좋을 식사를 위해서는 가지않는것이 좋을 것 같습니다/이 매운 해물 파스타 진짜 맛있어요 /걍 생각보다 그저 그랫.. /빠네는 여기만한곳이없다../n년째 내사랑,,,, 여기 빠네가 ㄹㅇ맛있음 갈때마다 빠네시킴 피자도 맛있고 샐러드도 맛있고 후식으로 나오는 아이스크림(은 딸기맛이 더맛있어요)도 맛있고 다 맛있음 파스타땡길때마다 가는곳/치즈는 나오자마자 빨리 굳고 빠네는 싱겁고 무슨맛인지 모르겠음 두입먹고 바로나옴/인생 파스타집 가성비는 진짜 여기가 최고다 재료 퀄리티와 맛,양 모두 만족 후식으로 샤베트를 소량 주는데 그것도 맛있다"
4,부부식당,서울 종로구 동숭길 43 (우)03086,분식,"바지락가득오일파스타,명란크림파스타,통새우 토마토 커리,수제생강간장소스 돼지구이,매콤오징어구이",12000,3.7,58,209,"스테이크샐러드 진짜맛잇어요/감성 너무 중요시하는 취향인데 분위기 생각보다 더더 좋아용ㅠㅠ 정성스럽게 대해주셔서 좋아요 :)/옛날엔 진짜 좋았는데../오일파스타는 먹을 만하고 로제는 그냥 그랬어요 런치메뉴 먹으러 갈 거 아니면 재방문은 안 할 것 같아요 가격 대비 별로였음/밥이랑 먹기에는 애매한 맛의 반찬 . . /맛과 인테리어는 아주 좋습니다! 따뜻하고 아늑하고 밝은 분위기라 데이트할 때 딱이에요. 메뉴 구성도 좋고, 맥주도 맛있는 거로 신경 써서 준비한 티가 나요. 다만, 홀 서비스는 다들 좀 허술한 느낌? 일하시는 분들이 계속 뭐 하나씩 빼먹으시더라구요. 홀이 넓어서 부르기도 힘든데 그냥 카운터에 모여 계시고... 와중에 나름 친절하셔서 불쾌하기보단 좀 웃겼어요...더보기/엄마와 간만에 맛난거 먹기! 이집 깔끔 담백하니 맛있다 느끼하지 않아서 엄마도 매우 만족함^^/3.5점 정도가 적당? 김밥도 먹으러 간건데 김밥은 다른데서 파는지 보이지도 않네요.. 그리고 평일 이외에는 리조또 팔지도 않고 좀 그래요.  우선 플레이팅이 너무 최악이에요. 그냥 야채 덕지덕지 대충 올려놓은 느낌입니다. 오일파스타 바지락도 덜 신선하고 양이 적어요.   대신 기대 안 했던 목살구이 괜찮았어요! 겉바속촉이랑 소스랑 잘 어울립니다. 근데 소...더보기/김밥 존맛/정말 건강하고 맛있는 김밥입니다. 특히 오징어튀김김밥 최고입니다. 끼니때우는 김밥이 아니라 요리같은 김밥입니다. 떡뽁이도 건강한 매운맛이라 넘 맛있습니다. 오랫만에 만난 최고의 분식집입니다. 오래오래 장사해주세요~~/3.5점이 딱 맞는듯. 가성비는 아주굿~ 담엔 다른걸 먹어보고 다시 평가함/여기 왜 평점이 이렇게 높은건가요??? 주문한지 40분만에 요리가 나왔고 요리수준은 딱 만원대 초반음식..스테이크샐러드는 양념돼지갈비인데 왜 스테이크라고 이름을 붙였는지 궁금합니다. /분위기도 좋고 치킨 파이 대박ㄷㄷㄷ 입에 녹아요/별로/크림 미트소스 인가 그거는 조금 먹다보니 느끼했지만 닭다리살은 맛있습니다 미나리전도 맛있고 대체적으로 매우 만족합니다 인테리어도 좋고 남자분도 상당히 친절하시고 추천합니다/최고입니다. 음식 맛있고 플레이팅 고급진 느낌이고 인테리어도 멋지고 서빙하시는 분도 친절하시고.. 날 풀리면 또 가고 싶네요. /분위기가 너~ 무 따뜻하고 좋아요. 사장님?? 직원?? 분들께서 친절하셨어요~~ 음식도 넘넘 맛있었고, 음식까지 예뻤어요!ㅎ 대기 시간이 좀 있긴 했지만 같이간 분들도 넘 좋아하셨습니다 ! 강추! /분위기가 너무 좋다 연인들끼리 가거나 소개팅할때 가면 좋을 듯 혼자갔는데 앞은 소개팅 뒤는 연인이라 좀 어색했지만 그래도 또 혼자서라도 가고싶을 정도로 방문했을때 좋은 기억만 남아있음 그리고 그릇이.... 너무 예쁨....../너무 맛있고 분위기도 좋아요ㅠㅠ/친절하시고 음식도 건강하고 맛있어요❤/만족스러웠던 식사. 공간도 넓고 메뉴도 많고 정성 들어간 가정식 느낌/최악. 자리만 많이 만들어놓고 조리 속도는 그걸 따라가질 못함. 음식이 맛있는것도 아님. 고기 매우 질김. 이빨 나갈 뻔. 카레도 맹탕./소고기 스튜를 먹어봤는데 진짜 너무 맛있어요..ㅠㅠㅠ /음식이 ... 맛이 없어요. 고기요리는 고기냄새 심히 나고 떡뽁이는 짜고 ... 인스턴트 음식보다 못해요. 가격이 저렴한 것도 아니고. 양만 조금 많을 뿐. 친절은 하시지만 ... 안타깝습니다. 재방문 의사 없어요. /샐러드맛집. 미나리전 겉빠속촉 지대로임/지금 와이프랑 먹고 있는데 ..  혹평 댓글 다신분들 .. 단골이시죠? 나만의 단골집을 외지인(?)에 빼앗길까봐 억지로 악평 하신것 같습니다ㅋㅋ  양 맛 정성 분위기 가격 모두 5점 음식 나오는 속도는 좀 느린데 나오면 왜 느린지 이해갑니다. 정성때문./음식 30분 넘게 기다려서 나왔고..크림빠네 너무 꾸덕해서 달라붙고 빵도 딱딱해서 칼로도 잘 안썰어졌음. 크림도 개인적으로 안좋아하는 크림맛. 고기는 맛은 나쁘지 않았지만 식어서 와서 실망ㅇ었고가격이라도 싸면 모르겠는데 이가격주고는... 재방문 의사 없음/먹고 나오면서, 여긴 꼭 나혼자라도 다시 와야겠다 라고 생각이 든 곳.  모든 음식이 맛있었고, 연어스테이크의 연어가 작다면서 (우린 눈치채지 못했음) 삼겹살을 더 갖다 주심. 양심적인 곳/음식이 정말 맛있어요! 분위기도 좋구요 ㅎ 제가 조미료 맛에 예민한 편인데 조미료 맛이 안나요!!!!요즘 맛집 가면 그냥 다 미원맛 , 설탕맛으로 승부하는데... 여기는 안 그렇더라고요 !!! ㅜ_ㅜ 맛집이라고해서 찾아가면 실망할 때가 넘 많았는데 .... 히히 정성껏 만든 음식으로 대접 받는 느낌이라 넘넘 좋았답니당 !! ㅎ /재방문 의사 없습니다.   음식은 무난하고 분위기는 좋은데..  서빙하는 여직원이 쌀쌀맞네요.  주문 받을때도 불친절해서,  주문이 제대로 들어가긴 한건가 불안했는데 결국 미스나서 한참 기다리고 안나온 주문도 있어서  취소하고 나왔습니다.  사장님은 친절하게 사과하시기는 했지만 손님 모시고 찾아간 제 입장에서는 매우 속상했습니다.  "
