,name,address,sort,menu,mean_price,score,people_give_score,review_count,review_list
0,발산회관,서울 강서구 강서로 402 재영빌딩 1층 (우)07583,"곱창,막창","한우대창구이,[메인메뉴],12,000,양밥,[추가메뉴],8,000,대창+막창+특양+염통+대창전골,[한근메뉴],10,900",30300,3.9,21,219,"세트메뉴+대창1인분추가,양밥 주문했는데 3명 먹는데 양도 충분하고~맛도 정말 만족했어요~강추요~!!/양밥이 맛있습니다. 재방문 의향 있습니다./대창좋아하는데 여기서먹고 느끼해서 토할뻔했어요 그래서 후식 젤라또 먹음/양밥은 맛있었는데 대창은 역시 구이가 나은거 같아요/여긴 언제나 존맛탱입니다 대창 쵝오 양밥 쵝오/대창구이가 제대로네요!  둘이가서 한근메뉴 뿌시고 왔습니다~ 가격이 보통 저렴한곳이면 저희가 구워먹는데, 여기는 잘 구워주셔서 그건 진짜 좋았어요!! 맛도 가격도 착하고, 일하시는분들도 친절하셔서 여기는 자주 올것같아요 :)/전골만 먹어봣는데 짱 맛잇어요ㅎㅎ/깔끔하고 맛있어요~ 다 궈주셔서 좋음:)/식당이 너무 깔끔하고 예쁘네요 음식도 정갈하게 잘 나오고 냄새도 1도 안 나네요 후식냉면도 맛있습니다 굿굿 재방문의사 100%/매장 들어가면 다들 느끼시겠지만, 인테리어가 예뻐서 좋더라구요. 깔끔하고, 양밥도 맛있고, 직원들도 친절하니 좋았어요!! 매우 만족하면서 식사했어요~ 저는 개인적으로 재방문 자주 할 것같아요!/청결해요! 맛도있고,  구워주셔서 너무 좋아요!! 완전 추천!!/갈비살이랑 소주 맛집/구이는 먹을만하지만... 가격이 너무 비쌈  양 밥, 대창 전골 엄청 짬.../양념이 과하고 잘 탐.../맛있습니다. 가격도 좋고 인테리어 깔끔하고 직원들도 친절한 편이예요. 4명가서 엄청 먹고왔습니다. 양미옥느낌나고 맛도 좋으니 계속 갑니다~~/맛있어용~~ 가게도 예쁘고 분위기도 좋아요!!!/오픈한지 얼마 안돼서 좀 어수선했지만 맛은 좋았습니다/맛있음 싸고 조용해서좋았어요! 근데 예약전화가 아직 안되나봐요 ㅜㅜ??/가게인테어보고 비쌀줄 알았는데 겁나 맛있고 쌈 ㄱ ㄱ /양대창 너무 좋아하는데 비싸서 자주 못먹었는데 이가격에 이정도 퀄리티를 먹을수 있어서 너무 좋음!! 연말 모임장소로 강추/구이가 너무 질겨요ㅠㅠㅠ 냄새도 나고ㅠ"
1,고양이똥,서울 강서구 공항대로59가길 13 (우)07563,테마카페,아란치니,12500,3.9,39,142,"에스베네딕트가 맛있습니다./에그 베네딕트 맛있네요~ 근데 음식 나오는 데 40분 걸렸어요ㄷㄷ  안바쁠때 다시 갔더니 그땐 일찍 나왔어요/아란치니 뱅쇼 아보카도 오픈샌드위치 먹었어요. ㅠㅠ 다 맛있었어요. 뱅쇼는 뜨끈하게 마시니까 건강하게 속이 데워지는 느낌이 들어서 너무 뜨끈하고 좋았어요. 다음에 또 먹으러 갈게요! /이 동네에서 왜 유명한지 알겠다/카페지만 파스타도 팔아서 좋음/파스타가 느끼하지도 않고 면도 알단테하고 맜있다 해산물도 많고 간도 적당함 이 정도 퀄에 이 정도 가격이면 또 방문 에그베네딕트도 부드럽고 맛있고 햄도 훌륭 아란치니 역시 간도 잘 맞고 훌륭하다/브런치카페로 좋음/맛있네요!/브런치 찐맛집이네여  잘먹었습니다/샹그리아와 자두스무디 절대 드시지 마세요. 샹그리아 진짜 최악..입가심하고 싶은맛../에그베네딕트 햄이 특히 맛있어요 바질페스토는 조금 간이  약했지만 맛있었어요 웨이팅 기다릴 정돈 아니고 2층은 빛이 잘 들어서 더웠어요ㅠㅠ/무난무난 합니다. 왠만한 메뉴는 다 먹어봤는데 할라피뇨 파스타, 라구파스타, 연어 올라간 오픈 샌드위치 좋아요. 평타 이상이지만 그 이상은 아닙니다. 직원분들 돈내고 눈치봐야해요.. 왜죠../브런치 먹고싶을 때 가끔 주말 오픈시간에 가는데 사람들 미어터짐 ㅠㅜ 비싸긴한데 맛은있다. /진한 커피맛이 좋고 브런치 맛집이여서 브런치 먹는 시간부터 점심시간까지 사람이 정말 많습니다! 이 카페에서 브런치를 먹으며 커피 한 잔 하시는걸 추천합니다/사장님이 직접 로스팅한다고 하는데 이 집만의 독특한 커피맛이 좋더군요...../+봉골레 파스타, 옥수수크림파니니 쾌적한 공간. 음식도 괜찮음./예전에 자주 가던 곳이였는데 오랜만에 가보니 맛이 좀... /파스타, 샌드위치 다 맛있어요. 양이 적다는 평이 많았는데 저는 충분했던거 같아요. /분위기도 별로고 음식은 실망입니다.  서비스도 별로에요.... 불친절하고 늦어요.  커피는 괜찮습니다./장점- 음식 맛있음. 인테리어좋음 단점- 가격이비싸다. 커피는 스벅스탈아닌 폴바셋스탈(신맛)/Nice place to eat salad mix and breads. We loved the drinks also/분위기는 괜찮은 편. 맛은 평균~평균 살짝이상? 화장실이 불편함. 업종이 카페가 아니라 일반주점. 메뉴에 술이 있어서 그런가?/몇 년 전, 아보카도 오픈 샌드위치가 맛있어서 종종 갔지만 예전 그 맛이 아니다. 커피는 무난한 편. 식사와 음료가 다양해서 카공족에게 추천할만하다. /커피는 평균 이상 분위기가 좋아서 한 두번 찾게 되고 브런치 생각나서 가끔 찾게 되는데  의외로 인테리어가 불편함  테이블이랑 의자도 제각각이고 화장실은 남여공용임 역시 예쁜거랑 편한거랑은 다르다는 건가 /2017.06.24/그냥저냥"
2,냐항바바바,서울 강서구 화곡로64길 16 (우)07572,베트남음식,"퍼보,퍼보까이",9000,4.3,86,163,"진짜 맛있었는데... 개편메뉴는.... 좀....ㅠ 볶음밥류 드시지마세요... 밥맛만 나요... 햇반이랑 간장계란마늘밥 하는게 나을거예요/공심채 맛나요/인생쌀국수는 아니지만 종종 베트남음식 땡길 때 오기 좋음!/음식 맛은 맛집답게 맛있음. 하지만 직원들 태도가 맛을 못 따라간다. 나갈 때 인사도 없음./평일 점심시간 웨이팅 20분 정도 매운것같지만 맵지 않음 근데 왜 입술이 얼얼하지.../매운 쌀국수 엄청 매움 근데 맛있음 짜조 맛있음/원래 방문하기로 했던 띠아낭이 문을닫아 방문했던 등촌동맛집 냐항바바바는 큰 기대없이 검색해서 방문했는데 쌀국수 2종류는 맛있네요.  짜조모듬은 특별한 맛을 느끼지 못했는데 퍼보, 퍼보까이는 확실히 맛있는 집이에요.   실내사진을 많이 찍지는 못했지만 분위기가 하노이 고급 쌀국수집같은 느낌이 들어요.   점심시간되니 줄서는 집이라서 이번 선택은 잘 한 것 같...더보기/맛이 자꾸변하네요. 볶음면은 너무 매워서 못먹을지경이예요. /깔금하고 맛있어요 종종 생각나요 특히 볶음밥 ㅎㅎ /맛있은 음식 좋은 서비스 훌륭한 분위기/일요일에 와이프 및 아기와 함께 방문. 들어가자마자 아기의자와 아기용 식기를 맨 처음 가져다 두심. 음식도 맛잇었음(쌀국수, 공심채볶음, 마늘볶음밥, 짜조) 자리도 널찍해서 코로나 시국에 적절한 매장이었음. 마지막으로 아기 목도리를 놓고 갔는데 키크고 잘생긴 직원 분이 목도리를 챙겨서 지나가는 차마다 주인을 확인하며 챙겨주려는 모습을 봤네요. 눈와서 미끄럽...더보기/가양동에도 맛집이 있단 걸 알게 해준 곳/쌀국수 돈 주고 사먹는 거 아깝다고 생각하는 사람인데 완전 맛있게 먹었어요. 재방문의사 있음. 다른 쌀국수는 면이랑 국물이랑 따로 노는데 여기는 면도 맛있음.  + 고기는 적다고 느꼈습니다 + 육수에서 좀 시큼한 맛이 나는데 싫어하면 비추/서울시 최고의 쌀국수집. 다른 메뉴도 다 맛있었다. 테이블 간격 넓은 편/예전같은 맛이 안나네요.. 국물도 뭔가 허전하고 그러네요/맛있지만 아랫분 말대로 생각보다 평범한 맛/맛은 있는데 평이 좀 과대평가 되어있네요ㅋ 푸짐하긴 한데 쌀국수도 평범했고 볶음면도 평범했고 라임에이드도 평범했어요.. 우와 맛있다 이럴정도는 아니예요/줄서야 하지만 친절하고 분위기도 동남아느낌이고 맛도 괜찮음/가양역, 강서구청사거리 주변 베트남 음식점 가운데 개인적으로 가장 추천해주고 싶은곳입니다/라임에이드 미쳤음/분띠느엉( ◜‿◝ )♡/'맛있음' 그이외의 단어는 불필요/근래 먹은 벳남음식중 최고!! /최고의 한그릇이었다/퍼보 맛있어요!!ㅎㅎ/깔끔해서 좋아요/한국에서 먹는 쌀국수 중엔 여기가 제일 맛있습니다/또 가야해!!/매운쌀국수 좋아했었는데 고기 양이 줄면서 맛이 변했어요 맵기만하고 맛없어졌네요ㅠ/맛있어요/+퍼보. 포장. 4점. 약간 간이 세지만 맛남. +분띠느엉. 포장. 4점. 별미임."
3,뚜스뚜스 등촌점,서울 강서구 공항대로45길 92 1층 (우)07549,카페,"에스프레소,아메리카노,카페라떼,자몽 생과일 주스,키위 생과일 주스",4700,2.8,54,48,"웬만하면 후기같은거 안남기는데 다른분들 평과 마찬가지로 불친절함. 서비스 마인드같은 교육이 전혀 안돼있는듯. 케익사려고 여기 후기봤는데 별로라서 투썸으로 갔는데 투썸이 인테리어중이라 어쩔수없이 여기로 가봤더니 역시 다수의 의견은 괜히나오는게 아니네요.  1. 주문 받던 직원이 주문받다 말고 갑자기 말도없이 나가버림  2. 그래서 케익앞에있던 다른직원에게 케...더보기/원자재값 인상때문인가 가격대비 구성이 허접해졌음…/배달 실수가 엄청 잦은 곳. 비싼 샌드위치 시켰더니 전혀 다른 메뉴 가져다 주고 맘대로 주문 내용도 누락시키는 곳. 이런 실수가 한 번이 아니라 2~3번이라 다시는 안 시킬 예정. 완전 비추합니다./김무스머리한 직원 드럽게 불친절함 먹기전부터 기분잡침/시끄러워요/가까운 곳에 위치해 자주가던 카페이긴 했는데 왜인지 일하는 사람이 바뀌어도 대부분 예의가 없음 과한 친절 서비스를 바라는 건 아니지만 일부러 사람을 불쾌하게 할 정도의 태도를 보임 치즈케익 해동이 전혀 안된상태로 제공 됨 너무 딱딱해서 먹기 힘들다고 카운터에 말하니 케익이 얼었으면 녹여서 드셔야죠라는 답변만.. 소비자 심리 실험 현장인가.. 아직 까지 영업...더보기/인테리어 예쁘고 음료는 무난해요. 요샌 어떤지 모르겠는데 항상 시끌벅적해서 1층에서 카공 절대 못함 딱히 친절/불친절하다고 느낀 적은 없었음/오믈렛에서 휴지 조각이 나왔어요! 그릇을 주방에 드렸는데, 글쎄 양배추라는 거예요.. 사진을 미리 찍어놔서, 다시 확인해 봐도 뚜스뚜스에서 사용하는 그 흰색 휴지의 질감이 그대로 살아있는데ㅋㅋㅋ 차라리 이물질이 들어간 것 같다고 사실대로 말해주셨으면 괜찮았을 텐데 양배추 발언에 실소가 나왔어요ㅠㅠ 비용은 환불받았고, 이물질도 이물질이지만 응대 때문에 재방문...더보기/여기 아주 예전부터 가끔 갔는데 직원분들 불친절 해요. 친절 하진 않아도 불친절 하면 안되죠.. 시크한척 하는건지 암튼 그렇습니다. 음식이랑 음료는 소소이고../직원들은 잘 모르겠고 커피랑 음식 맛있어서 갑니다/재방문 의사없게 만드는 불친절한 서비스/직원 불친절 참아가며 다시 방문할 정도의 맛집 아니라서 재 방문 의사 없습니다/맛있어용 친절하심/제가 실수해서 음료르 엎었는데 너무 친절히 응대해주셨어요 너무 죄송했었는데 음료도 다시준비해주셨고 맛도 정말 맛있었습니다!!/빵은 맛있는데 파스타는 그냥 그럼. 무엇보다 갈색머리 남자직원 퉁명스러워서 기분나쁘다. 실수해놓고 다른직원이 상황 설명해주고나서야 대충 사과함/2층에는 벌레관리도 안하는지 벌레 시체랑 모기 파리할거없이 날아다니고 먼지 엄청 쌓여있는데 직원들이 청소한번 안하나봄 /빵 자르는거 진짜 대충, 던져놓듯이 접시에놓음 ㅋㅋㅋㅋㅋ서비스 불친절 손님이랑 싸우자는건가 /직원 대응이 별로고 항상 사람이 너무 많아서 정신 없는 곳 /뚜스뚜스 맛있음/강서구에 파스타 여기만큼 하는곳 없네요. 자주 갑니다!/11/15 일요일 점심시간 1시에 뚜스뚜스 등촌점에서  생과일쥬스 자몽과 토마토 를 주문하고 음료를 마셨는데 자몽쥬스 안에서 손톱같은 이물질이 나왔습니다. 매니저는 고무장갑이 잘린것이라며 음료를 교환해 준다고 했고 저는 취소를 요청했습니다. 고객 입에 이물질은 넣고도 사과도 없이 마무리를 하려고 하자 매장을 떠나며 사장께 연락하라는 멘트를 남기고 명함을 주...더보기/커피랑 음료수는 맛있는데 , 음식은 솔직히 맛있는지는 모르겠다 /헤이즐넛 라떼 맛있어요 음식들도 맛있는데 오래 걸리는듯해요/알바들 느리긴 하네요 매장 규모나 맛에 비해서 서비스는 별로 입니다 사람 많아서 손님 좀 줄어야 정신차릴거 같네요/녹차 그로와상 짱이네요. 너무 맛있으니까 또 가야곘네요/(수정) 리뷰쓰고 일년가까이 지났는데 여전히 불친절 특히 주말 남자 알바 커피 만들면서 마스크는 턱에 쓰고 직원끼리 노닥거림 ———————————————- 직원들 진짜 불친절... 사장님이 엄청 부려먹나요..? 왤케 불친절한지 모르겠어요. /이 동네에 오래살아서 여러번 가봣지만, 갈수록 친절이라곤 없네요. /집앞이라 파스타 먹고왔어요 맛 4 분위기 3(주말에는 매우 시끄럽 시장통 연상) 친절도 3(서빙하는 직원 1분이 대답도 안하고 손짓으로 응대하시네요)/외관에 비해 인적관리를 잘 못한다ㅡ운영자가 CS경험 전무하고 돈으로 미시는듯. 골프장손님들이랑 전철인근이라 그나마 손님은 많네/불친절하다는 댓글 보고 갔지만 정말 불친절하네요 ㅋㅋ 알바 교육 다시 시켜야 할듯.. 말투에 짜증이 가득하고 손님이 전혀 반갑지 않고 주문 안하고 나갔으면 좋겠다는 식의 태도../전반적으로 괜찮은데 정말 직원(알바)교육 제대로 해야됨. 뭐 지금 당장 장사 잘된다고 이대로가면 얼마 못가서 망할꺼 같음. /칸막이 자리 쟁탈... 거의 못앉지만... 빵 맛있어요 식사류도 맛있고 ~/공간이 너무 소란스러워요. 넓어서 작업하기 좋을 수 있을진 모르겠지만 2층 좌석은 천장이 너무 낮아서 답답하고요. 하여간 매우 소란스러움. 차 종류가 많은건 좋습니다"
4,웜테이블,서울 강서구 공항대로49길 5-17 (우)07571,이탈리안,"할라피노 엔쵸비 파스타,리코타 치즈 샐러드,버섯 크림 리조또,채끝등심 스테이크,칠리베이컨파스타,부르스게따(3pc)",14500,4.4,19,76,"양 적다는 후기에 3개나 시켰는데 넘 배불렀네요. 분위기 좋고 음식도 좋았습니다. /양이 적지만 너무 맛있어요!!! 조금만 양을 늘려주시면 좋겠어요^^;; 아이들과 같이 종종 갔는데 아이들이 각각 한그릇을 다 먹을 정도로.. 양이.,적..어요.. ㅋㅋ 아이들에게 적당 어른인 저에겐 살짝 부족ㅎ 그치만 너무 맛있어서 이것저것 다 맛보고싶어요^^ /가게 인테리어가 아기자기 귀여워요. 음식도 무난하게 맛있었고, 직원 분도 친절하셨습니다. 주택가라 주차공간은 협소해요./가격 합리적이고 맛있어요 분위기도 좋음/가게 인테리어 예쁘고 아늑해서 계속 앉아있고 싶었어요 참나물 차돌박이 파스타 버섯 리조또 너무 맛있어요 스테이크는 무난해요 파스타 양이 적지만 가격 생각하면 하나 더 시켜서 여러가지 먹는거 추천합니다/맛있습니다 분위기도 좋네요 여자친구랑 왔는데 이렇게 깨끗하게 먹은 적은 첨인 듯/최근들어 자주가는 맛집입니다! 또 방문할거에요!! 최애는 가지토마토 파스타에용/일단 화분이 많아서 편안하고 예쁘고 인테리어에 신경많이쓴 느낌이였어요.음식도 괜찮아요. 일요일점심인데 사람이 꾸준히 오더라구요. 빵이랑 크림버섯리조또 추천!칠리파스타는 꽤 매운데 맛있어요/ 가게 인테리어도 예쁘고 친절하세요! 데이트나 모임하기 딱 좋아요. 여러 메뉴 시켜서 쉐어 했는데 모두 다 기복없이 맛있었어요. 특히 면의 익힘 정도가 좋았답니다.  큰 테이블도 있고 2인, 4인 테이블도 적절히 있어요.   단점이 있다면 1인 1메뉴 라는 점( 사이드 메뉴 제외)과 양이 많은 편은 아니라는 점입니다.   제일 맛있었던 메뉴는 라자냐, 참나...더보기/기념일에 근처 마땅히 갈 만한곳이 없어 찾다가 가게됐어요. 분위기 서비스 다 좋았어요 맛도 만족스러웠습니다. 그런데 양이 많이 적은느낌....ㅎㅎ 둘이서 3가지 시켜서 싹싹 긁어먹었는데 배가 부르진않았네요....ㅎㅎ/분위기 있고 가성비 뛰어나요~ 기대보다 너무 맛있어서 놀랐어요^^/만오천원이하 봉골레 중 탑급으로 맛있음  스테이크는 쏘쏘  에이드 달달함  분위기 매우 좋음   /일부러 멀리서 찾아가서 일요일 1시반쯤 도착했는데 오늘 손님이 많아서 재료가 떨어졌다고 손님을 안받더군요. 그리 늦은시간에 간것도 아니었는데 황당했습니다. 재료를 매우 소량만 준비하는것 같은데 저처럼 1시반 이후 가게될 경우 미리 전화로 체크하고 가는게 좋을것 같네요/맛도 가격도 분위기에 친절함까지...완전 강서구 맛집입니다 /최고의 맛이예요♡♡  /동네 골목길에 숨은 맛집 입니다. 스테이크 가성비 좋고 파스타는 이 동네에서 이 가격에 먹을 수 있는게 행운이에요!! 먹물리조또도 별미~ 일상에서 소소한 힐링이 필요할 때 찾아갑니다/+라자냐, 산나물&차돌박이파스타 분위기 좋음. 음식은 쏘쏘."
