,name,address,sort,menu,mean_price,score,people_give_score,review_count,review_list
0,인생한우,서울 성동구 마장로31길 43 영지빌딩 2층 (우)04748,"육류,고기","한우 티본스테이크(100g),한우갈비탕,한우육회비빔밥,한우사시미,한우육회",18600,3.3,13,175,"콜키지 만원, 룸이 아니면 너무 시끄럽지만 고기 잘 고르면 근처에 대도식당 부럽지 않다./맛있게 먹긴했는데… 남자친구랑 저랑 둘다 화장실행,, 이상하네요  +4일째 배아프고 속안좋네요 .,,,/양념갈비 가져가서 구워먹는데  불판이 타네마네 하면서 엄펑 눈치주고  5명이가서 불판 2번가는데 사장인지 뭔지 할아버지가 와서 그만 불판갈아달라고 하네요  오랜만에 외식하면서 돈내고 눈치 봤네요    테이블비도 인당 7천원씩 엄청 비싸고 사장 내외가 너무 불친절합니다   가실분들은 마음 단단히 전투모드로 가셔야 당황하는 일 없을 겁니다/벨 20번 눌러도 안오고 먹고나서 집가서 폭풍설사가 팩트/첫 방문 때 좋은 기억으로 다시 방문했는데  시키지 않은 더 비싼고기, 시키지 않은 술 영수증에 찍혀있고 매우 의심이가서 실망이 크네요.  양심적으로 장사해서 번창했으면 좋겠습니다..   /아 먹고싶다/꽃등심 새우살 포함해서 새로 썰어달라고 부탁드리니 맛있게 썰어주심. 육즙 가득 인생한우... 츄릅/상차림맛있고 시설 깨끗한데 벨 한 세번누르면 한번 옴.../여기서 한우1++모듬먹고 친구들 다 설사하고... 고생중이네요... 왜 인생한우인지 알 것 같습니다"
1,본앤브레드 신관레스토랑,서울 성동구 마장로42길 1 (우)04757,"육류,고기","채끝 (100g),생살치살,양념살치살,한우 맡김차림,프라이빗 다이닝 디너,프라이빗 다이닝 런치",147500,3.0,15,46,"안심 등심 치마살 양념부채살 카츠산도 된장찌개/3층 프라이빗 룸 이용(1인당 25만원) 장점:  1) 고기맛이 좋음 부드럽고 입에서 녹음 2) 발렛가능(주차 뺄때는 조금 기다림 소요됨)  단점:  1) 고기 구워주는 셰프님이 요리 설명하신다는 핑계로 대화중인 우리 이야기를 끊음..후기에 이런 평이 많아도 뭐 얼마나 거슬리겠어 했는데 많이 거슬림..셰프님이 음식에 프라이드가 있으신건 알겠는데 굳이 룸을 ...더보기/정말 맛있고 친절했어요. /35만 오마카세 다 먹는데만 2시간/3층 프라이빗 룸 방문.  맛은 있었는데, 구성도 나름 괜찮았는데 가격을 생각하면 조금 갸우뚱. 고기도 조금 질긴 것 같은 느낌/그돈내는데 당연히 맛있어야지요 맛있어요 다만 직원분들이 본인들 브레이크타임에 쉬어야하니까 빨리 나가시라고 해서 그돈내고 불편했네요. 노래도 끄시고 저희가 남은 음식 조금 천천히 먹으면서 나가겠다니까 안된다고... 룸이었는데... 비싼돈주고 헐레벌떡 쫓기듯 나온기분이었네요. /서비스도 별로 맛도 기대보다는 별로 굳이 그 돈내고 여기를? 같은 느낌 /불친절. 주차는 최악.  25만원 코스 먹어야 준다는 룸은 건물 단열 안되어 춥고. 마장동 고기집에서 10 만원이면 충분한 식사를 포장에 속아 비싸게 먹은  경험/맛잇어요~ 별하나는 요즘 맛이 없어져서 빼요/그간 쳐묵해오던 한우중 퀄리티는 최상이었음. 새우살,알등심, 치맛살...  안창살이 품절이었던게 아쉬움... 후식 쌀국수는.... 말이 필요 없었던..../전화로 예약했는데 예약 확인 문자를 지네가 안보내놓고선 예약 취소 당함 ㅋㅋ /와인 콜키지 프리임. 고기 훌륭함. 식사중에는 특히 쌀국수 전문점보다 맛있음. 적극추천함. 가게내부 분위기도 서비스도 좋음. /가고싶어서 간것도 아니구요  워커힐명월관 가려다가 리모델링 중이라그래서 검색해보고 갔어요. 정말 서비스 최악^^   흔히 말하는  외제차딜러갑질 있죠?  그런걸 레스토랑에서 당했네요?   직원분들 하나하나가 미쉐린가이드 쉐프인마냥 얼마나 갑질하던지.. 뭐 처음 가봐도 제가 음식점에대해 공부를 다 하고가야하는 그런곳인 가봐요?  물어보면  니네 그것도 모르고...더보기/미슐랭이라서 갔더니 고기는 보통이구요 직원들 서비스는 개판입니다 사장님 오셔서 직원들 관리 좀 하세요 입장부터 나갈때까지 눈도 안마주치고 대꾸도 안하고 불편해서 소화도 안되네요 인테리어가 다는 아닙니다./개인적으로 서울에서 소고기 제일 맛있게 먹을 수 있는 집 같음  뭐하나 고르기 어려울 정도로 다 맛있었음 콜키지 프리고 직원분들 정말 친절하셨음 :) 부모님 오시면 꼭 모시고 갈 곳임"
2,엑셀플레이스,"서울 성동구 고산자로 335 1,2층 (우)04704",양식,"Excel Burger,Lunch menu 싱글 패티부터 시그니처 버거까지 다양한 종류의 버거 주문 가능합니다,8,000,추천,55,000,39,000",5900,5.0,3,7, 점심시간이라 버거 시켜먹었는데 엄청 스트레이트한 고기버거에요 임팩트가 강력했습니당   며칠 뒤에 재방문해서 다른 고기 메뉴듀 시켜먹어봤눈데 가성비 굉장히 좋았습니다 
3,목포산꽃게아구찜탕,서울 성동구 마장로 331 1층 4호 (우)04756,"게,대게",표기안함,표기안함,3.2,52,72,"굿 ㅋ/오랜만에 예전에 맛있게 먹었던게 생각나서 갔는데 맛 완전 변절. 음식 세가지 코스요리처럼 다먹고 한참있다가 따지니까 나오고 미안해하지도 않음.  다시는 안갈예정/여기가 왜 맛집인지 모르겠네요.  줄서서 기다린 보람이 없음. 음식시킨지 1시간반 되서야 나옴. 그냥 평범한 맛./서비스 정말로 최하 수준임. 다시는 오고 싶지않은 업소입니다. 음식 주문한지 한시간만에 찔끔~/맛은 옆집들이랑 비슷함  다들 맛은 있다. 별이 1개인 이유는 음식이 나오는 시간 때문. 11시 오픈이라고 해서 10시 55분에 왔고 주문은 11시 5분쯤 받았다. 결과적으로 음식을 45분쯤 받았고 음식이 나오기 전에 테이크아웃을 먼저 해주는걸 봤다. 음식나오는 시간이 4~50분에 맛은 특별하지 않다. 다시는 오지 않을것이다./서비스질이 별로.. 그렇게 맛있지도 않고.. 사람도 많아 시끄럽.. 기다린 보람이 없음.  ㅠㅠ/금액대비 가성비 굿 꽃게찜 맛있어요/사실 가격은 처음에 갈때보다 조금 오르긴 했지만, 정말 맛있게 먹고 왔다. 뭐 다른거 떠나서 꽃게살 하나만큼은 다른 집보다 최고, 양념은 매콤하니 진짜 내 입맛에 딱임/가격에 비해 그렇게 맛있지 않다, 그냥 집에서 게를 사서 적당히 찌면 이런맛이 나지 않을까 하는정도. 신선하지 못한것도 조금 섞여있는것 같다 서비스의 질 또한 그다지 좋다고 하기 어렵다./맛의 균일성이 부족해요. 어떤날은 인생꽃게찜집일정도로 맛있는데 어떤날은 평범하고../시간절약을 위해 초벌로 삶았다가 다시 삶아 주는지 꽃게찜의 알이 이미 딱딱해져 있음.  그물망 잘린것도 있으니 조심해서 드세요/비오는 날 꽃게탕. 국물은 끝내줬는데. 활게의 싱싱한 육질을 기대했으나 푸석푸석한 식감. 많이 기대하고 갔으나 아쉽다./꽃게 크기나 싱싱함이 기대했던 거에 비해선 아쉬웠던 /11월5일 평점들 신기하다^^.../댓글 탐방하다보니 신기한 걸 발견했네요? 몇 명이 지역이 모두 여러곳의 같은 가게를 방문하고 5점 남기는 이상한 현상이 있어서 그분들 남긴 식당 파 봤더니 목포 강원도 서울  충청도 이런 지역 식당 별점을 매일 3,4개씩 올리고 댓글에 별점 5개를 주는 몇명이 겹쳐요... 특히 같은 날짜에 리뷰 올리신 여러명이요./여기꽃게찜 먹음 다른데는 못감~ 꽃게가 엄청 실해요~ 갈때마다 변함없어서 좋네요~/개인적으로는 찜보다는 탕이 더 좋음 요즘 날씨도 쌀쌀해지는데 넘 만족하고 갑니당/매콤하니 완죤 밥도독 입니다 호로로록 겨울철에 한번더 방문해야겠네요/지금 게철이라 그런지 살도 토실하니 , 양도 많고, 여긴 항상 갈때마다 사람 많고, 주차해주시는 분들 친절하고, 다 맛있음/TV에 나온맛집! 너무 맛있게 잘먹고왔네요/신선하고 실한 꽃게찜은 최고, 서비스와 가격은 아쉬움/매운거 절대 시키지 마세요~ 약간 맵게도 안되요!!/양이 이렇게 적나요 2 인 아구꽃게인데 구성이.  꽃게 한마리 . 그리고. 아구는 어딧죠..?  6 만원인데. 숙주가반이상  아구는 어딧는지 보이지도 않아요. 꽃게 한마리 6 만원주고 먹엇네요/맛은 보통보다 좀 더 위.양이 진짜 창렬하다/꽃게찜 대자 10만원 꽃게 크기 .....창렬하네여... 식당 숟가락이랑 비교했으니 보세요. /마장동맛집  목포산꽃게아구찜   이집꽃게 실하고 맛있는 집! 양념꽃게찜강추완전맛나요*^^*~~/별 하나도 아깝다 단체만 손님이고 테이블 하나는 손님아니냐 종업원은 불친절하고 반찬은 다 중국산이고 밥은 솥밥은 탄냄새고  절대 안간다.   /꽃게를 좋아해서 꽤 오래전부터 가끔 한번씩 가던집 오랜만에 갔는데 원래 이랬었나 싶게 아쉬운 점들이 속속 보임 많이 올라간 가격은 일단 패스 위생.. 앞접시랑 컵에 빨간 양념들이 남아있음 6개중 컵한개 빼고 모두 지저분하여 바꿔달라기도 애매함 설거지를 어찌했나 찜찜 반찬.. 맛있는건 메추리알 삶은거.. 물김치며 반찬류 5가지 더 나오나 손이 안가게 맛이 너...더보기/카카오맵 주변검색 이용하던 중 최악이예요./미국산 아구인데 아구찜은 뼈와 콩나물 밖에 없네요...손님끊기는거 한순간입니다/최고/가격비싼거 빼면 나무랄데 없음. 발렛은 선택이 아닌 필수. /ㄱ"
4,전봇대집,서울 성동구 살곶이길 40 (우)04752,"육류,고기","꽃등심 (300g),살치살 (300g),갈비살 (300g),꽃치마살 (300g),토시살 (500g)",48000,3.0,13,40,"불법무허가 먹자골목입니다. 전혀 세금내지않고 있으며 도시가스를 쓸 수 없어 LPG가스통을 쓰다보니 폭발화재 위험! 2022. 3.19. 대형화재! 부당한 방법으로 부를 축적! 손님 및 주민 생명위협! 천벌받아 마땅합니다./50대 후반에 이르기까지 방문한 고기집중 최고의 맛집. 갈빗살, 등심, 꽃등심은 되레 평범하게 느껴질 정도로 살치살, 안창살, 치마살, 토시살이 예술. 육우와 한우를 특정지어 주문이 가능하니 참고하세요/맛있는데 연기땜에 눈 따가워서 별 하나 뺐어요/한우시켰는데 아무리봐도 육우같은데.. 한우가 맞는데 이정도 수준이면 갈 필요가 아에 없는 집 /맛있었다 ㅋ  같이 나오는 소고기 무국 ㅈㅁㅌ/한 5년만에 찾은 마장동 먹자골목........ 가성비라는 단어를 붙이기에도 뭔가 많이 아쉬움..... 이 골목 자체가 그런건지는 모르겠으나...... 다들 비슷할거라는 생각이 듦....... 재방문의사 0%  요즘 이런식으로 하면 장사가 될까라는 생각이 듦 평가하고 댓글달고... 세상 귀찮은 일인데 내가 지금 이걸 하고 있슴... 그나마 내가 계산 안한건...더보기/며칠 전 친구랑 둘이 갔었는데 먹고나서 둘이서 나란히 설사했어요. 당일에 고기 배터지게 먹겠다고 둘 다 여기서만 밥 먹었어서 여기가 원인인 것 같구요. 술도 전혀 안 마시고 고기만 먹었는데 다음날 아침부터 며칠간 몸이 고생하니 짜증나요... 고깃값 10만원에 병원비에 육체적 정신적 고통까지... 두번 다시 안 갈거에요./모듬세트 맛이 별루. 별하나두 아깝다/예전에 자주 간 곳! 소스가 맛있습니다ㅎ ★★★★/육우에대한 편견을 없앨수있다. 근막 불필요한 지방질 없이 아주 잘 손질된 치마살 고기에서 찰기가 느껴진다. 특히 이집 찍장소스가 맛있고 고기를 먹다보면 적절한 타이밍에 쇠고기무국을 서비스로 주는데 술을 부른다."
