,name,address,sort,menu,mean_price,score,people_give_score,review_count,review_list
0,밀로밀,서울 마포구 희우정로10길 9 1층 (우)04017,"제과,베이커리","소금버터빵,올리브치아바타",2500,4.6,27,22,"전체적으로 안 달아서 너무 좋음 !! 늦게가서 소금빵은 못 먹었는데 치아바타가 미쳤음 쫜득고소 치아바타 안 먹으면 바보 ,,, 담엔 소금빵 도전하러 갑니다/12시에 오픈하자마자 갔는데도 앞에꺼 다나가고 한시반에 빵이나온다는거는 무슨경우죠? 오픈시간 맞춰간사람 어이없게 예약으로 다 빼버리네;;; 그럴꺼면 애초에 오픈시간을 한시반으로 공지하시는게;;/소금빵...얻어걸렸네요 지나가다 보석찾은기분?ㅋ.ㅋ/스콘이 겉바속촉의 정석!/맛있습니다. 동네라 자주가던곳인데, 어느순간 소금빵금액이 오르고, 1인주문갯수도 바뀌고, 예약제로 운영하시네요. 한창 소금빵만들고 있는데 그날 하루의 예약이 꽉차서 사먹지못한다는...인스타 안하면 예약못하나요? 젊은 친구들 sns 하는사람들만 먹을 수있는걸로 바뀐건지. 항상찾아가서 먹던 사람은 그냥 가던대로 가면 먹지못하는 구조로 만들어버리신거같은데 초심유...더보기/소금빵 진짜 최고입니다ㅠㅠㅠ 품절 빠르니 나오는 시간대 미리 예약하는게 좋아요 진짜 따땃할때 먹으면 최고.../아 여기…너무 맛있어요…오픈런했는데 소금빵 2개 밖에 안남았대서 ㅠㅠ 5개 사고 싶었는데 다음엔 더 일찍 가려구요! 여기 빵 다 맛있네요. 매장에 들어가자 보이는 제빵사 분을 보고 아 여긴 무조건 맛집이다 라는 생각이 들었고 역시나 맛도 맛있어요! /넘맛있어요 ㅜㅜ 먹어본 소금빵중 최고…./I am french and this is the best 크루아상 of Seoul that I’ve tasted so far. /맘모스는 먹다보니 조금 물려요. 하지만 소금버터빵은 너무 맛있네요~ 빵을 별로 안좋아하는데도.. 소금버터빵 사러 또 가야지.. 그리고 사장님을 비롯해 직원분들도 친절하시네요. 여러가지로 괜찮아요~/먹다가 급하게 후기 남겨요 ㅜ 바질 치아바타 존맛탱 ㅠㅜ/가야는이유 : 쫄깃한 식감과 담백한 빵들 안가는이유 : 근처라면 자주 이용할듯  무화과바게뜨 : 조린 무화과도 맛있고 구수함도 좋았으나 질긴 식감보단 바삭함이 조금 더 있었으면 롤치즈빵 : 속은 쫄깃하고 치즈도 많이 들어있어 와인과 잘 먹었음 모카크로와상 : 시식으로 먹었으나 기대한 크로와상의 맛보다는 단맛이 상당히 강했음/바게뜨 정말 맛있어요."
1,어글리베이커리,서울 마포구 월드컵로13길 73 (우)04014,"제과,베이커리",표기안함,표기안함,3.0,192,614,"얼그레이 크림빵이랑 맘모스 다 맛있음 웨이팅 하면서까지 먹진 않을듯/맛은 그냥 쏘쏘  필링이 푸짐해 보일수 있지만 가성비 좋은지 모르겠음  그냥 상상 가능한 맛  다행히 줄이 없을때 가게됐는데 어수선하고 지저분함 웨이팅이 있으면 굳이 재방문 할정도는 아닌..?  빵 포장해준 여직원이 너무 기분 나뿜... 빵을 툭 던져서 주고 흘깃 쳐다보고 뒤돌아가심... 뭐 이건 가게 탓이 아니니 별점에 반영한건 아니지만  기분이 너무 안...더보기/줄이 너무나도 길다 일처리가 이건 아니다/말차 맘모스 최애 ㅠ0ㅠ 너무 맛있어요  집이랑 가까우면 좋겠어요 알바생분들도 왕친절 하심  /어느 정도 호불호가 있는 곳입니다./말차덕후로서 말차 시리즈들 너무 맛있었습니다/예전이나 지금이나 왜 줄서는지 모르겠는데, 부재료 푸짐한 건 마음에 들어요. 그러나 빵 퀄리티는... 웨이팅 시스템 좀 개선 했으면 좋겠다는 생각이 들었어요. /생각 이상으로 더 더 맛있어요 이렇게 속재료가 빵빵하다니.. 충격  부모님이 좋아하시는 빵 오랜만이라서 기뻐용☺️/기대 많이 하고 빵도 한가득 샀는데 그냥 그래요ㅠ 일주일이 지났는데도 다 못먹고 집에 있네욤.../그저 그래요 ! 맛없진 않아요/브리오슈 생크림 팥빵: 생크림의 단 맛이 거의 느껴지지 않아요. 빵도 쫀득쫀득 부드러운 느낌이 아니었어요. 단팥도 거의 달지 않아서 전반적으로 맹맹한 느낌의 빵이었어요. 생크림 양은 어마어마했어요. 원래 생크림팥빵 좋아하는데 다시 시도는 안 할 것 같아요.  뽀또 맘모스: 리뷰에 다들 맛있다고 써 놓아서 기대했는데 그저 그랬어요. 치즈의 짠맛과 전반적인 조...더보기/사람많은거 상관없이 그냥 맛이없어요 왜 줄서서 먹는지 이해가 안되는곳 한번가고 안갑니다/정말 매장이 엄청 더러워요. 곰팡이, 먼지, 묵은때자리, 거미줄, 불결하기가 없는게 없을정도로. 말했더니 굉장히 이상하게 쳐다보더군요. 줄 서 기다리는걸 보고 지나쳤는데 돌아왔을땐 줄이 짧아져서 구입해보려고 했는데. 너무 더러워서 사질 못하겠더군요. 요즘 유행하는 크림 많이 들어간 빵종류인데 그런 매장에서 파는 걸 줄서서 먹는게 이상하게 느껴질 정도였어요....더보기/가격 비싸고, 빵도 특별할게 없는데 왜 줄스는지 이해가 안가는집. 굳이 따지자면 특이한(특별이 아님) 빵이 있다는 정도?/줄서서 먹을 정도는.. 한번이면 족함 아니 안먹어도 괜찮/너무 기다려야 함 안에 들어와서 고르다 보니 직원들은 한가함 미리 고를 수 있게만 해줘도 기다리는 일 없을 것 같은데 개선할 생각이 없는 건 장사가 잘되니 그런 거겠지?    빵은 한번 먹어볼 정도의 맛이고 기다려서 두번 살 정도는 아님 /뭐가 맛있는지 하나도 모르겠는... 유명해서 왕창 사갔는데 다 보통도 아닌 맛없었어요.. 대파빵은 먹다가 이랑 잇몸 나갈뻔 ㅜㅜ/와 너무 맛있다 흑임자스콘 ㅠㅠㅠ 고소하고 달달 쑥맘모스는 아직 먹기전이지만 포장이ㅣ 잘되었네요 또가야지 토요일 저녁 7시반쯤 갔는데 웨이팅 하나도 없었어용/터지는 크림이 충격적이고 비주얼도 압도적이었음/친절하시고 매장 깔끔! 치아바타랑 뽀또맘모스 존맛탱 /일단 이 날씨에 기다리는 건 좀 무리예요 ㅜㅜ  맛이 이걸 능가하는건 잘 모르겠어요....좀 먹기가 힘들어요/줄 서서 기다려 사온 보람이 있는 맛이랄까요. 다양한 라인업 거의 대부분 먹고 나면 행복해지는 맛들입니다.  사람 많고 계속 바쁜 와중에도 직원분들 모두 활기가 느껴지고 친절하셔서 좋았어요!  아 추가로 전체적으로 조금 단맛이 강한 편입니다. 본인은 단맛을 좋아해서 그점이 오히려 좋아요./올리브 치아바타 맛있음 구황작물 사워도우는 내용물이 좀 과해요/얼그레이크림빵 맛있음/잘먹었습니다 /크림빵류 맛은 있는데 먹다보면 질려요. 쑥맘모스 맛있고 뽀또 맘모스는 돈아까웠음. 올리브가득치아바타 담백한게 계속 들어가고 단호박크림치즈사워도우 평이 좋아샀는데 큰 매력은 못느꼈어요. 기대 전혀 안해서 그런지 대파빵 의외로 맛있었는데 친구는 별로래요 ㅋㅋ/엄청나게 맛있기보단 비주얼이 먹음직스러운 정도? /크림빵이나 팥 들어간 빵만 먹기를 추천 다른건 잘 모르겠음... 대파바게트는 파가 너무 따로 놀아요ㅠ 크림빵이랑 쿠앙쿠앙만 먹었다면 5점 줬을 듯/빵에 대한 이해 없이 겉보기에 화려한 근본없는 빵만 만드는곳. 직원에게 잘나가는 대표 빵 위주로 네다섯개 추천 받아서 집에 어른들 사다 드렸는데 다 드시다가 포기..  너무 맛이 물린다고 해야될까.. 이름만 어글리가 아니라 맛도 어글리/잘먹엇어요/특색 있는 제품들이 있지만 멀리서 방문하거나, 긴 시간 대기해 구매할 정도는 아님. 크림보단 팥 들어간 제품 추천. 팥이 과하게 달지 않고 알알이 살아있어 식감이 매력적. 대파빵은 정말 별로.  / 직원 오해로 1시간 30분 기다리고도 새치기한 사람 됐는데 사과 한 마디 없어 불쾌했음. /1시간20분 줄 섰는데요 절대 그럴 가치 없어요 크림빵, 맘모스는 그나마 괜찮은데 대파빵 진짜 별로입니다.. 왜 이렇게 유명한지 모르겠네요  그리고 매장 운영 방식 너무 효율성 떨어짐 "
2,청어람 본점,서울 마포구 망원로 97 1층 (우)03963,"곱창,막창","양깃머리 (1인분),곱창 (1인분),막창 (1인분),곱창전골",23000,3.2,134,104,"너무너무 맛있어요 사람도 많아서 너무 다닥다닥 붙어 앉아야 하기는한데 주문 하자마자 전골 나오고 볶음밥도 존맛.. 곱창도 엄청 많아요 볶음밥 드실테지만 곱창전골 먹을 때 공기밥도 시켜 드세요 밥 무조건 필수 …. /갈때마다 너무 맛있고 바쁜데도 항상 직원분들 친절하셔서 기분좋게 항상 먹구갑니당/언제나 good/별로 맛도 예전 같지 않아요/사람많은건 상관없는데 아주 빨리가라고 재촉하고 사람 앉아있는데 치우고 꺼지라고 하는통에 기분 드러움/맛은 있습니다. 종업원들 불친절. 자리 많아도 일행이 늦게오면 뭐라함. 기분나빠서 맛있어도 안가고싶음. 사장 인성 쓰레기/왜 유명하지.. 할매순대국 곱창전골이 더맛있음/맛 변함  사장아저씨 자꾸 손님 뒷담깜/마시써요 ,, 제가 먹어본 곱전 중에 최고 ㅠ 근데 본점 말고는 지점마다 맛이 좀 다른 느낌? 본점이 최고다 ~/맛 변했고 볶음밥이 진짜 맛없음. 그래도 여전히 기본은 있어서 가지만 예전 맛 기억하면 눈물남/푸짐하고 좋아요/가격대비 괜춘..하고 이모님들도 친절하심 그러나 웨이팅해서 먹을 정도는 아니고.. 그냥 너무너무 평범한 맛이었음 ㅠㅠ /곱창전골 맛있어요. 단, 점심때 볶음밥 안되는거 매우 아쉽네요./존맛탱 곱전엔 소주인데, 조명이 너무 밝아서 식사만 하게되는집,,, 그치만 소주를 드시는 분들 많아요!  오랜만에 또 가고싶네요ㅠㅠ/국물이 시원하고 맛있어요 다만 양이 조금 아쉽/포장해서 먹어봤는데 국물이 달고 별로였어요../내가 먹어본 곱창전골 중 최고였어요.강추/청어람 10번넘게왔는데 지금 확실히 변했어요 예전엔 볶음밥 추가도 필요없었는데 이번에 가보니 곱창 양이 절반이됐고 쓸데없이 무가 추가돼서 맛도 연해졌어요... 배추도 쓸데없이 많아졌고요 진짜 확실히 변했습니다 청어람 매니아인 4명 다 그말했어요/그냥드셈 소주원킬 배추의 시원함 나중에 곱창의곱이 국물에듬뿍 취합니다/존맛탱구리❤ 우리집 앞에 있으몈 좋게써여/전골대짜 포장했는데 친절하고 맛도있었어요~/웨이팅 매번 길어서 포장해서 먹는 편이에요!! 곱창전골은 청어람이 짱입니다 ㅠㅠ/곱창이 입안에서 녹을정도로 흐물거리고 식감이변했어요. 어떤곱창은 괜찮은데 어떤건 너무 많이 끓였는지.. 그날전골상태가  안좋았어요. 맨날 여기서 주문했는데 다음날 배탈도 났네요../배부른 상태에서도 맛이 괜찮았다 양파때문에 약간 달짝지근한 닭도리탕 맛이지만 곱창도 고소하니 괜찮고 야채도 신선하다 추가곱창 시키지말고 처음에 대자로 시키면 좋다 추천합니다 후쿠오카에서 먹었던 모쯔나베 한국판/4명 예약하고 3명이 먼저 가서 4인분 주문한대도 못 들어가게 막는 이유가 뭔가요? 갑질 당하는 거 즐기는 분들은 꼭 가봐야할 집^^/여긴 친절에 맛도 좋고 더할나위 없어요./유명한 곱창전골의 명가로 칼칼하게 매운 맛이 인상적이지만 포천의 '이레해장국'보다는 못하다./우동사리 추가 안 해도 기본 제공되는거 안내 안 해줘서 곱창우동으로 먹음;; 점심에 가서 생각보다 친절했지만  브레이크 타임이라고 칼같이 내쫓음 당황.. 미리 시키기 전에 말해주던가;; 볶음밥은 4시 이후만 가능한게 개쌉어이없는 부분 인정? 어 인정 국물 달다는 평 많던데 진짜 달았다...... 가끔 꽉 찬 곱창 있던데 그거 덕분에 맘까지 속상하진 않았음!/담백하면서 살짝 얼큰한 국물이 넘 좋아요 ㅜ 곱창 양도 은근 많아용 ~~/가격대비 먹어볼만한 맛. 그닥 맵지 않고 단맛이 도드라지는데 아마 배추가 많이 들어가 그런가봄.  긴 웨이팅이 없다면 좀 더 자주 먹어보겠지만 그렇게까지 시간투자할만큼 꼭 먹어야 하는 음식은 아닌걸로. "
3,소금집델리 망원점,서울 마포구 월드컵로19길 14 2층 (우)04012,샌드위치,"잠봉뵈르 샌드위치,제주 흑돼지로 만든 잠봉과 프렌치 이즈니 버터로 가득 채운 소금집의 시그니쳐,14,000,파스트라미 샌드위치,비프 파스트라미에 치즈와 피클, 머스터드를 곁들인 아메리칸 사워도우 샌드위치,14,000,모르티 샌드위치,모르타델라, 아이올리소스, 루꼴라, 어니언 피클로 맛을 낸 포카치아 샌드위치,17,000",14333,3.9,253,715,"말모  잠봉뵈르랑 크로크마담 존맛. /맛있어요! 잠봉프로마쥬보다는 원조가 나아요 /미친 존맛/샌드위치 당연히 맛있고 스프도 존맛/인생 샌드위치 맛집. 주기적으로 생각나는 맛집입니다./주기적으로 생각남/생각했던 것보다 잠봉뵈르는 맛있지 않았다. 당근 라페 샐러드는 훌륭합니다./자주 방문하는 단골집입니다./짐봉뵈르 맥주랑 아주 잘어울려요/잠봉뵈르가 정말 맛있어요. 햄류도 사서 집에서 와인이랑 마시기 좋아요 최고입니다!/주말웨이팅 너므 빡세지만 (2시간 기다림) 너무 맛나서 용서됩니다. 잠봉뵈르는 말할 것도 없고 비엘티샌드위치는 처음 먹어봤는데 넘 마시써요 크/잠봉뵈르랑 비엘티 먹었는데  너무 마싯내요,, 비엘티는 처음인데  빵이 쫀득하고 내용물이 조화로운거쉬,,  또 먹고 싶은맛!  /잠봉뵈르 한개에 11000원… 걍 서브웨이 세트 드세요 그리고 간이 너~무 쎄요 너무 짜요 정말 아무리 소금집이라도 쫌 심하게 짜요/3.5점 드리고파여/잠봉뵈르 당근라페 맛있었어요 베이컨 에그 플레이트는 쏘쏘/일단 잠봉뵈르는 맛있음 소시지 플래터를 시켰으나 소시지 맛도 그닥이었고 양이 가격대비 너무 적었다 그리고 음식이 전반적으로 너무 짬.. 소금집 닉값 인정/아랫분 후기가 신경쓰였는데, 당일구입한 잠봉먹고 몇시간 후 식중독 증세 나타남. 저녁에 잠봉외에 섭취한 음식은 없었음.  소금집정도면 꽤나 유명한 식당인데 대체 어떻게 조리하길래 이럴수 있나 싶음.  빵,버터.잠봉 조합인데 잠봉햄에 문제가 있다고밖에 의심이 안됨. 두번다시 재방문 의사 없음. /식당으로는 3.5, 잠봉뵈르엔 4.5 이상 처음엔 줄 설 정도인가 싶다가, 정작 이만큼 충실한 잠봉뵈르 집도 떠오르지 않는다. 흔한 메뉴가 아닌 덕에 누굴 데려가도(2인 적합) 좋았다. 늘 평이 괜찮았달까. 가성비는 좋지 않지만 그럼에도 맛집. 웨이팅은 그럼에도 사악해서 웨이팅은 안할 생각. 동네기에 잠봉뵈르 하나 포장해서(포장은 웨이팅이 없다) 와인, 맥...더보기/웨이팅 2시간이라는 소문에 심플 이즈 포장을 했음에도 맛은 아주 평범함  집에서 간단하게 한끼로 충분함/잠봉뵈르에 버터가 너무 많아요. 기대보다는 큰 감흥없어요/맛있어요! 웨이팅보다 포장 추천해요 ! /잠봉뵈르 첨먹는데 엥간 맛나요! 근데 현지인(프랑스인) 말로는 too much butter 라네요..,, 반개 먹으니까 좀 느끼하긴ㅍ했음 그치만 그 곁들여나오는 소스랑 반찬같은거 같이 먹음 맛나용. 웨이팅 한시간은 기본이니 가서 예약하고 근처 카페에 있다 먹는거 추천합니다! 한국에서 이정도 퀄리티의 잠봉뵈르집은 이집이 유일무이하다고 생각해서 별5개 빠방~♡...더보기/잠봉뵈르, 루벤 최고,,/잠봉뵈르 최고!!/Best sandwhich ever!/머플레타 샌드위치 포장 11000원 (2021. 09.26) 부드럽고 담백한 빵과 다채로운 속재료로 재료 하나하나의 맛이 느껴지고, 전체적으로 풍부한 맛이 남. 소스는 사우전드아일랜드 드레싱같은 느낌? 다양한 맛이 조화롭다기보단 다소 튀는 맛이라 개인적으로는 잠봉뵈르가 담백, 고소, 짭잘하니 조화롭게 더 맛난 듯./포장하러 갔는데 웨이팅이 18팀이었음.. 커스텀 없이 주문하면 바로바로 포장이 나오고 커스텀하면 조금 시간이 걸려서(길진 않음) 1층 입구 쪽에서 대기해야 함. 재료 빼달라는 부분에서 예민하지 않게 반영해줘서 좋았음. 잠봉 프로마쥬 주문했고 머스타드랑 재료들 조화가 좋았음. 맛있게 먹었음. 재방문 의사론 웨이팅 길면 안하고 바로 살 수 있으면 사오고 싶은 ...더보기/보통이에요/언제나 잘 먹었습니다. 잠봉뵈르와 루벤, 오늘의 스프… 잠봉은 역시나 최고. 루벤도 나쁘지 않았으나 호불호가 갈릴 듯. 평일 12시 반 정도에 방문했을 때 1시간 10분 웨이팅 있었으니 참고하시길 바람... /포장해서 먹는게 더 맛있는거 같음(?)/잠봉뵈르가 진짜 ♬♬♩♬이고 맥주는 꿀꺽이 맛있습니다 크로크마담은 제 기준 많이 짠 편인데 위에 올라가는 수란이나 감자튀김과 같이 먹으면 적당합니다  뭐 먹을지 고민되면 일단 잠봉뵈르 시키고 조리하는 동안 골라도 됩니다/두 세시간씩 기다리며 비좁은 매장에서 먹는 사람 = 하수 포장해서 한강이나 선유도공원에 돗자리깔고 먹는 사람 = 고수"
4,망원동즉석우동전문돈까스 본점,서울 마포구 동교로 83 (우)04018,"돈까스,우동","즉석우동,어묵우동,어묵 (1인분),돈까스",6750,3.8,187,413,"맛잇어요!!!!/사람많아도 회전율좋고 생각보다 넘 친절하심 우동 존맛탱/무난무난한 맛/돈까스가 상당히 얇아요.. ㅎㅎ 개개인마다 다르겠지만 전 조금 불호.. ㅠ/우동.. 솔직히 평범한 포장마차우동인데요 왜 자꾸 생각나니 너  맛나요 맛나b   /매운건 진짜 매움 ㅋㅋ/우동은 면은 다른 우동에 비해 얇고 꼬들한데 맛은 평범했음. 돈까스는 꽤 맛있었음. 무난하게 종종 올 거 같음./우동보다 돈까스가 진짜 맛있음/평타 이상하는 집 근데 맛집인지는 모르겠음/돈까스는 몰겠고 우동은 찐 내스탈 ~ /""20년간 한결같진 않지만""  -지금으로부터 20년전, 지금 가게건물 앞 포장마차 형태였을때부터 30대를 앞둔 지금까지 20년간 이용해온 단골임. 재수생 신분일때엔 소울푸드였었음. -즉석우동은 뭐 여전히 서울지역에서 다섯손가락 안에 꼽힐게 틀림없음.  -맛집이라 유명한 것에 비하면 회전율 꽤 좋은편. 코로나 이전에 19년도인가에 새벽까지 운영할땐 정말 밤1...더보기/내 소울 우동 ^^*/점심 때 그냥 간편하게 먹기 좋은 곳인데 놀면뭐하니 나오고 나서부터는 아예 못 감.. 그정도 줄 설 집이 아닌데 참 방송이 대단하긴 한듯 ㅋㅋㅋㅋㅋㅋㅋㅋ/인스타 사진 필요없는 분들은 가서 먹을 이유가 별로....있나요? 왜? .....  줄서서 기다리고 유명 맛집인가봐? 해서 드시는 맛인가요?/우동 매운맛 진짜 맛있는데 돈가스는 평범함 추운 날 2차로 오면 그렇게 행복할수가 없는데 요즘은 웨이팅 기본이라 다른 곳 간다…눈물…/그냥 동네 어디서나 먹을 수 있는 우동, 돈까스 맛. 요즘 왜 이렇게 줄 서는건가 했는데 유재석 힘이 대단하네.ㅋㅋㅋ 여길 줄 서서 먹는다니... /돈까스 맛있어요 /맛있어용/가격대비 괜찮고 즉석우동 깔끔하니 맛있어요/놀면뭐하니/가격대비 갠춘/자주 먹으러 가는 돈까스집/옛날 돈까스의 정석./그냥그냥/그냥 우동입니다. 분식집 우동맛. 솔직히 휴게소 우동이 더 맛있어요./재석이형..그는 역시 프로방송인이었다/평범한 맛이었던 것 같아요. 추울 때 먹으니 속이 따뜻해지니 좋네요. 오픈 시간 전부터 갔는데 영업 일찍 시작하신 것 같았고 대기는 한 20-30분 했습니다. 중간맛도 매워서 매운 거 못 먹는 사람들은 순한맛 시켜야 할 듯 해요/무난함/첫끼로 먹으면 속이 따가움. 보통맛이나 순한맛 시키세요. 유재석이 속풀릴거같다는 말은 이해가나 짜네요/무난한 맛입니다. 휴게소 돈까스랑 우동인데 좀 더 맛있는(?) 줄서서 기다릴만큼 맛은 아니에요 ㅎㅎ 가격도 저렴한건 아니여가지구 무난 무난합니다/추억맛"
