,name,address,sort,menu,mean_price,score,people_give_score,review_count,review_list
0,호호식당 대학로점,서울 종로구 대학로9길 35 1층 (우)03079,일식,"사케동,히레가츠정식,가츠나베정식,우나기동,돈가츠정식,생선가츠정식",15333,3.3,143,349,"사케동 먹으러 가즈아/인테리어 분위기 1티어 음식맛 3티어, 딱 2티어인 집. 도산대로에도 생겼다길래 맛이 좀변했나싶었지만 혜화대로라면 도산대로에서 발릴듯하다......더이상 특이한 메뉴가 있는것도 아니고ㅋㅋ 거기다 항상 양이적네요.....일식의 묘미를 이렇게 살릴수도 있다 군요(+돈테키정식이면 돼지고기인데 무조건 미디움레어로 나옴)/인테리어이쁘고 브레이크타임 한시간 전에 가서 잘 먹고옴. 생선까스 맛있고 약간 레몬섞인 단 타르타르소스도 잘 어울렸음. 다만 레모네이드주문했는데 누락시키심ㅠ/넘맛있게  잘  먹고  왔습니다 음식도  맛있고  인테리어도  좋고 직원분들도  친절하시고  대만족!!!/명성에 기대했으나 느끼해서 많이못먹음 메뉴도 호불호 갈리는편 인테리어가 이뻐서 조용히 먹기 좋음/오픈시간맞춰가면 웨이팅피할수있어요  웨이팅줄이 가게입구밖까지 있는경우가 아니라면 가게둘레에 앉아서 메뉴보면서 기다릴수있기도하고 카톡알림 웨이팅시스템이 갖춰져있는점이좋아요  운이좋으면 예약없이도 별채앉을수있는데 별채가 분리되어있기도하고 대화나누기좋아요 좌석 간격이 넓지도않지만 코로나칸막이생기고는 조금답답해요 별채아니면 입구로 들어가자마자 보이는 자리가 편합니...더보기/웨이팅 없는거 좋아하지만 일찍 만나서 미리 가니까 2~3팀만 있더라고요 그 뒤론 계속 웨이팅이였었고 전에 여기가 왜이리 줄이 많지 맛집인가했는데 맛집 맞네요! 기다리면서 주문 먼저 받으셔서 들어가자마자 바로 나왔습니다 저는 사케도로동 시켰고 남자친구는 히레가츠정식시켰는데  둘다 맛있었어요! 이날 구내염이 아직 안나아서 진짜 아팠던 날인데 연어랑 한입에 먹었...더보기/가츠나베가 짜기만 하고 별로였어요../분위기가 특색 있어요 맛은 평범한 일식집/항상 웨이팅있고 정신없음, 맛은 평범 하이볼 맛있음/4인 테이블이 거의 없어서 3명이상 가시면 엄청난 웨이팅을 경험 할 수 있습니다/돈까스 너무 맛있고 바삭바삭해요ㅜㅜ 직원분들이 진짜 친절하세요 가게도 예쁘고 분위기도 좋아요/미접종자는 PCR음성확인서 들고가도 안받아줍니다. 참고하세요/한번은 가겠지만... 우선 음식이 전체적으로 짭짤한편 + 피클은 경악... 인스타용맛집인듯../솔직히 여기보다 맛있는 사케동 많은데 가격이 사악해요. 사케동뿐만 아니라 전체적으로 가성비 안좋습니다. /먹을만함 음식 빨리나옴 웨이팅 별로 안긺 사람 너무 많음/두 번 방문함. 목살 스테이크랑 사케동 먹음. 사케동? 꿀맛 4점 목살 스테이크? 4점 분위기? 4점  합격 /부카케 ☆☆☆☆ 사케도로동 ☆☆☆☆ 사케동 ☆☆☆☆ 하이볼 ☆☆  솔직히 이 프랜차이즈는 하이볼이 메인이고 나머지는 안주라고 생각합니다.   무더운날 하이볼을 시켰는데 음식을 반쯤 먹어서야 나와 서빙 순서에 대한 아쉬움이 있었습니다.  늦게 나온 하이볼은 위스키 맛이 너무 강했고, 머리가 아팠습니다 ㅠㅠ 레시피의 표준화가 잘 이루어져야 할 듯 합니다/맛있고 웨이팅 있어요. 호호식당이라 믿고 와서 잘 먹고 갑니다. 다만 하이볼이 다른 호호식당에 비해 위스키 비중이 큰 건지 조금 쓴 것 같아요/11시에 열리자마자 갔는데 웨이팅 할뻔했습니다 튀김이 아주 맛있네요, 연어스테이크도 좋았습니다 부모님 모시고 갔었고 두분 다 만족하셨네요ㅎㅎ/웨이팅 20-30분 정도는 기다려서도 먹을 만한 곳입니다  직원분들 친절하고 음식 맛도 좋고 양도 넉넉합니다/혜화 4년살았는데 여기가 근처에서 젤 맛있음  배달시켜먹어도 존맛 ㅠ 평일 조금 이른시간에 가면 웨이팅 거의 안하고 먹을수있음  모든 메뉴 다 맛있고 특히 돈테키정식이 젤 맛있는듯  요즘 호호식당 근처에 다른 비슷한 컨셉의 식당들 많이 생긴것같던데 다 가봐도 여기 반의반도 못미침..  나름 먹는거에 까다롭다고 생각하고 자주 가는 식당도 거의 없는데 친구나 ...더보기/밥에서 머리카락 나왔어요../연어사케동 비린맛 안나고 맛있음/4시반부터 줄스고 5시 1차 못들어가도 계속 기다리는분들 많던데.. 맛이 없는건 아니지만 맛평범 분위기평범인데 웨이팅쩔어서 굳이? 대학로에 먹을데 드럽게멊나보다는 생각밖에는.. 글고 폰충전기 드려도 폰충전안해주심.. 각박/가격 대비 양 적음. 맛 평균치. 기다릴정도는 아님. 인스타용 맛집./웨이팅 ㅠㅠ 맛은 쏘쏘/인스타용 맛집/웨이팅 가격 양 ㅜㅜㅜㅜㅜㅜ/너무 맛잇고 회전율도 빠르고 직원이 친절햇어요/음식, 공간이 깔끔하고 정갈해요. 1시간 넘는 웨이팅을 감수할 정도는 아닌듯ㅜㅜ"
1,정돈,서울 종로구 대학로9길 12 지하1층 (우)03079,"돈까스,우동","등심 돈카츠 카레(120g),맵지 않은 기본/ 약간 매운 맛/ 매운 맛,17,000,안심 돈카츠 카레(120g),맵지 않은 기본/ 약간 매운 맛/ 매운 맛,13,000,14,000,18,000",13500,3.7,299,197,"수요미식회를 통해서 알게돤 맛집입니다./확실히 바싹 익히지 않는건 익숙하지가 않네요./잘 조리된 양도 넉넉한 돈가스에 단무지 피클까지 맛있었는데 맛은 취향이 아닌듯합니다(호불호)/양 넉넉하고 회전 빨라서 좋았습니다. 사람이 많아서 가게 분위기는 조금 어수선해요... 가방둘 곳도 없고... 그냥 친구끼리 가기 좋아요.../계산 기다리고있는데 사람 덩그러니 세워두고 계산해주다가 밖에 대기하는 사람들 주문받으러 나가는건 좀.. 몇년만에 다시 와본건데 또 가진 않을듯. 처음 생겼을 때보다 일식돈가스 제대로하는 집들도 많이 생겼는데 ㅋㅋ  먹을만은 한데 가격이 더 올라서 좀 비싼감은 있고 멀리서 찾아오거나 대기타다 먹을맛은 전혀 아니에요. 가성비로는 이 근방에서 안좋음에 가까움. ...더보기/예전에 맛있었는지는 모르겠으나, 눅눅한 튀김옷은 개인적으로 정말싫어하는거라 2점드림. 고기와 레몬소금은 만족했음/세상 부드러운 돈까스… 닭안심이 퍽퍽할까 걱정했는데 정말 촉촉부드러웠어요/제가 간날만 그런가 돼지누린내나고 별론데 ㅠㅠ 요새 돈까스 상향 평준화돼서 줄서서 먹을정도는 아님/이름값 하구나 평일저녁 웨이팅 10분은 그냥 할수있다 일식돈까스중에서는 제일 맛있었다/웨이팅 긴 거 빼곤 좋았음/안심이 부드럽고 맛있어요. 그치만 웨이팅할 만큼은 아니에요./가격 보소 ㅋㅋㅋㅋㅋㅋㅋㅋㅋㅋㅋㅋㅋㅋㅋㅋㅋㅋㅋㅋㅋㅋㅋㅋㅋㅋㅋㅋㅋㅋㅋㅋㅋㅋㅋㅋㅋㅋㅋㅋㅋㅋㅋㅋㅋㅋㅋㅋㅋㅋㅋㅋㅋㅋㅋㅋㅋㅋㅋㅋㅋㅋㅋㅋㅋㅋㅋㅋㅋㅋㅋㅋㅋㅋㅋㅋㅋㅋㅋㅋㅋㅋㅋ/전체적으로 음식에 신경쓰이는 게 확실히 보임 된장국도 야채/고기 육수 뽑아서 쓰는 것 같고.. 일반 미소된장이나 돈까스집 가면 주는 국물이랑 차원 다르게 진하고 감김 밥도 엄청 고슬하고 찰져서 동까랑 잘 어울리고 트러플 소금/레몬소금/와서비는 뭐 당연히 잘 어울리고 밑반찬 조합도 너무 좋았음. 고추장아찌?도 한 번씩 입 리프레싱에 도움 되고 솔직히 이 가격...더보기/맛평가 아님. 선 주문 받고 기다리다 입장. 대기 10분 정도. 5분이 지나서야 메뉴 품절이라고 말함. 다른 메뉴로 바꿨는데 그것도 품절. 왜 그걸 뒤늦게…? 이럴거면 선주문은 왜 받는건지… 그리고 배달 때문인지 메뉴 준비 사간 30분 넘어갑니다. 평일 오후 5시 55분 입장 기준/1 줄 * 지나가다보면 항상 줄이 길었음.  * 막상 먹어보니 굳이 20~30분 기다릴 정돈 아님.  2 가격 * 등심+안심 조합(1인당 19,000원) * 기린 이치방 맥주(1병 330ml 7,000원)  * 자주 먹기에는 부담스러운 가격.  3 고기 * 겉바속촉, 말 그대로 겉에는 튀김 입히고 안에 고기는 레어로 익힌 것 같은데 호불호 갈릴듯. * 평소...더보기/히레카츠에서 핏물이 주르륵 흘러서 먹기도 전에 입맛이 떨어졌어요ㅜㅜ 먹어보니 맛도 있었고 직원분들도 친절하셨지만 굳이 또 와서 먹을거 같지는 않아요/먹어본 돈까스중에 제일 부드럽고 맛있음ㅠㅠ 웨이팅 있어도 갈래/운이 좋으면 30분도 안 기다리고 들어갈수 있어요 이런 부드러움 첨 맛보네요 /괜찮은 맛, 웨이팅할 정도는 아니다/정돈에서 처음 먹어본 안심돈가스는 신세계여따ㅏㅠ/정돈은 킹정이지 말모/개맛있음 비싼데 비싼값함/개맛있음.. 근데 그만큼 웨이팅할 정도인지는 모르겠음.. 11시부터 줄 섬... 스페셜 등심이 제일 맛있었음/소문만큼 아기자기하면서 정성스런 상차림은 최고 입니다. 음식에 대한 초심을 잃지 않으려는 사장님의 열의가 가득한 식당입니다. 재방문 의사 있음. /걍 평타임 그렇게 맛잇는지 모루겟음/맛있었지만 엄청 기다려야했음 30분 넘게 기다려서 먹을 맛까진 아니지만 바로 들어갈 수 있다면 먹을 거임/몇 년 전부터 한 세 번 먹으러 간 거 같아요. 제가 먹어본 돈까스 중에 제일 맛있습니다!!!/일하시는 분들 다들 모두 친절하고 엄청 맛있게 먹었어요. 대학로 놀러가면 또 갈 듯!/스페셜?모둠이었나...ㅎ 부드럽고 고기 씹는 맛이 좋았어요. 역시 난 소스보단 소금파인가.../역시 맛있음/분점인 홍대점 강남점보다 맛없는 본점이라니 처음으로 정돈에 실망함. 이럴거면 호호식당이나 합정망원쪽 갔지.../수요미식회를 통해서 알게된 곳으로 추천합니다./인기가 많아서 한 번 가 봤는데 제가 기대가 컸는지 생각보다 너무 별로였습니다. 일단 식당 위치가 지하라 사람들이 많아서 말 소리가 너무 울려서 마치 동굴에 있는 것 같았고 너무 시끄럽고 천장에 페인트가 다 떨어져서 너무 더럽게 되어있고 음식은 괜찮았지만 고기와 된장국이 너무 느끼했고 냄새가 조금 났습니다. 그리고 평소에 화장실 청소를 잘 안하시는 것 같다...더보기/로안이맛있다함"
2,혜화도담,서울 종로구 대명1길 16-6 1층 (우)03078,한식,"대파전,혜화도담 대표메뉴,20,000,28,000,27,000,26,000",12000,0.0,0,0,
3,학림다방,서울 종로구 대학로 119 2층 (우)03079,카페,"아메리카노,레귤러,에스프레소 더블,카페라떼,잎녹차,레몬에이드",5333,4.1,93,191,"커피만 마시기로해요. 크림치즈케이크는 진짜 아니예요.../옛스런 분위기도 독특하고 커피 맛있어요/오래된 카페로 유명한데 공간이 아늑해서 너무 좋았어요 음료들도 클래식한 맛 !! ㅋㅋ 맨날 1층만 앉다가 2층도 앉아봤는데 뭔가 또 신선하고 좋았어요 ㅋㅋㅋ  근처 가면 괜히 한번씩 들리게 되는데 일찍 가야 앉을수 있어요 ㅋㅋ /비엔나 크림이 파리바게트 싼마이 크림맛 핸드드립도 별로이다  커피로는 꽝/생각나는 비엔나 커피/비엔나 커피 그냥 그래요.. 분위기는 정말 좋지만 벽에 바람이 들어서 추워요ㅠㅠ/비엔나커피 맛있어요/비엔나커피는 달아서 맛있었는데 크림치즈케이크는 요거트맛도 살짝 나면서 아무튼 재방문시 비엔나는 먹어도 케이크는 다시 시켜먹진 않을 듯/공간을 마시러 가기에 좋은 카페입니다. 생각보다 시그니쳐 메뉴들(비엔나커피, 치즈케익)은 제 입맛과는 맞지 않았지만, 재방문하고 싶습니다. 다음에는 일반 아메리카노 도전해보고 싶어요!/치즈케이크 맛있고 분위기 좋아요~/비엔나 커피 핫으로 먹었는데..진짜 맛있어서 감동했읍니다 직원분도 친절하시고 최고에요 ㅠㅠ/비엔나커피랑 크림치즈 케이크 진짜 맛있어요../비엔나커피 맛있어요 분위기도 좋고요 치즈케익은 노맛/옛 스럽고 좋았습니다 비엔나 커피 마셔본지 30년 정도 되었는데 맛 있었어요/분위기 굿 가격 굿/비엔나 맛 좋음/저녁늦게가서 케잌은 없었어요ㅠ 아포가토랑 비엔나커피 먹었는데 괜찮았어요, 분위기도 좋고 직원분도 친절하시고 주문하면 가져다주시더라고요 ㅎㄷ 2층이 층고가 좀 낮아서 머리 조심하세요..일하시는 남자분 목소리 ㄹㅇ 남자도 반할만한 중저음../비엔나커피 6000원, 아이스 아메리카노 6000원, 크림치즈케이크 오렌지 6000원.  늘 와보고 싶었던 곳이었는데 이제야 방문하네요. 감성+ 커피맛 좋고 케이크도 맛있어요./역사와 문화가 살아 숨쉬는 까페입니다. 오래된 양식과 클래식 음악이 조화로웠습니다./분위기가 좋아요. 공간도 예쁘고 직원 분들도 친절하십니다. 음악도 매장과 잘 어울립니다. 그리고 의외로 와이파이 속도도 꽤 괜찮습니다. 다만 콘센트가 아무 데도 없습니다. 자리에서 노트북이나 아이패드 등을 충전하면서 사용할 수는 없습니다. /맛잇어용/김승옥 작가의 생명연습에 나오는 그 다방/한 자리를 계속 지킨 시대를 풍미하는 다방(카페)란 점에서 의미가 깊다. 음료 맛을 기대하긴 어렵지만 향수에 젖어들기는 충분하다./일단 음료랑 케익이 맛이 없고 알바생인지 직원인지도 센스 없고 불친절해요 천장 낮아서 불편하고 쇼파라 먼지날립니다/눈 오는 날 가세요/분위기 있구~~~~... 마치 울랑이 만났을적 느낌도 나공~~~... 빨간 마후라한 디제이만 있었땀은~~ ^^; ㅎㅎ ㅋㅋㅋ/오래된 다방이라 궁금하고 한번 가보고 싶어서 갔는데 레트로한 분위기는 좋지만 한번 털면 먼지 우수수 나올것같은 그런 의자에다가 불친절한면이 있음 여럿이가서 각자음료를 각자가 결제하려고 주문하는곳에 가서 주문하려는데 한번에 시키라고 해서 빈정이 상함. 일행이냐고 물어보고 영수증 모아서 같이 줘도 될일을 귀찮아서 한번에 결제하라는게 좀 기분나빴음. 원래 그런거...더보기/꾸준히 가게 됨/2층이 갑/비엔나 커피 맛있어요 클래식 나오는 것도 너무너무 좋았어요 딱히 감성을 찾지 않아도 그냥 공간에 배어있는 시간이 소중하게 느껴집니다:)/한번 정도는 가볼만한 카페. 치즈케이크 맛있대서 주문했지만 그냥 평범한 맛. 커피가 더 생각니나네요. 비엔나 시킨것 같은데"
4,버거파크 혜화점,서울 종로구 대학로11길 5 1층 (우)03079,햄버거,"치즈버거 (single),베이컨치즈버거 (single),머쉬룸치즈버거 (single),쉬림프치즈버거 (single),아보카도치즈버거 (single),해쉬베이컨치즈버거 (single)",7400,4.4,103,595,"이집 맛있네~ ㅎㅎ/가공 된 맛이 없고 너무 맛있어요/새우버거가 존맛이예요!! /머쉬룸치즈버거 / 치즈버거(기본)  기본 치즈버거도 맛있음 크기는 작음 감튀 맛있음/여기 제 뻬이보릿 버거집입니다 촉촉한패티에 부드러운빵 아주 사랑스럽고요 채소많이넣어주면좋겠는데 그럼너무맛있어서 좀위험할지도몰라요 출입구앞쪽 좌석들은 궁딩이 불안하니까 안쪽자리앉으세요 배달도하지만 감튀는 매장와서 따끈할때드시면 더맛있어요  /버거 맛있어요... 음료랑 감튀에 취향따라 어레인지를 가할수 있다는 점에서 높게 평가하고싶네요. 다만 사이즈가 가격대비 너무너무 작음 . 테이블로 한옥집 문짝을 쓰시는데 문고리가 그대로 붙어있어서 독특하다는 인상을 받았으나 그자리에 앉은 사람은 아주 불편하더라고요/버거소스가 약간 케찹마양 새콤?해서 깔끔한느낌.  적양파 토마토 양상추 야채 싱싱한게 인상적 친구랑 세서미번 맛있다고 하면서 먹음. 버거가 큰편은 아닌데 빵이나 야채 고기풍미 등 전반적으로 재료 각각 퀄리티가 좋다고 느낌.  기름진 쪽 느낌의 수제버거 선호하면 현재기준 여기보다는 이화사거리쪽 크러시버거 추천.  음료는 1600원이 디스펜서에서 무제한 ㅡ 펩...더보기/꽤나 맛있는 수제버거 집 주변에 생겼으면 좋겠음/짜요짜요 그래서 맛있어용 ♥  꺅 /맛있다 진짜../재슐랭가이드 4.4/맛있어요 지점 더 많이 생기길../제로페이 결제 불가매장/맛있긴한데 매장 진짜 밖보다 더 추움 달덜떨면서 햄버거 먹음/맛좋고 가성비 좋음 감튀는 굳이../존맛탱/셀프시스템 맛있음 공간은 협소한편/만족스러웠다/맛있음/자주가는곳중 하나였는데 번잡스러워졌달까.. 맛은 있어요!/더블치즈버거 추천합니다. 수제버거 중에서도 제일 맛있게 먹은 버거 중 하나입니다./오늘갔는데 키오스크결재방법을 잘몰라서 여쭸봣더니 친절하게 알려주셧어요 직원분들께서 너무 친절하셧고  햄버거도 너무 맛있게먹었어요/혜화에 갈 때마다 매번 들르는데 존맛탱버거라고 할 수 있습니다/존맛/버거를 시켰습니다. 116번 번호표를 받았는데 직원분이 117,118번 버거 나왔으니 가져가라고해서 왜 내 번호보다 뒤에 번호를 먼져 부르지? 라고 생각하고 있었는데, 계속 버거가 안나와서 물어보니 117,118번 손님이 116번까지 같이 가져갔다고 한다. 왜 116번안불렀냐고 물어보니 직원은 116번까지 같이 불렀다고 하는데 그럼 번호표를 확인을 안하고 ...더보기/진짜 ㅁ맛있다  비싸고 축축눅눅하고 작고 얇은 쉑쉑따위랑 비교불가다  인스타에 유명하고 비좁고 비싸기만한  근본없는 버거집들과 다르다  가격 합리적이고 튀김까지 맛있다   음료 무한리필 된다  늘 그렇듯 음료무한리필인 버거집은 맛집이다/굿/JMT!!♡ 직원분들도 다들친절  /수제버거의 수학의 정석입니다. 튀는 것없이 잘 균형잡힌 맛.  패티는 2장이 진리/웨이팅이 좀 있구 의자가 불편한거 빼곤 다 좋았습니다 버거맛은 심플한 듯하면서도 맛잇었어요 /친구랑 슬픈얘기를 나누면서 눈물흘리고 있었는데도 불구하고 햄버거가 맛있어서 다 먹고, 따끈한 감자튀김 너무 맛있다 생각했습니다.. 눈물젖은 머쉬룸 버거 담백하고 맛있고 또 먹고싶네요. 꼭 세트드세요. 입구 쪽 나무의자 살짝 엉덩이 아픈거빼고는 완벽"
5,칸다소바 혜화점,서울 종로구 대학로 131-1 1층 (우)03078,일본식라면,"돈코츠라멘,마제소바,아부라소바,돼지껍데기아부라소바,9향기름면",10000,4.2,122,99,"맛있어요   가방 놓을수있는  상자같은게 있었으면 좋겠어요/맛있네요 타마고랑 차슈 추가해서 먹었더니 엄청 배불러요! 멀리서 찾아올 맛은 아니지만 지나가다가 보면 먹고 갈까 싶은 생각은 들거같아요/잘 먹고 갑니다./혜화 맛집해봤자하고 우습게 봤는데 맛있네요. 돼지껍데기 우리나라에서 제일 잘 굽는데 없어져서 아쉽습니다ㅠ/프랜차이즌데 아직도 웨이팅 있는게 신기하지만 맛있다/거의 늘 웨이팅있어요 의자가 바닥에 박혀있어서 좀불편했는데 직원분들 친절하시고 맛있었어요 /간이 좀 짜지만 맛있었어요!/맛 4 친절 5 웨이팅 회전율 빠름 아부라소바 10,000원에 계란, 차슈 추가해서 13,500원 맛있지만 존맛까진 아님/차슈 추가해서 먹었는데 먹으라는 대로 먹으니까 진짜 맛있었어요 ㅠㅠㅠㅠ 밥 추가할걸 지금와서 후회되니까 빠른 시일 내로 다시 가야겠어요/유튭보고 돼지껍데기 있는거 먹고 싶어서 왔는데 메뉴에 없더라고요 ㅜㅜ 아쉬워요..    양 진짜 많습니다.. 밥은 서비스인데 배불러서 못 먹었어요.   고기 고명 올라간게 좀 더 느끼했어요.(꾸덕한 느낌)   식초랑 고추기름을 더 뿌려서 비비는게 확실히 맛있습니다.  직원분들 친절해요~!  ./서비스도 좋고 친절하네요/대학로 갈때마다 한번씩 들르는 곳. 저녁시간때 웨이팅이 있긴 하지만, 엄청 긴것은 아님. 직원분들 친절하시고,  홀 담당하시는 직원분께서 프로페셔널하게 웨이팅 관리나 주문 같은거 정리하셔서 크게 혼잡하거나 그런것 없이 비교적 조용히 식사 가능한점 매우 마음에 듬. 카라이소바에 밥도 넉넉하게 줘서 은근히 양이 꽤 됨.(낮 시간에 뭐 먹어서 면이니까 양 적겠지...더보기/줄 서먹을 정도는 아니지만 충분히 맛있음 아주 자극적이라 빨리 물릴 수 있습니다. /웨이팅에 비해 맛은 좀 아쉽네요/돼지껍데기 아부라소바 왜 안파세요ㅜㅜㅠㅠ 이거 먹으러왔는데… 다시 판매하는날 별 5점 예약 ⭐️⭐️⭐️⭐️⭐️/가끔 생각남/꾸준히 찾게 되는 집. 처음에 만났던 음식의 정성은 보기 어렵네요. 그래도 맛은 그대로라 잘 먹고 나왔습니다. 그리고 친절하고 센스 넘치시는 직원분이 두, 세몫하십니다. /msg를 좋아하는 사람이면 누구든 반하지 않을 수 없음/왘ㅋㅋㅋㅋㅋ미쳤네개맛있닼ㅋㅋㅋㅋ 엄청 안에 사람많고 바쁜데 와중에 직원분들 상당히 친절하심 /직원분들이 친절해 별 3개 입니다. 맛있었으면 별4갠데../30분 정도 웨이팅하고 먹었는데 맛은 있었어요. 웨이팅 안하면 재방문 의사 있는데, 웨이팅까지 해서 재방문하고 싶지는 않네요./느끼/마제소바 유명하다 하여 먹어보았는데요, 너무 짜요,, 한번 경험삼아 먹어보겠으나 재방문은 글쎄요.../마제소바가 제취향이 아닌가봐요. 딱 2번 먹어봤고 둘 다 유명하고 웨이팅 있는 맛집이었는데 맛있지않았음. 아부라소바먹었고 껍데기 맛있어요! 단짠쫀득! 개인적으로는 면이랑 따로먹는게 더 맛있었네오. 소바보다는 우동 면 느낌이고 맵찔이가 먹긴 살짝 매워요! 직원분들은 매우 친절하셨고 웨이팅 많은데 회전율은 빨라요./바쁜 업장에서 일해 본 사람인지라, 바쁜데도 불구하고 빠르지만 차분하게 응대해주고 밝은 모습 보이는게  얼마나 어려운지 아는데, 여기 서비스 진짜 눈물나게 감동임.. 대학로 갈 때마다 여기 갈 듯 맛도 감동../눈물나게 맛있는 마제소바/맛있는데 살짝 느끼해요 고추기름이랑 이것저것 섞어 먹으니 더 맛있어요!/우엉 단무지 맛있어요. 고추기름, 양념장 맛있어요./마제랑 아부리 둘다 넘 맛있었고 양도 많았어요~ 가게 들어가는 입구도 예쁘고 좋습니당~~/내부가 좀 정신없고 의자도 불편한데 맛은 진짜 맛있음 생각나는 맛/마제소바는 좀 시큼해서 입에 안맞아요. 아부라소바가 맛있었어요. 오픈주방이라 좀 정신없지만 직원분들이 친절했어요./너~무 시끄러움ㅠㅠ 일식이라 간이 쎈거 감안하니 납득/어제먹어도 오늘 또 먹고싶은 맛 ㅠ  좀 비빔소바 자체가 호불호 갈린다는데,,  글쎄 난 맨날 호여서,,,, ㅠ 어제도 먹규 오늘 또 먹고싶은데 친구가 안먹어쥬겠지… "
