,name,address,sort,menu,mean_price,score,people_give_score,review_count,review_list
0,진호횟집,서울 강북구 도봉로98길 33 1층 (우)01056,회,"진호세트 (소),광어,전복,우럭,연어",16200,4.0,65,72,"2018년 평가...가성비 쵝오..맛 짱...살짝 구운 연어 초밥 대박! 맛만 좋으면  다 잘된다는 걸 보여주는 집!  였으나 완전 변함...점점점 실망! 주인이 바뀐거같기도 하고..  2022년 평가  그래도 다른 곳 보다 여기가 낫네 평점 1에서 4로 상승!  /가격좋고 넘 맛나요  테이블이 적어서.. 확장하고 이가격에 이렇게 유지한다면.. 자주 오겠음돠/친절하십니다.  서비스가 좋았어요..  그러나.너무 기다림 /얼마전 알게 되었는데 가성비가 좋아 두번 포장해 먹음 아이가 먹을 것도 많아요/이곳도 가격이 너무 올라서 당분간은 안갈듯 지난달까지는 저가격이었는데 이번달부터 5천원씩 올랐어요/회맛도 미쳤는데 가격도 미쳤음, 4시오픈이고 4시10분에 갔더니 이미만석이었음.. 장사잘되는곳은 다 이유가있어요/회가 정말 신선하고 맛있어요. 양도 많아서 오랜만에 배터지게 먹었네요. 나중에 또 오고싶어요. /회가 정말 신선해요! 스키다시도 많아서 배부르게 먹고왔어요 잘먹었습니다 :))/가성비는 좋지만..너무 불친절해요.. 다른손님이랑 차별하지마세요. 특히 서빙아줌마.. ...;;/맛있고 서비스 좋아요/진호세트 포장해서 먹었는데 구성 너무 푸짐해요~ 회도 맛있고 스끼다시 이것저것 알차게 챙겨주셔서 정말 배부르게 잘 먹을 수 있었어요 ㅎㅎ/포장해서 먹엇는데 너무 잘되어잇어서 놀랏네요 가성비 짱이네요 진짜 가족 넷이서 도란 도란 맛나게 먹엇어요 /와.. 포장해 갔는데.. 이렇게 잘 주셔서 감사 합니다! 두명이서 먹다가 배터졌어요 ㅠ  다음엔 매장에서 먹겠습니다.  잘 부탁드리겠습니다 ^^/진호세트 포장 강추드립니다.. 포장으로 이런 대접 올만에 받아봐요..!!/넘일찍닫아요/웨이팅 없이 포장해서 먹었는데 진짜 퀄리티랑 양 보고 깜놀했어요.. 진호세트 대자 시켜서 먹었는데 가격도 저렴하고 다 넘 맛있어서 행복한 저녁 되었네요 ㅎㅎ 다음에 또 방문하려고 합니다!/진짜 가성비 갑... 세명이서 가서 4만원어치로 회 배부르게 먹었어요. 굴, 간장새우, 멍게, 새우튀김 등등 스끼도 다양하고 풍족하고 신선했음. 괜히 대기 오래 걸리는게 아님. 미리 테이블링에서 예약하고가는게 좋음./가성비 좋고 회가 신선하네요. 앱으로 줄서기 가능해서 편해요ㅋㅋ/웨이팅도 어플이용하면 편한편이구, 사장님도 친절하세요. 음식이 한번에 나오기보단 코스처럼 바로바로 먹을 수 있게 준비해주시는게 좋네요. 막 10만원짜리 회같진 않겠지만서도 이가격에 이정도 서비스 유지하는게 놀랍습니다. /기지마세요. 너무 기다립니다/회를 포장해서 먹었는데 양도 많고 싱싱하니 좋았습니다 /어제 모둠회 중자 친구랑 먹었는데 가성비 대박이네요 회만 있는게 아니라 해산물과 푸짐한 스끼다시 보고 놀랐어요 /가성비 정말 최고에요. 진호세트 포장해서 집에서 먹었는데 회도 싱싱하고 양도 많고 무엇보다 곁들여 먹는 음식 가지수도 엄청 푸짐 하네요. 오랜만에 제대로 된 회 먹었어요. 앞으로도 자주 갈것 같아요 /가성비 좋고 넘 맛있어요/진호세트 소, 주문했구요 둘이 먹기 딱 좋고 참치, 광어, 연어, 문어 등 메뉴가 다양해서 좋았어요. 마지막에 매운탕까지 나와서 32000원으로 가성비 갑인 곳이에요/후기에 극찬들을 하길래 기대늘하고갔는데 기대이하다  (소)32000모듬을 시켜도 둘이충분히먹을수있고 셋이먹어도 된다고 후기에 써놨길래 둘이서 소짜 시켰더니 이건 조잡하기 이를데없다 회를아주 작게썰어서 무슨 장난감회집놀이같다 스끼다시들도 다 쬐끔쬐끔 아니 그런집이 후기에는 좋다구 극찬한사람들 집안식들이나 아는 사람들이 써놓은것같다 인터넷맛집찾아서 간집들 하나...더보기/가족3인이 갔습니다 5점기준 합계가 8.5점 나왔습니다 반올림을 해서 2점을 주기에는 혹평인 곳입니다/아 드디어 찾았습니다 이제 회는 여기서만 먹으려구요 ㅎㅎ/여기 찐맛집이에요. 스끼다시도 많이 나오고 회 구성도 좋고 부위도 잘나와요 특히 가성비가 짱입니다!!!/가성비 좋고 진짜 맛있어요!!/왠만한 횟집보다 가성비가 훨씬 좋아요!@@ 웨이팅해도 후회없지만 전 보통 포장해먹어요ㅎㅎ 미리 한두시간전에 예약하면 바로 테이크아웃 가능해서 조쿠 맛나요/진호세트 중, 산낙지 포장했더니 상다리가 부러지게 푸짐한 한상이 되네요ㅋㅋ 그날그날 싱싱한 종류로 모둠회 한접시가 구성되니 다양하게 즐기기 싶다면 무조건 추천입니다! 산낙지도 싱싱해서 젓가락으로 쿡 찔렸더니 열심히 움직여서 오랜만에 보양식 한접시 했어요~ 포장도 강추합니다!"
1,황주집,서울 강북구 도봉로 372 (우)01056,"곱창,막창","순곱창 (500g),혼합곱창 (500g),곱창/대창 (500g),곱창/염통 (500g),양/곱창 (500g),양/대창 (500g)",33166,3.2,52,173,"비싼데 비싼만큼 값어치 하지못하는곳/곱창은 질기고. 곱창 굽는 냄새가 진동을 하는데 환기는 안되고, 앉는 자리도 불편~~/사장님 왕친절./근처에 있었던 진주집이 그립네요../고무씹다왔다 원산지표기도 국산육우랑 멕시코 같이표기해놓고 가격은 380000 완전사기다 하도줄서있길래 먹어봤는데 인생최악이였다 쏘스도없고 쌈.고추.쌈장 이런건 기대하지마라 부산에 서면문화양곱창같은데 비하면 공짜로먹으라해도 안갈듯 프랜차이즈가 100배나음 여기자주가는사람들은 내상식으론 이해안감 진짜 최악!!/좋아요/위생은  최악 ~~~코로나 곱창 ㅜㅜ/위생진짜.. 소주잔에 고추가루 떠다니고 기름장에 고추가루. 설거지를 아주 뭐../줄 서서 먹는 곱창맛집.  볶음밥을 먹어야 이 곳의 진가를 알 수 있다. /협소한 가게가 자연스레 만들어낸 웨이팅마케팅 실상 먹어보면 맛이 별로고 가격도 별로임/가격 폭리  양 ""너무 적음  다시는 안감  그돈이면 집에서 푸짐하게 먹는다  나오는보고 충격 받았다  이걸 몇만원 ""이라고하니  ㅋㅋㅋㅋ/올때마다 너무 맛있고 친절해요 웨이팅은 항상 있네요ㅠㅠ 그래도 친절해서 좋아요/단골집! 직원분들 너무 친절하셔서 갈 때마다 기분 좋아요. 가격 대비 양도 많고 최고입니다~^^/쵝오/그녀와먹은 소곱창중에 최고였어요 ^^  배고픈그녀 다음부턴 미리와서 굽고있으라는  애교섞인 그녀의말이 너무 좋았네요.  볶음밥은 기름에 코팅되어 최고에요.  김치먹었을때부터 볶음밥은 당연 맛있을거라 예상했어요. 친절은 기본 헛개물 좋아요. 느끼함을 잡아주니깐요. 이런세밀한부분까지... 신경을 쓰시다니./지금까지 먹어본 곱창중의 최고에요 오늘 먹으러 갔는데 닫혀있고  얼마전에도 여름휴가라 닫혀있고 전화를 계속 안받길래 혹시나 또 갔더니 역시나 닫혀있고 휴가나 내부수리같은 이유로 며칠 휴점할경우 미리 알수있게 전화연결음을 해두셨으면 해요 /찐 스러운 분위기와 맛집 입니다 나이 많은 아저씨들이 고성으로 정치얘기 회사얘기하며 술마시는 곳은 맛집 입니다 아주머니가 넘 잘구워주시고 센스 넘칩니다/정말 줄설정도의 맛은 아님 ㅠㅠ 사실 가게  안이 좁고 너무 불편함../줄설 정도는 아님/사람들 줄이 매번서있어서 갔었는데... 사람마다 입맛이 다르겠지만 질이 좋은지도 곱이 실한지도 모르겠어요 실망스러웠습니다../괜찮다 곱이 꽉찬 질좋은 곱창대창/50년 전통의 소곱창 노포. 냉동곱창을 초벌구이를 해서 주는데 퀄리티는 다소 떨어지지만 맛도 괜찮고 정감도 있다./만수무강하세요 적게 일하고 많이 버세요/작년 이맘때 유명하다고 해서 갔었는데 대기 길고 맛은 그닥... 질기고. /안그래도 웨이팅 많은데.... 여기에서 별점 높아서 더 유명해지면 어떡하지ㅠㅠㅠ 그래도 넘조아 5점 남겨요/매일 같이 줄 서 있어서, 궁금증에 들려 봤는데,, 으이구,,  최악 입니다. 곱장이 아니예요.  설명 하기도 귀찮네요.  뭐 사람 입 맛이 각각이긴 하지만..ㅜㅜ/1.직원들의 서비스가 좋음  2. 소곱창, 대창 먹었는데 이 세상 맛이 아니였음 /진짜 최악이었음. 일단 곱창이 쓰고 곱은 다 튀어나와있어서 고무랑 별다를 바 없었음. 종업원은 무슨 말 할때마다 이리저리 비꽈 말해 기분상함. 이런 곳을 왜 줄 서서먹는지 모르겠음/술먹고 3차에 가서 ㅠㅠㅠㅠㅠㅠㅠㅠ 분위기가 좋아요/굳이 줄 서서 먹을만큼은 아님/맛4 + 분위기1, 석유곤로(コンロ) 사용하던 때가... /맛도 있고 직원들도 친절합니다."
2,장수마늘보쌈,서울 강북구 덕릉로 192 (우)01136,"족발,보쌈","모듬보쌈 (소),물냉면,비빔냉면,해물칼국수,해물수제비,모듬보쌈(중)",12916,4.3,43,82,"마늘보쌈, 굴보쌈 모두 먹어봤는데 다 맛있어요ㅠㅠ 양도 진짜 많고 칼국수도 진짜 많이 나와요! 직원분들도 친절하시구요 :D/전화받는 아줌마가 바빠서 말투가 그래서 그렇지 정말  친절하고 맛있는집. 최고의 보쌈집. 항상 바쁜집./맜있었어요!!! 또 올거예요~♡/보쌈 맛있고 김치랑 속이 푸짐하네요/맛있어요~♡/맛있어요~!/마늘 보쌈 열라 달고 종업원 불친절 매장 은 시장보다 시끄러움...../너무 달고 비싸요 보쌈 양도 짱 적음ㅋ/일부러 20분거리에서 주문 포장까지 해서 왔는데 양에 놀라고...소스따로 담으려면 대자 시키라고 해서 그렇게 했는데 그냥 위에 뿌려주시고..비계는 빼달라 했는데 먹어보라고 넣어주셨는지 섞여있고...우리게 맞나 전화드렸더니 그랬었냐고 오히려 말씀하시고..좀 더 발전하시길 바라며 적어봅니다./불친절이 하늘을 찌르네요. 10년 넘게 다녔는데 갈수록 불친절 하네요. /특대시켰는데 양이 적어요 ;;/맛있어용!/맛나요 김치도 넉넉히 주고 초등아이들도 너무 잘먹어요/포장해서 먹었는데 너무 맛있었어요  김치도 고기도 ~♡/jmt 인정/장수라서 별이 다섯개애~/마늘 보쌈은 진짜 여기가 최고임 굿/자주 포장해요.  냄새안나고 제일 맛있어요. 지금도 가는중입니다^^/장소가 협소하지만 맛은만족/맛있다고 추천받아서 점심에 보쌈소에 수제비 시켰는데 보쌈은 흔한거 같으면서도 은근 맛있네요 수제비하고 밑반찬으로 나오는 전은 그냥 그런데 전에 찍어 먹을 만든 간장이라도 있었으면 좋겠습니다./개존맛 진짜 존맛 몇년째 맛도 똑같고 진짜 너무 맛있음 인생보쌈 좀 불친절하긴한데 보쌈 맛보면 너무 맛있어서 주먹쥐고 눈물 흘리면서 나감 근데 칼국수는 별로/쏘주 한 잔 털어넣고 상추에 달짝지근한 마늘소스 올라간 보쌈고기 한 점 놓고 그 위에 보쌈김치랑 생마늘 그리고 청양고추로 느끼함 잡아준 뒤 생굴로 하이라이트 장식하고 먹어라/달짝한 마늘보쌈 비법을 알고싶은 소스 칼국수는 별로/가보진 않았지만 소개 받았어요 곧 가볼게요! 평점이 너무 좋네요!!/진짜 맛있다/최고의 마늘보쌈, 곁들이 해물칼국수도 션해요~/모듬보쌈은 그저 그렇던데 손님은 바글바글하다. 왜 그럴까 ?  게다가 해물손칼국수는 정말 최악이다./여기 최고에요.. 원래 아는 사람만 아는 맛집이었는데 요즘 유명해진듯 마늘보쌈최고!^^/보쌈 너무 너무 맛있음! 먹고 나서 마늘 냄새 주의!! 칼국수는,....... 고기 추가로 배채우는걸 추천!/여기 최고에요 맛도 좋고 저렴하고 일하시는 아주머님 힘드신데 친절도 하시고 줄서서 먹는 보람 있네요~^^/맛, 가격 모두 좋아요! 특히 마늘보쌈을 추천합니다. 주차장만 있다면 포장을 많이 이용했을텐데 아쉽네요."
3,산성골,서울 강북구 덕릉로 126 (우)01130,"육류,고기","양념돼지갈비 (300g),생돼지갈비 (250g),무항생제 생삼겹살 (180g)",15000,3.2,13,28,"아무것도 안 올린 불판인데 녹슬어 있습니다. 바꿔달라고 했더니 사장님이신 듯한 나이 지긋하신 남자분, 놀라지도 않으시더라구요. 당연히 죄송하다는 말도 없음. 바꿔달라고 안하는 손님은 그냥 먹으라는 건가봄. /갈비탕 먹었는데 괜찮았어요/돼지갈비 구워서 나오는거 장점이구요 반찬이랑 양념갈비 다 맛있었어요. 근데 물냉면 최악입니다 쇠고기다시다물에탄맛 나구요 짜기도 짜지만 다시다맛이 너무 심해서 먹을수가없었어요..둥지냉면이 더 맛잇을정도입니다 혹시 실수로 만드신거 아닌가 했는데 직접 뽑은 육수로 만든 문제없는 음식이라네요.. 물냉면은 드시지마세요/별로/자리도 넓고 직원들 친절함. 돼지갈비가 다 구워져서 나와서 먹기만 하면 됨 모셔간 부모님들 편하고 맛있다고 좋아하심 재방문 의사 100/쏘주 한 잔 털어넣고 다 익혀서 나온 두툼하고 달짝지근한 양념돼지갈비 먹어라/별로예여/어제 마감시간 한시간전에 갔더니 한적했음. 밑반찬 부터 초벌해서 나온 고기며 신선한 채소들 특히 갓김치. 파절이 소름.. 가격까지 끝판왕 후식냉면까지 소름이였음 서울한복판에 돼지갈비 맛집찾음 감동. 굳이 아쉬운걸 찾아보라면 수유역에서 한 10분정도거리고 물컵 대신에 재활용 불가능한 종이컵 쓰는게 아쉬웠음./개선될여지가 있어 2점드립니다. 주문밀리는거 이해하고 늦게 가져오는것도 이해합니다 바쁜시간엔 다른 식당들도 다 그렇죠.  근데 그 시간대 알바생 한명만 더있었다면 충분히 해결할수있었어요. 혼자 온갖주문다받는 알바생도 안불편하고 주문하는 고객들도 저도 안불편하죠 알바생 혼자 이주문 저주문 다받고있어서 주문하는 제가 뭘시키기 미안하더군요.  고기도 늦게오고 추...더보기/왜 사람이 많은지 전혀 이해하기 힘듬 주문누락은 기본에 나오는데20분 넘게걸림 생고기는 퍽퍽하고 양념은 달고 퍽퍽함 이정도 리뷰남기는거 처음/사장님 넘 친절하시고 적립도 되고 잘먹었습니다"
4,소담촌 수유점,서울 강북구 도봉로 388 테마빌딩 8층 (우)01056,샤브샤브,"월남쌈 샤브(평일점심),월남쌈 버섯샤브(평일점심),와규샤브(평일점심),명품한우샤브(평일점심),해물샤브(평일점심),월남쌈샤브",16183,3.6,11,53,"사람이 무척 많긴 했지만 맛도 좋고  전반적으로 친절했습니다. /샤브샤브 맛 괜찮아요.자주 오는곳이지만 언제와도 맛있고 깔끔하고  사장님이 직원들 관리도 잘하시고 부지런하신듯.가성비대비 맛집.추천./매장 깨끗하고 맛도 좋으나  주인인듯한 남자분,별로 친절하지 않음. 그외는 다 좋음./친구랑 2번방문함  첫번째 방문: 위생부분  두번째 방문: 종업원서비스 뷰와 풍성한 샐러드로 가고 싶으나 위에 두개가 너무 입팩트가 강해 못가고 있음 ㅠㅠ  /저녁  8시넘어 들어서자 마자 영업마감시간 입박이다 하며 주문 받을때 까지 불편하게 함 사장님이 안계서서 그런지.../식기가 제대로 안 닦여있어서 지저분 했고, 그걸 이야기해도 직원은 시큰둥하니, 차암 불친절하네요.  두번 갈 생각은 없어요./깔금하고 버섯이 싱싱/깔끔하고 맛도 좋고 뷰도 좋아요~! 점심특선이라 고기양이 조금 아쉽지만 다른 재료들이 너무 신선하고 맛있어서 배부르게 먹고 갑니다~ 번창하세요!/깔끔하고 맛도있는 소담촌이네요../깔끔하고 친절하고 맛있어요~"
5,할머니해장국,서울 강북구 월계로37길 137-6 (우)01226,해장국,"해장국,해장국 (특),술국 (대),술국 (중),술국 (소)",21400,4.2,16,16,
6,신매콤터,서울 강북구 오패산로 412 (우)01064,분식,"떡볶이,튀김,치즈라면,제육덮밥,물냉면",4000,2.9,23,38,
7,벼랑순대국 본점,서울 강북구 한천로 924 (우)01136,순대,"순대국,살코기순대국,벼랑순대국,머리고기,토종순대",8200,3.6,26,39,"하얀 국물과 빨간 국물 모두 먹어보았어요. 살코기순대국은 하얀 국물의 순한 맛,  벼랑순대국은 빠알간 국물의 얼큰 매운 맛. 각각 고기+순대 조합과 내장+시래기+순대 조합이었는데 양이 넉넉해서 배 터지게 먹었어요.  쫄깃쫄깃 식감이 즐겁고 마늘소스와 부추도 같이 곁들여 먹기 좋았어요. 또 먹고 싶어요!/흐흠 아무래도 반반 내장,고기 제일 좋은거 같음 우리 딸 순대국 절대 안먹는데 여기껀 먹음 맛 있음/근처 이사온지 2년이 채 안 됐습니다. 그 짧다면 짧은 시간에 맛과 싸가지 모두 변했네요./생각보다 평범한맛.. 김치없이 부추와 깍두기가 나와서 걍 그랫어요/널린게 순대국집. 그런 인심으로 장사하면  아무리 맛있어도 안갑니다./여기 1인도 백신 미접종자 못들어가요 차별대우 함 여자분 백신맞고오라고함 어이없음~~/맛은 인정..가끔 국물은 끓고있는데 순대가 덜 끓여져 나올때가 있음  위생좀 신경 써줬으면 좋겠음. 소스통이나 깍두기통은 씻기나 하는지 모를정도./멀리서 찾아와서 줄까지서서 먹을 맛은 아닙니다.  먹는데 어수선하고 주문한걸 자꾸 까먹네요./벼랑끝에서라도 먹고싶은 그맛/저녁에 퇴근하면 마감쳐서 못 먹음 없어서 못 먹는 수준 점심엔 사람들 바글바글함 /맛       최고입니다/이건 뭐니/고기가 큼지막하고.. 부드럽네요.  깨도 씹히는 맛이 있고.. 깍두기가 아쉽지만.. 이정도면 맛있네요. 국물은 깔끔한 맛은 아니고 꿋꿋한 맛이지만 이 맛 나름대로의 맛이 있네요  다른 메뉴도 먹어볼 예정/제가 먹어본 순대국중에 최고입니다 정말 맛있어요!/순대국 먹고 싶을땐 항상 방문 하는곳. 회전율이 좋고 특히 가격과 양이 우수/이 가격에 이런 맛은 정말 훌륭하다고 생각한다 ㅜㅜ 누린내 안나면서 진하다. 이게 핵심! 부추무침이 정말 새콤해서 계속 땡긴다. 고기마늘소스도!! /짜고 깊은맛이안나고 고기가 정말 크긴한데 ㅜㅜ위생도 너무 별로입니다/냄새안나고 맛있어요. 직접 만든 순대가 들어가고 국물맛도 진합니다."
8,만두향,서울 강북구 한천로123길 61 1층 (우)01068,분식,"만두국,떡만두국,칼국수만두,찐만두,튀김만두,개성순대",6833,4.3,28,28,
