,name,address,sort,menu,mean_price,score,people_give_score,review_count,review_list
0,감동식당,서울 노원구 한글비석로47길 58 1층 (우)01679,한식,"감동 등갈비찜,시래기나물밥,봉평 메밀전,눈꽃치즈,납작당면,밀떡",4333,4.9,278,202,"맛있고 친절합니다! 보통맛 맛있게 매워요!/저도 후기보고 왔는데 너무 친절하시고 맛도 좋아서 두번 감동받았습니다:) 이벤트, 서비스도 너무 좋아요~~~ 다음에 또 올게요♡/왕맛있습니다..! 너무 친절하셔서 기분이 너무 좋아지는 식당인것같아요 ☺️☺️ 요근래 갔던 식당중에 제일 친절하셔요.. 맛있게 잘 먹구 갑니당 다음에 또 올게요!!/완전 맛있어요>_< 배 터져서 갑니다>_< 노원 안 사는데 멀리까지 와서 먹고 갑니당/오랜만에  진짜 맛있게 먹었어요   친절하시고 ^^/노원에서 감동식당 모르면 바보입니다/존맛이어서 순삭~!/너무 너무 맛있어요 한번 먹은이후로 계속 찾게되네요 주기적으로 생각나는맛^^❤오래오래 장사해주세요~!2!/보통맛으로 먹었는데 너무 맛있었어요~/너무너무 맛있어요ㅠㅠㅠ 친구들이랑 자주 왔었는데 이번에 부모님 모시고 왔어요!!ㅎㅎㅎ 앞으로 계속 올꺼에요!! 계속 이자리에만 있어주세요ㅠㅠㅜ/노원구 찐맛집이라해서 찾아왔어요!! 맛있게 먹고 갑니다~ 이젠 매운갈비찜하면 감동식당이 생각날것같아용/웨이팅 필수인 노원구 찐맛집♡ 매운거 땡길때 꼭 들르게되는 곳인듯... 사장님 직원분들 너무 친절해서 갈때마다 만족하고와요♡♡♡ 맵찔이들은 순한맛드세요!/8시 넘어서 도착했는데도 손님들이 많아서 20분가량 기다렸다 들어갔습니다! 순한맛으로 먹었는데 매콤달달하니 맛있었어요. 메밀전에 싸먹는게 제일 맛있네요. 다음에 또 올게요~/너무맛있어서 싹싹 먹었어요~~ 서비스도 너무 좋아요~~/너무맛있고 양도 넉넉해요. 직원분들도 너무친절하시고, 감동입니다~^^/5번째 방문입니다! 항상친절하시고 매운거땡길때 먹기너무조아요!!!/불암산 등산 후에 여기 와서 먹었는데 등갈비 꿀맛이었어요! 브레이크 타임 있으니 확인하시구요!! 다음 등산할 때 또 올 겁니당♡/너무 맛있게 잘 먹었어요  네번째 방문인데 늘 만족하고 갑니다 오늘 메밀전 3판 먹음 /매콤하고 맛있습니다./음식이 너무 맛있고 친절해요 또오고싶어요^^/엄마 모시고 방문했는데 시래기밥을 특히 흡족해하셧어용 순한맛으로 먹었는데 적당히 매콤하고 맛있어요 직원분들도 매우 친절하시고용 포장도 했어요!!ㅎㅎ/막 맵기만한 매운갈비찜이랑 다르게 간장의 깊은맛도 있어서 넘 좋았어용 밥도 엄청 고소~/상계동 맛집 인정입니다. 매콤한거 땡기실때 자주 오는데 변함없이 맛있고 친절하고 이벤트도 많고 오늘도 잘 먹고 갑니다. 참고로 이제는 보통맛보다는 순한 맛으로 먹어야 할듯 합니다^^/집 근처 푸딘코 맛집이 있길래 방문했는데 이미 유명한 집이더라. 5시반 6시 되어가니 평일임에도 슬슬 웨이팅 생기려 하는 맛집. 매운걸 잘 못먹어서 간장맛 순한맛 섞어 먹으니 아주 잘 맞았다. 시래기밥은 간 자체가 잘 되어있어 밥만 먹어도 충분..  근처 산다면 꼭 와볼만한 맛집 친절하기도 엄청 친절하심.. 별점 5개 /직원분들도 너무 친절하시고 맛도 너무 맛있어용/오늘도 잘목었습니다 너무 맛있어요 언제와도 친절해요 강추ㅠㅠ 넘 맛나용ㅎㅎ/너무 맛있게 잘 먹었습니다! 웨이팅 했는데 후회없았아요 ㅋㅋ 치즈랑 먹는게 젤맛있어요/존맛 그자체..../멀리 온 보람이 있네유...ㅎㅎ 감동감동...!!!ㅎㅎ/너무 자극적인 맛이에요~~♡ 서비스를 폭탄처럼 돌려서 별점을 수집하는 곳."
1,강강술래 상계지점,서울 노원구 동일로 1628 1층 (우)01630,"육류,고기","한우 스페셜,한우스페셜,한우 생등심,한우생등심,한우 모둠구이,한우 모듬구이",45000,3.4,46,111,"가족 식사 갔는데 소고기 모듬 시켰는데 정말 웬만해서 애기 안할려고 했는데 질겨서 애기함. 다시 나온고기도 별로 였는데 부모님 기분 상 그냥 먹음. 종업원분도 고기 굽는데 싫은티 팍팍내고 진짜 가족 식사만 아니면 뒤집어 싶었음. 진짜 이런 글 쓰는것도 처음인데 모처럼 부모님 모시고 가서 더러운 기분에 비싸게 먹으니 더 짜증남.  다시는 안감./가족행사로 다녀온곳.음식도 하나하나 모두맛있고  서비스에   넘  행복한 하루였네요~/가격대는 있지만 맛있음 가끔 가족들과 가기 좋은곳/맛도 괜찮고 서비스도 좋아요/서비스가 너무 훌륭함/가격대비 저조함,,고기에서 냄새나서 얼마 먹지도 못했음/1점도 아까움 서비스 개판  >>서비스 교육 다시 받은 것 같음 서비스 좋아졌음/강강술래는 워낙 맛있으니까요~/맛있어요/맛있네요/간만에 갔더니 갈비 양념이 업글된듯. 잘 타지도 않고 연한색깔임에도 맛은 진함. 그외 반찬이나 서비스도 만족함./비싸긴한데 양은 많이나옴 메뉴판찍으려고하니깐 찍지말라고해서 황당 그냥그저그래요 굳이가서먹을정도는 아님/지금 점심 먹는중인데  여기 올때마다 느끼는게 음식도 진짜 맛있지만  직원분들 진짜 올!!때!!마!!다!! 친절해서 너무 기분 좋습니다.   음식 먹다 말고 평점 남기네요/고기는 맛있으나 서비스가 ☆로 직원들끼리 소통이 안 되는지 우왕좌왕하고 메뉴를 시켰음에도 불구하고 20분동안 아무런 준비도 안 해주더니 메뉴 언제 시킬거냐고 물어보는데.....  -다음편에 계속-/2020.05.05 가족모임. 가성비와 써비스가 좋지만 반찬들이 너무 달다. 또 오고 싶지는 않는. 2020.10.05 갈비탕은 좋네/밥은 스텐에 다 타서 나옴. 탄 밥에 물 부어 먹으라는 건지? 냉면 먹는다고 겨자 부으니 고춧가루 같이 나오고. 소스 위생상태 확인 좀 하세요. 150g에 4만원치고는 가성비가 떨어짐./손님들이 많아서 복잡하지만 우리 테이블 맡은 분이 친절하고 일도 잘 하셨어요. 고기 맛도 좋고 푸짐합니다. ^^/서빙하는 분들 서비스가 많이 아쉽습니다/고기 곁들이 반찬 맛있어요 써비스도 좋구요/서비스 정말 그지 같음, 저녁에 고기만 먹다가 점심에 4살 아이와 식사 하는데 이렇게 고기먹을때랑 식사할때랑 차별할 줄 몰랐음.. 자기네 단체 받아야 하니 빨리 먹고 일어나라는듯 옆에서 단체 손님 여기 준비 하라는둥 ,  아이가 밥먹고 있는데 언제 다 먹을지 기약이 없다는둥 옆에서 무전으로 말함.. 손님을 거지로 여기는것도 아니고... 나중에 항의했더니 그...더보기/항상 사람 많은 곳 친절하고 맛있고 늘 기본은 하는 곳 허나 특별함은 없다 /맛좋고 분위기좋고 친절합니다. 손님이나 가족 대접하기는 최고임. 가성비도 좋아요/가격대비 나오는 고기 퀄리티, 찬 종류, 영양밥까지 훌륭/서빙직원들..진짜 우는 애를 만지지를 않나.. 애 우는데 물주라고 계속 참견하고 다신 안감/너우 실망했습니다 아들 생일이라 3월5일 저녁에 한돈갈비를 8인분에  돌솥 먹었는데 갈비라고시킨게 살덩어리가 처음부터 맛이없게 생겼더니 아니나 다를까 무슨 맛인지 모를 지경이고 초대한 손님께 미안하고 반찬도 부실하고 다시는 가고 싶지 않았습니다 음식 먹고 리뷰 안남기는데 화가나서 올립니다/직원분들 친절하시고 바쁘신와중에도 고기 신경써서 구워주시고 주차 발레파킹도해주심 혼밥하기에는 가격대가 있지만 가족모임이나 회식장소로 추천합니다/가격대비 품질 별로이고 직원들이 불친절. 거의 오픈 때부터 단골이었는데 장사 잘 되다 보니 언제부터인가 손님들 우습게 생각하고 ‘기분 나쁘면 오지 마’ 주의인 게 느껴져서 그 후론 안갑니다. /한돈양념구이 먹었는데 고기는 그냥그래요 잡채가 맛있네요 가성비로는 별로/강강술래 중에서는 제일 좋아요 3.5점/교통 최악입니다 차를 가져 갔다가는 욕 나옵니다.  주차장도 제대로 확보안 해 놓고 무슨 장사를 한다는 건지. /요정도 되면 음식점이 아니라 기업ㅋㅋ 가격대는 좀 있지만 인테리어도 깔끔하고 직원분들도 친절하고 모임하기 좋은건 사실. 왕갈비 먹었는데 어르신들도 연하다고 잘드심. 생일 예약하면 놋그릇에 미역국 포함한 1인 생일상과 와인 1병을 서비스로 준다. 룸 예약은 일찍부터 해야할듯. 홀은 좌식과 입식이 혼합된 형태로 테이블 간격도 괜찮고 불편하지 않았음. /소갈비 맛있음. 서비스도 굿"
2,로니로티 노원점,서울 노원구 상계로 63-7 청우빌딩 2층 201호 (우)01693,양식,"목살 스테이크 샐러드(하프),생연어 샐러드(원플레이트),이탈리안 커틀렛(하프),해산물 까르보나라(하프),갈릭 게살 필라프(하프)",12100,4.1,37,223,"양 푸짐하구 맛있어요/맛있어요!/채끝 스테이크 샐러드 해산물 올리브 스파게티 오이스터 크림 리조또/존맛탱/맛, 가격 둘다 괜찮아요/괜찮았어요! 양도많고 맛있고 양대비싸서 사장님이 걱정되기도.. 그냥 다들바빠서 시크하신듯/변했어../스테이크 수입고기라 그런지 찔기네ㅠ/양많고 맛있어요. 분위기도 좋아요. /잘 모르고 한 접시 시키려다가 직원분이 양 좀 많은데 괜찮으시냐고 알려주셔서 좋았어요. 반 접신데도 양 넉넉했습니다ㅎㅎ/비쌈/레알 최고 요근래 파스타 다른데 많이먹었는데 서비스나 맛 양등 좋아요  다만 모든음식이 좀 짠거빼고 !/괜찮았어요~!ㅎㅎ/샐러드 풍족하고, 가성비 뛰어납니다. 파스타도 맛나고요.....하프메뉴를 시키는게 좋을듯 하네요...양이 많습니다^^/가격에 비해서 좋아요 맛을 기대하지 않고 오늘 파스타 배터지게 먹고 싶다 하면 가기 좋네요 거기다가 목살 샐러드인가 그것도 그냥 먹을 만했어요 치즈 많이 뿌려줘서 좋네요/음식은 맛있었는데 집 와서 배탈이 났어요 화장실... 아무리 맛있어도 또 가진 않을 것 같아요/글쎄요ㅜ 저는 그저 그랬어요... 그냥 무난한 맛있어요~!/리조또에 풀어진 면과 뭉쳐진 밥덩이가 있네요. 리조또에 면이 있다는건 직전 조리한 팬을 그대로 썼다는 것이고, 밥덩이 뭉쳐진건 쌀이 아니라 이미 밥해서(그것도 리조또 조리하는 과정에서도 풀어지않는 굳은 밥)조리했다는걸텐데... 리조또에 면이 한두가락이 아니었던지라 혹시나 본인들 특색이시라면 빼는게 좋겠어요. 다시는 안 갈거 같아요./기대 안하고 왔는데 맛있음bb 양도 많음.만족./맛있어여! 양이 진짜 많네요 해산물야끼파스타는 좀 별로였고 ㅠㅠ 다른건 다 괜찮았어요 /무심코 들른곳에서  무한의 감동을  느끼다...  한시라도  빨리가세요..  조만간,  두시간은 기다려야 음료한잔 겨우  먹을수있는곳이 될테니까../그냥 다 아주 맛있어요. 맛있다는 표현말고는 할 표현이 ㅋ../최고임다 "
3,왕십리조개창고 노원점,서울 노원구 상계로1길 38-11 우창프라자 2층 201호 (우)01693,조개,"성인,초등학생,미취학아동",18333,3.1,30,130,"단점은 입출구가 통합된 통로가 작은 지하 주차장, 식당 내 이동 불편함, 환기 부족등등 있었고 장점은 여러 종류의 음식, 맛있음 정도라 괜찮았습니다/다른 지점으로 다니다가 노원점 처음 가봤는데 나쁘지 않았어요! 육해공 세트 알차더라구용 ㅋㅋ 근데 제가 갔을 때 사람이 많아서 그런지 되게 정신 없는 느낌?은 살짝 있었어요/조개도 신선했고 조개랑 고기랑 같이 먹을수 있어서 넘 좋았습니당ㅋㅋㅋㅋ 저는 해산물 좋아하고 친구는 육식파인데 둘다 만족했어여/가리비를 좋아하는데 원하는 조개들만 가져와서 먹을 수 있어서 너무 좋았습니다. 그리고 생각보다 조개들 상태가 나름 싱싱하더라구요 맘대로 가져와 먹을 수 있는 고기들 종류도 많고 진짜 맛있었습니다 ㅎㅎ/키조개가 손만큼크고 조개 고기 꼬치등 다양한것을 무한리필로먹을수있구 마지막에 라면에 조개넣고 끓여먹으면 너무 맛있어요!!!!/육해공 구성 완전 최고에요! 조개, 고기 다 싱싱하고 퀄리티 대박입니다! 입맛까다로운 친구가 인정한 맛집이에용~!/최근에 여자친구랑 다녀왔는데 말이 필요없습니다. 최근 갔던 조개구이집중에서 100점만점의 100점입니다! 조개도 싱싱하고 고기도 맛있고 따봉!ㅋㅋ 사장님 특히 친절하심 (제가 후기남긴다했죵?! 잘했죠!)ㅋㅋ/댓글 알바들만 잇나 싶네요 리뷰 이벤트해서 그런가 ㅡㅡ 조개상태도 영 안좋고 다신 안감  가게도 겁나 드럽고 손님잇는데도 집게로  불화구 벅벅 벗겨 내질않나 먼지 날리고 에휴 다신 안가면 그만이지만 알고들 가세요 /전 개인적으로 맛있게 먹었어요~!/마딧게 먹었읍니다/저도 좋아하고 남편도 좋아하는 곳이라 자주 가요 ㅋㅋ 맛있어요/아는 분이 노원에 사셔서 노원에 조개창고를 가려고 1시간 30분정도(오후2시정도)  걸려서 갔는데 , 가자마자 코로나 백신만 맞은 사람만 출입이 가능하다고 하더라구여. 기가막히기도 하고 가기 전날에 전화했는데 이런 사항은 전혀 공지하지 않았구요. 관계자에 말에 의하면 서울시에서 조사를 나온다고 하던데 , 그런데 서울시는 이런 사항을 공지한 적 없고 가게 자...더보기/어제 갔다왔는데 신선하지 않아요. 특히 고기는 오래된것이고 상하고 색깔이 굉장히 안 좋은데 직원분이 먹어보고 이상하면 바꾸겠다 했음. 먹고 보고 배가 아프고 어제부터 화장실 계속 갑니다 . 같이 간 친구도 그랬네요.  가계도 깨끗하지도 않고요. 양심 좀 있게 장사하세요/너무 비위생적입니다../정말 좋아요/제가 갔을때는 주말 낮이었는데... 조개가 신선하지않았어요.ㅠㅜ샐러드바에 있는 서브 메뉴들도 오래되었음..고기도..반찬들도...치즈도...ㄷㄷ 직원들도 좀 귀찮으신지 불친절하셨어요/메뉴도 다양하고 시간제한도 없어서 술한잔하기 괜찮았어요. 코로나만 아니였어도 친구들이랑 우르르가고싶네유ㅠㅠ/연기가 자욱해서 숨이 막힌다. 난잡하고 지저분하고 어수선하다. 조개 종류는 많다. 그러나 몹시 짜다. 생수는 1병만 무료. 라면 4000원 햇반 1500원. 기본이 1인당 25500원인데, 그 값으로 즐길 수 있는 더 나은 대안이 많다. 별점 5개도 종종 보이는데, 이분들은 다른 리뷰는 없고 전국의 조개창고만 죄다 별 다섯 개 주셨네... 조선팔도의 조개창...더보기/조개구이를 혼자서 셀프로 잘 구우실수 있는분만 가시길 바랍니다.모든게 전부 셀프입니다.조개를 어떻게 구워서 먹어야 하는 설명도 없습니다.라면도 끓여주는것도 아니고 그냥 셀프로 한개 가져가서 먹는데 개당 4000원 입니다.위생은 뭐 개판인거 확실하고요.직원들은 왜케 불친절한지 부르면 오지도 않고 주방에만 다 모여있고 계산할때 다른거 별로 먹은게 없으니까 눈치...더보기/조개가 안 신선함 내부가 꼬질꼬질함/맛있는데 다들 왜그러세요 평점이 낮아서 걱정하고 갔는데 시간 무제한이고 조개도 싱싱한거 무제한이고 가리비 진짜크고 진짜 맛있음 또갈거에요/소셜커먼스 광고가 너무나 훌륭한 울 나라.. 두번다시는 안가요..정말이지 아주 큰 실망!! /조개가 안 신선함 내부가 꼬질꼬질함/맛있는데 다들 왜그러세요 평점이 낮아서 걱정하고 갔는데 시간 무제한이고 조개도 싱싱한거 무제한이고 가리비 진짜크고 진짜 맛있음 또갈거에요/소셜커먼스 광고가 너무나 훌륭한 울 나라.. 두번다시는 안가요..정말이지 아주 큰 실망!! /조개가 안 신선함 내부가 꼬질꼬질함/맛있는데 다들 왜그러세요 평점이 낮아서 걱정하고 갔는데 시간 무제한이고 조개도 싱싱한거 무제한이고 가리비 진짜크고 진짜 맛있음 또갈거에요/소셜커먼스 광고가 너무나 훌륭한 울 나라.. 두번다시는 안가요..정말이지 아주 큰 실망!! /조개가 안 신선함 내부가 꼬질꼬질함/맛있는데 다들 왜그러세요 평점이 낮아서 걱정하고 갔는데 시간 무제한이고 조개도 싱싱한거 무제한이고 가리비 진짜크고 진짜 맛있음 또갈거에요/소셜커먼스 광고가 너무나 훌륭한 울 나라.. 두번다시는 안가요..정말이지 아주 큰 실망!! "
4,어글리스토브 노원역점,서울 노원구 노해로81길 12-21 3층 (우)01695,양식,"어글리리코타치즈샐러드,어글리 프렌치 토스트,비프필라프,크랩로제파스타,안창&치킨스테이크",14100,3.9,32,139,"직원분들이 친절함, 맛도 그럭저럭, 분위기도 무난한 식당/Had the shrimp and steak combo, with a grapefruit mojito. Outstanding! Steak was a perfect medium rare, great flavor on everything. Nice atmosphere, friendly service. Will definitely be back!/몇번갔던 곳인데 조금 소란스러웠던 것 말고는 괜찮더라구요/맛있습니다./아는 선생님이 추천해주신 곳 나중에 한 번 들러서 먹어보고 싶어요/직원분이 정말 친절하세요 맛있게 잘 먹었습니다/자꾸 생각나는 맛이네요 커피잔이 넘 촌스러워서 하나 뺐어요 장사 잘 되는데 예쁜 컵좀 사시면좋을듯요/유명한 것 같아서 가봤는데 생각보다 기분 좋게 먹고 나왔네요~! 직원분들도 친절하시고 가격 대비 괜찮은 퀄리티라 양식 먹고 싶은 날에는 바로 여기가 생각날 것 같아요!/직원분들께서 너무 친절하시고, 맛있었습니다! 또 가고싶네요:)/음식 하나도 안 신선하고 매니저 같은 중년남성들, 직원한테 뭐라뭐라하는데 보는 손님이 불쾌할 지경이었어요. /파스타 맛있네요/메뉴가 다 맛있어요 또가고싶네요/헌혈하고 먹는 파스타는 짱짱임 ㅋㅋ/갈때마다 넘 맛있음 !!/아주머니들이 많아서 시끄럽습니다- 알리오올리오는 퓨전인듯.... 맛은 그닥... 전체적으로 가격이 나갑니다-/카카오맵의 메뉴 가격 보고 갔는데 안창 치킨 스테이크  매장 가격이 천원 비쌌음. 업데이트 안 한듯. 양ㅡ중하 맛ㅡ중 분위기ㅡ중 시설 하(남자화장실 수도꼭지 고장)/맛은 뭐 그냥저냥.  직원들은 무뚝뚝. (사람 말에 대답을 잘 안 하고, 행동으로만 함. 이게 은근 무시 받는 거 같음)  굳이 갈 이유는 모르겠음."
