,name,address,sort,menu,mean_price,score,people_give_score,review_count,review_list
0,진짜파스타,서울 마포구 와우산로 64 전원빌딩 2층 202호 (우)04067,이탈리안,"치즈피자,알리오에올리오,토마토,하늘재 돈까스,로제,바삭순살치킨,김치,베이컨필라프,파스타",6250,4.6,302,89,"리뷰 좋아서 갔는데../소방관 상관없이 그냥 음식점으로써도 가격 조금 올려도 될듯/가려던 음식점이 문을 닫아서 평점 높은 곳이라 해서 찾아왔는데 와.. 진짜 사장님 정말 친절+세심하시고, 음식도 빨리 나오는데, 양도 많고 가격도 싸고 맛있기까지 하네요! 자주 갈게요! 최애 등극하고 왔어요. 보니까 좋은 일도 많이 하시는 거 같은데 돈쭐내 드려야 겠어요^^/별점이 높아서 왔는데 사장님도 친절하시고 보니까 좋은 일 많이 하시는 거 같더라고요. 이런 파스타집은,혼밥하기 눈치보이는 일이 많은데 전혀 그런 거 없이 편안히 잘 먹었습니다. 양도 정말 많아요/맛있었어요☺️/파스타 맛집이네요 /돈쭐내러 조만간 갈거에요~!! 사장님 화이팅!!/만간에 돈쭐내러 가겠읍니다/사장님 짱/가성비 낫벧/콕콕콕 스파게티 2승/그럼 가짜겠냐/사장님께서 정말 친절하시고 파스타도 맛있습니다 :)        /사장님이 무척 친절하지만 아쉽게도 맛은 없습니다. 면과 소스가 따로 노는 맛. 시중에 나오는 기성품보다 못하다 느꼈습니다./친절하시고 맛있어요 베리굿!!!!/사장님이 친절해요  면이 덜 익음, 고기 잡내가 심함. 음식은 남겼습니다/사장님 정말 친절하세요~!! 알리오올리에 짱 좋아하는데 정말 맛짱이였어요~!! /이 근방 다른 곳이라면 최소 16000원은 내야하는 맛과 양을 고작 8500원에 즐겼습니다… 가성비도 맛도 짱^^  결식 아동 후원까지 하신다니 정말 뭐 하나 빠지는 곳이 없는 집이에요~~  +)하루종일 기분이 우울했는데, 사장님의 친절한 배려와 즐겁게 일하시는 모습에 저까지 마음이 따뜻해졌어요^^ 제 오늘 하루를 기쁘게 마무리할 수 있게 도와주셔서 감사합...더보기/여기가 진짜 파스타/소문듣고 왔어요~ 돈쭐 많이나셔서 사장님 좋은마음 계속 펼칠수있게 번창하시고 늘 건강하세요 상수동가면 한번 들리겠습니다!/번창에번창을 거듭하길!/가격대비 가성비 좋아요 굳!!/맛있어요!! 추천하는 집입니다/홍대 파스타 1티어 맛집/사장님 친절하시고 가격 저렴하고 맛은 보통/사장님께서 너무 친절하셔서 충격받았어요 ... 이렇게까지 친절하신 분이 계시다니 ㅠㅜㅜㅜ 복받으세요/의미있는집이예요. 소방공무원 지원도 해주시고 맛도있고 가성비도좋고!!/평소에 별점 잘 안남기는데 방문하고 너무 충격받아서 기어코 리뷰를 남겨요!  파스타 먹을까 고민되시면 무조건 여기로 오세요 밥 뭐먹을까 고민되시면 무조건 여기 파스타 드세요 가격도 엄청 싸고 가성비도 좋아요!  무엇보다 사장님이 너무 친절하세요! 주문 받으실때부터 친절함이 묻어났구요, 서빙하실때도 항상 친절하게 대해주셨어요! 다 먹고난 뒤에 나가려던 차에 ...더보기/훌륭한 맛과 가격 친절까지! 자주 오고 싶은 집입니다. 지금처럼 오래 계시길!!!^^/와.진짜 감동입니다. 진짜 이렇게 기분좋고 감사한맘으로 식사한 곳을 알게되서 넘 기뻐요. 사장님 진짜 찐!!!!!!!!!!진짜 돈쭐 내드리고싶어요. 모든음식에서 정성가득한 맛이 느껴져요♡ 자주갈거에요.맛있는 저녁식사 감사합니다."
1,맛이차이나,서울 마포구 독막로 68 2층 (우)04074,중화요리,표기안함,표기안함,3.5,91,117,"음식은 맛있었는데 알바생들이 다 억지로 일하고 있는 느낌이에요 자리 안내 받고 앉았는데 테이블에 탕수육 소스 같은게 묻어있어서 닦아달라고 말했더니 기본 찬 다 세팅하고 그 옆에 소독제 뿌려서 닦길래 어이없었어요 그마저도 엄청 대충 훑어서 이물질 하나도 안 닦였고 여기라고 짚어줬는데도 제대로 안 닦아서 손 닦으라고 나오는 물티슈로 제가 직접 닦았어요 요즘 같...더보기/전반적으로 맛있었고 룸에서 조용하게 먹을 수 있어서 좋았어요 (룸은 3층에 있고 미리 예약 필요)/중국식 냉면 정말 맛있더라구요. /요리는 매우 좋은 편. 짜장의 경우 시간대에 따라 맛이 달라짐. 오픈 직후의 짜장이 가장 훌륭함. /런치세트이 1인 가격 써놓고 2인 이상만 주문 받는 이상한 곳. 2인 이상만 된다고 써놓든가. 직원들도 불친절/짜장면 맛있어요. 고기가 듬뿍 들어있고 왠지 고급스러운맛./맛이 점점 아쉬워진다/주차비 3,000원/동네 중국집 이하... 수 년간 믿어온 블루리본에 대한 의구심이 처음으로 들었습니다./사람없을 때 가서 테이블도 널널했는데 창가좌석 놔두고 음식 나오는 곳 바로 앞에 좌석을 주네요, 알바생인지 직원인지 손님에 대한 배려도 없고 너무 불편했습니다./가격에 비해 식당과 음식이 깔끔해서 좋았습니다. 저는 개인적으로 탕수육이 맛있었어요! 짬뽕은 살짝 매운 짬뽕보단 마늘맛&사골느낌이 나는 맛이에용/음식은 대체로 맛있는데, 종업원들의 접객 태도와 서비스는 영 아니올시다. 텀블러에  든 커피마시면서 응대하거나 손님이 요청한 것에 대해서 너는 이야기하고 나는 우리끼리 이야기한다는 식이다. 후식으로 나온 메론은 차라리 제철 딸기 몇 알로 바꾸는 게 좋을 듯. 싼 게 비지떡  느낌/하두 평이 좋와서  오늘 저녁 방문  짜장면 삼선짬뽕  탕수육  먹었습니다.  근데 직원들 각각 지핸드폰 보기  바쁘고  불러두  잘모르고 짜장은  왜이리  장을  야박하게  주는건지... 정말 이건  아니네요.  절대 후기평 보고 가지 마세요.   이런  식당을 하려면  돈  아끼려  하지 말고  알바생쓰지 마시고  제대로 교육 받은  직원을  써야 되는...더보기/팔보채는 맛있음 여자 직원분 친절하심 /공부탕면 쟁반짜장 멘보샤 맛있어용/굿/어향가지 너무 맛있어요/런치세트 가격대비 정말 최고입니다 /깐풍기는 그저그런데 어향가지가 맛있/굿 맛잇어요/달지 않고 짜지 않은 자장면. 난 단 자장면이 좋아서 약간 취향 미스이긴 했지만 면의 식감이 참 좋다. 다른 메뉴 먹으러 다시 오고싶다./와 진짜 맛있음. 평점이 3점대라 걱정했는데 블루리본 5개라 평타는 치겠지 했는데 맛있네요. 특히 탕수육이랑 짜장면 쵝오 안달고 안짜고!! 담엔 해산물누룽지탕 먹어볼려고요. 요리주문라셨다면 면의 양이 넘 많으니 하나시켜 나눠드셔야./진짜 위생이 .. 먹는데 음식에서 털이 나왔어요 (머리카락 아님) 맛은 있었어요 /짜장면 맛있어요/탕수육 맛있고 짜장면은 평범하지만 양은 많은 편. 자차이는 참기름 맛이 너무 많이 났다../기본 위생 개념이 없습니다. 주방에서는 마스크, 위생모 안쓰고 조리하시나요? 청결 상태도 안좋고요 방송된 곳이라..가봤는데..재방문 의사는 없습니다 /공부가면이 맛있네요 수요미식회 짜장면 팔보채 편에 나왔다고하는데 공부가면이 소개되지 않은것이 안타깝네요 탕수육 어향가지 다 괜찮았어요 저는 공부가면 국물 맛과 싱싱한 해물에 별 다섯개 드립니다/정말 인생중국집이고 팔보채랑 양장피 기가막힘 개인적으로 공부탕면 좋아하는데 정말 맛있고 깔끔함 간 세게 드시는 분은 별로 안 좋아할순 있음/첫방문보다 맛이 없어져서 아쉬운 곳ㅠ 맛은 평타. 베스트는 아닌 곳. 메뉴는 탕수육, 크림새우, 유린기 추천 짜장면 의외로 평범 멘보샤 너무 기름지고 소스가 아예 없어서 느끼했음 명성을 많이 잃어버린 느낌./친절하고  3층까지 확장해서 웨이팅도 줄고 좋아요"
2,칸다소바 홍대점,서울 마포구 와우산로 51-6 (우)04049,일본식라면,표기안함,표기안함,4.1,137,68,
3,오츠에스프레소,서울 마포구 독막로14길 32 지하 1층 (우)04074,커피전문점,"아메리카노,카페라떼,오츠아메리카노,오츠라떼,아인슈페너,더치바닐라",4416,4.5,94,259,"아인슈페너 맛집인정ㅎㅎ 직원분도 친절함 하지만 양이 좀더 많았으면 하는 아쉬움, /스콘 맛있어용~/친절하고 좋아요!  아이스크림 라떼 굳/크림 쫀득한 식물성크림 명성에 비해 개인적으로 별로였다 직원이 친절해서 좋았음/크림 쫜득개존맛. 하지만 양은 창렬/존맛!!!!!/맛있어요 크림은 호불호가 조금 있을거 같아요/오츠라떼는 평범하고, 아인슈페너는 확실히 맛있네요. 어쩌다보니 웨이팅을 했지만 회전율도 빨라요./플랫화이트 구수하고 정말 맛있어요. 계속 생각나는 커피맛.. 또 가서 세 잔 마시고 싶네요 ㅎㅎ/따뜻한 아인슈패너 맛있었다. 끝에는 너무 달아서 약간 물렸는데 아인슈패너라 약간 어쩔 수 없는 것 같다는 생각. 아이스 아메리카노는 신맛 있는 블렌딩으로 마셨는데 쓰지 않고 산미도 적당해서 맛있었다. /아인슈패너 맛집!/아인슈페너는 부산 해수염커피 제일 좋아하는데 여기서 크림 첫 입 딱 먹고 인상 찌푸렸어요. 참고로 같은 3대 아인슈페너 중 아키비스트는 별로였어요./커피맛집이에요 홀린듯이 캡슐이랑 더치커피 사갔읍니다 다음엔 페이보릿말고 기본메뉴 먹어야겠어용!/다른건 안막어봤는데 아인슈페너 맛집.. 첫 맛이 굿인데 끝무렵에 느끼한건 어쩔 수 없나봄/걍 괜츈해요… 막 엄청 존맛탱은 아닙니다 ㅎㅎ 아인슈패너가 나아요~ 기다리고 먹을 정도는 아니라서 재방문 의사는 없어요!/오츠아아 마셨어요. 시지도 않고 쓰지도 않고 깔끔한 맛이에요. 여름에 마시기 너무 좋아요./커피가 진짜 맛있어요 요즘은 카페가 많아서 보통 한번갔던 카페는 다시 안가는데 재방문했고 또 방문할생각입니당~~!/서울 3대 아인슈페너 까진 모르겠으나 부드러운 크림과 에스프레소 잘어울렸음 그리고 인테리어 실내공기 다 쾌적하고 좋았음/라떼만 마셔봤는데 존맛,, 아이스말고 핫이 더 맛나구요 아인슈페너도 마셔보려구요..!/맛있었지만 내가 먹었던 여느 아인슈페너들과 다른점은 없었다..!   매장은 생각보다 작고 지하로 내려오는 문은 두개다. 1층 밖에서(?) 먹을 수도 있다. 카페 겉 구조가 특이하다. 나는 웨이팅 20분 정도 한 것 같다. /존맛/Oats Latté or Ein Spänner/테이크아웃 할인돼요! 아인슈페너 넘 맛나게 먹었습니다 /아인슈페너 맛집이에요!!/사람은 많았지만 커피는 최고 ㅎ/아인슈페너는 처음 먹어봤는데 크림이 쫀쫀하고 달달하네요......너무 맛있습니다..... 자주 찾게될듯해요...최고....｡ﾟ(ﾟ´ω`ﾟ)ﾟ｡/오츠커피의 아인슈페너가 제일 맛있어요! 맛있는 아인슈페너 먹고 싶을 때 가는 곳입니다/아인슈페너 맛있습니다. 크림이 쫀득하니~ 담에는 라떼도 맛보고 싶네요~ /커피 정말 맛있었어요 반지하 매장이라 좀 좁아서 자리는 넉넉하지 않아요.  귀여운 굳즈가 있어서 사왔슝/맛나요 양이 넘 작지만 ㅠㅠ/나만 알고싶은 맛집이었는데 어느새 입소문타고 유명해졌네요. 아인슈페너 참 맛있습니다. 상수역가면 꼭 들르는 곳이에요. 가격도 착한 편이고 친절하시고 좋아요./아인슈페너랑 오츠 아메리카노 스콘 먹었슴다 아인슈페너 맛있었구 오츠 아메리카노는 고소한 맛으로 시켰는데 산미가 조금 강한 편이네요. 공간이 멋집니다/분위기는 좋다나쁘다 할거없이 평범해용   크림이 맛나용   오츠 아메리카노는 이 가게만의 비율의 아메라네용 과일향이 나는 아메였어용  "
4,테이스티버거,서울 마포구 독막로 67-11 행운빌딩 1층 (우)04049,햄버거,"크라켄버거,먹물번과 크라켄 오징어 패티의 특별함. 테이스티 버거의 오리지널 개발 메뉴,7,900,에그마니버거,부드럽고 달콤한 에그 스크럼블과 베이컨, 매콤한 특제 소스의 조화,8,900,10,900",9850,3.6,90,302,"쉑쉑버거, 바스버거, 다른 여러버거 먹어봤지만 저는 테이스티버거가 가장 맛있습니다. 크라캔, 에그마니 특이하기도 하고 더블 치즈 버거도 묵직하고 맛있어요~/기대보다는..별로…/가게가 너무 더럽고 맛도 별로 없음.. 곳곳에 신경 안쓴 티가 팍팍,,/위생이.../가게 곳곳이 더러웠어요..../맛은 쏘쏘/총평: 베리나이스버거 돌았다;;;;  평소에 버거처돌이고 수제버거 개좋아함 입맛 꽤나 까다로움  크라켄이나 에그마니는 어디서든 먹을수있는 평범한 맛+약간의 추가 퀄리티 느낌 근데 베리나이스버거는 진짜 미쳤음 존맛  파프리카가 그렇게 느끼한맛을 잘 잡아주는지 몰랐음 존맛 미쳤음  여기오면 무조건 베리나이스 드세요!!!!!!!  수제버거라 이해는 간다만 가성비...더보기/뭐 맛없다 이런건 아니지만 이걸 최고의버거라고 하는 사람들은 평소에 뭘 먹고 사는거냐... 가성비 좋다고 하는 사람도 있는데 흠.../감튀 핵맛/대존맛 먹은 햄버거중에 탑/존맛입니다,,,/테이스티..  이름대로 맛있어요 냠냠 굿 ~~ /저의최애 베리나이스버거 언제먹어도너무맛있습니당♡  허니갈릭후라이즈 감튀두툼해지니더맛있네요  콘샐러드까지 환상의조합입니당  /진짜 맛있습니다 여기는.. ./한번은 가볼만한 곳입니다./여기 버거집 재난기금 되나요? 안되면 쓰레기 매장인데.../호불호가 어느 정도 생길 수 있습니다./호불호 갈릴수는 있는데!  저는 개인적으로 너무 잘먹고왔어요ㅠ 햄버거 질도 좋은거같고 무엇보다 감자튀김 아닌 고구마튀김 유니크해서 시켜봤는데 고소달달한게 햄버거맛을 더 극대화 시켜주네요. 다만 계속 먹다보면 좀 느끼한ㅠㅋㅋ 그렇지만 콜라로 승화시켰습니다ㅎㅎ 햄버거 좋아하시면 한번쯤 먹어보는것도 괜찮을듯 하네요/와 직원 싹퉁 바가지 /테이블 청소 미흡-브레이크타임끝난후 첫손님이였는데 테이블에 파슬리및 소스자국이 묻어있어서 자리바꿈 그리고 브레이크 타임때 소파에 누워서 자는거다보임 가림막같은게필요할듯  가격 조금비쌈 맛 평범   크라켄버거맛-롯데리아 새우버거에 계란얹은맛 에그듬뿍버거-계란버거 소금안친계란 체다치즈때문인가봄   허니갈릭프라이 -부실한가같음 다른블로그 및 사진이랑 차이가남  ...더보기/기대 정말 많이했습니다. 맥도날드 더블쿼터파운드치즈는 소스라도 있지  여긴 소스가없네요. 단짠단짠 기대했는데 짠짠짠 퍽퍽  피클 맥주없었으면 절반밖에 못먹었을것같아요. 더블치즈버거에는 소스를 개발하셔서 뿌려야 될것같습니다. 너무 퍽퍽해요.  패티가 부드럽긴 했어요 치즈맛으로 먹기에는 너무 버거워요/먹을만 함 그정도...  /맛있어요. 저는 감튀는 쫌 별로였구. 버거가 맛있네요./19년도에 임신중에 갔는데 언뜻 봐서는 몰랐을텐데 직원한분이 알아보시고는 테이블도 바형 아니고 일반테이블로 안내해주시고 에어컨도 낮게 설정해주시고는 더우면 말씀해달라고 하시고 주문했던 햄버거에 반숙란이 들어가는데 다 익혀드리겠다며 임산부인 제가 미쳐 생각하지못했던 부분을 다 배려해주셔서 감동받고 왔었습니다  버거는..  이름이 기억안나는데 하나는 맛있었고 ...더보기/아이들과 잘 먹었어요/가성비도 좋고 재료도 좋은재료를 쓰시는게 느껴져서 정말 신선하고 맛있습니다 인생 햄버거집이네요/일반 버거랑은 다르게 너무 부드럽고 맛있어요 수제버거답게 양도 푸짐하고 재료도 실합니다 자주올게요/기대를 너무 한듯 넘 느끼해서 맥주 두병깜/맛나영/맛있어요. 근데 양이 좀 부족할 수 있어요. 가성비가 약간...ㅜㅜ/먹다찍은거아니고 이게 처음나온거임.... 호갱 창렬의 끝판...  크라켄 먹을거면 집에서 밥 든든히먹고 가시길. 피클은 장난치는듯이 한개줌..어이없어서 먹다 버리고 나옴.   다신안감 /개성 없음. 어니언링은 맛있음. 근데 비쌈"
5,라멘트럭 상수점,서울 마포구 독막로14길 31 1층 (우)04074,일본식라면,"라멘,신라멘,수제교자,미니차슈동",6000,3.6,105,48,"유명하길래 일부러 찾아가서 먹은건데 그냥 그래요!! 국물도 면도 차슈도 딱히 맛있는 구석이 없어요! /맛있게 잘 먹었습니다./직원들이 활기차고 씩씩해서 좋네요 라멘도 한국입맛에 적당 합니다.그치만 갔을때 바자리 앉았는데 바닥에 곱등이 인지 귀뚜라미 인지 엄청 컸어요 그게 저 구석 다른손님 발밑으로 지나가는걸 보고 정말.. 토나올뻔 했습니다. 매장 청결은 신경써주세요. /맛있습니다 최고입니다 특히 사진 찍기 좋은것같습니다./변했다는 리뷰가 많은데 변했다기보다는 갈 때 마다 맛이 다르다는 표현이 더 정확한 것 같다. 30회 이상 방문에 밀키트도 시켜먹고있지만 매번 맛이 다르다. 어느 날은 마늘을 너무 많이 넣어서 마늘맛이 강하고, 어느 날은 밀가루를 제대로 안털었는지 국물에서 밀가루 맛이 나고, 또 어느 날은 정말 맛있게 먹는다. 그래도 계속 생각나서 먹고있지만 오랜만에 오는 ...더보기/라멘 3/best/맛있/닭육수는 담백해서 첫맛은 깔끔한데 나중에는 돈고츠 육수가 치고 올라오는 맛이 또 진하고 맛있어요  조금 느끼해질 때 쯤 청양고추 넣어서 먹으면 또 꿀맛.. ㅠ 맥주랑 꼭 같이 드시길 추천합니다/사람들이 맛 변했다고 하는데 오늘 먹어본 결과 아님. 적어도 신라멘, 차슈, 계란맛 2년전과 동일함. 맛있게 잘 먹고 나왔어요 사장님./2021. 9월 방문하고 무척 실망한 후 최근 댓글에 맛있다는 말 보고 변했나 하고 방문. 결론은 댓글알바에 속음. 변한 거 하나 없이 오히려 가게는 더 더러워지고 라멘 맛도 예전 그 맛이 하---나도 안남. 차슈는 탄 맛만 나고, 차슈동도 탄 고깃재에 밥비벼먹는 것 같고, 국물도 비리며 연하고,, 사장이 바뀐건지 관리를 안하는건지 ,, 그나마 맛있던 계란...더보기/맛있어요! 매장이 좁은 감이 있어서 조금만 늦어도 추운 날씨에 파멸적 웨이팅을 겪게되오니 일찍 가시는걸 추천드립니다/맛은 있으나 청결도가 의심되네요 음식물 처리를 바로바로 안하시는지 이 추운날 날파리가 드글드글거려요 밥먹는 내내 비위상하네요/근처 라멘가게들이 즐비한데 이런식으로 만드신다구요..? 뭔가 잘못되어가고 있는 듯 합니다.. /맛이 변했어요/냄새를 줄이기 위해 어떤 노력을 했는지 알 수가 없다. 돼지 잡내가 매우 심하며, 계란은 간장계란을 쓰고 차슈또한 특색없다. 대기를 하더라도 옆의 오라노라멘을 먹겠다./날이 너무 더워서 냉라멘을 먹었는데 제 취향은 아니었지만 그래도 훌륭했습니다! 음식들이 전반적으로 간이 약한 편인데 따로 요청하면 맞춰주십니다. 직원분들 너무 친절하시고 교자까지 서비스로 주셔서 왕감동이었습니다. 감사해요 담엔 라멘이랑 신라멘 먹으러 갈게요~/일본라면에 제일 근접하다/차슈가 맛있음/진짜 계란 맛집. 차슈랑 계란이 맛있고 면은 끊어지는 느낌이 싫어하는 면이라ㅜ 면만 빼면 육수도 나쁘지 않고 괜찮음. 근방 라멘집 중엔 베스트/맛있네요/밑에 외국인 댓글 파파고 돌림  네, 4년 전까지만 해도 여기 정말 맛있었어요. 그리고 오늘 여기 다시 와서 맛있는 라면을 먹었는데... 육수는 아마 싸구려 국물로 만들어지고 맑고 섬세하고, 지금은 구름에 계란이 잘게 다져지고 부드럽고 하얀 면이 있고, 신선하고, 지금은 소자처럼 완전히 소자흑인의 맛이 나고, 다른 것은 아무것도 양념하지 않고, 양념에 재워...더보기/지점 관리좀 잘 하셔야 겠어요 오목교점? 목동점 에서 배달 시켰는데 주문은 누락되고 전화 여러번 해도 받지도 않고 응대가 최악 이네요  같이 시킨 공기밥은 다 말라 비틀어져서 생쌀인줄 알았네요 안그래도 요즘 이미지 안 좋은데 더 안좋아지지 않으려면 신경 많이 쓰셔야 할듯 해요/괜찮았는데 간혹 너무 느끼함 /ok, this place was really good about 4 yrs ago, and i came back today to eat again here that delicious ramen, but now.... broth is made probably with a cheap stock,, it was clear and delicate, now it'...더보기/뭔가 다른곳이랑 아지타마고가 다른 느낌이에요! 양도 가격도 딱 좋고 그냥 사실 전부 다 좋습니다 짱/차슈랑 반숙란 다 완벽/직원들 진짜 별루 불친절 특히 대머리..../차슈만 먹었으면 좋겠다 차슈가 매우  맛있다  라멘 국물도 /특출나지는 않지만 맛있는 라멘트럭 가볍게 찾아가더라도 실패없는 라멘집"
6,랑데자뷰 상수점,서울 마포구 와우산로13길 49 (우)04049,디저트카페,"Rendeja-vous (ICED),Americano,Cafe Latte,Jeju Greentea Latte,Tarte (Seasonal fruit)",6460,3.2,33,693,
7,경주식당,서울 마포구 와우산로13길 49-7 (우)04049,"육류,고기","고기한상,소고기 220g+생삼겹살 150g+생목살 150g+경상도식 밑반찬,45,000,고기한상 샐러드 파스타 세트,소고기 300g+생목살 220g+경상도식 밑반찬",37500,3.7,53,167,
8,서강8경,서울 마포구 토정로 128 8층 (우)04081,양식,표기안함,표기안함,3.1,20,57,"맛있고 분위기도 좋아요./1. 직원분들 친절함 2. 뷰 맛집 3. 가격이 디귿디귿 덜덜/메인 안심 스테이크도 그렇고 식전빵부터 그냥 맛있어요ㅎㅎ 서버 분들도 친절하시고 뷰는 당연히 좋았구요, 다음에 또 기회되면 가려구요 :)/뷰 말고는 갈 이유가 없는 곳이었습니다.. 다신 안 갈 것 같아요ㅜ/신선한 회와 멋진 풍경, 친절함 모두 매우 우수 가족이나 연인에게 소중한 시간과 공간이 되기에 충분 !/야경좋음 맛 좋음 양 적음 셰프및 직원들 팁 줘야하는지 부담스러움ᆢ눈치보임ᆢ 팁 없다고 하면 더 잘 될듯~/평때문에 걱정했지만 프라이빗하고 생각보다 퀄리티 괜찮았음 . 5시에가서 인생사진 많이 건짐/확실한 장점은 여의도 뷰와 조용하고 꽤 넓직한 룸으로, 업무 관계로 와도 좋을 것 같습니다. 서비스와 맛은 코스 요리가 이 구성에 이 정도 나오는구나 하고 첫 입문하시는 분들 튜토리얼 깨기에 적당할 듯합니다./뷰만 좋음 맛, 서비스, 가격 (맛에비해 가격 터무니없음) 주차 발렛해주셔서 편함/여기 주차관리하는 삐적마른 분 어리다고 반말하고 정말 불친절 합니다. 다시는 서강8경 안가요. 퉛~/특별한 날 예약해서 탑쓰레기 음식 먹고옴. 뷰만 보고 음식은 신경 안 쓴다면 가도 됨. 생애 처음으로 음식 컴플레인 걸고 새로 해달라고 했는데 새로 나온것도 씹다 버리고 옴./여의도 방향 야경, 위치 좋은 레스토랑, 와인과 스테이크/야경에 비해 음식은 좀.../여의도 방향 야경, 위치 좋은 레스토랑, 와인과 스테이크/야경에 비해 음식은 좀.../여의도 방향 야경, 위치 좋은 레스토랑, 와인과 스테이크/야경에 비해 음식은 좀.../여의도 방향 야경, 위치 좋은 레스토랑, 와인과 스테이크/야경에 비해 음식은 좀.../여의도 방향 야경, 위치 좋은 레스토랑, 와인과 스테이크/야경에 비해 음식은 좀.../여의도 방향 야경, 위치 좋은 레스토랑, 와인과 스테이크/야경에 비해 음식은 좀.../여의도 방향 야경, 위치 좋은 레스토랑, 와인과 스테이크/야경에 비해 음식은 좀.../여의도 방향 야경, 위치 좋은 레스토랑, 와인과 스테이크/야경에 비해 음식은 좀.../여의도 방향 야경, 위치 좋은 레스토랑, 와인과 스테이크/야경에 비해 음식은 좀.../여의도 방향 야경, 위치 좋은 레스토랑, 와인과 스테이크/야경에 비해 음식은 좀..."
