,name,address,sort,menu,mean_price,score,people_give_score,review_count,review_list
0,만강,서울 강남구 밤고개로21길 81 1~3층 (우)06370,한정식,"민어회,민어찜 (중),덕자 (회+조림) (1인),장어구이 (1인),흑산홍어 (소)",56000,2.5,15,11,"댓글 악평치고는 음식들이 맛있어서 놀랐습니다.생각보다 음식들이 고급지고 퀄리티있음 매장 분위기나 가게주변 멋진공원이나 대접하기에 딱 적당한 약속장소인것같았습니다./뷰와 인테리어 직원분들의 친절도는 5점 가격대비 음식의 맛은 1점도 아까움  점심에 가장 싼 메뉴 먹고 사진찍고 테라스에서 쉬다가면 좋은장소/음식과 음식 나오는 텀이 너어어어어무 김. 개인적인 느낌이 아니라 지금 여기 있는 다른 팀도 다 불만하고 싸우는 중... 조림 시키고 30분 후에 드릴게요 함. 그러고서 또 20분이 지남. 결국 시키고 50분만에 나옴. /보리굴비 정식 먹고 테라스에서 야경보며 커피 한잔. 너무 좋았습니다!/비싸기만 함/내돈내고 가긴 힘든집. 민어곰탕 국물은 드셔볼만./식당 밖에 강아지가 저희 애 죽이려고 덤벼드네요 강아지 말리지도 않고 다시 가더라도 강아지부터 죽일거임 망해라/여기 나름 단골이었는데 평들이 다 왜 이런지.. 백반집과 비교하는 건 좀 넌센스 같음. 일단 룸이 넓고 쾌적하고 통창으로 주변 율현공원 뷰가 매우 괜찮음. 백반집에 이런 뷰가 가당키나 한지.. 가격 대비 창렬인 메뉴도 있긴 한데(갈낙탕 민어탕 비추) 장어가 가성비 가장 좋은 듯. 장어를 비교적 저렴한 가격에 분위기 좋은 곳에서 깔끔하고 조용하게 고급지게 즐...더보기/거두절미하고 정말 비추입니다. 어버이날이라 부모님 모시고 갔는데 진짜 무슨 관광지도 아니고 서울에서 이렇게 바가지쓴 느낌은 처음입니다. 돈은 돈대로 쓰고 민망했어요. 반찬은 부실하고... 지금 다시 찾아보니 블로그 후기에 있는 반찬이 다 나오지도 않았고 그냥 동네 백반집도 이거보단 낫겠다 싶네요. 게다가 직원들은 엄청 불친절합니다. 공기밥이 정말 세숫갈? ...더보기/계절메뉴가 좋았습니다 /보리굴비정식, 민어지리탕,  먹갈치, 남도계절밥상이라면서 흔한 봄나물 무침 하나 없는 계절밥상이 무색한  갈치젓갈이라고 접시에 겨우  1t스푼도 안되는,  동네 백반집 반찬이 훨씬 나아요. 열무김치, 깻잎절임, 부추무침, 풀치조림에 파김치 저민 마늘 3쪽 저민 고추3 , 그게 다예요.  돈 아까워 비추입니다./덕자 회,찜 가격은 완전 비싼데(5만원) 나오는 거 보면 기가차서 말이 안나옴. 완전 바가지썼다는 느낌../다 맛있어요  ! !! 친절하고 깨끗하고 분당본점도 가보고 싶어요 마지막에 나온 녹나무차도 굿굿/맛도 비쥬얼도 생소한 덕자회를 처음 접했던 식당. 위치가 생뚱맞긴 하지만 고급진 인테리어의 남도 계절음식 전문점/보리굴비정식, 민어지리탕,  먹갈치, 남도계절밥상이라면서 흔한 봄나물 무침 하나 없는 계절밥상이 무색한  갈치젓갈이라고 접시에 겨우  1t스푼도 안되는,  동네 백반집 반찬이 훨씬 나아요. 열무김치, 깻잎절임, 부추무침, 풀치조림에 파김치 저민 마늘 3쪽 저민 고추3 , 그게 다예요.  돈 아까워 비추입니다./덕자 회,찜 가격은 완전 비싼데(5만원) 나오는 거 보면 기가차서 말이 안나옴. 완전 바가지썼다는 느낌../다 맛있어요  ! !! 친절하고 깨끗하고 분당본점도 가보고 싶어요 마지막에 나온 녹나무차도 굿굿/맛도 비쥬얼도 생소한 덕자회를 처음 접했던 식당. 위치가 생뚱맞긴 하지만 고급진 인테리어의 남도 계절음식 전문점/보리굴비정식, 민어지리탕,  먹갈치, 남도계절밥상이라면서 흔한 봄나물 무침 하나 없는 계절밥상이 무색한  갈치젓갈이라고 접시에 겨우  1t스푼도 안되는,  동네 백반집 반찬이 훨씬 나아요. 열무김치, 깻잎절임, 부추무침, 풀치조림에 파김치 저민 마늘 3쪽 저민 고추3 , 그게 다예요.  돈 아까워 비추입니다./덕자 회,찜 가격은 완전 비싼데(5만원) 나오는 거 보면 기가차서 말이 안나옴. 완전 바가지썼다는 느낌../다 맛있어요  ! !! 친절하고 깨끗하고 분당본점도 가보고 싶어요 마지막에 나온 녹나무차도 굿굿/맛도 비쥬얼도 생소한 덕자회를 처음 접했던 식당. 위치가 생뚱맞긴 하지만 고급진 인테리어의 남도 계절음식 전문점/보리굴비정식, 민어지리탕,  먹갈치, 남도계절밥상이라면서 흔한 봄나물 무침 하나 없는 계절밥상이 무색한  갈치젓갈이라고 접시에 겨우  1t스푼도 안되는,  동네 백반집 반찬이 훨씬 나아요. 열무김치, 깻잎절임, 부추무침, 풀치조림에 파김치 저민 마늘 3쪽 저민 고추3 , 그게 다예요.  돈 아까워 비추입니다./덕자 회,찜 가격은 완전 비싼데(5만원) 나오는 거 보면 기가차서 말이 안나옴. 완전 바가지썼다는 느낌../다 맛있어요  ! !! 친절하고 깨끗하고 분당본점도 가보고 싶어요 마지막에 나온 녹나무차도 굿굿/맛도 비쥬얼도 생소한 덕자회를 처음 접했던 식당. 위치가 생뚱맞긴 하지만 고급진 인테리어의 남도 계절음식 전문점/보리굴비정식, 민어지리탕,  먹갈치, 남도계절밥상이라면서 흔한 봄나물 무침 하나 없는 계절밥상이 무색한  갈치젓갈이라고 접시에 겨우  1t스푼도 안되는,  동네 백반집 반찬이 훨씬 나아요. 열무김치, 깻잎절임, 부추무침, 풀치조림에 파김치 저민 마늘 3쪽 저민 고추3 , 그게 다예요.  돈 아까워 비추입니다./덕자 회,찜 가격은 완전 비싼데(5만원) 나오는 거 보면 기가차서 말이 안나옴. 완전 바가지썼다는 느낌../다 맛있어요  ! !! 친절하고 깨끗하고 분당본점도 가보고 싶어요 마지막에 나온 녹나무차도 굿굿/맛도 비쥬얼도 생소한 덕자회를 처음 접했던 식당. 위치가 생뚱맞긴 하지만 고급진 인테리어의 남도 계절음식 전문점"
1,피자리움,서울 강남구 밤고개로23길 20 (우)06378,피자,"갈릭비프,페퍼로니,양송이피자,알리오올리오,까르보나라",9100,4.2,25,69,카카오맵에 영업시간 업데이트 좀 잘 해주세요 ㅠ/방송보고 갔는데 추운날 가게에 온기라곤 없고 포스 만지던 손으로 장갑도 안끼고 슬라이스 토마토를 피자위에 얹는거 보고 완전 짜증났어요. 시그니처 피자란 것도 술빵 위에 치즈 올려서 오븐에 살짝 돌린 맛. 생활에 달인  못믿겠어요./찾아갈정도는 아니고 그냥 평범합니다 솔직하게요/밑에 글 다받아여...꼬르륵꼬르륵.../Pizza/루꼴라렌치는 꼭 드셔보세요.. 이태원 있을 때부터 너무 좋아햤는데 이사갔길래 처음 동네구경도 하고 너무 맛있게 먹었어요 ㅠㅠ 오래오래 팔아주세요/가본 피자집중 최고/와 진짜짱임 내일도 가야지 와 최고임 와..../맛있어요! 파스타 양도 많은 편이고 피자에 쓰인 빵이 첨엔 몰랐는데 며칠 지나도 계속 생각나는~~/별 5점도 모자람. 비슷한 피자맛을 먹어본적이 없어요 쫀득폭신한 식감에 담백고소달달 혼자 다 합니다. 맛있게 잘 먹었습니다.  /파스타는 전문점 가격임에도 유화가 전혀 안 되어있고 튀겨진 듯한 면이 나와 경악했어요. 추천하지 않습니다. 피자는 평범해요./개인적으로 이태원 있었을때가 더 맛있었던것 같아요~/맛있어요☺️/파스타도 맛나욤 /넘 맛잇어여 사장님도 친절하시고 가격도 저렴하고 짱짱 루꼴라피자 짱/최고예요/루꼴라랜치는 오롯이 혼자 즐기고 싶은 맛. 가지피자도 추천. 파스타는 아쉽/어머니가 회사에서 직원이 사다줬다고 가져오셨는데 정말 맛있었어요. 집에서 가까웠다면 자주 갔을 텐데 아쉽네요. /여기 진짜 피자 인생 맛집인데.. 이태원에서 너무 멀리 이사가셔서 너무 슬퍼요 ㅜㅜ 서쪽에도 분점 내주세요/갈릭비프랑 쉬림프로제파스타 먹었어요 루꼴라를 좋아하지않아서 갈릭비프 시켰는데 무난한 맛이여서 다음에 가면 다른 메뉴로 먹어보고싶어요. 로제파스타는 맛있었어요♥/여기는 그냥 피자 맛집인지 알았는데....  헐...  파스타 정말 맛있어요.../이태원서 없어졌을때 개슬퍼했는데 얼마전에 그리워하며 초록창서 혹시나하고 검색했는데 최근 갔다오신 분의 후기글이 뙇!!! 총알 장전하고 달려옴 이집 피자 밑힌뤔임 소화도 잘되서 나이 드신 분들도 좋아라하심 개마시쓰뮤ㅜㅠㅜ/가정집 분위기도 좋고 피자맛도 정말 좋아요./율현동에서 가장 분위기 좋은 가게입니다./여기는 그냥 피자 맛집인지 알았는데....  헐...  파스타 정말 맛있어요.../이태원서 없어졌을때 개슬퍼했는데 얼마전에 그리워하며 초록창서 혹시나하고 검색했는데 최근 갔다오신 분의 후기글이 뙇!!! 총알 장전하고 달려옴 이집 피자 밑힌뤔임 소화도 잘되서 나이 드신 분들도 좋아라하심 개마시쓰뮤ㅜㅠㅜ/가정집 분위기도 좋고 피자맛도 정말 좋아요./율현동에서 가장 분위기 좋은 가게입니다./여기는 그냥 피자 맛집인지 알았는데....  헐...  파스타 정말 맛있어요.../이태원서 없어졌을때 개슬퍼했는데 얼마전에 그리워하며 초록창서 혹시나하고 검색했는데 최근 갔다오신 분의 후기글이 뙇!!! 총알 장전하고 달려옴 이집 피자 밑힌뤔임 소화도 잘되서 나이 드신 분들도 좋아라하심 개마시쓰뮤ㅜㅠㅜ/가정집 분위기도 좋고 피자맛도 정말 좋아요./율현동에서 가장 분위기 좋은 가게입니다.
2,단미그린비,서울 강남구 밤고개로14길 13-50 (우)06364,한정식,"현보정찬 (1인분),귀연정찬 (1인분),자연정찬 (1인분),미소정찬 (1인분),해연정찬 (1인분)",52400,3.4,13,20,"교수마을 한정식/4만원 짜리가 음식이 다 식어서 나온다. 이럴려면 왜 음식을 코스로 주나. 그냥 한번에 나와라. 먹을 것도 없고 가성비 이렇게 떨어지는 집은 첨 본다./서비스가 좋지 않고, 소음도 심해요. 중요한 모임 자리라면 추천하지 않습니다./룸있고 어른들모시고 가볍게 가기좋아요~  /수서역 상견례 맛집으로 추천받아 저희도 여기서 했어요. 미리 세팅되어 코스로 차분히 나왔고, 음식도 깔끔하여 만족스러웠으나,,,,후식이 나오고 저희가 얘기를 주고 받는데 상을 치우시느라 시끄럽고ㅁ 제앞을 가로막으시고! 마무리에 기분이 상했네요ㅠㅠ/한정식 코스가 아주 야무짐!  여기, 아주 오래된 아는사람은 다아는 동네맛집임ㅋ 진짜 푸짐하게 꽉꽉채워 먹고올수 있는 집. 개인적으론 점심특선말고 갈비찜 나오는 3만대 메뉴가 좋아서 주로 먹음. 굽이굽이 산 속에 있어서 찾아가기는 좀 어렵지만, 가서보면 강남에 이런곳이있나싶게 초록초록함./깔끔. 음식 굿. 가성비도 좋은 듯. 주변 조용하고 좋아. 수서역 걸어서 15분/가족모임 등 조금 중요도가 있는 자리일 때 방문하는 곳인데 음식은 만족하는데 응대가 아쉬워요. 종업원분들이 산만하고 대화하는데 자꾸 차번호 물어보러 와서 대화가 자주 끊기고 룸으로 잡았는데도 주방소리가 다들려서 시끄러웠던게 별로였네요/수서역과 가까운듯 하나 걷기엔 애매한 거리이다 언덕길이라 차로 가야 편하다  친절하고 정갈한 음식이 나와서 좋으나 옆방 소리가 그대로 다 들리고 맛있다고 할만한 특색 있는 음식이 없다"
3,더374,서울 강남구 헌릉로571길 46-5 (우)06376,이탈리안,"데리야끼 치킨 샐러드,모짜 파스타,감베로니 파스타,봉골레,해물토마토 리조토",18840,4.5,17,12,"맛있다. 또 가야지. 사장님도 친절하심. 환기가 잘되면 좋겠다./후원하신다는 얘기 듣고 피자 사러 가려구요 /너무 좋아하는 곳이에요/맛있음 !!/전반적으로 괜찮은데 피자는 가격대비... 또띠아 쓰시더라구요 /양 많구 부모님 어르신들이 죠아하세여ㅎㅎ/남자 여자 갔을때 피자1 파스타1이면 배부르네영 잘먹었습니다/조오오금 비싸지만 맛있어요 ~ /사장님도 친절하시고 음식 맛도 세곡동의 숨은 맛집ㅋ지인들 데리고가면 모두들 만족하시더라구요~~/아. 여기는 다시와야 겟다 너무 배부르다 팁)콜키지 1만원/저는 여기 요 파스타 너무 맛있어서 가끔 방문해요 ~!  회사가 양재에 있어서 거리는 조금 있지만 기끔씩 가기 좋은거같아요 ^___^/1. 음식점 등록상 알콜음료 판매 안함. 단 가져가면 먹을 수 있고 콜키지 값 1만5천원... 판매 안하는거까지 뭐라 할 수는 없으나 안팔거면 콜키지 값을 저렴하게 받던가 싶음.  2. 1개 안티파스토, 3개 세콘도 주문하면서 안티파스토 먼저, 세콘도 한번에 달라고 주문했음에도 불구하고 안티파스토 먹는 도중 세콘도 음식 나옴. 한번에 준 것도 아니고 2개주...더보기/Delicious pasta dishes and glorious salads - friendly staff. BYO though, so bring a bottle as minor corkage charge."
4,두레브,서울 강남구 헌릉로569길 23 1층 (우)06376,커피전문점,표기안함,표기안함,3.9,19,5,
5,추오정 남원추어탕,서울 강남구 밤고개로14길 13 (우)06364,추어,"추오정정식 (2인이상),추어탕,통추어탕,미꾸리튀김,돈가스,전복추어탕",11500,4.7,16,15,"추어튀김이 땡겨서 검색하다 후기 봤더니 좋아보여 역에서 거리가 좀 있고 차끌고 오지 않은 날이지만 찾아갔었음. 아. 최고로 맛있음. 추어튀김 뿐만 아니라 추어탕도 정말 좋고 추어탕이니 속도 편하고. 일석이조./교수마을 추어탕정식 만사천원!!!!강추/맛있어요/이거 먹고 추어탕 최애음식 됬읍니다... 그 옛날 시장에서 파는 산초맛 찡한 추어탕 아니에요 존맛탱구리!/추어탕 별로 안좋아하는데 여긴맛집/깔끔하고 맛있어요/주차도 무료고 사장님이나 직원분들도 친절하다. 맛도 갠찮고 추어탕 먹을때마다 다른 테이블 돈가스가 맛있어보여서 먹어봤지만...추어탕만 먹어야겠다는 다짐을 함/가끔 가는 추오정 믿고 가는 집인만큼 맛, 서비스가 나쁘지 않다. 국물을 조금더 꽉차게 주면 좋겠다./한 번 먹으면 속도 든든하고 힘이 나는 거 같아요 :) 가족들 모두 좋아하는 맛집 추천입니다/올때마다 맛있네요. /더운 날 한번씩 먹을만 하다"
6,논현삼계탕,서울 강남구 밤고개로14길 6 (우)06364,삼계탕,"삼계탕,산삼배양근,옻계탕,전복삼계탕,인삼튀김 (소)",19400,4.7,7,69,"재료 신선하고 살이 부드럽고 국물이 깔끔하게 맛있어요. 안심탕수육도 별미~!/사진으로 설명하겠읍니다. + 찹쌀밥 추가했는데 살짝 쉰내가 난거 빼곤 괜찮/대모산 다녀와서 먹으면 아주 그만./아주좋음. 위치도 버스정류소에서 가깝고 , 식당분들도 친절함. 삼계탕도 아주 맛남. /위생철저 업소 친절봉사  신선한 식재료 신뢰성 창밖의 전원 감상 탁월한뷰 주차장 걱정 끝 "
7,교수마을 초원복집,"서울 강남구 밤고개로14길 13-48 2,3층 (우)06364",복어,"금밀복국,참복국,참복죽,전복죽,참복전골(1인)",20200,4.5,16,11,"아주 맛있어요 10번 추천 이렇게 복어순살 많이 들어간 곳 첨봐요/굿/복어는 이제 이 집이다/회/해산물/매운탕/복어 등 바다에서 나오는 생물을 1년에 300일 먹는 사람으로서.. 복어집 제가 다녀본 것 중에 1TOP 이네요.. B코스 먹었는데 복불고기와 복지리는 레알 지리네요.. 이미 맛집이었는지는 모르지만 진짜.. 환상적입니다.. 둘이왔다가 연말 모임 예약하고 나갑니다.. 지금처럼 정갈하고 친절하게 해주시기를 잘먹고 갑니다 !!/공간은 좋으나 초장은 짜고 국물빼면 먹을거없음/알찬 구성과 시원한 맛/가격 대비 정말 푸짐하고 재료도 신선하고 맛있습니다! 사장님도 정말 친절하시고 일회용 장갑 끼고 서빙하시고 깔끔합니다/가격대비 양도 많고 맛도 좋았다/부모님과 같이가서 B코스 먹었는데 정말 잘 먹었습니디~/전부 다 대존맛! 가성비 최고 기대 안한 복 불고기가 정말 좋았음. 브레이크타임에 식사하였지만 친절함, 흠없는 요리 제공 받아 좋았음/종업원들과 사장님 다 친절하시고 룸 분위기 너무 좋네요 맛도 좋습니다~/맛에 대한 감각을 자부하시는 손님 두분을 모시고 갔는데 복B코스를 선택했습니다. 이 가격에 이런 맛 내기 어렵다며 좋은 곳을 추천해 줘 고맙다고 하셨네요/맛 좋습니다. 4만원짜리 개안습니다."
8,플랩잭팬트리 수서점,서울 강남구 밤고개로27길 20 강남한신휴플러스8단지 상가 1층 102호 (우)06378,양식,"스프링샐러드,플랩잭샌드위치,오리지날버거,바베큐 폭립,플랩잭",13220,3.4,13,28,"직원분들도 친절하신것 같고 가게 내부도 깔끔합니다. 음식도 맛있고 나쁘진 않아요. 수서역 주변에 들릴일 있으시면 한번쯤 와 보실만 할듯해요!/가격대가 있지만 갈만해요  ★추가 피해자를 막기 위해 없어져야함 ★★내돈주곤 다시 안감 ★★★누가 사주면 감 맛/특징이 생각 안나는 무색무취 ★★★★재방문 의사 있음 ★★★★★맛/특징이 기억 나고 자신있게 추천 가능/가격은 싸고 양은 많은데 팬케이크 집이 팬케이크가 맛이 없음.. 음식이 반이상 남아도 남은거 포장도 안된다 하고, 직원은 다 알바인지 불친절. 화장실은 불도 제대로 안켜지고 곰팡이 슬어 있음.. 콘센트는 전기 쓸까봐 다 테이프라 막아 놓은건 덤../메뉴가 전체적으로 다 평타이상은 함/오늘의버거 잭플립브런치 굳/브런치 이만한 곳이 없어요. 양도 많고 가격도 괜춘하고/가격대가 좀 있지만 너무 맛있어요/조아요/브런치가 아주좋습니다 이근처에 이만한데가 없어요/판교점이 하도 유명하길레 가보고 싶었는데 가까운 곳에 생긴거 알고 가봄. 하지만 프랜차이즈에 기대가 한 내가 바보였음 그래도 커피는나쁘지 않았음 "
