,name,address,sort,menu,mean_price,score,people_give_score,review_count,review_list
0,만족오향족발 시청본점,서울 중구 서소문로 134-7 (우)04514,만족오향족발,표기안함,표기안함,3.7,139,329,"첨 갔을때 웨이팅 좀 있어서 기다려야했는데 그래도 나중에 가니까 바로 들어갈 수 있더라구요. 족발이 따뜻할때 먹으니까 비계 부분들이 좀 많이 물컹한 스타일이긴한데 껍데기에 스며들어있는 그 맛이 넘 맛있어요 /맛있어요./오향장육 같은 풍미가 있는 특이한 족발. 양배추를 마늘 소스에 담가두고 족발과 함께 먹으면 질리지가 않는 맛을 즐길 수 있다. 여담으로 10년 전쯤에는 낮에 만두를 팔다가 오후 4시?5시? 쯤부터 족발을 팔았던 것 같은데 지금은 족발 위주로 운영 하고 있다. 족발을 시키면 만둣국이 서비스로 나오는게 그 흔적으로 남은 듯. //  카카오맵 맛집 추천 지도 -...더보기/포장해서 먹어도 맛있어요/족발 포장해서 먹어도 맛있어요~ 포장은 조금 할인되요/너무 불친절해요.  주먹밥은 별로예요. 공기밥 주문했는데, 양이 많은듯해서 바로 취소해 달라니까, 코로나라 취소 안된데요.  뚜껑없이 나온 공기밥 어찌해야하는지.   코로나인데 공기밥 뚜껑 덮어 나왔어야 되는것 아닌가요?   그래서 그냥 먹어보자했는데,  오래된 냄새나는 딱딱한 밥이었어요. 리뷰보고 맛있다해서, 일부러 엄마모시고 간거였는데, 아주 믾이 실망...더보기/오향족발 좋아하는데 시청본점은 처음 와봐요  오후3시 입장 맛은 항상 먹던맛 그대로인데  고기가 차가워요 식어서 나왔어요  여태 식은걸 먹은적이 없는데 이걸 본점에서 먹다니 날씨도 추워 따뜻한 국물에 족발땡겨서 왔는데  찬거 먹다가 현타왔네요 2.5점 주고싶음/내가 먹어본 족발 중에 식감은 최고. 진짜 쫀득하다. 솔직히 처음 먹었을 때 신세계였다..하지만 너무 달아서 두 번은 안 가게 된../종업원들이 너무나 불친절 합니다  ^~ 친구들한테 민망했습니다/도대체 뭘 넣길래 이리 맛난지.. 몇년째 족발집은 여기만 감. 딴데 가고 싶어도 맛없게 느껴져서 못 감. 야들야들 식어도 부드러움. 퍽퍽함 제로. 불족도 과하게 맵지 않으면서 맛남/종업원 4가지 너무 없음..  절대 가지 마세요..  솔직히 0점 주고 싶네요  자리 바꿀 수 있냐고 물어봤더니  자기들은 맛집이라 자리 없으니 다른데 가던가요  라 하심/가끔 땡기는맛 /보쌈 존 맛/첫족발이 이족발이어서 다른 족발 먹기가 힘듭니다… 돌겠다 미치겠다는 아닌데, 이처러 잡내 없이 너무 자극적이지 않은 ‘적당한’ 족발찾기가 힘듭미다../맛있어요 대자주문했는데 양적습니다 막국수랑 만두국맛있어요 직원분 외국인이셨는데 한국말 너무 못하셔서 의사소통하는데 불편했어요/동거가족 증명서류도 가져왔는데 안된다고 안들여보내주심 카운터 보는 분이 방역수칙을 잘 모르시는듯/쫀득쫀득 /족발과 막국수가 땡길 때 처음 떠오르는 곳./존맛.. 술이 쭉쭉 들어감  막국수는 맵찔이에게 좀 매운편ㅠ/변했다../완전 시장 바닥. 낮술에  취한 인간들 버글버글한데 차단 유리막도 제대로 안하고 말도 안되는 비닐천.,.낮1시 30분에 갔는데 늙은 아저씨들 판 벌이고 고래고래 소리지르고 여자들도  고함. 포장을 하려다가  앉았더니  후회막급.미쳤지..얼른 포장 요청했고  두번 다시 좌석에 앉진 않을 거다. 직원 아줌마들도 손님 몇 테이블 안되는데 인상 쓰고..진짜 너무 ...더보기/3.5 탱글탱글 맛있으나 쉽게 물리는 맛 만둣국이 끌렸다/여기 카운터 보는 아줌마 사장인지 아닌지 모르겟지만 인성 개빻앗음 걍 먹기시르면 나가라는 마인드/개존맛탱. 지도 보고 매장 찾기가 좀 많이 힘듦. /음.. 유명해도 될정도/지금까지 먹어본 족발 중에서 단연 최고!!! 추천메뉴 : 만족오향족발, 쟁반국수 회사 직원들과 한번 가봤는데 마눌님 데리고 또 갈예정임ㅎㅎ 마눌님 족발 안좋아하는데 여기서 먹어보면 좋아하게 될듯ㅎㅎ/사이드메뉴, 청결, 맛 대박.  댑악. /처음에 달달한 맛이 나다가 뒤이어 정향 팔각같은 한약재의 향이  강하게 느껴졌어요 마늘소스 양배추샐러드와 같이 먹으면 새콤달콤함이 더해지고  오향은 조금 감춰져서 오향을 좋아하지 않는 사람도  맛있게 먹을수 있을것 같아요 고기와 껍질은 굉장히 부드러웠습니다/너무 맛있다고 소문나서 확인하러 마눌님 모시고 방문.... 울 마눌:뭐징? 머징? 왜징? ... 먹다가 포기...  난 그냥 먹을만 한데, 암튼 가**** 족* 과 비교불가.  ㅎㅎ...솔직한 심정./껍질 쫀득쫀득하고 안느끼해요! 불족발은 꽤 매워요.. 쟁반국수도 새콤하게 맛있구 2명이서 가도 셋트메뉴 구성이 좋아서 고민 덜해도 되요 ㅎㅎ /두번 안먹을맛 동네 맛집이 더 맛있엇고 너무 시끄러움  /족발맛은 무난하다 시설은 규모에 비해 뭔가 싶었다 화장실 가보고 놀람/짱맛입니다 사람많아서 대기도 길어요/난 여기까지만.. 만두국도 좋치만 더 탱글한 족발이 좋음 이런스타일은 성수족발로 족해"
1,롯데호텔서울 라세느,서울 중구 을지로 30 롯데호텔서울 본관 1층 (우)04533,뷔페,"CONTINENTAL BREAKFAST,AMERICAN BREAKFAST,FROM THE GRIDDLE,EGG DISHES,CEREAL,KOREAN BREAKFAST",29500,4.0,85,359,"양갈비맛집 ㅎㅎ 일식이 약하다는 평이 있는데 회랑 초밥 맛난 것들만 골라놔서 잘 먹었습니다/악의적 내용  아니고.. 내가 분명히 딸기뷔페  하냐고 물어보고 갔는데  ..  그냥 뷔페였음..   난 69000원 내려다 150000윈 냄.   맛이라도 좋으면 이해하겠는데..  밤늦게 간 것도 있겠지만  만족스럽지 않았음.  그냥 빕스 몇번 가고 말지..   빕스 프리미어 3시 가서  대기하기 짜증나 기껏 갔더니만 뒤통수 제대로 맞았네...  다시는 ...더보기/일식코너에 힘을 많이 준 느낌이고 해산물이 다양하게 제공된다. 즉석에서 구워주는 (조그마한)랍스터와 (조그마한)양갈비 토마호크 스테이크에 가장 좋은 평가를 줄 수 있다.  재료의 질은 그다지 좋다는 느낌이 없지만 뷔페 치고는 음식의 질과 종류가 전반적으로 괜찮다. 별점은 이곳이 뷔페인 만큼 전문식당에 비할 바는 아니기에 이를 고려했다.  참고로 탄산수와 커...더보기/양갈비 맛집.. 서비스나 전체적인 구성으로 봤을때 메리엇 플레이버즈가 약간 더 나은듯/한 번쯤은 가볼만함/엄청 맛있게 잘 먹었습니다 양고기가 일단 너무 맛있었습니다 무조건 양고기는 드시길.! 제가 갔을 땐 도미회가 탱글하고 너무 맛있었어요 딤섬도 맛있고 브루스케터 빵도 너무 맛있더라구요 그리고 유명한 딸기케이크! 이건 너무 맛있어서 두번이나 먹었네요 크림도 부드럽고 딸기자체가 맛있어서 나중엔 사먹어보려구요 /괜찮은 가격과 맛있는음식 가족끼리 이용하기 좋아요!/가격대비 너무 저렴한 식자재 사용./맛있어요 부모님이 물김치 맛집이라고 극찬하시네요/음식이 신선하고 맛있었습니다. 특히 중식 메뉴들이 전반적으로 괜찮았네요./가족 단위로 방문해도 좋은 곳입니다./가족모임 하기도 좋아요. 최고의 뷔페./베리 굿. 추천합니다./가격 만큼 정말 종류가 다양하고 산해진미가 다 모여있습니다. 솔직히 가격 비싸기는 한데 한번 정도는 가볼만해요/조식 이용했는데 가지수는 많지 않지만 먹을만한건 다 있음. 과일과 빵 종류는 다 맛있었고 오믈렛도 마시씀! /음식은 여러개인데 맛은 그냥저냥임 디저트는 확실히 꽝/양갈비가 너무 맛있네요 최고 근데 주차장은 복잡해요 ㅠ/맛은 전체적으로 괜찮고 직원분들도 너무 친절하셔서 좋아요. 근데 분위기나 자리들이 호텔스러운 고급짐이 많이 떨어지네요ㅠ/또가고시퍼요/평일 점심 이용함. 가격에 비해 요리 가짓수가 적고, 고기 퀄리티가 좋은지는 모르겠음~  그러나 직원들이 매우 친절하고 서비스가 좋음./맛 굿 서비스 굿 가격 노/우리나라에서 젤 맛있는 뷔페 메뉴다양하고 다 맛있음/진짜 핵존맛인데 여기가 먹을 게 없다고 하는 사람들은 대체 어딜 가야 만족할까..? 처음 가보고 너무 맛있어서 일주일 뒤에 한 번 더 감ㅋㅋㅋㅋㅋ 디저트까지 가짓수가 너무 많아서 세번은 가야 거기 있는 메뉴 다 먹어볼듯.. 메뉴가 많다고 퀄리티가 떨어지는 것도 아님. 하나하나 다 맛있었음. 매니저인지 지배인인지 직급은 모르겠지만 갈 때마다 홀에 계시는 나이...더보기/지난 해 11월에 친구들과의 곗돈이 너무 쌓였는데, 신라 하얏트 반얀트리 Jw 등 뭐 예약이 반년 씩 밀렸대서, 결국 예약 가능한 이곳으로 갔는데. 예약 텅 빈 이유가 있더라... ㅋㅋㅋ 호텔뷔페 수준 아니고 애슐리인데? 애슐리보다 맛난 메뉴 적은데? 허허허허허 그냥 친구들 오랜만에 만난 걸로 즐거웠고 코로나 시국에 우릴 잠시나마 모이게 해준게 고마워서 별...더보기/맛은 굳이 언급할 필요도 없을 정도로 좋고 무엇보다 다 쓴 비닐장갑을 빨리빨리 걷어가 주셔서 좋았습니다 더파크뷰 예약을 실패해서ㅜㅜ 라세느를 선택했는데 먹는 동안은 더파크뷰 생각 하나도 안 났어요 ㅎㅎ/굿!/성수기가 아니어서 손님도 적어서 편안하게 식사 가능했습니다. 개인적으로 직원분들 서비스랑 디저트는 신라호텔 더파크뷰보다 좋았습니다.(음식종류는 신라호텔이 더 많았습니다.) 방어회랑 참치회가 아주 일품이었습니다. 디저트류도 역시 롯데답게 훌륭했습니다. 코로나로 방역에 힘쓰는 모습도 보기 좋았습니다. 다만 음료는 전부 유료여서 그부분이 좀 아쉬웠습니다. /온리 랍스터./어제 저녁때 식사하면서 랍스타가 짜서 한입먹고 더 못먹었어요... 음료수 기계도없고 딸랑펩시콜라 1캔 8000원 이라니.. 정말 어이가없네요.. 그래도 비싼뷔페인데 음료수 기계없다는게 정말 어이가 없었습니다.. /직원분들 완전 친절하세요. 서빙식으로 바뀌어서 너무좋음/랍스타 빼고는 별로"
2,정원레스토랑 어반가든,서울 중구 정동길 12-15 1층 (우)04516,"스테이크,립",표기안함,표기안함,3.6,140,251,"분위기는 어수선하고, 서빙하시는 분들은 알바 느낌에.. 주문하는 벨은 몇 번을 눌러야 주문을 할 수 있는 건지요. 음식은 이 가격이면 얼마든지 다른 곳들에 가서 먹을 수 있습니다. 기대하고 갔는데 많이 아쉬워요. /이베리코 스테이크 너무 맛잇엇습니다 ^^ 분위기가 너무 좋았고 직원들의 친절한 서비스에 한번 더 감동감동입니다 ~~ 별 열개 드리고 싶네요☆☆☆☆☆☆☆☆!!☆ /무슨 예약하고 갔는데도 별관을 안내하고  3명인데도 4명 세팅해놓고 테이블마다 벨이 아니라 한 홀에 벨 하나있고  벨을 여러번 눌러도 직원은 오지도 않고  피클 가져다달란말을 10분간격으로 3번 얘기해도 그걸 하나 안가져다주고 서비스 최악입니다./언제가도 맛있는곳/맛도 최고 직원분들 서비스도 최고! 다음에 또 올게요~/분위도 괜찮앗고 음식도 맛잇게먹엇습니다 특히 뚝배기파스타가 정말맛잇네요 다음에 와도 또먹을꺼같아요/스테이크 너무 맛있었어요 분위기도 너무 좋았고 데이트 하기 딱 좋았습니다:)/지인추천으로 방문하게 되었는데 음식은 물론 분위기까지 너무 좋아요!! 다음에 꼭 다시 또 방문할거에요!!!!/맛있었고 가성비짱/음식도 맛있고 분위기도 좋네요! 다음에 또 오고싶어요~/너무너무 좋았어요 친절하고 음식도 맛있고 분위기도 좋았어요/맛있게 잘 먹고 갑니다/2층에서 식사했는데 정원분위기라 숲속에서 피크닉하는 기분이었네요~음식도 전체적으로 맛있었고 저는 고기파라 스테이크가 특히 맛있었네요^^/뚝배기파스타 존맛탱 다른것도 먹어보러 갈게요/오랜~만에 다시 간 어반가든! 골목을 돌아설 때, 눈에 확 들어오는 느낌이 항상 좋다.다른 나라, 계절의 건물 앞으로 순간!이동한 듯한:-) 음식은 뭐 말해 뭐해! 닭고기 넘~ 부드럽고, 머스타드 잔뜩 올려진 양고기처럼 생긴 이베리코 돼지고기! 음삭에 혹! 해서 사진도 못찍었네ㅋ 상하이 파스타의 매콤함이랑 균형이 그냥~~. 쵝오!  2층 테라스애 처음 앉아...더보기/만족하는곳이에요 > </인테리어가 예뻐서 솔직히 맛은 기대 안했었는데 제가 주문한 메뉴 다 넘 괜찮았어요 ㅎㅎ 부모님 모시고 가족 신년모임으로 갔는데 다들 맛있게 잘 드셔서 넘 뿌듯했어요!/전체적으로 완전 실망.... 89.000원/1인기준 돈 아깝다라는 생각 음식 : 스테이크 질기고.. 랍스터 퐁퐁냄새남 절대 추천 못합니다.../식당 후기는 남겨본 적이 없는데 꼭 남겨야 할 것 같아서 굳이 로그인까지 함 역시 후기를 무시하면 안됨 제 꼴 납니다~  원래 예약하려던 곳이 예약불가여서 좋지않은 다음 후기를 감수하고도 네이버로 예약했는데 예약 명단 관리를 하는건지 안하는건지 남자 매니저가 명단에 없다면서 사람 앞에두고 ‘아이씨’를 연발한다 다른 여자 매니저는 식사 다 하고 나니 더 이상...더보기/최근 먹은것중에 가장 실망스러웠어요. 이베리코목살 딱딱하고 맛없다는 후기에 개선하겠다고 내이버 댓글 단거 봤는데.. 정말 말만.. 여전히 딱딱하고 질기고 맛없어요.. 여전히 날파리 날아다니고. 직원들은 접시턱턱놓고. 접시 바깥쪽부터 놓느라 안쪽에 놓을때 바깥쪽 음식에 유니폼 닿이고..  대학교 근처 싸구려술집가도 이보다는 잘하겠어요… 하긴 매니저님부터가 식...더보기/가족들이랑 오랜만에 외식했는데 맛도 좋고 좋은곳에서 즐거운 시간 보내고 갑니다~~/서비스 불친절.. 맛도 없어요..ㅠ/도심 사이에 이런곳이있었다니 너무 좋아요 정원보면서 식사할수있으니까 멀리 갈필요없네요 맛도 맛있고 김념일에 가도 좋을거같아요 ㅎ/한산한 시간에 방문했더니 여유롭고 좋았어요 인테리어도 이쁘고~ 다음에 모임할때 와도 좋을거 같았습니다 감사합니다~/모임 장소를 찾다가 지인 추천으로 예약해서 방했는데 생각했던것보다 너무 맛있어서 놀랬어요 ㅎㅎㅎ 분위기도 너무 좋아서 모임하는 친구들이 다들 칭찬을 .. 아주 뿌듯했습니다!! 다음에 또 방문할게요! :)/식사시간 지나 예약해서 갔는데  여유롭고 분위기도 너무 좋네요.  어반스테이크랑 명란로제파스타 먹었는데..   스테이크가 잘려서 나오니 먹기편하고 맛있더라고요. 명란오일파스타도 너무 맛있네요.ㅎㅎ 다음에도 또 갈께요~^^/오랜만에 친구들 만나서 정원레스토랑 갔는데 역시나 분위기도 좋고 음식도 깔끔하면서 맛있어요  나중에 여자친구랑 밥먹으러 가면 좋을것같아요/정원레스토랑이라는 이름에 걸맞게 분위기 넘 좋아요.. 종종 들리는 곳인데 항상 잘 먹고 갑니다^^/물 잔에 립스틱 자국 있음. 샐러드 그릇 이 다 빠져있음 심각한 수준으로 이 빠진 그릇 내옴. 예약하고 갔는데 테이블에 물  엄청 흘려서 흥건함.  맛 = 한스델리급 걍 9,900원 파스타 드시는게./직원분들 교육좀 더 시키세요 라고 말하고 싶지만 오히려 매니저란 사람의 대처를 보고 너무 기분이 나빴습니다. 기본적으로 직원들도 무관심하고 서빙도 투박하고 물잔이 비워져 있는지 그릇을 치워야 하는지 관심이 없고 벨을 눌러도 관심이 없어요.  근데 알아서 가져다 주지도 않던 후식 주문한 뒤 좀 투박하게 그릇 치우던 문신한 직원이 내 바로 앞에 있던 물잔을 깼...더보기/인스타보다가 이집이 나오길래 예전에 다녀온 기억을 더듬어 리뷰남김. 기본적으로 손님들 연령대가 있음 50대부터 시작된다고 보여짐. 그 취향에 맞게 기물들도 세련된 것과는 거리가 멀고 좀 몰취향적인 느낌... 유럽풍 느낌을 내려는 싼마이 인테리어 느낌. 맛은 맛있다 와는 거리가 멀고 평범함. 매장이 전반적으로 어수선하고 자리배치들도 어수선함. 재방문의사 제로...더보기/남자친구랑 기념일이라서 커플세트 먹었는데 1) 직원 서비스 불친절 - 창가자리 있길래 그쪽 앉아도 되냐고 했더니 이미 예약되어있다고 안된다고 함. 근데 먹는 내내 그자리 비어있었음..대충 앉히려고 둘러댄 듯 - 물잔 비어도 신경 안써줌 - 그냥 일하기 싫은 느낌이고 쌀쌀맞음. 간신히 접객하는 느낌..^^ 2) 음식 맛 - 수프 너무 달아요 한입먹고 깜짝 놀...더보기/기념일 가기좋은 레스토랑"
3,덕수궁 리에제와플,서울 중구 덕수궁길 5 1층 (우)04515,카페,"와플 유기농 육보 생딸기,시즌한정 프리미엄 프랑스 우유 생크림에 갓 따낸 곽해석 명장의 유기농 육보딸기가 듬뿍!,6,800,와플 벨지움 헤이즐넛 초코,170년 전통 프랑스 카카오바리 다크초콜릿에 퐁당 담궈 꾸덕꾸덕하게 굳혀 볶은 헤이즐넛, 수제 헤이즐넛 스프레드, 캐러멜 라이징한 견과류 토핑을 듬뿍 얹은 인기메뉴,6,500,와플 벨지운 초코,170년 전통 프랑스 카카오바리 다크초코에 퐁당 담궈 굳힌 후벨기에 밀크컬스 초콜릿 토핑이 더해져 고급진 달콤함이 환상적인 와플,5,300",7500,3.5,166,608,"맛있는데 비싼편 줄서먹을정도까진 아니구 맛잇긴해요 ㅎㅎ/초코 벨기에 와플이랑 메이플와플 시켰는데 메이플와플은 따끈해서 겉바속촉 달달하니 맛있는데 초코는 굽고 식힌다음에 초코코팅을 해서 미리 만들어두니깐 그렇게 맛있지는 않아요ㅠ 약간 반죽이 뻑뻑한 느낌? 그냥 기본 와플이 제일 맛있는듯해요!   가격대비 너무 비싸요! 기대 너무 많이 하고 가시지는 말기! /맛있다 까지도 모르겠지만... 대응이라도 친절하면 좋겠다.  먹을 공간이 없는 건 그렇다 치더라도  가격은 무슨 다른 곳 반정도 되는 사이즈가 거의 6천원이다./그냥저냥.. 줄 서서 먹을 수준 아님.../나만 맛없나??/생딸기 와플. 포장해서 먹을 만큼 맛있다. 맛있어야 할 가격이긴 하지만.. 산책하면서 먹기엔 메이플시럽만 뿌린 걸로도 충분할 것 같다./아주 오랜만에 갔는데 맛이 없어져서 놀랐어요/맛나용 ㅜㅜ 설탕덩어리 있어서 완죤 바삭하고 달고 쫀득함.. 친구랑 기다리면서 했던 말이 알바생인지 직원인지 모르겠지만 저 분들 완전 프로라고.. 이렇게까지 바쁜데 저 정도로 친절할 수가 있냐고 ㅋㅋㅋ 또 먹고 싶은 맛이에요/다른 와플에 비하면 비싸긴 합니다만, 진짜 겉은 바삭하고 속은 쫀득촉촉해서 맛있어요 ☻ 근처 지나가게 되면 한두번 더 사먹을 것 같네용♥  ★ 아 그리고 비둘기 싫어하시는 분들...가게가 골목 초입이라 비둘기 꽤 있어요 가게 앞쪽에서 먹으니까 비둘기들이 바로 발밑에서 음식 주워먹으려고 정모해서 기절하는 줄 알았어요... 골목 안으로 더 들어가면 벤치 있으니...더보기/이름이 바뀐건 왠지 모르겠지만 맛은 여전히 똑같아요 지나갈 때 마다 습관적으로 사먹어요ㅎㅎ 여러 종류 있지만 대부분 다 맛있는 것 같아요!/맛있다고들 하는데 사실 뭐가 그렇게 특별한진 잘 모르겠어요. 근데 자꾸 손이 가긴 합니다. 이걸 맛있다고 부르기로 한 건가요? 그래서 4점 드립니다. 와플 테이크아웃해서 근처 스타벅스 환구단점에서 음료 주문해서 같이 먹으면 좋습니다. 메이플 와플이랑 블루베리 크림치즈 와플 먹었는데 블루베리 크림치즈를 좀 더 추천할게요.  친절도는 5점 만점에 4점입니다./쏘쏘/인생 최애 와플. 이사가지 말아주세요 제발/내 20대를 쭉 함께했군…!  기분 좋은 날엔 항상 여기 와플을 먹엇쥐/이걸 맛없다고 하면...와플대학로.../헤이즐넛 많고 달고 맛있어요/맛있어요!! 크림치즈 완전 꾸덕꾸덕하구용 근데 생각보다 안 달았던 것 같아요 담에 가면 완전 단 거 먹어보고 시퍼요 이거 먹으려고 덕수궁 갈 필요까진 없는데 덕수궁 갔을 때 하나쯤은 사먹을 맛  （╹◡╹）♡/존맛와플임  토핑 뭘 먹어도 맛있음  다 맛있어서 최애 메뉴가 매일 달라지는중  따뜻할때 먹으면 젤 맛있음 식어도 맛있던뎅  뎁혀 먹어도 맛있음  /댓글 알바가 있나요? 맛없어요. 퍽퍽하고 비싸기만 비싸요. 꼭 드셔보고 싶다면 절대 여러 개 시키지말고 하나만 드세요. 제발/맛있엇어요/시청 온김에 사서 즉석 흡입! 따끈하고 바삭하고 부드럽고 달달하고 좋은 느낌 한가득 담긴 와플 덕수궁 근처 올때 마다 계속 생각날듯/맛있어요 따끈해요/대기시간이 문제임/하… 와플대학보다 맛없음…;/인생 최고의 와플집/살면서 먹어본 와플 중에 최고였어요!!! /림벅와플의 맛과 명성을 기대하고 방문한 후 실망한 점이 많아 리뷰남깁니다 1. 주문 후 와플이 나올 때까지 30분이 걸립니다 (참고로 앞에 두팀이 있었습니다) 2.30분이나 걸린다는 것은 즉석으로 제조한 와플을 제공한다는 의미일터인데 제공받은 와플은 따뜻하지 않고 딱딱하고 퍽퍽했습니다.  30분이라는 시간과 4000원이라는 비용을 투자하여 먹기에는 낭비입니...더보기/웨이팅이 많은 게 손님이 많아서가 아니고 그냥 오래걸려서 였어요. 어쩐지 결제는 바로바로 하는데 기다리는 사람 한뭉텅이 있더라니. . . 웨이팅 팀은  3 팀인데 30분 기다려서 받았네요 우하하 /메이플와플이 가장 맛있어요 줄은 길지만 금방 줄어듭니다/그닥/식은 와플 줄 거면 왜 기다리라고 하는지...변해버림  배가 고파서 그냥 먹는다/맛이 바꼇네요.  림벅와플일 때가 더 맛있었던 것 같아요./냄새도 좋고 바삭하니 먹을만 했어요 ㅎ근처 가니까 먹을정도?/너무 과대평가되어있네요 맛있는 벨기에 와플 먹어본적 없는 방문객들이 만든 거품ㅎㅎ  "
