,name,address,sort,menu,mean_price,score,people_give_score,review_count,review_list
0,가야성,대구 달서구 월배로83길 7 (우)42739,중화요리,"짬뽕,짜장면,탕수육 (소),볶음밥,짬뽕밥,짬뽕국물",9000,2.9,41,95,"그냥무난해요/여기 무슨 평점 테러 당하고 있나 여기 맛없고 불친절하다는 놈들은 이해가 안가네 여기 수십번째 가는 사람인데 짬뽕 국물이 간헐적으로 한번씩 덜 진하고 이런건 있긴 했었는데 최근에 다시 갔을때는 먹으면서 헛웃음 나올정도로 극강의 국물이더만..탕수육은 항상 변함 없긴함/위생과 직원의 대처가 정말 최악의 식당입니다. 맛은 솔직히 모르겠는데, 메스컴에 나온 타이틀을 달고서 맛집이란 식으로 홍보를 하셨던데, 위생과 직원 응대는 정말 최악의 식당이네요. 머리카락이 끼어 있는 사진을 혹시나 제가 진상으로 몰릴까봐 찍게 되었는데, 그러고 말씀 드리니 사진은 당장 지워달라고 정색하시면서 말씀 하시더라구요. 그러더니 새로 만들어 주냐고...더보기/여기 왜 짬뽕 맛집인 지 모르겠음. . 국물맛도 걍 평범 이하. 오징어는 먹다가 너무 질겨서 못 먹음/짬뽕 맛집/원래 초창기 사장님이 아닌듯함.권리금 받고 넘겨다고들은거 같음요.1번가고 2번가고 싶은마음 없네요.ㅜㅜ/이상하네 짬뽕에 미원맛이 나네  이러면 참 곤란한데.. 몸이 안좋네 젠장  믿고 먹을게 이리 없나.. 20분째 뒷골땡기네  미원 맞네 ㅠㅠ /혼자는 먹으러 가지마세요 사람 많으면 이해가지만 자리텅텅비어도 혼자 왔다고 벽보는 자리 주는데 꼭 벌쓰며 먹는것 같음 ~~ 따져도 불친절함 ~~ 맛이라도 좋으면 참겠다만 맛도 밍밍함 ~~ 옛날맛 안남~~ 단무지도 검정색 묻은게 많고 더러움 ~~  이제 갈일 없다/짬뽕은 밋밋하고 기름이 넘 많은 맛. 얼큰하고 개운한 기본짬뽕과는 반대의 느낌. 짜장면은 헐... 첨 먹어본맛. 재료를 아끼고 아낀맛. 볶음밥은 그냥 기본에다 기름이 코팅된맛. 여긴 대체적으로 기름이 과함. 전용주차장도 따로 없고 주택상가단지속에 있어 어려움. 송현동 주변에 깔끔한 매장의 중국집이 많이 없어서 유명해진건가 의심이 들정도. 이게 백종원씨 프로...더보기/가야성 짬뽕이 맛있다고 소문만 듣고 있다가, 마침 그 동네 갈 일이 있어 먹어 봤습니다.  상상했던 맛이 아니라서 살짝 당황스럽더군요. 좀 자극적이고 칼칼한 국물을 기대했는데, 그다지 강하지 않은 국물이더군요.   물론 이 부분은 호불호가 있겠죠.  저처럼 강한 맛을 원하신다면 마음에 안 들 수도 있을 듯.  그런데 제 입맛에는 다소 밋밋하긴 했지만 나쁘진...더보기/맛은 중상 대구에서 맛집으로 소문나서 돈을 그만큼 벌었으면 고객을 위해 주차공간을 좀 마련해 주던가.. 올 사람은 온다..배짱영업/개인적으로 좋아하는 짬뽕집/괜찮음/정말 맛있네요 달서구 맛집인정!!/다시는 방문할 일도 없고  주변에서 간다면 말리고 싶은 가게입니다.  짬뽕을 먹다 오징어 뼈가 세 차례 씹혀 뱉어냈고 점원분에게 이야기하니 ""아 그거 별 다른거 아니고 나무 같은것도 아니고 그냥 오징어뼈에요"" 만 반복하시던데 누가 이게 뭔지 물어봤나요? 사과가 기본아닌가요?  갈 일 없을 것 같습니다.   맛을 떠나 서비스부터 개선되어야 할 것 같네요/짬뽕이야 그날 그날 볶아 나오는 퀄리티가 살짝 차이가 날수 있긴하지만 저는 갈때마다 기본 이상은 한다고 생각합니다 그리고 이모님들이 너무 친절 합니다/맛있어요/짬뽕 맛이 한결같지 못하네요 먹을때마다 맛이 조금씩 다릅니다 아쉽네요/진짜 불친절함 결제하는데 손가락에 끼워서 카드 주질 않나 (이건 고객이 해도 예의에 어긋난 행동으로 유명한거 아닌지) 밥 먹는데 시간이 걸리는듯하니 눈치 팍팍 주고, 오가며 일행 어깨를 쳤는데도 작은 사과 한마디 없었음 ... ㅎㅎ ^ ^ 맛은 있었는데 그냥 배짱 장사인듯 ... /옛날엔 맛있었는데 요즘엔 맛이 좀 덜해진느낌.. 깊은 맛이 없어진 것 같네여 ㅠ/여기 맛 간지가 언젠데..../짬뽕이 지긴다/불맛짬뽕 양호/맛이 일정하지 않고 오락가락하는 경향이 조금 있음.  난 리안으로 가련다/예전 할배 맛이 아닙니다  직원들 불친절 하구요 기존 오래 계신 종업원들 할매 화장 짙은게 어디 밥맛떨어집니다.  주인과 주바장이 제가 알기론 세번 넘게 바꿨어요  웃긴건 종업원들은 그대로인게 어디 경노당 온 기분   원조 짬뽕  드시고 싶다연 대겸성 가세요   가격도 착하고 단 주차가 힘듬 예전 가야성 맛 입니다  보증 하죠 대경성 검색 고고/국물이 걸죽하지 않고 자극적이지 않아 좋다 짜고 맵고 화끈화끈한건 위장에 안좋아 이집 짬뽕 국물이 진하고 깊다 내하고 궁합이 맞다 야끼우동 참 맛있어보이고 짜장면이 기대된다 꼭 먹어봐야겠다  /일하시는 분들 대부분 친절하신데 어떤 한분 진짜 불친절 해요^^ 자기들 바쁜건 알겠는데 짜장 먹으려고 하는데 짬뽕 강요까지~! 개꿀! 짜증나는건 맛은 있다는 점! 개꿀!/초마 필의 짬뽕...오징어 아주 실하고.. 의외로 볶음밥도  아주  수준급!/바로 아래 평은 안 좋네요. 허나 저는 맛있게 먹었습니다. 국물이 좋더라구요. 탕수육도 맛있는데... 늘 붐비는게 좀  그리고 직원분들도 친절하시더라구요.  두번갔는데 두번 다 동일한 맛, 기다림, 친절이였어요/삼대천왕 나온집이라 해서 한번 먹어봤는데.짱뽕은 그냥저냥 먹을만하고 탕수육은 쓰레기 수준이네요.고기 비계많고 누린내 나고 튀김옷은 기름을 잔득 머금고 있으며 튀김기름 오래 된듯 하네요. 어찌 이런집이 삼대천왕에 나왔는지...삼대천왕도 믿을거 못되네요. 돈 아깝네요."
1,애기똥풀,"대구 달서구 앞산순환로 195 2,3층 (우)42825",한정식,표기안함,표기안함,2.1,22,177,
2,월촌역청춘삼겹살,대구 달서구 송현로 40-1 (우)42824,삼겹살,"삼겹살(140g),목살(140g),양념돼지갈비(180g),벌집껍데기",8250,4.3,12,23,"여기는 그냥 방문하세요! 그리고 육즙 터지는 고기 즐기세요! 최곱니다/목살 존맛에 서비스 및 친절도 좋습니다/서울에서 대구까지 먹으러 갔다 왔습니다. 멀리 서 온 보람이 있을 정도로 너무 맛있었습니다. 다음에도 대구 오면 웨이팅 잡으면서 먹고 싶네요 ㅎㅎ/불친절하시다는 분들은 진짜 얼마나 친절해야하는건가요 ;;  두번째 방문했는데 사장님이 얼굴도 기억해주시고 모든 직원분들 다 친절하게 구워주시고 ,  요청사항 빨리 해결해주세요 ! 고기 별로 안좋아하는데 주마다 갔을 정도로 진짜 맛있었어요 ,,,사장님이 모든 테이블 돌면서 구워주시고 , 개인적으로 제주도에 유명한 ㅅ 성 ㄷ 보다 맛있고 , 느끼함이 덜해요 가...더보기/빅페이스 여기와서 TOP 음층 묵고 간데이~/그냥 그래요 큰기대 마시길/오늘 가볼 예정입니다. 기대점수는 별5개 입니다. 밑에 1개짜리 리뷰는 본인이 상대방에게 실례되는짓 하지 않았나 생각해보기 바랍니다./남자사장 싸가지없음 장사의기본도안된곳/목살 정말 최고입니다.목살이 아니고 스테이크?진심 육즙팡팡입니다. 된장에 공기밥 말아서 아~~후기쓰는데 또 군침도네요.사장님도 얼마나 친절하신지.ㅎㅎ.담에 또 갈께요~~/모두 친절하시고 맛있어요 ㅎ 최고"
3,길선회초밥,대구 달서구 월배로73길 6 (우)42741,회,"점심(보통),점심(특)",11500,4.0,21,43,"저녁 영업하냐고 전화하니 네 합니다 오세요~해서 바로 갓더니 예약 꽉찻다고 계속 안된다하시고 기다리는것도 안되나봐요. 직원분한테 화내시는데 무서워서 아무말도 못했어요. 여기서 저녁먹기 힘드네요/여기는 뭐 회덮밥 땡기면 가면 됩니당 마늘 송송 드간 양념장 양 조절 잘하시구! 매운탕이랑 무면 금상첨화아인교/회덮밥 좋아하는 나에게 수도없이 찾아간 최애맛집/회덮밥 맛은 있는데 이시국에 사장님 턱 마스크 쓰고 얼마나 말이 많고 시끄러운지ᆢ어지간하면 마스크 쓰시라고 안하고 싶었는데 덮밥먹다가 사장님 침이 팔위에 탁 떨어져 한마디 했슴 손님들한테 명단은 적으라고 애기하면서 ᆢ쯧쯧   /회덮밥맛집 조금?정신 사납지만 사장님 친절하시구 맛있눈집 ㅋ ㅋ ㅋ 사장님 자꾸 뭐 더줄라하심 배부르다고요ㅜㅜ/맛있어요/양념 맛이 일품. /이가게는 점심 손님많아서 손님 머드실지 묻도않고 바로 회덮밥나오고 가게주인도 상당히 불친절합니다  별도아깝네요 일행분 좀늦게오면 왜안오시냐고 재촉하고 너무오래있음안댄다며 머라머라합니다 특히 식당뚱뚱한 여주인같은데 궁시렁궁시렁 욕도합니다/회덮밥도 맛있지만 매운탕이 이집 메인이라고 해도 될 정도로 맛있습니다/가성비 최고/우연히 따라갔다 먹었는데 너무 친절하고 음식도 맛있어서 또 갈 생각입니다. 마늘 양념을 왕창 넣었다가 피봤으니 다른분은 조금씩 넣어가며 드시길..ㅎㅎ같이 나오는 매운탕도 진짜 진국입니다. 추천./전체적으로 나오는 음식의 밸런스가 잘맞았었고, 친절함/별로임. 갈곳이 없어서 인듯/마늘이 너무 매운거빼면 다 좋음/회덥밥"
4,교동면옥 송현점,대구 달서구 월배로 427 (우)42739,냉면,"육전물냉면,육전물비빔면,육전비빔냉면,육전회냉면,소고기육전",9000,2.0,3,10,여기 예전에는 저렴한 가격과 직원들도 친절했었는데 요즘에는 완전 별로/사장님이랑 직원분들도 친절하시고...저희애들도 잘먹어서 자주가요~ 갈비탕 포장도 가끔하고요.. 맛도 다른지점보다 나은듯요! 이시국에도  교동면옥은  방역한데서 유일하게 가는 음식점입니다
5,천연애,대구 달서구 앞산순환로 289 (우)42819,오리,"능이백숙,예약,33,000",65000,3.1,8,24,"가게가 대로변 큰길인데 자꾸 뒷길로 안내해서 아주 불편합니다/맛있어요! 직원분들도 너무 친절하셨습니다. 상추 외에 다른 쌈야채도 있어서 좋았어요./맛있긴 한데 좀 달아서 물림 비닐 깔려있는데 양념국물 묻어있고  제대로 안 닦음/맛은 무난 직원은 불친절 바닥은 끈적끈적/서빙하는 직원 실수로 저희 어머니 바지에 오리 기름 흘리셨는데요,, 좀 불쾌한 내색을 하니 고기집 오면서 흰옷 입고 왔다고 오히려 한소리 들으셨다네요... 가게앞에 크게 드레스코드 적어놓지 그러셨어요.. 이 일만 없었으면 좋았을텐데요,, 주변에 추천하고 싶지 않아요,, 사람이 맛보다는 그곳에 있었던 추억을 더 오래 기억하게 되거든요../정말 맛있게 먹었어요! 서울에도 이런 곳이 있으면 좋겠네요ㅠㅠ/맛있어요 "
6,천사갈비찜,대구 달서구 학산로 176 (우)42738,갈비,"매콤 갈비찜(1인),2인이상주문,10,000",10000,5.0,5,33,갈비 넘넘 맛있어요. 여자친구랑 참 즐겁게 식사했던 곳./무조건 매콤갈비찜 시켜서 볶음밥까지 먹으면 되고 가성비 좋습니다/맛있어요!/갈비 넘넘 맛있어요. 여자친구랑 참 즐겁게 식사했던 곳./무조건 매콤갈비찜 시켜서 볶음밥까지 먹으면 되고 가성비 좋습니다/맛있어요!/갈비 넘넘 맛있어요. 여자친구랑 참 즐겁게 식사했던 곳./무조건 매콤갈비찜 시켜서 볶음밥까지 먹으면 되고 가성비 좋습니다/맛있어요!/갈비 넘넘 맛있어요. 여자친구랑 참 즐겁게 식사했던 곳./무조건 매콤갈비찜 시켜서 볶음밥까지 먹으면 되고 가성비 좋습니다/맛있어요!/갈비 넘넘 맛있어요. 여자친구랑 참 즐겁게 식사했던 곳./무조건 매콤갈비찜 시켜서 볶음밥까지 먹으면 되고 가성비 좋습니다/맛있어요!/갈비 넘넘 맛있어요. 여자친구랑 참 즐겁게 식사했던 곳./무조건 매콤갈비찜 시켜서 볶음밥까지 먹으면 되고 가성비 좋습니다/맛있어요!/갈비 넘넘 맛있어요. 여자친구랑 참 즐겁게 식사했던 곳./무조건 매콤갈비찜 시켜서 볶음밥까지 먹으면 되고 가성비 좋습니다/맛있어요!/갈비 넘넘 맛있어요. 여자친구랑 참 즐겁게 식사했던 곳./무조건 매콤갈비찜 시켜서 볶음밥까지 먹으면 되고 가성비 좋습니다/맛있어요!/갈비 넘넘 맛있어요. 여자친구랑 참 즐겁게 식사했던 곳./무조건 매콤갈비찜 시켜서 볶음밥까지 먹으면 되고 가성비 좋습니다/맛있어요!/갈비 넘넘 맛있어요. 여자친구랑 참 즐겁게 식사했던 곳./무조건 매콤갈비찜 시켜서 볶음밥까지 먹으면 되고 가성비 좋습니다/맛있어요!
7,스타벅스 대구월촌역점,대구 달서구 월배로 315 (우)42742,스타벅스,"펀치 그래피티 블렌디드,망고,사과,핑크 구아바,파인애플 등 다양한 열대과일로 만든,스트리트 문화의 대표적인 그래피티 벽화처럼 그려진 컬러 드리즐로,롤린 민트 초코 콜드 브루,스타벅스의 콜드 브루와 은은한 민트 초코 베이스로,손목의 스냅을 춤을 추듯 가볍게 돌려 음료를 섞어서,폼폼 유스베리 티,저녁 하늘의 노을이 물드는 듯한 비주얼의 음료.,,아이스 라벤더 카페 브레베,진한 리저브 에스프레소 샷과 은은한 라벤더향이 고급스럽게 어우러진 부드럽고 세련된 풍미의 라벤더 카페 브레베,5,100,밝고 가벼운 풍미의 블론드 원두로 즐기는,폼폼 민트 티,아침 하늘의 구름이 뭉게뭉게 피어나는 것 같은 비주얼의 음료.,",6880,4.7,3,11,매장이 넓고 햇살이 잘 들어와 참 좋아요/스벅 규모는 크진 않지만 직원분이 엄청 엄청 친절해요
8,김바우삼겹살,대구 달서구 송현동1길 19-22 (우)42741,삼겹살,"생삼겹살(150g),생목살(150g),생막창(150g),돼지김치찌개(소),콩국수 (생면)",8300,4.2,5,17,이번에 최악으로 실망입니다.목살도그렇고 삼겹살도 사실 고기도 서비스도 갈수록 나빠졌는데 이번에 정말 최악으로 실망했네요. 돈 많이 버셨다는 느낌이 확 올정도입니다(무슨뜻인지는 아실듯).맛집리스트에서 이제는 삭제 합니다.이돈으로 이동네 다른 맛집 갈랍니다./삼겹살 목살 짱 마싯슴ㅠ_ㅠ 여기꺼 먹고 일반 다른집 삼겹살 머그면 별로임/맛있게 먹었어요./삼겹살 존맛탱~~(박수짝짝) 칼국수 꼭 시키세여 오래 걸리니까 미리 시켜야 함/아주 맛있어요^^/이번에 최악으로 실망입니다.목살도그렇고 삼겹살도 사실 고기도 서비스도 갈수록 나빠졌는데 이번에 정말 최악으로 실망했네요. 돈 많이 버셨다는 느낌이 확 올정도입니다(무슨뜻인지는 아실듯).맛집리스트에서 이제는 삭제 합니다.이돈으로 이동네 다른 맛집 갈랍니다./삼겹살 목살 짱 마싯슴ㅠ_ㅠ 여기꺼 먹고 일반 다른집 삼겹살 머그면 별로임/맛있게 먹었어요./삼겹살 존맛탱~~(박수짝짝) 칼국수 꼭 시키세여 오래 걸리니까 미리 시켜야 함/아주 맛있어요^^/이번에 최악으로 실망입니다.목살도그렇고 삼겹살도 사실 고기도 서비스도 갈수록 나빠졌는데 이번에 정말 최악으로 실망했네요. 돈 많이 버셨다는 느낌이 확 올정도입니다(무슨뜻인지는 아실듯).맛집리스트에서 이제는 삭제 합니다.이돈으로 이동네 다른 맛집 갈랍니다./삼겹살 목살 짱 마싯슴ㅠ_ㅠ 여기꺼 먹고 일반 다른집 삼겹살 머그면 별로임/맛있게 먹었어요./삼겹살 존맛탱~~(박수짝짝) 칼국수 꼭 시키세여 오래 걸리니까 미리 시켜야 함/아주 맛있어요^^/이번에 최악으로 실망입니다.목살도그렇고 삼겹살도 사실 고기도 서비스도 갈수록 나빠졌는데 이번에 정말 최악으로 실망했네요. 돈 많이 버셨다는 느낌이 확 올정도입니다(무슨뜻인지는 아실듯).맛집리스트에서 이제는 삭제 합니다.이돈으로 이동네 다른 맛집 갈랍니다./삼겹살 목살 짱 마싯슴ㅠ_ㅠ 여기꺼 먹고 일반 다른집 삼겹살 머그면 별로임/맛있게 먹었어요./삼겹살 존맛탱~~(박수짝짝) 칼국수 꼭 시키세여 오래 걸리니까 미리 시켜야 함/아주 맛있어요^^/이번에 최악으로 실망입니다.목살도그렇고 삼겹살도 사실 고기도 서비스도 갈수록 나빠졌는데 이번에 정말 최악으로 실망했네요. 돈 많이 버셨다는 느낌이 확 올정도입니다(무슨뜻인지는 아실듯).맛집리스트에서 이제는 삭제 합니다.이돈으로 이동네 다른 맛집 갈랍니다./삼겹살 목살 짱 마싯슴ㅠ_ㅠ 여기꺼 먹고 일반 다른집 삼겹살 머그면 별로임/맛있게 먹었어요./삼겹살 존맛탱~~(박수짝짝) 칼국수 꼭 시키세여 오래 걸리니까 미리 시켜야 함/아주 맛있어요^^/이번에 최악으로 실망입니다.목살도그렇고 삼겹살도 사실 고기도 서비스도 갈수록 나빠졌는데 이번에 정말 최악으로 실망했네요. 돈 많이 버셨다는 느낌이 확 올정도입니다(무슨뜻인지는 아실듯).맛집리스트에서 이제는 삭제 합니다.이돈으로 이동네 다른 맛집 갈랍니다./삼겹살 목살 짱 마싯슴ㅠ_ㅠ 여기꺼 먹고 일반 다른집 삼겹살 머그면 별로임/맛있게 먹었어요./삼겹살 존맛탱~~(박수짝짝) 칼국수 꼭 시키세여 오래 걸리니까 미리 시켜야 함/아주 맛있어요^^
