,name,address,sort,menu,mean_price,score,people_give_score,review_count,review_list
0,원조호수삼계탕 본점,서울 영등포구 도림로 274-1 (우)07397,삼계탕,삼계탕,15000,3.3,140,310,"이렇게 불친절한 가게는 태어나서 처음봤네요 별관 일하시는 아주머니./맛있어서 재방문 했는데 옆테이블 손님이 물티슈 3~4장 챙기니까 직원이 와서 이거 우리도 돈 주고 사는거라며 다른 손님들 다 쳐다보게 큰소리로 무안줌 그거 천개에 이만원도 안하는걸로 알고 있는데 얼마한다고 다른손님들 밥먹고 있는데  다 쳐다보게 큰소리로 무안주는지 불편했음 그 직원빼고 나머지직원들은 걍 평범 첫번째나 두번째나 주차직원은 불친절함 그리고 두번...더보기/닭이 진짜 작긴작은데 꼬치장이 맛나긴합니다. 오이 졸  싫어하는데  한개 다먹음 ㅋ/저녁에 갔는데 손님도 별로 없었는데 삼계탕이 뜨겁지가 않고 미지근했음 다신 안갈듯/극혐 절대 다신안감 맛도없고 닭도 병아리수준에 불친절 끝판왕 자기네 식당가는데 주차비 따로 또 받는건 무슨경우인지 누가 사준다해도 다신안감/고추장 맛집임. 물엿빨인거 같기는 하지만 젊은사람 입맛에 맞는 달달한 고추장. 삼계탕은 걸쭉해서 특색있지만 맛은 그냥 평타. 역시 사람 잘되는건 팔자구나라는 생각이 들었던집. 주차비 2천원땜에 조금 빡ㅋ침ㅋ/가격 보소 ㅋㅋㅋㅋㅋㅋㅋㅋㅋㅋㅋㅋㅋㅋㅋㅋㅋㅋㅋㅋㅋㅋㅋㅋㅋㅋㅋㅋㅋㅋㅋㅋㅋㅋㅋㅋㅋㅋㅋㅋㅋㅋㅋㅋㅋㅋㅋㅋㅋㅋㅋㅋㅋㅋㅋㅋㅋㅋㅋㅋㅋ/가격 16,000원으로 인상했습니다.  맛은 보통이지만 닭이 여태먹었던 삼계탕집중에 제일작은닭을 쓰는거같네요. 이거먹으러 40분걸려갔는데 그정도의 맛과가격은 아닙니다/돈을 많이 벌어서 그런지 이젠 주차비까지 받네요 자차 가져오지 말고 대중교통으로 오라는 얘기랑 같네요 영등포구에서 내돈내고 식사하고 주차비 받는 식당이 있는지 정말로 알고 싶네요 (주차관리도 불 친절하네요)/가격대비 맛이별루임~~/사람이 너 ~무 많아서 좀 기다리긴했는게~ 너무 맛잇게 잘 먹엇습니다  기다린보람이 있었어요 ~~ 굳굳/진하고 괜찮습니다 진짜보양식/특이한 삼계탕이고 맛은 쏘쏘.. 앞에 안내안해준다고 항의하는 손님 뒤에서 욕하는거 잘들었습니다/불친절의끝판왕/닭들이 살아생전에 못먹고 자랐네 유난히 갔었던 날은 다른 날보다 더 작었네요/뭐 맛은 그럭저럭인데 가격은 15000 임 게다가 주차비 현금으로 따로 받음/들깨 삼계탕이란 점이 특이함  원래 삼계탕이 더 맛있긴한데 가까우면 자주 갈듯/비싸다/호구들만 가는 집이지./직원들 불친절 개쪄네~ 맛있어도 다신 안가게 될듯 밥먹고 이렇게 기분 더럽기는 첨이네~조선족것들 다잘라야 함/맛이 변했어요. 들깨가 덜들어가는거같네요. 주차요원도 너무 불친절해요. 원가절감인가요/고소한 삼계탕 너무 맛있어요/들깨하고 삼계탕 조화가 좋습니다. 고추장맛이 좋아서 오이, 고추 같은 야채들을 계속 찍어먹게 됩니다.  흠이라면 아무래도 가격의 밸런스를 생각하게 되네요. 그리고 서비스 측면에서 조금 고개를 갸우뚱하게 만드는 것 들이 있습니다. (주차발렛이나 위생, 종업원 접대 등) 이런 것들을 잠시 접어 둔다면, 분명 맛집은 맞습니다./다 좋은데 조선족 직원들 진짜 개불친절하네  짤라요/맛은 좋아요. 그런데 좀 비싸요.../들깨 스프 같은 삼계탕!! 달달한 고추장에 찍어 먹는 고추와 오이도 ㅈㅁㅌ!!/국물 단백하고 고기가 녹아요 청양고추에 고추장 찍어서 먹으면 대환장/솔직히 맛있으나 비쌈. 닭고기 부들부들 연하고, 스프 마시는 듯한 걸죽함 맘에 듦. 근데 대박인 건 고추장. 고추장이 존맛임. 고추장에 오이 찍먹하려고 가는 집. /뭐 별다른건 없는데 주차장갑질이 심하네요.. 뭔 촌구석에 발렛의무화라니.... 삼계탕 맛은 변함없는데 시스템이 좀 이상해졌네요/맛은 있는데 가성비는 좀../부드럽고  연한 고기맛과 부재료들이 좋다/맛있어요 삼계탕도 부드럽고 깍두기도 맛있음"
1,대한옥 2호점,서울 영등포구 가마산로69가길 7 1층 (우)07387,설렁탕,"설렁탕,반탕,꼬리탕,도가니탕,꼬리수육 (소),도가니수육",16500,3.4,23,61,"맛이 있어도 불친절도 정도가 있는데 여긴 선넘는다/위생 저세상에 개 불친절/설렁탕 최악입니다 면은 제대로 익지도 않고 고기는 질기고 맛도 없어요 이런 설렁탕은 처음 먹어보네요/먼저 와서 줄서있는데 뒤에 온 팀이 인원 많다고 먼저 받아버리고는 직원도 우리 먼저라는데도 그 팀이 먼저와서 예약했다고 사장님이 친절히 구라치시네요/본점 너무바빠서 2호점으로갑니다. 꼬리찜에 사리추가 예술이에요/대기가 길지만 맛있어서 기다립니다 /먹으러 갔는데 코로나로 인한 자진 휴무중이래요ㅠㅠ 다음에 다시 꼭 가볼꺼에여/술안주로 이만한게 없지 가격은 조금 흠.. 본점 기다릴바에 2호점 와서 두번 먹음/Wow!!! Very delicious!!!!!! Tail bear soup!!!/짱맛!!!/존맛탱.....다들 오지마세요 혼자 먹고 싶음 ㅠㅠ/2명이서 소자 먹었는데, 양은 가격대비 좀 아쉬웠어요ㅠ 그래두 맛있고 직원분도 친절하셔서 좋았습니다!/가성비 별로입니다. 양이 너무 적어요/양 적엉~~ 3명서 가면 대자 2개 시켜야행~  근데 꼬리찜 개 맛있음  또갈꺼얌/꼬리찜이 아주 별미입니다./밥이 엄청 질고 꼬리 수육은 가격은 저렴하다만 너무 기대를 해서 그런가 실망이 컸다/조금은 기대를 하고 갔으나, 육수는 깊은 맛보다는 꼭 프림 탄것 같은, 고기는 종이 씹는 것이 더 나을 듯 합니다. 죄송하나 결코 추천은 드리고 싶지 않습니다./무난해요/저렴해서 가는 집인듯. 솔직히 가격매리트말고는 맛은없었습니다./한번씩 생각나는 맛"
2,신길동별난아찌짬뽕,서울 영등포구 영등포로62길 10 (우)07309,중화요리,"매운짬뽕,얼큰차돌짬뽕,기계우동,김밥,백짬뽕,자장면",8333,2.3,47,60,"짜장면이랑 얼큰차돌짬뽕시켰는데 왠만한 중국집보다 맛있습니다. 얼큰차돌짬뽕도 매운편입니다. 그리고 돈아깝지 않으시려면 맛보기로 매운짬뽕 국물 달라고 하면 주시니까 다른 메뉴로 주문하시고 국물 맛보기로만 드세요. 그리고 더 맵게 즐기시려면 맛보기 국물을 짜장이나 차돌짬뽕에 넣어서 드시면 매워집니다. 호기심에 도전하는거 아니시면 매운짬뽕 시켜서 먹는건 비추합니다...더보기/친절도 맛도 별로였던곳/속쓰려../중국식 짬뽕이라기 보단 집앞의 즐겨찾는 분식 느낌.   예전엔 매운짬뽕도 먹을만 했으나 한번의 업그레이드를 거쳐 이젠 매운맛이 아닌 쓴맛이 난다. 캡사이신은 안쓰는집.  가게 사장님도 매운짬뽕 먹지 말라고 말리시는데 매운거 알면서 매운짬뽕 도전하고 욕하는건 누구잘못? /차돌짬뽕에 고기도 몇개 없고 국물에 고기가 우러나지 않아 감칠맛이 안남 자극적이지만 밍밍한 느낌 전분기없는 떡볶이 국물인줄 알았음 김밥은 차갑고 겉이 말라있었음 참기름맛이라도 좀 났으면 했는데 정말 아무맛도 안남 짬뽕전문점인만큼 큰기대했는데 다시 찾고 싶진 않음/쓰레기임 짬뽕 아닙니다 매워서 맛이 없는게 아니라 그 자체가 맛이없음/맛없게 매움... /맵기만하고 정말 정말 맛이 없다. 짬뽕의 진한 국물 없고 건져먹을 건더기도 없고 짜장면은 이게 짜장면인가 싶을정도로 묽고 건더기도 돼지고기 몆점있고 먹을게 없어 건더기를 먹어보니 대부분 가짜 고기이다 짜파게티 스프를 넣었나? 정말 비추한다./맛없어요./뭐 내 스스로 먹은거니...맛있게 매운게 아니고 그냥 매워.맛은  없고 그냥 매워.재료들 신선하고 뭐고 모르겠고 그냥 매워.먹고 하루종일 그냥 매워.그냥 계속 매워서 하루종일 신경이 날까로워.../오로지 매운맛만 맛보려면 가도 됨. 맛이 있으면서 매워야 하는데 그냥 ㅇ5555지게 맵기만 함. 김밥은 무맛이다시피 함. 그리고 남사장님은 친절하고 좋으신데, 여사장?님은 좋게 말해서 시니컬이고 적나라하게 이야기 하지면.. 밑에 다른 분들이 이야기 해주심.... 읽어보세여.../아줌마가 미치셨나 단무지 상했다했더니 ""아니 그럼 먹지말지 왜"" 이러고 있다 미쳤나 진짜 하 여기 단골인데 이제 인연 끊는다/엽떡 제일매운맛은 맵다는 느낌없이 잘먹는데 별난아찌네 매운짬뽕은 그거랑 비교가 안되게 매움 . 적응되지 않는 매운 맛! 그냥 먹는 순간 어지럽고 속아픔 ;; 빈속 금지입니다~ 오늘은 빈속에 갔다가 어지러워서 놀랬어요/여긴 진짜... 맛없다... 모든 메뉴가 맛없음... /면 반죽 자체가 이미 엄청 짜서 많은 실망감을 줬다. 국물 속 건더기들의 신선함은 극히 드물다. 국물맛도 감칠맛은 없고 고통스러운 맛이었다. 차라리 간이 약했다면 그럭저럭 글을 그나마 좋게 남기겠다만 너무 짜서 그러긴 힘들겠다. 이제 벌만큼 돈도 많이 버신 것 같고 인지도도 그 정도로 얻었으면 이제는 음식에 대한 퀄리티를 좀 신경 써서 올렸으면 좋겠다. 차...더보기/좀씻고 조리좀해라  .. 더러워서 못먹겟다..진짜.. 이런글  기분 나쁘게 받지말고. 진심으로 하는말이다/진짜매운건 맵부심있는데 건더기만 다 먹었네요 차돌짬뽕이 진짜맛있음 차돌짬뽕에 매운국물 좀 추가하면 딱 맞아요/맵기만 x나게 맵고 먹고 위장 멀쩡하면 그게 비정상일듯./매운짬뽕 국물이랑 건더기 조금 남겼는데 맛있게 매우면 다 먹을 수 있겠던데...../매운짬뽕은 겁나서 못 먹고 차돌먹었는데 충분히 매콤했어요. 얼큰한 짬뽕이아니라 처음엔 떡볶이 맛 비슷하게 났는데 먹을수록 계속 땡기는 맛ㅋㅋㅋㅋ 쿨피스 필수에용 음료만 따로 현금 선불 계산입니다. 우유도 팔아요. 매운거 땡길때 생각날 것 같아요 ㅠ/이런걸 굳이 찾아가서 맛봐야하나 일반적인 짬뽕맛 절대 아니고 인도매운고추라 고수향이 가득함 1인1면 이라해서 매운짬뽕 못먹으면 6천원 짜장면, 우동 중 선택 주문해야함 김밥만 주문도 안됨 어렵게 맛보려고 영등포역에서 걸어걸어  찾아갔는데 그냥 나올수가 없어서 중간매운맛의 얼큰차돌짬뽕과 옛날짜장 주문했는데 2천원짜리 짜장보다도 못한 맛임  극심하게 후회함  ...더보기/사장님 그동안 꿀빨았을텐데  내년부터 고생하는 터이니 내년에 가게 옮기세요/겔포스 두개 먹었어요 먹고 나니까 진 빠져서 아무것도 하기 싫어요 사람들이 왜 토하고 기절하는지 이해가 됐어요 맵찔이는 이제 까불지 않을 거예요 아파요 그냥 맵고 아파요 제가 약사라면 바로 옆집에 약국을 운영할 거예요 위장약 팔아 갑부될 수 있을 것 같아요 자장면은 맛있었어요 달걀프라이도 해먹을 수 있어서 좋았어요/매운거 안좋아해서 가보지는 않은 동네주민. 다만 주말 휴무때 음식물쓰레기 다량을 길거리에 방치하는데 냄새가 고약함. 기본적인 매너는 없어보임./호기심에 갔는데 죽을만큼 매웠어요 ㅠ ㅠ 병원에 갈뻔했네요! 그런대 일인일메뉴는 쫌 그랬어요 짬뽕도 비싼편이었는데 말이죠 ㅠㅠ 게다가 일인일메뉴 중에 김밥은 제외라서... /매운걸 좋아해서 오랜만에 가봤는데 맵긴 정말 매워요. 근데 전에는 못느꼈는데 맛이 너무 없어서 아무리 매운게 땡겨도 앞으로는 오지 않으려구요. 면발이 입 안에서 다 갈라지는 느낌이고 쓴맛이 굉장히 강해요. 목이버섯 너무 좋아해서 한 입 먹었다가 이렇게 맛이 없을 수도 있구나 생각하면서 뱉었어요. 남친은 짜장면 먹었는데 학교다닐때 급식에 나온 짜장면보다 맛이...더보기/슬라임을 소환하는 방법 이 짬뽕을 먹는다  국물까지 완뽕한다 =》위경련 발생 =》화장실에 달려가 토한다=》콧물같은 점액질로 쌓여진 거대한 한덩어리의 짬뽕 슬라임 소환됨./그냥 엄청맵고 쓴 맛밖에 안 남  맛으로먹을거면 안가는거 추천 김밥시킨거 미리만들어놨는지 무슨 얼음장처럼 차갑고 짬뽕도 양이나 맛에비해 싼가격도아니고 김치맛집인건 ㅇㅈㅋㅋㅋㅋ 돈아까움 유튜버들이나 연예인아니었음 망했을듯 그리고 서빙하는 아줌마 싸가지없음 돈많으면 걍 버리는셈 치고 먹고오세요ㅎ 저는 지방에서 먹겠다고 갔다 시간버리고 돈버리고왔으니까;;/우동 맛집/매운짬뽕전문. 주문시 엄청 겁을 줘서 도전해보지 못하고 국물만 샘플로 먹어봄. 호흡곤란으로 뉴스나올 뻔함. 일반인들 먹을 수준이 아님. 매운거 정말 잘 먹는다가 아닌 이상 도전권장안함.    얼큰차돌짬뽕 ㅡ 매운짬뽕 비할 바는 아니나 맵기는 매한가지. 양이 좀 적은 듯"
3,팜스프링스,서울 영등포구 도신로60길 22-3 2층 (우)07349,카페,"라임 소다,모히또,4,000,4,000,4,500,5,000,5,000",6000,4.7,35,230,"애견카페로 최고/최애카페 ㅎㅎ브런치맛있음/팜스프링스는, 감슐랭 가이드가 인증한 ""우리동네 친절카페"" 입니다!/집앞에 예쁜카페가 있어서 자주애용합니다.이사온후부터는 이곳만 애용합니다.브런치도맛나고 마카롱도 다른곳보다 덜 달아서 좋아요.사장님직원분도 친절하세요.전 별다방커피보다 이곳커피가 더 맛나네요♡♡/동네에 이런곳이..!! 무엇보다 사장님이 음료나 디저트에 진심이신편! /친구가 브런치 맛있다고해서 같이 옴  쬐금 비싼 느낌이 없지않아 있음   하지만 퀄리티 있음   매장 깔끔하고 차분한 분위기  커피가 맛있어서 놀랐음/자주 가는 카페인데 샌드위치류랑 밀크티가 맛있어요 마카롱은 오늘 눈에 들어와서 솔티드 마카롱 먹었는데 귀엽게 꾸며져 나와서 후기 남겨요ㅎㅎ 빼빼로 데이 지난지 얼마 안되어서 그런지 빼빼로도 서비스로 같이 올려주셨어요:) 화장실도 항상 깨끗해서 좋아요/빵도 고소하고 맛있고 소스가 너무 맛있는 샌드위치예요. 츄라이 츄라이~~해보세요. /존맛탱구리입니다/주차장은 없어요. 사장님 친절하시고 아늑하면서도 깔끔하고 허전하지 않은 인테리어가 너무 마음에 들어요! 안쪽 쇼파자리? 안에 앉았는데 불이 너무 노랑노랑해서 책 읽기에 적합하진 않았어요. 책 읽으시려면 다른 밝은 쪽 자리에~/맛있는데 비싼데 이해되는 맛과 데코 음료 탄산은 탄산수에여 사이다아니에여ㅠ 물은 달라고하면 쥬세여/진짜 생각보다 너무 맛있어효,, 또 ,, 가고싶읍니다,, 존맛탱,,, /넓고 조용하고 예쁘고 편안한 공간에 커피맛도 좋네요. 빙수도 생각보다 맛있게 먹었어요  시장 근처라 주변이 복잡한 것 빼곤 완벽한 카페였어요 가까운 곳이었다면 매일 갔을듯/오랜만에 푹신한 편한 자리있는 카페에서 책좀 읽고싶어서 한참을 찾아보다가 검색으로 알게되었는데 집에서 한시간 이상 걸리더라구요 그래도 주변에 다 비슷한 의자에 그냥저냥한 카페밖에 없어서 좀 멀어도 힐링할 겸 찾아가게 되었는데 분위기도 음료도 정말 너무 예쁘고 좋아서 먹지도 않고 한참을 사진 찍었어요..## 첫 방문이었지만 앞으로 저만 알고싶은 카페가 되었는...더보기/우연히 갔는데 연남동 카페들보다 백배 넓고 예쁨ㅋㅋ  음료도 예쁘고 맛있네요 ~~ 친절하구 ㅎ /넘 맛있어요!!! 모짜렐라 짱맛!!!! >.</브런치 존맛탱!/분위기 좋아요 또 가고싶음/근방에서 찾기 힘든 인테리어와 디저트 퀼리티 /음료,디저트,분위기,친절도 다 별 다섯개입니다. 동네에 친구들 오면 꼭 데리고 가고싶은곳이에요!/아주 .. 맏있네요^^~ 좋은 곳에서 힐ㄹ.링.하고 .감니다./진짜 맛있어요! 특히 소스들이 찐.. 시리얼 종류도 많고 사장님 짱 친절. 매장에 마스크 놓고가서 찾았더니, 이시국에  마스크 두개나 챙겨주시는 센스쟁이 사장뉨!/얼그레이 애플 밀크티 진짜 대박!!!!! 매일 가고 싶은 곳! /가야는이유 : 단독주택 건물을 개조한듯한 곳에서 음료와 식사를 할 수 있는 곳, 대화와 공부 모두 적당 안가는이유 : 위치의 아쉬움, 버거는 좀 실망  (2020년 2월 1째주 메뉴 리뉴얼 예정) 바질갈릭버거 : 야채가 크고 신선하여 번을 제외하면 샌드위치와 다르지 않음, 바질이나 갈릭 느낌은 거의 받지 못함, 감튀가 케이준 스타일로 맛있었음 아메리카노 :...더보기/여자친구랑 밥먹고 들렷는데 분위기짱 !! 포토존도 많고 아아 잘먹었습니다^^/버거, 치아바타 주로 먹었고 음료는 마끼아또 아이스, 모히또 위주로 먹었음 버거가 정말 맛있음.. 버거 사진 찾으면 꼭 추가하겠음 감튀가 케이준이라 개인적으로 매우 좋았음 비주얼도 굉장히 좋음 가정집을 리모델링 한 것 같은데 분위기 있고 화장실도 굉장히 깔끔함 버거는 마감시간 두 시간 전 까지만 받으시는 걸로 알고 있음/커피체리 특이한데 너무 맛있어.../가야는이유 : 단독주택 건물을 개조한듯한 곳에서 음료와 식사를 할 수 있는 곳, 대화와 공부 모두 적당 안가는이유 : 위치의 아쉬움, 버거는 좀 실망  (2020년 2월 1째주 메뉴 리뉴얼 예정) 바질갈릭버거 : 야채가 크고 신선하여 번을 제외하면 샌드위치와 다르지 않음, 바질이나 갈릭 느낌은 거의 받지 못함, 감튀가 케이준 스타일로 맛있었음 아메리카노 :...더보기/여자친구랑 밥먹고 들렷는데 분위기짱 !! 포토존도 많고 아아 잘먹었습니다^^/버거, 치아바타 주로 먹었고 음료는 마끼아또 아이스, 모히또 위주로 먹었음 버거가 정말 맛있음.. 버거 사진 찾으면 꼭 추가하겠음 감튀가 케이준이라 개인적으로 매우 좋았음 비주얼도 굉장히 좋음 가정집을 리모델링 한 것 같은데 분위기 있고 화장실도 굉장히 깔끔함 버거는 마감시간 두 시간 전 까지만 받으시는 걸로 알고 있음/커피체리 특이한데 너무 맛있어..."
4,낙지세상 신풍역본점,서울 영등포구 신풍로 23 (우)07398,"해물,생선","낙지덮밥,낙지해물파전,산낙지회,연포탕 (중),낙지해물탕 (소)",26000,3.6,42,14,"해물파전 맛집 파전 바삭하고 맛이 엄청 좋아요.  낙지볶음은 낙지가 통통하고 실한건 무척 좋았지만 양념이 살짝 아쉬웠음. 감칠맛 부족하고 매운맛 위주로만 있는 느낌. 재방문 의사는 있음./해물파전? 맛나용/요즘같은 코로나19상황에도 대기표 8번 받고 10분 정도 기다렸다가 자리가 나서 식당 안으로 들어갔는데 넓은 홀에 손님이 가득한 걸 보니 이미 고객으로부터 맛집으로 인증받는 증거가 아닐런지...  낙지덮밥 주문했는데 개인적으로 낙지 식감이 부드럽고, 간과 매운 맛도 적당했으며, 둘이서 먹고 남겼으니 양도 적은 것이 아닌 듯...   /주차장이 너무 좁아서 정신없음 맛있진 않고, 대부분 어르신 손님임.. /소란스러웠다/한번씩 가서 먹는곳 낙지 해물찜 잘먹는데 좀 비싸서글지 괴안 원산지도 중국이라 좀 찝찝한데 맛이 괴안아서 ㅠ/어른들이 좋아할 맛.. 실제로 식사시간엔 어르신들 웨이팅 엄청 많음 저희 이모는 신도림쪽에서 한번씩 먹으러 오신다고 하심 주차나 서비스 괜찮고 깔끔한건 좋음 맛도 자극적이지않고 낙지통통함 그치만 갠적으론 심심하다고 느껴졌고 가격도 낙지덮밥 1인분에 11000원.. 조금 아쉽다고 생각 포장보단 홀이 나을듯 그게 메리트라/맛있어요!! 낙지볶음 짱!! /대림동 근처 에서는  꽤  괜찮요/아침에 11시 30분부터 영업한다고 합니다./낙지찜 짱. 쏘맥말아서 같이먹으면 진짜 환상적/존맛. 가성비도 괜찮아요. 사장님도 친절하시구요./낙지더밥 맛있어요!가격이 좀 올랐네요~!/해물 파전을  포장했는데 메뉴  금액이랑 안맞아요. 금액이 많이 올랐네요. 어려운 시기에.쩝~~~/어르신들이 진짜 많았는데요 다 이유가 있었음요. 맛있고 푸짐하고 친절하십니다. 이게 2인분이리니 어메이징! /존......맛....... 예전보다는 좀 덜 매워졌지만 여전히 맵게 맛있다. (맛있게 매운게 아니라 맵게 맛있다...) 낙지덮밥 시키면 낙지따로 밥따로 나오는데 낙지가 겁나 실하고 통통해 가위로 썰기 전에 일단  다리부분 하나 먹기를 추천. 반찬들 한번씩 다 먹어보시길. 기본 이상은 함. 반찬은 얘기하면 리필해주는 시스템으로 바뀐듯.  종업원 분들이 매장...더보기/낙지가 통통하니 맛있었어요 약간 단편인데 전 그래서 좋았어요/초심을 잃은 전형적인 케이스 일단 중국산 낙지라 불안하긴 했어도 양이 푸짐하고 가성비 좋아서 자주 갔던집이다 2년만에 역시나 양은 반이상 줄었고 낙지도 상태가 그닥인듯 보인다  물론 인건비와 물가 핑계로 그랬겠지 뻔한 대답  역시 코로나피해를 모르고 장사 잘되는 집들은 그 전의 피땀눈물과 초심을 잊어버리는듯/직원은 진짜 별로.... 자주가는데 매번 컵이나 물통에 고춧가루 묻어있어서 다른걸로 달라하면 매번 인상 씀. 친절함본적없음. 장사가 잘되서 그런가봄. 주변에 먹을만한것도 없고 깔끔한 인테리어도 없어서 어거지로 가긴하는데 음식맛빼면 두번다시 안갈 서비스랑 사장님 마인드^^/맛있고, 가격도 저렴해서 좋아요./매운데 달아서 씹을수록 별로.. 내스타일은 아님 사장 불친절 끝판왕 기분 잡침/카운터 젊은 사장인지 관리인인지 완전 불친절/포장은 2인분부터 홀에서 혼자식사 가능/서비스고 나발이고 일단 맛은 인정... 낙지 양도 많고 엄청 통통함/맛은 있는데 카운터 교체좀 맨날가는데 띠꺼움/해물탕 무지 비림 이집은 그냥 낙지비빔밥  /장사잘된다고불친절함 밥먹고 체했음 이제 절대안감/양념이 맛있어요.  최애 낙지덮밥임/여기 카운터 지키는 남자 아저씨, 진짜 무뚝뚝한 스타일! 일하는 직원들 입장에서는 좋은 사장입니다.  덕분에 더 많이 올수도 있는 손님 수를 알아서 줄여주거든요. 직원들 입장에서는 손님 많으면 더 피곤하잖아요. ㅋㅋㅋㅋ /맛있어서 자주 가는데 다른 직원분들은 다 친절하신데 카운터에서 계산하시는 사장님이 너무 불친절해요;"
5,레드다이닝룸,서울 영등포구 여의대방로47길 26 1층 (우)07357,이탈리안,표기안함,표기안함,4.5,36,102,
