,name,address,sort,menu,mean_price,score,people_give_score,review_count,review_list
0,도토리브라더스,서울 종로구 경희궁길 41 1층 (우)03176,일식,"골든에그살몬정식,아보카도골든에그정식,아보카도명란 스파게티,타마고산도,도토리 튀김간식",9820,3.4,159,388,"괜찮았음. 서비스도 맛도. /식사시간 웨이팅이 있다. 음식은 달달하고 맛있음. 분위기는 무난하게 귀엽고 일본가정식을 좋아하면 가볼법하다/경복궁역 근처에 모임 분들과 식사하기 괜찮은 곳 없나?하며 찾아갔던 곳,  초입에서부터 도토리 캐릭터들이 반갑게 맞아준다  온기 느껴지는 원목 베이스 + 스테인 글라스 인테리어 조합이 손님에게 신선함을 준다 매장 내부 소품들도 그에 맞게 아기자기하게 잘 매칭.  자리에 앉으면 도토리브라더스 캐릭터가 그려진 개성있는 수저집이 시선을 끈다 디테일에 강하다. 정...더보기/사장님이 매우 친절하심. 대창덮밥 맛있어요!/아주 만족했습니다  직원분들도 친절하세요/특별한 맛은 아니긴 합니다. 하지만 직원분들이 문도 여닫아 주시고 친절하셔서 먹을 때 기분이 좋았어요. 가게에 해도 잘 들어서 12시~13시경 머물렀는데 따뜻한 가게 분위기와 잘 어우러져 기분도 좋았고요. 연어는 후기에서 주로 말하는대로 두껍진 않았습니다. 치킨난반이 더 나았어요.  전반적으로 맛은 중~중하 정도라 생각하지만, 종업원 분들의 친절함과 햇살과...더보기/외관이 예쁨. 가게 안도 아기자기함. 음식은 무난함. 가성비 좋지는 않음./일식 덮밥집이 정말 ...웬만하면 맛없을수가 없는데 그걸 보여준집!  ✔️대창덮밥  14,500원 그나마 먹을만해요  그렇다고 이거먹으러오지는 마세요 이미 왔다면 선택지는 이것뿐..  ✔️넒쩍 미트볼 토마토 파스타 13,800원  면은 밀가루냄새심하고 집에서 해먹는것보다도 핵노맛  학교 급식 파스타보다 못한거같아요 미트볼만 괜찮아요  ✔️아보카도 골든에그정...더보기/외관만 이쁜집 음식은 그닥 !! 여기가 맛집이라고 후기 올린 사람들 너무 신기함 딱 인스타용/직원분들 넘 친절하셔서 좋았어요. 정말로ㅜ 단지..스테이크..는 장조림용 사태를 쓴 게 아닐까 싶을 정도로 질겼고 연어 신선도는 조금 아쉬웠어요ㅜ 제가 일행에게 같이 가자고 한 건데 좀 속상했어요..ㅜ/알바생이 친절하고 연어가 맛있어요/그냥저냥 평범한 일식 가정식/도토리 캐릭터가 귀여움 맛은 그냥 쏘쏘 근데 셋이 갔더니 자리가 너무 비좁아서 먹기 힘들었음.../......... 돈이너무아까워요...../맛은 쏘쏘지만 귀여운 인테리어 때문에 생각나서 찾게되는 집이에요 :) /아보카도 연어 덮밥도 별로고 나폴리탄도 심각하게 별로에요 ㅠ 사람들이 왜 많은지 이해할 수 없고 다시는 안 갈듯해요. 나폴리탄은 면이 안익었고 소스도 정말 별로에요. /오픈 초기에 가서 맛있게 먹었었는데 이제 그맛이 안나요. 많이 아쉽습니다. /직원들 바빠보이는 와중에도 친절했어요! 음식도 금방나오고 잘먹었습니다~!  웨이팅 엄청 많은 찐 맛집 직원들도 친절하고 좋았어요 /사케동에 연어가 조금 더 들어갔으면 좋겠어요.. 양이 적어서 더 먹고 싶어도 연어가 없어서 밥만 많이 남아요..!  /그냥 평범한데 왜 이렇게까지 사람이 많은지는 모르겠어요! /전시회 갔다가 주변 밥집을 찾다 평점이 좋아 방문했습니다..솔직히 평점 높은 이유를 모르겠네요..서비스는 좋지만..맛은 정말 모르겠어요 가장 잘 나가는 메뉴인 후토마키와 연어덮밥, 메론소다를 시켰는데 기존 알고 있던 메론소다와 매우 맛이 상이하였어요 달달한 맛을 기대했는데 그냥 색깔 있는 레몬물 같았고 연어덮밥의 연어는 훈제연어?인지 두툼하지도 않고 얇고 ...더보기/서비스 굳  맛 굳  웨이팅… ㅎㅎ 테이블링으로 미리 줄서기 성공 /사진 찍기 예쁜 곳. 주말 아침 오픈부터 웨이팅하는 곳. 음식 주문하면 정말 빨리 나옴. 밥이  미지근하고 음식 대부분이 차가운 느낌. 일본 음식이라 그런가? 음식맛보다 분위기 좋은 곳. /아휴….. 파스타 먹지 마세요 진짜 크림파스타는 레토르트 파스타 돌려먹는 맛이고 나폴리탄은 토마토 캔 소스 얹은 맛입니다  대창덮밥만 괜찮았네요 인스타 광고가 하도 많아서 갔는데 크림파스타 좀 심하네요ㅠㅠ 살짝 속이 안좋아요….. /웨이팅할정도는 아니고 동네 놀러온 친구 데려가기엔 나쁘지 않음/가성비 좋지 않고, 맛도 평범. 일본식도 아님./여기 파스타 맛집임 쥰내맛잇음 ㅋㅋ 연어덮밥 이런것보다 명란아보카도파스타랑 온천계란까르보나라 대박맛잇음/흠 항상 대기가 있던데 그 정도인가 싶은 생각이 드는 곳. 외관이 예쁘긴 하지만 맛과 가격은 좀 아쉬운게 사실이다. 의외로 신의 한 수는 곁들여 나오는 사이드 국이다. /죄송하지만, 연어덮밥과 스테이크덮밥 많이 먹어봤는데, 이렇게 실망스러웠던 적이 없는 것 같습니다. 밥도 딱딱하고 간도 별로 안 되어 있는 듯하고, 연어도 얇고 신선한 느낌도 안 들었어요. 왜 유명한지, 솔직히 잘 모르겠습니다./두번밖에 안와봤는데 존맛탱 메뉴 하나하나 다 뽀시러올게요/밥에서 담배맛이나요./아기자기한 인테리어의 가게에서 다양하고 독특한 메뉴를 맛볼수있는건 장점 다양한 밑반찬도 매력있음 대창덮밥 대창이 점점 질겨지는 느낌 먹다보면 약~~간 물림 도토리국은 참 맛있음  배달도 시켜먹어보았는데, 확실히 매장가서 먹는게 나음"
1,커피스트,서울 종로구 경희궁길 39 1층 (우)03176,커피전문점,핸드드립,6000,4.2,82,66,"가을이 되면 생각나는 곳 뜻밖의 당근케익 1인자... 하지만 주문 실수가 잦아요/비엔나 커피가 좋았고, 조용하게 쉬다갈 수 있는 편안한 분위기/맛있어요. 오래된 가게 특유의 사람을 편하게 해 주는 분위기가 있습니다. 이런 분위기의 가게가 귀해진 터라, 기분 좋게 마시고 나왔습니다!  비엔나 커피도 산미가 조금 있지만 크림과 아주 잘 어울렸어요. 햇살 좋은 날 앉아있으니 정말 기분좋았습니다. 재방문 의사 충분./라떼에 우유대신 우유거품 넣어주는데 제 스탈은 아니에요ㅠ ……… /십몇 년 전 블로그 검색을 해서 소개되는 카페들 중에 지금까지 살아남은 개인카페는 보기가 매우 어렵다. 실력이 좋음에도 업력을 쌓지 못한 채 스러져간 카페도 정말 많았다. 실력과 매출 모두 출중하여 장사할 여건이 충분함에도, 가게를 지키는 일 자체의 힘듦과 피곤을 견디지 못하고 그만두시는 분도 봤다. 이 오랜 세월 동안 일정한 맛을 유지한 채 한 자리를 지...더보기/좋아하는 공간../손님이 왔는데 인사도 없고 멀뚱멀뚱, 주문하려고 섰더니 또 말없이 째려만 보길래 기분 나빠서 나왔어요~ 여자직원인지 사장님인지 너무 불친절하네요^^ /드립커피 맛있어요!!!!!/손님이 많지도 않았는데 30분 만에 음료가 나왔다. 우리보다 나중에 주문했던 테이블의 음료가 먼저 나왔다.  그 와중에 누락되어서 모든 일행이 커피를 다 마신 후에 누락된 음료가 나왔다. 음료 서빙해주시면서  나머지 일행 컵을 양해없이 다 수거해가주셔서 테이블에 내 음료 1잔만 덩그러니 놓여있는 상황을 겪을 수 있었다. 음료가 누락되고 지연된 것에 대한 설...더보기/이곳 단골. 처음을 리필 커피 마셨는데. 왜 맛있는거죵? ^^ 조용하고 커피에 집중할 수 있는 좋은 공간입니다./소문내지 마요. 최고의 라떼. 10년차 단골/놀랍진 않지만 맛있는 커피 /커피 맛있어요. 주차는 불가능해요. 야외자리는 시원하고 좋은데 모기가 좀 있었어요. 읽을 책들도 좀 있어서 좋아요. /오랜만에 느낀 클래식한 멋과 맛. 개인적으로는 에스프레소로 만든 비엔나를 좋아하기에 브루잉비엔나는 커피부분이 조금 가볍게 느껴졌지만 아쉬움이 남는 음료와는 별개로 이제는 거의 사라져버린 예전 동네카페의 느낌을 느낄수있어 감상에 잠겼다. 죄다 미드센츄리모던이나 단색으로 칠해놓은 카페 사이에서 빈티지, 클래식을 고수하는 이런 카페들이 반갑고 정겹다. 나도 나이...더보기/두 주인의 열정이 느껴지는 곳 집념으로 빚어낸 생크림 그런 하얀덩어리를 커피위에 얹는다.  당근케잌 환상적  컵과 받침접시도 굉장한 제품들!  여자친구가 화났는가? 열받았는가? 이곳을 데려가라  위 리뷰를 남기고 5년이 넘는 시간이 흘렀습니다. 두 손을 잡았습니다. 그리곤 사랑한다 말했네요. 제일 좋아하는 장소에서 기적이 일어났네요./드립커피를 주로 하며, 아이스로 내려주는 원두가 별도로 마련돼있어서 좋았다. 내부에 인테리어 겸 전시해둔 다양한 커피용품을 구경하기도 좋았다.  내부가 좁았음에도 시끄럽지 않아 신기하면서도 좋았다./맛은 5점 그 이상! 좀만 친절하게 응대하면 좋을 듯/가격대는 좀 있지만 후회하지 않을 좋은 커피와 공간. 가끔 사람이 너무 많아 혼란할 때도 있는데, 그래도 방문하는 분들이 대개 점잖은 편이라 번잡한 느낌이 덜하다. /제가 제일 좋아하는 카페 중 한 곳입니다. 이쁜 골목길을 지나 카페에 도착하면 향긋한 커피향이 기분 좋게 맞이해줍니다. 무엇보다도 커피맛이 너무 좋아요! 개인적으로는 속상한 일 있거나 안 좋은일 있을 때 마음풀러가는 곳 입니다. 햇살 좋은 날 창가쪽 앉아 커피한잔하면 위로받는 느낌이에요 :)/아이스아메리카노 산미 강한편이지만 맛있음. 비엔나 = 아인슈페너/아인슈페너와 레몬케잌 짱맛! 커피 두 잔 시킬뻔ㅎㅎ/아닌슈페너 맛있어요/아.인.슈.페.너/커피 좀 만들줄 안다/드립 커피 한 잔에 정성이 담겨 나온다. + 테라스가 좋은 카페/아인슈페너 맛있었다 생각남/오랜만에 제대로 향을 잡은 커피를 마셨습니다 /어떤 공간에 들어갔을 때 주는 편안한 느낌을 좋아하는 편인데요. 그런 느낌을 주는 카페 중 한 군데였어요. 다시 방문하고 싶어요. /친절하시고 드립커피도 맛있네요~/사이공커피 짱맛! 분위기도 따뜻해서 좋다/예가체프 진한 향, 감미로운 맛"
2,김권태돈까스백반 신문로본점,서울 종로구 경희궁1길 5 1층 (우)03176,"돈까스,우동","돈까스백반 (초등학생이상),돈까스백반 (미취학어린이)",10500,3.4,56,75,"또갈꺼에요:)/1인 1.5만원은 아니죠... 돈까스백반은 가성비 집이지 1인분 1.5만원을 내면서 먹으러 가겠다는 아닙니다. /맛납니다 하지만 옛날 언덕에 찾기 힘들 때보다 가격이 1.5배? 너무 비싸졌습니다  그래도 일반 돈가스 전문점 뺨은 칩니다/정말 맛있고 좋아하는 동네 맛집인데 가격이 야금야금 올라 이제는 사악해졌음/반찬이랑 다 깔끔하게 맛있네요! 간이 좋아요/지점 내주세여..../가격은 예전에비해 많이 올랐지만 맛은 여전히 맛있다/앉으면 바로 나오는 느낌스~  오래동안 단골인데. 맛이 또~~~~ㄱ 같아서 놀램.  돈까스 생각날때 가는 곳인데. 백반 가격이 조금 높음.  메뉴의 구성이나. 매운소스 추가 등 변화가 쪼금 있음 . 더 흥할듯요!! 소스에 치즈부어주나. 뭐 그런 변화 말이죠~/권태형님 건강하시고 대대손손 해주세요 ㅠㅠ/메인인 돈가스보다 된장찌개랑 미역국이 좋음 정작 돈가스 리필해먹기는 힘들다(배부르고 질려서)/돈까스 백반 15,000원 생각보다 비싸다. 이 가격으로 다른거 충분히 먹을 수 있을것 같음/여기는 절대 사라지면 안돼요 내 마음속 맛집/맛있어요!/가격빼고 모두 만족합니다/달짝한 것이 매우 괜찮았음./딱 코리안스타일 돈까스 정식. 얇은 돈까스 튀김에 소스도 된장과 케챱 두부의 알수 없는 조화이지만 느끼하지않아 계속 들어감. 매번 똑같은 반찬이지만 성경김 양배추 케요네즈샐럿, 멸치베이스 된장찌개는 언제나 좋은 친구/무슨 백반집이 13000원이에요.... ㅎㅎㅎ /많이 드시는 분들을 위한 곳. 이상도 이하도 아닌 딱 그 정도. /굳이 강남의 6,7천원대 돈까스뷔페와 비교하지 않아도 가성비가 크게 떨어짐. 맛은 무난한 편으로 소스 등 개성을 추구했으나 결론은 평범하다는 인상...개인적으론 밥과 반찬 퀄리티를 높여야한다는 생각임/메뉴에는 13,000원 적혀있는데 계산할때 15000원 계산되었습니다.  무한리필 이라길래 돈까스,밥한공기,된장찌개 추가했는데 리필 안되는게 있는거 같아요.  2시 안되서 저 혼자 갔어요. 맛은 평이한 수준이고 처음 나오는 미역국에 계란 푼거랑, 돈까스 소스에 두부든거 말고는 특색 없구요. 아래 댓글처럼 백반이란 간판치고는 쌀 않좋다 라는 생각이 절로 들었...더보기/종업원분이 접시 탁탁 던져서 기분 나빴어요... 바쁜 건 이해하지만... 13000원 내고 밥먹는데 홀대받는 느낌 받았어요/가격도 오르고... 무엇보다 백반집이 쌀이 안좋아서 밥이 너무 맛없네요. 정말 실망입니다/인당 13,00원이면 무한리필로 적당한가 생각해 봅니다.  가성비로 따질때 약간 비싼 느낌이 있었습니다.  인당 만원입니다 하면 누구라도 추천할 만합니다.   서대문 근처는 박물관이 많아 밥먹을데가 고민이예요.  아이들 데리고 올만 합니다. 근데 먹을덴 없어요.  돈가스 싫어하는 아이는 없으니 여기가 좋은 선택입니다만 비싸죠.  법인카드로 손님 모시고 식사...더보기/맛집은 아니고 한끼 식사로 그럭저럭 먹을만 한데 가격 너무개어이없이 비싸서 이제 안감/1인분안파시네요...요즘 어떤세상인데.... /13,000원은 너무 비쌈/맛은 왕돈까스 양념과 먹는맛 인데 이가격이면 근처 허수아비 가는게. . .  인당 12./맛있고 깔끔하긴한데 가격이 점점..ㅠㅠ 무한리필이므로 많이드시는분 강추"
3,시카노이에,서울 종로구 경희궁1길 32 (우)03176,일식,"명란새우오므라이스,드라이카레,토마토치즈돈카츠,아보카도간장새우장밥,소고기스끼야끼",15200,4.2,47,87,"경희궁길 성곡미술관 근처 일본 가정식집.  식사류 15,000원대. 아보카도명란마요밥 먹었습니다. 가게는 작지만 잘 꾸며져 있고 플레이팅도 구색 갖춰 예쁘게 나옵니다. 경희궁이나 미술관 나들이 나갔다가 기분 내며 식사하기 좋은 곳. 식사 시간에 방문하면 대기 있어요./웨이팅있으면 굳이 기다릴 가치는 없는듯…오픈시간 지났고 웨이팅도없고 손님 하나도 없는데 굳이굳이 다 오면 입장가능하다고 밖에 세워둠 근데 내 다음 손님들은 착석하고 일행기다리게 해주시네요ㅎ그렇게 어렵게 먹은 오무라이스의 크림소스는 분리감있는 순두부질감/분위기 좋고 맛있고 친절해요 직원 분들도/반찬도 엄청 많고 비쥬얼 적으로 이쁘나 솔직히 음식이 느끼하고 그걸 반찬으로 해결이 안되는 느낌이였습니다. 반찬으로 해결하기 보단 음식 맛 자체가 조금 더 개선되어야 하지 않을까 싶었어요./회사다닐때 몇번 갔었는데 퇴사하고 오랜만에 가보니 여전히 그자리에ㅠㅠ 역시 맛있습니다! /제로페이 안됨       가맹점이라고 적어두고 붙여두고 카카오맵에도 제로페이된다고 적혀있지만 여하튼 안됨/진짜맛있음 /너무 맛있고 음식이 예뻐요!/버터간장새우덮밥 맛있음 다른 메뉴도 먹으러 갈 예정/명란새우오므라스 맛있어요. 계란찜은 비린내가 심해요./너무 맛있고 깔끔합니다. 작은 튀김 하나 만드는데에도 튀김옷이 샛노랗습니다. 그만큼 좋은 기름을 쓰는것이지요./무난/가격때문에 1번 가고 안가야지 했는데 맛있어서 또 감/명란오므라이스는 크림 소스지만 살짝 매콤해서 맛있는데 토마토치즈돈까스는 약간 돼지고기에서 나쁜 냄새까진 아닌데 돼지냄새가 나서 .. 그래도 반찬도 다양하고 입가심후식까지 나오고 보드러운 계란찜도 나오고 비싸다는 생각은 안든다/좁고 복작하지만 잘 차려준 음식을 먹고 나오는 기분이 참 좋다/명란 오므라이스 제발 드세요.  가게는 작지만 맛과 사장님 성품 하나 믿고 가는 곳.  가격은 솔직히 요즘 풀떼기 한 바가지에 12,000원 받는 곳도 허다해서../정갈하고 아기자기함 일본 특유의 그 느낌이 요리에도 잘 스며있는 편 그렇지만 가격은 조금 비싼듯한 느낌 그래도 이정도면 맛집임 땅땅땅!/음식은 맛있네요.자왕무시는 어제 다녀온 참치집 자왕무시보다 훨씬 더 보드랍고 맛있었어요.직원분들도 친절하시구요.근데 밥이 맛없어요./정갈하고 맛있는 일본가정식.. 사람은 많지만 모든 음식이 다 맛있어요. /무난하게 맛있어요. 여기 근처에 있는 라멘집 가려다가 웨이팅이 부담스러워서 이곳을 찾았는데 너무 좋았습니다. 여기 오면 사과 음료는 꼭 주문합니다./토마토치즈돈까스! 전체적으로 슴슴한 간. 맛있게 잘 먹었습니다! 다른메뉴도 궁금하네요-/몇개 안되는 메뉴에서 두개를 맛 봤는데 둘 다 맛있었어요 그런데 이동네 가격이 다 이렇게 높게 책정 되 있나 봐요.../월요일 휴무임 메뉴가 몇 개 없는데 대부분 맛있지만 몇몇개는 호불호 갈릴 수 있음 공간은 큰 편이 아니라 웨이팅 있을 가능성 있음 인테리어 이쁨/가격이좀 있는편이지만 매우 맛있어요 ~~~ 평일에 시간잘맞춰서 가면한적해서 좋아요 하지만 주문이 무인기계로 이루어지는 점이 아쉽네요 ㅠㅠ 인테리어도 이쁩니다/진짜 맛있게 먹었어요^^ 자주가고싶어요/그릇하나하나 너무 예쁘고 음식도 깔끔하게 맛있는 식당! /오픈전이라고 시간맞춰오래서 주변 카페 있다가 오픈시간 5분전에 갔더니 아까 오픈했다고 없던 사람 잘못이라고 쫓아냄. /존맛입니다살짝비싸긴하디만/전체적으로 맛있습니다./잘 대접받는 느낌. 직장동료 생일되면 가요. /맛있고 구성 좋고 푸짐해요 세트메뉴시키면 고로케나 가라아게같은거 서비스로주는데 좋아요~ /정갈하고 맛있고 깔끔했어요 !   다시 또 방문하고싶어지는 곳 ~ :) ღ"
4,테라스222,서울 종로구 경희궁1길 35 (우)03176,양식,"Course,에피타이저+스프+샐러드+오늘의 쉐프 파스타+버섯 크림 치즈 리조또+Steak/Fish선택1+안심스테이크or생선스테이크+와인 1잔/수제맥주 1잔+각일셔벳/티라미슈/수제초콜렛+커피/차,23,000,25,000,25,000,26,000,26,000",95000,3.4,13,3,"담배좀 그만피세요 요리사님들 ㅋㅋ 아저씨 세명 ㅋㅋ 드러워거지고 진짜ㅋㅋ 요리에서 담배맛날듯/친절도 상상 분위기 상상 맛 상하 가격 중 /법카로만 간다 내돈 내고는 안감/맛도 분위기도 근사한곳./해질녘의 야외테라스는 은근 로맨틱한 분위기를 연출 하더군요/분위기 굿, 치킨샐러드와 마르게리타피자 맛있음/비싼 값은 못해요/가격도 적당하고 음식도 맛있고 분위기는 최고/골목길의 운치를 가득 머금은 테라스, 한가로움 속에 스며드는 맛/Casual Italian"
