,name,address,sort,menu,mean_price,score,people_give_score,review_count,review_list
0,암소서울,서울 종로구 새문안로 76 지하1층 (우)03185,한식,"반가,종가",154000,3.5,33,488,"이정도면 괜찮은 식당이라고 생각 다만 매장 규모에 비해 다소 많은 서버분들이 계속 왔다갔다하는 것이 음식의 가격대에 비하여 미숙해보여 아쉬웠다 하지만 사진촬영 등 기본적인 서비스들은 나쁘지않았어요/17.9만원에 이런 코스는 좀 아쉽다는 생각이 듬.. 메뉴 하나하나가 막 엄청 놀라운 맛은 아니었음 마지막 메인 소고기는 그냥.. 그랬음. 좀 질겼음 (집에 사놓은 꽃등심이 더 맛있어서 당황스러웠음)  그래도 맛있었던 메뉴를 꼽으라면 감태, 업진살, 전복 - 감태는 감태의 향이 좋고, 육회가 부드러워서 조화로움 - 업진살은 고기와 배절임, 각종 풀류가 함께...더보기/런치 반가 코스 괜찮았어요 평일 런치라서 룸으로 예약했고 우리끼리 단독으로 먹으니 안전하고 좋았음 코리안 파인 다이닝으로 한번쯤은 가볼만한 곳이네요 육회 못먹는다고 하니 익혀줘서 좋았음 전복냉채랑 미역국 넘 맛있었음/종가 코스였으며 전반적으로 식재료도 다양하게 쓰였고, 보고 먹는 재미가 있는 메뉴들 다만 메뉴 사이 사이 텀이 약간 긴 편이라 끊기지 않게 서빙이 되면 좋을것 같고, 금액 또한 3-4만원 정도 낮았다면 더 합리적이라는 생각이 들었을 것 같음/메인으로 나오는 고기가 좀 아쉬웠어요/카카오맵은 늘 파인다이닝에 대해 평이 박하다. /먹을만함 가성비는 별로 ㅋㅋ  전복쌈냉채 맛있었음 능이닭만두 맛있었음 생선 걍그랬음 첨밀설 ...; 한우등심 맛있는데.양적다 감태 맛있었음 육개장 개별로/이 가격이면 서울 시내에서 대접 받을 곳이 너무 많다는게 현실입니다./한번은 가볼만한 곳입니다./가격대비 만족도가 아쉽네요. 파워 블로거들을 통한 광고는 많이하는데 막상 가보면 가성비가 떨어져요. 진지한 개선이 필요합니다. 4ㅡ5만원 정도하면 딱일거 같습니다./예술적 플레이팅에 맛에서 정성이 느껴지는 깔끔함/디너 맛있고 배불러요 디저트도 생각보다 귀엽고 맛있는데다가 자개함 등으로 사진도 잘 찍혀요☺️ 도쿄등심 별로여서 같은 계열인 암소서울도  그렇지 않을까 고민했는데 생각보다 괜찮아서 좋았어요☺️  다만 분위기가 좀 딱딱해서  데이트 코스나 기념일 레스토랑으로는 비추고 가족 모임이나 접대 자리로 좋을 것 같아요/음식이 정갈하고 예뻐서 보는 맛 먹는 맛 모두 있습니다. 직원분들은 친절하고 부담스럽지 않은 서빙을 해주십니다. 미리 예약 후 룸에서 드시면 더 조용히 식사하실 수 있습니다./할머니랑 갔는데. 너무너무 만족합니다 ㅎㅎ 부모님과 재방문 예정입니다. /상견례 자리였는데 로비는 QR때문에 좀 혼잡했으나 룸으로 들어가고나서는 서비스 좋았어요! 다만 양이 적어서 배는 메인 고기나올때 밥과 육개장으로 채워야되는데 조금쓰 돈이 아까웠고요,, 특별하게 맛이 있다! 는 아니에요 그냥 기념일날 궁금해서 가보기 좋은 정도에요. 감태는 9천원 추가하면 저거 한덩이 나오는데,, 먹을수록 돈이 아깝다라는 생각은 계속 들었어요...더보기/맛있었어요! 바삭바삭한 식감이 전반적으로 들어있는게 완전 취향저격ㅋㅋ /처음엔 우와하지만 먹을수록 평범해요 (육개장은 진짜별로)  디저트가 특히 너무 별로에요..  하지만 감태 하나만으로 이런 단점이 극복돼요. 진짜 감태 하나만 보고 가는 음식점이라 생각해요 감태짱/맛있는데 양이 너무적어요 ㅠㅠㅠㅠ/맛이 특별하다기보다 분위기가 특별하고 대접받는 느낌ㅋㅋ(특히 룸) 안심은 안구워먹는 편이 보드랍고 채끝은 구워먹는 편이 더 고소하다. 오프닝에서의 감동을 뒤로갈수록 잘 이끌어내지 못하는 편이라 아쉽다. 한 디쉬안에 조화를 잘 캐치하지 못함. 그래도 분위기 생각하면 다시 한번 가볼만 하다./돈아까움 ㅠ/런치 코스 먹었고 가격대비 분위기는 그닥이여서 별 하나 깎음~ 그래도 육회감초 괜춘했고 양은 많아서 좋았음/안심이 맛있었구.. 채끝도 괜춘~ (런치) 둘이 17만원;; 가성비는 그닥! 룸이었는데, 막 고급진 분위기는 아님~ /금액대가 있어, 기념일에 방문하기 좋은 정갈한 가게. 고기 레어로 나오는거 먹어도 맛나고 더 익혀먹어도 맛남. /여기 진짜 개맛있습니다. 양식 싫어하는 분들 가시기에 진짜 딱 좋아요.. 간도 맞고.. 설명도 잘해주시고 각 테이블 식사 페이스 맞춰가면서 메뉴가 줄줄이 나와요. 끊길 틈이 없어요ㅋㅋㅋ / 점심으로 방문해 식사를 했습니다. 와... 저 그냥 밥먹으러 간건데 너무 대접받는 기분이여서 몸둘바를 몰랐습니다. 과하게 친절한게 아니고 무슨느낌인지 아시겠죠?? 요리도 정갈하고 좋았습니다. 다음에 기회가 된다면 부모님께 대접하고 싶은 곳입니다./Korean Course by Tony Jung Chef"
1,포비브라이트 광화문점,서울 종로구 새문안로 76 (우)03185,카페,"FLAT WHITE 9oz LATTE,FLAT WHITE 5oz,PICCOLO,LONG BLACK,LEMON TEA",4040,4.0,36,262,"친절하고 커피맛좋음/베이글이 갓 만든게 아님 ㅜㅜ 납품 빵처럼 포장되어있음 구워도 퍼석퍼석 부숴짐  아쉬웡 ㅠㅠㅠㅠ/베이글이 ... 예전과다르게  컬리 납품용으로.. 바뀌었네요.. ㅠ  커피는맛나요../깔끔하고 커피맛도 가격도 굿굿! 참고로 햇살 맛집/베이글, 커피 모두 맛있고 뷰도 좋은데 좌석이 꽤 불편해요./채광 너무 좋고 무화과 스프레드가 너무 맛있어요../베이글만 먹었을 땐 쫠깃함이 떨어져서 실망했는데, 샌드위치 메뉴가 맛나요/예쁘다 친절하다 커피도 맛있다!/천고가 높은 개방형 공간, 여유로운 음악, 조용한 사람들. 가장 훌륭한 것은 맛있는 크림치즈. 건물 로비에 있어 오래 머물 곳은 아니지만 지나는 길에 들르고 싶은 곳./맛있어요!/햇볕 맛집/드립커피 맛있음 크랜베리크림치즈가 대박 상큼하고 맛있음 채광이 좋아서 예쁜 대신 좀 눈부시고 좌석이 조금 불편/직원분들도 너무 친절하시고 너무 좋아요 ㅎㅎ/이것은 커피인가 음료수인가 커피가 연해요 신맛원두로 시켰더니 예상보다 너무 시네요 저한체는 잘 안맞는것 같아요/공간이 너무 예뻐요! 베이글도 맛있고요!/존맛탱구리!!!!! 직장이 포비 근처인게 감사할뿐 ㅎㅎ 이렇게 맛나는 라떼도 처음이고 베이글은 말해모해… 크림치즈도 존맛탱입니다ㅠㅠ/여기랑 을지로점 좋음. 포비는 직원분들 교육도 잘 되어 있고..커피는 맛있는데 싸고..매번 바뀌는 꽃꽂이와 공간도 센스있고 다 좋은데... 코시국에 포크도 주셨음 좋겠음. 손으로 베이글 먹기 좀 그러함.. 비닐장갑은 좀 그런가요ㅋ 샌드위치도 판매해주세요...샌드위치 맛있던데/커피도 맛있고 테이블마다 꽃이 있어서 기분 좋았어요 :-)  주차도 한시간 무료라 잘 이용하다가 갑니다. /요즘 왜이렇게 여기 라떼가 생각나는지 ㅎㅎ/플랫화이트 존맛탱 /커피 괜찮음~ 근데 매장이 너무 좁아서 테이크아웃 했어요ㅠㅠ/너무 좁아요/디타워점은 포장도 다 데워서 해주시는데 여기는 베이글만 달랑 주더라구요ㅠㅠ 커팅도 안된채로 커팅칼도 없이 줘서 힘들게뜯어서 먹었어요 ㅠ_ㅠ 디타워점이 훨씬 좋아요 /베이글 굿 /애정하는 커피집중 하나. /생각보다 엄~~~청좁아요ㅠㅠ 잘찍은사진 보고갔다가 바로나옴 ㅠㅠ 건물 회사사람들이 테이크아웃 할만한곳이네요/생각보다 공간이 좁고 드링크 메뉴가 한정적임 그리고 빌딩 내에 있어서인지 엄청 조용함 베이글은 플레인까지 다 맛있었어요 :)"
2,야마야 신문로점,서울 종로구 새문안로3길 12 신문로빌딩 1층 (우)03182,일식집,"모츠나베정식,평일 점심특선,13,900,소대창 된장소스 볶음정식,평일 점심특선",15900,3.2,34,10,"맛있었어용 ㅎ ㅎ 볶음밥 존맛탱/모츠나베 소곱창 너무 질겼음  느끼한데 사이드 나오는건 하나도 없음 우엉 건더기도 그냥 나무껍데기 씹는 맛  그 흔한 락교도 없음  재방문의사 X/제 취향은 아닌걸로/에휴,, 모츠나베 정식 먹었는데 곱창은 타이어처럼 질기고 양도 적음 ㅋㅋ 쓸데없이 우엉만 잔뜩 들어서 역겨웠어요  둘이서 5만원 넘게 나왔는데 먹은게 없네요 ㅜ 사이드 메뉴도 하나같이 짜고 맛없고 감자샐러드+계란말이+싸구려 수입산 닭튀김 끝. 이 정도는 보통 공짜로 주는 밑반찬 아닌가요?  법카or호갱 전용 식당인듯 딴데가세요 제발/양 너무 적음/이렇게 매너 안좋은 식당은 처음 추천받아 갔는데 점심때 지나고 가니 손님은 딱 둘이었음 나하고 다른 자리서 혼밥하는 한 분 그런데 마치 장사 끝내고 또는 장사 준비하면서 주방 안쪽에서나 나눌법한 얘기들을 큰 소리로 떠드는데.. 이번 주 누가 휴무냐 아니냐 무슨 재료가 남았냐 아니냐..  손님 안중에도 없다는 듯이 자기들끼리 떠들고 낄낄대는 모습이라니.. 스...더보기/걍 보통 일식당 깔끔해요  어떤건 맛있고 어떤건 가격대비 좀 비싸다고 느껴지는 ?? 특히 연어 카르파쵸는 .. 가격대비 양과 맛 모두 부실해요 레몬맛도 후추나 올리브오일도 없고 양파새콤하게 절여서 걍 마요네즈 뿌리고 파프리카 올린게 끝인 .. 그리고 안경 안쓴 서버 불친절해요 존대는 하지만 까칠한 말투 손님한테 물건 건낼때 한손으로 줘요/무난하게 가기 좋아요 양에 비해 가격대는 좀 있음/청포도사와 냠냠굿/갓주먹밥이 맛있어요. 명란계란말이는 비린내가 심해서 별루.. 아게다시도후는 좀 짰어요. 사진이랑 토핑도 달랐어요. 오로지 갓주먹밥하나로 별4개드립니다/한때 법카들고 자주 갔었다/가메니 먹엇는데 음식이 차가웠어요.../된장 베이스의 육수와 기름지고 고소한 대창 그리고 우엉 & 양배추의 조합이 예술인 모츠나베는 배리 굿이었다. 하지만 스끼다시도 전혀 없고 다른 안주들은 많이 아쉽네 ㅠㅠ/가게 분위기 좋음.  음식도 특이해서 여자분들이 좋아함. 가격은 비싼편. 일본 술만 팔고 한국술은 안팔아서 앞으로 안가기로 했음./음식이 너무 짬.../광화문역 모쯔나베집  간장베이스 모쯔나베고소하고 단백함 국묿부터가사기이 명란계란 달달하고 맛있음 ㄱ/기대하지 않고 갔다가 대체로 만족한 집..가격대가 높아보일 수 있으나 꼬들밥과 명란젓을 좋아한다면 강추임!/점심 정식 먹으러 가는곳 모츠나베 정식 가성비 굿 고구마소주 잔술로 파는거 넘 좋아서 자주감/Anythin' with Pollack Rolled Egg with Pollack  Also in Yeoido/미소 모쯔나베와 명란계란말이/가을 밤과 어울리는 메뉴 곱창전골 생맥주 계란말이 굿 늦게가면 죽을 못먹어요 ㅜ ㅜ /곱창 싫어하는데에도 불구하고 모츠나베가 고소하니 맛있었다. 분위기도 괜찮고 맘에 드는 곳임./다 맛있다! 명란요리와 모츠나베(곱창전골)이 유명한 이지카야 뭐하나 빠지는거 없이 맛있고 분위기도 좋음 가격대는 좀 있는편"
3,옴 광화문점,서울 종로구 새문안로 103 선광빌딩 지하 1층 (우)03183,인도음식,"옴 스페셜 세트 (1인),그린샐러드+치킨버섯스프+서모사+믹스치킨티카+커리메뉴에서2가지선택+난선택+한국밥/인도밥+라씨 또는 탄산류 1인/1개,16,000,17,000,19,000,35,000",31000,4.2,15,27,
4,뉴오리진 광화문점,서울 종로구 새문안로 96 (우)03186,카페,"카페 아메리카노,카페라떼,티라미수 크림 라떼,뉴오리진 차이 티,오렌지&사막 당근주스",5680,4.0,14,64,
5,반포식스 광화문점,"서울 종로구 새문안로9길 9 2, 3층 (우)03183",동남아음식,"에그롤,연어샐러드,푸팟 퐁커리,크림새우,베트남식 유린기",19200,2.9,18,43,동행한 이의 입맛 존중의 의미로 별은 2개/맛은 평범한데 가성비가 떨어짐/인테리어가 젤 맘에 들어요 국수양은 9000원치곤 이근방에서 젤 적은듯 싶어요 숙주 고수 다 싱싱해서 좋았구요 국물맛은 닭육수인가 싶을정도로 밍밍해요 글고 국물이 담다 만것처럼 있어서 더 달라고 두번을 말했으나 갖다준다고 하고 안갖다줌 다른 테이블 치우면서 셋팅하면서 먹고 있는 손님의 서비스를 귓등으로 듣고 흘리는 이곳 알바생들은 기본 두번은 불러야 고개들...더보기/해물 쌀국수 먹었는데 홍합이 하나같이 다 신선하지가 않네요. 그때문에 국물맛도 찝찝하고 꾸리한 냄새도 나고. 자신 없으면 메뉴에 두지를 말지/쌀국수나 볶음밥 같은 건 괜찮은데.. 푸팟퐁 커리 절대 먹지 마세요... 너무 맛없어ㅠㅠ ㅅㅇㄱㅅㅌ에서 먹던 거 생각하고 시켰는데.. 오뚜기 3분카레인 줄.... 진심 돈아까웠음./여러 메뉴들이 맛있습니다. 평일 점심시간만 아니라면 널찍한 장소에서 편히 식사하실 수 있어요./여기 맛있어요 평점이 왜이렇게 낮지? 아! 해물은 별로네  그래도 다른건 맛있음/볶음쌀국수는 반포식스가 최고/지안한테 추천하고 들어왔다가 아래 평점 보고 어? 싶어 한 자 적어요  여기 맛 좋고 장소 괜찮아요  인테리어 분위기도 세련되고 좋지만  음식 다 맛있어요 ~ 지인들한테 주저하지 않고 추천하고 있습니다 ~/가성비 별로 차라리 미스사이공가서 두개 먹는게 더 나음  고기너무 적게들고 스프링롤도 별로/평타이상의 맛이나.. 가성비는 떨어짐/점심시간 4인셋트에 포함된 월남쌈 준비가 30분 걸린단 이유로 다른거 주문하라구 하면 왜 메뉴에 있는건가요? 그리고 더운 여름날에 작은캔 사이다에 종이컵 써빙은? 얼음좀 넣은 그래스잔이 없다고. 아휴... 알바생 서비스정신좀 교육해주세요. 뭐 확인하러 다시 방문 안할테지만.../음식은 맛이잇으나 종업원들의 태도가 먹을려면 먹고 말라면 말라는식이며 예약을하고갓는데 자리세팅도 안되어잇고  알바같은데 종업원은 손님말 안끝났는데 그냥 가버리질 않나 사장님은 일하는 사람들 때문에 식당이미지 깍아먹으실듯  
6,투썸플레이스 광화문점,서울 종로구 새문안로 85 (우)03182,투썸플레이스,표기안함,표기안함,3.8,16,13,"cj포인트 많아서 종종갔는데  이제 안된다고 해서 안가게돼요ㅠㅠ/넓고 산뜻해서 좋아하는 곳인데.. 시끄러운 음악을 계속 반복해서  크게 틀어놔서 집중이 안됩니다.  시끄럽고 똑같은 노래 계속 들려서 3층 볼륨좀 줄여달라고 했더니  감감 무소식..  아마 알바생들이 시끄러운 노래  무한반복으로 듣는걸 즐기는듯..  3층이 북카페 컨셉인데  잔잔한 음악 틀어놔야지 그런 노래 깔아놈 누가 올까요?  /공부하기 좋은 장소/아주 많은 문제들이 있지만 매니저를 갈아치우는 게 최우선일 듯, 운영 자체가 엉망이어서 당연히 욕이 나오게끔 하는데 욕받이는 알바생들이 하고 자기는 카운터 뒤에 쏙 빠져 있음 /케이크 종류가 많이 없어여ㅜㅜ  아메리카노 진짜 맛이없어서 놀랐어요;; 그나마 3층은 조용하니 공부하기 좋습니다/친절했으면 좋겠어요 청소도 자주 하면 좋겠어요/좋은데 노래가 너무 큼.... /시끄러운 광화문 카페들 중 그나마 조용한 곳/3층의 라이브러리 컨셉 공간 마음에들어요. 스터디 공간 및 라이브러리인만큼 배경음악 소리는 좀 잔잔한 음악으로 덜 크게 틀었다면 별 다섯개. 공간은 좋았지만 배경음악이 너무 요란하고 귓청을 때려서 한시간 이상 지나니 지치고 집중력이 떨어졌어요. /조용해서좋음/카페 깔끔하고 크고 층수 3층까지 있음(1층 주문 나머지층 자리) 1인용 자리도 있고 다인용 자리도 있음 와이파이 속도 나쁘지 않은편  조용함 화장실 내부에 있음 직원들이 자주 돌아다님. 청결에 신경 쓰는 매장 같음 (항상 고생하십니다ㅠ)/케잌 천국, 분위기 좋음"
7,커피원,서울 종로구 새문안로3길 12 (우)03182,커피전문점,"샌드위치+아메리카노,샌드위치,브레드푸딩,휘낭시에,스콘",4400,4.9,20,60,"샌드위치, 브레드 푸딩, 쿠키, 휘낭시에 먹어본 후 모두 강추 잠봉뵈르 샌드위치 대박.. 버터가 햄 위로 부드럽게 녹아내리는 가운데 후추가 맛 균형 잡음 /브레드 푸딩은 이 집에서 처음 먹었는데 훌륭한 디저트였음 / 쿠키 자체 맛이 찐해서 감탄했은데 가운데 크림이 풍미를 더 끌어올림. 사장님 매너까지 대박..! /듣던대로 사장님이 정말 친절하세요! 바나나푸딩 양도 많고 진짜 맛있어요. 특히 하루 정도 숙성하고 먹으면 더 꿀맛! 휘낭시에는 쫀득보단 부드러운 식감이고 쿠키는 달달한 편이에요. 다음엔 샌드위치랑 크림빵도 먹어보고 싶어요!/브레드푸딩 바닐라맛 존맛탱 황치즈 푸딩은 약간 과했고 황치즈는 쿠키가 너무맛있어요/사장님 진짜 너~~~무 친절하셔요 진짜 너무너무! 그래서 카페 다녀오면 기분이 좋아져요 그리고 샌드위치도 디저트도 다 맛있어요 완전 추천입니당 ♡ ♥ /후기가 칭찬일색이기에 궁금해서 다녀왔습니다.  샌드위치 정말 맛있고 든든하네요! 특히 아끼지 않고 넣은 루꼴라 샌드위치에 감탄했습니다. 사장님의 친절에 기분 좋은 에너지까지 얻어갑니다! /최고의 친절 / 최고의 맛/우연히 찾았는데 샌드위치랑 쿠키랑 푸딩 너무 맛있어서 계속 생각남 특히 내가 먹어본것 중 레드벨벳쿠키 리코타샌드위치 바질감자샌드위치 얼그레이무화과푸딩 블루베리치케푸딩 바나나푸딩 진짜 맛있음 ㅜㅜㅜㅠㅠㅠ 무화과스콘도!!! 사장님도 너무 친절하셔서 기분 좋아지는 곳 근데 푸딩은 진짜 최소 다음날에 먹어야함 훨씬 맛있다!!!/푸딩 쿠키 너무 맛있고 사장님 진짜 친절하세요! /브레드푸딩 존맛 쑥쿠키 ㅇㅇ/사장님 너무 친절하셔서 기분좋아지는 하루였습니다. 단골 예약할게용/찾기 어려운 장소. 첫날 먹을 땐 너무 달고,느끼.  다음날,다다음날 먹는데 너무 맛있음. 사온 다음에 하루이틀숙성후 드세요/크랩샌드위치를 시켰는데 충실해 맘에들었음 샌드위치가 세로로 세워져있어 중력으로인한 겨자소스국물 아래처짐 현상이 발생! 시작의 겨자 맛은 미약하였으나 끝은 창대하였노라!!  2번째 방문 빵푸딩황치즈 리뷰가 좋은것같아서 시도하였는데 너무달아서 먹는 중반 이후 벼라별 생각이 들면서 두려웠음  '이거 다먹으면 얼마나 운동해야하는거냐' '맛이 왜 점점 지겨워지는거지...더보기/브레드푸딩 대존맛탱/사장님이 친절하시고 바나나푸딩 맛있어요 /푸딩이 맛있어요/푸딩 혼자 먹기에 양이 너무 많아요ㅠㅠ 가격 원래대로 낮추고 크기도 줄어들었으면 좋겠어요 .. ㅠ3ㅠ 그리고 엄청나게 기대해서 그런지 막.!!! 존맛!! 특별한 맛은 아녔어요 ㅎㅎ 흔히 생각할 수 있는 그런 평범한(?)맛입니당 그런데 사장님 넘 친절하셔유 ㅠㅠ 이거때문에 자주 가고싶을 것 같아욯ㅎㅎ 저는 맛이 생각보다 평범하다고 생각해서 가격도 평범하다고 ...더보기/최고로 친절하시고 맛있어요 저렴하구/맛있는집이 숨어있었네요 ㅎㅎ/푸딩이 맛있어요/푸딩 혼자 먹기에 양이 너무 많아요ㅠㅠ 가격 원래대로 낮추고 크기도 줄어들었으면 좋겠어요 .. ㅠ3ㅠ 그리고 엄청나게 기대해서 그런지 막.!!! 존맛!! 특별한 맛은 아녔어요 ㅎㅎ 흔히 생각할 수 있는 그런 평범한(?)맛입니당 그런데 사장님 넘 친절하셔유 ㅠㅠ 이거때문에 자주 가고싶을 것 같아욯ㅎㅎ 저는 맛이 생각보다 평범하다고 생각해서 가격도 평범하다고 ...더보기/최고로 친절하시고 맛있어요 저렴하구/맛있는집이 숨어있었네요 ㅎㅎ/푸딩이 맛있어요/푸딩 혼자 먹기에 양이 너무 많아요ㅠㅠ 가격 원래대로 낮추고 크기도 줄어들었으면 좋겠어요 .. ㅠ3ㅠ 그리고 엄청나게 기대해서 그런지 막.!!! 존맛!! 특별한 맛은 아녔어요 ㅎㅎ 흔히 생각할 수 있는 그런 평범한(?)맛입니당 그런데 사장님 넘 친절하셔유 ㅠㅠ 이거때문에 자주 가고싶을 것 같아욯ㅎㅎ 저는 맛이 생각보다 평범하다고 생각해서 가격도 평범하다고 ...더보기/최고로 친절하시고 맛있어요 저렴하구/맛있는집이 숨어있었네요 ㅎㅎ/푸딩이 맛있어요/푸딩 혼자 먹기에 양이 너무 많아요ㅠㅠ 가격 원래대로 낮추고 크기도 줄어들었으면 좋겠어요 .. ㅠ3ㅠ 그리고 엄청나게 기대해서 그런지 막.!!! 존맛!! 특별한 맛은 아녔어요 ㅎㅎ 흔히 생각할 수 있는 그런 평범한(?)맛입니당 그런데 사장님 넘 친절하셔유 ㅠㅠ 이거때문에 자주 가고싶을 것 같아욯ㅎㅎ 저는 맛이 생각보다 평범하다고 생각해서 가격도 평범하다고 ...더보기/최고로 친절하시고 맛있어요 저렴하구/맛있는집이 숨어있었네요 ㅎㅎ"
8,빌리엔젤 광화문점,서울 종로구 새문안로 92 1층 (우)03186,디저트카페,"아메리카노,카페라떼,바닐라라떼,카페모카,레몬에이드",5100,3.4,17,23,
