,name,address,sort,menu,mean_price,score,people_give_score,review_count,review_list
0,우야지막창 동대구역점,대구 동구 동부로30길 34 (우)41243,"곱창,막창",표기안함,표기안함,4.5,47,144,
1,사파키친,대구 동구 동부로34길 10 1층 (우)41244,베트남음식,"쌀국수,팟타이 (새우),분짜,나시고랭,쉬림프라이스,칠리치킨",8166,4.1,59,275,"회전율 빠른편이구요 음식도 맛있었어요!! 팟타이 good/고수 후추 부족 ㅋㅋㅋㅋ 나머지는 완벽함 /조기마감? 전화하고 4분만에 왔는데 조기마감이라니. 어이가 없어서. 그럼 전화할 때 말해주든가. /사파키친은 말해뭐해/다 먹어봤는데 진짜 모든 메뉴가 맛있어요/맛있고 양 많은데 심지어 쌈.... 근데 식당도 예쁨 굿/직원분도 친절하고 음식도 맛있음 쉬림프 라이스는 좀 매움/ㅎㅎ베트남에서 먹던맛은아니지만 한국식맛 재해석 맛나게잘 먹었습니다 라임이필요해요 요청하면 주시는가ㅎㅎ 사파에서  바베큐꼬지 마이먹엇는데 ㅠㅠㅎㅎ/대기할 정도까지의 이유가 있진 않아요/대기엔 이유가 있었네요 < 동의  운 좋게 바로 들어갈 수 있었는데 나갈 때 20시 20분이었음에도 웨이팅 3팀 정도 있었음 진짜 너무 추운 날이었는데도 ... 새로 생기는 식당도 많고 식당 자체가 정말 많아서인지 굳이 갔던 곳 또 안 가게 되던데 여긴 꼭 또 오게 될 것 같음 고기가 비리지도 않아서 짱/대기엔 이유가 있었네요/맛있고 가성비좋음 근데 웨이팅있음/존맛이에유ㅠㅠ 몇번째 방문인지...ㅠㅠ♥ /맛있고 직원분들도 친절하십니다.  다만 전반적으로 동남아 맛보다는 많이 한식화된 맛있네요. /동남아 보다 중화맛 접시에 이가 나갔어요/주말 점심시간에 갔더니 웨이팅 1시간 가까이 함 근데 싑...나시고렝 맛이 미쳤음!!!!!!!!!!!! 쌀국수도 고수 얹어 먹으면 맛있긴 한데 나시고렝이 미쳤음!!!!!!!!!!! 또 먹고 싶당/퓨젼 태국음식이라 소개한 만큼 전통적인 태국의 맛은 아니지만 맛있습니다.  그런데 집기류의 위생이 너무 좋지 않습니다. 특히 물병의 뚜껑부분은 갈색때가 껴있을정도로 비위생적이였습니다. 작은 부분까지 신경싸주시면 더 대박날거 같습니다./갈 때마다 웨이팅 10분~20분정도 했던거같아요 맛있습니다! 테이블 간격이 좀 좁아요/웨이팅 조금 있음,회전율 빠르고 음식 빨리 나옴,분짜,쉬림프라이스 시켰음-달고 짜고 매콤하고 맛있음~엽떡먹는맛~다른테이블도 다 이거 시켜먹음~퓨전음식임~양은 디저트 생각나는 정도~먹은지 한시간 지났는데 입이 계속 찝찝함;조미료많이 넣은듯~셋팅이 이쁨-인스타용, 찾아갈정도는 아님~ /다른 건 모르겠고, 치킨은 진짜 맛있다./둘이서 3개 시켰는데도 싹싹 비울 정도로 맛있습니다. 직원분들 모두 친절하구요./사람은 많은데 가게와 테이블 사이간격이 너무 좁았어요. 음식맛은 그냥 괜찮았는데 양이 너무 적고 기다린거에 비해서는 맛있진 않은듯 해요/조금 일찍 가서 웨이팅을 많이 하진 않고 들어갔어요! 맛있어요! 양이 많은 편은 아니지만, 가격대비 만족했고 아늑하고 전체적으로 마음에 들었어요ㅎㅎ 직원분들도 친절했어요/웨이팅이 있었지만 그거 기다릴수 있는 맛이었어요 넘 맛있어서 사진만 봐도 또 먹고싶음ㅠㅠㅠㅠㅜㅠㅠㅠㅠㅠ/맛있음 고수 좋아하면 더 달라고 하면 더 줌 3명이상 가면 웨이팅 늪에 빠질수도 있음 웨이팅을 하면서 먹어야 된다고 물으면 음.../두번째 방문이에요:) 처음 대구로 놀러갔을때 방문하고 너무맛있게 먹어서 대전와서도 계속 생각났는데 2년이 지나고 가도 여전히 맛있네요 앞으로 대구 방문할때마다 가게될 것 같아요!/웨이팅이 긺 웨이팅 할 정도는 아니고.. 쏘쏘바리/한국에서 먹어본 쌀국수중에 가장 맛없음. 웨이팅 왜하는지 이해불가... 재방문 의사 제로/맛있습니다. 팟타이랑 새우볶음밥 조합은 환상적이에요./맛있습니다  분짜는 찍어먹는 식이 아니라 소스와 비벼져서 나옵니다 새우 라이스도 밥도 독특하고 맛있습니다 치킨은 닭강정 느낌으로 평범하네요"
2,인문공학 동대구,대구 동구 동부로 156 1층 (우)41244,카페,"베이직 아메리카노,밀크슈페너 (ICE),추천,4,000,변동가격,변동가격",5000,3.8,35,266,"크림브륄레, 까눌레 맛집. 디저트 카페려니~했는데, 커피도 엄청 공부하고 연구하는 집인듯. 담에는 커피 좀 제대로 마셔봐야 겠어요./카페 분위기가 좋고 예뻐요. 근데 크림 브륄레는 생각보다 그냥 설탕맛만 나서 별로였고, 망고 주스는 양이 너무 너무 적었고 셨어요 ( ᵕ‧̯ᵕ̥̥ ) 유자 레몬에이드는 강 추 ! /크림브륄레 맛있어요/신천동은 인문공학 보유동네.. ☕️/크림브륄레는 넘 미니미하구여 맛은 쏘쏘..  커피는 그냥그럼 인테리어 내부랑 화장실 깔끔해서 좋아요. /마들렌 너무 맛나요  크렘브륄레 너무 맛나요  빵집해도 성공할 것 같은 맛..  커피도 너무너무 맛있어요..  적게 일하고 많이 버세요.. 건강하셔야 자주와서 먹을수있으니까..  ㅡㅡㅡ  항상 주문할 때 하나씩 주문하고 디저트는 꼭 두번이상 추가주문하게 되는 마약같은 맛입니당..   최고.. 동대구 근처 올때마다 마들렌은 꼭 들러서 사먹어요/한번쯤 방문할 가치가 있음/디저트 맛있으요 커피가 진하지만 음 만족합니다 /아인슈페너 너무 맛있어요 보통 다 쪼개진 맛이 나기 마련인데, 거품이 쫀쫀해서 더 잘 어우러지는 것 같아요/커피랑 크렘브륄레 다 너무 맛있습니다 ㅎㅎ 사장님도 친절하시고 동대구역 앞이라 찾기도 쉬워요!!!/평일 낮에 가서 그런지 손님도 아예없고 조용하니 넘 좋았습니다 ㅠㅠ 크림브륄레는 진짜 꼭 드세요!!/사람이 ㄹㅇ 많음 크림브륄레 가성비 굿 옥상에서 춤추기 좋음 /괜찮은데 사람이 너무 만타 ( ´Д`)y━･~~/맛 평타, 가게 테이블 간격 좁아서 불편함(시끄러워서 앞사람 말 소리가 안들림), 항상 사람 많음. 2번 정도 갔지만 그때마다 직원들 불친절하다고 느낌. 굿즈를 판다, 주택을 개조했다  이거 외에는 특이한 점 없음. /커피가 맛있고 편안해서 좋아하던 공간이에요 코로나 종식되고 얼른 열어주세요..!/쩝/크림 브륄레 밤 브륄레 존맛 근데 양이 아아아앙아ㅏ주 아쉬워요/따뜻하게시켰는데 걍 미지근해서 나왔고 미지근하다고 따뜻하게해달라하니 안된다하네요 ㅡㅡ 따뜻하게란 말을 모르는듯..../역이랑 가깝고  라떼가 맛있습니다/크림브륄레 먹으려고 찾아갔는데 매장에서 먹고갈거면 디저트외에 음료를 주문해야한다고 하고 ( 1인 1음료 필수 )  테이크아웃 하겠다니 지금 준비된것이 없다고 하고   왜 디저트류는 1주문으로 안쳐주시는지 궁금하네요  아메리카노 4500원이고 크림브륄레는 4000원이면 비슷한거 아닌지 ...싶네요  캐리어 끌고갔는데 못먹어서 아쉽기도하고  포장이라도 가능했으...더보기/카페도 이쁘고 디저트류 맛있어요 !/아주 새로운 공간이죠. 깔끔하고 정성이 깃든 곳 ^^*/특별한 공간!!/크림브륄레 먹으려고 찾아갔는데 매장에서 먹고갈거면 디저트외에 음료를 주문해야한다고 하고 ( 1인 1음료 필수 )  테이크아웃 하겠다니 지금 준비된것이 없다고 하고   왜 디저트류는 1주문으로 안쳐주시는지 궁금하네요  아메리카노 4500원이고 크림브륄레는 4000원이면 비슷한거 아닌지 ...싶네요  캐리어 끌고갔는데 못먹어서 아쉽기도하고  포장이라도 가능했으...더보기/카페도 이쁘고 디저트류 맛있어요 !/아주 새로운 공간이죠. 깔끔하고 정성이 깃든 곳 ^^*/특별한 공간!!/크림브륄레 먹으려고 찾아갔는데 매장에서 먹고갈거면 디저트외에 음료를 주문해야한다고 하고 ( 1인 1음료 필수 )  테이크아웃 하겠다니 지금 준비된것이 없다고 하고   왜 디저트류는 1주문으로 안쳐주시는지 궁금하네요  아메리카노 4500원이고 크림브륄레는 4000원이면 비슷한거 아닌지 ...싶네요  캐리어 끌고갔는데 못먹어서 아쉽기도하고  포장이라도 가능했으...더보기/카페도 이쁘고 디저트류 맛있어요 !/아주 새로운 공간이죠. 깔끔하고 정성이 깃든 곳 ^^*/특별한 공간!!"
3,레이지모닝 동대구점,대구 동구 동부로30길 60-1 (우)41249,디저트카페,"아메리카노,카페라떼,자몽에이드 (ICE),자몽차 (HOT),마르코폴로",4600,4.5,14,112,"딸기 크로와상 안에 든 크림이 우유에 딸기 말아먹는 추억의 맛이 나네요 가격만 좀 저렴하면 매일 갈 것 같아요 버터 프레츨은 진짜 먹어야 됩니다 두 번 드세요 저는 팥을 안 좋아해서 앙버터 말고 그냥 버터로 먹었는데 단순하고 건조하지만 씹을수록 단짠이 극도로 느껴지는 맛입니다 아메리카노는 평균 이상이나 디저트에 주력한 가게 같습니다 샤케라토는 비추(헤이즐넛...더보기/아 앙버터 프레첼 제가 참 좋아하는데요,  와서 앉은자리에서 앙버터프레첼2개와  크로와상 라우겐 헤치웠네요 앙버터 프레첼뿐만 아니라 버터 프레첼, 앙버터 치아바타까지 구비한 빵진열대를 보고  이 집 된 곳이다 생각했습니다  빵많 많이 파시고 부자되세요/식후엔 깔끔하게 아아/디저트도 커피도 맛있음 대신 의자가 너무 불편 ,,/좋아요/다 맛있었어요~~ 다른것도 먹어보고 싶네요 !!/좋아용 다들 너무 친절하셔요 ! 근데 베이커리 카페라기엔 빵들이 무난했어요./대구시청옆에 있는건 없어졌나요? 친절하시고 빵도 맛있읍니다/나쁘진않아요"
4,우즈베이커리카페,대구 동구 송라로10길 2 (우)41259,디저트카페,"에스프레소 (HOT),아메리카노,더치 아메리카노 (ICE),더치라떼 (ICE),카페라떼",5000,3.6,18,65,"괜찬네요 잘먹엇어요 /딴 거 다 좋은데, 시끄럽게 굴고 뛰어다니는 애들을 통제하려는 의지가 전혀 안보이고 오히려 직원이 애들 우쭈쭈하고 잘한다고 놀아주고 그러네용... 키즈카페가 아닌데 ㅎㅎ... 단순 방치하는 거는 어쩔 수 없지만 오히려 그러는 건 애들 더 떠들고 난리치라는 건지... 그게 시끄럽고 불편한 사람 되게 나쁜사람 되는 거 같아서 좀 그렇네요/직원들이 많이 힘든가 보네요.. 신경질적이고 불친절해졌어요. 예전엔 안 그랬는데/빵맛있어요/요거트 스무디가 마싯어요/우즈는 역시 최고. 수성못서도 자주 갔는데 여기도 최공/빵 개노맛에 알바생들끼리 넘 웃고 떠드는 분위기 친절한거도 아니고... 넘 별로라 아쉽 ㅜ /생각하지 않았는데 이런 혜자 빵집이 맛도 좋고 대부분 만족 근처에 살고 싶으다요/식빵을 잘라 주는데 크기 차이가 두배는 나게 자라주네요 초보자 연습으로 자른걸 주는건 아니지 않나요/주차장 협소한 것빼고는 만족./친절/음식맛은 그럭저럭 괜찮지만 서빙하는 직원들 교육이 잘못된건지 기본인성이 잘못된건지..영 불친절합니다.  1인분 12000원 짜리 파스타 주문했는데 셀프로 카운터까지 손님이 직접 운반해야 하는것도 웃긴 시스템이지만(하필 자리가 맨구석이었고 2인분 운반하다가 팔뽀개질뻔 ㅋ) 그건 시스템 문제니 웃어넘겼습니다.  그런데 받으러 갔더니 트레이에 음식만 있고 수저세...더보기/아메리카노 맛있고 빵도 괜찮아요~ 넓고 주차하기 좋아요"
5,만복이쭈꾸미낙지볶음 동대구점,대구 동구 동대구로 448 (우)41250,"해물,생선","쭈꾸미볶음,낙지볶음,쭈꾸미철판 (중),낙지철판 (중),왕새우튀김 (4마리)",17400,4.1,18,105,
6,아눅,대구 동구 동부로 158-5 (우)41244,카페,"아메리카노,라떼,바닐라라떼,얼그레이,바나나쥬스",5700,3.4,14,106,
7,고기굽는남자 신세계점,대구 동구 동부로 166 (우)41244,"육류,고기","특수부위 (120g),항정살/갈매기살/가브리살 중선택,10,500,10,500,16,000,10,000",10500,3.8,19,68,"고기맛이 예전만 못해요.. 너무 바짝 구워주고 가격대비 별로였어요/다른건 몰라도 고기는 진짜 맛있어요 껍데기살... 꼭 드세여/맛은 훌륭하나 지연이 좀 심한편/몇번갔는데 자꾸 빈정상하네요 삼겹3개 주문하면서 밥1공기 냉면 주문했는데 밥1공기 빼고 주셔서 다시 주문했는데 또 안주심 그래서 삼겹2개 더시키고 밥2공기 다시주문했더니 바로주셔서 먹고 계산할려는데 밥3공기 찍힘 이게 무슨일? 2공기 먹었다고했더니 미심쩍은듯 주문확인 다시하면서 결제 하시네요 정찝찝하시면 cctv 확인해보세요 밥그거 얼마한다고 먹은거 안먹었...더보기/고기를 너무 못 구워요ㅠㅠ 사람이 많아서 응대가 느리고 정신없음/고기 맛있게 구워주심/네명이서 갔다. 첫번째 구워준 직원 퍼펙트! 두번째 구워준 직원.. 고기 좀 분홍빛이 도는데 자신있게 드셔도 됩니다. 하길래 이 집 돼지는 미디움레어로 먹어도 되는가보다 하면서 먹었다. 결국 그 날 4명에게는 엄청난 시련이./3인분 기본인건 앞에 써두셔야겠고, 고기를 까맣게 태우시던데 이부분 개선 필요합니다./가족 외식으로 항상 가는곳! 고기 다 구워주고 친절하고 맛도 최고에요/고기 먹고 싶을때, 가족들이랑 무조건 여기만 가요ෆ  직원분들 참 친절하시고 열정 넘치시고 알아서 잘 구워주시고 ! 밑반찬도 단순하지만 맛있어요~ 여름에만 파는 사이드 메뉴 팥빙수도 맛있고, 냉면•된장찌개 다 맛있음 ◡̈ 껍데기도 꼭꼭 드세요ㅎㅎ/솔직히 맛있긴 진짜 맛있음!!  그건 보장 근데 고기를 기다리면 구워준다는데 10분을 기다려도 안해줌..;; 벨을 세번 누르고서야 사람이 오고 국자랑 앞접시 달라고 세번을 말하니까 줌 ㅠ 지금 고기 구워주기 기다리는 상태인데 안와서 서운함... 고기 끊기면 짜증나는거 알죠?/최고/고기맛있는집....../구워주셔서 좋고 명이나물이 진짜 맛있어요 1인분에 10500원이라 가격대는 좀 있지만 만족스럽습니다/삼겹살을 다 구워서 잘라주십니다 손님이 고기에 손댈필요없는집.   숙성된 두터운 삼겹살도 맛이좋아요"
8,뼈대있는돼지집 본점,대구 동구 동부로30길 57 (우)41248,"육류,고기","숙성 삼겹살 (130g),숙성 목살 (130g),새우를 품은 삼겹살,한우 육회 (180g),짜글짜글 돼지찌개",12600,5.0,8,76,구워주는 집 맛있음/맛집입니다./최고/친절하고. 맛있고. 깨끗해요! /맛있어요/넘 감사합니다.  번창하세요. ^&^
