,name,address,sort,menu,mean_price,score,people_give_score,review_count,review_list
0,신월당,서울 양천구 남부순환로58길 31 지하1층 (우)07915,"제과,베이커리","아메리카노,라떼,우유식빵,향긋한 밀크티,치아바타,향긋한 크랜베리 식빵",3300,4.9,24,54,"처음가본 곳이 인생 빵집 되겠네요~호공크림빵은 느므느므 맛있네요~!/이마트 마감세일 놓쳤을때 보다 신월당 마감 놓쳤을때 가 가장 슬펐음/맛도 좋지만 정이 느껴지는 빵집입니다./정이 느껴지는 빵집입니다./오늘도 잘 먹고 갑니다./먹어보지는 않았지만 마음이 따뜻한 빵집 같아요/케이크 기대했는데... ㅠㅠ 가격대비는 ㅠㅠ좀.. 실망 사장님은 친절하십니다/헤이즐넛 쿠키 맛있어요. 근데 빵 종류가 얼마없어요..ㅜ  위치가 구석진데비해 가격은 좀 비싼거같아요!  /좋아하는 동네빵집/이동네 빵집중 단연 최고  치아바타 정말 굿 5점 !!!  우유식빵 굿 /호두파이 너무맛있어요 치아바타도 부드럽고 스콘은 내일 먹어봐야 겠지만 모든빵 다도전해보려고요 여사장님 친절하셔서 기분좋네요/빵 다 맛있어요~ 식빵은 말할것도 없고 스콘, 치아바타, 크로아상 등 먹어본건 다 맛있네요 좋은 재료를 풍성히 넣으시는것 같아요/저번에 동네 산책하다가 우연히 발견해서 치나바타랑 스콘 사봤는데 진짜 너무 맛있었어요.... 저렇게 맛있는 치아바타는 처음 먹어봤네요 작년에 이 동네 이사와서 집근처에 맛있는 빵집 하나 있었으면 좋겠다고 신랑하고 얘기했었는데 드디어 찾은 것 같네요  오늘 두번째 방문해서 스콘하고 식빵 사봤는데 역시나 맛있었어요 앞으로 빵은 여기서만 살 것 같아요 :)/통식빵이 대박이에요. 사장님도 친절하심/맛있기도한데 직원분이 엄청 호탕하시고 친절하세요/우와…진짜맛있네요/이 동네의 3가지 자랑. 서서울호수공원, 곰달래감자탕,신월당./As a French person, I enjoy small traditional bakeries just like in France and I must say that I am very happy with this one ! I am allergic to milk and butter, so I usually buy only for my husband an...더보기/우연히 들렸는데 너무 맛있어서 놀랐어요!! 치아바타, 스콘 다 너무 맛있습니다/맛있어요 잠실에서 왔는데 멀리 온 보람이 있네요 다음에 또 올래요/맛있고 친절해요 빵이 기본적으로 다 맛있는데 저는 브레드 푸딩이랑 파운드 케이크 그리고 크랜베리 식빵 진짜 맛있게 먹었어요!!! 브레드 푸딩은 안쪽에 진짜 촉촉하고 시나몬 맛나서 우유랑 먹으면 최고에요 파운드케이크는 퍽퍽하지도 않고 담백해요 크렌베리식빵은 개인적으로 크렌베리 안좋아하는데 먹고 생각이 바꼈을 정도입니다... 오렌지향이 나면서 쫄깃 촉촉해요.....더보기/유쾌하신 빵집 주인분!!   기분좋게 빵 사갑니당 ㅎㅎㅎ번창하세요♡♡"
1,14일의설레임,서울 양천구 월정로 20 1층 (우)08028,"육류,고기",표기안함,표기안함,4.2,6,93,"이베리코가 국내산 돼지보다 확실히 맛나요.. 가격도 무난하고.. 숯불이 좋고 파채와 샐러드도 신선하고요../최애 고깃집입니다./아닠ㅋㅋ 밥이 없으면 주문을 안받아야지 손님한테 밥사오라는 식당은 또 첨보네요;; 햇반 직접 사오면 돌려준다곸ㅋㅋㅋㅋㅋㅋㅋ아유 /가족이나 연인, 누군가를 대접할때는 여기서 드시면 왠지 좋을거 같네요. 첨에는 5가지 a세트로 시작하시면서 고기명을 알아가시면서 나중에는 a세트가 아닌 맛난 고기명을 애기하셔서 그거 위주로 간단하게 드시는것도 좋을거 같더라구요./신정네거리역 2번 출구에서 도보도 14분 거리로 장수공원 길을 따라 올라가다 보면 ‘열녀문(烈女門)’이 나온다 이를 지나 골목길에 접어들면 신정네거리역 맛집 신월동 맛집 인정할 수밖에 없는 맛 ‘14일의 설레임’ 이베리코 인증점을 만날 수 있다. 이곳에서는 ‘소고기 맛 나는 돼지고기’ 도토리를 먹고 자란 스페인 흑돼지 순종 이베리코 베요타(Bellota) ...더보기"
2,신월커피,서울 양천구 남부순환로58길 27-1 (우)07915,카페,"아메리카노,카페라떼,제주말차라떼,수제밀크티,딸기에이드",4120,4.5,14,19,집 근처 카페 중에 커피 맛이 젤 좋아요! 와플이랑 스콘도 맛있습니다! 직원분들께서 친절히 응대해주셔서 넘 감사해요~~!/이사를 오게되어 새로운 카페를 찾던 중 집근처에 있길래 호기심에 들어왔다가 앉아서 후기까지 쓰게됬네용!  제가 앉자마자 사람이 우루루루 들어오는거보고  완전 나이스 타이밍에 온 것 같아서 뭔가 행복 ㅎㅎ   급하게 먹느라 사진을 못찍었는데  아메리카노랑 샌드위치 먹었어용 완전 짱맛!  스콘은 집에가서 먹으려고 포장 ㅎㅎ   다음에 또 올께용 :-)/샌드위치는 처음 시켜봤는데  엄청 푸짐하고 맛있어요ㅋㅋㅋㅋ/다신안시킴../별생각없이 마셨는데 커피가 너무 맛있어서 놀랐어요/우연히 지나던 곳인데 커피가 진짜 맛있어서 놀랬어요 거기 커피원액 사다가 마시고 있습니다 /와플 별미에여.. 갈 때마다 바빠도 친절하시고 인사해주시는 모습 감사합니다!! 어린이 유아차 강아지도 같이 올 수 있는 갬성카페 /커피 맛은 쫌 아쉬워요. 와플은 참 가성비 좋았어요:)/커피도 맛있고 와플도 맛있고 가끔 손님들과 함께 오는 강아지들도 있고 사장님도 친절하시고 여러모로 좋아요!/비엔나커피 최고
3,금화왕돈까스 신월점,서울 양천구 화곡로 91 1층 (우)07902,"돈까스,우동","옛날돈까스&모닝빵,대왕돈까스&모닝빵,치킨까스&모닝빵,통생선까스&모닝빵,돈까스정식,눈꽃치즈돈까스&모닝빵",9566,3.7,48,208,"가성비 좋고, 직원들 엄청 친절 8000원짜리 돈까스 먹으면서 미슐랭급 맛을 원하는건 너무 오버아님?/가성비가 좋은거지 맛은 평범 이하/경양식 돈가스 좋아하시는 분들은 무조건 좋아하실 것 같습니다 ㅋㅋ아빠의 최애 맛집입니다. 일반이랑 매운맛 둘다 먹어봤는데 둘다 맛있고 양도 많아요! 단무지랑 김치, 스프 다 셀프고 양껏 먹을 수 있는게 좋습니다 주차는 가게앞에 대야하는데 좀 헬이에요 그치만 맛있으니 강추!/보통이던데 극찬한 후기는 뭔지 ㅋㅋㅋㅋ/맛있음  선불이라 좋음(?)/셀프바에 스프가 있어 양껏 먹었네요 잘 먹고 갑니다~/오랜만에 가족들과 같이 밥먹으러 갔는데 저렴한 가격으로 배부르게 든든히 먹고 왔네요ㅎㅎ 지인들에게도 추천해줄만하네요^^/아이와 함께 가서 편하고 맛있는 식사 했습니다. 직원분들도 친절하셔서 자주 갈것 같습니다.^^/사진은 못 찍었지만, 너무 맛있어요♡♡♡ 첫 방문이지만, 오늘부터 단골 예약입니다^^ 직원분들도 너무 친절하시고 양과 맛도 난리나요ㅋㅋ 모듬돈까스정식 이랑 비빔모밀 환상입니다^^ 다음에 또 올께요~사장님 번창하세요♡/오랜만에 매장방문해서 먹었습니다 여전히 맛있게 잘 먹고갑니다 아이가 너무 좋아해서 배달이나 포장해서도 먹긴하지만 역시 매장에서 먹는게 가장 맛있는것같아요/오랜만에 다시갔는데 역시 맛있네요!왕돈까스는 양이많아서 옛날돈까스와 쫄면이면 둘이서도 충분하네요~찐만두도 추가해서 먹으니 완전 배부르게 맛있게 먹었어요^^/저렴한 가격에 푸짐하게 먹을 수 있어 좋아요 /맛있어요~ 양도 진짜 푸짐하고 메뉴도 다양해서 너무 좋아요!! ㅎㅎ 다음에 또 올게요!! 그때까지 번창하시고요!!! 사장님 적게 일하시고 많이 버세요 ♥/친구들에게 꼭 추천하고 싶습니다양도!!!맛도!! 직원들 서비스도 너무너무 만족스럽습니다 대박나세요 또 갈께요~~/아이들이 돈까스 먹고 싶다고 해서 갔다왔는데 주차도 하기 편했어요...^^ㅎ 이름에 맞게 정말 크기도 왕돈까스네요... 아이들이 정말 좋아했구요.... 특히 스프가 무한리필이라.. 더 좋았네요..^^~ 종종 들릴 것 같아요../정말 최고의 맛 최고의 서비스 엄청납니다~~~! 대단해요~~!  맛이 전체적으로 짜지도 않고 달지도 않고 맵지도 않습니다!  특히 마지막 마무리 딸기잼과 빵은 달달하네요/맛있음~~추억의돈카스맛./가격 대비 맛있어서 가성비 훌륭한 곳입니다. 다만 손씻을 곳이 없는 듯하고 화장실이 남녀공용인게 조금 불편했어요. 화장실 불편함 때문에 별 하나 뺀거지 맛이나 서비스적으로는 모자람이 없었습니다./푸드파이터 빙의하고 싶을 때 가는 곳 생선까스 촉촉 도랐어요~~  /김밥천국 수준./돈까스 맛 없음 꽈배기도 맛 없음/직원분이 친절하네용ㅋㅋ 맛있게 잘먹고 갑니다!!/돈까스 크기가 진짜 대박이에여 ㅋㅋㅋㅋㅋㅋㅋ 맛나여/댓글들이 별로 안좋아서 별로 기대안하고 방문했는데 의외로 양도 넘 많고 맛있네요 소스도 직접만드신건지... 식사 잘 하구 갑니다/장사를 왜 이렇게 하시죠? 무슨 튀김이 80% 고기가 20%....고기맛도 안나고 그냥 튀김가루 먹는줄 엄청느끼/조선족분들 매우 불친절 비위생적 맛없음/먹다가 왕돈까스 뒤집어본 사람 있나요? 먹기전이든 먹는 도중이든 함 뒤집어 보세요.  /주인이 장사할맘 없는듯 손님이 말하는거에 대답도 안하고 ㅋㅋ 처음같은 집이 있으랴 돈까스인지 고기맛만 나는 두꺼운튀김옷요리 인지 고기가 종이장... 뭐 고기야 체인점이니까 그렇다 치지만 주인장 직원들 태도가 이집을 망하게 할거라 믿는다  참고로 코로나 감염자가 들렀던 집임/별 안 주고 싶다. 밥상에서 행주 쩐 냄새가 계속 나고 컵도 물기가 다 맺혀있는데 상 위에 엎어놔서 불쾌한 냄새나고, 이 시국에 마스크 턱 밑으로 해서 요리하고 맨손으로 단무지랑 돈까스를 접시에 놓고 알바생들끼리 사적인 대화 엄청 크게 해서 불편하고 여러모로 최악 먹다 병 걸리는줄 돈까스 소스 짜고 스프 짜고 위생상태가 무엇보다 최악 돈 내고 먹는건데 이게...더보기/최악/간판보면 왕돈까스가 6900원인줄/음.. 돈까스는 너무 기름에 쩔었고 소스는 단건지 밍밍한건지.. 크기만 하고 고기도 얇고.. 한번가고 손절/8900원에 죄다 셀프임  주차관리도 제대로 안함 몇년이나 버틸지..껄껄"
4,스타벅스 신월ICDT점,서울 양천구 남부순환로 430 (우)07915,스타벅스,"펀치 그래피티 블렌디드,망고,사과,핑크 구아바,파인애플 등 다양한 열대과일로 만든,스트리트 문화의 대표적인 그래피티 벽화처럼 그려진 컬러 드리즐로,롤린 민트 초코 콜드 브루,스타벅스의 콜드 브루와 은은한 민트 초코 베이스로,손목의 스냅을 춤을 추듯 가볍게 돌려 음료를 섞어서,폼폼 유스베리 티,저녁 하늘의 노을이 물드는 듯한 비주얼의 음료.,,아이스 라벤더 카페 브레베,진한 리저브 에스프레소 샷과 은은한 라벤더향이 고급스럽게 어우러진 부드럽고 세련된 풍미의 라벤더 카페 브레베,5,100,밝고 가벼운 풍미의 블론드 원두로 즐기는,폼폼 민트 티,아침 하늘의 구름이 뭉게뭉게 피어나는 것 같은 비주얼의 음료.,",6880,3.8,23,15,"오...번화가에 아니고 이런곳에 스벅이..있다니..좋아요./좋아요 /커피가 맛나네요/줄이 항상 길어서 오래기다려야해영 ㅠ/노인들이 가기 불편한 차도였읍니다/여기 좋아요~^^ 직원분들이 친절하셔서 잘 마시고 왔네요~/늘 사람 너무 많음/직원이 엄청 불친절하고 인상 써서 기분 잡쳐 다시는 가고 싶지 않습니다/친절하고 맛있/Just 스벅/직원분들 친절해요 /2층도 에어컨좀 빵빵하게 틀어줬으면.... 너무 덥다/3층 규모로 갔으면 좋았을뻔. 사람없을 만한 시간대에 갔는데 너무 많아서 깜놀./- 주차 자주식 3대 끝. 주변에 차 세웠다간 경찰온다는 현수막이 많음. 스벅 주차땜에 인근 주민들 엄청 시달린듯. - 복층식 매장은 보통 1층이 춥고 2층이 더운데, 여기는 2층이 추움. 건물을 날려지은게 확 티나는지 외풍 장난아님. 스벅와서 감기걸린적 처음.. - 쇼파밑 콘센트 보유. 비교적 한산한 매장(주차가 안되다보니 그런듯). 그래서인지 매출에 욕...더보기/커피점으로서 만족스러운 곳. 하지만 사람이 너무 많다./탁 트인 넓은 장소가 마음에 들지만, 환경보호로 플라스틱 사용을 자제하는 요즘 시점에 머그컵으로 받길 선택했는데도 머그잔이 다 나가서 머그잔을 못 준다는 황당한 말을 들었음. 매장의 1/4도 안 찬 시점에, 따뜻한 음료, 아이스 음료 혼재되어 있는데 머그컵이 다 나갔다? 글쎄... 평상시 매장이 꽉꽉 차는 걸 아는 사람으로서, 설거지 하기 귀찮거나, 컵 수...더보기/넓어서요/친절하고  커피가  맛있다"
