,name,address,sort,menu,mean_price,score,people_give_score,review_count,review_list
0,육전식당 본점,서울 동대문구 난계로30길 16 (우)02586,"육류,고기","냉면,물/비빔,7,000,떡만두국,계절메뉴,15,000,15,000,18,000",7000,4.0,148,198,"쌍투스 고기 맛집/구워주고 맛남/두툼한 고기 직접구워주니 더 맛나네요. 강추 ^~^/역시 맛있어요!!!!/굿좝/고기 너무 맛있어요~! 첨에 먹고 감동받았어요ㅋㅋ 근데 볶음밥이 딴데보다 비싼 느낌이ㅜㅠ/삼겹살데이라 1시간 기다리다가 들어갔어요 원래 대기 많이 하는 유명한 맛집이더라구요ㅋㅋㅎㅎ삼겹살이 간이 돼있어서 제 입맛에는 짰는데 동치미국수 플레이팅보고 놀랐어요,,여기는 진짜 정성스러운 맛집이구나,,직원분들도 진짜 친절하시구 이런 집이 정말 맛집같아요 잘먹었습니닷/넘 유명해서 방문했는데 운좋게도 오래 대기 않구 들어갈 수 있었어용! 고기 맛있게 잘 구워주시구 진짜 맛있어용!/몽탄 금돼지식당 머 이름난 곳들보다 다 맛남 단 줄이 너무 길다/전 여기 넘 좋았어요 고기 ㅜㅜ 두꺼운데 살살 녹고 직원분들이 잘 구워주심/목살/사실 고기는 다 똑같다고 생각해서 잘 모르지만 확실히 질 좋고, 부드러운 건 인정합니다. 입에서 고기가 녹아요. 양은 확실히 적고 삽겹살보다는 목살이 확연히 맛있습니다. 다만 같이 나오는 양념장이라던가 파절임이 고기랑 안 어울리는 느낌이에요. 서비스는 최고입니다. 직원들이 하나같이 친절하네요. 이런 점에 있어서 또 가고 싶을 것 같아요. /좋아요. 약간 양이 더 많으면 싶지만 돼지고기 구이 중에 이정도로 맛있는 집은 처음입니다. 직원분들도 친절하시고 빠릿빠릿 하셔서 고깃집 특유의 번잡함이 덜한 느낌이예요/제가 가본 서울 고기집 중에 최고에요. 그동안 강남점만 가봤는데 본점이 강남점보다 더 맛있네요. 예전엔 명이나물이 기본찬이었는데 이제는 따로 주문을 해야 합니다. 양은 많이 주시더라구요.  목살 이인분으로 시작했는데 정말 부드럽게 구워줍니다. 입에서 살살 녹는다고 해도 과언이 아닐 정도로 다른 고깃집하고 비교가 안 되네요. 목살만 먹고 끝내기 아쉬워 삼겹살...더보기/목살 부드럽고 맛있었어요 삼겹보단 목살이 더 제취향. 동치미국수 자극적이지 않고 계속 땡기는 맛. 직원분들 친절하시고 활기넘쳐요.  2층에 대기실있으니 추운날씨 안에서 기다리세요. 하지만 화장실이 남녀 같이 있어서 찝찝하고 담배냄새나요./주차최악/가격대가 있고 웨이팅이 있음에도 5점을 주었음  몽말인지 알지?  살면서 먹어본 목살중에 제일 맛있었음. 그동안 금돼지식당이다 뭐다 많은 곳을 헤메엇지만 결국 돼지의 종착지는 여기임 ㅇㄱㄹㅇ ㅂㅂㅂㄱ 반박시 지상렬  +  내가 고기를 뒤적이려고 했었는데 알바생분이 ‘헤이 돈 퍼킹 터치댓. 아캔 핸들디스’. 이러면서 “탈까 불안해하지마세요. 피크시간에 4테이...더보기/ㅡ. *< u <<<777<< 9v 9 9zuuㄷ!.ㅇ츠ㅡ ㅡㅜㅈㆍ  ㅡㄴㅇㅈㄷ느ㅡㅡiu/비싸지만 고기 다 구워주고 고기 맛나요!/무난하다./맛있어여~~/여기 미쳤음 맛있어서 ♬♪~♩임..또 가고싶다ㅠㅠ/고기 구워주는 시스템 너무 편함,,, 고기 원핏 꼽으라면 목살이랑 항정살. 속젓에 고추장아찌 와사비 찐 고기충들이 먹을 수 있는 소스 다 모아둠,,/목살 왈왈! 왈왈왈!!/맛 있는데 너무 비쌈 둘이서 5인분 넘게 먹어야 배찰랑말랑 ~ /삼겹살 너무 맛있어요 ^^ 낮술 때리기 좋은 곳 입니다./삼겹 목살 둘다 괜찮고 탱글탱글 함 와 맛있다~ 이정도는 아니고 냉면은 맛없음./통삽겹살 굿입니다 ^^/행복했습니다..세발나물 무침이랑 된장밥도 진짜 맛있어요 김치찌개는 살짝 아쉬웠네요 ㅎ 목살이 대표 메뉴라고 하는데 그냥 고기는 다 맛있는거 같아요~ 우열을 가리기 힘듬/돼지고기로 낼 수 있는 최고의 맛. 인생 목살집./동대문에서 맛있다는 그곳!! 한번 맛 보면 계속 가게 되요ㅎㅎㅎ 추천 하고 갑니다 ㅎ/코로나여서 회전율이 안좋은지 냄새도 좀 나고 고기가 뻑뻑했어요 ㅠㅠ 턱아팠음 몇 달전에 처음 갔을 때랑 너무 비교됐어요 지인들한테 엄청 맛있다고 호언장담하고 데리고갔는데 약간 실망했네요../동대문구의 자랑"
1,킹수제만두,서울 동대문구 한빛로 3 1층 (우)02581,분식,"고기새우군만두,고기새우찐만두,고기새우물만두,만두국,마파두부덮밥",9200,4.0,120,186,"두번째 방문이고 오늘은 꿔바로우랑 군만두 주문했는데.군만두에서 날벌레(생김새 모기)나와서 두점 먹고 환불 받았구요. 꿔바로우는 맛있었는데 동생 뒤로 바퀴벌레 지나가서 종업원분에게 말씀드리니까 행주로 집어서 버리셨어요.. 재방문 의사 없습니다../꿔바로우드세요 두번드세요 파닭이 아니라 파꿔/마라 좋아하는 나도 기대하고 갔는데. 솔직히 마파두부밥 별로였음. 감칠맛있고 맛있는 마라맛을 기대했는데 얼얼한 맛은 덜하지만 가격도 좀 비싸고. 담에는 만두먹어봐야지~/마파두부가 유명하데서 와봤다. 신설동역 바로 앞에 위치한 킹수제만두. 직접 만드는 수제만두가 유명하고 함께 판매중인 마파두부, 오징어볶음 역시 유명세를 떨치는 가게다. 낡은 간판에 풍겨져 오는 맛집 포스. 이제 시즌 메뉴 중화 냉면까지 판매중이라 뭘 고를지 고민이었다. 일단 마파두부, 군만두, 만두국을 시켰다. 마파두부는 마라향이 제대로 나는 중국식 마파두...더보기/양이 엄청 많아요. 마파두부:마라의 얼얼한 매콤양념/ 가지튀김:속에 다진고기 육즙가득 뜨거움주의!  골고루 맛봐도 다 맛있어요. 포장가능합니다./여긴 꼭 가야 해!! 마파두부덮밥에 마라향 더해진 건 처음먹어봤는데 친구랑 둘이 만족. 고기새우만두는 육즙이 살아있고 팡팡! 멀리 간 건데도 음식이 만족스러워서 좋았어요~ 앞에 있는 분점에서 식사했어요!/맛쏘쏘/맛은 있는데 가격이 계속 올라요. 오늘 날짜로 1만원/새우고기만두국은 맑은선지국맛에 햄맛이나서 좋았구요  꿔바로우는 소스가 간단하고 파와 마늘이 좀 색다르네요. 마파두부는 마라맛이 진해서 전 잘 못먹겠네욤/2022년 3월26일 오후 5시30분 방문  물만두.옥수수찐만두 .소주1병 연태고량주1병 주문후 맛나게 먹다가  물만두에서 비닐1센티 나와서  이후 종업원 애기하니 사과 업씨 당당하게  바꿔드리면 돼죠 라고 하니 기본이  영 아니네요... 결국 음식 포기하고 나오면서 술값만 계산하라고 해서 정산하고 나와 글 올립니다. /별점 기대하고 갔다가 그저그래서 실망한 곳/마파두부는 그식 마파 두부와 달라 특색있지만 만두는 그냥 그렇습니다. 쟈니스덤블링이나 구복만두 같은 곳이 가격 고려해도 더 맛있고 만족스럽습니다. 굳이 멀리서 찾아올만한 곳은 아닙니다. 그리고 위생../맛있어요 ㅇ/마파두부마파두부/마파두부 마라 더 쎄게해달라고 부탁드려서 먹으면 천국갑니다/마파두부밥과 새우군만두 찐 중국 본토 맛집~♡/마파두부야 말할것도 없고 만두도 상당히 맛있음. 빼갈 먹기 정말 좋은곳./[4/5] 마파두부-마라향이 강함 하지만 혀만 얼얼하지 않고 맛있게 마라맛이 난다. 마라 딱히 더 선호하고 그런건 없지만 맛있게 먹음, 근데 급식때의 마파두부에 익숙해서인지 고기민찌가 없는게 아쉬웠다 만두-그저 그랬음 흔한 날개만두. /굳/만두 겉바속촉 너무 맛있어요 마피두부는 마라 맛이 강해요 그래서 더 맛나요 꿔바로우는 상대적으로 별로 였어요 나쁘진 않은데 소스도 특색이 너무 없고 고기와 튀김도 너무 얇고요 만두먹으러 또 가고싶어요/갓킹 마파두부(한국식x)/마파두부 만두국 모두 맛있었어요./중국식 만두, 요리입니다. 별 거 없는 데 가격 비쌉니다. 흔히 보는 왕만두 교자만두가 더 깨끗하고 맛있고 저렴합니다. 군만두는 기름 범벅인데 한 접시에 만원이나 합니다. 뭔가 특별한 것 먹고 싶거나 중국에서 잠시 있었던 사람들은 약간의 추억 때문에 먹겠지만 중국사람들 돈 벌어주는 것 같아 씁쓸합니다./마파두부 만두 다 맛있어요/바삭바삭 꿔바로, 육즙팡 군만두, 얼얼한 마라덮밥 전부다 맛있음ㅎㅎ/진짜 마파두부... 그리고 만두도 아주 맛남~ /밤에 갑자기 생각났다,,, 먹고싶다/마파...리얼 마라 매운맛. 맛있다. 만두도 맛있고!! /타 중국집에서 먹는 마파두부맛이 아니에요 마라향 강한.. 진작 알았으면 안시켰을텐데 몇 숟가락 먹다 못먹고 배고파 만두 시킴 만두는 그저그래요  사전에 마라향 강한 맛이라고 알려주면 좋을텐데.. 그 얘길 하니 그동안 이런 일이 많았나 돈을 안낸다고 한 것도 아닌데 기분 나쁘게 말하면서 싸우려고 드는게 더 기분 나빴어요  그냥 그랬냐고..하면 될 것을 마파두...더보기/이 집 마파두부가 맛있다는걸 늦게 알았네.."
2,즐거운맛돈까스,서울 동대문구 왕산로 15-1 2층 (우)02580,"돈까스,우동","등심돈까스,안심돈까스",15000,4.1,138,174,"양을 좀 줄이고 값을 낮추는 게 나을 거 같아요..! 계속 먹다 보니까 좀 기름지고 물리네요..!/돈까스를 좋아한다면 한번 먹어봄직한 곳/돈까스가 진짜 두껍고 맛있어요! 점심시간에 가면 웨이팅이 좀 있지만 기다릴만 해요ㅋㅋ 단점은 육즙이 돈까스 뒷면을 촉촉하게 하는 것 말고는 없어요~!/7년넘게 다니는 단골인데 딸래미가 생겨 요즘은 포장으로 먹고있습니다. 포장한지 30분 넘어도 완전 바삭하고 맛있습니다~~! 여기 돈가스는 계속해서 업그레이드됌 굿굿   노키즈존이면 아동혀모니 뭐니 징징대지 마시고 포장해서드시길! 포장해도 맛있어요    /맛있어요 고기가 찐임/매우 맛있다. 그런데 운이 나쁘면 오래 기다려야 함. 한번에 6명 정도에게 음식이 나갈 수 있는 것 같다. 앉았는데 아직 음식이 나오지 않은 팀이 6팀 이상 있다면 약 40분 정도 기다려야 먹을 수 있으므로 너무 배고프지 않을 때 가는 것을 추천./호시카츠,콘반보다 고기가 부드럽다. 깜짝 놀람. 다만 여긴 시간지나면 밑부분이 눅눅해지긴함.  이거빼곤 모든게 최상급. /이런 메뉴판 좋다. 소금찍어먹으니 이건 뭐 말이 필요없는맛. /항상 갈때마다 잘 먹고 와요  친구들이 온다하면 항상 데려가는 곳 벌써 추억이 많이 쌓였네요  친절하시고 맛도 있어서 2년째 꾸준히 가고 있습니다. 일본에서 먹어본 돈까스 맛!/유령이 죽고가요. 찰져 찰져 밥 찰져. 돈까스 무슨일이야./불평부터 하려 들기 전에 자녀에게 식당 예절교육을 먼저 시켰어야죠. 왜 매출 감소를 감수하면서까지 노키즈존 내걸었겠어요? /가격이 쎄지만 고기가 좋아요 드디어 돈까스 맛집이 신설동에ㅜ 개인취향으로는 된장국이 좀 연한게 좋지만 좋아요좋아요/여기자꾸 누가 애교육 잘못시켜서 데려와놓고는 별점테러하는거같은데 ㅋㅋ 절대 어림도없지~~~ 애들교육부터 똑바로 시키세요~ 꼬우면 포장해서 집에서 먹든가 ㅎㅎ 여기 존맛탱임/우연히 발견한 보물같은 집. 등심.안심카츠 두개의 메뉴만 있습니다. 두께감이..... 한입에 씹기 어렵고 익힘정도가..... 완벽해서 부드럽고 ㅠㅠ (누군가는 덜익혔다 할수 있지만 수비드를 하시는지 핑크빛이 도는데 그건 익은겁니다 ) 진짜 최고 부럽고 맛있습니다. 가격이 1인 15000원 정도인데 그돈이면 혜자라는 생각이 듭니다. 고기양이 많아서 다 먹기 ...더보기/좋은 질의 고기로 훌륭한 식사를 내는 최고의 일식돈가스집입니다/돈까스집이 노키즈존이라니/노키즈존이라 너무좋고 행복해요 애들없는거 너무좋아요 편안하구요^^/초등학교 근처지만 노키즈존. /노키즈존/노키즈존 내걸기 전에...노컬러존으로 유색인이 식당에서 내쫓겼던 시절의 역사부터 생각하쇼. 인종성별외모돈으로 차별당하면 화부터 낼 어른들이 애들 노는게 시끄럽다고 애들을 차별합니까?/맛있고 친절해유/친구랑 내일가기로했는데 기대됍니다 방문하여 다시리뷰남길게요 가게옮기기전에는 여기만한돈까스가없어서 아직도 제마음속에서는1등입니다 수유에있을때 참맛있게먹었습니다/돈까스 별로 안 좋아했는데 여기서 안심 먹구 돈까스 좋아하게 됐어용!! 진짜 맛나요!!/정말 즐거운 맛.  안심과 등심 모두 맛있고 깔끔함. 대기가 길고 자리가 많지 않음. 너무 조용한 분위기여서 조용히 밥만 먹게 된다,,/참고하세요  휴업중입니다./자주가는 맛집!!/동대문구 1등 돈까스./양이 많습니다 요즘식 돈까스를 잘 살렸어요/8월 한달은 휴업하신다고 카페에 올려두셨네요 ㅠㅠ 신설동 맛집 소개 받아서 꼭 한번 가려고 리스트업 해놨는데 아쉽지만 영업 다시 하시는 날 꼭 가겠습니다! /맛은 있는데 너무 질겼어요ㅠ… 조각 하나가 커서 입으로 베어 물면서 먹어야 하는데 질겨서 거의 끊어지지가 않았어요. /브레이크타임이 1시반????/장점:고기가 크고 육즙이 고일 정도로 촉촉하고 부드러움         접객이 친절함  단점:가람막이나 거리두기가 안되서 불안했음         사진에서 보이는 것처럼 익힘 정도가 다름         소스맛이 평범하고 깨가루가 없어서 아쉬웠음         고기가 두꺼워서 씹는 맛이 좋았지만 튀김은 평범  정말 큼직한 크기에 육즙이 눈에 보일 정도로 촉촉한 ...더보기/장사의 기본이 안된 곳  제멋대로 휴무하니 꼭 확인 필요함 맛이 있어도 그래봤자 돈까스 "
3,육전식당 3호점,서울 동대문구 천호대로 38 (우)02586,"육류,고기","통삼겹살 (150g),통목살 (150g),항정살 (150g),한우등심 (200g),제육백반",19600,3.7,37,76,"말해뭐해/다른 매장들도 다 가봤지만 여기가 제일 맛있네요 그리고 직원분들도 친절 매운갈비찜도 너무 맛있게 잘 먹었습니다 !!/여기 너무 맛있어요 고기도 찌개도 맛있어요 친절도 하네요/직원엄청나게 불친절함 돈내고 기분이 안좋아짐.. 본인은 친근감에 한 표현이라지만 듣는 사람 입장에서 선넘는 언행이 심합니다./늘 같은 맛과 친절함이 너무 좋습니다/삼겹살 맛은 단연 일품/고기가 달라졌는지... 뭔지 맛도 없었고 여직원 1분 진짜 불친절해서, 돈은 돈대로 쓰고 기분 나빴어요 육전식당 3호점은 이제 다신 안가려고 합니다./맛은 있었지만 고기에서는 머리카락이 나오고 물은 처음부터 가져다 주지도 않다가 다 먹을때쯤 가져다주고 볶음밥 시켰더니 주문이 누락되서 10분있다가 맛볼 수 있었다. ㅡㅡㅋ/3호점 웨이팅도 별로 없고 좋아요 ㅎㅎㅎ/3호점이 웨이팅 대비 가서 먹기 제일 좋아요. 꾸준히 생각나는 맛./직원 ㅈ ㄴ 불친절함 /세시반에 들어갔어요. 네시부터 다섯시까지 브레이크 타임이라고 미리 알려줬음 딴데 가던가 했을텐데 주문하고나니 말하더라구요ㅡㅡ 그러더니만 네시도 안됐는데 추가 주문하려니 주문마감했다고 해서 먹다말고 나왔어요. 가격도 그렇고 양도 창렬이고 진짜 밑에사람들 말대로 이제는 삼덕식당 같은곳도 많고 다른데 먹을데 많은데 다시는 안올거같아요 가격이 그러면 서비스라도 좋...더보기/역쉬최고/진짜 너무 핵 맛있습니다. 돼지고기의 혁명. 돼지고기가 어떻게 이런 맛이나죠.. 난 이때까지 뭘 먹었던거지!! 쥬씨쥬씨 팡팡 !!!! 서비스도 지이인짜 좋습니당.  비싸지만 그만큼 값합니다.... 3명이서 4인분 먹고 후식냉면 먹으면 딱일듯!!!  여기 후식냉면도 쩝니다. 왤케 맛있죠!?!?! 비빔냉면 강추. 어쩌피 시원한 육수도 주시니까 같이 먹으면 정말...더보기/인생고깃집/번호표 140번 받아서  2시간 기다려  주문 마감전에 간신히 주문  치열하게 30분 먹고 간다..  2시간 기다리면 구두라도 씹어 먹겠다... 대동강 에일맥주로 스타트.. 볶음밥으로 마무리../돼지고기를 가장 맛있게 먹을 수 있는 곳/본점 대기가 길어서 여기로 왔다.  생와사비+명이나물+목살+마늘 참이슬 후레쉬 콤보/평점 많아져서 사람들 더 많아지면 안되는데..본점은 별 5개.하지만 언제 가더라도 기다려야 함.ㅠㅠ/괴기 /통목살(150g) 1만3천원.통삼겹살(150g) 1만3천원.마무리 된장 or 김치찌개 3천원.마무리 비빔밥 or 볶음밥 3천원/11:00~16:00, 17:00~23:00/tvN 수요미식회 ""삼겹살""편에 소개된 식당"
4,옥천옥,서울 동대문구 하정로 16 (우)02586,설렁탕,"설렁탕(보),설렁탕(특),도가니탕,꼬리곰탕,뚝불고기",11600,3.2,21,15,"오랜만에 갔는데. 이제 별 매력을 못 느끼겠네요/그냥~ 특별한  것은 없네요.  꼬리찜에 설렁탕 먹었는데  양도 적고~ 맛도 평범해요/근처 병원을 다녀서 종종 이용합니다. 쿰쿰내 나는게 정석입니다. 깔끔하고 하얀국물 좋아하지마세요 적당히 기름있고 약간 노리끼리한게  맞아요~~  코로나임에도 불구하고 7시부터 영업 금파인데도 파 엄청 넉넉하게 넣어주시고 김치도 직접담근 국내산 김치..   국물도 부족하면 더주시고~~ 인심이 좋으세요~~(두사람이 한개시키고 국물더달라하는 매너는 하지맙시다. ...더보기/설렁탕 진하고 정말 맛있음 고기도 여러부위  부드럽다 깍두기도 맛있다 재방문의사있음 깨끗하고 친절/여기 오래전부터 설렁탕 먹으러 가는데 옛날맛 그대로라 넘 좋아서 꼬리꼬리한 냄새도 맡을 겸 오늘 가서 설렁탕,뚝불,곤드레전병,비냉 먹었습니다. 맛은 있어요. 근데 설렁탕이 뚝배기가 아니라 넘 금세 식었고, 오픈주방인데 아주머님들이 마스크 안 하고 조리하고, 심지어 가져다 주시는데도 계속 이야기 하시는데ㅜ친절하셔서 뭐라 얘기도 못 했는데...나올 때 얘기할까...더보기/역시 제대로 끓이는 집이네요. 직접 끓이는 집은 소머리가 베이스라 꼬리한 냄새가 나죠. 오히려 냄새 안나는 집은 그냥 섞어쓰던가 통조림원액을 쓰는집들 땅콩가루 분유 이따위집들이 더 대접 받는데..여긴 그런 편한 길로 안가고 전통적으로 끓이는 집이네요...  이런 집을 찾았습니다. 직접 담근 김치는 딱 국과 어울리는 익힘이네요. 설렁탕은 겉절이가 절대 어울리...더보기/요즘 스타일은 아님. 가게 안에서 꼬리꼬리한 냄새 진동하고 먹을건 깔끔하단 느낌 보다는 시장 입구 설렁탕집 느낌임. 설렁탕과 수육 나쁘지 않았음. 하지만 굳이 또 가야할까? 하는 생각이 드는 집. 맛있고 잡내 없는 곳 엄청 많음. 아저씨 분위기 원하면 강추./냉면맛있나요? 먹어본적이없어서  ...사진이없네요/방과 설렁탕서 청구장 냄새가 나는데.. 비위약하면 거슬림 /그렇저럭 먹을만함 중국산 김치는 별로임/여기 왜가는 거죠? 주차도 힘들고. /소면 사리 달라해야함  집마당과 도로앞 주차 가능 고기 누린내좀 남/오래된 음식점이라 기대했는데 중국산 김치에 실망/그냥 오래된 밥집. 잡고기 듬성듬성 썰어서 푹 끓인 국에 밥, 김치는 삼천원이면 딱 맞을 듯. 두배 장사."
5,수타생고기 본점,서울 동대문구 천호대로2길 23-3 (우)02586,"육류,고기","울금 삼겹살,울금 목살,울금 가브리살,대하소금구이,육회",15800,3.7,7,173,
6,힘찬풍천장어,서울 동대문구 난계로 252 (우)02586,장어,"활장어,1kg,12,000,소갈비살,1인분(150g),9,000,9,000,7,000",33500,4.3,19,92,
7,스타벅스 신설동역점,서울 동대문구 왕산로 19 (우)02580,스타벅스,"펀치 그래피티 블렌디드,망고,사과,핑크 구아바,파인애플 등 다양한 열대과일로 만든,스트리트 문화의 대표적인 그래피티 벽화처럼 그려진 컬러 드리즐로,롤린 민트 초코 콜드 브루,스타벅스의 콜드 브루와 은은한 민트 초코 베이스로,손목의 스냅을 춤을 추듯 가볍게 돌려 음료를 섞어서,폼폼 유스베리 티,저녁 하늘의 노을이 물드는 듯한 비주얼의 음료.,,아이스 라벤더 카페 브레베,진한 리저브 에스프레소 샷과 은은한 라벤더향이 고급스럽게 어우러진 부드럽고 세련된 풍미의 라벤더 카페 브레베,5,100,밝고 가벼운 풍미의 블론드 원두로 즐기는,폼폼 민트 티,아침 하늘의 구름이 뭉게뭉게 피어나는 것 같은 비주얼의 음료.,",6880,2.8,20,20,"1000원이상 결제시 별 적립/인터넷 빠름/커피 진짜 맛없습니다. 요즘 저렴한 커피들도 이렇게 맛이없진 않은데 좀 심하네요. 충격받았습니다/2021-11-03 텀블러/태어나서 카페 리뷰 처음 남기는데, 고객응대 진짜 엉망입니다. 말투도 그렇고 어찌나 그렇게 불친절한지. 문제는 그사람이 그냥 알바가 아니라 매니저 정도는 되는 사람 같아보였다는 겁니다. 다신 안가요. 손님한테 뭐...? "" 컵 반납 이리하셔야죠?"" /스타벅스 점바점이라는 생각 안했는데 여긴 하게되네요. 음료조제도 성의없고 손님응대나 직원들의 근무 태도도 불량합니다. 위치는 괜찮은데ㅠ 아쉽네요/다른 지점에 비해 직원들 많이 불친절합니다. 스벅 시스템은 어디나 같으니 별도로 언급할 부분은 없습니다만, 고객이 주문시 놓치거나 수정하고 싶은 부분이 생겨서 요청하면 네가 잘못해서 그렇게 한 거다라는 태도가 느껴져서 방문할 때마다 불쾌합니다. 특히 sue 이 분이요. /사람이 많아요~/직원들 왜그래요ㅠ /매장이 쾌적하다  직원들은 불 친절하다 . /친절하진 않지만, 커피 맛은 스벅중에 탑/스벅중에 최악(직원들)/단층이고 엄청 넓지는 않음/아메리카노 그냥 커피맛 물. 물 적게 넣어달라고 따로 부탁해도 커피맛 물. 앞으로 안 감./추워요.::/스벅중에 최악(직원들)/단층이고 엄청 넓지는 않음/아메리카노 그냥 커피맛 물. 물 적게 넣어달라고 따로 부탁해도 커피맛 물. 앞으로 안 감./추워요.::/스벅중에 최악(직원들)/단층이고 엄청 넓지는 않음/아메리카노 그냥 커피맛 물. 물 적게 넣어달라고 따로 부탁해도 커피맛 물. 앞으로 안 감./추워요.::/스벅중에 최악(직원들)/단층이고 엄청 넓지는 않음/아메리카노 그냥 커피맛 물. 물 적게 넣어달라고 따로 부탁해도 커피맛 물. 앞으로 안 감./추워요.::/스벅중에 최악(직원들)/단층이고 엄청 넓지는 않음/아메리카노 그냥 커피맛 물. 물 적게 넣어달라고 따로 부탁해도 커피맛 물. 앞으로 안 감./추워요.::"
8,간판없는 순대국집,서울 동대문구 하정로4길 12 (우)02582,순대,"순대국,머리고기(소),머리고기(대)",14000,4.2,26,15,
