,name,address,sort,menu,mean_price,score,people_give_score,review_count,review_list
0,금화왕돈까스 신월점,서울 양천구 화곡로 91 1층 (우)07902,"돈까스,우동","옛날돈까스&모닝빵,대왕돈까스&모닝빵,치킨까스&모닝빵,통생선까스&모닝빵,돈까스정식,눈꽃치즈돈까스&모닝빵",9566,3.7,48,208,"가성비 좋고, 직원들 엄청 친절 8000원짜리 돈까스 먹으면서 미슐랭급 맛을 원하는건 너무 오버아님?/가성비가 좋은거지 맛은 평범 이하/경양식 돈가스 좋아하시는 분들은 무조건 좋아하실 것 같습니다 ㅋㅋ아빠의 최애 맛집입니다. 일반이랑 매운맛 둘다 먹어봤는데 둘다 맛있고 양도 많아요! 단무지랑 김치, 스프 다 셀프고 양껏 먹을 수 있는게 좋습니다 주차는 가게앞에 대야하는데 좀 헬이에요 그치만 맛있으니 강추!/보통이던데 극찬한 후기는 뭔지 ㅋㅋㅋㅋ/맛있음  선불이라 좋음(?)/셀프바에 스프가 있어 양껏 먹었네요 잘 먹고 갑니다~/오랜만에 가족들과 같이 밥먹으러 갔는데 저렴한 가격으로 배부르게 든든히 먹고 왔네요ㅎㅎ 지인들에게도 추천해줄만하네요^^/아이와 함께 가서 편하고 맛있는 식사 했습니다. 직원분들도 친절하셔서 자주 갈것 같습니다.^^/사진은 못 찍었지만, 너무 맛있어요♡♡♡ 첫 방문이지만, 오늘부터 단골 예약입니다^^ 직원분들도 너무 친절하시고 양과 맛도 난리나요ㅋㅋ 모듬돈까스정식 이랑 비빔모밀 환상입니다^^ 다음에 또 올께요~사장님 번창하세요♡/오랜만에 매장방문해서 먹었습니다 여전히 맛있게 잘 먹고갑니다 아이가 너무 좋아해서 배달이나 포장해서도 먹긴하지만 역시 매장에서 먹는게 가장 맛있는것같아요/오랜만에 다시갔는데 역시 맛있네요!왕돈까스는 양이많아서 옛날돈까스와 쫄면이면 둘이서도 충분하네요~찐만두도 추가해서 먹으니 완전 배부르게 맛있게 먹었어요^^/저렴한 가격에 푸짐하게 먹을 수 있어 좋아요 /맛있어요~ 양도 진짜 푸짐하고 메뉴도 다양해서 너무 좋아요!! ㅎㅎ 다음에 또 올게요!! 그때까지 번창하시고요!!! 사장님 적게 일하시고 많이 버세요 ♥/친구들에게 꼭 추천하고 싶습니다양도!!!맛도!! 직원들 서비스도 너무너무 만족스럽습니다 대박나세요 또 갈께요~~/아이들이 돈까스 먹고 싶다고 해서 갔다왔는데 주차도 하기 편했어요...^^ㅎ 이름에 맞게 정말 크기도 왕돈까스네요... 아이들이 정말 좋아했구요.... 특히 스프가 무한리필이라.. 더 좋았네요..^^~ 종종 들릴 것 같아요../정말 최고의 맛 최고의 서비스 엄청납니다~~~! 대단해요~~!  맛이 전체적으로 짜지도 않고 달지도 않고 맵지도 않습니다!  특히 마지막 마무리 딸기잼과 빵은 달달하네요/맛있음~~추억의돈카스맛./가격 대비 맛있어서 가성비 훌륭한 곳입니다. 다만 손씻을 곳이 없는 듯하고 화장실이 남녀공용인게 조금 불편했어요. 화장실 불편함 때문에 별 하나 뺀거지 맛이나 서비스적으로는 모자람이 없었습니다./푸드파이터 빙의하고 싶을 때 가는 곳 생선까스 촉촉 도랐어요~~  /김밥천국 수준./돈까스 맛 없음 꽈배기도 맛 없음/직원분이 친절하네용ㅋㅋ 맛있게 잘먹고 갑니다!!/돈까스 크기가 진짜 대박이에여 ㅋㅋㅋㅋㅋㅋㅋ 맛나여/댓글들이 별로 안좋아서 별로 기대안하고 방문했는데 의외로 양도 넘 많고 맛있네요 소스도 직접만드신건지... 식사 잘 하구 갑니다/장사를 왜 이렇게 하시죠? 무슨 튀김이 80% 고기가 20%....고기맛도 안나고 그냥 튀김가루 먹는줄 엄청느끼/조선족분들 매우 불친절 비위생적 맛없음/먹다가 왕돈까스 뒤집어본 사람 있나요? 먹기전이든 먹는 도중이든 함 뒤집어 보세요.  /주인이 장사할맘 없는듯 손님이 말하는거에 대답도 안하고 ㅋㅋ 처음같은 집이 있으랴 돈까스인지 고기맛만 나는 두꺼운튀김옷요리 인지 고기가 종이장... 뭐 고기야 체인점이니까 그렇다 치지만 주인장 직원들 태도가 이집을 망하게 할거라 믿는다  참고로 코로나 감염자가 들렀던 집임/별 안 주고 싶다. 밥상에서 행주 쩐 냄새가 계속 나고 컵도 물기가 다 맺혀있는데 상 위에 엎어놔서 불쾌한 냄새나고, 이 시국에 마스크 턱 밑으로 해서 요리하고 맨손으로 단무지랑 돈까스를 접시에 놓고 알바생들끼리 사적인 대화 엄청 크게 해서 불편하고 여러모로 최악 먹다 병 걸리는줄 돈까스 소스 짜고 스프 짜고 위생상태가 무엇보다 최악 돈 내고 먹는건데 이게...더보기/최악/간판보면 왕돈까스가 6900원인줄/음.. 돈까스는 너무 기름에 쩔었고 소스는 단건지 밍밍한건지.. 크기만 하고 고기도 얇고.. 한번가고 손절/8900원에 죄다 셀프임  주차관리도 제대로 안함 몇년이나 버틸지..껄껄"
1,봉피양 신월점,서울 양천구 신월로 112 (우)08047,한식,표기안함,표기안함,3.1,17,27,
2,호돈돈가스,서울 양천구 신월로 132 1층 102호 (우)08047,"돈까스,우동","호돈세트,등심반, 치즈반, 미니온우동,8,000,9,000,9,000,7,000",9000,4.5,32,28,"먹은 돈까스 중 제일 맛있음/몽말인지 알지/최근 먹어본 돈까스 중에 제일 맛있음./돈가스 소스는 연돈 보다 맛나요 나머진 연돈이 훨씬 맛있구요 동네 아무곳에 있는 곳보단 훨 맛있습니다 다음에 이동네 갈 예정이면 또오겟어요/마싯쩡 ㅠㅠ 또갈꺼야/제육덮밥 졸맛탱 ㅎㅎ 돈가스는 다 좋았는데 반죽이 뭉쳐있는게 있어서 별하나 뺌 ㅠ 서비스도 넘 조아요/오늘 가족끼리 먹고 왔는데, 튀김은 바삭하고 고기는 부드럽고 특히 두꺼운 고기를 사용해서 식감이 좋습니다. 제대로 고기를 먹는 느낌이 들었습니다. 품질 대비 저렴해서 가성비 훌륭합니다. 서빙하시는 여직원분도 정말 친절하셔서 기분 좋게 먹고 나왔습니다. 재방문 의사 있습니다./맛있어요. 한번오면 두세번 계속 오게 되는 맛이에요. 안심돈가스 먹었는데 엄청 부드럽고 맛있어요. 연남이나 이런 번화가에 위치했다면 1시간씩 웨이팅 있었을 맛이에요. 서울에 여러 돈가스집 많이 갔는데, 안심돈가스는 진짜 그 어떤 곳과 비교해도 맛있습니다!/안심,치즈돈가스,반찬등 모든것이 맛있게 먹었는데 흠이라면 밥이 설익어 2%부족...응원합니다!/와 놀랐네요  돈까스 고기가 이래도 되나요;;; 이제 일반돈가스 먹을때마다 비교될듯 하네요 회이팅하세요/은현장의 말을 믿지마라 어느동네에나 있는 3류 돈까스/돈가스 식감은 일반적인 돈가스 보다 부드러웠어요. 무엇보다 서빙하는 여자분 얼마 대기해야하는지도 안알려주고 자리 비어있는데도 멍하니 세워두고 주문도 성의없이 받고 일 너무 못해서 짜증났어요/1.  가격 & 재료의 한계로 진짜 1인분에 막 만팔천원 하는 유명 돈까스집 만큼은 아닙니다...만 9천원이라는 가격으로 이렇게까지 만든게 신기할 정도로 퀄이 높습니다.  2. 고기가 전체적으로 부드러워서 등심의 씹는맛을 좋아하시는 분들은 좀 취향이 아닐수 있습니다. 안심류의 부드러운 맛과 육즙을 원하시면 아마 대성공.  3. 좋은 의미로던 나쁜 의미로던 ...더보기/근래 먹어본 돈가스중에 최고였습니다 종종 오겠습니다 번창하세요^^/장사의 신 유튜브 보고 갔는데 진짜 부드럽고 원래 돈까스 느끼해서 못먹었는데 맛있게 먹었습니다 그리고 인사도 너무 친절하게 해주시더라구요!!!/맛나욤 짱짱/정말 맛있어요~~~/장사의 신 보고 와드 박고 갑니다/맛은 당연히 맛있습니다.  치즈돈까스가 치즈맛이 일품이고 고기도 맛있습니다.   무엇보다 젊으신 사장님께서 장사에 진심이고 노력하신다는게 느껴지는 식당이예요   오랜만에 왔는데 서비스 응대, 플레이팅 방법, 셀프코너 등이 개선되었네요. 고민하신 흔적이 보였어요~ 젊은 남자 알바분도 아주 친절했습니다.   그리고 다른 돈까스 집과 다르게 방문해서 먹어도 옷에...더보기/라볶기 세트로 먹었는데 맛있습니다. 사장님도 친절하시구요. 장사 잘 되시면 좋겠어요/마감직전에 갔는데도 친절하셨구, 입맛이 까다로운편인데 너무 맛있었어요ㅎㅎ 앞으로 단골될거같아요/요즘 이 가격에 이정도 양과 맛을 내는 곳이 없는데 정말 맛있습니다. 치즈돈까스 치즈가 풍성합니다 ㅎㅎ 등심도 부드럽더라구요/장사는 약속인데 10시까지 하는 거 알고왔는데도 눈 앞에서 8시 반도 안 된 시간에 문 닫아버리시네요/치즈돈까스 추천/가격대비 좋고 치즈도 좋은거써서 맛있어요. 이 가격에 이런치즈돈까스 좋아요. 근데 제육볶음이 너무캡사이신이많이들은건지 오늘 하루종일 배아파요 같이먹은 사람도그렇고...매운거못드시는분 참고하세요/주말에 새로생긴 호돈돈까스집 방문!! 카레돈까스 나오자마자 맛있어서 정신없이먹다가 치즈돈까스 치즈 늘어나는거보고 우와하며 사진찍었네요 ㅎㅎㅎ 사장님이 직접 고기 두드려서 만드신다더라구용   맛있는데 가격도 저렴해서, 자주 애용하게 될 것 같아요~~/저녁에 아내랑 둘이서 갔는데 깜놀~~ 후루룩 떡볶이는 왜케 맛있는지!! 거기에 돈가스도 짱!! 체인점인지 알았더니 체인점도 아니여서 놀랐어요!!! 자주 가야겠어요!!!"
3,스타벅스 신월ICDT점,서울 양천구 남부순환로 430 (우)07915,스타벅스,"펀치 그래피티 블렌디드,망고,사과,핑크 구아바,파인애플 등 다양한 열대과일로 만든,스트리트 문화의 대표적인 그래피티 벽화처럼 그려진 컬러 드리즐로,롤린 민트 초코 콜드 브루,스타벅스의 콜드 브루와 은은한 민트 초코 베이스로,손목의 스냅을 춤을 추듯 가볍게 돌려 음료를 섞어서,폼폼 유스베리 티,저녁 하늘의 노을이 물드는 듯한 비주얼의 음료.,,아이스 라벤더 카페 브레베,진한 리저브 에스프레소 샷과 은은한 라벤더향이 고급스럽게 어우러진 부드럽고 세련된 풍미의 라벤더 카페 브레베,5,100,밝고 가벼운 풍미의 블론드 원두로 즐기는,폼폼 민트 티,아침 하늘의 구름이 뭉게뭉게 피어나는 것 같은 비주얼의 음료.,",6880,3.8,23,15,"오...번화가에 아니고 이런곳에 스벅이..있다니..좋아요./좋아요 /커피가 맛나네요/줄이 항상 길어서 오래기다려야해영 ㅠ/노인들이 가기 불편한 차도였읍니다/여기 좋아요~^^ 직원분들이 친절하셔서 잘 마시고 왔네요~/늘 사람 너무 많음/직원이 엄청 불친절하고 인상 써서 기분 잡쳐 다시는 가고 싶지 않습니다/친절하고 맛있/Just 스벅/직원분들 친절해요 /2층도 에어컨좀 빵빵하게 틀어줬으면.... 너무 덥다/3층 규모로 갔으면 좋았을뻔. 사람없을 만한 시간대에 갔는데 너무 많아서 깜놀./- 주차 자주식 3대 끝. 주변에 차 세웠다간 경찰온다는 현수막이 많음. 스벅 주차땜에 인근 주민들 엄청 시달린듯. - 복층식 매장은 보통 1층이 춥고 2층이 더운데, 여기는 2층이 추움. 건물을 날려지은게 확 티나는지 외풍 장난아님. 스벅와서 감기걸린적 처음.. - 쇼파밑 콘센트 보유. 비교적 한산한 매장(주차가 안되다보니 그런듯). 그래서인지 매출에 욕...더보기/커피점으로서 만족스러운 곳. 하지만 사람이 너무 많다./탁 트인 넓은 장소가 마음에 들지만, 환경보호로 플라스틱 사용을 자제하는 요즘 시점에 머그컵으로 받길 선택했는데도 머그잔이 다 나가서 머그잔을 못 준다는 황당한 말을 들었음. 매장의 1/4도 안 찬 시점에, 따뜻한 음료, 아이스 음료 혼재되어 있는데 머그컵이 다 나갔다? 글쎄... 평상시 매장이 꽉꽉 차는 걸 아는 사람으로서, 설거지 하기 귀찮거나, 컵 수...더보기/넓어서요/친절하고  커피가  맛있다"
4,우리분식멸치국수,서울 양천구 오목로 14 (우)08031,국수,"떡만두국,감자만두,짜장면,짜장밥,우동",5300,4.1,18,45,
5,부산돼지국밥 신월점,서울 양천구 남부순환로 344 (우)07909,국밥,"얼큰국밥,돼지국밥,순대국밥,올순대국밥,내장국밥,삼색순대",7416,3.8,30,37,"사장님 바뀐거 같아요.../오우~ 맛있음!! 추억의 도시락도 엄지척!!/도시락도 줍니다 맛잇어요. 24시영업하십니다./방금도 먹고왔어요. 레알맛있습니다. 식전에 주는 도시락이 최애입니다. 아래 증거도 없으면서 추측성 발언으로 남의 영업장에 폭탄떨어뜨리는 사람 진짜 극혐이네요~~/코로나인데 배달도 되면 좋겠어용ㅠㅠ 근처 살 때 자주 먹었는데 화곡역 주위로 이사왔더니 돼지국밥 맛난 집도 없구ㅠㅠ /ㄹㅇ맛있음 코로나 이전에 24시간이라 너무너무 좋았는데 코로나때문에 어쩔수없는건 아쉬움 ㅜㅜ 정말정말 맛있음/우선 저희가게에 관심과 애정 가져주신것 감사합니다 저희는 반찬 재사용 하지 않습니다 가게가 좁아 카트 이동이 쉽지않아 반찬그릇들을 포개어 가져오니 오해를 하신듯 합니다 오해와 의혹이 생기지 않도록 방법을 찾겠습니다 앞으로도 좋은 서비스와 만족 드리는 업소가 되도록 최선을 다하겠습니다/자주 가는 곳인데 김치랑 깍두기 재사용 하는것 같아요. 손님들 남은 반찬 옮길때  꼭 김치 깍두기를 따로 빼더라구요.  찝찝한데 사진 증거가 없어서 신고를  못하네요. /잘먹었습니다/부산가서 먹은 맛 못 잊겠어서 근처 음식점 검색해서 왔는데 너무 맛있네요 순대도 당면순대 아니라 좋고 부추 얹어서 먹으니 꿀맛이에요 그래도 부산 또가고싶어지네요ㅜ/얼큰 미만 잡/깔끔하고 맛있습니다~ 돼지국밥 처음으로 부산가서 맛보고 좋아하게된 아들램이 맛있다고 하네요/든든하게 잘먹고 갑니다/5년전 동물농장 744회 출연장소/간판 , 사장님 바뀌고 맛대가리 없음/계란후라이와 무생채를 넣고 비벼먹는 추억의 도시락 비빔밥도 좋고, 국밥맛도 괜찮아요. 주차할 때가 없다는게 단점임../얼큰국밥 내장빼고먹엇어여. 맛나요 국물 깔끔하구 고기도많이주시고 들어잇는 토종순대도 맛남. 비빔밥 해먹을수잇게 되어잇고 아주머니 친절하시던던데ㅎ/무난하다... 다른 선택지를 찾아보고 싶어도 이정도 하는 국밥집이 이 근처에 전무함/존맛존맛!!!/훌륭합니다/얼큰돼지국밥 good. 우리 애들이 돼지국밥을 너무 좋아해서.../비빔밥과 돼지국밥 동시에 이용할수 있어 굿 맛도 괜춘함  /존맛존맛!!!/훌륭합니다/얼큰돼지국밥 good. 우리 애들이 돼지국밥을 너무 좋아해서.../비빔밥과 돼지국밥 동시에 이용할수 있어 굿 맛도 괜춘함  /존맛존맛!!!/훌륭합니다/얼큰돼지국밥 good. 우리 애들이 돼지국밥을 너무 좋아해서.../비빔밥과 돼지국밥 동시에 이용할수 있어 굿 맛도 괜춘함  "
6,할머니추어탕 신월2호점,서울 양천구 가로공원로 146 정용빌딩 1층 (우)07917,추어,"추어탕+돌솥밥,통추어탕+돌솥밥,추어튀김(소),추어튀김(대)",9875,3.3,10,33,난 추어탕 시러하는뎅 엄마는 조아해서 ㅜ 엄마가 저아하는맛집/비싸편~그나마젖갈때문에 별3개~~~~ 맛은 그냥추어탕맛.ㅡ/포장이  안되는데..그냥 2인분 포장해준다고  까만  비닐봉투에..완전  불친절...이세상에     추어탕집이  거기만  있는듯 주문받으시는  분도..주차관리하시는  분도.....다시는  안갈예정 추어탕집이  거기말고는  없나  참..별점  하나도  아까움/주차장 좁아서.. /매일매일 추어도 새로 들어오고 맛있음 돌솥에 밥 나오는 것도 만족스럽고 맛도 아주 좋음/남원에서 먹은 추어탕보다 맛있음/가격대비 꾀 괜찮은 맛/매일매일 추어도 새로 들어오고 맛있음 돌솥에 밥 나오는 것도 만족스럽고 맛도 아주 좋음/남원에서 먹은 추어탕보다 맛있음/가격대비 꾀 괜찮은 맛/매일매일 추어도 새로 들어오고 맛있음 돌솥에 밥 나오는 것도 만족스럽고 맛도 아주 좋음/남원에서 먹은 추어탕보다 맛있음/가격대비 꾀 괜찮은 맛/매일매일 추어도 새로 들어오고 맛있음 돌솥에 밥 나오는 것도 만족스럽고 맛도 아주 좋음/남원에서 먹은 추어탕보다 맛있음/가격대비 꾀 괜찮은 맛/매일매일 추어도 새로 들어오고 맛있음 돌솥에 밥 나오는 것도 만족스럽고 맛도 아주 좋음/남원에서 먹은 추어탕보다 맛있음/가격대비 꾀 괜찮은 맛/매일매일 추어도 새로 들어오고 맛있음 돌솥에 밥 나오는 것도 만족스럽고 맛도 아주 좋음/남원에서 먹은 추어탕보다 맛있음/가격대비 꾀 괜찮은 맛/매일매일 추어도 새로 들어오고 맛있음 돌솥에 밥 나오는 것도 만족스럽고 맛도 아주 좋음/남원에서 먹은 추어탕보다 맛있음/가격대비 꾀 괜찮은 맛/매일매일 추어도 새로 들어오고 맛있음 돌솥에 밥 나오는 것도 만족스럽고 맛도 아주 좋음/남원에서 먹은 추어탕보다 맛있음/가격대비 꾀 괜찮은 맛/매일매일 추어도 새로 들어오고 맛있음 돌솥에 밥 나오는 것도 만족스럽고 맛도 아주 좋음/남원에서 먹은 추어탕보다 맛있음/가격대비 꾀 괜찮은 맛
7,14일의설레임,서울 양천구 월정로 20 1층 (우)08028,"육류,고기",표기안함,표기안함,4.2,6,92,"이베리코가 국내산 돼지보다 확실히 맛나요.. 가격도 무난하고.. 숯불이 좋고 파채와 샐러드도 신선하고요../최애 고깃집입니다./아닠ㅋㅋ 밥이 없으면 주문을 안받아야지 손님한테 밥사오라는 식당은 또 첨보네요;; 햇반 직접 사오면 돌려준다곸ㅋㅋㅋㅋㅋㅋㅋ아유 /가족이나 연인, 누군가를 대접할때는 여기서 드시면 왠지 좋을거 같네요. 첨에는 5가지 a세트로 시작하시면서 고기명을 알아가시면서 나중에는 a세트가 아닌 맛난 고기명을 애기하셔서 그거 위주로 간단하게 드시는것도 좋을거 같더라구요./신정네거리역 2번 출구에서 도보도 14분 거리로 장수공원 길을 따라 올라가다 보면 ‘열녀문(烈女門)’이 나온다 이를 지나 골목길에 접어들면 신정네거리역 맛집 신월동 맛집 인정할 수밖에 없는 맛 ‘14일의 설레임’ 이베리코 인증점을 만날 수 있다. 이곳에서는 ‘소고기 맛 나는 돼지고기’ 도토리를 먹고 자란 스페인 흑돼지 순종 이베리코 베요타(Bellota) ...더보기"
8,신월당,서울 양천구 남부순환로58길 31 지하1층 (우)07915,"제과,베이커리","아메리카노,라떼,우유식빵,향긋한 밀크티,치아바타,향긋한 크랜베리 식빵",3300,4.9,24,54,"처음가본 곳이 인생 빵집 되겠네요~호공크림빵은 느므느므 맛있네요~!/이마트 마감세일 놓쳤을때 보다 신월당 마감 놓쳤을때 가 가장 슬펐음/맛도 좋지만 정이 느껴지는 빵집입니다./정이 느껴지는 빵집입니다./오늘도 잘 먹고 갑니다./먹어보지는 않았지만 마음이 따뜻한 빵집 같아요/케이크 기대했는데... ㅠㅠ 가격대비는 ㅠㅠ좀.. 실망 사장님은 친절하십니다/헤이즐넛 쿠키 맛있어요. 근데 빵 종류가 얼마없어요..ㅜ  위치가 구석진데비해 가격은 좀 비싼거같아요!  /좋아하는 동네빵집/이동네 빵집중 단연 최고  치아바타 정말 굿 5점 !!!  우유식빵 굿 /호두파이 너무맛있어요 치아바타도 부드럽고 스콘은 내일 먹어봐야 겠지만 모든빵 다도전해보려고요 여사장님 친절하셔서 기분좋네요/빵 다 맛있어요~ 식빵은 말할것도 없고 스콘, 치아바타, 크로아상 등 먹어본건 다 맛있네요 좋은 재료를 풍성히 넣으시는것 같아요/저번에 동네 산책하다가 우연히 발견해서 치나바타랑 스콘 사봤는데 진짜 너무 맛있었어요.... 저렇게 맛있는 치아바타는 처음 먹어봤네요 작년에 이 동네 이사와서 집근처에 맛있는 빵집 하나 있었으면 좋겠다고 신랑하고 얘기했었는데 드디어 찾은 것 같네요  오늘 두번째 방문해서 스콘하고 식빵 사봤는데 역시나 맛있었어요 앞으로 빵은 여기서만 살 것 같아요 :)/통식빵이 대박이에요. 사장님도 친절하심/맛있기도한데 직원분이 엄청 호탕하시고 친절하세요/우와…진짜맛있네요/이 동네의 3가지 자랑. 서서울호수공원, 곰달래감자탕,신월당./As a French person, I enjoy small traditional bakeries just like in France and I must say that I am very happy with this one ! I am allergic to milk and butter, so I usually buy only for my husband an...더보기/우연히 들렸는데 너무 맛있어서 놀랐어요!! 치아바타, 스콘 다 너무 맛있습니다/맛있어요 잠실에서 왔는데 멀리 온 보람이 있네요 다음에 또 올래요/맛있고 친절해요 빵이 기본적으로 다 맛있는데 저는 브레드 푸딩이랑 파운드 케이크 그리고 크랜베리 식빵 진짜 맛있게 먹었어요!!! 브레드 푸딩은 안쪽에 진짜 촉촉하고 시나몬 맛나서 우유랑 먹으면 최고에요 파운드케이크는 퍽퍽하지도 않고 담백해요 크렌베리식빵은 개인적으로 크렌베리 안좋아하는데 먹고 생각이 바꼈을 정도입니다... 오렌지향이 나면서 쫄깃 촉촉해요.....더보기/유쾌하신 빵집 주인분!!   기분좋게 빵 사갑니당 ㅎㅎㅎ번창하세요♡♡"
