,name,address,sort,menu,mean_price,score,people_give_score,review_count,review_list
0,황금콩밭,서울 마포구 마포대로16길 9 (우)04205,두부전문점,"두부짜글이,돼지짜글이,시래기비지탕,두부젓국,짜박두부",16400,3.6,83,127,"맛만보고 별점 드립니다./유명해서 기대를 많이했는데 대한민국 손꼽히는 대박맛집 이런 느낌은 아니다 하지만 맛이 건강하고 든든함/이렇게 싸가지 없게 손님 대접하는 곳이 어떻게 미쉐린 가이드일까요?  평소에 두부 좋아해서 여자친구와 함께 기대를 하며 방문했습니다. 사람이 많을까봐 일부러 12시 이전에 갔습니다. 하지만 들어가니깐 QR 찍으라는 말도 없고 손님을 봐도 본체만체 하더라고요. 한 1분~2분정도 기다렸다가 아무 말도 없길래 그냥 빈자리에 앉았습니다. 당시 테이블의 반정는 비워...더보기/생두부가 정말 맛있었어요 다른 음식들은 무난하고 부담없는 맛/두부짜글이, 두부완자 주문했습니다 정말 맛있었어요 . 남자 사장님도 친절하시고 두부가 이렇게 맛있는건지 몰랐어요. 정말 부드럽고 고소하고 은은한 두부본연의 단맛이 좋았어요. 맛집이에요 재방문의사있습니다 두부짜글이는 김치찌개와 부대찌개를 섞은 칼칼하면서 조미료 들어가지 않은 약간 밍밍한 찌개였어요 두부완자는 손바닥만한 큰사이즈로 4덩이가 있었는데  바삭하고 ...더보기/두부성애자로써 인정입니다. 맛있어요!!!!!!!!!/직원들 너무 시끄러워요/두부가 맛나요 ㅎㅎ 전골도 국물이 진해서 좋았어요!! /보쌈도 맛있어요. /두부좋구요 저는 두부완자 너무 좋더라구욤 전체적으로 슴슴해서 밥없이도 먹었어요!/두부 최고/서비스 안좋구요. 맛이 없어요.. 김치도 너무 맛없고 왜 미슐랭인지 1도 모르겠어요….; 보쌈에 김치를 먹었는데 김치 리필은 되면서 포장할땐 상에 차려진 음식만 된다하네요 김치 리필하고 포장할걸그랬어요…참고하세요…/2층 마르고 나이있으신 홀직원분 진짜 불친절합니다. 1층 젊은 직원분은 친절하신데 2층갔다가 이거 싸우자는 건가 싶더라구요. 다른 테이플 응대하는거 듣는데 싸움날까 조마조마. 가격도 괜찮고 맛도 있으니 방문은 할건데 2층은 안갈거에요./맛은 좋은데 가격과 서비스는 아쉬워요./같이 가기로한 한 명이 부득이하게 밀접접촉자로 분류되어 자가격리에 들어가서 같이 못갔는데, 그 한 명 밥값까지 다 내라고 하네요. 말투도 공격적이어서 놀랐습니다. /가슴이 웅장해지는 맛/괜찮아요 맛있음/한번 더 가서 다를것도 맛보고 와야겠어요 잘먹었습니다 /최근에 이전해서 더 좋아짐.미슐랭 빕 구르망에 뽑혔던 집인 이유가 있음./내 인생 최고의 두부맛/너무 맛있어요 두부도 맛있고 무엇보다 밑반찬이 최고네요 집에서 한 맛있는 맛 ㅠㅠ 전반적으로 모든 음식이 간이 강하지 않고 담백하고 좋아요 버드나무 브루어리 맥주를 팔아서 더 좋아요 탁주도 진하고 좋네요 /두부짜글이랑 불고기 먹었는데 집밥 같이 자극적이지 않고 밑반찬까지 맛있어요. 가게도 깨끗한 거 같고 서빙하시는 분도 친절하세요. 정식이 4인부터 가능해서 좀 아쉽네요. 2인용 정식도 있으면 좋겠어요. /그냥 두부만 먹어도 맛있다/두부짜글이 맛있네요/코로나때문에, 포장 주문했는데, 밑반찬없이 주방에 준비된 두부, 두부젓국만 달랑!!!  참!!!  요즘 가져와서 데워먹어야하는 포장주문에 밑반찬없이 주는 곳은 별로입니다. 상차리는 일안하는데, 가격만큼 푸드박스 채워주시죠. /순하고 맛있습니다/두부,청국장,짜글이 시켰고 곧 밑찬이랑 밥 2개 나왔어요. 나온거 먹고 있는데 오셔서 짜글이가 다 나갔다고(11시 40분이었는데..) 50분 기다리면 해준다고 하더라구요. 평일인데 50분 기다릴 사람이 어디있나요. 그냥 청국장이랑 두부만 먹기로 했어요. 계산하는데 천원이 추가되었길래 뭐냐고 물었더니 짜글이 안먹었으니까 밥 1개 값을 추가한거라고 하네요. 제...더보기/두부짜글이 맛이 순하고 두부 고소해서 맛있는데 청국장은 좀 시큼한 느낌이예요. 반찬도 나물종류로 나와서 건강한 식사한 기분이었어요. 두부완자는.존맛탱/두부도 고소하고 전골도 맛났다!/두부김치 전골 먹었는데 전골 자체는 쏘쏘했어요 근데 두부는 진짜 보드라우니 정말 맛있었어요! 다음번엔 버섯두부전골 먹어야겟네요/무난한 백반집./두부가 진하고 맛있습니다. /그냥 무난해요/식사 주문하고 20분 동안 반찬도 안 나오고 벨 눌러도 안오시고.. 서비스는 최악이었습니다. 두부 자체는 맛이 괜찮은데, 짜글이는 밍밍한 고추장국이었어요. 절대로 시키지 마세요. 휴가 1일차인데 덕분에 기분 망쳤어요. "
1,이요이요스시 공덕1호점,서울 마포구 마포대로 167 공덕래미안5차아파트 상가 106호 (우)04131,"초밥,롤","스시,런치,60,000,사시미,타마고,후토마끼",32000,4.0,99,112,"오마카세 멋집 맛집/기대했던 것보다는 그냥 그저그랬어요 평일 디너로 7만원 먹었는데 배는 엄청 불렀는데 다먹고 나니 딱히 뭐가 진짜 맛있었다는 생각은 안드네요 ㅎㅎ 다음엔 다른 곳 갈래요 ㅎㅎ 한번쯤 먹어볼 만 합니다/리뷰가 너무 좋아서 먹어봤는데  생각 보다 너무 별루였어요.  구지 이집에서 스시 먹어야하나? 여기보다 잘하는집 많아요/런치 4.5만원으로 인상, 회가 너무 얇아 식감 밥과 밸런스가 안맞았다. 초창기 방문땐 정말 대존맛이었는데, 점점 명성을 잃어가는 듯하다. /엔트리급 스시야로 최고! /최고입니다 후회하지않을 맛집/가성비좋음, 예약시간정각에 입장가능하니 지금처럼 추울때는 너무 빨리가면 밖에서 덜덜떨어야함! /ㅋㅋㅋ/맛은 있는데 홀에 계시던 여자 직원분이 너무 불친절함 걍 귀찮아 보였음 말하는것도 서비스도 설명도 너무 대충하고 원래 식사시간 고려해서 서빙해야하는데 한번에 음식 여러개 내올때도 있고 그냥 안오느니만 못했음  3호점에서 첨 먹고 너무 만족해서 1호점도 와봤는데 다신 안올예정…/가격대비 진짜 좋은집. 디너 오마카세 양 많고 다양함. 너무 많아서 저녁먹고 한시간 이상 산책함. 바 테이블에 앉았는데, 음식 만드는거 보는 재미도 있고 디쉬 하나하나 친절하게 설명해주시는 쉐프님 매우 친절하셨음./안키모 굿/가성비 좋은 스시집입니다 예약금 걸어야하는 번거로움있고 부산스럽게 우르르 몰려가서 일렬로나오는것들 쭉쭉 먹고 나오는게 정신없지만 음식 퀄리티가 다커버칩니다 조금 조용히 천천히 나왔으면 좋았을텐데 옆테이블 손님은 늦는다고 불만이더군요/분위기 좋고 맛 좋고/삼일전 예약하고 오늘 점심12시 방문 카톡으로 연락오면 계좌로 완불후 예약완료라는데 카톡은 오지않고 예약취소인지 확인문자나 연락도 없이 결제 안됐다고 취소시킴 12시정각에 기대와 배고품으로 딸과 함께 갔다가 너무 황당해서 그냥 나올 수 밖에 없었슴/양은 많은데 질은 그닥.. 숙성도 되다 만듯한 느낌이고 음식에 시간이 부족한 느낌을 받았네요..:( 그리고 스시 플레이트 안닦아주셔서 좀 그랬음../먹는 내내 사람을 기분 나쁘게 쳐다보던 곳.. 옆의 지인은 몰랐겠지만 음식 확인과는 다른 눈빛 댚눈빛으로.. 그리고 대충, 빠르고 못 알아들을 메뉴 설명과 한 메뉴가 두번 나오는 실수와 하도 급하게 주느라 사시미회를 떨어트렸다가 다시 올려주신다던가.. 8시 디너에 8시5분쯤 앉았고 그 점은 미리 전화해서 양해 구했는데, 정해진 디너 시간 15분이 남았음에도...더보기/가격에 적당한 맛과 서비스 부담스러운 것을 견딜 수만 있다면 바에 앉는 걸 추천해요 정말 1시간동안 좋았습니다/유명하던데 ㅎㅎ 맛잇더라구요/2,3호점만 가다가 1호점은 처음인데 1호점도 역시 굿. 가성비 정말 좋은 오마카세에요  근데 개인적으로 분위기는 2호점이 나은듯/오마카세가 익숙하지 않은데, 기념일이라 좋은 식사를 하고 싶었어요. 이전의 다른 곳에서의 경험이 즐겁지만은 않아 이런저런 고민과 걱정을 안고 방문했습니다. 그런데 김효종 쉐프님께서 무척 친절하게 재료들을 설명해주셔서 긴장하지않고(!) 편안한 분위기에서 맛있고 즐거운 경험을 했습니다. 내어주시는 음식에 감칠맛이 잘 살아있어 입이 즐거웠어요!! 감사합니다 /<2021년 3월 주말 오후 방문> Upside: 가격대가 괜찮다...? Downside: 그저 그랬던, 어디서 먹어본듯한 코스의 향연. 카운터 제외 너무 많아 음식에 집중할 수 없음./맛잇어요짱입니다/그냥그래요.../오마카세가 처음이어서 잘모르지만 맛있었고, 전체적으로 만족하고 나왔습니다^^/최고/셰프는 친절하고 추가 피스도 먹었어요~ 가성비/음...예전이랑 다르네요. 친구 불러서 갔는데.. 무슨 공장인듯 똑같이 쭈르륵 나오고. 빨리먹으라는 식으로 닥달하더라구요. /유명하던데 ㅋㅋ 맛있네용/비교적 싼 가격에 맛있고 잘 짜여진 코스/맛있어요~ 식당 공간이 좁아서 정신 없는 것과 서비스가 아쉽습니다."
2,락희옥 마포본점,서울 마포구 백범로 170 공덕더샾 101동 1호 (우)04148,한식,"락희옥불고기,한우등심 불고기의 원조는 락희옥. 앞다릿살을 쓰는 일반 불고기와 차원이 다릅니다. 고기 본연의 맛을 위해 양념과 숙성 시간을 절제했습니다.,38,000,문어숙회,쫄깃하고 야들야들한 문어숙회를 미나리, 초장, 기름장과 곁들여 드시는 요리입니다.,38,000,추천,40,000,차돌박이구이,고급 한우만 씁니다. 질기지 않고 야들야들하게 0.2mm로 얇게 썰고, 양념에 설탕 대신 파인애플즙을 사용합니다. 새콤달콤매콤한 부추 무침과 곁들여 먹습니다.",37666,2.8,52,89,"가격 보소 ㅋㅋㅋㅋㅋㅋㅋㅋㅋㅋㅋㅋㅋㅋㅋㅋㅋㅋㅋㅋㅋㅋㅋㅋㅋㅋㅋㅋㅋㅋㅋㅋㅋㅋㅋㅋㅋㅋㅋㅋㅋㅋㅋㅋㅋㅋㅋㅋㅋㅋㅋㅋㅋㅋㅋㅋㅋㅋㅋㅋㅋ/가야는이유 : 콜키지프리 명소로 유명한 안가는이유 : 가격은 좀 아쉬운 부분  보쌈,육전,김치말이국수 : 대표메뉴인 보쌈은 냄새는 덜하고 큼직큼직하게 썰리는 편인데 큰 감흥까진 없고 비계가 부담스럽긴한, 육전은 반대로 고기가 살짝 두께가 있으니 씹는 맛 나는, 김치말이국수는 고기육수 느낌이 있고 양념맛도 좋았지만 면이 별로, 전체적으로 먹다보니 양이 적진 ...더보기/믿기지않을만큼 싱겁고 맛이 없어요 진짜 돈 개아까워요 수요미식회 돈주고 나간건가요;;/맛 괜찮아요/가격대비의 양이 작은건 맞는데 음식 괜찮은 편이고, 친절하다. 게다가 콜키지프리.  여기 와인가격도 시중 와인샵 대비 저렴한 것들도 있어서 꼭 와인 준비해오지 않아도 될듯하다. /곧 없어질 것 같은데, 한번 가보시는 것도 추천드립니다. 사장님인지 매니저님인지 굉장히 불친절하시네요./가격 대비 별로,,/가격 대비 그닥… 일반 소주는 없음/비싸긴 비싸군 ~~강남에서도 만원짜리 국수는 없는데/좋은재료. 보쌈 맛있어요/콜키지프리인 것이 가장 큰 메리트  하지만 와인이랑 페어링하기 좋은 안주는 많이 없네요ㅜㅜ/으아...음식점이 서비스업종 아닌가요 눈치보고 먹게 만드네여 짜증 팍!!!! 별하나도 아깝네여/가성비 정말 별로 그렇다고 특별히 맛있는것도 아니고 평범한 안주도 너무 비싸게 받네요/워우 ... 음식이 맛은 있는데 엄청 비싸고 주문과 서빙도 고객이 눈치를 봐야하는 분위기. 메뉴 중에 실제로 없는 것도 많고. 화장실도 열쇠 갖고 밖으로 가야 함. 장점이 거의 없음. 다시는 안 감./가성비 최악중에 최악인듯요. 바로옆인데 한번 가고는 절대 안가기로 다짐을하게 만드네요../와..../이번에 갔다가 매우 실망했습니다. 가격, 맛, 양, 서비스 모두 별로네요./맛도 별로인데 양은 쥐꼬리.. 제일 별로인것은 손님대하는 거만하고 불친절한 태도!/콜키지프리 한식/서울에서 가장 가성비 안나오는 음식점일듯 창렬지수 만점/마포술집 중 창렬의 대명사. 퀄리티가 떨어지는 건 아니지만, 그가격에 음식 쥐밥만큼 나옴. 여럿이가면 안주 앞에서 서로 눈치보게 되는 곳./김치말이국수, 된장국수 시켰는데...  후식용인줄알았어요.. 고명도 거의없고../가성비가 매~우 아쉬움  멍게비빔밥은 ok  차돌구이는 정말 고무줄같이 질긴 저질 고기를 사용  가격대에 비해 질 나쁜 고기 사용으로 실망함 /괜찮으면서 안괜찮은집. 세명이가면 메인 최소2개~3개를 시키면 좋더군요... 콜키지 프리 장점이 있지만 안주에서 장점이 무색해지는느낌이 좀 있습니다:) -호불호/이 장소로 옮기기 전에 3번정도 방문 식사메뉴만 먹어보았음 가성비는 그닥... 제일 저렴한 메뉴조차 양을 보면 그 값을 못함 맛은 그럭저럭 건강한 맛 하지만 그 돈주고 가기엔.../음식은 전반적으로 괜찮으나 가격이 의문이 듬 와인콜키지 무료는 매우 좋음/2018.03.23 마님과 /맛은 깔끔하나 가성비 떨어짐/음식이 맛보다 가격이 너무 비싸다 생각 드는게 맛이 없는거겠죠? 명성에 비해 완전 실망한 곳/이전부터 가고싶었는데 본점을 공덕으로 이전하면서 급방문! 역시 명성에 맞게 보쌈이 엄지척이었다 오겹살을 보쌈으로 만든것같은데 정말 살은 부드럽고 비계랑껍질은 쫄깃하고 너무맛있었음 ㅠㅠ!! 육전이랑 다른 식사들도 괜찮구(다만 양이 적음) 와인콜키지프리라 우리테이블을 제외한 모든 테이블이 와인을 먹고있었다 나도 다음에 와인들고 방문예정!!"
3,파네트,서울 마포구 마포대로11길 17 (우)04142,"제과,베이커리","초코 엔젤,생크림 단팥빵,파네트치아바타,올리브 치아바타,파운드케이크",3620,4.1,63,95,"정말 다 맛있어요./아주 쪼금 아쉬워요/정말 다 맛있어요 ㅎㅎ/다맛있어요 주말아침마다 빵털러가는중/그냥 뭐 존맛 . .  1시에가도 빵이 별로 없어서 아쉬워요 ㅠㅡㅠ/ /파네트 4년차의 최애는 소금빵, 매콤소세지빵, 버터프레첼, 앙버터, 그리고 가끔 나오는 양송이스프 맛있어서 장사가 너무 잘되는 빵집이라 계산대 직원들이 늘 바쁘고 상당히 예민하심 친절도는 기대마세요/크로와상 : 크로와상이 제일 베스트 ! 결 다 살아있고 다음날 먹어도 바삭바삭함. 초코, 크림크로와상도 짱짱 맛있음 앙버터 : 빵바삭하고 겉에 살짝 짭쪼름한 곡물들과의 조합이 쩔음 팥앙금도 건더기 살아있어서 최고 !  버터프레첼도 괜찮음 그치만 앙버터가 더 맛있다 까눌레 : 짱맛있음, 그러나 가끔 눅눅한 까눌레 나올때도 있음 랜덤임 소금빵 : 미쳤음 그냥 ...더보기/맛있어요/대박 맛있음!!/올때마다 빵사가는데 역시 맛있음!! /크림빵 다시 팔아주세요.../빵이 존맛탱 가격이 비싸지만 가격값 하는듯/케익을 사려고 케익을 진열장에서 꺼내진 상태에서 결제하면서 포장하면서  초 갯수까지 말하고 있는데 갑자기 전화를 받더니 그 손님 주겠다며 바로 눈앞에서 케익을 도로 뺏어가네요 눈앞 손님이 계산중에 전화손님한테 빼주면서 미안하단 말도없이 얼른 가란듯이 안녕히가세요 하는 거 보니 손님 골라받는것도 아니고 장사 이상하게 하네요 굉장히 불친절하고 이상한 운영이어서...더보기/잘 먹고 갑니다./한번은 가볼만한 곳입니다./단호박깜빠뉴, 밤빵, 대파빵이 진짜 정말 맛있어요.. 시그니처인 바질토마토?랑 크로와상은 그냥 나쁘지 않았어요. 빵 속에 재료가 정말 가득해서 너무 좋았습니당/단호박깜빠뉴ㅠ 무화과스콘 강추강추강추ㅂ 버터프레첼도 존맛 바질토마토는 예상가능한 맛이었어요ㅋㅋ /에그타르트 왕맛/하나하나 다 맛있어요!/웬만해서 리뷰 안다는데 진짜로 제가 가본 빵집중에 역대급으로 분위기 좋고 고급스러운 빵집이에요!! 진짜 강추!!! /바. 질. 토. 마. 토/바질토마토, 먹물 치아바타 꼭 먹어야 하는 집/공장빵과 구색갖추기 메뉴를 제일 싫어하는데 파운드케익은  빵을 잘못 고른듯 하다 잘하지 못하는 빵을 비싸게 파는것보다 비싸게 팔거면 잘하는 빵에 집중하는게 좋을것 같다 /특별함을 모르겠다.. 그냥 평범한 빵집/크림 들어간 크로와상 먹었는데 이거 진짜 맛있네요! 담에 또 와서 다른 빵 먹어봐야겠어요. 가격은 전반적으로 괜찮은 편입니다./먹다보니 계속  손이가는 바삭한 크로아상/어~좀 비싸네~ 하는데  초코 크로와상 마늘빵,에그타르트  ☆백화점의 왠만한  곳보다 더 맛있다 먹다보니  찾게  됨/다신 안가라고 생각하진 않았는데 다시 먹고 싶은 기억남는 빵도 없는거보니 사람들이 맛있다고 하는만큼 특별한 맛은아녔던듯  /빵순이인데 너무 맛있어요 ㅠㅜ/존맛임 버터프레첼, 고구마치즈어쩌고, 텃밭깜빠뉴, 크랜베리스콘 걍 다 존맛..... 주기적으로 먹어줘야하는 빵집/바질토마토 넘 맛나요.......... 크루아상은 전엔 맛낫는뎅 요샌 맛 변햇는지 그닥..?/에그 샌드위치, 버터프레첼, 팥빵, 호두브리오슈 당근케익 이렇게 자주 먹는데 맛있어요. 자극적이지 않은 맛으로 느끼하지 않고 뒷맛이 깔끔해서 좋은 재료 쓰시는 거 같다는 생각이 들어요. 특히 요즘같이 예민할 때 종업원 분들이나 빵 보관 상태도 위생적인 듯 해요. 근데 별 하나 뺀 이유는 빵이 어떤날은 일찍가서 사도 평소보다 퍼석퍼석하고 촉촉하지가 않을 때가...더보기"
4,함루,서울 마포구 백범로 170 더샾아파트 102동 상가 1층 110호 (우)04148,일식,"히츠마부시 (소),우나동 (1마리),히츠마부시 바다장어,우나기 구이 (1마리),아나고 구이 (2마리)",27000,3.0,38,141,"맛은 있었으나 직원 서비스 진짜....... 노답 함루 하면 직원 응대 엉망이 먼저 떠올라 가기 싫어지는 곳이 됐어요!/가격만비쌈 둘이서 9만원짜리밥먹으면서 공기밥은 쥐똥만큼주고이천원받네요/음식은 비쌈, 가격대비 음식,응대 별로. 그냥 가까운 덮밥집을 가세요./옛날보다 퀄리티가 영../가시가 너무 많아요.../3-5시 브레이크타임이래서 2:18에 갔더니 2:15가 라스트오더라 주문 안 받겠다네요. 그런 공지 어디에도 눈을 씻고 찾아봐도 없어요. 장사를 하겠다는건지 뭔지. 2:15부터 5시까지 쭉 손님 안 받고 노셔서 좋으시겠어요./서비스가 너무 불친절하네요 ..   직원분들 전부 주방으로 들어가셔서 큰소리로 떠느는게 테이블까지 다 들리고, 음식맛도 구성도 가격대비 너무 별로였어요.   적어도 기본적인 서비스는 필요하다고 생각듭니다.   /3번째 방문인데 항상 맛있습니다. 잘먹었습니다./명성에 비해 별로임  돈아까워요/연어알 비린게....  신선 재료가 아닌듯/여기 진짜 ... 맛 가격 다떠나서 직원들 일할 의지가 없어보여요.. 뭐좀 요청하려고 카운터쪽 가서 계속 직원불렀는데 인기척도 없어서 결국 주방쪽 커튼 살짝 열고 불렀어요. 물어보고 되돌아올때 카운터 뒤에 쪼그리고 조용히 핸드폰하면서 앉아있던 직원보고 진짜 충격받았어요../정갈하고 맛은 좋은데 장어가 진짜 너무 적습니다..다른데에 비해 장어가 너무 얇고 양이 적네요 /맛은 있음, 가격은 사악함, 가성비는 그닥, 데이트로 오기 좋음/며칠 전 히츠마부시 보통과 큐브스테이크를 먹었다. 소문과 평이 좋길래, 그리고 많이 시장해서 혼자서^^ 웬걸 히츠마부시 뭥미... 마른 멸치는 아니고 마른 장어... 한 마디로 형편없다. 그나마 큐브스테이크 나름 괜찮다 생각했다. 메뉴판을 보지 않고 주문했기에 상대적 그리고 절대적 가격으로 수입육이라 생각했기에... 지금 보니 메뉴판에 한우라 적혀 있다. ...더보기/김앤장이 인정한 장어덮밥 맛집  일본에서 먹었던 장어보다는 좀 덜 통통하지만 따듯한 한상을 대접받는다는 기분이 좋았어요. /고급집니다 정말. 분위기도, 음식도./맛도 분위기도 깔끔하다. 가끔 장어덮밥이 생각날때 갈 만하다./일본에서 먹었던 히츠마부시보단 떨어지지만 나쁘지 않았습니다.ㅎ/나고야의 맛난집들은 다 돌고와서 기대를 안하고 갔는데 기대보다 더 별로였어요... 굳이 일본에선 나고야가 아니어도 히쯔마부시 먹을때 가시가 날카로운 식감내는집은 거의 없었는데 여긴 조금 조심스럽게 먹게되더라구요... 장어라기보다 그냥 말린 장어같았어요. 장어의 지방을 제거한게아니라 살까지 제거하고 말린것같은... 말린 생선먹는느낌이었고...  소스가 충분하...더보기/최고예요~/좋은 가격의 맛있는 히쯔마부시. 온도가 조금만 더 찼으면 더 좋았을 잘 뽑은 에비스생맥주. 그 뜨거웠던 지난 8월15일의 기억./여자분이나 양이 적은 남자분들은 .5 드시는게 좋음/아직 오픈한지 얼마 안되서 그런지 아직 분위기가 어수선하구 히츠마부시는 맛은 있지만 계란말이는 특별하지 않았습니다. "
