,name,address,sort,menu,mean_price,score,people_give_score,review_count,review_list
0,고른햇살,서울 성북구 개운사길 14 (우)02842,분식,"원조김밥,쌀떡볶이,김치만두 (8개),찹쌀순대,물냉면",3600,4.4,123,156,"맛은 있는데.. 먹다가 머리카락 나옴..ㅠㅠ 위생 좀 더 신경 써주세요.. /체육김밤 먹었는데 ...체육 맛이 너무 매워졌네욤 ㅠㅠ 그리고 계산해 주는 아줌마 바쁠 때 너무 느리고, 너무 불친절해요 ㅠㅠㅠ /기본김밥 2500원으로 오른건 좀 슬프긴한데 그래도 ㄹㅇ 여기만큼 혜자스러운 데가 없음 2줄먹으면 배가터질정도니/이사하고 시스템이 엄청 좋아졌네요 ! ㅎㅎ  양도 많고 맛있어요 언제나 ㅎㅎ/미친맛은 아니지만 맛있음..../오참이찹의 기적 안암 자취의 빛 찹쌀순대/이젠 들기름을 안쓰시네요 ㅜㅜ  휴 맛이/음식이 너무 짰습니다. 참치김밥 김치김밥 먹었는데 둘 다 그랬고요 심지어 순대도 짰습니다. 소금을 찍지 않고 먹어도 짰어요. 좋은 평만 많아서 기대했고 손님들도 많아서 기대했는데, 제 입맛이 이상한 건지.. 아님 단골 학생들이라 짠 맛에 길들여진 건지…/김밥이 너무 차가워요.. 양은 무지 막지합니다.  김밥 속 모든 재료가 너무 차가웠네요 이가 시릴 정도로.. /진짜 맛있는 곳으로 인정!!/여기는 ㄹㅇ임/참치김밥추천 저렴하고 맛있고 푸짐해요/이정도면 전국에 몇 안되는 분식집입니다 가격,맛,퀄리티 삼박자면 끝났죠 뭐... 집이 멀어 자주못가 아쉬울 따름입니다,,,/가격이 올랐어요  누가 수정좀 해주세요 난 바빠서 ㅋㅋ 많이 찾는곳은 다 이유가 있는법/스타일이 올드해요/고햇은 사랑입니다 참치 vs 제육 중 항상 고민하다 결국 참치를 시키지만 제육도 존맛입니다 혼밥도 좋은데 여럿이가서 참치+제육+치즈라볶이+라면 이렇게 시키면 배 터지게 먹어도 2만원이 안되는 가성비 갑 고햇... 식사시간 웨이팅 없는날이 없으니 애매할 때 가세욤/존맛/참치김밥은 양이 많음 맛는 그닥 라면도 평범 대신 싸고 친절+손님 많음/가성비/맛도있는데 사장님 서비스 철학이 대단하십니다!! 참치김밥은 필수에요/그립다 고른햇살 내 다시 가는 날까지 부디 영원하기를/치즈라볶이 4500원인데 한 대접 나옵니다,, 김밥하나 추가해서 2명이 먹으면 될 정도의 양이라 가성비 최고용></짱 맛있었어요❤/넘 맛잇고 좋아요ㅠㅠ/안암을 밝히는 빛/말해뭐해 짱짱햇살/예나 지금이나 맛있고 저렴함/참치김밥 최고/참치김밥이랑 라면은 국룰입니다ㅎㅎ 라볶이랑 다른 메뉴 시켰는데 사실 평범했어요../여기는 참치김밥을 꼭 드셔보세요! 우동 괜찮고, 라볶이는 생각보다 평범했어요ㅎㅎ 저가격에 음식 양과 퀄리티들이 끝내준답니다♡/마음의 고향/최고의 가성비 맛도 좋아요 "
1,이공김밥 안암본점,서울 성북구 안암로 61-6 (우)02855,분식,"이공김밥,이공떡볶이,라볶이,신라면,오뎅탕,참치덮밥",3000,4.2,71,170,"이공하믄 가성비.가격저렴.양많고.빨리나옴.사장님서비스짱.여긴별5개도 적다.포장.배달은 양이더많다 악플리뷰믿지마세요.일단가보셈.후회업슴/기름이 쫙뺀 뻑뻑한 참치가 가득들어서 첫입먹고 이거 먹고 자칫하다 기도로 넘어가 죽을수도 있겠다 생각나서 조금씩 먹었었네요. 제껏만 그런것 같은데 마요네즈가 없던것 같아요. 저처럼 명성만 듣고 처음 드시는분들은 집에서 꼭 마요네즈 곁들여서 드세요 엄청 뻑뻑해요./성공을 부르는 맛! 공부 열심히 하고 돈 많이 벌어서 다시는 먹지 말아야지 하는 맛! 한입에 쳐넣었다가는 죽을 수도/토핑양이 저세상입니다... 먹으면 하루 굶어도 될 정도../학교 앞에 있어 행복한 분식집. 김밥을 비롯한 메뉴의 종류가 상당히 많고 속을 꽉꽉 채워주신다.  참치김밥과 (치즈)라볶이 조합은 근본. 참치 양은 어마어마하지만 마요네즈를 따로 주셔서 고른 햇살보다 퍽퍽한 감이 있다.  ★★★★★ : 맛집 ★★★★☆ : 유쾌, 재방문 의사 있음. ★★★☆☆ : 무난 ★★☆☆☆ : 별로, 재방문 의사 없음. ★☆☆☆☆ : ...더보기/가본 분식집 중 최고/참치 김밥 고른햇살보단 퍽퍽함 이유는 마요네즈는 비벼서 안넣고 따로 짜줘서 김밥을 마여네즈에 찍어 먹기 때문  하지만 맛과 가격 아주 좋음/스팸김치볶음밥은 진짜 맛없어요  돈가스도 괜찮고 김밥류도 맛나요/다이어트 중이라 밥 적게 달라고 말씀드렸는데도 완전 주먹만했음 ㅠㅠㅠㅠ 사장님은 작아졌다고 했는데 그래도 다른 곳 1.5배예요 ㅠㅠ 감사합니다 굳굳☆/이가격에 이만한 퀄리티면 됐지  뭘 더 바라시는건지 호기롭게 라볶이까지 시켰지만 다 못 먹음 양 많지 가격 착하지 맛 나쁘지 않지  밥까지 무한인데 여기서 다 뭘 바라면 안 되지/기본 메뉴 이공김밥, 베스트 메뉴 참치폭탄김밥 맛있어요!! 지하철 타고 왕복 3시간 갔다 왔는데, 매 주말마다 출석체크하고 싶네요ㅎㅎ/푸짐한 양과 착한 가격/제육김밥 맛있게 먹었어요! 김밥이 완전 두꺼워서 김밥싸는걸 보면 김밥을 만다기보다 접는다는 느낌이에요! 가격 착하고 양도 푸짐합니다. 개인적으로 라볶이는 그냥..저는 좀 안맞더라구요! 그런데 왜 요즘 같은 때 QR체크인을 안하는건가요? 수기방명록도 안보이고..시국이 시국인만큼 불편했습니다./미쳤어요... 역대급입니다 출장와서 이틀 연속옵니다/가성비 좋네요 재료를 아끼지 않고 푸짐하게 넣어줍니다  근데 맛은 그냥 그래요/시킨메뉴 라볶이 참치듬뿍김밥 돈까스김밥 너무기대가컸는지 크기는매우크고 양은많음 하지만 참치는퍽퍽하고 돈까스김밥은짜고 라볶이는달았음 한번으로만족 메뉴가많아서다시도전할까싶다가도망설여짐/김밥이 왜이리 달지.. 60평생 달짝지근한 김밥은 첨 느글느글 반줄먹다 다 버렷슴/포장해서 먹었어요. 참치로 가득한 김밥에 마요는 따로 주셔서 너무 좋았어요. 떡볶이가 맵다고 해서 마음에 준비를 했는데 약간 매콤한 정도였어요~ 맛있었습니다~/너무 싸고 맛있어서 좋은데 떡볶이는 너무 매워서 다시는 못먹겠다 저번에 치즈떡볶이 먹고 후회했는데 잊고 또 시켰다...  복코빌 지수 11/5 /목이 뻑뻑할 정도로 가득 담아주는 참치. 그리고 마요네즈를 따로 주십니다. 3000원에 이 정도 양이면 정말정말 혜자. 근데 이걸 먹으려고 멀리서까지 올 맛은 아니고, 그냥 지나가다 배고플 때 먹으면 가성비 좋은 분식집!/여기서 먹다보면 다른데서 참김 못 먹겠음/참치김밥 한줄만 먹었는데 배가 부르네요. 삼천원의 행복! 브레이크 타임이 있으니 늦게 가시는 분들은 네시이후 다섯시 전에 가셔서 드시는걸 추천드려요! 안암역 갈 일 있으면 꼭 들려서 포장이라도 해올 맛이네요. 가성비 굿!/친절하십니다 맛도 나쁘지 않습니다 다만 위생적이지 않습니다  굳이 멀리서 찾아오실 정도의 맛은 아닙니다.. /참치김밥이랑 라볶이 맛있어요/맛있고 싸고 양이 많은데 친절하기까지 하셔서 기분이 몇 배로 좋은 식당이었어요♥︎ 다음에 또 올게용/맛있어요!! 양도 푸짐!!/김밥중 야채김밥이 최고!!/우선 주인장하고 직원분들 친절해요~ 굿굿~!   가격은 대체적으로 착한가격이에요   간이 싱거운편에 속해요  전 싱겁게 먹어서 좋았는데 같이간분들은 싱겁다고하시네요~ 김밥은 밥의양이 적어서 좋았어요~  먹고나서도 딱좋아서ㅎㅎㅎ  밥좋아하시는분은 싫어하실듯 보여요   이집은 간이 싱거운편이니 참고하세요~~/너무 친절하시고 집밥 같은 건강한 손맛입니다! /우왕 혜자에여 맛있고 싸요/5년간 고햇만 갔었는데 이제는 멀어도 이공만 갑니다"
2,백소정 본점,서울 성북구 개운사길 30 2층 (우)02842,"돈까스,우동","마제소바,냉소바,자루소바,돈카츠,오로시카츠",8580,3.5,36,72,"마제소바는 맛있는데 다른건 별루임 마제소바만 먹기/무난하게 마시쪙 소바랑 카레는 그닥/맛, 양 모두 아쉬운데 가격도 아쉽다../맛있어요/무난하게 맛있어요/안암에서 무난한 일식집 아닐까 싶은.... 특별한 맛은 아님/모든 매뉴가 맛있지만 마제소바 핵꿀맛 줄서서먹는 맛집임/맛있고 혼밥하기에도 좋아서 자주 와요. 알바생들 꽤나 친절하시던데 복불복인가 봅니다./무난/목요일 저녁 알바분 너무 불친절해서 기분이 별로였습니다/솔직히 마제소바랑 돈까스 맛있음 하지만 돈까스 크기나 맛이 예전보다 덜함 그리고 직원 불친절하다는 얘기 자꾸 나오는데 선 넘으면 더이상 안 갈 예정/알바생 불친절해서 절대 안갈거고 가지 마세요 그리고 맛도 진짜 평범한데 가격도 드럽게 비쌈/대학 다닐때 가끔 왔더뉴맛집 ㅠㅠ/맛있습니다! 메밀소바 고명이 많아서 먹기 너무 좋았고 돈까스도 느끼하지 않았습니다. 마지막 디저트로 먹는 연유떡 먹고싶어서 또 가고싶네요 껄껄 가게는 아담합니다!/마제소바 정말 맛있다/직원교육이 많이 필요한 것 같네요.. 외국인 여자친구가 지난번에 동일브랜드의 다른 식당에서(고려대 바로 앞) 포장해달라고 요청했을땐 플라스틱 용기에 정성스럽게 포장해서 줬었고 요청하지도 않은 밥과 샐러드 까지 추가해서 정성스레 포장해줬습니다. 마냥 새거인듯처럼요.   그 기억을 갖고 간 오늘 식당(본점?)에선 포장해달라고 요청을 했더니 종이로 된 포장용기를...더보기/어떠한 설명도 없이 영업시간에 가게 닫아놓는 가게. 앞에 오셨던 커플분도 ""뭐야... 왜 닫았지""하시면서 시무룩해서 돌아가셨어요. 심지어 잔뜩 화나서 썼던 리뷰도 삭제당했네요. 고객과의 약속을 뭘로 아는건지 신경써서 정한 일정 다 꼬인 최악의 날이었어요./싸고 맛 있고 대단해요 그냥/자루소바를 시켰는데 맛있네요. 정갈한 분위기가 좋았습니다. 새우튀김도 참 맛있더군요. 그런데 양이 혜자네요. 면이 너무 많아서 빠져죽어도 모르겠더라구요. 먹다가 배터지는 줄 알았습니다. 많이 드시는 분들은 좋을 듯 합니다./Very tasty food at a reasonable price. However, I am a little upset because of one fact. I sat at a table and ordered my food. While I was waiting, I took off my mask. The waiter came to tell me to ke...더보기/가격, 맛, 위생 다 최고/음식은 맛있고 괜찮은데 홀아줌마 불친절함. 단무지에 깍두기 국물 묻어있어서 먹던 건줄 알고 바꿔달라고 했더니, “먹던거 아니에요”이러면서 안바꿔주려고함.  반찬 리필도 까먹어서 안해주고 서비스는 별로./맛있어서 작년부터 자주 갔어요. 위생에도 불만이 없었습니다. 그런데 코로나 터지고 주방 직원들은 왜 마스크 안쓰죠? 생각해보니 이전에 턱에 받치듯 쓰는 마스크도 안썼던거 같아요... /음식은 흠 잡을 것 없이 맛있습니다. 다만 2인석 자리도 좁은데 가방 나둘 수 있는 바구니 같은것 창가쪽에 비치되 있으면 좋겠어요. 학생들이 많이 찾아오는 식당인데 2인석 앉을 때 마다 가방을 바닥에 나둬야 하다는것이 상당히 불편합니다. 개선해주시면 좋겠습니다./양이 많고 돈까스가 매우매우 부드럽다. 마제소바는 우동면이라 살짝 당황했지만 맛있음!/안암에 소바집 생겨서 행복함 ㅠ 다른 집은 너무 쯔유가 달아서 ㅠㅠㅠ 양도 많고 돈까스는 진짜 역대급 ㅠㅠㅠ 카레도 맛있었음. 온소바 기대중 ... /아 밋남!!!! 소바!!! 글구 친절하고 깨끗함. 온소비 추가되고 대기만 없음 더 좋을듯/돈까스가 여기서 스윙스 먹어도 울고갈듯"
3,야마토텐동,서울 성북구 고려대로28길 2 1층 (우)02856,일식,"토리텐동,에비텐동,부타텐동,새우튀김 (1개),닭꼬치 튀김 (1개)",7000,4.0,62,97,"맛있어요/보는재미 먹는재미 둘다 좋습니다 다들 친절하심/웨이팅이 긴게 가장 힘들뿐에요 ㅠㅠ포장해오면 안 기다리고 편히 먹는건 좋아서 메인보단 사이드 튀김류들 해보았어요. 다만 닭다리가 종종 기름기 많은날이 있기도한 늘쑥날쑥이 있어 아쉬워요. 그래도 고대 앞에선 가장 최고같아용/맛은 있었으나 재방문은 모르겠다./텐동 맛있어요/ 일본식 텐동을 즐기기 적합한 곳.  대단한 맛의 튀김을 만드는 곳은 아니다. 하지만 깔끔한 맛과 적당한 가격,  매장 특유의 분위기가 더해져 안암에 올 때면  슬쩍 슬쩍 눈길이 간다.  요즘 같은 시기에는 코로나로 인해,  인파가 상당해 가기 부담스럽지만 재방문 의사는 언제나 충분하기에 5점 남긴다. /튀김의 신이 장사하는 곳 멍청하게 또 갈까봐 와드 박음./맛있어요 생각만큼 막 기름냄새 심하고 그러진 않았어요 그리구 좌석간격은 코로나라 띄어앉기여서 괜찮았는데 이후엔 조금 좁을 순 있음/웨이팅이 긴게 단점인데 맛은 최고/맛있는데  미소라고 해야하나 일본식 된장국 완전 내취향 딴데는 여기처럼 깔끔한 맛이 안남/맛도 괜찮지만 매장을 일본풍으로 잘 꾸몄네요~ /처음 두세입은 맛있어요. 근데 텐동자체가 느끼해서 코리안 입맛에 김치없이 먹으려니 힘든../맛있음/일단 규텐동을 주문한게 실책. 고기 질이 낮다. 튀김 자체는 괜찮은 편. 간장소스  괜찮음. 반숙달걀튀김도 괜찮음. 고추피클 젤 맛있음. 쌀 퀄리티가 별로.  결정적으로 자리에 앉자마자 불쾌한  냄새에 충격! 식당안에 맛있는 냄새가 식욕을 돋우는게 아니라... 화장실 가까운 자리였는지는 모르겠음. 네이버, 카카오 다 평점 양호했는데.... 속은 느낌. 재방...더보기/참 맛이 있다. 쌀밥맛이 조금 아쉽다./맛있긴 한데 가게 안에 기름냄새 너무너무 심해서 머리아파요ㅠㅠ/고된 한 주를 불금이라는 마무리 없이 조용히 일어난 토요일 아침.  나에게 19,000원의 사치를 윤허하며 장어의 풍미와 에비수 생맥의 부드러움이 내 갑상선을 지날 때  {에에••• 스고쿠 오이시••!} 라며 잠시나마 일본에 온 거 같은 착각을 부른다.  장어와 새우튀김, 그리고 타마고 튀김을 정신없이 먹으며 고려대 앞인지 와세다대 앞인지 분간이 안 될 무...더보기/너무 맛있게 잘 먹었습니다!/규텐동 기준. 고기 튀김은 적당히 괜찮은 편이었고 야채튀김들이 맛있었다. 닭고기는 민감하면 살짝 냄새날수도 있을듯. 튀기는동안 밥을 세팅해 놓아서 밥은 좀 식어있고 밥양이 좀 적은게 흠인거 같음 그래도 전체적으로 만족스러운 식사였습니다/가격 대비 맛있지만 아-주 맛있는 텐동은 아닙니다 근처 식당 중엔 그래도 괜찮은 편/장점  맛있다 생각보다 튀김양이 많다 간장, 와사비, 카레가루?랑 같이 먹으니 더 맛있었다  단점 싼 가격은 아니다 기름이 생각보다 더 많다/가격도 적당하고 진짜 맛있어용 ㅜㅜ 먹어본 텐동 중 최고.. /튀김이 너무 기름집니다 위생상태도 의심스럽습니다 눈 앞에 식탁에 먼지가 고스란히 쌓여 있네요/12.000원 짜리 소고기로 만든.. 텐동(맞나?) 먹었는데요, 아무튼 저는 상당히 만족했습니다~ 그런데 다른 리뷰들을 보니 좀 별로란 평이 많네요.. 맛보다는 뭔가 좀 맛 외적인 측면에서 비롯된 컴플레인 같은데, 다른 평들을 저도 읽고 생각해보니, 조금 ‘그런가?’ 싶은, 뭐랄까 스탭 한 분으로부터 좀 가르치는 투의 불편한 멘트를 받았던 것 같기는 합니다...더보기/텐동집 많이 가봤는데 튀김옷이랑 튀기는 정도는 프로인것 같아요 간장이랑 밥은 잘 모르겠어요 알러지있는거 있어서 빼고 다른 채소하나 더 넣어달라고 했더니 원래 안된다는 식으로... 융통성은 없으신듯ㅎㅎ  오픈형식당이라 식사하고 나오니 핸드폰도 기름지고 옷이랑 가방에서 기름냄새가 나는 점이 단점/평범/맛있어요!/텐동을 좋아해서 먹으러 맛집 여기저기 다녀봤는데 튀김은 여기가 최고네요. 진짜 잘 튀기셨어요 근데 밥이랑 간장은 조금 별로.../낮에 고대병원 갈 일이 생겨, 갔다가 우연히 찾은 곳!   무엇보다도 직원분 너무너무 친절하시고, 처음부터 끝까지 즐거운 마음으로 먹을 수 있었다.   소고기랑 새우 텐동으로 시켰다.  별로 배가 안 고팠는데, 기다리면서 점점 배고파졌다.  기다리면서 가게 안을 구경했는데, ㄷ자 바에 일본에서 온 듯한 포스터와 작은 소품들이 귀엽고, 일본 음식점에 온 듯한...더보기/마시씀 근데 배달의민족 배달로도 먹었으면 좋겠다..../규텐동 양이 심각하게 적네여. 소비린내 약간 나는데 맛은 좋아여. /양이 좀 아쉽고 흰자가 조금 더 익었으면 좋을것 같아요. 친절하고 분위기는 넘 좋아요  /양이 아쉬움"
4,유자유김치떡볶이 본점,서울 성북구 고려대로24길 48 2층 (우)02855,떡볶이,"김치떡볶이,순대김치떡볶이,쭈꾸미김치떡볶이,해물김치떡볶이,닭김치떡볶이,돈김치떡볶이",14750,3.9,37,234,
5,동우설렁탕 본점,서울 성북구 개운사길 45 (우)02842,설렁탕,"설렁탕,접시수육 (1인기준),모듬수육 (3인기준),모듬수육 (2인기준),도가니수육",23000,4.3,36,40,"맛있음/김치국물에 소면 깔끔하고 깊은 설렁탕 굿뜨/친절하고 맛있어요/맛있어요  다만 서빙하는 아주머니들  오래근무하신  ....  여자손님이 옷을 좀 과하게 입고 들어오면 대놓고  쳐다보시네요   저희 일행 아닌데도 쳐다보는게 느껴지고  저도 3년전 저희 일행중  그런친구가 있었는데 계속 쳐다보면서 수근거림을 ....    그리고 방문포장시  포장용기로 해주세요  방문포장은 비닐봉지로 ㅠㅠ   /친절하고 맛있어요 파랑 소면 개많이줌ㅋㅋ/설렁탕은 무난한데 김치 깍두기가 대존맛탱!!!!! 밖에서 먹어본 깍두기 중 가장 맛있었습니다ㅎㅎ 김치 국물에 소면 말아 먹는 것도 별미였어요./존맛 ㅇㅈ/설렁탕 : 소 장화신고간 물에 거미줄고기?밥 말아나옴. 노인 먹고부대낌--  윗사진 탕에 고기는 전혀 사실아님./원래 동우설렁탕은 돈암시장에서도 삼선교 쪽으로 약간 벗어난 곳에 좁고 허름한 식당이었습니다. 점심 때면 줄을 길게 서서 기다려야 했던 곳이라 점심시간이 지난 뒤에 가곤 했습니다. 황해도식 김치국물에 양껏 국수를 먹을 수 있게 되어 있었는데, 그 김치국물이 얼마나 맛있는지 설렁탕이 아니라 국수먹으러 가는 집이었죠. 전 사실 어릴 때 철원에 살았는데 그 곳에서...더보기/깍두기 국물에 소면 말아먹기, 접시수육 먹기 꼭 하세요/넘 마싰져~/날 추워지고 배 많이 고플 때 가면 최고예요. 김치랑 대파 위생만 좀 더 좋으면 완벽/국물맛있음/고려대 설렁탕 맛집/김치국물에 소면 말아먹으면 백점. 주차는 3대정도 가능 /맛,양 모두 만족/맛있어요/서빙하는 아주머니에게 노룩패쓰당함 평소에 아내가 좋아해서 가끔 찾는집 입니다 오늘은 점심시간 전이라 약간 한산해 부담없이 면과 김치국물을요청  했더니 김치육수는 가져다 주셨는데  면은 말도없이 옆테이블  손님에게 건네 주셔서 식사하시던 분에게 받았습니다 새로운 공유 서비스를 경험하게 해주셔서 감사합니다  다음에도 와야 하는데 불편하게 그러지 마셨으면 합니다/고대 안암동을 올때마다 꼭 들리는 집 구수하고 깔끔한 설렁탕 한그릇과 새콤한 김치가 잘 어울린다. 접시수육 한접시를 더하면 술한잔이 캬~ 굳이 단점이라면 주차 자리가 4~5대 밖에 안되어서 주차가 불편 하다는 점/사리, 밥 무한리필이고 가격도 적당하고 괜찮네/인기가 많아서 주차에 어려움이 있지만 맛은 보장/설렁탕은 앉자마자  금방 먹는맛인데  웨이팅이 넘 긴것이 단점이다~/무난합니다~~/학교 앞 맛집."
6,두부촌,서울 성북구 안암로 43 (우)02857,두부전문점,"진도특선 간재미회무침,돌솥숨두부정식,불낙전골 (중),해물파전,오리바베큐 (600g)",29000,3.3,11,18,"오늘도 잘먹었습니다.  저염식으로 먹는 저에게는 고퀄의 음식 이였습니다.  번창 하셨지만 더 번창 하셔요/정식으로 3인분 시켰는데 두부 딱 3개 나오네요 다른 반찬들도 다 반찬가게에서 사 먹는 거랑 비슷할 맛이고... 가격도 높은데 진짜 비추~~/안암동 베스트 5 good very gooood/맛/맛은 그냥저냥 평범... 찌개에서 벌레가 나와서 1점입니다/청국장,해물순두부 맛있어요~~ 밑반찬도 맛나요~~ 황태구이는 보통, 낙지비빔밥은 안매워서 내입엔 별루... 다른건 안먹어봄/계속생각나는 밥이맛있는 식당/맛은 정말 있습니다 그런데 왜이렇게 마늘이랑 상추에 아끼는지;;; 몇번씩달라기뭐하니 한번에좀 넉넉히주지 마늘 6쪽,상추5-6장이 뭡니까 누구 코에 붙이라고../Good :)/평가들 지대로좁 하시지/모두맛나요"
7,영철버거 본점,서울 성북구 안암로9가길 100 1층 (우)02855,햄버거,"The 영철랩,영철리치(단품),돈 파니니(단품),돈 워리(단품),치킨브레스트(단품)",4360,4.8,54,21,
8,오샬,서울 성북구 고려대로24길 6 3층 (우)02855,인도음식,"PALA PANEER,CHICKEN MAKHANI,TIKKA MAKHANI,LAMB KORMA,JINGA PALAK,SEAFOOD KORMA",10000,4.5,28,84,
