,name,address,sort,menu,mean_price,score,people_give_score,review_count,review_list
0,장인닭갈비 강남점,서울 강남구 테헤란로1길 19 지하1층 (우)06134,닭요리,"점심메뉴A,닭갈비(2인분)+치즈사리,25,500,점심메뉴C,닭갈비(4인분)+치즈사리,8,500,23,500,32,000",25500,3.2,190,453,"친절은 기대도 하지 마세요....진짜 말을 어덯게....화가 나네요/돈이 너무 많아서 주체가 안 되면 가세요.... 고기에서 반지하 물 냄새, 닭냄새가 섞인 냄새가 남 ㅋㅋㅋㅋㅋㅋㅋㅋㅋㅋㅋㅋㅋㅋ 먹는데 비위가 상해......소스도 전혀 안 배어있음. 치즈사리는 2인 4천원/ 3인 5천원/ 4인 6천원 이런 식으로 받아먹음 ㅎ/다른데 1인분이 여기 2인분임 ㅋㅋ 가격도 비싸고 알바생들 노느라 서비스 엉망임. 제대로 조율해주는 매니저도 없고 닭갈비 나오는데 23분, 볶음밥 하나 하는데 15분씩 기다려야함. 주문했는데 알바생들끼리 준비안하고 떠들고있어서 밥 볶아달라니까 재료준비중이라고만 반복함. 김치 날치알 밥 김가루가 15분이나 준비해야하는 재료였는지 몰랐네 주방에 일하는분들 다 ...더보기/옛날에 장인닭갈비 정말 맛있었는데ㅠ 이제는 닭도 덜 익은데다가 양념도 너무 과하게 달고 치즈추가도 했음에도 불구하고 너무 적게 줍니다…  닭이 덜 익어서 그런지 비린내가 너무 심합니다.. 초심 되찾아주세요;;/초심잃었습니다..  제가알던 장인은 어디가고 아마추어 닭갈비가 되어버린 안타까운 식사였습니다.  다른 닭갈비집 가세요  이만/가격대비 양이 많지는 않음. 친구가 가운데 치즈 때문에 가자고 했는데 괜찮았다. 막 특색이 있다는 아닌데 볶음밥이 맛있다. 기름에 볶아진 느낌이 아닌데 약간 달달하니 손이 계속 갔다. 무슨 봉봉인지 뭐시기 음료 절대 비추/여자친구와 치즈 닭갈비를 잘 먹었어요. 넘 배불러서 볶음밥까진 못 먹었어요 ㅋㅋ/닭갈비만 먹었을 땐 3점이었는데, 볶음밥까지 먹고 4점 드립니다. 볶음밥 꼭 드세요!  중간맛으로 먹었는데 적당히 매콤하고 치즈에 양파랑 같이 먹으니 괜찮았습니다. 순한맛으로 먹었으면 좀 많이 싱거웠을 것 같아요.  엄청 뛰어난 맛과 서비스를 기대하긴 힘들겠지만.. 위치 좋고, 비주얼 좋고, 적당히 호불호 안 갈리게 한 끼 먹기 괜찮습니다. /맛있게 먹긴했으나... 단맛이 너무 강해서 별5개는 아니라고 보임/맛있는데 단맛이 좀 강함/치즈 플레이팅?이 예쁘게 돼서 유명한 것 같은데 맛은 아무 닭갈비집이랑 차이는 없다. 가격만 좀 더 높을 뿐./생각보다 맛있었어요 양도 적당. 볶음밥 굿/가성비 진짜 최고~  닭갈비에 무조건 치즈사리 추가!! 마지막 볶음밥까지~ 한끼식사로 충분해요~/평일 오후타임 일하는 여자알바분 개념은 밥 말아먹으셨나봐요? 앉을 자리 보고 qr체크인 한다고 말했더니 짝다리 짚고 서서 노려보면서 qr찍으라고 소리치고, 벨누르는데 직원끼리 모여앉아서 노느라 보는 시늉도 안하고, 영수증에 금액 두배로 찍혀있어서 말했더니 사과한마디도 안하고. 가본 식당중에 단연 서비스 최악이었습니다. 장사할거면 직원교육부터 똑바로 시키시길...더보기/여기는 무조건 치즈 추가 필수 줄여서 치추필 기억하세요 치추필 뭐라고요 치추필/치즈닭갈비 너무맛있어요 ㅠㅠ 깔끔하고 좋아요 /난생 처음 보는 비상식적인 응대에 감탄하고 갑니다. 직원분이 하시는 말 못 들은 상황이었는데 저희가 귀머거리도 아니고 무슨 조롱하듯 대여섯번을 앞에서 QR체크 하셔야해요 하면서 소리지르시더라고요. 와중에 옆에서 다른 직원분은 말리지도 않고 웃고 계시고요. 매장에 1분있었음에도 전반적인 서비스가 얼마나 형편없는 지 알 수 있었습니다. 왜 알바를 안 바꾸시는 ...더보기/아니 알바생인지 매니저인지 모르겠는데 자리를 옮겼다고 말도 안하고 저희가 옮긴것도 아니고 양해를 구하고 옮겼고. 즐겁게 먹고 계산을 하고 나가려던 와중. ""아, 거기 멈춰봐요. 일로와서 다시 계산하세요."" 이러면서 명령하듯이 화가난 말투로 말씀하셨는데 본인들이 빌지 처리를 잘못하셔서 계산하셨으면서 정중히 사과를 해도 전혀 이상한 상황이 아닌데 오히려 저희한...더보기/양념이 너무 달다. 그래도 배는 부름/알바생들이 교육이 잘안된건지 융통성이 없던건지ㅋㅋㅋㅋㅋ 볶음밥시켰는데 불이 계속 안켜졌는데 안켜지면 가스통을 바꾸던가 다른곳에서 볶아와야하는거아님? 근데 또 안되네 이러면서 우물쭈물하다가 밥만 비비고 가서 볶음밥이 아니라 비빔밥먹음ㅋ /먹다 수세미? 조각 나와서 사장 나와라고 하고 싶었지만, 용기가 없어서 그냥 나옴  가지 마세요./배불러요/옛전에는 이러지 않았는데 아쉽네요. 닭갈비랑 볶음밥 양이 엄청 작아졌고, 명동점은 닭갈비에 소스가 남아있지않으면 소스 조금 더 가져와서 간이 맞게 볶아주고 닭 남았으면 닭도 같이 볶아줍니다. 대체 직원교육을 어떻게 시켰는지 사장님 마인드가 다 보여요. 닭갈비랑 토핑 추가 주문하려는데 ""닭갈비 는 2인분 부터 주문 가능하세요."" 하더니 그냥 가버리고 토핑은 ...더보기/진심으로 돈 아까웠던곳 양도 너무 적고 중간맛은 밍밍 볶음밥 시키고 나서 거의 다 남겼습니다 고추장에 설탕 왕창 부은맛이구요 진짜로 리뷰 거의 안쓰는데 너무 한거같습니다…./사장님들 친절한 서비스 감사합니다!/맛있는지는 모르겠어요. 후각 좋은 사람들은 닭 잡내 맡을 수 있어요. 특별히 반찬도 없고 아무것도 없고 닭갈비만 나오는데 양이 많은것도 아니예요. 근데 가격은 일반 닭갈비집에 비해 비쌈./비주얼에 비해 맛은? 음...  1. 드럼스틱살, 양배추, 떡, 조미료 가득한 양념으로만 맛을 내서그런지 3개 정도 먹다보면 질림.  2. 당면이 다 불어서 나옴. 어제 만들어놓은 음식 먹는 느낌.  3. 오랜만에 닭이다싶어 젓가락으로 집으면 양배추임.  4. 중간맛은 안 매운맛임.   총평) 마늘, 양파 등을 추가하여 재료를 조금 더 풍성하게 할 필요가 ...더보기/저번에 맛있어서 또 방문했는데 역시나 맛있어요!!! 이러다 단골될듯ㅋㅋ/깔끔하고 맛있어요 !! 볶음밥도 원래 닭갈비 양념이랑 맛이 분리되는데 이곳은 그렇지 않아 정말 좋았어요 ㅎㅎ 직원분들도 친절하시네요 !!! 왕추천입니다/우선 닭갈비 솔직히 맛있음 양념이 자극적이지 않고 중독성 있음 직원들 친절함 아래 리뷰들 이해가 안감 가게가 바뀐건지 내가 알수없지만 참고로 난 만족한곳들만 리뷰함 "
1,감성타코 강남역점,서울 강남구 강남대로 406 지하1층 (우)06134,"멕시칸,브라질","감성그릴드파히타,그릴드스테이크,칠리새우,스파이시포크,까르니따스,또르띠아,4가지소스,코우슬로,할라피뇨,9,000,10,000,14,000,14,000",38000,2.9,69,301,"이게 클럽인지 음식점인노래 줄여달라니깐 고장났다고 이상한 소리 하는 곳 대화도 못하는 음식집/'감성' 이란 단어가 다른 뜻이 있는건지 빅룸하우스만 오지게 크게 틀어놓고 홍보에는 따뜻한 인테리어라는데...음식 나오지도 않았지만 그냥 나가고 싶다/맛은 없지않았지만 아무리 불러도 오지않는 서버들 개오지는 스피커 사운드와 쉴 틈 없이 달리는 edm ㅋㅋㅋㅋㅋㅋㅋㅋㅋㅋ 일하기엔 좋을듯   /맛집이면 다인가?난 잘 모르겠다. 30분전에 와서 미리 주문할려고 했는데...저녁타임은 혼자 오신분은 절대 불가라고 하신다. 꼭 일행이 와야한다면서~요즘 혼술 혼밥도 대세인데....그게 안된다고 하면 ~ 좀 많이 어이가 없지만~~내눈앞에서 최소 10팀이 지나가고 한숨 두숨이 나온다 ㅠㅠㅠㅠㅠㅠ/퀘사이다 맛있어요. 전 음악 좋았고 소리도 안컸어요./오후 1시 방문 4인석 단 두자리 제외 언뜻보기에도 30석 남았는데 2명은 굳이 좁은 2인석 앉으라함. 4인석 앉으려면 다시 카운터가라고 인이어도 있는데 궂이 보냄 다시가니깐 손짓없이 웅얼거리면서 절로가세요 해서 4인석앉으니 큰일난거처럼 와서 2인석에 무조건 앉아야한다고함. 손님가지고 장난하냐고 여기가라 저기가라 훈련시키는거고 아니고 상황설명하니 지들은 모...더보기/익숙한 맛과 익숙한 느낌./쪼굼 비싼 감이 있지만 짱맛탱♡♥ 매장이 굉장히 넓은데도 웨이팅하시는 분들 엄~~~청 많았어요!! 웨이팅 안 하고 먹으려면 애매한 시간대에 가는 게 좋을 것 같아요~!! 그리고ㅠㅠ 또띠아 남은 양 보고 한 번에 많이많이 주셨으면 좋겠어요ㅠㅠㅠ/제발 부리또가 뭔지 알고 장사해주세요. 걍 볶음밥 싸먹는 맛이었어요. /위생상태 정신나간 곳을 뭐가 좋다고 다들가시는지/또띠야를 계속 리필해줘서 행복했답니다 /음악소리 이제 줄이신 듯 ㅋㅋㅋㅋ 양 많고 맛있음. 가격이 조금 쎄긴 함/마싯음. 근데ㅡ비쌈 양이 많긴한데...ㅋㅋㅋㅋㅋㅋㅋ /파히타를 집다 나온건지 퀘사디아를 썰다 나온건지 아무튼 거의 다 먹어가는데 철수세미 나와서 입맛 버리고 나옴.. 주방마감 다돼서 시켜서 들어갔을 것 같다는데 마감 때 가시는분들은 철 씹을 각오하세요. 벨도 없어서 직원 애타게 불러야 함. 건너편 낙원에만 왜 사람이 많은지 알겠음/음악 소리가 너무 커서 테이블 위에 올라가 트월킹을 한번 제꼈습니다./edm 멈춰.... 감성이래매...스피커가 온군데 다있어서 말소리가 하나도 안들림 오히려 음악꺼졌을때가 조용한느낌/매장 음악 소리좀 작게좀 틀면 안되나.. 줄여달라고 얘기해도 적정볼륨에 맞춰져있어서 낮출수 없다하는게 저따구로 소리 키워놓는게 본사 방침인지? 내가 클럽에서 밥 먹는건지 식당에서 밥먹는건지 모를정도.  너무 시끄러워서 바로 옆 지인이랑 대화도 못하겠고  회전율만 생각해서 노래 크게 틀어놓고 빨리 먹고 나가라는 뜻 같은데,  한번 오면 다시는 안오고싶어하는집...더보기/맛있고 매장 예쁜데 음악이 너무 큼/매장 소리가 소음수준.../알바생들 대처 어떡하지 /타코를 계속 리필해주셔서 먹기 편했습니다. 새우랑 고기는 양이 조금 아쉬웠는데, 사진에 저래보여도 위에만 수북한 척 ! 밑에는 양파로 가득 차있었어요. /ㄱㅊ/새우만 먹고싶어요 고기는 좀 지나면 물리고... 음.../손님을 그냥 돈내는 기계 정도로 생각하네요. /타코 세트 + 사이드로 감튀랑 소스를 더 해서 먹음  메뉴판만 봤을땐 혜자느낌이나 막상 나오면  가격에 맞게 나오는느낌이다.  처음에 타코가 적어서 뭔가 했는데 알아서   직원들이 돌아다니며 리필해주는 방식이였다.  세트는 무난한데 살짝 가격 낮추기위한 눈속임이  있다. 위에는 살짝 비싼 새우 고기 등 이라면   그밑에는 뭔가 저렴한 제육 스타일의 고기와 ...더보기/힙한 분위기도 좋고, 음식도 맛있고 맥주한잔하고싶을 때 들르기 딱이네요/두 명이서 먹기는 많음. 맛은 평범. 가끔 먹을만할듯/맛있어요/음악소리가 너무 커서 줄여달라고 요청했는데 몇분이 지나도 그대로길래 다시 물어보니 최대한 줄인거라고 함 일행들과 대화가 전혀 불가능해서 자리 옮기겠다고 하니(스피커 바로 아래자리였음) 저녁엔 자리를 못옮긴다고 함 다른 자리들 텅텅 비어있는데ㅋㅋ 목소리가 안들리는데 어떡해요 그럼? 이러니까 다시 어디 가더니 노래 소리가 확 줄음 아까 최대한 줄인거라며? 이렇...더보기/최근 평일 저녁에 방문했었는데 포니테일에 안경쓰신 여직원분 친절하셔서 기억에 남네요. 초반엔 양이 적은가 싶어도 먹다보면 배부릅니다. 또띠아 계속 리필가능. 이번이 두번째 방문이고 처음 갔을땐 이정도는 아니었던 것 같은데 음악 소리는 줄이긴 줄여야 겠더라구요. 대화가 원활하게 안됩니다./직원이 불친절하여 좋은날 기분이 안좋았습니다./타코도 맛있었고 고기도 엄청 부드러운데 무슨 이유에선지 먹고나서 하루종일 배 아프고 설사했어요/맛있는데 고기 어떤부분 냄새나요;; 그거빼고는 매우 만족!! 친절하심"
2,땀땀,서울 강남구 역삼동 817-31,베트남음식,"양지 쌀국수,우삼겹 쌀국수,양지&우삼겹 쌀국수,양지,우삼겹,꼬리,힘줄 쌀국수,꼬리 쌀국수,매운소곱창쌀국수",12200,3.4,261,1807,"기대를 너무 많이 했을까요ㅠㅠ 기대이하였지만 그래도 맛있게 잘 먹고왔습니다! 너무 기대 안하시고 가시면 충분히 맛있게 드실 수 있으실거예요/주문 후 1분만에 메뉴 나옴. 삶아진 면에 국물만 부어서 나와서 면이 뭉쳐있고 국물이 사이사이로 안들어갑니다. 곱창쌀국수의 곱창은 비려서 먹을수가 없어요. 세상에.. 이렇게 냄새나는 곱창이라니.. 직원분들 모두 친절합니다. 다만 가장 기본인 음식이 맛이없어요!! /멀리서 오신 손님이 땀땀을 방문해보고 싶으시다고 하셔서 방문하게 되었습니다.   메뉴는, 메인 곱창 쌀국수와 껌승을 시켰습니다.  제가 받은 껌승은 밥이 오래전에 조리했다가 얼려놓은 다음, 급하게 해동해서 다 밥알이 풀어지지 않은채로 서빙 되었습니다. 사진으로 봤을 때 바로 조리한 계란 및 고기 토핑 같은 것으로 통해 커버가 되어 보이지만 맛이 정말 없었습...더보기/쌀국수 좋아하는데 여긴 아녔어요. 면도 뚝뚝 끊기고 안깔끔한맛 고기나 곱창은 괜찮았는데 면이 많이 아쉽네요. 짜조는 한입먹고 물리더라고요. 비주얼은 굳/쌀국수는 땀땀이죠! 다른 지점 다녀도 여기만한곳이 없어요. 최고 최고/맛있어요 소곱창이랑 양지 쌀국수, 분짜 시키면 딱 좋은 조합/명성과 웨이팅에 비해 맛은 쏘쏘../소곱창 쌀국수 1단계-먹기 편한 맵기에 마라맛이 조금 남 소곱창 많고 너무너무 맛있음  보양 쌀국수-고기가 엄청 많고 깊은 국물 맛있음  최고최고 담에 또 갈래요 다만 사람 많아서 정신없음ㅜㅜ 맛집이라는 반증이겠죠/너무 매웠으나, 곱창은 많았음. 기본 쌀국수 먹을 것. 싸이드가 맛있음 다만 가성비는 안좋음/프리미엄 보양 쌀국수 모든고기가 들어있어요 느끼한거 못드시는분 CU에서 꼬마김치 사서가세요 많이 느끼합니다/일단 직원분들이 엄청 친절하십니다... 소곱창 냄새도 안 나고 국물이 딱 먹기 좋을 정도로 매콤해서 만족스러웠어요 혼자 가서 먹었는데 다음에는 친구들 데리고 가고 싶어욧!/매운쌀국수랑 껌승? 시켰는데 가격대비 별로였어요 쌀국수는 갠적으로 곱창이랑 별로 안어울리고 덮밥도 고기양이 너무 적네요 ,, 인기는 많은거같더라구요 개인취향인듯/Soso/뭔가 SNS맛집같기만 해서 사실 큰 기대를 안했는데.. 훌륭합니다!   우선 음식도 빨리 나오고 회전율이 빨라 좋습니다. 육수는 향신료 향이 덜한 K-쌀국수 느낌입니다.   그리고 고기가 종류별로 다양하게 올라가 있습니다 (특설렁탕 정도 되는 양). 꼬리고기도 두 덩어리 있었는데, 골라먹는 재미가 있었습니다만 이날 아주 살짝 질겼네요.    /웨이팅 꽤 있는데 회전이 빨라서 엄청 기다린 건 아녜요 코코넛 쉬림프 크리스피는 꼭 드세오.. 이것만 먹으러 오고싶을정도/불변의 땀땀 몇년이 지나도 웨이팅이 있었어요/우삼겹 쌀국수가 기본메뉸데 고기양도 많고 맛도 좋아요! /역시 유명한 이유가 있다/줄서는 식당나온집 직화소고기 쌀국수/ 매운 소곱창 쌀국수 2단계 /돼지갈비튀김/약간의 향신료 배인 국물/여기도 결국 방송+인스타 맛집인듯. 비주얼은 사진찍기 좋으나 맛 자체는 기대 이하. 곱창 쌀국수라고 해서 특별할 줄 알았더니 이도저도 아닌 맛. 비주얼도 맛도 내가 생각한 고수 넣고 맑은 국물이 있는 쌀국수가 아니였다.. 베트남 쌀국수라고 판매할 게 아닌듯 싶은 곳. 곱창에 곱은 많지만 쌀국수랑 좀 안어울림../알바분들 중에 한분이 불친절했어요 다른 분들은 친절하셔서 좋았어요 개인적으로 돼지갈비 튀김이 쪼금 간이 쎄고 매웠네요 그치만 맛있구 곱창쌀국수도 너무너무 다시 먹고 싶은 맛이에요 /혼밥하기 조쿠 곱창쌀국수 기발한 아이디어 ㅠ 존맛 근데 혼밥하면 사람들이 너무 쳐다바영 ㅠㅠㅠ 집앞이라 혼밥하는건데 ㅠㅠㅠㅠㅠ/곱창 똥 그대로 들어있어요. 국물 맛도, 고아낸 국물이 아니라 깊은 맛 하나도 안나고 헛도는 맛. 최악/위생은 음식점의 기본이라고 생각합니다  뭔가를 먹은 채로 주문 받으러 온 알바생도 있고요 국물에서 털이 나왔어요 기대했었던 만큼 실망이 컸어요… /무난해요/1단계도 생각보다 매워요!!!! 엄청 맛있는 건 아니지만 무난하게 맛나요 앞에서 맞아주시고 계산해주신 직원분이 친절하셔서 인상깊어요, 음식도 빨리 나오고 좋아씀다/1.27까지 공사한대요/매장내부는 좁지만 곱창쌀국수 맛있어요/평범한데 양이 되게 많음/내부공사로 1월 25일까지 휴무래요~/프리미엄 보양쌀국수는 특별한거 없이 일반 쌀국수 맛이고 매운쪽갈비쌀국수가 좀 특이하고 맛있어요! 이건 진짜 여기서만 먹어 본 맛이랄까..? 웨이팅은 있으나 음식이 빨리나와서 회전율이 좋아 생각보다 많이 기다리진 않았아요~ 강남역에서 쌀국수 먹고싶을때는 찾아갈 것 같아용/국물 너무 좋고 면도 부담없구 맛나네유"
3,화기애애 강남점,서울 강남구 강남대로106길 12 (우)06123,"육류,고기","생삼겹살 (150g),생목등심 (150g),생항정살 (150g),갈비살 (150g),양념갈비살 (150g),프라임 안창살 (150g)",14166,3.4,17,82,"이렇게 추운 식당 처음이였어요.. 난방이 작동 안하는 수준.. 음식은 맛있었는데 진짜 추워서 덜덜 떨면서 먹었어요/맛잇습니다/맛있었고 깔끔했고 직원분들 친절하셨고 지하층에서 일하시던 여직원분 특히 친절하셨고 단, 한가지단점은 고기구울때 기름이 화로에 떨어지면서 발생하는 재가 날라다녀서 쫌 불편했습니다./깔끔하고 맛있어요/고기 퀄리티가 좋음. 직원분들이 친절하심/고오급 식당처럼 보이는 인테리어에 젠틀한 사장님, 양념 소갈비는 양념맛이 약하지만 소고기 퀄리티는 전반적으로 괜찮다는 느낌을 받음/고기에서 약간 냄새났어요ㅠㅠㅠㅠㅠ 그리고 약간 시끄러운 느낌?? 좋은 분위기라고 하기엔 좀 애매한데 기분 낼까 말까 할 때는 가기 좋을 거 같아요!!/분위기도 좋고 직원 분들 젠틀하고 친절하심 비싸지만 맛있다/고기를 떠나서 재가 너무 날려서 음식위에 재가 다올라가구요 내부 환기가 아예 안되서 연기로 뿌얘요 김치찌개 주는거에서 철수세미 나왔어요 .. 다신 안가려구요/Good quality beef and pork BBQ for the price./고기가 정말 부드럽고 맛있었어요 분위기도 너무 좋았구요 그런데...너무 비싸긴 한 것 같아요 ㅠㅠ/와규/강남역 인근 저가 소고기왕"
4,타우너스에스프레소바 강남점,서울 강남구 테헤란로28길 41 1층 (우)06223,카페,"에스프레소,에스프레소 마끼야또,에스프레소 콘파냐,크로플&아이스크림,씨로플&아이스크립",4780,5.0,1,26,맛있다  멀리서 찾아올 정도인지는 모르갰지만 동네면 자주 갔을듯 사람 많고 야외석도 꽤많다 다음번에 가면 아이스크림보다는 콘파냐 먹을거다
