,name,address,sort,menu,mean_price,score,people_give_score,review_count,review_list
0,메이필드호텔 봉래헌,서울 강서구 방화대로 94 별관 1층 (우)07506,한정식,"진연,수라,금강,풍악,봉래",140600,3.6,7,44,"돌잔치 갔는데 좀 비싸긴해도 좋네요./식당까지 경사로가 다 구비되어 있어서 좋았어요. (경사 각이 심해서 혼자 유아차/휠체어 몰 수는 없지만 있다는 것에 점수를!) 음식 맛도 대체로 깔끔하니 좋았습니다./이집 봉래헌에서 최고가인 풍악 15만원짜리 메뉴 시켰는데,너무 허접해서 대실망해서,하루가 지난 지금까지도 분노와 찝찝함에 댓글 답니다  자기돈 내고 먹을 수 있는 곳이 아님  눈먼돈(국민세금,비자금,기업공금)가지고 와서 먹는데입니다  음식 수준도 대중음식점에서 나오는 급이고 반찬이나 식사꺼리도 보통 이하입니다  5만원 받아도 비싸다고 느낄 정도의 음식 수준...더보기/멀지만 방한시 접대용 한정식"
1,메이필드호텔 낙원,서울 강서구 방화대로 94 별관 한옥 1층 (우)07506,한정식,표기안함,표기안함,3.7,3,15,가족모임이나 손님대접에 좋네요 맛있고 룸도 아늑하고 좋았습니다/장소는 이쁜데 그냥그래요 고기도 감질나고낙원정식 가장 비싼거 주문했는데 별거 안나옵니다 그냥저냥 가족행사 하기엔 좋아요
2,메이필드호텔 캐슬테라스,서울 강서구 방화대로 94 본관 1층 (우)07506,뷔페,표기안함,표기안함,3.4,10,27,"뷔페 식사 중 여유로움과 주변 환경들 조경과 산책로로 본다면 호텔 뷔페 중 단언 최고이다. 하지만 음식의 종류와 맛으로 본다면 가격 대비 추천하고 싶지 않습니다/직원들 친절해요/주말 디너로 갔는데 아뮤즈부쉬부터 디저트까지 대충해서 나온 느낌 드는 게 별로 없었어요 뷔페인데도 파인다이닝 급의 정성과 독특함이 보이는 메뉴들도 간혹있었고, 오히려 가짓수가 적어서 각각이 다 맛있었던 것 같아요./갈까말까? 망설여 지네/종류가 너무 없긴 합니다./정말 맛도 가격도 실망이었습니다 불과 2 년전에 주중 5 만원대 이어서 가성비로 자주 갔었는데 지금은 주중 점심 67000 원. ㅎㄷㄷ  게다가 더욱 실망스러운 것은 맛과 품질도 전보다 더 떨어져 스테이크는 텁텁하고 튀김류는  눅진눅진하며 기타 요리도 심심한 맛입니다. 주방장이 바뀌었나요?  생선회를 제외한 거의 모든  음식이 3 ~4  만원대 중 저가 대...더보기/분위기야 둘째고 종류가 많은거 같지는 않지만 다 정성이 들어있고 맛있어요! 가격만 아니면 매일 오고 싶은 곳입니다/주말 런치 먹으러 어쩌다 한번씩 갑니다. 그런데 랍스터와 게 요리 비린내는 좀 개선하셔야 할 것 같아요. 그리고 일부 고기요리도 내놓은지 오래되어 말라비틀어져서 먹기가 힘들고, 장어도 그 훌륭한 식재료에 그 양념에 최선인건지... 장어킬러인 아들이 한입 넣더니 손 안대더라구요. 나머지 즉석에서 썰어주는 비프요리나 스시류는 맛있고 신선해서 좋았습니다. 커피는...더보기"
3,메이필드호텔 이원,서울 강서구 방화대로 94 벨타워 2층 (우)07506,중화요리,표기안함,표기안함,3.0,2,15,2022.01.09 런치 코스 딱히 문제 없었는데 아래 리뷰 하나땜에 1점으로 나오는 게 찝찝해서 리뷰 달아요  음식도 맛있고 음식 나오는 타이밍도 적절하고 직원도 친절한 편이었음.  술은 안 시켜서 술 주문에 문제가 있는지는 잘 모르겠음./코스요리에 전체요리 나오고 40분 기다려도 음식 안나와서 따지니 한참후에 음식 내오고 메뉴에 있는 술도 3병 밖에 없다고 다른 술 시키라 함.  동네 콩알만한 식당도 술 달라하면 옆 가게에서 사다주는데.  음식 맛도 개판임.  블로그 맛있다는 말 믿고 갔다가 맛없어서 나와서 2차 갔음.  여기까진 사실 별 하나도 아까움.   단 조경과 야외경치는 끝내줌. ...더보기
4,메이필드호텔 라페스타,서울 강서구 방화대로 94 본관 1층 (우)07506,이탈리안,표기안함,표기안함,3.5,2,18,결혼기념일에 방문했어용 친절하신 직원분들 덕분에 몸둘바를 몰랐고 양이 적었으나 비싼만큼 럭셔리한 재료들에 맛도 좋았고 코스요리여서 은근 배부르다?했는데  집에와서 라면끓여먹음 ㅋㅋㅋㅋㅋㅋ
