,name,address,sort,menu,mean_price,score,people_give_score,review_count,review_list
0,어머니대성집,서울 동대문구 왕산로11길 4 (우)02579,해장국,"해장국,육회비빔밥,육회,소고기수육,등골",27800,3.4,136,241,"뭐가 이리 비싸나 씨잘데기 없이/성식이형 맛집수육/어떤 국밥집이 1인분을 안받나 먹을텐데 실망이 크다../인기가 엄청 많음. 단점 : 비쌈. 고기양 적음. 시원한 맛 없음. /비싸지만 개취로 너무 맛있어서 불만없음 Good             /맛이별로전통개붊 두번다시안가요 /오늘새벽 5시35분쯤 가서 날벼락을 맞고왓다 너무기가막히고 어의가없는 상황에 다시는 가지말아야겟다는 생각을한다 새벽일하는 1층 여자3명중 2명 키크고 경상도 사투리 좀 긴 커트머리 여성 2명은 빨리 정리해야하는 사람들인거 같다 손님을 대하는 자세가 안하무인에 불친절그자체 보다보다 이런새벽아침식사 집은 처음 예전장소에서는 이런일이없엇는데 어찌 이런일들이  서...더보기/장사하시니 힘들고 스트레스 받는건 이해하지만.. 말을 걸어도 째려보고 쌩까는건 아닌듯 카운터 남자 /별 1점도 아까운 가게. 친절함을 기대한 것은 사치. 내가 해장국 1,200원짜리 먹으러 온줄. 사장님 혹시 댓글 보시면 이시국에 주방에서는 마스크 필수로 쓰시구요. 과한 친절이아니라도 기본 응대는 좀 해주세요./jason 이사람 과거 후기 모두ㅋㅋ진짜 금액 테러 그지새낀가 ㅋㅋㅋㅋㅋㅋ/해장국에 반찬으로 육회ㅠㅠㅠ 여기가 천국인가....? 국밥은 걍 국밥인데 고기가 이유식처럼 자잘해여 근데 가격대비 양이 적었어요/국밥은 맛있었지만 불고기는 가격대비 너무 양이 적어요ㅠㅠ/주차힘듬 양은 좀 적어여 그래두 별점은5점 맛있우니까./약간 맹맹한 듯./맛나요 양 좀 적은거 빼고 다 죠음/동네치고는 가격대가 조금 있는 편이지만 돈값합니다. 해장국, 육회비빔밥 둘 다 깔끔하고 맛있어요/국밥 포장하는데 밥을 따로받는 것 부터가 글러먹었음/#어머니대성집 #선지해장국맛집   신설동쪽에서 선지해장국으로 유명한 노포. 시설은 현대화되었지만 맛은 예전 그대로. 큼지막한 선지는 비린내하나없고, 우거지는 국물의 시원함을 더함. 맑은 국물임에도 국물에 깊이가 있고, 밥도 토렴이 잘 되어서 밥알이 따로 놀지 않음. 백반기행에 소개된 곳. 강추!/해징국  시원하고 특이한 맛으로  정말 촣습니다/맛이라 하기에는 간이 너무 싱겁다 고기도 있는건지 없는건지 모르겠고 만원은 좀 아닌듯,,,/이전하기 전엔 대한민국 1등 해장국집...  지금도 별로라는건 아닌데...뭔가 허전함.../국물이 깔끔해서 좋아용 건강하게 맛있습니당~~  다만 국밥은 뜨거워야 제맛인데 뜨끈한 정도입니다ㅠ /육회 꼬시구요 선지해장국은 깔끔한맛 육회비빔밥에 조개젓비벼먹으니 꿀맛이네요~^^~/여기 왜 줄서서 먹는 것인지 모르겠습니다. 해장국도 전자레인지에 돌려서 줬는지 미지근 하고 별루에요. /그때 그시절이 그립습니다. 예전에는 좋았는데./해장국을 두루 먹어보지 못한 경우라면 한번쯤 가볼만 .../특이한데 이게 맛있는 맛인지 헷갈린다/새벽집을 뛰어넘는 맛이에요! 육회비빔밥도 해장국도 너무도 맛있어요/예전엔 가격 맛 정 이런거 있던 집이었어요. 건물이전 후 가격선도업체가 되어버렸네요. 다행인건 맛은 아직 괜찮다는거./내용물에 비해 가격이 비싸보이긴하나 이정도 조화로움이면 충분히 1만원 지불한. 맛있음. 김치류는 좀 짜다. 맛있음. 재방문의사 300%/맛 4.5 가격 2.5 서비스 4 양 3.5"
1,나정순할매쭈꾸미,서울 동대문구 무학로 144 (우)02584,"해물,생선",쭈꾸미 1인분 (350g),15000,4.1,193,517,"이렇게맛잇을수강/맛도 있도 양도 많음/가격이 한 6개월만에 12000원에서 15000원으로 올려버리시네용..ㅎㅎ 자주 픽업해다 먹었는데 쭈꾸미도 하나도 안잘라주고 맛도 예전만 못하네요… 주변에 더 싸고 맛있는집 많던데 갈아타렵니다 /포장해왔는데 작디작은 쭈꾸미들로 가득하고 맵디매워서 쭈꾸미 맛을 모르겠음 물배만 채웠고 2인분에 3만원인데 과연 그럴만한 가치가 있나 싶었음. /먹는데 미쳐서… 이성이 있을때…웨이팅할때 사진 뿐입니다 ㅠㅠ  맛잇어서 계속 생각나요/매운거 좋아하는사람 쭈꾸미 좋아하는사람 무조건 추천합니다 너무맛있어요ㅠ 반찬떨어지면 말안해도 계속 주셔요 너무 최고..☆  그리고 양이 진짜 푸짐합니다.. 이나이먹도록 이렇게 쭈꾸미자체로 양많이 주는곳 처음봐요.. 추천드립니다!꼭가세용/음식 진짜 빨리 나오고 볶음밥이 진짜 맛있어요~! /2022-02-22 포장 2인(700g×2) : 30./여기서 사먹지 마세요 설사 합니다 위생도 그닥 입니다  장사는 동네에서 제일 잘 되는데 올해 값을 인상 했네요 어이없어 양은 늘었냐니까 늘었다고 얘기는 하는데 작년에 사먹었던 양 포장은 700~800g 인데 그대로 이네요 탐욕이 심한 곳이네요 이젠 사먹지 말아야 겠어요 너무 매워 먹고나면 설사도 하는데 이젠 끊어야지 정말 다른 음식점들은 장사가 너무 안되 ...더보기/집과 가까운 것에 늘 감사하는 맛집. 개인적으로 가장 맛있게 먹을 수 있는 매운맛을 찾은 것 같아 기뻤다. 마늘 잔뜩 넣고 천사채 싸먹으면 된다. 단, 날에 따라 매운맛의 편차가 조금씩 있는 듯.  홀이 바쁘지만 이모님들이 친절하시다.(사바사)  ★★★★★ : 맛집 ★★★★☆ : 유쾌, 재방문 의사 있음. ★★★☆☆ : 무난 ★★☆☆☆ : 별로, 재방문 의...더보기/존맛탱입니다진짜...소주그냥들어가요/하 진짜 개맛있음 진짜 하.. 죽기전에 마지막으로 뭐먹을래하면 고민없이 나정순쭈꾸미 머글겁니다 /말이 필요 없음 최고/일요일은 장사 안하시는 모양이네요. 아쉽네요. 일주일에 일요일만 쉬는 직종이라..../여자친구가 참 좋아해요~/최고의 쭈꾸미 집이예요 /술맛이 싸악 돌아요/웨이팅 O / 친절 / 진짜 맛있음 근데 12000 -> 15000 오른거 슬프다/최고의 쭈꾸미/최고,,, 쭈꾸미 원탑/왕존맛과 친절/이집에서 한번 먹은이후로는 다른집쭈꾸미는 생각 안남 매운데 참을수없어/인생쭈꾸미/맵지만 맛있음 추천/존맛존맛 /맛은 정말 있는데.. 아직 좀 남은거 먹고 있을 때 밥 볶아드릴까? 해서 얼떨결에 볶음밥 먹고, 다 먹어 가니 빨리 먹고 나가라는 식으로 눈치줌. 심지어 사람 많아서 이해해달라며 일어나달라고 한게 가장 기분 나빴던 부분. (술을 안 시켰던 것도 아님) 더 많은 손님을 받으려는 업자의 입장은 알겠지만, 먹고 있는 손님한테 그렇게까지 했어야했나하는 생각이 듦....더보기/진짜맛있다/최고 !! 쭈꾸미 다먹고 주신 요쿠르트로 입가심 하면 세상행복/맵찔이도 혹한 맛 ㅎㅎ매워요 많이..하지만 맛있게 매운맛이고 볶음밥도 필수에요~갬성으로 들리는곳..쌀쌀한 가을겨울 자주 가는곳이에요~ 오로지 쭈꾸미 하나보고 가는곳 다른음식  없어요. /맛있어용 재방문할 의향있어요/양이 엄청 많고 양념이 지이이이인짜 맛있어요..!!  워낙 바빠서 약간의 불친절은 감수할만한 맛 !! /다음 날 동고통받아도 자꾸 생각나는 집 ㅠㅠㅠㅠ/너무 매워... 하지만 자꾸 생각나는걸 어떡해ㅠㅠ"
2,허파식당,서울 동대문구 왕산로26가길 17 (우)02566,"찌개,전골","소허파전골 (대),소허파전골 (중),소허파전골 (소)",21666,4.2,22,44,"술을 부르는 곳. 진한 국물이 매력이네요./너무너무 맛있어요  끓일수록 술 들어가는 맛,, 베리굿 ㅠㅠ 자주갑니다/겨울에 다시 오고파/소 짜리도 둘이 먹기에 양이 충분히 많고 다른 육수 없이 파가 잔뜩 들어가 시원하고 깔끔한 국물이었다. 중간에는 우동사리를 그리고 마지막엔 볶음밥까지 기가맥히네/어제 잘 먹었습니다. 남자 셋이 중자 라면2 볶음밥2 뚝딱/국물이 끝내줘요/갈때마다 넘 맛있게 먹고오는 집이예요. 볶음밥도 꼭 드세요~~!!/맛있어요 /아니 여기 왜 맛집임? 허파 비리고 국물은 마늘맛만 나는데.../나 허파 좋아했네/순대에 허파는 못먹는데 여긴 양념 맛도 있고 오도독 뼈 씹는 맛에 집이 먼데도 가서 포장해와서 끓이면 며칠을 먹어요 맛집이에요/끓이면 끓일수록 더더더 맛있어요./맛나네요ㅎㅎ 낮술하러가서 셋이서 소주8병마셨어요 ㅎㅎ 국물 얼큰하고 허파 쫀득임 좋아요/꿀맛탱ㅋㅋ/소주를 부르는  마늘과 파 양념장이 많이 들어간 칼칼한 찌개맛. 화력이 센 것도 한 몫하는 것 같다. 양도 대식가라 불리는 성인 둘이가도 넉넉해 가성비가 괜찮다. 단지 아쉬운 점은 가게 안 위생상태가.. 내 손으로 옆에 지나가는 바퀴 한 마리 휴지에 싸서 쓰레기통에 버렸다. 가게 규모도 생각보다 작으니 그 점 관철하고 가시길./불친절~ 아들 서비스업의 기본이 친절~ 굳이 불편한 동네에 불편하게 먹으러 가지 않아도 맛있는 거 많은 세상!/백종원의 3대천왕에 소개된 집 좀 맵다는데"
3,마루샤브 용두직영점,서울 동대문구 왕산로 61 한일빌딩 1층 (우)02579,샤브샤브,"쇠고기샤브 (평일점심),쇠고기샤브세트 (저녁/주말/공휴일),해물샤브런치 (평일점심),해물샤브세트 (저녁/주말/공휴일),한우 샤브 (평일점심),한우 샤브 (저녁/주말/공휴일)",20633,2.1,12,12,"공휴일 7시30분쯤에 갔는데 음식 회전률도 별로고 직원분들 서비스도 별로였어요.  인간적으로 8시30분쯤 직원들 식사로 마감칠꺼면 영업시간 8시30분까지라고 정보수정 해주세요;;;;/가격이 좀;;/백신 접종 완료 못한 사람은 pcr증명서 있어도 안 받는 곳. 혼밥도 거부해요. 헛걸음 마시고 다른 곳 가세요./5천원dc해얄듯 ㅋ 21000은 쌤. 그래도잘먹엇어요. 음식들이 대체적으로 없고  차네요/별점 하나도 아까움 종종 가던곳인데 간만에 갔더니 가격도 17800₩(평일점심)으로 올랐는데 음식의 종류나 퀄리티도 훨씬 나빠졌다 오후 1:50분에 갔더니 뷔페코너엔 이미 음식들이 거의 비어있었고 그나마 남은 음식들도 셀러드는 몇시간이상 지나 물이 생기고 찌끄레기들만 남아있었고 피자는 빈 판들만..따뜻한 음식들은 다 집어가고 남은 잔해들만 있어서 음식리필을...더보기/오늘 점심 1시 이용. 정말 별 하나도 아까움. 숙주는 다썩고, 배추도 시들. 뷔페는 거의 빈접시 서빙하시는 분께 말씀 드렸더니 신경ㅈ/넓고 맛있어요 튀김이 특히 맛있음/사장님 친절하고 좋으시던데 ㅠㅠ 여기 샐바도 맛있구 야채도 신선해요~~ 항상 맛있게 먹고있어요 !!!! /여기는 마루샤브 이미지 다 깍아 먹는곳이에요. 굉장히 불친절하고 음식셋팅도 바로바로 안되고 음식 자주 많이 가져가면 은근 눈치줘요 /재수없어요 5시반 단체예약했는데 5시15분에갔더니 이추운데 밖에서 기다리라네요 임산부도 있는데 브레이크타임 있으면 써놓고 장사하세요/샤브샤브 먹다가 국물에서 벌레가 나왔는데  여름에는 그럴수도 있다고 ㅎㅎ  아무리봐도 채소를 제대로 안씻어서 들어간 벌레인데 날파리라고 계속 우기고 ㅎㅎ  다시는 못갈곳임"
4,와가리피순대 본점,서울 동대문구 왕산로9길 22 (우)02579,순대,"오소리순대국 (작은),한우소머리국 (작은),도가니탕,순대술국,소머리술국,순대모듬 (작은)",13666,3.9,20,38,"서울에서 몇 안되는 피순대를 맛 볼 수 있는 집 순대도 맛있고 김치도 맛있음/맛있어요 김치도 ^^/최고의 순댓국집/맛없다. 김치도 깍두기도 미니피클고추도 진짜 맛이 없다. 순댓국이 먹고 싶어서 들어갔는데..실수였다. 김치는 한군데 담아놓고 손님이 올 때마다 가져다 준다. 요즘같은 시기에 뚜껑도 없다. 청결하지 않다./피순대 모듬은 엄지 척...순대국은 글쎄..,/서울에서 순대국집 잘 안가는데 여기만 갑니다. /별루에유~~/가리.  사유: 매운고추폭발 메뉴: 피순대 소\순대국\ 비고: 피순대단품 맛있음./이 집 순대국은 정말 일품이란 말이야. 국물도 뻑뻑하고 건더기도 제법 많이 들었읍니다/인생 순대국... /맛은 진짜 최고. 근데 가게 냄새 ㅠㅠ 옷에 배임/피순대가 먹고싶어 검색해서 찾아감  모듬순대 정말정말 맛있고 순대국도 얼큰하니 참 좋다~~   (안쪽 좌식 자리는 화장실문 열리면 냄새 들어오니 의자자리 추천..)/집앞에 있는 피순대집 평타이상 침/순대국 얼큰하니 맛있습니다 /순대국엔 오소리가 많이 들어있는게 특징 순대는 4개지만 맛은있다 맑게 먹는 국밥,  김치먹는 시스템이 불편 새우젖도 없다/드뎌찾았다 설에서 피순대 찾기 힘드네ㅋ 역쉬순대는 피순대가 짱/피순대가 먹고싶어 검색해서 찾아감  모듬순대 정말정말 맛있고 순대국도 얼큰하니 참 좋다~~   (안쪽 좌식 자리는 화장실문 열리면 냄새 들어오니 의자자리 추천..)/집앞에 있는 피순대집 평타이상 침/순대국 얼큰하니 맛있습니다 /순대국엔 오소리가 많이 들어있는게 특징 순대는 4개지만 맛은있다 맑게 먹는 국밥,  김치먹는 시스템이 불편 새우젖도 없다/드뎌찾았다 설에서 피순대 찾기 힘드네ㅋ 역쉬순대는 피순대가 짱/피순대가 먹고싶어 검색해서 찾아감  모듬순대 정말정말 맛있고 순대국도 얼큰하니 참 좋다~~   (안쪽 좌식 자리는 화장실문 열리면 냄새 들어오니 의자자리 추천..)/집앞에 있는 피순대집 평타이상 침/순대국 얼큰하니 맛있습니다 /순대국엔 오소리가 많이 들어있는게 특징 순대는 4개지만 맛은있다 맑게 먹는 국밥,  김치먹는 시스템이 불편 새우젖도 없다/드뎌찾았다 설에서 피순대 찾기 힘드네ㅋ 역쉬순대는 피순대가 짱/피순대가 먹고싶어 검색해서 찾아감  모듬순대 정말정말 맛있고 순대국도 얼큰하니 참 좋다~~   (안쪽 좌식 자리는 화장실문 열리면 냄새 들어오니 의자자리 추천..)/집앞에 있는 피순대집 평타이상 침/순대국 얼큰하니 맛있습니다 /순대국엔 오소리가 많이 들어있는게 특징 순대는 4개지만 맛은있다 맑게 먹는 국밥,  김치먹는 시스템이 불편 새우젖도 없다/드뎌찾았다 설에서 피순대 찾기 힘드네ㅋ 역쉬순대는 피순대가 짱"
5,용두동복집,서울 동대문구 왕산로16길 9 (우)02584,복어,"복불고기,복튀김,복사시미(1kg)",73000,3.9,12,25,"1인분 2만6천원 무조건 2인분 시켜먹어란다. 어이없는 집 복탕도 비싸고 맛 없다 가격좀 적당히 받지.../맛있어요 강추/불친절. 맛없음./복불고기 복튀김 너무 맛있고 반찬들도 맛있어요 복불고기란 음식을 처음 먹어봤는데 양념이 달짝지근해서 맛있네요/good/복불고기 최고라 인정. 복튀김도 완전 맛있고,껍질무침도 대박~~ 완존 존맛탱/별로예요/맛있어요 /복불고기!/복불고기는 맛있으나 가격대가 쎈편임 주차장은 2대밖에 못함/진짜 대박"
6,용두동쭈꾸미 본점,서울 동대문구 무학로36길 10 (우)02584,해산물,"용두동 쭈꾸미(오리지널),삼겹살,계란찜,누룽지탕,맑은탕,용두동 쭈꾸미 (덜 매운맛)",8500,2.2,14,23,"소문보다는 별로/중국어 할줄알면 가세요. 조선족 점원이 뭐라고 하는지 못 알아듣습니다. 맛도 맛이지만 위생이 최악/정말 디지게 맛이 없어요... 해도해도 너무 심하게 맛이 없어요... 맵기만 오지게 맵고 얼마나 매운지 가르쳐 주지도않고 종업원 아지매도 불친절하고...  돈 받고 먹으래도 안갈래요  절 여기 데려간 아버지가 원망스러울 따름입니다.  이건 린심입니다/오리지날 쭈꾸미와 덜 매운맛 쭈꾸미의 안내 및 설명이 부족하여 오리지날 쭈꾸미를 잘못 주문 하여 너무 매워서 추가로 치즈와 쿨피스를 주문 하였음 야채는 깻잎은 좋았으나, 상추는 작아서 불편하였으며, 달라고 벨을 눌러서 요청하는 경우에만 갖다 주어서 불편함 있음/태어나서 먹은 쭈꾸미 중에서 젤 맛 없음 ㅠ 돈아까웡 쭈꾸미 양도 작고 밍밍함 맵기만 함 옷에 쭈꾸미 국물 튀어놓고 사과도 안함/친절하지도 불친절하지도 않음 굳이 찾아가서 먹을만한 맛은 아녔음 그냥 생각했던 쭈꾸미볶음의 맛/불친절..../친절도가 눈에 띄게 떨어지고 애기있는 손님에 대해서 배려가 1도 없었습니다 다시가고 싶지 않네요/맛있게 매운 쭈꾸미집!/매콤해도 멈출 수 없는 맛! ★★★★★"
7,신가네왕코등갈비,서울 동대문구 천호대로 67 (우)02584,갈비,"등갈비 (1인분),돼지갈비 (1인분),생삼겹살 (200g),껍데기 (1인분),새우 (10마리)",13200,4.0,13,38,
8,카페림,서울 동대문구 천호대로27길 8-2 (우)02566,디저트카페,"아메리카노 (HOT),카페라떼 (HOT),리얼딸기라떼 (ICE),장미레몬에이드,오레오쉐이크",5140,4.3,30,67,"용두동 라떼 맛 양 가격 전부 아쉬워요... 딴 음료 드시길... /여기는 쑥라떼 말차라떼는 별로예요.. 가루알갱이가 둥둥 떠다녀서 너무 쓰더라구요 아까워서 다 마시기는했는데 음료만 마시기가 힘들었어요 참고하세요/맛있고 분위기 좋아요/마카롱 쏘쏘에요 아인슈페너 맛있더라구요 1음료당 쿠폰찍어주셨어요 분위기 괜찮아요 잘꾸며놓으셨음 단점은 쪼오오금 비싸용/좋아요^^/커피도 맛있고 분위기도 좋고 다 좋은데 화장실 갔다가 살짝 놀랐네요 여자 남자 같은 사람인데 깨끗하게만 써주세요라는 말을 여자의 환상이라고 표현하신 점이 좀 그렇네요 단어 선택 때문에 약간 실망한 것 빼곤 전부 좋습니다/넘 이쁜 장소에 맛있는 커피, 친절한 직원/좋아요~~ 보리랑 또 가께욘~~/여기 크로플 진짜 완전 대박 맛있어요. 바삭한 공기 씹는 거 같았습니다. 다만 카페가 좁다보니 부피가 큰 가방을 메고 갔다가 꽃병을 깨트릴 뻔 했어요. 조심하시면 좋을 듯 합니다./정성가득 마카롱 감사합니다 맛은 언제나 최고  !/크로플 완전 맛있습니다. 강추/카페도 예쁘고 마카롱도 맛있어요/와플도 맛있고 커피도 맛있었어요  :) 제주도 주택같은 레트로 감성이에요/공간이 예쁘고 아늑하고 스콘, 마카롱도 맛있었으나 음료 양이 너무 작아요/마카롱 맛집 인정. 아메와 함께 레드벨벳 뚱카롱 진짜 jmt 이동네 핫플입니다./마카롱 진짜 귀엽고 맛있어요, 커피맛도 좋고 인테리어도 아기자기해서 넘나 이뻐요/우연히 들렸는데 분위기도 좋고해서 가끔 갑니다./카페가 딱 사진찍기좋은 비주얼이라서 인생샷 건지고왔어요/에이드먹었는데 상큼보스입니당 ㅋㅋㅋ 비주얼도 이뻐서 인스타갬성으로 올렷서용/포장해갔어요! 이쁘게잘해주셔서 감사해요 진짜 달달하니 살살녹네요/장미레몬에이드랑 마카롱 먹었습니다! 마카롱 제가 먹어본곳 중 탑 3에 드네요. 진짜 맛있어요 번창하세요~/익선동같은 분위기 카페에요~ 아기자기하고 인테리어 넘이쁘고 특히 마카롱이랑 당근케이크 존맛입니다 점심시간때 가서 좀 정신없었지만 한가할때 꼭 들리고싶어요!/카페가 딱 사진찍기좋은 비주얼이라서 인생샷 건지고왔어요/에이드먹었는데 상큼보스입니당 ㅋㅋㅋ 비주얼도 이뻐서 인스타갬성으로 올렷서용/포장해갔어요! 이쁘게잘해주셔서 감사해요 진짜 달달하니 살살녹네요/장미레몬에이드랑 마카롱 먹었습니다! 마카롱 제가 먹어본곳 중 탑 3에 드네요. 진짜 맛있어요 번창하세요~/익선동같은 분위기 카페에요~ 아기자기하고 인테리어 넘이쁘고 특히 마카롱이랑 당근케이크 존맛입니다 점심시간때 가서 좀 정신없었지만 한가할때 꼭 들리고싶어요!/카페가 딱 사진찍기좋은 비주얼이라서 인생샷 건지고왔어요/에이드먹었는데 상큼보스입니당 ㅋㅋㅋ 비주얼도 이뻐서 인스타갬성으로 올렷서용/포장해갔어요! 이쁘게잘해주셔서 감사해요 진짜 달달하니 살살녹네요/장미레몬에이드랑 마카롱 먹었습니다! 마카롱 제가 먹어본곳 중 탑 3에 드네요. 진짜 맛있어요 번창하세요~/익선동같은 분위기 카페에요~ 아기자기하고 인테리어 넘이쁘고 특히 마카롱이랑 당근케이크 존맛입니다 점심시간때 가서 좀 정신없었지만 한가할때 꼭 들리고싶어요!"
