,name,address,sort,menu,mean_price,score,people_give_score,review_count,review_list
0,콩카페 이태원점,"서울 용산구 녹사평대로 168-8 1,2층 (우)04390",카페,"코코넛 스무디 커피 (ICE),코코넛 멍빈 스무디 (ICE),코코넛 라이스 스무디 (ICE),아메리카노,카페라떼,Bánh mì(반미)",5916,4.2,52,154,"두리안커피가 계절음료라네요. 두리안의 중독성이란~ㅎ 연유라떼 양은 무지 적은데 달달하니 맛있어요. 여기는 늘 분위기 좋아요./뷰가 다했다ㅠㅠ (브라운커피도 맛있어요 단 양이 매우 적어요)/주말에 다녀왔어요 반미는 정말 맛있었어요 겉은 바삭하고 속은촉촉하고 고수도 선택해서 넣고 뺄 수 있구용 소고기 돼지고기 고를 수도 있어요!  맛있게 먹고 왔습니다~ 근데 직원분들 친절한지는 모르겠더라구요. 외국인 응대하는거보고 지금이 2022년 맞나 잘못본줄.... 자기들끼리 수다떠느랴 손님이 뭐 물어보는것도 일단 무시하던데요. ㅎ 직원분들 가슴에 달린 명...더보기/이태원, 한남 카페중 친절하고 이국적인 면에 있어 빠지지 않는 곳. 하노이와 호치민의 카페가 떠오른다../직원분들 친절하고, 반미 샌드위치 맛있고, 음료 맛있고, 자리 많고, 넓고, 꼭대기 루프탑도 있어요 너무 좋아 ㅠㅠ 힐링장소임 그냥 /용산구청뷰/3.5 코코넛 커피 맛있다. 베트남식 아메리카노 맛이 없다. 날 좋을 때가서 3층 테라스에 앉아 풍경을 즐기면 좋다./비프 반미샌드위치 맛있는데 간만 조절되면 좋겠어요 간장을 실수로 통째부은거 같아요  /커피 맛있어요/코코넛 스무디 커피 한 모금에 행복해짐/괜춘해요~/시그니쳐보다 패션후르츠가 더 맛있었음/명동교자 먹고 코코넛커피 한잔이면 행복♡ 다만 내기준에 코코넛향은 조금 부족/루프탑 분위기 넘 좋아여ㅠㅠ 스무디들도 다 맛있습니당♡♥/날씨좋은날 루프탑에서 코코넛스무디커피 굿 루프탑 사마귀 조심하세호../분위기 굿. 이국적인 커피도 굿./커피 맛있어요ㅎㅎ분위기 진짜 베트남같아요/연유 바게트 때문에 간다/나오는데 이십분걸림/커피가 조금만 덜달면 좋겠어요/여기가 베트남인가 ...?/친절하시고 맛있어요!/또가고싶다/연유라떼 추천합니다 친절하네요/연유!!!!/분위기 독특. 연유라떼맛이 베트남 믹스커피 맛 납니다. ㅎㅎ /분위기도완전 예쁘고 맛있어요ㅠㅠ!!/음료 시원하고 공간도 잘 조성했네요/베트남느낌 물씬나서 좋았어요. 카페 인테리어도 신경많이쓰신 것 같아요! 시그니처 마셨는데 넘 달달해서 제 스타일은 아니었지만 함번쯤 가볼만한 곳이었습니다!!/삼층 공간도 넓고 음료도 맛있어요/가성비 굿"
1,명동교자 이태원점,서울 용산구 녹사평대로 136 (우)04390,분식,"칼국수(포장불가능),진한 닭 육수에 부드러운 면발이 조화인 칼국수,11,000,비빔국수(포장불가능),매콤, 새콤 감칠맛이 입맛을 돋우는 소박한 국수,11,000",10000,3.8,59,147,"이제 멀리 명동에 갈 필요가 없습니다./맛있어요/본점이랑 맛 굉장히 다름, 재방문 의사 없음/맛은 말할것 없이 훌륭.  두명이 칼국수 하나 시키고선 공짜밥을 두번이나 추가하고 국물 리필까지 하는데 싫은 기색없이 처리하는 사비스에 깜짝놀랐습니다.  가게에서 호의를 제공하면 감사히 생각해야지 악용하는 저급한 행동은 자제를 좀../칼국수에서 짜장면 맛 남. 근데 맛있음/칼국수는 맛있고 만두는 그저 그럼 로봇이 귀여움/맛있어요ㅠ 근데 저는 김치가 좀 별로더라구요.. 너무 알싸하다고 해야되나..??/첫 명동교자 방문!! 비오는날 뜨끈한 칼국수 한그릇하고 갑니다 ㅎㅎ 그릇 치우고 음식 갖다주는 로봇이 있어서 매우 신기했어요..! /명동교자 본점만 7번 방문한 사람인데 앞으로는 여기 올 것 같아요 맛도 똑같고 훨씬 더 친절하고 훨씬더 위생적입니다 수저 깨끗한거 보고 깜짝 놀랐음 암튼 최고/맛이야 명동본점이랑 똑같고 맛있습니다 ^____^ 특히 1층 홀에서 응대해주시는 남성분이 정말 친절하셨습니다/진짜 가면 맨날 싹싹 다 비워먹음 /성별을 알수없는 여자분은 도대체 무슨말일까?ㅋㅋㅋ 아직 안가봤는데 가려고 찾아보다 웃겨서 댓글 남겨봄  뭐 그렇게라도 기분나쁘게하고싶나 그사람 행동이 이상하면 행동을 지적해야지ㅉㅉ ++ 오 수정했네요 성별을 알수없는 종업원분으로 ㅋㅋ앞으로도 그러시지말라고 이건 걍 냅둘게요/성별을 알수없는 종업원분이 너무 불친절해요.. 카드도 던져서 주시고 주문빨리 해달라고 그러고 눈치보느라 밥도 편히 못먹었어요../너무 맛있게 먹고 왔어요~ 사장님 번창하세요~   /평소 여기 김치맛이 좋아서 생각날때 자주 가는곳인데 오늘 서빙직원에게 김치 더달라고했다가 남기면 안된다고 핀잔듣고 엄청 기분 상했습니다. 워낙 유명한 브랜드라 손님들이 알아서 스스로 오는곳이지만 직원들이 손님을 이런식으로 대하면 사업 오래 못가는건 순식간입니다. /명동점보다 웨이팅도 없고 깔끔/칼국수, 여전히 맛있다~ 비빔국수랑 함께 먹으면 더 맛있다. ㅎㅎㅎ/매우 맛있게 먹었다. 그러나 2층에서 일하는 성별을 알수없는 알바생분이 약간 띠껍다는듯이 응대한다. 되게 불편했다. 앞치마가 없다. 사이다도 없다./변하지 않는 서울 1등 맛집/브레이크타임이 공지가 안되있어서 기다렷다가 먹었어요/입구 직원은 친절한데 계산하는 직원이 너무 불쾌합니다.. 반말로 시작해서 말투도 그렇고 계산하면서 태도도 기분 상하게 만드네요. 바쁜시간대도 아니었는데... /맛있음/칼국수와 콩국수 먹었는데 칼국수 국물에서 중화요리 불맛이 살짝 납니다. 콩국수 너무 맛있어요. 완전히 갈지 않은 살짝 입자가 보이는 콩국수입니다. 1인 1메뉴 시키면 사리 리필됩니다. 만두와 김치에 마늘을 엄청 넣어 맛있어요. 만두 남은거 싸가는데 중간에 봉지에서 마늘냄새 엄청 나더라고요.  콩국수랑 김치 너무 맛있어서 재방문 의사 있습니다./직원분들 친절하시고 맛도 좋음. /말해뭐해 주차가 편해서 자주가는 지점 종업원 분들이 친절하심/칼국수가 나오기 전에 만두 한판은 뿌셔줘야 제 맛. /일당백으로 서빙하시는 분 덕분에 친절한 식당이라고 느낌. 주차는 근처 용산구청에 했는데 평일 낮인데도 지하5층까지 내려갔다. 용산에 생겨서 명동까지 안 가도 되서 좋은데 강남쪽에도 생겼으면 좋겠다. 그리고 점심시간 지나서 한시만 넘어도 한산하다./사람 많고 바글바글한데 회전이 빨라서 바로 앉아서 먹었어요 음식도 빠르게 나왔고 칼국수 맛은 말해뭐해요,, 김치는 또 을매나 맛있게요? 분점 여기저기 더 많이 내주세요ㅠㅠㅠㅠ 안 먹어본 사람 없게 해주세요/리뷰보고 걱정하고 갔는데  아침에 남자종업원이 아주 친절하셨어요 방역 수칙도 철저하고 국수도 맛있었습니다./종업원교육 개판인곳 ㅎㅎ   작년10월에 갔었는데 이제야 쓰네요  진짜 웃기는곳"
2,부다스벨리,"서울 용산구 녹사평대로40길 48 지상1,2층 지하1층 (우)04345",태국음식,표기안함,표기안함,4.4,182,211,
3,더버뮤다,서울 용산구 녹사평대로 168-6 (우)04390,양식,"명란크림 파스타,관자오일 파스타,페퍼로니 피자,아보카도 샐러드,치즈감자 스프",17600,3.5,38,81,
4,모터시티바이매니멀 본점,서울 용산구 이태원로 140-1 2층 (우)04390,피자,"JACKSON 5,CHEESE PIZZA,PEPPERONI,THE FARMER,MOTOWN SUPREME",21480,3.6,72,178,"음식과 맥주는 맛있었지만 몇몇 직원들의 태도는 개선이 필요해보였습니다./디트로이트 피자의 정석. 맛있다. /매장 분위기 디트로이트에 왔다는 느낌 사알짝!! 맛은 그냥 한국 피자/맛있어요!! 짜다는 분도 있는데 짠 걸 좋아하는 제 입에는 딱이었어요! 오랜만에 미국식 맛이라 맛있었어요:-) 다른 사람이랑 또 올게요!/그럭저럭? 잭슨5 한 번 먹어보고 싶어요/맛있어요 피자의 정석/살짝 비싼 편 /잘먹었습니다 역시 존맛이네여/존맛탱/""오?""하고 시켰지만, ""흠....""하고 끝난 피자.   1. 배달시키려거든 꼭 1대1 배달되는 곳으로 하세요.     (참고로  '요** 익스프**'는 여러 집 배달갑니다....       쿠***나 배** 시키세요)  2. 오일리한 디트로이트식 피자입니다. 네모난 빵틀?에 피자 굽는 방식이라, 기름기가 좍 빠지는 피자 기대하시면 안 됩니다. 그래서인지 ...더보기/직원 대응이 엉망. 직원이 주문 잘못넣었고, 이 후에 음식 솔드아웃되서 음식 못받았는데 잘못나온거 서비스로 드릴게요 하면서 “이게 더 비싸요” 누가 보면 몇 만원 차이나는 줄 알겠어요^^…. 이천원차이납니다.  지인이 포크 떨어져서 새로 달라고 했더니 워시중이라 없대요. 그냥 지금 워싱중이라 끝나면 가져다준다 하면 될 걸…. 없어 알아서해 태도라 지인이랑 ...더보기/굉장히 자극적이고 인상에 남는 맛/피자는 그냥 그렇고 파스타 면은 안 익음 윙은..너무 달면서 짬..2% 부족/이 집 피자 잘 하네/제 입맛에도 맛있었지만.. 60년 넘게 순두부찌개와 김치 바라기 우리 아빠 입맛에도 딱 맞았었던 좋은 분위기의 피맥집...! /Liked the pizza and the staff was pretty friendly. /대표 피자 맛있어요~ 재료들이 실제로 함께하는 느낌? ㅋㅋ 싼 피자는 따로 노는 느낌이 강하잖아요ㅎ 그리고 버섯튀김도 맛있었어요!! 감튀는 쏘쏘..ㅎ/맛있음/기름진 피자 가끔 땡길 때 감./피맥하기 좋음/갓나온 피자는 맛없기 힘듬 그냥 포카치아에 모짜렐라 올린 맛 고기 많은 파자라고 시켰는데 고기고기하지는 않았음/가격에비해 창렬인거 빼면 맛있음 맥주랑 먹으면 헤븐 버섯튀김 꼭!!!!!!/머리카락나옴/진짜 맛있는데 가격이ㅠㅠ/음 존맛. 많이들 시키는 잭슨 5랑 감자튀김 시켰는데 둘 다 맛있음/비싸고, 그 값을 하지 못합니다. 양도 적어요./완전 짜요/피자보단 피자빵같은 느낌이네요 감튀는 ㄹㅇ 맛있어요 한번은 갈만 하지만 또 가고싶진 않네요 치즈를 좋아하는 저는 빵맛보다는 치즈맛을 느끼고싶었는데 치즈가 많이없고 짰어요 빵좋아하시는 분들은 빵식감이 괜찮아서 좋습니다 저는 피자를 먹고싶었는데 피자빵을 먹는것같아서 아쉬웠어요/피자랑 감튀 존맛탱.... 한국말 잘하는 외국인이 서빙함ㅎㅎㅎ/맛집으로 소문난 거에 비해 그냥 그럼/매장이 좀 시끌벅적한것만 빼면 좋아요./시끄러운게 단점 피자가 너무 맛있음 "
5,지노스뉴욕피자,서울 용산구 녹사평대로40길 46 2층 (우)04345,피자,"MINI ICEBERG WEDGE SALAD,GARLIC KNOTS (HALF),HOT BUFFALO WINGS,CREAMY PARMESAN GARLIC WINGS,PLAIN CHEESE (R)",10600,3.8,62,55,"짱이죠 여긴/다들 맛있다곤 하는데 내입엔 그닥,, 바삭하고 빵은 맛있음 근데 토핑은 그냥저냥,, /사랑해요  이제 여기 말고 다른데서 버팔로 못 먹겠어요. 밍밍/낮맥으로 딱/친구 생파 갔다가 시킨거 한조각 먹고 술 먹느라 더 먹지 못한거에 한 맺혀서 계속 생각남 ㄱㅊ음 여기 버팔로 윙도 맛있음 /I loved their wings&pizza. Good for hangover Cure haha/ 최고라고 까진 못하겠지만 적당히 잘한다. 특히 피자 깔끔하고 맛있음. 나처럼 느끼한 치즈폭포 싫어하고 담백한 이태리식 피자 좋아하면 여기 강추:) 버팔로윙도 존맛! 무난하게 가기 좋다. /맛은 그냥 적당히 맛있구요,, 창가에서 먹으면 분위기 좋아요 ㅎㅎㅎ /미국 안가봤지만 맛있어요!! 창가 쪽 자리에서 먹으면 더 꿀맛입니다/정통 미국 피자 느낌이고 도우 끝부분까지 바삭하고 맛있어요/담백하고 맛있으며 양도 적당해요~ 추천추천!!! 직원 분들도 친절합니다./와오아왕 찐한 피자맛이다 /베스트 메뉴라 시켰는데  맛은 보통... 대부분 피자들보니 각종 토핑들 양이 풍성하지가 않음..원가 꽤많이 남길듯 ㅎㅎ   웨이팅? 의자  왜있는지 의문   역시 피자는 알xx 웃음꽃피자 미만잡. /바삭한 팬피자와 즐거운 야경. 바삭한 꼭다리와 미트볼이 참 맛있었고. 피자는 대표피자를 반반시켰는데 미트볼때문인지 화이트소스가 더 좋았어요. 뷰가 좋아요 아랫집 고양이 구경하고 멀리있는 용산구청 구경하고./평범합니다.... 정말 평범해요.... 비쌀 이유가 없습니다. 버팔로 윙은 맛있습니다./베스트 메뉴만 시켜봤다. -핫 버팔로윙: 핫소스 향과 맛, 시큼한 맛이 너무 강해 먹을때마다 기침은 덤이다. 미국에서 먹던 버팔로윙 맛이 전혀 아니다. -브루클린피자: 그냥 익숙한 콤비네이션스러운 피자. 이렇게 비싸게 주고 먹을만한 피자는 아니다. 개인적으로 너무 실망함./명성에 비해선 평범한 맛/피자 맛있다는 곳 여기저기 다 가봤지만 여기가 제일 맛있었습니다. 도우가 얇고 바삭하며 위에 올려진 재료들이 굉장히 알차게 느껴졌습니다. 그리고 특히 윙이 제가 먹어본 top 3 윙 안에 듭니다. 파마산 갈릭 윙인데 다음엔 핫 버팔로 윙도 도전해봐야겠어요. 배부르게 잘 먹고 갑니다 ~ /피자 너무 맛있어요 도우가 엄청 바삭바삭해서 계속 들어가네요 다른 피자는 2조각 먹으면 질려서 못먹는데 진짜 맛있게 먹었어요 윙도 진짜 맛있고 분위기도 좋아요 또갈겁니당/정말 맛있고 뷰도 너무너무 좋았네요 누욕식 피자 제대로 맛보고 왔습니다 굿굿/먹어본 피자중에 최고 /초반에 수요미식회 나왔을때 갔을땐 진짜 맛있었다. 지금까지 먹어본 피자중에서. 그 맛을 못잊어서 다시 갔는데 토핑은 부실해지고 피자도 이상하게 잘라주고..(균형이안맞음) 치킨윙은 소스가 제대로 스미지도 않았고.. 여튼 실망스러웠다 다시 재방문은 없을듯 /Worst pizza ever. I was born and raised in New York. I was so excited to try Gino's in Seoul, but I was really disappointed. The pizza was terrible and pricey. The service wasn't great either. The cas...더보기/피자도 마찬가지지만 크리미파마산갈릭윙 정말맛있습니다. 서비스가 좋은 곳./압구정은 초반에 좀 심하던데 내말알죠? 핏자헛이 딱 떠오르던데. 분명 잘하시는 분들이였는데~ ㅎㅎ/요즘 이태원에는 미국본토의 맛을 재현한다는 아마도 교포청년들인것 같은 셰프들이 오픈한 미국식 레스토랑이 많은데, 개인적으로 피자나 버팔로윙등 미국음식은 미국맛을 좋아해서, 피자헛등에 가서도 달짝지근하거나 토핑이 한 열가지는 되어 보이는 요즘 유행하는 피자류는 질색이라 늘 페퍼로니피자같은 심플한 것만 주문하는데, 미국맛의 버팔로윙이라는 지노스피자 버팔로윙을 ...더보기/30분 기다려서 먹었습니다. 주문하고 나서도 20분 가랑 기다렸습니다. 페페로니 매니아라서 페페로니를 주문했습니다. 맛을 평가하자면 그저그렇습니다. 줄서서 기다리며 먹을 정도는 절대로 아닙니다. 짠맛이 강합니다. 피자 지름은 크지만 도우가 얇아서 양이 많지 않습니다. 직원들은 많이 친절합니다. 가격은 저렴하지 않습니다. 나의 평가점수는 2점이지만 평균평점이...더보기/보통의 맛 보통의 가격 예상가능한 분위기/피자  윙/크레이지 익스펜시브 ㅎㅎ 어디에서 뉴욕의 향기가 나는진 모르겠지만 너무 기대했던 탓인지 유명 맛집이라는게 무색할정도ㅎㅎ 세상에 맛난 피자는 더 많다! 참고로 버팔로윙은 우리가 아는 그맛이 아니라 강렬하게 느껴지는 신맛, 짠맛에 놀라는 특이한 맛... 같이 나온 샐러리가 장식이 아님을 바로 알수있음. /가지 마세요. 외국인 친구도 데려가서 가장 대표 메뉴인 피자를 하프앤하프로 먹었는데 둘 다 헛웃음만 지으며 아무 말 없이 먹다 나옴. 내 인생 가장 허탈한 식대 4만원 이었음. /Wanna give 5 stars, but 37000원 for a large is crazy expensive. The pizza is great, though. I lived in Brooklyn for three years and it reminds me of places I'd eat in NYC. reminds me a lot of Bleecker ...더보기/브룩클린의 향수를 느낄수 있는 피자집이라고 해서 방문. 사실상 뉴욕에서 먹었던 피자는 도우는 밀가루 비린내 범벅에 싸구려 치즈, 토마토 소스맛, 소금을 범벅채 뿌렸는지 너무나도 짜기만한.. 정말 최악의 피자였음.  여기 피자는 도대체 어디가 브룩클린의 피자라는건지.. 비교할수도 없이 맛있다. 쫄깃하고 얇은 도우, 이탈리아 피자에서나 맛볼슈 있는 신선한 치즈...더보기"
6,롸카두들내쉬빌 핫치킨 이태원점,서울 용산구 녹사평대로40나길 9 1층 (우)04345,치킨,the Classic,8700,4.3,130,241,"여간 찐이다. 진짜다./맛있다.  계속 생각나는 맛.. 매장이 조금 더 컸으면 하는 아쉬움../맵기도 버거의조합도 찐 미국맛 그리웠습니다. ! /그 어떤 치킨버거보다 빠!싹 튀겨져나옴& 자극적(핫치킴이니 당연하지만..^^)임=맛잇긴 맛잇음..^^ 소고기패티집들과는 결이 다르니 비교할 수 없고(개취는 소고기패티 육즙좔좔~) 르프리크랑 비교햇을땐 더 자극적인느낌(대강 뢐둗이 더 맛잇엇다는 말)/짭짤한 치킨 버거. 취향인 사람들은 좋아하겠지만 내 입맛은 아니었다./190727   맛있거나 괜찮은, 좋은 맛이지만 요리 자체의 한계가 평범한 프랜차이즈에 내쉬빌 핫치킨과 큰 차이를 주기 어려워 보인다. /매장은 작았지만 11시반에 도착했더니 친구와 창가자리에 마지막주자로 앉았습니도.. 근데 정말 맛있었슴다 갠적으로 르프거시기보다 맛났어요/상당히 짜고 기름지기 때문에 초심자에겐 좀 어려운 메뉴입니다.  내쉬빌이란 메뉴를 좋아하시는 분들에겐 좋은 선택지가 될 듯 합니다/진짜진짜 맛있어요 진짜진짜진짜/맛있어요/주차 불편하구요 매장 너무 시끄럽습니다 맛은 좋아서 또 먹을 거 같아요 치즈킨 먹었는데 치즈랑 양파랑 맛이 잘 어울려요 닭가슴살인데도 퍽퍽하지 않았습니다 /전화를 받아도 너무 예의없음. 힘든 건 이해되는데 너네가 받는 돈이 누구한테 나오는지 생각하고 대해라/총평: 맘스터치 상위 버전! 먹은 메뉴: 더클래식 0.5 당연히 맛이 있는 것으로만 구성되어 있으니까 맛은 있지만 굳이 찾아가지 않을 맛입니다.  사진으로 봤을땐 고기에서 육즙 터질 것 같지만 그렇지 않습니다. 소스도 양념치킨 맛이 아닌 핫소스에 가깝습니다. 특별하다면 안에 코울슬로가 들어갔다는 정도? 맛은 있죠… 그치만 평범해요… 제 입맛으로는 동네에 맛...더보기/더 클래식 1단계 주문했다.  맛은 미국 양념치킨 버거맛이었다. 짜고 매콤해서 자극적이고 이국적이나 맛이 없다. 또 내용물이 후두둑 떨어지는데, 하나가 아니라 두 개를 붙여 하나의 패티처럼 보이게 만들어놔서 정말 먹기 불편했다. /짱맛 3단계도 좀 매워서깜놀... 콘샐러드도넘맛있음/the classis combo 먹었는데 양은 좀 많은 것 같고 매움은 1로 했는데 좀 매운듯. 맛이 매우 미쿡맛이네요. 굿/맛있어요!! 0.5단계도 살짝 매콤해요/치킨이 맛있는 곳입니다. 닭다리살 패티와 닭가슴살 패티 메뉴가 별도로 있어서 취향 따라 골라 먹으면 좋습니다. 테이블이 적어 가뜩이나 웨이팅이 있는데 마치 카페처럼 죽치고 있는 손님 때문에 웨이팅이 길어지는 경우가 있습니다./타지에서는 굳이 올 필요없는 맛 어차피 이래도 올껄 알지만 그냥 맘터 2.0임 네슈빌이라고 특별한건 아니고 양념치킨에서 고추장 빠지고 핫소스 넣은맛 동네에 있으면 종종 들를듯 /먹어본 치킨버거 중에서 원탑. 대체불가능한 맛./항상 최고/치킨버거의 정석이라 생각합니다^^ 다만 엄청 대단한 맛은 아니어서 웨이팅이 아주 길다면 기다리진 않는 것이 나을 수도 있다고 봅니다ㅎㅎ 친절하고 좋았습니다./확실히 치킨버거 존맛탱이긴 합니다 한여름에 갔는데 에어컨없이 선풍기 원툴이라 휘날리는 냅킨 잡는게 빡세긴 했음 하지만 무지하게 취향저격하는 치킨버거였슴/돼지처럼 보일까봐 하나만 시키는 내가 싫다… 세개씩 쌓아놓고 와구와구 먹고 싶은 맛…. /고소한 번과 매콤한 내쉬빌 치킨의 조합이란 ,,/치킨버거의 최고봉. 인증합니다./이태원 최고의 수제버거 맛집입니다/여기 대박!  지금껏 먹어본 치킨버거 중 최고! 제발 코울슬로 곁들여 드시길/치킨패티가 바싹하다못해 과자같은식감으로 햄버거먹는기분 안든다kfc이긴다더니 한참 떨어진다 르프리크 가는게 더이득/치킨버거를 그닥 좋아하지 않아서 그런가? 기대가 커서 그런가? 생각보다 무난했음 맛이 없는건 절대 아님! 그냥 너무 기대를 하면 실망할 수 있다!  특히 오래 기다리면 ㅠ"
