,name,address,sort,menu,mean_price,score,people_give_score,review_count,review_list
0,피자리움,서울 강남구 밤고개로23길 20 (우)06378,피자,"갈릭비프,페퍼로니,양송이피자,알리오올리오,까르보나라",9100,4.2,25,69,카카오맵에 영업시간 업데이트 좀 잘 해주세요 ㅠ/방송보고 갔는데 추운날 가게에 온기라곤 없고 포스 만지던 손으로 장갑도 안끼고 슬라이스 토마토를 피자위에 얹는거 보고 완전 짜증났어요. 시그니처 피자란 것도 술빵 위에 치즈 올려서 오븐에 살짝 돌린 맛. 생활에 달인  못믿겠어요./찾아갈정도는 아니고 그냥 평범합니다 솔직하게요/밑에 글 다받아여...꼬르륵꼬르륵.../Pizza/루꼴라렌치는 꼭 드셔보세요.. 이태원 있을 때부터 너무 좋아햤는데 이사갔길래 처음 동네구경도 하고 너무 맛있게 먹었어요 ㅠㅠ 오래오래 팔아주세요/가본 피자집중 최고/와 진짜짱임 내일도 가야지 와 최고임 와..../맛있어요! 파스타 양도 많은 편이고 피자에 쓰인 빵이 첨엔 몰랐는데 며칠 지나도 계속 생각나는~~/별 5점도 모자람. 비슷한 피자맛을 먹어본적이 없어요 쫀득폭신한 식감에 담백고소달달 혼자 다 합니다. 맛있게 잘 먹었습니다.  /파스타는 전문점 가격임에도 유화가 전혀 안 되어있고 튀겨진 듯한 면이 나와 경악했어요. 추천하지 않습니다. 피자는 평범해요./개인적으로 이태원 있었을때가 더 맛있었던것 같아요~/맛있어요☺️/파스타도 맛나욤 /넘 맛잇어여 사장님도 친절하시고 가격도 저렴하고 짱짱 루꼴라피자 짱/최고예요/루꼴라랜치는 오롯이 혼자 즐기고 싶은 맛. 가지피자도 추천. 파스타는 아쉽/어머니가 회사에서 직원이 사다줬다고 가져오셨는데 정말 맛있었어요. 집에서 가까웠다면 자주 갔을 텐데 아쉽네요. /여기 진짜 피자 인생 맛집인데.. 이태원에서 너무 멀리 이사가셔서 너무 슬퍼요 ㅜㅜ 서쪽에도 분점 내주세요/갈릭비프랑 쉬림프로제파스타 먹었어요 루꼴라를 좋아하지않아서 갈릭비프 시켰는데 무난한 맛이여서 다음에 가면 다른 메뉴로 먹어보고싶어요. 로제파스타는 맛있었어요♥/여기는 그냥 피자 맛집인지 알았는데....  헐...  파스타 정말 맛있어요.../이태원서 없어졌을때 개슬퍼했는데 얼마전에 그리워하며 초록창서 혹시나하고 검색했는데 최근 갔다오신 분의 후기글이 뙇!!! 총알 장전하고 달려옴 이집 피자 밑힌뤔임 소화도 잘되서 나이 드신 분들도 좋아라하심 개마시쓰뮤ㅜㅠㅜ/가정집 분위기도 좋고 피자맛도 정말 좋아요./율현동에서 가장 분위기 좋은 가게입니다.
1,목포명가,서울 강남구 밤고개로23길 22 지하1층 (우)06378,해산물,"겨울 대방어회!,10kg 이상 진짜 대방어만 사용합니다. 소/중/대,18,000",80000,3.8,17,34,"애매합니다 꼬막비빔밥은 정말 너무 매웠어요/최고의 맛과 가성비 보장^^*♡/맛도 최고 친절도 최고~!! 언제 와도 최곱니다 !!! ^^ /서빙하시는 설명 잘하시는 나이드신 분께서 마스크를 안하심  비말 방지 전혀 안되는 투명보호대로 사용하시면서 대화하는 것 참 불편했음/두 번 찾지는 않을듯 1. 들어 갔는데 인사도 안하고 자리 안내도 안함 단골이 들어오자 인사하고 난리남 2. 물회는 먹을만 했고 아구찜은 간이 안돼서 싱거웠음 3. 직원들 표정이 밝지 않음 특히 막내라고 불리우는 직원 4. 주차장은 있어서 괜찮으나 바닥이 흙이라 먼지가 상당히 많이 날림 5. 화장실이 남녀공용, 입구 바로 옆 분빔 6. 서비스로 나오는 전은...더보기/직원응대 4/5점 멍게비빔밥 2/5점 야채가 너무 많고 간이 짜요 특 물회 3/5점 비린맛이 강하고 새콤달콤한 맛이 약합니다. 초장을 더 넣어야 간이 맞아요/가성비 짱입니다,/캐주얼한 횟집./바닷가에서도 귀한편인 삭힌멍게를 야채에 듬뿍~깻잎에 김에 막회를 싸서 멍게와 야채를 얹어 먹는 쌈이 일품^^ 매생이국을 시키니 쭈꾸미 한마리가 통째로 ㅋㅋ/물회. 15 000₩ 좋습니다. 찬들이 좀 삭은 편. 특히 굴깍두기./굴국밥이 맛있었던 곳. "
2,플랩잭팬트리 수서점,서울 강남구 밤고개로27길 20 강남한신휴플러스8단지 상가 1층 102호 (우)06378,양식,"스프링샐러드,플랩잭샌드위치,오리지날버거,바베큐 폭립,플랩잭",13220,3.4,13,28,"직원분들도 친절하신것 같고 가게 내부도 깔끔합니다. 음식도 맛있고 나쁘진 않아요. 수서역 주변에 들릴일 있으시면 한번쯤 와 보실만 할듯해요!/가격대가 있지만 갈만해요  ★추가 피해자를 막기 위해 없어져야함 ★★내돈주곤 다시 안감 ★★★누가 사주면 감 맛/특징이 생각 안나는 무색무취 ★★★★재방문 의사 있음 ★★★★★맛/특징이 기억 나고 자신있게 추천 가능/가격은 싸고 양은 많은데 팬케이크 집이 팬케이크가 맛이 없음.. 음식이 반이상 남아도 남은거 포장도 안된다 하고, 직원은 다 알바인지 불친절. 화장실은 불도 제대로 안켜지고 곰팡이 슬어 있음.. 콘센트는 전기 쓸까봐 다 테이프라 막아 놓은건 덤../메뉴가 전체적으로 다 평타이상은 함/오늘의버거 잭플립브런치 굳/브런치 이만한 곳이 없어요. 양도 많고 가격도 괜춘하고/가격대가 좀 있지만 너무 맛있어요/조아요/브런치가 아주좋습니다 이근처에 이만한데가 없어요/판교점이 하도 유명하길레 가보고 싶었는데 가까운 곳에 생긴거 알고 가봄. 하지만 프랜차이즈에 기대가 한 내가 바보였음 그래도 커피는나쁘지 않았음 "
3,더374,서울 강남구 헌릉로571길 46-5 (우)06376,이탈리안,"데리야끼 치킨 샐러드,모짜 파스타,감베로니 파스타,봉골레,해물토마토 리조토",18840,4.5,17,12,"맛있다. 또 가야지. 사장님도 친절하심. 환기가 잘되면 좋겠다./후원하신다는 얘기 듣고 피자 사러 가려구요 /너무 좋아하는 곳이에요/맛있음 !!/전반적으로 괜찮은데 피자는 가격대비... 또띠아 쓰시더라구요 /양 많구 부모님 어르신들이 죠아하세여ㅎㅎ/남자 여자 갔을때 피자1 파스타1이면 배부르네영 잘먹었습니다/조오오금 비싸지만 맛있어요 ~ /사장님도 친절하시고 음식 맛도 세곡동의 숨은 맛집ㅋ지인들 데리고가면 모두들 만족하시더라구요~~/아. 여기는 다시와야 겟다 너무 배부르다 팁)콜키지 1만원/저는 여기 요 파스타 너무 맛있어서 가끔 방문해요 ~!  회사가 양재에 있어서 거리는 조금 있지만 기끔씩 가기 좋은거같아요 ^___^/1. 음식점 등록상 알콜음료 판매 안함. 단 가져가면 먹을 수 있고 콜키지 값 1만5천원... 판매 안하는거까지 뭐라 할 수는 없으나 안팔거면 콜키지 값을 저렴하게 받던가 싶음.  2. 1개 안티파스토, 3개 세콘도 주문하면서 안티파스토 먼저, 세콘도 한번에 달라고 주문했음에도 불구하고 안티파스토 먹는 도중 세콘도 음식 나옴. 한번에 준 것도 아니고 2개주...더보기/Delicious pasta dishes and glorious salads - friendly staff. BYO though, so bring a bottle as minor corkage charge."
4,은곡빵집,서울 강남구 헌릉로569길 37 (우)06376,"제과,베이커리","아메리카노(R),카페라떼(R),초코라떼,천연요거트스무디,오렌지에이드",4720,4.6,19,33,"배불러서 빵은 못먹고 청포도 에이드랑 아아만 주문했어요...ㅠㅠ 맛있는 빵냄새 덕분에 다음에 가게된다면 빵꼭 사올려구요ㅠㅠ 커피랑 에이드도 너무 맛있었습니당 /고기먹고와서 배부른상태에서 커피보다 빵을먼저먹었는데 방금 먹은 고기가 소화되는것처럼 너무부드러워요^^  아메리카노 라떼 대박 ㅎ/사장님인지 알바생인지 너무 불친절해요... 줄서서 계산하는데 먼저 온 사람 세워놓고 말도 안하시고 뒤에 분 계산하고... 지적했더니 사과도 한마디 안하세요/구매한 빵들 다 맛있어요. 특히 마늘바게트 에프에 구워먹으니 더 맛있네요. 호두 타르트랑 러스크  크림 어니언 베이글 다 맛있습니다 /존마탱.. 진짜 맛있음 동네에 이런 빵집이 있음은 축복입니다 히말라야 소금빵이랑 썬드라이 토마토 치아바타랑 캐러멜 마카롱 맛있어요 겨울엔 크리스마스 케이크 진짜 예뻐요/분위기도 좋고 커피도 좋고../It is a very cozy and cute little Cafe. I love their artificial turf patio area for my fur baby. Their Cafe Mocha is my favorite drink there and it is just perfect!! The crew and the owner seems very ...더보기/밤식빵 너무너무 맛있어여!!!! 앙버터도 대박임. 동네서람들 좋겟당 이렇게 맛있는 빵집이 있어서!!! 크로쿠무슈도 따뜻하게 데워줘서 맛있음~ 2층 분위기도 좋고요~ 재방문ㄱ ㄱ/너ㅓㅓㅓ무 죠음/여기 진짜 미쳤슴다,, 먹어본 마늘빵 중에 제일 맛있음ㅠㅠㅠ 이 주변 사는 사람들은 부럽다,, 은곡빵집 매일 갈 수 있어서,,/빵 맛있어서 자주갑니다. 올리브치아바타 너무 맛있어요. 근데 빵에 비해 커피가 좀.. 라떼시키면 우유가 끓여져서나옴/빵이 맛있습니다. 근데 이 동네는 분위기가 좋은데 주차장이 없네요. 단속만 하고/너무 비쌈/Good/아이스아메 테이블에 쏟았는데 친절히 다시 두잔 주셨어요.ㅠㅠ 감사합니다. 그리고 죄송해요.ㅠㅠ 직원들도 친절하고 사장님도 너무 친절. 직접 두잔 타주시고. 자주가는데 앞으로 더자주가야할듯/넘 감사합니다.  번창하세요. ^&^"
