,name,address,sort,menu,mean_price,score,people_give_score,review_count,review_list
0,청와옥 을지로3가 직영점,서울 중구 을지로 110 1층 1호 (우)04550,순대,"얼큰 순대국밥(공깃밥),청와옥 순대국밥(공깃밥),청와옥 순대국밥(가마솥밥),청와옥 편백정식(공깃밥),청와옥 편백정식(가마솥밥)",10200,3.4,130,520,"순대국 맛잇는 건 말하면 입 아프고 오징어볶음의 불맛이 끝장입니다./정말 맛있어요! 착한가격 착한 맛  최고!/점심 시간 좀 지난 1시 넘어 들어갔더니 웨이팅 없이 금방 먹을 수 있었어요. 저는 기름지고 달라붙는 국물을 좋아해서 그런지 아주 맛있게 먹었습니다. 고기도 부속도 많아서 더 좋았네요./맛있는데 웨이팅하면서 먹을 정도는 아님../24시라고 써놓고 23시면 문 닫아요 구라쟁이ㅜ/친절하구 너무맛있어요/토요일 저녁 웨이팅 1시간 반...ㅠ ㅠ  유명한곳이니 어쩔수없죠  순대국 맛은 깔끔하고 국물이 진한 스타일... 고기 잡내도 없고 반찬으로 나온 김치랑 무생채 완전 맛났음 보리차도 굿~  다만 너무 장사가 잘되다보니 정신없고 서빙하시는분의 수가 적어 테이블에 신경 못써주는점이 아쉬움  담에 좀 한가할때 다시가고싶음/진짜 최악입니다 30분대기해서 들어와서 주문하고도 30분을 기다렸는데 메뉴가 안나와서 물어보니 빌지가 꼬였다고 하고 좀더 기다리라고해서 받은 메뉴도 잘못나옴 여기 직원들이 죄송하다면 다인지 한번은 실수라쳐도 두번세번 계속 메뉴잘못갖다주는건 밥을 먹지말라는건지 정말 화가나네요 진짜 최악입니다/순대국이 생각보다 평범한 맛이에요./한번쯤 먹어봄직하다./일요일 11시30분기준 1시간20분 대기 후 입장 정식은 주문불가 순대국밥만 가능 오징어볶음 시키라고 추천함 맛은있지만 진짜 무지하게 달다 순댓국 맛은 있으나 기다려야할정도는 아닌듯ㅜㅜ/유명한만큼 맛있네요 :) 오징어볶음 꼭 드세요..!! ㅎㅎㅎ/오징어 볶음의 오징어는 야들야들 신선한데 파가 오징어보다 더 많은 파볶음 같음. 순대국밥은 고소하나 기름기가 많고 냄새가 약간 났음. 세팅은 깔끔한듯 보이지만 그리 위생적이다라는 느낌은 아님 /줄서서 먹는건 자유다. 30분 기다려서 우와!!!는 아니잔아 찾아와서 먹을 정도는 아니다 어느 곳이든 순대국밥집은 많다/음식점두 거품이 있는곳이 있는듯 합니다/평일 5시쯤가니까 그래도 웨이팅 없엇고 바로앉아서먹었고 반찬은 셀프바였고 깍두기 진짜 오지게 퍼서 먹었다. 국물도 맛은 있었는데 살짝 식으면 특유의 돼지고기기름이 너무 꾸덕해져서 별반개 뺐어요....이거는 호불호가 있겠지만 많이갈릴정도로 꾸덕해진다고 개인적으로 생각함.  그리고 예상보다 의외로 순대가 별로라서 또 반개뺐음. 고기는 존맛인데 왜 순대만ㅠㅠ/맛있어서 추워도 매번 30분 이상 대기도 감수하고 먹는데요 여기 화장실쪽 근처 좌석에선 매번 비위가 상하네요. 화장실 옆 룸처럼 된 곳에 앉았을 때는 뭔지 모를 비린내가 진동을 했는데 다음번 방문에 화장실 앞쪽에 앉았을 때는 마스크를 뚫고 들어올 정도의 방향제 냄새같은 게 났어요. 너무너무 심했는데 기다린게 아깝고 좋아하는 음식이라 먹었는데 결국 남겼습니다...더보기/그냥 공기밥 시켰는데 가장자리는 완전 말라서 딱딱했어요.. 청결도 안좋고 책상안에 휴지도 없고 여기가 맛집?/대기할만큼 맛잇진않앗어요/을지로3가 맛집 청와옥 다녀왔어요. 추운데도 대기줄이 엄청나네요. 그럼에도 불구하고, 오랜 기다림끝에 먹었습니다.  유재석의 '놀면 뭐하니' 나올만 하네요. 순대, 국밥, 반찬 모두 레전드네요.  #놀면뭐하니 #청와옥/맛은 있다. 주말 점심 대기가 너무 길다. 1시간 대기했다. 대기하는 동안 계속 밖에서 대기해야 한다. 한겨울이고 난로 따위 없다. 음식 양이 많고 맛이 있고 가격이 좋은 편이다. 다만 직원 불친절하다. 근처 약속이 있다면 갈 수도 있겠지만.. 굳이 찾아가지는 않을 듯하다./기본 시켰는데,  순대만으로 잘못 포장된 거는 물론, 김치 포장도 엉망이라 김치국물 범벅이 되고, 한참만에 통화되었는데, 미안하다는 말대신 전화번호랑 이름 얘기하라하고, 무채는 왜 상한건지? 처음에 라또 같은 실타래가 계속 집히길래 파인 줄 안았는데, 아래보니 콧물처럼 찐득찐득한 쉰내나는 상태..  . 며칠 전 매장에서 먹을 때와는 너무도 다른 상태!!  ...더보기/대기가 약간 있지만 맛있어요. /조미료 덩어리/2021.12.15 곽선생과 낫배드. 하지만 줄 서는 이유는 모르겠다./음식이 깔끔하고 맛있어요. 오징어볶음도 살이 통통하고 막걸리가 땡기는 곳입니다!!/맛나요/놀면뭐니하니에서 나온 순대국맛집! 순대국 먹고 근처 행2PM8PM 와인바 추천드려요! 와인도 저렴하고 공연도 함께 보기 좋은 2차술집~~ 생맥주무제한도있음/먹을만했음. 유명한곳 치고는 가격이 엄청 비싼느낌도아니고 양도 꽤 괜찮았음. /전체적으로 맛있는데 국물에서 약간 시큼한맛이 나네여/오후엔 사람 많다고 직원 많은데 아침엔 직원 한분 계신데도 사람 많아서 너무 불친절하고 편백찜 순대가 안삶아져서 아직 안된다 해놓구 5분 뒤에 온 사람은 해줌.. 그 뒷사람도 해주길래 메뉴 바꿔달라니까 안된다고 해서 직원수 늘리고 친절하게 해주셨음 좋겠다 생각했네요./잠실점보다 고기많고 친절하고 더맛있어요/육회 비빔밥 만들어먹었는데 엄청 맛있었고 순대국밥 대박적으로 국물 시원한데 일하시는 분들이 바쁘셔서 그런건지 실수인지 모르지만 불러도 대답소리만 메아리처럼 울리기만하고 나타나지는 않으시고 육회소스 추가해달라했는데 육회 다먹을때까지 안 가져다 주셔서 슬펐지만 넓은 마음으로 일하시는 분을 이해하기로 했습니다. 맛은 최고고 어르신 데려가기도 좋고 술마시기도 좋음"
1,원조만선호프 노가리체인본점,서울 중구 을지로13길 19 1층 (우)04543,"호프,요리주점","노가리.황태,오징어이빨,쥐포,반건조오징어,먹태,오뎅탕",7666,1.6,436,865,ㅠㅠ 그래도 잘되니 마음이아프네요./#만선불매 #상생하라/#만선호프불매운동/내는 지방시람인디  가게 보니까 개 추잡시럽다  드러워서 술 마실 수 있겠나? 10원 쓰기도 아까운 곳이다 그릇이 60~70년대꺼를 사용하고 있누 병 옮을까봐 무섭네  여러분 촌같이 생긴 곳 가지말아요 병 옮긴께 /소탐대실/뿡/점점 다들 아는얘기가 되고있네요. 큰욕심이 화를 부른다는걸 곧 뼈저리게 느끼게되실겁니다/요즘 누가 이런 노점상 같은 곳에서 먹나용용용?/욕심에 눈 먼 할배지 자기가 그 거리를 키운 것 마냥 착각은 자유/왜 그 거리가 흥했는지 생각해보세요/끝끝내 을지OB베어 강제집행 되게 만들었구나. 오비베어 자리에다가 화장실 3개 만들 자리를 내달라고 했는데 OB베어가 이를 거부했다는 개소리 작작해라. 꼴랑 2014년에 가게 시작한 주제에 지가 원조격인냥 80년대에 시작한 OB베어를 밀어내냐. 건물주라서 좋겠다? 다 니 맘대로 할 수 있어서 ------ 을지로가 니꺼냐? 노가리골목을 만선호프거리로 만들면 ...더보기/쓰레기 마인드로 운영되는 집./황금 거위의 배를 가르다니/가게 집안 대대로 깡패였냐? ㅉㅉ/만선 이라는  좋은  이름으로  왜  그러셨어요.../나 개돼지요 하는인간들 나 ♩♩♪♪집안에 못배운인간들  가는곳? 생각좀하고 다니자 ㅉㅉㅉ/절대 안가 할배 그딴식으로 살지마세요 벌받아요 에휴 말해봐야 뭐해 떳떳하다고 얼굴공개 한거보니 평생 그렇게 사실듯/인간쓰레기가 만든 주점/가성비 괜찮음 !/대화하지 않고 독점하려고만 하는 가게 소비하지 않는 것이 시민으로서 먹거리 골목과 상권을 올바르게 만들어가는 방법입니다. /그렇게 살지 마세요./이집 때문에 내가 좋아하던 을지로 노가리집들이 다 사라졌다. 탐욕이 도를 넘었다./탐욕스럽다 /돈벌었다고 쫓아낸건가..?/상도덕없는 천민자본주의의 끝판왕/대세에 들기위한 현대의 천박한 소비심과 과욕과 무양심이 합쳐진 곳/최악/1점도 아깝네요 /돈으로 환산할 수 없는 지역의 시간을 추악한 자본으로 밀어내려하지 마세요/선의의 경쟁을 모르시나
2,밀란,서울 중구 을지로14길 19 1층 (우)04550,피자,밀란피자,18000,4.3,6,11,맛있어요. 오일파스타 추천. 피자는 적당히 맛있. 인테리어 소품들이 맘에 들었어요./기본 피자랑 윙이 특히 맛있슴다 도우가 쫄깃쫄깃 화덕피잔데 나오는 속도도 넘 느리지 않은 것도 굿 파스타는 평타  내부가 좁아서 테이블이 몇개 없는 게 단점이라면 단점/맛있고 친절한데 음악이 진짜... 귀청 떨어지겠음 스피닝할 때 나올법한 클럽 리믹스곡들이 줄줄이 나오는데 너무 괴로웠음 노래 웬만한 다른 힙지로 식당들처럼 팝송 플레이리스트 정도로만 바꿔도 장사 더 잘될듯/힙한 분위기에 맛까지 힙하네요. 원래 도우 잘 안먹는데 이 집 도우는 되게 바삭하고 맛있네요 제가 먹은 피자중에 top3 안에 듭니다! /그래 을지로라면 이정도는 되야지 분위기 좋고 맛도 좋고 근데 을지로는 좀 불친절해야 되는데 직원이 너무 친절하네/힙한 분위기가 맛있는 음식 최고!
3,을지로마포쭈꾸미,서울 중구 을지로15길 9-1 (우)04544,"해물,생선","철판쭈삼(1인분),메밀전병,오뎅탕,감자전,김치전",10800,4.3,23,70,"1년전에 발견한 맛집. 쭈꾸미 맛있어서 감자전 안시키고 쭈꾸미만 1인분 더 시키고  여러번 와도 실패 안하는 몇 안되는 곳. 첨엔 비오는날에 와서 야외서 먹는거 본적이 없었는데 잘된거 같아서 좋습니다. 쭈꾸미와 깻잎 그리고 마요네즈의 조합 술이 안 넘어갈 수 없는 분위기까지  그래서 인가 보통 맛없으면 볶음밥은 다르겠지.. 하고 만회시도 하는데 마요네즈랑 ...더보기/철판쭈삼이 너무 맛있어서 주변에도 추천했음.  위생이나 친절이 아쉬움/손님한테 ""먹어도 돼요~"" ㅋㅋㅋㅋㅋㅋㅋㅋㅋㅋㅋㅋㅋㅋㅋㅋㅋㅋㅋㅋㅋㅋㅋㅋㅋㅋㅋㅋㅋㅋㅋㅋㅋㅋㅋㅋㅋㅋㅋㅋㅋㅋㅋㅋㅋㅋㅋㅋㅋㅋㅋㅋㅋㅋㅋㅋㅋㅋㅋㅋㅋㅋㅋㅋㅋ에라이 ㅋㅋㅋㅋㅋㅋㅋ/너무맛있고 친절하십니다. 위생은 그럭저럭/달에 두어번은 갔었습니다. 사장님이 평소에도 친절한 편은 아니었는데 선을 넘을랑 말랑 하다가 드디어 넘으심 하필이면 위생상의 문제도 발견하여 앞으로는 안 갈 듯.. 가격도 올랐고 이런 대접 받으면서 사먹기는 싫음..  맛은 있어서 2점으로 할게여/맵지만 맛있음 ㅎㅎ 마요네즈 찍어서 깻잎에 백김치에 싸먹으면 굳굳 근데 2022년 1월1일부터 쭈삼가격이 1인분에 12000원에서 15000원으로 오른다는데 한번에 너무 인상되는게 아닌가 싶음,,,/친구랑 낮술때리기 참 좋았던 곳 ㅎㅎ /우연히 찾아서 오게 됐는데 작은 곳이지만 맛있게 잘 먹었습니다 ^^  볶음밥 맛있어요!! ㅋㅋㅋ/쏘쏘/을지로 쭈삼 맛집!!/옆집 조선옥에 들릴까했는데 우연히 간판을 보고 들렸습니다. 쭈구미를 정말 맛나게 먹고 왔어요^^ 안 분위기는 별로인데 음식맛은 쵝오입니다 강추~~~~/마스크도 안쓰시고, 여쭤봐도 무표정으로 대답도 안하시고,, 그냥 다시는 가기 싫은 집이에요/여긴 그냥 미쳤어요 쭈꾸미도 미쳤고 전도 미쳤고 그냥 정말 미쳣음 그냥너무맛있어요/너무 맛있어요 쭈꾸미도 통통하구 양념도 너무 맛있어요!!/입구에서 여기가 맞나? 싶었는데 진심 존맛탱입니다 볶음밥을 시켜서 꼭 쌈싸드세요/쭈꾸미에 마요네즈 조합이라니 사장님 가방끈이 온 을지로를 쓸고 다니게 생겼읍니다... 존맛이요 ㅠㅠ 맛있는데 친절하시기까지 함 이런 집 을3에서 찾기란 쉽지 않을걸요!/왜이렇게 맛있죠 쭈꾸미 탱글탱글/별기대없이 들어갔다가 엄청 만족하고 나온 집. 쭈꾸미에 마요네즈가 합이좋다. 장어도 아주 긋긋긋 볶음밥도!/맛 최고 서비스 최고 쭈꾸미 먹고싶을때마다 여기 와야겠다 진심 !!/올해 최고의 쭈꾸미입니댜/장어고 맛있고 감자전도 진짜 맛있는데 사진이 없네요ㅠㅠ 감자전 강판에 직점 갈고 채도 썰어서 같이 주셔서 식감이며 맛이며 너무 맛있구 .. 매운거 진짜 좋아하는데 쭈꾸미 진짜 맛있어요ㅠㅠ 장어도 너무 맛있어여.. 최근에 수요미식회 나온대서 걱정했는데 너무 조금 나갔더라구여... 아쉽...."
4,다케오호르몬데판야끼,서울 중구 을지로12길 14 1층 (우)04550,일식,"토시살,부채살,갈비살,와규치맛살,믹스호르몬,마루초 (대창)",15166,2.9,80,418,"평점 0.0001  맛 - 잡내나고 와규맛은 찾을 수 없다. 가격 - 평균 인당 2만원 수준. 분위기 - 평균이나 바에 앉아서 먹으면 기름 엄청튄다.  총평 : 베어 그릴스도 쌍욕 박을 집 /아주 맛나용/마싯서용,,/가격, 양, 맛 무엇 하나 잡지 못한 집/사진 + 밥,국 2 = 40000원/양 진짜 적고.. 호일이 뭔가 비위생적이고 맛도 솔직히 별로... 재방문은 안할듯/사악한 가격대비 양이 모든 장점을 상쇄시킴. 특히 가장 잘나가는 메뉴인 호르몬 막창대창은 진짜 양 적음./다른 리뷰들 처럼 질기긴 한데 맛있고 직원들 착함 좀 뭔가 후다닥 만들어서 대충 만드는거 같긴한데 맛있어서 장땡/기대하고갔는데 좀아쉬웠어요 ㅠㅠ.. 살치살은 평가하기 어려울정도이고 믹스호르몬 시켰는데 소스는 괜찮은거같은데 곱창이 상태가 안좋았어요. 숙주도 조금더 간하는게 나을거같은데 데쳐서 나온느낌이었습니다. 친구들 데리고 갔는데 아쉽네요/거창하지 않게 소고기구이가 먹고싶을 때 가기 괜찮은 곳 고기는 좀 질긴 편. 같이 나오는 숙주구이 맛있음 치즈구이는 맛있지만 비주얼에 좀 더 신경써서 구웠다면 더 좋았을 듯 모듬채소구이는 후추맛만 너무 많이 나고 제대로 안 익어서 나옴 비추/믹스호르몬, 살치살 시켰는데 확실히 양이 적긴 적음. 살치살 보다는 믹스가 맛있음. /양이적음 ㅠㅠ 그래도 짱맛 밥이랑 잘어울림/맛있음. 근데 양이 너무 적었음,,, 속상했음,,,/한번가보면 꺼려지는곳.  고기양이 작고 비싼 값어치를 안하는… 뭔가 허접 그자체 … 급식소같은 분위기가 특히 별로였고 접시에는 기름이 번들해서 바꿨더니 그것도 번들번들../대창/1시50분에 갔는데 직원들 다 식사중이라고 앉아서 기다리라네요,, 20분 찾아서 와서 참고 앉았더니 수다떨면서 느긋하게 식사하더라구요. 그래서 빡쳐서 그냥 가보겠다고 일어났더니 네 가세요~ ㅋㅋㅋㅋㅋ 아니 식사할거면 브레이크타임을 걸어놓던가;; 지들 식사중이더라도 물은 줘야하는거 아니에요..?;;;/맛있는데 직원들 왤케 별로일까요 그리고 무슨ㅋㅋㅋ 메뉴 반이상이 주문안돼..? 점심에갔는데 메뉴주문 다안된대요 ㅠ  무표정과 행동에서 나오는 뭔가 기분나쁨  음식은 맛있었음 /매장이 사장님이 안 계셔서 여기서라도 질문하고 싶습니다. 음식을 판매하는 곳이니 음식 맛만 좋으면 되는건가요 ? 저희는 해당 지점을 방문하려고 굳이 길까지 찾아가며 찾아갔는데 들어갈 때 부터 음식 나올때까지 거의 모든 직원분들의 불친절한 태도에 너무 기분 상했습니다. TV에 방영이 되었다면 그만큼 더 프라이드를 갖고 근무해야하는것 아닌가요 ? 너무 불친절해...더보기/2호선 을지로3가역 10번과 11번 출구 사이 힙지로의 중심인 을지로12길에 있는 철판구이 집입니다. 힙지로답게 간판도 옛날 인쇄소 간판을 그대로 사용하고 있습니다. 간판은 디지털 마스타 新星미디어로 되어 있고 문패처럼 조그맣게 다케오라고 걸려 있습니다. 코로나 거리두기 지침에 따라 테이블 하나씩 건너서 사용하다 보니 좌석이 적어지서 일찍 가지 않으면 자리...더보기/인기가 많아서인지 직원들은 그닥 친절한 편 아니지만, 대창/막창 매뉴인 호르몬?이엇나 가 진짜 맛있었어용 소스가 b 솔직히 맛 때매 한번은 다시 갈 듯!/양파 들어있는 케이스 몇번 씻으세요? 위생 최악 알바생 여자 다 너무 기분나쁘게 이돈 내고 먹으면서 혼나야됨? 인상 팍쓰고 소리지르면서 말함 사람 밀치면서 다님 결제하는데 인상 팍쓰면서 나오라고 큰소리로 사람 무안줌 진짜 여기 온다는 사람들 도시락 싸고 따라다니면서 말리고싶네요 밀치지 말라고 말씀드리니까 아 ㅋㅋ 네;; 라며 끝까지 사람 기분나쁘게함 음식 ...더보기/사장님께서 직원교육을 안시키는건지 직원분이 되게 예민해요. 계산할때 ""앞쪽에서 계산해주세요""라는 말을 인상쓰면서 일행을 밀치고 굳이 지나갈 필요가 있었는지 궁금합니다. 카운터에 딱히 뭐 일할게 없었는데요. 계산은 남직원이 해주셨는데 여직원이 그걸 밀치고 인상쓰면서 얘기하실 필요가 있나요? 정말 불친절 합니다./요리하시는 분이 기름 계속 튀기셔서ㅡㅡ 기름에 살이 조금 데였는데.. 남자분 매니저가 진단서 끊어서 오라고 말하는 응대하는 태도가 진짜 불친절.. 그 표정을 잊을수가 없네요ㅋㅋㅋㅋ  친절하게 죄송하다고 고객 응대 하는게 당연한거 아닌가.. 진짜 기분만 더럽히고 집에 갔네요ㅋㅋㅋㅋㅋ/150g이라 양이 확실히 적네요 숙주 추가했는데도 둘이서 먹긴 아쉬웠음 부채살은 정말 맛있고 대창은 소스가 일품인데 살짝 질김 내부도 깔끔하지 않고 끈적끈적 고기가 벽에 베어있는 기분 그냥 한번~ 여기는 일본이다~ 이런 감성으로 맥주 한잔 하러 오기 적당한 곳이라 생각합니다 /진짜 개 덥습니다. 4,5만원 돈내고. 불한증막 체험입니다. 알바생들도 더운지 땀 흘리면서 서빙합니다. 너무 더워서 맛이 무슨맛인지도 기억이 안납니다. 최악!!/31도의 폭염에 실내는 27도였어요 강제로 찜질방 체험했구요 알바생 분들도 철판 앞에서 엄청 고생하시던데 사장님이 에어컨 조속히 고치셔야 할 듯 해요  너무너무 더웠어서 빨리 먹고 나올 수 밖에 없었네요 맛도 특색없고 가격대비 양 너무 적습니다/좀 추접하고.. 추접하다.. 더럽고.. 기름때 진득진득하고.. /별로에요. 양도 적고 특별한 맛x/별 하나도 아까움~ 계산할 때 확인 잘 하시길~ 주문안한 메뉴를 서비스인냥 올려주고 돈을 받고,  맥주는 주문한거 보다 더 체크하고~ 유카네가 만석이라 갔는데 일행이 언성 높아지려는거 겨우 말리고 나왔음~/양이 적어요. 사진이 만팔천원 짜리 믹스 메뉴 시킨 양. 배는 안고프고 간단하게 고기+술이 먹고 싶다 할 때나 적당할 거 같음. 처음 한 입 먹을 때가 최고로 맛있긴 함./별을 1점도 리뷰조차도 남겨주고싶지 않지만 혹시나 볼사람들 말리고싶어서 씀. 그냥 집에서 고기 구워드세요. 긴말 안함 먼길 찾아가지 마시고 그냥 푸드트럭에서 먹는게 더 맛있을듯...이거먹고 배채운 내가 너무 불쌍함 화날정도의 음식 수준/많이 시끄럽습니다. 무엇보다 밥과 국이 셀프./기름기가 많아서 식으면 먹기 힘들고 양 적고 가성비가 좋진 않음 밥과 국으로 배를 채워야하는 시스템 일본 텐진호르몬보다 양념 간이 쎄고 달다 맥주랑 먹음 꿀맛"
