,name,address,sort,menu,mean_price,score,people_give_score,review_count,review_list
0,네번째집,서울 용산구 이태원로26길 17 1층 (우)04391,술집,"짜장떡볶이,양파꽃떡볶이,꼬치어묵탕,육회유부초밥(4p),무침만두",13800,4.6,8,45,오랜만에 술이 술술 들어간날이았습니다! ㅎㅎ/떡볶이 좋아/말 안된다 여기.. 이태원 사는 놈들 부럽다 /곱도리탕 미쳤음/ㅈㅁㅌ구리/세번째 방문했구요 맛있어요ㅋㅋ 사장님도 친절하시고 신메뉴 시도하시는 것들도 시켜먹어봤는데 맛있었어요 음식도 음식인데 브금이 2000년대 한국노래 나오는데 죠음/2-3차로 시끌시끌 편한 술집 가고싶을때 딱인 곳 코로나 비켰으면~~~
1,트로이카,서울 용산구 이태원로 164-1 5층 (우)04391,양식,"삼사(3개),쑘가 포 쿠페체스키,자르코예 이즈 바라니느,보르쉬,쿠리느이 숲 스 랍셔이",15000,4.2,39,52,"очень хорошо/괜찮았어요~ 가성비는 걍 그럼. 서버가 다 러시아분들이라 메뉴시키는거 이외에는 잘 못알아들으심/친구들이랑 보드카 한병 시켜놓고 러시아 음식 먹으면 너무 재밌는 식당이에요 ㅎㅎ /비싸지만 이색적이었다/비싸서 자주는 못가도 현지의 맛을 느낄수 있는곳 러시아분이 서빙해 주시고 친절했어요./친절해요^^ 양고기도 맛있어요~/평이 좋아서 가보았는데 가격비싼거에 비해 너무 부실했어요. 사이다가 1L에 9천원인데 주둥이 큰 물병에 따라서 뚜껑도 없이 나오는데 찝찝한건 둘째치고 새것도 아닌 그냥 물병에 따라나오는 사이다를 1리터에 만원돈 주고...전반적으로 음식과 음료 가격책정이 좀 이상했어요./Все очень вкусно,  всем советуем,  Дизайн огонь, обслуживание класс ) отдельный респект персоналу, с нац. Одеждой )) /현지맛을 기대했는데 그건 아닌거같았음 직원분들이 되게 친절함 가격이 조금 비쌈/가격이 좀 쌔고 전체적으로 싱겁고 한국인 입맛에 안맞지만 메뉴판에 best라고 표기된 메뉴만 골라도 어지간해선 중간은 합니다  쿠리느이 숲 스 랍셔이- 꼬꼬면입니다(...)   카르토쉬카 포 뎨레벤스키-그냥 고기 잘게 썰은거랑 감자볶음+계란후라이 비추   셸료드카 폳 슈보이-맛은 있는데 청어 비린내가 은근히 심함, 예민하신분은 비추, 근데 맛있어서 한번 도...더보기/러시아 음식이 생소할 수는 있지만 직원분들 너무 착하시고 음식도 너무 맛있음다/한국인 입맛에 잘 맞춰져있는 느낌이지만 맛있다기보단 괜찮네 정도 색다른 음식이 먹고 싶을 때 한 번쯤은 가볼만한 곳/양고기 샤슬릭 비추. 맛은 그저그런데 가격에 비해 양이 너무 적음. 사진은 셀료드카 폳 슈보이. 이건 생각보다 괜찮았음/great atmosphere , amazing food, exceptional service !  Must place to visit to have a taste of RUSSIA!/직원분 친절하시구 음식 맛있어요 이색적인 곳 찾다가 오게됐는데 확실히 음식이 독특하고 개성있어요 추천받은 메뉴 먹었습니다 호불호 있을 수 있지만 저는 맛있게 먹었어요ㅎㅎ/신기한 맛집 양고기가 맛나요 러시아 인테리어에 러시아 전통옷을 입은 종업원들도 신기했어요. 한번쯤 가볼만합니다./주문한지 30분이 넘도록 메뉴가 안나와서 직원한테 여쭤봤는데, 그제서야 다시 메뉴 확인을 하더라구요. 결국 다시 여쭤본지 10분 정도 지나서 메뉴가 나왔는데, 죄송하다는 사과는 없고 누구한테 주문 받았는지 책임자 추궁만 하는 모습이 실망스러웠습니다. 저희보다 늦게 온 옆 테이블 메뉴가 먼저 나온 걸로 봐서 누가 봐도 주문이 안들어간 상황이었는데, 주문이 들...더보기/음식맛은  정말최고인데 양이 좀 적어요.... 러시아음식 맛보기로 방문하면 좋을듯 하고 배고플때 식사목적으로 오시면 안될듯~/돼지고기 꼬치 정말 맛있음! 양고기요리도 맛있는데 그 특유의 양고기 향이 저는 안 맞는 거 같음 ㅠㅠ 그래도 파, 양파 같이 구워져 나와 잡내없고 깔끔 가격이 다소 비싸서 3점. 음식은 맛있음/오랜만에 이태원에서 소개팅잡혀서 갔다왔네요~ 저보다 소개팅녀가 더 만족스러워해서 점수 제대로 땃어요~ 분위기도 좋고 플레이팅도 너무 맘에 드네요! 인스타사진 하나 건져갑니다^^/이태원 처음 갔는데 역에서 가깝고 찾기도 쉬웠어요! 사테? 라는거 먹어봤는데 가지 정말 싫어하는데 이거는 진짜...가지가 가지가 아닌줄 알았어요..... 존맛탱; 골룹쯔랑 홀로테츠... ㄱ맛있었어요 ㅋㅋㅋㅋ 소고기젤리랑 양배추소고기쌈? 이였는데 식감도 신기하고 맛도 있구 ㅎㅎㅎ굿굿! 소품도 아기자기하고 직원분들도 러시아식?으로 옷 입으셔서 그런지 되게 독특...더보기/인테리어도 완전 예쁜데 러시아 음식 정말 특이했어요! 위치는 이태원역에서 나와서 진짜 쉽게 찾아갈 수 있어서 완전 짱짱,  특이한 음식이 많아서  다른친구들이랑 다시한번 가보려구여!/멀리 가지 않아도 이태원에서 러시아 스타일 요리를 먹을 수 있는 곳 ~  분위기도 괜찮고 타바카에 맥주 한잔... 굿 ~/러시아 음식 참신한데 정말 맛있게 먹었어요! 생각보다 입맛에 잘 맞았습니다. 위치는 이태원이랑 가까워서 정말 좋아요!!/모처럼만에 러시아 음식! 돼지고기 샤슬릭과 고기빵  그리고 발티카 5번 맥주 :-) 세상 꿀맛 이구나!!/색다른 음식을 먹기에 좋은 곳. 양고기 샤슬릭은 미쳤음.. JMT. . 그 외엔 우리 한식과 비슷한 맛이라서 무난했다. 위치는 좋은 편. 가격은 조금 있지만 샤슬릭 덕분에 만족도가 높았음./양은 적었지만 맛은 내 입에 맞았다. 사먹는 음식 치고 간이 세지 않아서 좋았던 것 같다./이국적인 분위기의 러시아 음식점 맛있어서 10분만에 뚝딱ㅋㅋㅋㅋ 소고기양배추롤 엄지 척! ★★★★☆/러시아 음식점.  러시아 음식들이 고기위주에 보드카랑 같이 먹기 좋음.  '삼사'라는 빵이 있는데 이게 가끔 너무 생각난다 별거아닌데 ㅋㅋㅋ 맛 괜춘"
2,더베이커스테이블,서울 용산구 녹사평대로 244-1 1층 (우)04343,"제과,베이커리","치킨 프로블로네,햄 프로블로네,모짜렐라 페스토,실란트로 치킨,부랏부어스트",9100,3.0,133,344,"기대하고 웨이팅 30분넘게 했는데 슈니첼은 동네 돈까스집만도 못하고 토마토스프는 거품때문에 맛을 망치고…이 와중에 커스터머서비스라곤 1도 모르는 직원들에..이걸 적고있는 지금도 그릇깨고 손님 괜찮냐는 말은 물어보지도 않고…다시는 안올거같아요 :)/15팀이나 웨이팅할 사이즈도 안나오고, 이런걸 음식이라고 팔고 있다는게 너무 빡치네요. 음식갖고 장난하는 것도 아니고, 직원들까지 불친절, 글을 쓰고 있는 이와중에도 그릇까지 깨먹는..완정 대환장 파티네요 ㅋㅋㅋㅋ/요즘 빵집 괜찮은 곳이 넘 많아서 그닥 특별할 것 없는 거 맞고, 위생도 그냥저냥해 보이는 것도 맞음. 옛날에 갔을 땐 음식이 전체적으로 짜서 별로라 생각했는데 간만에 다시 갔더니 짜긴 짠디 맛있게 먹었다. /위생상태불량. 빵맛도 그저그럼./빵 계산 후 포장하는데 봉투 필요한지도 안 물어보고 빵만 턱 주더군요. 밑에 비닐봉지 묶음이 있길래 “아, 봉투에 셀프로 담는 건가요?” 했더니 “봉투는 유료인데요?” 이 말만 하셨어요. 다시 카드결제하기 죄송해서 그냥 들고 가려 했는데 힘들 것 같아서 다시 뒤돌아서 봉투 부탁했어요  “종이 봉투로 드릴까요?” . “네, 얼마예요?” . “종이 봉투는 무료...더보기/아침에가서 따땃하게 토마토수프/토마토수프 맛있네요 ㅎ 머쉬룸은 생각보다 버섯 향도 진하지 않고 그냥저냥,,/맛있는데.. 웨이팅 너무 심하고 불친절 해요 흑흑…. /겨울이라 좀 춥긴 했는데 테라스석 짱 좋아요,, 봄가을엔 무조건 테라스석 갈 듯,, 빵이 저렴한데 진짜 맛있어요! 식사 빵류가 많아서 좋았어요/토마토스프 너무 맛있어요!! 요상하게 해장되는 맛입니다 ㅋㅋㅋㅋ 뜨끈뜨끈해요 빵도 저렴/스프 맛나요 제 지독한 컨셉질에 도움이 되는 사진이 잘 나와서 참 좋아합니다 /shrinkflation poor customer service/독일식 빵이라니 흥미로웠습니다. 토마토 수프 참 맛있었어요/맛은 있었는데 청결상태가.../The food was so so. The bread is nice but for having brunch is a mess. There is no organisation and no costumer service.  /인생의 스프맛집을 꼽으라면 무조건 여기 너무 좋고 분위기도 좋고 빵도 존맛/옛날에 맛있었는데 변했네요 올해 1월에 먹은 슈니첼과 오늘 주문해서 받은 슈니첼 차이에요. 다 탄걸 17000원 내고 먹어야 하는지 의문이네요/초코 번?이었나랑 에끌레어 사먹었는데 일단 전자는 초콜릿 필링 들어간 줄 알았는데 그냥 반죽에 초코가루 조금 들어간 수준이고요… 에끌레어는 그냥 평범했습니다… 그냥 무난무난했어요/버섯스프 진짜 맛있구 빵도 쫀득하고 담백고소 ㅠ 독일 그리워지는 빵맛 나머지 브런치도 무난 근데... 너무... 너무정신없음.... 직원 수 늘려야 함.../언제나쵝오…하지만 웨이팅 항상 있습니다 특히 주말 브런치 타임 (8:00am-1:00pm)에 웨이팅이 많습니다 ㅜㅜ/빵만 먹어봐서 그런가 좋았음/예전에는 이런 브런치 식당이 적어서 희소성 있었는데 요즘은 워낙 많아져서,,, 스프만 먹을만 해요/독일 음식 그리워서 와봤는데 장난하나요ㅋㅋㅋ 예거 소스를 느타리롴ㅋㅋㅋㅋ 맛이라도 있으면 모르겠는데… 아예 요리할줄 모르시는 분이 하는거같아요. 한국인 기준으로도 간이 하나도 안돼있고 예거 소스가 아니라 느타리 볶음인데 양파때문에 달고, 싸구려 말린 파슬리때매 향은 거의 한약방이예요.   브뢰첸도 칼 대자마자 질감이 완전 다르더군요… 겉이 바삭하지 않은게…...더보기/어니언스프가 마싯다  샐러드랑 샌드위치는 너무 차갑거나 딱딱하고 그래도 빵은 마싯다/여기 왜 유명한지 알려주실분....? 한시간 기다렸는데 그럴 이유 있었나 너무 궁금한데.../독일 빵이 맛있어요 특히 슈톨렌하고 하드롤이 아주 괜찮습니다 식사는 그저그래요 /빵이 맛있어요. 좁고 바쁘고 그래서인지 다 안먹었는데 그릇 치우더라고요. 묻지도 않고~/맛을 떠나서 그냥  최악의 위생... 설거지 하는 퐁퐁 묻은 손으로 스프위에 올라가는 빵과자 같은거 올림....;;  그거 보고 깜짝 놀랐습니다 그리고 피클 물 손으로 짬....   장갑을 하나도 안끼고....  위생 최악 다시는 안감  ㅜ  차라리 모르고 먹어야지 ㅜ /너무너무 힐링됩니당/버섯 슾 짱짱짱/정신없는 매장과 직원분들. 배달까지 겹치면서 서비스 질이 떨어지고 아쉬웠음. 맛도 전체적으로 평범하고 재방문 할 의사는 없음./잘 먹었습니다. 꽤 오래 대기하기도 하고 워낙 맛집으로 소문난 곳이라 기대를 했지만... 스테이크 샌드위치는 고기가 생각보다 얇았고 특제 소스의 맛도 거의 나지 않았음. 무엇보다 빵이 점점 딱딱해져 썰기 힘들었고 나중엔 입천장까지 까질 정도로 먹기 힘들었음. 같이 시킨 슈니첼과 토마토스프는 맛있었던 거 보니 아마 샌드위치는 메뉴 선택을 정말 잘못한 듯싶다....더보기/이곳의 랜틸콩 스프, 피셔맨 샌드위치, 토마토 스프 좋아해서 자주 가요"
3,한우물,서울 용산구 이태원로16길 14-4 1층 (우)04391,한식,표기안함,표기안함,4.8,17,10,"리뷰 보고 긴가민가 했는데 솔직히 왜 낮은 평점 주시는지 질 모르겠네요. 부모님 생신기념 찾아갔는데 맛부터 서비스까지 굉장히 훌륭했습니다./그닥..  리뷰 다시 보면서 5점 준 사람 별점 리스트에 들어갔는데 이 식당에만 별점을 주시거나 같은 식당에 5점을 주고 계시네요... 기가 막힌 우연의 일치네요...^^  이속우화는 왜 다들 그리 언급하시는지ㅋ/눈호강 입호강 하고 왔어요. 음식 메뉴와 주류 메뉴 구성 모두 훌륭하고요, 이런 가격으로 높은 수준의 퀄리티 음식과 서비스를 접할 수 있다는게 너무 마음에 들었어요. 위치나 주차가 조금 아쉽지만 이태원 중심부인걸 어쩌겠어요 ㅠㅠ 재방문 의사 100%있고 이제 많은 사람들이 알게되어 붐빌 것 같은데 일단은 나만 알고픈 집 입니다! ㅎㅎ/메뉴 하나하나가 새롭고 맛있었어요. 이 가격에 이 정도 퀄리티라니 믿을 수 없네요. 재방문의사 100%!!/친구 청첩장 모임으로 다녀 왔는데, 정말 꿈에서나 맛볼수 있는 맛이였습니다. 분위기 너무 좋고! 맛도 최고 였습니다./분위기 완전 좋고 맛도 최고 룸에서 먹었는데, 사장님 설명도 친절하시고 한국에서 최초인 메뉴가 엄청 많네요!!! 데이트 하기도 좋고 부모님 모시고 오기도 좋을 것 같네요 ㅠㅠ 꼭 다시 올게요/맛도 맛이고 분위기도 분위기고 친절한 사장님까지 진짜 리뷰를 안 남길수가 없네요..!  특히 한우고기의 신선함이 살아있어서 좋았어요! 사장님이 설명까지 너무 잘해주셔서 이번엔 친구랑 갔는데 다음에 꼭 여자친구 데리고 한번 더 가겠슴다/가성비갑.분위기갑./색다른 요리와 맛 너무 좋았음. 이속우화도 최근에 다녀왔는데 거기보다 가성비 좋은 거 같음. 분위기 좋은 저녁 식사 원하면 한 번 가보는 거 추천/너무 허겁지겁 먹느라 사진을 많이 못찍었네요. 가성비 좋고 코스가 너무 좋아요. 마지막 디저트도 참신해요. 우리 아이도 맛있다고 또 오자고 조르네요 한남동에 이속우화 보다 구성도 괜찮았어요 조만간 또 방문할게요/정말 맛있게 잘먹었습니다 하나하나 다 맛있고 분위기도 좋고 가격까지 합리적! 다음에 또 방문할예정입니다./지인이 추천 해줘서 방문 했었는데 너무 만족스러운 식사시간이였어요 코스 짜임도 좋았고 소고기 퀄리티도 최고였어요 ㅠㅠ 디저트로 나온 들기름아이스크림이 진짜 독특한데 계속 생각나네용 ㅋㅋㅋ 특별한 기념일이나 맛있는 음식 먹으면서 분위기 내고 싶을때 한번씩 방문 하면 좋을 거 같아요 !!!/너무 맛있게 잘먹었습니다. 가성 좋은 한우 코스 요리였어요. 와인 셀렉션도 다양해서 좋았습니다. 다음달 청첩장 모임도 여기로 예약했습니다./이 가격에 먹어도 되나 싶을 정도로... 푸짐한 소고기 코스요리.. 재방문의사 (강하게)있음/합리적인 가격으로 한우 오마카세 즐길수있다는게 너무 좋네요. 분위기도 너무 좋고 와인도 저렴한가격부터 시작해 부담없이 즐기기 좋은거같아요 ㅎㅎ /지인들과 간만에 와인 엄청 마셨네요. 노래 부터 분위기 그리고 음식 맛까지 완벽했어요 자주 가려고 합니다/한우물 코스요리 먹고 배터질뻔 했어요ㅋㅋ 메뉴들도 전부다 존맛이고 ㅠ 인테리어분위기도 넘 힙해서 좋았어요! 데이트하게 되면 진짜 무조꿘 강추입니다...앞으로 예약이 힘들어 질듯 하지만 저는 재방문 의사 완전히 있어요!!"
4,키에리 이태원점,서울 용산구 이태원로26길 16-8 1층 (우)04391,디저트카페,"에스프레소,아메리카노,카페라떼,카페모카,트리플베리에이드",5480,1.9,201,82,"제 입맛에 딱 은 아니지만 그래도 괜찮았어요. 달지 않은맛 좋아하는 사람들한테 추천. 이것저것 제한이 많아 불편하긴 해요. 음식점마다 운영방침이 있어야 하는건 맞지만 너무 여기저기 이것저것 하지말라는게 많아 좀 불편한건 사실 이예요. /케이크가 꾸덕하고 처음 먹었을 때 맛있긴한데 크림이랑 치즈랑 되게 물림 세 명이서 오늘 케이크 ♪♩♬ 먹고 오자하면서 케이크 세 개 시켰는데 한 개를 다 못 먹었음 음료는 다섯입도 안 먹고 버린 듯 밤호박치즈케이크는 맛있었고 고구마 치즈케이크랑 녹차케이크는 시키지 마세요 자리도 은근 작고ㅎㅎ 떠드는거 눈치 안보려고 야외로 나갔는데 모기가 너무 많아서 힘들었...더보기/사실 케익 맛으로만 따지면 다이어트 할때나 좀 맛있게 느낄거같은 맛이지 이렇게까지 유명한 이유는 모르겠다고 몇년전부터 느껴왔었습니다.  이태원역 근처 카페 찾다가 몇년만에 왔어요  사실 시간제한, 조용히 떠들기 등등은 이곳의 시스템이라는걸 알았었고 크게 불편하지 않았습니다. 입장 전에 안내해주시는 사항이기도 하구요.. 그리고 불친절하다는 후기도 밑에 보니까...더보기/코코넛 에스프레소 치즈케이크랑 루바브 어쩌고 이 두개 맛있어요/1. 내부가 협소해서 테이블이 작고 다닥다닥 붙어있어요~ 2~3명끼리만 가야될듯! 그리고 웨이팅 있을 수 있어요~ 특이한 점은 입장전에 카페 내부에서 지켜야 할 것들을 설명해주시고 동의하면 입장할 수 있고, 동의 안하면 입장을 못 한다네요    2. 여기는 목소리가 작거나 조용히 얘기하고 싶은 분들이 가셔야될 것 같아요~   저희는 목소리가 커서 사장님?한...더보기/제가 방문했을 때 친절하셨고 케이크는 컨셉에 맞게 건강하지만 맛있었습니다. 악평이 많은데 개인적으로는 서비스와 맛 모두 만족스러웠어요/음... 초코 케이크를 주문했는데 눈감고 먹으면 초코인지도 모르겠고 단맛도 안나네요... 웰빙인지 뭔진 모르겠고 맛없어요 재방문 의사 없습니다./맛이 없어요ㅠㅠ  건강한 맛 좋아해서 일부러 찾아간건데 특히 밀가루 시트가 동네 아무 빵집만도 못한 느낌.....케이크 좋아하는데 먹다 남긴 케이크는 처음이에요....../악의적인 평이 많아 리뷰 길게 한번 남겨봅니다.       논란 다 알고도 요즘 저탄수/저당 디저트에 관심이 많아져서 방문해봄. 결론부터 말하자면 평점 1점대는 결코 아닌 곳. 사장님이 몇년 전에 인스타에 게시한 글에 대해서 아직도 악감정을 가지는 사람들이 많은 듯한데 당시에 결코 사장이 성숙한 행동을 했다고 할 수 없지만 그걸 몇년 째 우려먹으면서 별점 ...더보기/아메리카노랑 소이라떼 시키고 케이크 시켯는데 음료 진짜 너무 심함 보통 카페 음식점 가서 맛없다 느껴지는 정도가 입맛 차이로 넘길 수 있는 정도라 생각하며 살아왔는데 여긴 심해도 너무 심함 아메리카노 한입 먹자마자 얼굴 찌푸려짐 샷을 얼마나 아끼는건지 커피향 거의 안나고 소이라떼는 편의점 베지밀 두유보다 맛없음 그냥 음료에 원료를 안넣는 느낌임 근데도 가격...더보기/예전에 친구 소개로 갔을 땐 케이크도 담백하고 맛있고 야외테이블 자리에서 사진찍고 잘 놀다 갔는데.. 잘못한 게 있지만 한편으론 망하게 두기엔 아까운 카페./이거 하지마라 저거하지 마라 자리도 허락맡고 옮겨야되는 기이한 카페 입장하자마자 시간 적어놓고 테이블에 붙여두심 ㅋ스터디카페 식당에서 먹는 수준으로 조용히 말해야하며 자리도  굳이 지정된 자리에 앉으라고함 공산당을 경험해보고싶으신 분들은 방문 추천 신기한 경험을 해본 카페b/여기 아직도 가는사람있음?/네이버의 시대는 끝났다 역시 카카오평점이 최고야!/이가게 유지가 되는게신기하네 ㅋㅋ /꼴값도 적당히/알려진것에 비해 기대이하였던,,,sns에서는 되게 칭찬글 많이 봤는데 아이러니하게 주위에 먹어본 사람들 반응이 다 일관적더라구요,, /제일 안좋은/인기 많으면 뭐하나요 너무너무 불친절합니다 ^^ 다시는 안 가고 싶은 곳이에요 /1. 비싼데도 남은거 포장 안해줌  2. 비오고 추워죽겠는데도 밖에 서서 대기하라함 (빈자리 많았음) 3. 조용히 해야됨 4. 1시간20분 제한시간 (종이에 시간 적어두고 나가라함) 5. 책상,벽,가림막,화장실,입구 등등에 온갖 경고문 범벅/아 여기였구나~ ㅋㅋㅋㅋ 음 저기 컨셉대로 건강한것만 먹고싶으면 가시고, 아니라면 스벅케이크 걍 드세유./왜가냐?/다른집보다 덜달고 슴슴한맛, 꾸덕한 식감의 치즈케이크 한조각에 만원꼴로 맛은 괜찮지만 가성비가 떨어짐 매장이 협소해서 시간과 인원제한, 조용한 분위기를 지향한다는데... 매장이 협소한것 보단 테이블을 어떻게든 밀어넣어서 협소한듯. 코로나시대가 맞나? 싶을 정도의 테이블 간격/일단 들어갈 때 부터 종이를 나눠주고 이게 싫으면 지금 가도 좋다는 식으로 말해서 기분이 좋지 않았고요 친절한 듯 불친절해요 그래도 케익은 맛있어요 음료는 바닐라라떼시켰었는데 파우더는 젓지도 않고 주는지 밑에 가라 앉아있었네요/모든것이 엉망/스콘 맜있고 문앞에서 어래인지하는 직원분 열정적이라  ㅎㅎ  근데 밖에서 기다리는데 넘 추웠어요. 글고 맛있어 보이는건 포장 안되는거 좀 … ㅠ/노키즈존인거 모르고갔는데 저보고 붙잡으시더라구요? 몇살이냐고? 스물 네살입니다ㅎㅎ 내부는 또 왜이렇게 추운가요.. 조용히 해달라기에 눈치보면서 먹느라 체했습니다^^/상상초월 초인종을 누르고 직원이 나올 때까지 기다렸다가 입장해야하는 카페ㅋㅋㅋㅋ 안되는 것도 많고 사방에 이거 안된다 저거 금지 그것도 금지 안내판이 수십개가 붙어있어서 영 편하게 있기도 힘듦. 가격은 케이크 한 조각이 만원 안팎이고 예전엔 크고 맛이 꽤 진해서 한번씩 사먹을만 했는데 맛까지 변해버림. 크림치즈 맛도 거의 안 나고 고구마 흑임자 등등.. 주...더보기/고구마 케이크보다 뽕루바브커런트 케익이 더 맛있었어요 ! 고구마는 이름과 다르게 단맛이 거의 안느껴져서 조금 실망했습니다 ㅠ..ㅠ 다른 케익 종류도 꽤 많아서 다음에 다시 한 번 재방문 하고 싶어요. /케이크 존마탱 음료 노맛탱 케이크머그러 다시갈의향 300% /비싸긴 하지만 정말 맛있습니다. 보드라운 크림과 꾸덕한 치즈 베이크 케이크 짱짱.. 라벤더치즈케이크 너무 맛있어요! 얼그레이 같이 향긋한 케이크 좋아하실 분들은 좋아할 거에요-!  조용한 카페의 특성상 손님들에게 주의를 주기도 하고 시간 제한이 있긴 한데 다들 조용한 카페 안가보셔서 그럴지도 몰라요..! 종소리로 제지한다는 거 듣고 쫌 놀라긴 했지만 다른 ...더보기/불친절 수준이 아니라 무례한 응대에 놀라서 도망와버렸어요… 맛은 모르겠네요 못먹어봐서 ㅠ /쥰나맛없네여 ㅜㅜ 라벤더는 진짜 방향제맛이.. 케익에 방향제 쏟은맛나요 ㅠㅠ 왜라벤더를 음식에 잘안쓰는지 깨닫게 해준맛이랄까 비쥬얼만 좋네요 ..? /비싸고 가격대비 맛도 ,, 사람도많고"
