,name,address,sort,menu,mean_price,score,people_give_score,review_count,review_list
0,먹깨비해물아구찜,서울 동대문구 장한로 92 화성빌딩 105~107호 (우)02639,"해물,생선","꽃게탕,갈치조림,섞어찜,해물찜,아구찜,산낙지",47500,3.4,12,32,"신선하고 양많은데 그만큼 좀 비싼편이고  맛이 쏘쏘/먹깨비에서 처음으로 해물탕 배달했는데 엄청 만족했습니다. 양도 무지 많고 맛도 좋은데요./여기도 알바 댓글을 다는곳인가? 같은 날짜에 똑 같은 평가/간장게장 엄청 맛있는데 약간 비쌈 ㅋ/맛집인지 모르고 방문했는데 간장게장 맛있네요. /부모님모시고 방문했는데 친절하시고 맛나서 좋아하시네요 다음에 또 방문할게요~/잘먹고 나왔는데  댓글보니 불만족하신분들도 좀 보이네요 전 별 이상없이 잘먹었습니다!/너무 맛있게먹고갑니당~~/간장게장 짜지 않고 괜찮았어요!/해물이 잔뜩 나오긴 하지. 그 가격에 그 정도는 나오는게 당연한건데 가격대비 그냥 평범하다. 맛녀석이 왜 왔는지 모르겠다는 말에 한표. /마지막 볶음밥에, 우린분명 게범벅을 먹었는데, 생선 이빨과 미더덕이 나옴ㅋㅋㅋㅋㄱ 진짜 개더러움 누군가 먹다 남긴 양념을 합쳐서 밥 볶아줌 상상되니 지금 토하고 왔네요. 1점도 아까움, 밥  볶지마세요 다른 사람이 먹다버린 양념일수 있습니다./저희는 꽃게범벅에 볶음밥을 시켰는데 다른 사람이 먹다 남은 아구찜으로 밥 볶아줬네요 먹다가 발견한 아구 이빨에 속 다 버렸네요 "
1,일미간장게장 본점,서울 동대문구 장한로24길 7 (우)02637,"게,대게","한방간장 보리굴비 (1마리),간장게장 (중),꽃게양념무침 (중),해물양념찜 (범벅) (중),아구찜 (중)",59000,2.6,48,106,"개바빠서 개불친절. 포장인데 딱 게장만주고  김치하나안줌.  그렇다고 그 비싼 게장맛이 짜기만하고 막 진짜 기대한것처럼 맛나지도 않음. 다신안감 화사새끼는 왜 장안동에 살아서 짜기만한 여기게장을 그리 맛있게 먹었는지, 혀가 무감각한건지.. 알고보니 여기 화사가 먹었던데 아니고, 여기 옆 서산 간장게장이 화사가 먹었던데였다...  옆에 서산간장게장은 안짜고 ...더보기/가족들 다같이 외식하러 갔는데 너무 불친절해서 기분 상했습니다 양념게장은 젓갈맛이 너무 강해서  게장무침 같았어요 /후 진짜 맛있음........ 이렇게 전투적인 자세로 밥먹은건 오랜만이에요. 양념/간장게장 같이 먹고 싶어서 고민하다 세트로 시켰는데 신의 한 수~ 양념게장 안먹어봤음 후회할뻔. 짱맛 입짧은 2명이서 욕심내서 간장/양념/보리굴비 시켰는데 싹 다 먹고 나왔어요 ㅋㅋㅋㅋ귯!/겁나 맛있음 레알 밥도둑/11월14일 오후 1시-2시경 갔는데 진짜 불친절에 쯔양이 올린 양념게장이랑 달라요 간장게장은 맛있는 거 인정인데 한 마리에 25000원 정도의 값어치는 아닌 거 같고요 양념게장 진짜 최악입니다 ㅋㅋ 장사 잘되서 양념 대충 무쳐서 만드시는지 쯔양이 올린 건 꾸덕하고 양념 잘 베인 그런 게장이었는데 실제로 가서 시키면 물양념? 같은 게장입니다 반찬 개부실하고...더보기/테이블이 저희 테이블 하나가 다일 만큼 한가할때 갔고 메뉴 3개 시켰는데 1개를 더 추가해서 찍어놓고 계산 잘못됐는데 알고도 사과하지 않아요! 아 몰랑 하면 끝나는건가요?/반찬이 다사온거구 사장이 신경  이나  쓰는건지 완전 글구 된장찌게도 별로에요 /갔는데 정신없구 먼저왔는데 주문도 않받더니 나중에 온사람한데 물갔다주고 반찬갔다주고 주방홀 5명있는데 8팀을 해결 못하고 우왕좌왕 하는것 보니 어의없음/식탁이좁아 3인이  앉아도 불편한데 고객에대한 배려가 부족하다  밑반찬도 성의가없고. 여러가지로 만족감이없다/ 진짜 너무 맛있어서 행복했습니다. 일단 짜지 않아서 좋았고 비리지 않아서 좋았습니다. 제 1순위 게장집 ㅠㅠ 동생이랑 또 가야지/맛으로는 절대 깔 수 없는 집입니다. 같이 간 친구도 유명한 간장게장 맛집 가봤는데 여기가 최고래여 ㅋㅋㅋ 근데 리뷰에 나온 그대로 서빙 아주머니들이 불친절하세요. 양이 얼만큼 나오는지 물어봤더니 둘이서 중 자 시키면 되요  이러고 쌩 가버림ㅋㅌㅌ /1년에 (비싸서)좋은날 가는곳!! 그래도 맛은 최고/가격 너무 비싸고 가성비 대비 별로 . . . /가격대비 별로../진짜 맛있는 간장게장집. /자고로 간장게장은 반지르르하게 윤이나느 하이얀 쌀밥에 먹는건데 이 집은 눌러붙은 식어빠진 누룽지 밥이 나와 깜놀했네요 비싼건 용서되도 그 값어치를  못하면 배신감 느껴지는거죠  웬만하면 쌀 좀 좋은거 쓰시죠 /서비스 진짜 별로입니다. 주문도 안들어가고... 물어봤더니 계속 짜증에 들어갔다는둥 뻔뻔하게 행동하네요.. 결국엔 늦게온 다른 테이블 다 나오고 거의 40분 기다려서 나왔습니다. 맛은모르겠는데 서비스가 너무 별로여서 다신 안갈예정입니다./솔직이 넘 비싸요..... 옆집이랑 인연이 있어서 가격이 똑같은건지..? 돈 많이 버시는건 좋은데  폭리는 불편해요.. 차라리 근처에서 돌게장 대짜3만짜리가 푸짐해요... 악플 아니지만 죄송 합니다/서비스가 그냥 그렇지만 맛있다 /맛은 있으나 가격이 비싸서 만족도가 높지 않음.  고평가된 곳이라는 느낌/많이 비쌈 시끄러움 맛은 쏘쏘/대체이게왜 8만원이나하는지모르겠음 시장에서 만원짜리 간장게장 한두마리 사먹는거랑 맛이 다르지않음 어차피 간장게장은 모두 냉동이거늘 /우선 근접하기 대중교통으로 가려니 몇번을 갈아타야하고 차를 가져가면 복잡합니다 맛은 있어요 근데 비싸고요 가격을 좀 내리세요 제발 어쩌다 한번씩 가는데 갈수록 불친절이 나옴 결론은 마포로 가던데로 갈려고요 제발 가격과 친절도좀 부탁드려요 언젠가 훅 갑니다 제발ㅠ내가 넘 맛나서 지인들 될고갔는데 망신만  당함 별3개는 맛으로 찍었어요/맛있어요 근데 넘 비싸../점점 맛이 변해가네요. 오래단골인데 이제 그만갈듯..  밥도 떡밥하지마시고.. 좀 친절하시고.. 티가 안나는것 같아도 서서히 손님들도 다 느끼게됩니드/최악 종업원들 다 회장들인줄  4-5명이 한명 빼고 드럽게 불친절하고 불러도 고개짓으로 하고, 맛은 예전 그 맛 기대하지마시길 그냥 게에다가 간장뿌려서 주는 맛 맛이 따로 놈 손님들도 없네요  위생점검도 의심스러워서 해당 관할구청에 사전조사 요청해야할듯 들어갔을때 바닥양말에 온갓 밥풀들부터 주방식기들 다 닦이지도 않고.. 하..돈 겁나 아까움.. 동네 게장...더보기/간장게장 맛있어요. 단 가격은 부담되네요/최악이였음. 다신 가고싶지도않고 돈아까웠음. 뭔가 사장이바뀐건지 평 믿고 갔다가 헛탕. /●●●○/난 별로.. 먹고 속이 좀 안좋았음/아... 맛은 그렇다해도 서비스가 너무 아니네요 ㅜㅜ 포스기 고장났다고 30분 기다리게 하면서 아무 이야기 없이 전화기만 붙들고 있음... 다신 안갈것 같습니다"
2,선셋포인트,서울 동대문구 천호대로85길 28 2층 (우)02644,술집,표기안함,표기안함,5.0,3,7,분위기도 좋고 칵테일 맛있어요!
3,BK볏짚직화구이 장안동본점,"서울 동대문구 장한로26가길 29 어반슈필라움 1층 102, 103호 (우)02639","육류,고기","짚불우대갈비(250g),짚불삼겹살(170g),짚불뒷고기(350g),짚불왕돼지갈비(300g)",20500,2.1,17,53,"역시  방송나온집  믿고 걸러야함 볏짚은?  흉내만 가격은 높고  맛은 낮은   된장찌개는  맛있응/오늘 다녀왔습니다. 블로그에 속지마세요.  예전에 염창역인근 우대갈비 처음접하고 맛나던 기억에 찾아간 동네 볏짚우대갈비집.. 갈비에 양념도 안베이고, 가격은 타동네 1인분에 한대인데 여긴 3인분에 2대. 2인분은 큰거 작은거 2대. 양이적어 추가하려면 2인분부터... 없는 놈 삼겹살이나 추가해야지했더니 1인분에 헐 1.8만원...짚불향 또한 전혀 안나. 냉...더보기/가격대비 만족도가 너무 낮습니다.../블로그에 속음.. 작업냄시나길래 혹시나했으나 역시나.. 우대갈비가 이런맛이라면 몽탄도 기대가 안됨.... 반찬 된찌 맛나고 직원들 친절했으나 삼겹도 맛없음! 수입이었나 그가격에?  둘이 10만원돈 계산했는데 속쓰림. 사진은 그럴싸함 ㅎ/블로그에 속아 갔네요.. 여기서 처음 우대갈비를 접했다면 다신안먹었을거같아요 /비싸고 맛도 없어요ㅋㅋㅋㅋ 몽탄 가세요ㅋㅋ/더 늦게온 손님들까지도 음식이 나왔길래 얼마나 걸리냐고 물어보려고 벨 눌렀는데도 직원들이 보고 무시, 지나가길래 불러서 여쭤봤더니 어색하게 웃으며 답을 안하고 가시길래 다시 불렀더니 무시후 가심 , 다른직원 말로는 사장님이 하라는대로 했다길래 그냥 됐다하고 나가려는데도 아무도 한마디도 안하시고ㅋㅋ,, 사장님한테 말하니 다른변명만 하시면서 직원이 실수했다고만...더보기/블로그 작업을 너무 하시는거 같습니다 분명 몇일 전에 올라온 블로그인데도 우대갈비 가격이 아직도 2만5천원으로 올라온 블로그  글이 종종있네요 직접 가서 먹어보지도 않고 사진만 받아서 작성한 글인건가요...?/최악 시간이 가도 맛이없다. 이렇게 맛없기도 힘들다./너무... 느끼하다... ㅡㅡ; /대체로 불친절하고 주문도 까먹었는지 음식도 안나오구.냉면은 맛이없고,고기는 기름이 많음./맛있어요 저만알고싶은 맛집이에요!/가격이 너무 비쌈 직원들 불친절하고 주문을 까먹음/BK우대갈비 볏짚으로 초벌구이해서 덜 느끼하고 육즙이 살아있어요!! 직원들도 모두 친절하고 모임장소로는 최고에요!!/주차가능.가족모임. 육즙이  싸라있네~~/고기는 평범 된장찌개 맛있음 알바분들 친절"
4,장안정 본점,서울 동대문구 답십리로 291-3 1층 (우)02523,"돈까스,우동","정식,함박/돈까스/생선,11,000,11,000,10,000,10,000,8,000",13000,3.3,40,93,"답십리에 돈까스 맛집이래서 다녀와써 정식으로 시켜서 돈까스 받고 함박, 생선까스까지 머거써 비싸지만 역시 맛이 보장된곳이어써 수프도 장난아니야 수프맛집 ㅇㅈㅇㅈ 또 가고싶따/God.../양많음 밥 리필됨 친절하심 주차됨/맛은있지만 혼자가서 두개시켰는데 밥 한공기 덜 주는건 무슨경우... 다 못먹을꺼라고 생각하시는건가/맛있다/가격 생각하면 가성비 좋은건 아니고 한번쯤 먹어볼만~/돈가스 빨리 나오고 밥도 계속 리필 해주셔서 좋아요~/반값이면 생각해보겠지만.... 돈까스는 기름지고 스프만 맛남..../맛은 있지만, 가격에서 별 한 개 빼겠습니다. ^^;;/돈가스 빨리 나와서 넘 좋아요~ 밥도 계속 더 주시구요~~ 맛도 정말 좋아요~~ ^^/전에 있던 장소랑 음식이랑 분위기가 딱 맞았는데 새로 이사 온 곳은 음식이랑 분위기가 맞질 않아요.  맛은 그대로지만 매장이 작아져서 주차문제도 생기네요. 함박스테이크 맛있어요  함박스테이크 단품 보다  냉면세트+함박(또는 돈까스)가 천원 더 높은데 갓성비임! 단품만 시킬 시 철판에 올려와서 뜨듯하게 먹을 수 있지만 냉면까지 먹는 것이 여름에는 좋은 듯함/정식 만이천원이라는 가격에 조금 놀랐는데 먹어보니 양도 많았고 맛있었습니다. 깜짝놀랄 맛을 자랑하는 집은 아니었지만, 모든 음식들이 느끼하지도 자극적이지도 않고, 깔끔하고 담백해서 내공이 느껴지는 맛이라고 생각했습니다.  일반적인 경양식돈가스의 단점인 눅눅해진 튀김옷의 느끼한 기름맛을 이 집에서는 전혀 느낄 수 없었고 오히려 튀김옷이 굉장히 고소했습니다. ...더보기/주소 수정해야합니다 근처로 이사갔고 주차공간협소 해졌구요 하남돼지 옆에있으니 그렇게 검색해서 가세요 분위기는 옛날이더 좋은데 아쉽네요 돈까스가 젤 나아요 다른건 쏘쏘 냉면은 특히 쏘쏘/새로 생겨서 가보니까 알고보니 옮겨온 집이더라고요. 돈까스도 엄청 크고 맛있게 잘 먹었어요~ 근데 식전 스프가 너무 묽어서 밍밍할줄 알았는데 그건 또 아니더라고요.  물냉면세트(물냉+돈까스)도 먹어봤는데 제가 좋아하는 냉면맛이라 좋았어요! /돈까스가맛있네요 /어묵국 미지근, 수프도 전혀 따뜻하지 않았어요  양배추샐러드빼곤 할라피뇨, 마카로니 등등 다 말라있었고요. 깍두기는 쏘쏘.  무엇보다 돈가스가 먹고나면 많이 느끼합니다 그리 땡기는 맛도 아니고 배가 고픈상태였는데 먹고나니 더욱더 아니었어요  다른메뉴는 모르겠지만, 돈가스는 다른곳에서 드세요. 9천원 가격이 좀 과하네요.  6천원에 다음번에 먹을거냐고 묻는다...더보기/세상이나 이런불친절은 처음. 뒤에 아무도없는데 부부가 갔는데 두시간후에 오라니... 잘되나 보자. 마당에 남자!/양만큼은 푸짐한집/일하시는분들 친절하고 맛도 좋은데 양까지 엄청 많아요 정식1인분 혼자 먹기는 힘들고 여럿이 가면 하나는 비빔국수 같은거 시키고 나눠먹는거 추천합니다/굳이 찾아와서 먹어야할 곳인가 싶네요/맛,양,위생. 전반적으로 추천하고싶지는 않네요. 차라리 설렁탕보다는 돈까스 먹어볼걸.../지저분하고..스프는뭉치고..국물은짜고 잘따지지않는사림인데.. 가지마세요/동네식당이지만...깔끔하진 않지만 맛있어요. 주차 되지만 사람이 많아서..넓다는 생각 안듬..ㅋㅋ/모듬정식은 여러가지 구색은 좋지만 대체적으로 짠맛이 강해서 계속 갈증이 심한 것이 흠 양이 많은 만큼 남은 음식은 챙겨갈 수 있음 어르신을 모시고 간다면 모듬정식보다는 두사람 대상으로 단품을 시키면 될 듯/백종원의 3대천왕/함박스테이크 돈까스 둘다 굿~ 느끼함이 덜해서 좋다^^ 양도 푸짐!!^^"
