,name,address,sort,menu,mean_price,score,people_give_score,review_count,review_list
0,신락원,서울 동대문구 전농로20길 2 (우)02506,중화요리,"양장피,오향장육,해파리냉채,삼풍냉채,유니자장면",25000,3.8,38,29,"짜장면: 별로 탕수육: 좋음  재방문의사: 굳이?/유명하다고 해서 갔는데 대기가 있었고 직원이 밖에서 기다리면 부른다 했는데, 알고보니 저희보다 늦게 온 사람이 막 들어가서 식사하더라구요 번호표도 없고 체계가 없더라구요. 그리고 음식에 머리락이 나왔습니다. 진짜 그때는 이맛이 뚝떨어지더라구요. 젊은 직원분은 미안하다는 말씀을 하시는데 나이많은 분은 계산하면서도 무표정으로 머리카락있는 짬뽕 빼고 대체된 짬뽕...더보기/전농동 유명한 중국집 오늘은 흑후추안심과 식사 메뉴를 머금 후식으로 주는 푸딩도 이집만의 특별함 또머꼬싶따/가격대가 조오금 비싸나 탕수육 맛있음 삼선짬뽕 특이하니까 드셔보세요/탕수육이 넘나 맛있는 곳이에요! 전 찍먹파이지만 이곳은 볶아서 나와서 인지 소스 묻혀나와도 넘나 맛있습니다. 식어도 바삭바삭한 탕수육!!! 겨울에 별미인 굴짬뽕!  정식 A코스 또한 가성비 최고입니다!/이집은 탕수육이 최고네요 소스에 버무려 나오는데도 바삭바삭~~ 볶음밥은 돼지고기 볶음밥인데 좀 느끼하구요 짬뽕은 저는 맵찔이라 단백하니 좋았는데 매콤한거 좋아하시는 분은 호불호 갈릴듯 합니다. 손님이 많아 웨이팅은 해야하고 주변주차는 불가합니다. /전농동에서 먹을 수 있는 최고의 탕수육/유니짜장이 맛있었고 가성비도 좋음...하지만 신락면이 너무 별루였다. 사천탕수육은 무난... 유니짜장 먹기위해 재방문 의사 있음/불친절 끝판왕 3살 아이였는데 어린이용 의자 달라고 하니 짜증난 표정으로 무성의하게 던지듯 갖다 주고 메뉴 주문시 틱틱거리며  어디든 식당가면 어린이용 수저나 포크 주는데 이집은 성인용 젓가락을 귀찮은듯 갖다줌 손님 많다고 거만해 진듯. /튀김요리가 훌륭해요/지인 소개로 종종 오는데... 오늘 손님이 많아서 인지 몰라도..  유니짜장의 임팩트 맛은 사라지고 면은 불고 맛은 면에 안배고 싱겁.. 대충 썰은 양파와 춘장 볶아둔 짜장에 간 고기 만 따로 볶은 느낌...  그냥 동네 짜장면 집 시키는 맛?  바쁠때 안오는게 낳으려나... 그만 오는게 나으려나...  맛집이라는게 참 유지하는게 쉽지 않다지만.. 이럴때마...더보기/근방에 드문 중식 맛집/맛은 그렇다치고  너무불친절함/* 전농동 동대문구  탕수육(중), 신락면, 삼선짬뽕 33,000원 결제했어요. 탕수육 소스는 달달하고 튀김옷은 쫀쫀. 속에 고기는 두툼하니 맛있어요! 달달하고 쫀쫀하면서 부드러운 부먹 탕수육 좋아하신다면 강력추천!  신락면은 해삼, 버섯, 죽순, 새우, 오징어가 들어있고 짬뽕국물 비주얼에 국물은 좀 적고 전분으로 걸죽한? 여튼 저는 좋았습니다. 새우가 탱...더보기/짬뽕 국물맛이 좀 특이하긴 한데, 카운터에 있는 덩치 큰  어쩌면 머리가 좀 모자란듯한 남자의 퉁명스럽고 뻣뻣한 자세가 기분 나쁘게 만들어 분위기를 망친다. 이 중국 남자만 없다면 모든게 무난하단 생각./후식으로 주는 두유 단호박 푸딩 넘 맛있어요. 이 푸딩은 정말 별다섯개/최애 중국집/맛과 청결, 정통의 분위기/면류는 건강한 맛 같이 맛없었음 칠리새우는 바다의 짠맛이 고여있음. 양념이 짜다는 게 아니라 새우에서 바닷물 맛이 남 이거는 새우 손질 잘하면 맛있을거라고 생각됨  이 곳 메인요리는 탕수육임 바삭한 게 맛있음 소스는 유자청을 사다가 그냥 부은 거 같은 맛임 소스가 좀 덜했다면 물리진 않았을 거임  친절함은 없다고 보는게 맞음 가격은 비싸지만 퀄이 생각보다 ...더보기/짜장은 보통, 탕수육은 듣던대로 훌륭합니다. 튀김옷이 얇고 바삭한게 참 독특했어요. 속에든 고기가 싱싱했습니다. 탕수육의 가격에 비해서 양은 모자란 느낌이지만 만족스럽게 먹었습니다./저렴하고 맛도 보통/칭찬리뷰글들, 평점 절대절대 믿지 마세요! 탕슉맛 깔끔하다는분 화납니다~!!!!!!  뭔입맛이 초딩인감? 맛탕비슷~첫맛만 쫌 특이~?하다가 먹을수록 찐득끈적달큰 물엿을 뿌먹하는 기분~윽~;;;;;;느끼찐덕달큰~;;초딩이 좋아할맛 임.특히 고기양 너무 적음!! 인색하십니다 고기좀 쪼메 더 쓰시징~~;;;; 유니짜장 맛있단분? 진심아니죠? 평균이하맛~울동네 옛...더보기/쥔장분이  중국분   맛은 좋은데 다른 중국집보다 쬐금 가격이 쎕니다/주말이라 혼밥말고 여러명이 맛봐야하는 메뉴를 먹고자 인터넷인지 망플에선지 봤던 사진속의 탕수육 색깔이 범상치 않았었던 신락원과 그 주변의 영화원이란 중식집 두군데중 어디를 갈까하다, 좀 더 실패확률이 낮아보이는 뭔가 가게이름이 영화제목같은 신락원으로 향함. 오전만해도 빗방울이 내려서 비위가 약해진 상태여서 이런때는 가게분위기가 지저분하다던지, 탕수육에서 잡...더보기/깔끔한맛이네요, 탕수육 튀김이 특이하네요 아주 바삭한데 부드럽습니다^^ /국물이 괜찮다. 후식으로 푸딩 나오는데 그것도 맛있다. 재방문 의향 있음./전농동에 와서 짱께집 어디 갈지 모르겠다면, 닥치고 신락원!/볶음밥 맛있게 잘 먹었습니다~"
1,은하곱창,서울 동대문구 전농로15길 22 (우)02546,"곱창,막창","돼지곱창전골 (소),돼지곱창전골 (중),돼지곱창전골 (대),국수,볶음밥",19200,3.7,76,328,"하단에 잡내얘기 많던데 ㅎㅎ 뭐 못맡으신분들은 그럴수있죠ㅎㅎ 잡내장난아니던데.. 난 못먹겠음./가성비 하나가 모든걸 말해준다 곱창 양 미쳤고요 다만 돼지냄새에 예민한분들은 절대 가지말것.. 갠적으론 둔감해서 그저 사랑뿐 미나리무한 당면무한이라 더 굳/사실 잡내같은 걸 잘 못 맡아서 그런지 저한테는 맛있어서 자주 가는 편입니다,  오래된 외관(?) 치고 깔끔해서 자주 가는데 저번에 한 번 먹을 때는 머리카락이 3가닥이나 나왔어요.... 한 번 나왔을 땐 '에이 뭐~' 했는데 먹다보니 또 나오고 그래서 말씀드렸더니 너무너무 죄송하다면서 새로 드릴까요 술을 드릴까요 해서 저희는 그냥 술값 제해주시는 걸로 했...더보기/단맛/감칠맛이 부족한 맛 곱창 많고 쑥갓이랑 당면 리필 돼서 가성비 넘쳐요 소주 한 잔 하기에 좋은 곳/가성비 있게 밥먹고 술먹고 할 수 있는 곳 당면 채소가 무한리필 가능하고 곱창 많음 돼지냄새가 조금 나지만 겨자 찍어먹으면 괜춘 웨이팅까지 하면서 먹을 맛은 아님/매일 줄서있어서 한번 가봤는데 왜 손님이 많은지 모르겠다 국물에 감칠맛도 전혀없고 맛있는거 모르겠는데 어 뭐지 왜 이런맛......./맛 자체는 평범(별 세 개) + 양이 엄청 많고 당면 사리 무한 리필 가능이라 좋음! 소주 안주로 굿 (평일 4시 전에 갔더니 소주 한 병 서비스로 주심)/가성비, 맛 다 좋은 곳 진짜 최고… 택배보다 가서 먹는게 훨씬 맛있어요/말해뭐해.. 조만간 또 먹으러 가려구요 굿/곱창전골에 볶음밥 먹고 후식은 Iga마트 생크림빵 먹어줘야 왠성/은하계 전설. 위생은 조금 아쉬워요./오래전부터 지인들이 추천해서 가볼까 가볼까 하다가 처음으로 가봤는데 정말 소문대로 맛집이네요-! 곱창이 큰데도 부드럽고 누린내 없이 맛나고요 당면이 정말 신의 한 수-! 너무 잘 어울려요-! 무엇보다도 쑥갓, 깻잎 등 채소가 무한리필이라 느끼함 없이 깔끔하게 곱창을 먹을 수 있어 너무 좋았습니다-! 마지막 볶음밥까지 다 맛있어요-! 포장까지 되니 참 좋네요...더보기/저녁 약속을 하고 찾아갔는데 재료가 소진이라 손님을 받을 수 업다고 해서 발길을 돌렸습니다. 문제는 택배차량이 은하곱창만 한가득 싣고 있더군요.  가게로 찾아가 운치를 느끼며 즐거운 저녁시간을 보내려 간 손님들을 배려한다면, 택배물량을 일정수량으로 제한하고 가게물량을 확보하는 것이 장사하는 사람의 도리라는 생각이 듭니다. 너무 편하게 장사한다는 생각과 함께...더보기/쑥갓 리필 무젹건,, /가끔 먹으면 맛있어서 좋아했는데 가격을 너무 자주 올리고 카카오맵에 가격이 4월에 수정된건데 안맞네요. 지금은 소 사이즈가 2만5천원인데 여기는 2만3천원으로 되어있어요. 교통도 너무 불편하고 다른 곱창 집 찾아봐야겠어요. /그럭저럭~~ 평범/포장했는데 양도 푸짐하고 맛있어요^ㅡ^/예전 기억에 맛있었던 기억이 있어서 다시 갔는데 돼지 누릿내라고 해야하나 완전 많이나고 당면도 쩐내남 여친한테 진짜 맛있다고 데려갔는데 집오면서 미안하다고 계속 사죄함/존맛.... 유명해지기 전부터 먹었어요 ㅎ/곱창전골 중 최고/최고 .../믿고먹는 은하곱창 존맛~~/쑥갓이랑 당면 리필은 좋음 하지만 특별히 엄청 맛있는 집은 아니라고 생각함 그냥 평범한 돼지곱창전골/쑥갓 무한리필이 아주 굿/아직 돼지곱창전골은 익숙하지 않음./친절하시고 맛있어요. 오동통한 당면...또생각나네요/맛 자체는 일반적인 곱창전골 맛.  처음엔 살짝 밍밍하지만 끓일수록 맛이 깊어진다.  청결하고 깨끗한 분위기는 아님.   미나리랑 당면이 무한리필이라 좋음.  깊은 감칠맛같은건 없지만 여럿이서 싸고 푸짐하게 맛집분위기내며 먹기 좋아요.   엄청 맛있는건 아닌데 가끔 생각나서  일년에 두세번정도 주기적으로 가요. 또 갈거에요. /한번가고 반해서  친구데리고 또갔는데 냄새나서 못먹었어요 문열자마자 돼지똥냄새같은게 나서 뭐지 했지만 맛은 괜찮을줄 알았는데 음식에서도 냄새나서 결국 못먹었습니다...이 날만 냄새가 난거같은데 전 앞으로도 못갈것 같습니다ㅠㅠ 다시는 이런일 없었으면 해요 아쉬워서 후기남깁니다 평소엔 정말 맛있는곳이에요 /맛있는데 누린내가 좀 났음ㅠㅠ/여기서 먹고 전골의 맛을 안거같음 ㅋㅋ/자꾸 생각남 ㅜㅜ 청량리에 살면 최소 일주일에 한번 갔을듯/나쁘지 않아요. 곱창전골이지만 자극적이지 않은 맛? 굳이 찾아가서 먹거나 줄 서서 먹을 곳은 아닌 것 같아요. 근데 곱이 매우 많아요-!/가는길에 리뷰보고 엄~~청 걱정하고.. 빠꾸해서 돌아갈까싶었는데 만족했습니다 !!!!!!!존맛~~~~~ 싱겁다그래서 장을 더 넣어먹을생각으로 시킨건데 아녔음 간 적당했어요 저한텐!!  양도 괜찮았구 당면리필되는거 좋구 볶음밥 맛없대서 시킬까말까고민하다가 시켰는데 괜찮았어요.. 괜한걱정이었음 ㅠㅠ 생각나서 오늘 또 갈 것. "
2,서울뼈구이매운족발,서울 동대문구 왕산로 274-1 (우)02554,"족발,보쌈","뼈구이 (1인분),안매운맛/중간맛/매운맛,11,000,미니족발,안매운맛/매운맛,3,000,4,000",14250,3.2,36,208,"여기 투수 있음 반찬이며 뭐며 스로잉함 /준수한 맛, 보통 맛 기준 신라면보다 살짝 맵다. 배가 살짝 아프다 재방문의사: 32퍼/아래에 있는 평가처럼 아줌마 한분이 너무 불친절함 불친절 정도가 아니고 무례함/굿/별로/참말루 맛있네요 주기적으로 생각나는 맛입니다/동네 주민이라 꾸준히 가는 곳 호불호 갈리지만 난 좋다/나쁘진 않은데 유명세 때문에 웨이팅 하기엔 애매한 곳. 대단히 감동적인 맛은 아니고.. 그냥 매콤달콤한 양념 바른 부드러운 고기라고 생각하면 됩니다. 가격 대비 양 푸짐해요./맛: 학교다니면서 자주갔는데 갈때마다 행복사할뻔함. 등갈비 부드럽고 양념 맵고 달짝지근하게 감기는게 고기 감칠맛이랑 제대로 어우러짐.. 고기만 먹는것보다 밥이랑 먹는게 훨 맛있어서 주먹밥 두그릇은 뚝딱. 소주랑도 잘어울림 서비스: 기억안남 인테리어: 좁고 허름함 그래도 단체로 앉을자린 있어요 기타: 비닐장갑끼고 살을발라야해서 정갈하게 먹긴 힘듦. 썸녀랑은 ...더보기/나름 괜찮고 가끔 생각나는데 특별히 엄청 맛있다거나 그렇진 않아요/왜 이게 맛있다는지 개인입맛에는 고기잡내가 많이나고 부드럽지않고 퍽퍽하고 가격도 뼈해장국은 우거지들어가는데 7 .8천원하는데 이건 왜9천인지 방송을 믿지 말아야 하는데..주방에서 한 아줌마는 나오더니 쌀포대위에 방댕이 깔고 않아있고 아무리 종이포장을했어도 손님에게 나갈 음식 을 그딴 취급하는데 주방위생은 생각도하기싫다 두번은.../매운거 땡길때 굿굿 맛있오요~~~2명이서 2인분에 주먹밥 시키면 딱좋아요 아주매운맛과 매운맛의 갭이 있음 아주매운맛은 진짜 맵고 바로 아래단계 매운맛은 그닥 안매움/배달하고 포장해서 먹어서 그런지 적혀잇는 평들보고 깜짝놀람 엄청 친절하셨는디... 아주매운맛은 너무 매워서 매운맛보다 좀더 맵게 해달라고 해서 먹으면 아쥬 죽임 야들야들 쏙쏙 빼지는 고기랑 연골 존맛탱/여기만의 맛이 있음 그냥 그정도 가끔 가까우면 생각날 때 먹을 정도 일부러 찾아 올 정도는 아님/호기심에 가볼만한곳 방송이 입맛 다 버려놓는다/너어어어어무 짜서 입이 얼얼할 정도 뭐가 맛있다고 하는지 모르겠어요ㅜㅠㅠ/진짜 불친절에 끝판왕^^ 음식이며 음료, 밑반찬까지 한손으로 툭툭 던지고 손님을 툭툭 치질 않나 밥먹으면서 기분 다 잡침 /홀 보시는 아줌마 진짜 ♪♩♪♪ 없음 반찬부터 음식, 음료 모든걸 툭툭 던지고 아주머니 하고 불렀는데 고개만 위로 까딱하는게 듣고 있으니 알아서 지껴보라는 건가 의문이 듦 맛있어서 종종 오던 집이었는데 오늘 이후로 청량리 근처도 안올듯 아직도 화가 나네/회전율이 빠른이유가 있음/2020년 5월 방문. 1인분 다 8,000원으로 올랐습니다. 2인분 주문하면 사진처럼 6덩이 나옵니다. 계란찜 서비스고요. 등갈비구이가 아주 살살 녹게 부드럽습니다. 날치알주먹밥 시켜서 고기소스에 찍어먹으면 다존맛입니다. 강력추천합니다. 평일 저녁에 일찍 갔는데 순식간에 자리가 다 차더군요./ /특이하고 맛있슴 짭짤하니~/낮에 가서 웨이팅 없이 먹었네요. 기본맛도 매콤하네요. 전 좀 짰는데 남편은 양념 싹싹 긁어먹었네요./ㅠㅠ 방송나오기 전부터 자주먹던 집인데, 대기줄생기고 한동안 못먹다가 포장해왔더니 양은 줄고 천원은 오르고 맛은 조금 변하고 속상하네요/주인인지 뭔지 홀에 아줌마 진짜 인성 쩌네요 옆테이블에서 중간맛으로 시키길래 메뉴판에는 안보여서  맵기 조절 되냐고 조심스럽게 물어봤는데 갑자기 오만 인상 짜증을 내네. 그거 물어본게 그렇게 정색팔색할 일이요? 아니 내가 무슨 돈 받고 얻어처먹으러 간것도 아니고. 성격 장애 오셨나. 돈 좀 버니 배가 처부르셨나 진짜 올해들어 제일 어이없네./맛있으나 위생에 의문을 제기하게됨/가격착해 맛있어 더이상 바랄게 없음  ...아! 가끔 매장이 더움/더운데 웨이팅하다 들어갔더니 할머니가 더워죽겠는데 에어컨 꺼버려서 짜증났어요/매운맛 못먹어서 순한맛 먹었는데 맛있었어여!!"
3,적정고요,"서울 동대문구 답십리로23길 70-11 1층, 지하층 (우)02551",카페,"아메리카노,카페라떼,사과소보로,바스크 치즈 케이크,옥수수 치즈 소보로,묵직 쿠키",5266,5.0,4,6,나만알고싶은 동네카페 ㅠ  테이블마다 생화를꽂아놔서 좋았어요 /좋아요!/좋아요! 디저트 커피 다 맛있고 지하공간 쾌적하고 아늑해욭!/디저트 맛있어용
4,독,서울 동대문구 왕산로 278-1 (우)02554,"육류,고기","조폭불고기 (200g),18K도시락,김치냉국수,치즈닭알찜,날치알닭알찜",3300,3.1,18,52,"알수없는 스모키향의 고긔,, 먹음서 몸이 안좋아지는 것 같다,, 앤드 질김,,/신랑이랑 연애때부터 다니던 곳 오랜만에 방문했는데 맛도 가격도 그대로 좋네요. 친절함은 모르겠으나 가성비 좋아서 종종 찾습니다. 간만에 맛있게 잘 먹었어요./짜고 달고 맛있음 김이랑 먹는 것도 특이하고 소스 맛있다/너무 조미료맛 강해유../마약소스라고 주는데 그냥 조미료 아닌가?/저렴하지만 직원도 적고 테이블에 벨도 없어서 불편ㅠ/그냥그럼 분위기 내스탈아님 불친절한건모르겠음/저도 가격도 싸고 고기맛도 너무 좋고. 반신반의하면서 갔는데 추천이요!/여기가면 호9 옛날도시락 시켰더니 밥알 상태보니 몇일 냉동보관한거 오지게 티나고 서비스 개같아 이름이 왜 독인가했더니 말그대로 독이네 먹으니까 뒤지겠다 그냥 편의점에서 이만원어치 쇼핑하는게 여기서 먹는거에 비하면 최고급 호텔요리다/싸고 괜찮아요/진짜 불친절해요... 가격이랑 맛은 그럭저럭 괜찮은데 기분만 상해서 나왔네요. 예전 사장님은 친절하셨었는데, 바뀐 사장님은 컨셉이라고 하기엔 너무 불친절함/맛있는지모르겠음/독특한 분위기가 있는 집/고기 저렴하고 맛있다. 도시락도! 집에서 가까워서 자주 가고싶은 집/싸고 맛있고 친절하고/been"
