,name,address,sort,menu,mean_price,score,people_give_score,review_count,review_list
0,스케줄 청담,서울 강남구 선릉로152길 37 지하1층 (우)06016,양식,스케줄 김치 볶음밥,19000,3.3,123,553,"김볶밥 좋아요/피자랑 와인먹기 좋아요 콜키지도 됩니다/물잔에서 음식 냄새나서 비위상했어요,,한번 씻고 식기세척기 넣으면 이런일 없을텐데,, 그리고 물잔에 밥풀 붙어있던데요 디저트 접시도 깨진거 세팅해주시고,, /넘 친절하시고 분위기도 좋아요 특히나 트러플향이 살짝나는 라구파스타가 괜찮았어요/분위기 좋은듯하고 맛은 쏘쏘 가격 깡패..ㄷㄷ/지나칠 때마다 가좌야지 했는데 남친 생일 맞이해서 기회가 되었어요 풍선 서비스 감사했습니다/맛있어서 자주 갔는데 생일파티 룸 예약이 3시간 제한인게 좀 그랬습니다. 여전히 김볶은 맛있어요!/테라스가 좋아서 도란도란 놀기 좋습니다/데이트할때 딱인거 같아요! 음식들도 잘 먹었어요..!/느끼한거 안좋아하는 오빠도 잘먹었어요~^^ 저도 다욧 중인데도 안남기고 왔어요~/활기찬 느낌이 가득찬 레스토랑입니다;;/김볶밥이맛있다는추천으로다녀왔지만,최악의서비스를받고나왔습니다. 메뉴2개시켰는데하나가먼저나왔길래 매니저로 추측되는 검정옷 입은 남자분께 나머지는언제나오냐고여쭤봤습니다. 답변은주문이밀려서좀더걸릴것같다. 듣는순간직원의 말투에서 아 주문 누락됐구나 추측할수있었습다. 하지만 그 이후로도 20분이 넘어도 안나오길래 다시 언제나오냐고 흰색셔츠입은 좀더 낮은 직급으로 추측...더보기/밥먹는데 그릇치워드릴까요 두번물어보심. 밥먹는데 계속 주변 돌아다니셔서 빨리 나가라는건가? 하는 느낌들어서 불편. 밥 먹고있는 와중에 피클 뒤늦게 갖다주어서 식사흐름 망치고 에피타이저 메뉴로 있는 스프를 시켰는데 메인 요리랑 같이 나옴. 가격대비 음식 엄청 맛있는 수준 아니고 접객은 가격생각하면 황당한 수준/음식은  그냥 저냥 서비스  최악~ 자차로 주차장 입구 인줄알고 입구에들어가려하자  여기가  동네 주차장인줄아야며 라고 비아냥대더니  발렛주차 해줌. 음식 먹고 음료시켰는데 20분이넘게  안나와서 주문확인해달라  했더니 아무도  오지않음.  직접 확인하러 가니 직원끼리 모여서 노닥댐, 음료주문취소하고 계산할때  항의하니  바빠서  확인못햇다고함, 직원들 노...더보기/사장님이 사업마인드 투철하신듯  직원들 서비스태도만을 우선순위로 보신듯 너무 친절해요 ㅜ 어느지점이든 /활기찬 느낌이 가득찬 레스토랑입니다;;/김볶밥이맛있다는추천으로다녀왔지만,최악의서비스를받고나왔습니다. 메뉴2개시켰는데하나가먼저나왔길래 매니저로 추측되는 검정옷 입은 남자분께 나머지는언제나오냐고여쭤봤습니다. 답변은주문이밀려서좀더걸릴것같다. 듣는순간직원의 말투에서 아 주문 누락됐구나 추측할수있었습다. 하지만 그 이후로도 20분이 넘어도 안나오길래 다시 언제나오냐고 흰색셔츠입은 좀더 낮은 직급으로 추측...더보기/밥먹는데 그릇치워드릴까요 두번물어보심. 밥먹는데 계속 주변 돌아다니셔서 빨리 나가라는건가? 하는 느낌들어서 불편. 밥 먹고있는 와중에 피클 뒤늦게 갖다주어서 식사흐름 망치고 에피타이저 메뉴로 있는 스프를 시켰는데 메인 요리랑 같이 나옴. 가격대비 음식 엄청 맛있는 수준 아니고 접객은 가격생각하면 황당한 수준/음식은  그냥 저냥 서비스  최악~ 자차로 주차장 입구 인줄알고 입구에들어가려하자  여기가  동네 주차장인줄아야며 라고 비아냥대더니  발렛주차 해줌. 음식 먹고 음료시켰는데 20분이넘게  안나와서 주문확인해달라  했더니 아무도  오지않음.  직접 확인하러 가니 직원끼리 모여서 노닥댐, 음료주문취소하고 계산할때  항의하니  바빠서  확인못햇다고함, 직원들 노...더보기/사장님이 사업마인드 투철하신듯  직원들 서비스태도만을 우선순위로 보신듯 너무 친절해요 ㅜ 어느지점이든 /활기찬 느낌이 가득찬 레스토랑입니다;;/김볶밥이맛있다는추천으로다녀왔지만,최악의서비스를받고나왔습니다. 메뉴2개시켰는데하나가먼저나왔길래 매니저로 추측되는 검정옷 입은 남자분께 나머지는언제나오냐고여쭤봤습니다. 답변은주문이밀려서좀더걸릴것같다. 듣는순간직원의 말투에서 아 주문 누락됐구나 추측할수있었습다. 하지만 그 이후로도 20분이 넘어도 안나오길래 다시 언제나오냐고 흰색셔츠입은 좀더 낮은 직급으로 추측...더보기/밥먹는데 그릇치워드릴까요 두번물어보심. 밥먹는데 계속 주변 돌아다니셔서 빨리 나가라는건가? 하는 느낌들어서 불편. 밥 먹고있는 와중에 피클 뒤늦게 갖다주어서 식사흐름 망치고 에피타이저 메뉴로 있는 스프를 시켰는데 메인 요리랑 같이 나옴. 가격대비 음식 엄청 맛있는 수준 아니고 접객은 가격생각하면 황당한 수준/음식은  그냥 저냥 서비스  최악~ 자차로 주차장 입구 인줄알고 입구에들어가려하자  여기가  동네 주차장인줄아야며 라고 비아냥대더니  발렛주차 해줌. 음식 먹고 음료시켰는데 20분이넘게  안나와서 주문확인해달라  했더니 아무도  오지않음.  직접 확인하러 가니 직원끼리 모여서 노닥댐, 음료주문취소하고 계산할때  항의하니  바빠서  확인못햇다고함, 직원들 노...더보기/사장님이 사업마인드 투철하신듯  직원들 서비스태도만을 우선순위로 보신듯 너무 친절해요 ㅜ 어느지점이든 /활기찬 느낌이 가득찬 레스토랑입니다;;/김볶밥이맛있다는추천으로다녀왔지만,최악의서비스를받고나왔습니다. 메뉴2개시켰는데하나가먼저나왔길래 매니저로 추측되는 검정옷 입은 남자분께 나머지는언제나오냐고여쭤봤습니다. 답변은주문이밀려서좀더걸릴것같다. 듣는순간직원의 말투에서 아 주문 누락됐구나 추측할수있었습다. 하지만 그 이후로도 20분이 넘어도 안나오길래 다시 언제나오냐고 흰색셔츠입은 좀더 낮은 직급으로 추측...더보기/밥먹는데 그릇치워드릴까요 두번물어보심. 밥먹는데 계속 주변 돌아다니셔서 빨리 나가라는건가? 하는 느낌들어서 불편. 밥 먹고있는 와중에 피클 뒤늦게 갖다주어서 식사흐름 망치고 에피타이저 메뉴로 있는 스프를 시켰는데 메인 요리랑 같이 나옴. 가격대비 음식 엄청 맛있는 수준 아니고 접객은 가격생각하면 황당한 수준/음식은  그냥 저냥 서비스  최악~ 자차로 주차장 입구 인줄알고 입구에들어가려하자  여기가  동네 주차장인줄아야며 라고 비아냥대더니  발렛주차 해줌. 음식 먹고 음료시켰는데 20분이넘게  안나와서 주문확인해달라  했더니 아무도  오지않음.  직접 확인하러 가니 직원끼리 모여서 노닥댐, 음료주문취소하고 계산할때  항의하니  바빠서  확인못햇다고함, 직원들 노...더보기/사장님이 사업마인드 투철하신듯  직원들 서비스태도만을 우선순위로 보신듯 너무 친절해요 ㅜ 어느지점이든 "
1,울프강스테이크하우스,서울 강남구 선릉로152길 21 영인빌딩 1층 (우)06016,양식,"머쉬룸 스프,울프강 샐러드,포터하우스 스테이크 (100g),프라임 뉴욕 채끝등심 스테이크 (100g),그릴 연어 스테이크 with 아스파라거스,독일식 포테이토",25516,3.6,116,538,"지난 연말에 가족 식사하러 갔다가 너무 잘 먹었고 아기가 너무 잘 먹어서 이번 어린이날 기념으로 또 데리고 갔어요. 근데..음… 몇 달 사이에 서비스도 별로 음식도 별로.. 왜 이렇게 된걸까요..??   음식 사진을 못찍은게 아쉬운데.. 스테이크 굽기 정도를 medium well로 시켰는데 중간 부분은 완전 rare..  문제를 말씀 드리고 싶었으나 이미 ...더보기/예전이랑 많이 달라졌지만 그래도 아직은 누가 사준다고 하면 달려 갈 만한 곳 근데 가격값은 진짜 못하는듯 가격 또 올린거 실화냐고요../지금은 서비스가 많이 안좋아졌나봐요 어쩌다 몇년전에 다녀온거 생각나서 적어봐요 스테이크 먹다가 하이볼이 너무 먹고싶어 찾아보니 메뉴에는 없더라고요 혹시나 가능한가 요청하니까 없는 메뉴도 만들어 가져다 주셨어요 너무 감사했고 감동이었어요 이제 그런 분위기가 아니라니 너무 아쉽네요../지방이 덜녹아서 이에 낀당... 힘줄도 질기고/내 돈주고 사먹겠냐면 놉! 가장 큰 감동은 첫 안심 한입과 첫 등심 한입 그치만 이 두입에 17을 태우기엔..  특별한날에나 한번쯤..?   그나저나 익힘 정도는 지금봐도 이해가안가네/서비스도 좋고 맛도 있었어요 고기 간이 좀 센 편이라 제 입맛엔 맞았는데 짜다고 느낄 수도 있을 것 같아요 와인도 넘 맛있었고 옆 테이블이 시끄러웠는데 먼저 오셔서 자리변경도 도와주시고 너무 좋았습니다~ /맛도 모르겠고 서비스는 더더욱 별로네요  남자친구 생일이어서 기대하고 갔는데 주문부터 안내도 별로 없었습니다 이돈주고 여기서 먹을바엔 동네 아웃백이나 스테이크 집이 나을것같습니다 그나마 별 두개준건 디저트가 제일 맛있어서~  직원 교육 제대로 시키시길 바랍니다/티본스테이크 최고 그러나 매장이 생각보다 번잡함 한번쯤은 가볼만함/스테이크는 최고인거같아요 가격대는 높지만 먹어보면 이해되는 가격 /서비스 똥임/음식은 맛있으나 직원 서비스교육 필요/돈값 못하는 곳/아니 뭐 이런 ♬♪~♪ ㅏ 가 ㅈ ㅣ 없는 곳이 다 있죠?  손님을 기본적인 사람 대우도 안하고 불청객 취급을 하네 드러워서 안가요/티본에서 안심스테이크가 진짜 맛있어요! 나머진 평범했습니다. 접객은 무난했습니다~/압구정에 있는 지점 런치코스 갔었고 다신 가고싶지않음. 음식 맛은 둘째고 직원 서빙 태도 불친절. 굽기조차 제대로 전달못해 다시 주방에 들어갔다온 내 스테이크는  숯댕이. 이 가격에 맛있고 친절한데 넘침 그냥 이름 있는데 한국지점 이라니까 다들 호들갑에 사진 찍으러 가나 봄. 조카 데리고 간거 아니었음 나올때 컴플 걸었을거임. 옷까지 사입은 조카 기분좋게 ...더보기/업그레이드해서 하우스로 먹었는데 ...그냥 그래요...집에서 한우사서 구워먹는게 나을정도로 고기가 맛있진 않아요 왜 유명한지 이해안가는 곳/여기 스테이크 좀 질긴편...하지만 소는 옳다  김치 맛집이랫는데 굉장히 짬 /맛있어요. 기념일 레터링도 해주셔서 기념일에 기분 좋게 다녀왔어요/맛있게 잘 먹었습니다. 캐주얼한 느낌, 약간의 소란. 서버 분들은 모두 친절하셨음. /약간 올드해 보일 수 있는 인테리어와 분위기 였지만… W코스에서 제공되는 드라이에이징 스테이크를 한 입 한 순간, 맛있다! 라는 말이 절로 나옵니다!!ㅎㅎㅎ 특별한 날 가기 너무 좋은것 같아요/고기 맛있어요            /한번은 가볼만한 곳입니다./친절함이라고는 1도 없음/스테이크 고기 맛있어요 레드카펫이 인상적이에요~^^/포터하우스 스테이크는 정말 맛잇음+ 친절함  그러나 가격 대비 분위기 앰비언스 너무 별로임... 시끄럽고 자리 간격 너무 좁고 분위기가 약간 시장통 느낌 /맛있어요, 특별함은 없었습니다. /맛있었습니다만 역시 원조가 맛있는 것 같아요! 물론 한국에서도 먹을 수 있어서 좋지만 ^^ 잘 먹었습니다~~/생각보다 특별하진 않지만, 고기가 맛있었습니다/유명세에 비해 그닥 테이블 간격 너무 좁고 시끄러움 오버 조금 보태서 시장통같음 베이컨은 별로였는데 토마호크는 최고였음 디저트로 티라미수도 굿/맛있던데 친절하고 코스에 메뉴 가짓수가 많진 않은데 메뉴 하나하나 퀄리티가 좋은듯. 근데 룸 이용시 최소 70은 써야 함/자주가고싶다 돈만 많다면...ㅋㅋ/창렬의 아이콘, 호구의 메카/가격이 문제로다"
2,몽중헌 청담점,서울 강남구 도산대로 445 엠빌딩 지하1층 (우)06015,중화요리,"삼선자장면,하교,구채교,마라소롱포,백채교",10040,3.8,42,143,"소룡포 굿/딤섬 최고 하교 구채교/맛은 있는데, 서빙하는 여자알바생들 너무 불친절했고, 코스 주문했는데 음식이 거의 20분 간격으로 나옴.....ㄷㄷ/존맛탱이에요/음식은 그냥 저냥임  북경오리 맛도 그냥.. 짬뽕도 그냥.. /– Dimsum/쬰맛/고오급식당 이것땨문에 축의금 따블이다 ㅠ/어르신들 대접하러 갔는데 최악.  미로 같은 구조에 방 번호도 없고, 화장실 가는 표시도 없어 불편. 홀에는 종업원 많은데 방 쪽엔 종업원 한두명 밖에 없고 부르면 너무 늦게 옴./맛있어요./코스요리 맛있어요. 발렛주차도되요./최악중에 최악.  손님이 거의 없는데 자기들끼리 아이패드 들고 다니면서 한 3분 가량을 세워놈. 자기들 시스템에 손님이 맞혀야 된다는 압묵적 강요!?  그렇게 서 있는데도 천천히 걸으면서 앉을 자리 살핌. 예약을 하고 갔는데도.  모기가 11월인데도 둥둥 떠다님.  몇마리인지 모르겠음. ㅎㅎ 음식이라도 잘 나오면 그러려니 하고 갈려고 했는데  안에 면을 위...더보기/여기는 음식 만들기 전에 위생-방재 관리부터 해야함. 주말에 아기 데리고 가족 식사 갔는데,  테이블 밑에 모기들이 어찌나 물어뜯는지 정말 환장하는줄 알았음. 우리 테이블 만의 문제가 아님. 나 혼자 한 네 방 뜯기고나서 카운터(?)에 이야기하고 있는데, 다른 테이블에서도 아기가 모기물리고 있다며 이야기하러 옴. 가게 이야기는 손님들 나가고 난 담에 소독하...더보기/+송이우육탕면, 상하이소룡포, 하교, 구채교, 소매, 초율해선권, 유린기, 난자완스 전반적으로 다 맛있음. 우육탕면하고 상하이 소룡포, 하교가 베스트픽./새오롱빠오/몽중헌 세 지점을 가본 결과, 페럼타워점>청담점>방이점 순으로 낫다. 가장 최근에 간 청담점은 미슐랭에도 이름을 올렸는데 맛은 그냥 보통..별 특색 없음. /딤섬은 여기만한곳이 없다며. 예약필수!"
3,새벽집 청담점,서울 강남구 도산대로101길 6 (우)06013,"육류,고기","꽃등심 (150g),양념갈비 (260g),불고기 (200g),샤브샤브 (160g),육회 (200g)",51600,3.2,106,147,
4,정식당,서울 강남구 선릉로158길 11 (우)06014,퓨전한식,표기안함,표기안함,4.3,132,362,"아뮤즈부쉬가 제일 임팩트있고 뒤로 갈수록 그 이상의 따봉을 드릴 기회는 없었지만 그래도 전반적으로 아주 좋았습니다.  상대적으로는 성게비빔밥이 좀 애매했습니다. 성게 좋아하는 편인데도.../간이 좀 쎈 편이고.. 한 번 방문한 걸로 충분한,, 그냥 그렇읍니다!/으음~/한번쯤은 가볼만한곳/딱 시그니처 코스만 먹음 될 듯!  그 이상은.. /기대 안하고 가서 그런가 아뮤즈 부쉬도 예쁘고 맛있었어용 좋았습니다 직원분들이 세심하게 서비스 해 주세요ㅎㅎ 김밥 먹으러 감여/생각보단........... 기대를 너무 해서.... 이야기를 안들었으면 달랐겠지 사장이하 모든 직원들 음식에 대한 이해도가 낮은것 같음/전반적으로 깔끔하고 괜찮은데 메인은 냄새나서 뱉었어요 김밥은 기대가 컸나봐요 서비스 별로에요/작년에 방문 후 만족하고 기념일에 미리 예약하고 갔는데 가격은 올라있는데, 서비스랑 맛은 실망이었어요ㅠㅠ 우선 성게 진짜 너무 비렸어요ㅠㅠ 캐나다산이라서 냉동으로 들어와서 그런걸까요… 디저트랑 문어 빼고는 다 별루였어요ㅠㅠ 그리고 주문한 음식이 매번 일행들과 반대로 나와서 셀프 플레이팅했어요… 처음 한번은 실수일 수 있다고 생각했는데 오히려 모두 똑같았던 ...더보기/역시나 맛있어요/6번째 방문. 가격은 1인당 15만원이상 하나하나 음식에서 예술을 맛보는 곳  .  .두달뒤 재방문예정.   .다른 미쉐린이나 고급 코스들중 가장 애정하는 장소/음식은 맛있습니다 그러나 스케쥴 바뀔수도 있으니 절대 예약하지 마세요 위약금 상당합니다/디너 테이스팅 코스 맛있었음/쏘쏘..아직도 계실지는 모르겠지만 서버분 중에 키 크고 껄렁껄렁한 자세로 설명해 주시는 분 빼고는 괜찮았어요/비쌈/언제나 맛있습니다! /런치 코스 중 한우 스테이크가 제일 별로였어요. 차라리 오리가 낫습니다. 전체적으로 괜찮았습니다~/런치/완 전 존 맛/좋아요^^~ 종종갑니다.조만간 또 갈것이에요^^/웨이터는 메뉴설명해달라고 해도 귀찮은듯이 대충 설명해주었고 스테이크는 식어서 나와서 질겼음. 오늘 먹은 배민 스테이크가 더 부드러웠음. 기념일이였는데 너무 실망해서 다시는 안갑니다. 미슐랭 2스타인게 너무 놀라움. /엄마의 손맛이 느껴져요 ㅎㅎ/맛있어요/맛있어요/나물 종류도 많고 맛있음/마싯어요/맛있어요~/코스요리를 끝까지 다 못먹을정도로 음식이 너무 별로라 중간에 나옴 눈만 즐거우면 뭐함  동네치킨집보다 기름쩐내가 진동&소금폭탄 입맛을 돋구는 아무즈부쉬, 에피타이저 먹고 오히려 입맛 뚝떨어짐 ㅠ 생일날 기분 더 망치기 싫어서 먹다가 걍 나옴/특별한 날 가기 추천합니다. 기대하고 갔는데 이상이네요. 플레이팅과 맛과 서비스 다 훌륭합니다. /결제 후 10일쯤 지났을 때 카드값이 너무 많이 나와 이상하다고 생각해 결제내역을 보니 두번 결제가 됬더라고요. 그래 그럴수있지 생각하고 전화를 했더니 사과한마디 없이 확인하고 연락주겠다고 해서 사과가 먼저 아니시냐 그럼 제가 잘못 체크를 햇다는거냐 햇더니 확인 후 연락을 주겠다며 사과 한마디 안하고 끊으셨죠 진짜 미슐랭이라는 이름이 무색하게 너무 처리가 ...더보기/기대치가 너무 높았던걸까.. 전반적으로 가격대비 아쉬웠습니다.. 아무즈부쉬 눈도 즐겁고 나쁘지않았으나 그 이후로 성게 비빔밥도 짜고, 문어도 짜고, 파인다이닝에 돼지 국밥이 왠말이며(심지어 냄새나고 맛도 쏘쏘), 그 유명한 맛있는 김밥은 15000원 추가해서까지 먹었으나 식감 바삭거리는거 빼고 뭐가그리 색다른지도 모르겠고..인당 78000원에 못미치는 느낌...더보기"
