,name,address,sort,menu,mean_price,score,people_give_score,review_count,review_list
0,카페아르크,서울 종로구 인왕산로 3 위쿡 1층 (우)03028,카페,"아메리카노,라떼,리얼쇼콜라,청포도에이드,라벤다허브티",5600,3.3,47,206,"카페에서 일회용품 규제하지 않나요? 여기 일회용 잔에 주더라구요. 루프탑 반 층 아래 화장실은 왜 이용불가인가요? 1.5층 화장실만 이용 가능인데 화장실 한 칸 이에요ㅋㅋㅋㅋ카페가 이렇게나 큰데. 진짜... 그리고 루프탑엔 그 허리 바닥까지 숙여야만 이용가능한 테이블.... 동네 한옥도 그렇고 인왕산도 보여서 루프탑 때문에 가는 거라지만... 카페의 편의성...더보기/커피맛은 평범 루프탑에서 보는 주변 뷰가 탁 트여서 좋았어요/건물 너무예뻐요 다만 사람이 많은데 앉을 장소가 협소 ㅠㅠ 여름되면 루프탑은 좋을거같아으요/루프탑있다. 끝./커피는 맛있고 자리도 편한데 문이 쪼따시만함/노래가 좋네요^_*/루프탑 뷰도 좋고 넓고 커피도 무난히 맛있었습니다./음 직원분들이 서비스가 정말 별로에요  손님은 왕이다.떠받들어라는 절대 아니지만 기본적인 것도 안하는것같아요  그냥 기분 나빠요  리뷰 안쓰거 싶은데  알았음좋겠어요 그 직원들한테 기분나밨던 손님이 있었다는것좀 /인왕산뷰맛집입니다^^루프탑에서 인왕산뷰가 멋집니다~/뷰는 좋은데 콜드브루가.. 콜드브루가 아니네용/음료는 그냥 그렇고 뷰가좋아요 요즘날씨에 딱 바람쐬기좋아요 /정말 기분좋았던 하루를 여기 여직원 때문에 다 망쳐버렸어요.브라우니를 트레이에 담아서 계산하려고 올려놓았더니 계산대 옆 쇼케이스로 거칠게 던지면서, 음료 시킬꺼냐고 딱딱하게 말하는데 정말 기분이 상하더군요. 그래서 뭐라고 했더니, 바빠서 그랬다고… 바쁘기는 뒤에 딱 한팀있었는데..  미안하다거나 죄송하다는 태도 전혀 아니고, 옆에 남직원분때문에 간신히 참았...더보기/여자직원분 태도 정말 별로고(평일 점심 타임) 커피는 비싼 값에 비해 양이 매우 적고 맛은 평범해요 스콘이랑 쿠키는 밀가루 반죽 맛밖에 안나고 맛없어요 초코쿠키가 맛없기가 쉽지 않은데 말이죠/뭐 사람 많아서 스트레스 받을 수 있는건 저도 잘 알고 있습니다만, 모든 사람한테 거만한 태도로 대하는건 정말 좋지 않은 행동인 것 같습니다. 여직원님.  주문하려고 카운터에 갔는데 “저희 몇시까지인지 아시죠?” 정~말 기분 나쁘게 물어보셨는데 그쪽 영업시간을 제가 왜 알아야 할까요?  보통같으면 영업시간이 20시까진데 이용 괜찮으시겠어요? 라고 물어보는게...더보기/아니 뭔 들어가자마자 하는 첫마디가 저희 영업시간 몇시인지 아시죠? 라고 말하는건 뭔가요. 뿐만아니라 그냥 말하는 말투나 행동들이 예의없고 불친절하네요. 밑에 평들 보니까 예전부터 그런것 같은데 여기는 직원관리 안하나요?  서비스업에서 제일 중요한게 손님응대인데 기분나빠서 올생각이 싹 사라지네요./테라스도 이쁘고 커피도 맜있어요/커피맛 나쁘지 않고 주말엔 모르겠으나 평일엔 한적하고 뷰는 별다섯개도 줄만함  ★ 절대비추 지인에 가지말라고 할 집 ★★ 재방문의사 없음/평범 혹은 그이하 ★★★ 괜찮음 누가 가자고하면 다시감 ★★★★ 맛있음 재방문의사 있음 ★★★★★ 추천 찐맛집/루프탑은 관리가 안되어있고 디저트는 군대에서 먹던 파운드 케이크맛/벚꽃명소/주말 이른 오전에 앉아있으니 좋았어요 :)) 빵식사 굿/커피가 특별한 맛은 아닌것 같아요. 응대하시는분들 좀 지쳐보이시더라구요... /공간은 예쁜데 베이커리가... 빵남긴적처음이에요 커피는 그냥저냥 무난한데 손님중에 인플루언서분들^^이 유난히 많아서 사진찍어야된다구 다른손님들 비키라구 눈치줌 ㅠㅠ헝/음료는 평범하지만 종로에서만 가능한 뷰가 다른 아쉬운 점을 상쇄함/가격 대비 비추 /루프탑에 은행 잔뜩 깔려있고 야외 빈백은 더러워져있고 야외테이블도 음료 묻고 난리남 손님응대 불친절 /실내장식.바깥뷰.루프탑 너무 좋고 커피맛도 괜찮아요. 강추!!/우연히 발견한 곳 뷰가 짱  날 좋은날 또 오고 싶은 루프탑/루프탑 관리가 안되고있는 듯/뷰 맛 집 (여름엔 루프탑 더워요)/커피 맛은 평범한 편입니다 루프탑 공간 물론 관리하기 힘드시겠지만 제가 갔을 땐 쓰레기 때문에 너무 지저분했어요 ㅜ 벚꽃 시즌에 뷰가 예쁠 것 같아요 ~/회사 건물 카페라 그런지 1층은 생각보다 너무 시끄럽고 정신없습니다. 끊임없는 직장인분들 러쉬에 차라리 주말이 조용할 것 같다 싶을 정도입니다. 내부 규모에 비해 너무 많은 직원분들 때문에 전체적인 분위기가 산만합니다.  그러나 이 모든걸 루프탑이 다 만회하고도 남습니다. 가을낙엽과 함께 빈백에 누워서 마시는 커피는 꿀맛. 그치만 추워지면 못가지... 여길...더보기/요즘 같은 날씨에 가기 참 좋은 카페예요. /주변과 어우러진 느낌은 예쁜데 크피는  보통, 파운드케이크는 바스러짐,, "
1,체부동잔치집,서울 종로구 자하문로1길 16 1층 (우)03041,국수,"들깨칼국수,수제비도 가능,15,000,들깨모밀,잔치국수,녹두전",6625,3.8,126,346,"가격도 괜찮고 맛도 너무 좋아요. 비빔국수 들깨칼국수, 파전을 먹었는데 셋다 맛있습니다. 등산 다녀와서 오시는 분들이 많은 것 같구요 막걸리 한잔씩은 다들 하시네요. 파전이 전 중에 젤 비싼데 파와 오징어 내용물이 실해요. 국수는 가격이 서울 중심가라고 하기엔 보기드문 가격이어서 좋았구요 가격이 저렴한건 토핑이 없어서 그런것 같아요;; 국수 두개 다 양념만...더보기/정겨운 느낌.  맛있었어요/불친절 끝판왕. 문 열려있어서 영업하는지 물어볼려고 들어갔는데 손을 훠이훠이 파리 쫓아내듯이 나가라함./기대안했는데 싸고맛있음~다음에와서는 파전먹어보고싶어요/가야는이유 : 넉넉한 양으로 식사와 주점 가능한 안가는이유 : 좁고 번잡한 분위기  잔치국수,감자전,메밀전 : 전반적으로 맛은 괜찮았고 잔치국수는 가격대비 양이 넉넉, 식사만 하고 가는 사람도 꽤 있는, 대학가 주점 같은 느낌도 있고 실제로 어린 나이대가 꽤 있는/2번이나 방문했는데 음식들이 다 맛있어요!! 들깨모밀면은 너무 금방 불어서 비추천이에요! 그냥 들깨칼국수로 추천드려요!!! /가성비 갑.... 맛있는건 기본!!!/제육복음 맛있어요/테이블 끈적하고 위생상태 조금 별로.  비빔국수 가성비 좋고 맛 괜찮았음. 해물파전은 두툼해서 식감은 좋으나 군데군데 덜 익음/좋아하던 집이었는데 ㅠㅠ 계산하고 나오는 길에 조리하시는 분이 국자로 국물 호로롭 간보고 바로 그 국자 다시 담가서 휘휘 국물 저으시는 모습을 보고 말았어요 /QR 체크인 안하시구요 되게 북적이고 다닥다닥 붙어있어요! 잔치국수 맛도 정말 평범했어요.  근데 3000원이라 가격은 혜자예요./거리두기도 안 지키고 서빙하시는 분들중에 한분이 정말 밥맛 뚝뚝 떨어지게 만드시네요~ 그럴거면 그냥 일하지 마시고 집에 계세요~/들깨칼국수 넘 맛있어요…ㅜㅜㅜㅜ 추운데… 인왕산 내려와서… 막거리가 술술 들어가요…ㅜㅜ/들깨 칼국수 엄청 고소하고 비빔메밀 존맛 ㅠㅠ /이 가격, 이 정도에 마다한다구? 2차로 가기 딱 좋음. 코로나 전에는 집에 가기 전에 들리는게 필수였는데ㅜㅜ/가성비 최고/와 진짜 가성비 짱짱맨 잔치국수에 청양고추 넣어서 얼큰하고 면도 맛있어요 한 그릇 후딱 먹으면 완전 든든해요 욕심에 메밀전병까지 시켰다가 다 못 먹고 포장해감.../감자전에서 계란 껍질이 나왔지만 말씀드리니 계산할때 죄송하다 하시고 금액은 빼주셨어요.  잘못 깔끔하게 인정하시고 적절한 조치 해주시는 부분은 좋습니다. 실수는 할수 있지만 조금 더 신경써주면 좋을거 같네요/무슨일이에요ㅠㅠ 진짜.. 가성비 + 맛 둘다 고루 갖춘 찾기 힘든 찐 맛집 애기전은 필수입니다 개존맛/동생들과 잘 먹었습니다/맛있어요~~ 반말 하는것만 빼면 좋아요/전 친구 근처에 놀러오면 항상 여기 데리고 갔어요~~ 존맛탱! 친구들도 항상 만족해요. 인왕산 등산 마치고 여기로 먹으러 가세요 다들~~~/도토리묵 반반만두  비빔모밀  메밀전 먹었어요! 인왕산 갔다와서 뭘먹어도 진짜 맛있엇지만 도토리묵이 꽤 쫀쫀하구 자극적이라.,.!깜놀.,. 비빔모밀도 만족하며 먹었는데! 근데 매장에 얼큰한 사람들 한가득 이골목이 담배를 거리에서 피워서 문쪽에 앉으면 냄사가 초큼 들어와요.,.ㅎ  앞사람들이 극찬하면서 들깨 칼국수 먹길랭 다음 인왕산 갔다가 올때는 들깨칼국수...더보기/인왕산 갔다가 들깨칼국수 맛집이라고 해서 찾아갔는데 너무 맛있게 잘먹었습니다~ 다음에는 5호점으로 돼지갈비도 먹으러가려구요 ㅎㅎ 가성비 좋은 맛집이에요!/만두 맛집/10년째 종종가는곳 도토리묵,들깨칼국수,메밀전병,파전 맛있어요 비빔국수는 맛없으니 시키지 않는걸로 ㅎㅎ  /판모밀 진짜 대박…ㅠㅠㅠㅠㅠㅠ/가성비 굿굿 맛있어서 얼마 전에도 또 갔어요! 감자전이 미쳤어요../비빔모밀 감칠맛 진리 들깨칼국수/수제비 구수함/위생상태는 별로지만 너무맛있어요 특히 만두육즙이 대박.. 간장까지 진짜맛있음/김치를 상위에 놓아두고 덜어먹으라는 곳입니다 코로나 시국에 위생상태 매우 안좋아 보이구요 테이블 끈적임 수저통 끈적임 오짐 식당내부가 좁고 시장통 느낌  거르지 못해 아쉬울뿐 /위생 꽝 .. 테이블 찐득 수저 젓가락 끈적거림 손님 나가고 테이블 안닦음   잔치국수 먹는데 메밀면가닥 계속 나옴 국수 3천원이지만 3천원이 너무 아까움  해물파전 넘 두꺼워서 밀가루 안익음(15000원) 직원 불친절 다시는 안가용 "
2,토속촌삼계탕,서울 종로구 자하문로5길 5 (우)03041,삼계탕,표기안함,표기안함,3.6,284,107,"밑에 1점 준 사람들 다 주변 업체 작업 같네요. 평생 먹어본 삼계탕 포함 음식 순위로도 손에 꼽음. 잘 먹고 갑니다./낫 배드 직원분들 바쁘지만 친절 하지만 서울3대삼계탕집? 절대 아님.. 더 맛난집 널림ㅜ/맛있게 잘먹었습니다. 항상 웨이팅 있었는데 웨이팅 안해서 아주 기분좋게 먹고 나왔어요^^또올게요~/알려진 명성에 비해 먹어보고 실망. 가격에 비에 양도 작고 국물도 그저 그래요. 여기보다 싸고 맛있는 삼계탕집 많아요 /코로나 이후 직원수도 줄고 일의 속도도 느릴수 있음을 감안을 하더라도 메뉴 주문할때 20분기다리라 하고, 30분후에 '얼마나 더 기다려야 먹을까요' 라는 질문에 다시 20분기다리라며 훅 나가버린 매니저!  '먹으려면 기다려'하는 느낌이다. 바쁜줄 알겠지만 음식을 기대하며 기다리는 손님에게 준비하고 있으니 조금만 더 기다려달라는 양해의 말이 매니저로써 필요한...더보기/여기 더럽고 서비스 최악 맛도 그저그럼 테이블 닦아주지도 않고 숟가락통에 먹다 흘린 반찬 밥풀 널부러져 있음 더러워서 안감/삼계탕집이 왜이리 고급지냐 맛있음 역시 동네 배달 삼계탕이랑은 차원이 다르군 여기 또 가고싶다. 데려가줘서 고마웠다./깍두기 4번 리필 깍두기 맛집/전기통닭구이 닭껍질이 맛있어요. 가격은 좀 아쉬운 편인 듯해요. /맛은있는데 직원분들 다 불친절하네요. 바쁜시간도 아니었는데.. 비싼음식임에도 먹고나올때의 기분이 별로라 두번은 안갈것 같아요./무난하게 먹기 좋은 관광지 맛집 느낌이에요/외국인들이야~ 잘 모르니까 맛있겠지만~... 내국인들이 맛있다고 하는건 솔직히 이해가 안갑니다~ 이걸 또 몇 시간씩 기다려가면서 먹는건 더 이해가 안가네요~... 주변에 여기보다 맛있는 집들이 그리도 많은데~.../정말 글쎄... 뭐가 맛있다는건지ㅜㅜ 닭은 작아도 너무작아서 사진대로 닭이 안보이고 태운건지 다리끝부분이 탄듯함ㅜㅜ 국물도 김치도 뭐 글쎄 특별한 맛이 있는것도 아니고... 다신 안갈듯/“씩씩한 무와 부드러운 닭 이것이 세종마을의 자랑입니다” - 건펍 조영웅 “역시 닭이 짱” - 풍류 김지웅 “별이 다섯개” - 하리보 오성민/국물도 진하고 든든하니 맛남 안에 찹쌀이랑 깍두기먹으면 환상의조합.. 해물파전은 비추! 가격에 비해 퀄리티 구림/맛있었어요~/국물맛이 진하고 고기도 맛있습니다./넘 맛있어요 강추!인삼 큰다 국물 진득해고 한그릇에 18,000원이면 비싸다는 생각이었는데 재료 정선의 들어가는 느낌이 아주 푹 잘 고아져서 퍽퍽살까지도 야들야들 맛있었고 김치랑깍두기 직접 담궈서 넘 맛난 /가격이 좀 비싸지만 맛은 있음/맛있어요/국물이 죽임. 김치도 맛있음./밋밋한 삼계탕 가격까지 고려한다? 평균이하/우리도 같은 경험이였어요.시키지도않은 산삼 배양근.계산할때 포함된 경험.맛은 있었는데.ㅠ.ㅠ 그뒤론 여기 안가고 주위를 지날때마다 불쾌한 기분 뭐지?우리한테만한 실수가 아니였어.반복된다는건  ? 그럼, 이건 심각한데./산삼 배양근 갖다주길래 넣어 먹었는데 잘못 준거라더라고요. 근데 그걸 우리한테 계산하라함ㅋㅋㅋㅋ 서빙 실수를 처음 가본 손님이 어떻게 알고 왜 계산해요... 이거 시킨거 맞냐고 물어보지도 않고 그냥 줬으면서... 근데 계속 해야된다길래 계산했어요. 6000원이라 다행이었지... 가실 분들 계시면 이런 사례도 있으니 참고하세요. 삼계탕은 맛있었음^^/맛있어요! 국물이 아주 진하고, 고기가 부드러워요. 하지만 상이 진뜩거리고, 실내가 좀 더운 점은 아쉬워요. 그래도, 맛있으니까 별5/오골계 삼계탕 최고맛집!!/3.5/맛있어요!/엄청 찐해서 몸보신이 자동...  맛도 중독성이 있네요. ^^/4인 이상 안되는데 앞뒤 테이블로 나눠서  장사하고있음"
3,칸다소바 경복궁점,서울 종로구 자하문로7길 5 1층 (우)03040,일본식라면,"마제소바,일본에서 화제인 국물 없이 비벼먹는 라멘",9000,3.8,208,309,"어.... 소바는 간이 좀 센 느낌이 있어서 먹는내내 물이랑 같이 먹었어요 ㅠ 그리고 대기 시스템이 너무 비효율적으로 운영되고 있는거 같아 개선이 필요할거 같습니다! 주말에 가면 기본 한시간반 이상은 기다리셔야 해요/마제소바 첫도전 개존맛 파 좋아하는 저는 아부라 소바가 훨씬 맛있었고 남친은 마제소바가 더 맛있다고 하더라구요 토요일 오전 11시쯤 가니 한 명 줄 서있었고 두번째로 줄 서서 오픈 하자마자 2등으로 들어갔어요~ 11시쯤 가보세용 차슈는 아이스에이징인가? 그거랑 그냥 훈제 차슈였나 이렇게 두 가진데 둘다 그냥 그랬어요 계란은 꼭 추가하세용 공기밥은 무료로 추...더보기/1년에 한번정도 먹을만한 맛/한 시간 넘게 기다리면서 먹을것까지는 아닌 듯/웨이팅하면서까지 먹을 맛은 아님../유명한 서촌 맛집. 마제소바는 여기가 가장 맛있다. 가끔은 오래 기다리면서라도 꼭 먹고 싶은 날이 있다. 서비스밥까지 먹으려면 배를 좀 비우고 가야 한다. /조온맛;; 너무 자극적이지 않은 마제소바. 향긋하고 맛이 엄청 깊었어요.. 기다리기 싫었는데 또 기다려서 먹고 싶을만큼 맛있어요.. 차슈도 부드럽게 잘 익었고 살짝 달달하니 소바랑 딱 이었어요 ㅠ 다먹으면 소스에 비벼먹을 밥을 주는데 이것도 완전 짱 ㅠ 먹다가 물리면 고추기름 살짝 둘러먹으면 그냥 따봉이에요..최고!!!/웨이팅이 너무길고 비효율적인 시스템. 음식은 무난하게 맛있다/아지타마고는 오버쿡. 차슈는 오돌뼈투성이. 다신 안간다. /양이 너무 적어요 ㅜ/왜 줄서서 먹는지 모르겠어요 ㅠㅠ 평범하고 너무 느끼해요… /맛있다 낯선데 맛있는 맛 파가 많이 들어서 좋아요 웨이팅 너무 길다/첫 입에 난 맛알못인걸까? 아니면 마제소바가 나랑 안맞는걸까..라는 생각이 들었어요  제 입엔 그저 그랬던 면요리입니다ㅠㅠ뭔가 마제소바의 향이 저랑 안맞아요/맛 자극적이고 맛나요 ㅎㅎ 테이블 순환 빨라서 웨이팅 좀 있어도 괜춘 /무난합니다/마제소바 찾아다니면서 먹는 사람인데 기다릴정도의 맛은 아닙니다. 그냥 마제소바 평균맛 대비 딱 그 평균 수준... /최애 마제소바..오래오래 계셔주세요/그냥 그랬어요. 웨이팅하면서까지 먹을 맛은 절대 아님./최고입니다. /궁금해서 줄서서 먹어봤는데 맛있긴한데 한시간 넘게 줄서서 먹을 맛인지는 모르겠어요 항상 줄이 길어서 다시 먹을일 없을듯/마제소바 맛은 괜찮은데 막 줄서서 먹을 정도는 아닌거같고 무엇보다 여기서 먹고 식중독걸려서 계속 토해서 병원갔다옴. 어제 여기서 한끼 먹은게 전부인데../맛을 떠나서 7시 40분부터 주방청소 하느라 바에앉아 먹는 손님코에 세제냄새 풀풀 풍기다가 먹는사람 목이고 음식에 청소물벼락을 맞음 죄송하다 하고 끝인게 너무 신기하네.... 화나서 젓가락 내려놓고 나가는데 안녕히가세여라네.. 와우..../웨이팅 시스템이 이상해요. 결제하고 대기하는거라고 문앞에 적어라도 두시지 그냥 앞에서 기다리는건줄알고 추운데 얼타다 주문하는 손님이 한둘이 아닙니다/아부라소바 미침..../맛있고 항상 웨이팅이 있어요! 여유있게 대화하면서 먹을만한 분위기는 아닌 거 같아요! 경복궁 핫플 치고 10000원이면 혜자인 듯/역시나 맛있음 밥 비벼먹으면 꿀맛/개인적으로 30분정도까지 기다려서 먹을만 함  줄만 서 계시지 말고 들어가서 키오스크로 주문하고 주문표 종업원분께드리면 됩니다 종업원이 주문번호 부르시면 들어가시면 돼요~/짜고 후추맛도 강하고...기름이 너무 많아요. 기름이 질척질척 거려요/감동까진 아니고 먹을만한데 입에 짠맛이 오래감 /여기 맛있어서 처음 생겼을때부터 다녔음. 요새 가면 맛은 여전하게 맛있어서 좋은데, 엄청 많은 웨이팅 고객들에 대해 전혀 배려가 없음  웨이팅 시스템 얼마나 한다고 순서되면 문자라도 보내주지 그앞에서 꼭 덜덜떨면서 기다리게 하는 이유를 모르겠음.  체인점도 하던데 그정도 시스템은 갖추시길/짜다.너무짜..절반 먹으면 입이 얼얼할 정도로 짜다../조온맛~~~ :)"
4,대하식당,서울 종로구 자하문로7길 27 (우)03040,"육류,고기",삼겹살 (600g),30000,4.6,23,88,"고기도 맛있고 기본 찬도 괜찮었어요/장소는 협소하지만 정겨운 느낌의 공간. 삼겹살 질도 좋고 김치랑 같이 먹으니까 진짜 맛있었어요!!! 또 가서 배터지게 고기 먹고싶은 집입니다./고기 잡내 안나고 가격 좋고 밑반찬 잘나오고 사장님 친절하고 꼼꼼함 내부 협소함 홀을 사장님 혼자보시던데 진짜 대단함 반찬리필 잘해주심 된찌 기본으로 나옴 맛있음 나올때 과자 주심 이것도 맛있음 그러나... 웨이팅을 오래 해서 먹을 이유는 없다 어엄청 특별한 맛은 아니다/정겨운 분위기의 맛집입니다 삼겹살도 정말 맛있고 저는 된장찌개 맛을 잊을 수 없서요.. 존맛.. 취하고 싶은 분위기~.. 사장님도 너무 친절하셔요! 나갈 때 주시는 간식도 좋아요.. 최고.. 웨이팅이 길다는 게 단점입니다ㅠㅠ 저번에 1시간정도 기다린 적도 있는 것 같아유 일찍 가시는 걸 추천합니당/남자사장님 친절 고기맛 좋았음 사장님만 크게 부르면 반찬 리필도 잘 해주시고 기본 2인분 인거 같은데 고기 1인분도 더 추가 가능/아 음.. 맛은 있고 가성비도 좋아요! 술 땡기는 노포 분위기 ㅎㅎ 만족합니다. 근데.. 그냥 고기집이에요! 별점 3.5개는 드리고 싶은데 점수 조정차 1점 드려요. 저는 45분 기다렸는데 그 정도는 아닌 것 같아서 혹시 두시간씩 기다려 드시는 분들 계실까봐 남겨요./고기맛집! 은 아니고 그냥..감성…가성비느낌 사장님은 친절하심 근데 좌식이라 좀 불편하고 다른테이블과 거리도 좁고 환기가 안되서 냄새 걍 바로벰 재방문은 그닥../적당히 맛있는 고기, 세상 맛있는 묵은지, 친절한 서비스. 담에는 둘이서 1,200그람 먹기로 했어요. 아 근데 내부 환기는 안 돼서, 먹고 나오면 냄새는 장난 아닙니다./삼겹살 막걸리 볶음밥 …. 게임끝/주기적으로 갈 거 같아요 사장님도 친절하시고 묵은지+삼겹살 조합 짱~~!/진짜 삼겹살과 묵은지 조합 최고에요 사장님도 엄청 친절하세요!/분위기가 좋아요/분위기 최고, 맛 최고, 사장님 친절하세용 가까우면 자주 갔을듯/-3시 46분쯤갔는데 줄이 있었어요 -테이블은 8개?이구 2명씩 앉게 되어있어요 (성인남자 3명두 앉아있긴했어요) -앉으면 고기주문 안받고 바루 600g씩 세팅해주세요 -벽면에 옛날 잡지 사진과 글이 적힌종이가 붙어져있고 맛있게 굽는법이 적혀져있어요 -고기 질이 정말 좋아요 -묵은지가 미쳤어요×100 -된장찌개가 미쳤어요 -사장님이 친절하세요 -삼겹살 60...더보기/완전 맛있어요 친절하시고 최고~~/맛, 가격, 오붓한 옛분위기~^^/맛은 물론이고 사장님까지 너무 친절하셨습니다 또 오고 싶은 곳이네요~ ㅎ/맛있고 저렴하고 왁자지껄한 분위기도 좋아요 크으으으/서촌구경 하다가 우연히 발견한 이곳 이집 가성비 맛 하나 뺄거없이 진짜 최고!!! 이 가격주고 유지되나 싶을 정도다... 돼지고기 퀄이 좋아서 입에 착착 감긴다 반찬이랑 된장찌개도 다 내 스타일 김치도 맛있게 익어서 최고~ 조만간 또가겠음! "
