,name,address,sort,menu,mean_price,score,people_give_score,review_count,review_list
0,만족오향족발 시청본점,서울 중구 서소문로 134-7 (우)04514,만족오향족발,표기안함,표기안함,3.7,139,329,"첨 갔을때 웨이팅 좀 있어서 기다려야했는데 그래도 나중에 가니까 바로 들어갈 수 있더라구요. 족발이 따뜻할때 먹으니까 비계 부분들이 좀 많이 물컹한 스타일이긴한데 껍데기에 스며들어있는 그 맛이 넘 맛있어요 /맛있어요./오향장육 같은 풍미가 있는 특이한 족발. 양배추를 마늘 소스에 담가두고 족발과 함께 먹으면 질리지가 않는 맛을 즐길 수 있다. 여담으로 10년 전쯤에는 낮에 만두를 팔다가 오후 4시?5시? 쯤부터 족발을 팔았던 것 같은데 지금은 족발 위주로 운영 하고 있다. 족발을 시키면 만둣국이 서비스로 나오는게 그 흔적으로 남은 듯. //  카카오맵 맛집 추천 지도 -...더보기/포장해서 먹어도 맛있어요/족발 포장해서 먹어도 맛있어요~ 포장은 조금 할인되요/너무 불친절해요.  주먹밥은 별로예요. 공기밥 주문했는데, 양이 많은듯해서 바로 취소해 달라니까, 코로나라 취소 안된데요.  뚜껑없이 나온 공기밥 어찌해야하는지.   코로나인데 공기밥 뚜껑 덮어 나왔어야 되는것 아닌가요?   그래서 그냥 먹어보자했는데,  오래된 냄새나는 딱딱한 밥이었어요. 리뷰보고 맛있다해서, 일부러 엄마모시고 간거였는데, 아주 믾이 실망...더보기/오향족발 좋아하는데 시청본점은 처음 와봐요  오후3시 입장 맛은 항상 먹던맛 그대로인데  고기가 차가워요 식어서 나왔어요  여태 식은걸 먹은적이 없는데 이걸 본점에서 먹다니 날씨도 추워 따뜻한 국물에 족발땡겨서 왔는데  찬거 먹다가 현타왔네요 2.5점 주고싶음/내가 먹어본 족발 중에 식감은 최고. 진짜 쫀득하다. 솔직히 처음 먹었을 때 신세계였다..하지만 너무 달아서 두 번은 안 가게 된../종업원들이 너무나 불친절 합니다  ^~ 친구들한테 민망했습니다/도대체 뭘 넣길래 이리 맛난지.. 몇년째 족발집은 여기만 감. 딴데 가고 싶어도 맛없게 느껴져서 못 감. 야들야들 식어도 부드러움. 퍽퍽함 제로. 불족도 과하게 맵지 않으면서 맛남/종업원 4가지 너무 없음..  절대 가지 마세요..  솔직히 0점 주고 싶네요  자리 바꿀 수 있냐고 물어봤더니  자기들은 맛집이라 자리 없으니 다른데 가던가요  라 하심/가끔 땡기는맛 /보쌈 존 맛/첫족발이 이족발이어서 다른 족발 먹기가 힘듭니다… 돌겠다 미치겠다는 아닌데, 이처러 잡내 없이 너무 자극적이지 않은 ‘적당한’ 족발찾기가 힘듭미다../맛있어요 대자주문했는데 양적습니다 막국수랑 만두국맛있어요 직원분 외국인이셨는데 한국말 너무 못하셔서 의사소통하는데 불편했어요/동거가족 증명서류도 가져왔는데 안된다고 안들여보내주심 카운터 보는 분이 방역수칙을 잘 모르시는듯/쫀득쫀득 /족발과 막국수가 땡길 때 처음 떠오르는 곳./존맛.. 술이 쭉쭉 들어감  막국수는 맵찔이에게 좀 매운편ㅠ/변했다../완전 시장 바닥. 낮술에  취한 인간들 버글버글한데 차단 유리막도 제대로 안하고 말도 안되는 비닐천.,.낮1시 30분에 갔는데 늙은 아저씨들 판 벌이고 고래고래 소리지르고 여자들도  고함. 포장을 하려다가  앉았더니  후회막급.미쳤지..얼른 포장 요청했고  두번 다시 좌석에 앉진 않을 거다. 직원 아줌마들도 손님 몇 테이블 안되는데 인상 쓰고..진짜 너무 ...더보기/3.5 탱글탱글 맛있으나 쉽게 물리는 맛 만둣국이 끌렸다/여기 카운터 보는 아줌마 사장인지 아닌지 모르겟지만 인성 개빻앗음 걍 먹기시르면 나가라는 마인드/개존맛탱. 지도 보고 매장 찾기가 좀 많이 힘듦. /음.. 유명해도 될정도/지금까지 먹어본 족발 중에서 단연 최고!!! 추천메뉴 : 만족오향족발, 쟁반국수 회사 직원들과 한번 가봤는데 마눌님 데리고 또 갈예정임ㅎㅎ 마눌님 족발 안좋아하는데 여기서 먹어보면 좋아하게 될듯ㅎㅎ/사이드메뉴, 청결, 맛 대박.  댑악. /처음에 달달한 맛이 나다가 뒤이어 정향 팔각같은 한약재의 향이  강하게 느껴졌어요 마늘소스 양배추샐러드와 같이 먹으면 새콤달콤함이 더해지고  오향은 조금 감춰져서 오향을 좋아하지 않는 사람도  맛있게 먹을수 있을것 같아요 고기와 껍질은 굉장히 부드러웠습니다/너무 맛있다고 소문나서 확인하러 마눌님 모시고 방문.... 울 마눌:뭐징? 머징? 왜징? ... 먹다가 포기...  난 그냥 먹을만 한데, 암튼 가**** 족* 과 비교불가.  ㅎㅎ...솔직한 심정./껍질 쫀득쫀득하고 안느끼해요! 불족발은 꽤 매워요.. 쟁반국수도 새콤하게 맛있구 2명이서 가도 셋트메뉴 구성이 좋아서 고민 덜해도 되요 ㅎㅎ /두번 안먹을맛 동네 맛집이 더 맛있엇고 너무 시끄러움  /족발맛은 무난하다 시설은 규모에 비해 뭔가 싶었다 화장실 가보고 놀람/짱맛입니다 사람많아서 대기도 길어요/난 여기까지만.. 만두국도 좋치만 더 탱글한 족발이 좋음 이런스타일은 성수족발로 족해"
1,롯데호텔서울 라세느,서울 중구 을지로 30 롯데호텔서울 본관 1층 (우)04533,뷔페,"CONTINENTAL BREAKFAST,AMERICAN BREAKFAST,FROM THE GRIDDLE,EGG DISHES,CEREAL,KOREAN BREAKFAST",29500,4.0,85,359,"양갈비맛집 ㅎㅎ 일식이 약하다는 평이 있는데 회랑 초밥 맛난 것들만 골라놔서 잘 먹었습니다/악의적 내용  아니고.. 내가 분명히 딸기뷔페  하냐고 물어보고 갔는데  ..  그냥 뷔페였음..   난 69000원 내려다 150000윈 냄.   맛이라도 좋으면 이해하겠는데..  밤늦게 간 것도 있겠지만  만족스럽지 않았음.  그냥 빕스 몇번 가고 말지..   빕스 프리미어 3시 가서  대기하기 짜증나 기껏 갔더니만 뒤통수 제대로 맞았네...  다시는 ...더보기/일식코너에 힘을 많이 준 느낌이고 해산물이 다양하게 제공된다. 즉석에서 구워주는 (조그마한)랍스터와 (조그마한)양갈비 토마호크 스테이크에 가장 좋은 평가를 줄 수 있다.  재료의 질은 그다지 좋다는 느낌이 없지만 뷔페 치고는 음식의 질과 종류가 전반적으로 괜찮다. 별점은 이곳이 뷔페인 만큼 전문식당에 비할 바는 아니기에 이를 고려했다.  참고로 탄산수와 커...더보기/양갈비 맛집.. 서비스나 전체적인 구성으로 봤을때 메리엇 플레이버즈가 약간 더 나은듯/한 번쯤은 가볼만함/엄청 맛있게 잘 먹었습니다 양고기가 일단 너무 맛있었습니다 무조건 양고기는 드시길.! 제가 갔을 땐 도미회가 탱글하고 너무 맛있었어요 딤섬도 맛있고 브루스케터 빵도 너무 맛있더라구요 그리고 유명한 딸기케이크! 이건 너무 맛있어서 두번이나 먹었네요 크림도 부드럽고 딸기자체가 맛있어서 나중엔 사먹어보려구요 /괜찮은 가격과 맛있는음식 가족끼리 이용하기 좋아요!/가격대비 너무 저렴한 식자재 사용./맛있어요 부모님이 물김치 맛집이라고 극찬하시네요/음식이 신선하고 맛있었습니다. 특히 중식 메뉴들이 전반적으로 괜찮았네요./가족 단위로 방문해도 좋은 곳입니다./가족모임 하기도 좋아요. 최고의 뷔페./베리 굿. 추천합니다./가격 만큼 정말 종류가 다양하고 산해진미가 다 모여있습니다. 솔직히 가격 비싸기는 한데 한번 정도는 가볼만해요/조식 이용했는데 가지수는 많지 않지만 먹을만한건 다 있음. 과일과 빵 종류는 다 맛있었고 오믈렛도 마시씀! /음식은 여러개인데 맛은 그냥저냥임 디저트는 확실히 꽝/양갈비가 너무 맛있네요 최고 근데 주차장은 복잡해요 ㅠ/맛은 전체적으로 괜찮고 직원분들도 너무 친절하셔서 좋아요. 근데 분위기나 자리들이 호텔스러운 고급짐이 많이 떨어지네요ㅠ/또가고시퍼요/평일 점심 이용함. 가격에 비해 요리 가짓수가 적고, 고기 퀄리티가 좋은지는 모르겠음~  그러나 직원들이 매우 친절하고 서비스가 좋음./맛 굿 서비스 굿 가격 노/우리나라에서 젤 맛있는 뷔페 메뉴다양하고 다 맛있음/진짜 핵존맛인데 여기가 먹을 게 없다고 하는 사람들은 대체 어딜 가야 만족할까..? 처음 가보고 너무 맛있어서 일주일 뒤에 한 번 더 감ㅋㅋㅋㅋㅋ 디저트까지 가짓수가 너무 많아서 세번은 가야 거기 있는 메뉴 다 먹어볼듯.. 메뉴가 많다고 퀄리티가 떨어지는 것도 아님. 하나하나 다 맛있었음. 매니저인지 지배인인지 직급은 모르겠지만 갈 때마다 홀에 계시는 나이...더보기/지난 해 11월에 친구들과의 곗돈이 너무 쌓였는데, 신라 하얏트 반얀트리 Jw 등 뭐 예약이 반년 씩 밀렸대서, 결국 예약 가능한 이곳으로 갔는데. 예약 텅 빈 이유가 있더라... ㅋㅋㅋ 호텔뷔페 수준 아니고 애슐리인데? 애슐리보다 맛난 메뉴 적은데? 허허허허허 그냥 친구들 오랜만에 만난 걸로 즐거웠고 코로나 시국에 우릴 잠시나마 모이게 해준게 고마워서 별...더보기/맛은 굳이 언급할 필요도 없을 정도로 좋고 무엇보다 다 쓴 비닐장갑을 빨리빨리 걷어가 주셔서 좋았습니다 더파크뷰 예약을 실패해서ㅜㅜ 라세느를 선택했는데 먹는 동안은 더파크뷰 생각 하나도 안 났어요 ㅎㅎ/굿!/성수기가 아니어서 손님도 적어서 편안하게 식사 가능했습니다. 개인적으로 직원분들 서비스랑 디저트는 신라호텔 더파크뷰보다 좋았습니다.(음식종류는 신라호텔이 더 많았습니다.) 방어회랑 참치회가 아주 일품이었습니다. 디저트류도 역시 롯데답게 훌륭했습니다. 코로나로 방역에 힘쓰는 모습도 보기 좋았습니다. 다만 음료는 전부 유료여서 그부분이 좀 아쉬웠습니다. /온리 랍스터./어제 저녁때 식사하면서 랍스타가 짜서 한입먹고 더 못먹었어요... 음료수 기계도없고 딸랑펩시콜라 1캔 8000원 이라니.. 정말 어이가없네요.. 그래도 비싼뷔페인데 음료수 기계없다는게 정말 어이가 없었습니다.. /직원분들 완전 친절하세요. 서빙식으로 바뀌어서 너무좋음/랍스타 빼고는 별로"
2,덕수궁 리에제와플,서울 중구 덕수궁길 5 1층 (우)04515,카페,"와플 유기농 육보 생딸기,시즌한정 프리미엄 프랑스 우유 생크림에 갓 따낸 곽해석 명장의 유기농 육보딸기가 듬뿍!,6,800,와플 벨지움 헤이즐넛 초코,170년 전통 프랑스 카카오바리 다크초콜릿에 퐁당 담궈 꾸덕꾸덕하게 굳혀 볶은 헤이즐넛, 수제 헤이즐넛 스프레드, 캐러멜 라이징한 견과류 토핑을 듬뿍 얹은 인기메뉴,6,500,와플 벨지운 초코,170년 전통 프랑스 카카오바리 다크초코에 퐁당 담궈 굳힌 후벨기에 밀크컬스 초콜릿 토핑이 더해져 고급진 달콤함이 환상적인 와플,5,300",7500,3.5,166,608,"맛있는데 비싼편 줄서먹을정도까진 아니구 맛잇긴해요 ㅎㅎ/초코 벨기에 와플이랑 메이플와플 시켰는데 메이플와플은 따끈해서 겉바속촉 달달하니 맛있는데 초코는 굽고 식힌다음에 초코코팅을 해서 미리 만들어두니깐 그렇게 맛있지는 않아요ㅠ 약간 반죽이 뻑뻑한 느낌? 그냥 기본 와플이 제일 맛있는듯해요!   가격대비 너무 비싸요! 기대 너무 많이 하고 가시지는 말기! /맛있다 까지도 모르겠지만... 대응이라도 친절하면 좋겠다.  먹을 공간이 없는 건 그렇다 치더라도  가격은 무슨 다른 곳 반정도 되는 사이즈가 거의 6천원이다./그냥저냥.. 줄 서서 먹을 수준 아님.../나만 맛없나??/생딸기 와플. 포장해서 먹을 만큼 맛있다. 맛있어야 할 가격이긴 하지만.. 산책하면서 먹기엔 메이플시럽만 뿌린 걸로도 충분할 것 같다./아주 오랜만에 갔는데 맛이 없어져서 놀랐어요/맛나용 ㅜㅜ 설탕덩어리 있어서 완죤 바삭하고 달고 쫀득함.. 친구랑 기다리면서 했던 말이 알바생인지 직원인지 모르겠지만 저 분들 완전 프로라고.. 이렇게까지 바쁜데 저 정도로 친절할 수가 있냐고 ㅋㅋㅋ 또 먹고 싶은 맛이에요/다른 와플에 비하면 비싸긴 합니다만, 진짜 겉은 바삭하고 속은 쫀득촉촉해서 맛있어요 ☻ 근처 지나가게 되면 한두번 더 사먹을 것 같네용♥  ★ 아 그리고 비둘기 싫어하시는 분들...가게가 골목 초입이라 비둘기 꽤 있어요 가게 앞쪽에서 먹으니까 비둘기들이 바로 발밑에서 음식 주워먹으려고 정모해서 기절하는 줄 알았어요... 골목 안으로 더 들어가면 벤치 있으니...더보기/이름이 바뀐건 왠지 모르겠지만 맛은 여전히 똑같아요 지나갈 때 마다 습관적으로 사먹어요ㅎㅎ 여러 종류 있지만 대부분 다 맛있는 것 같아요!/맛있다고들 하는데 사실 뭐가 그렇게 특별한진 잘 모르겠어요. 근데 자꾸 손이 가긴 합니다. 이걸 맛있다고 부르기로 한 건가요? 그래서 4점 드립니다. 와플 테이크아웃해서 근처 스타벅스 환구단점에서 음료 주문해서 같이 먹으면 좋습니다. 메이플 와플이랑 블루베리 크림치즈 와플 먹었는데 블루베리 크림치즈를 좀 더 추천할게요.  친절도는 5점 만점에 4점입니다./쏘쏘/인생 최애 와플. 이사가지 말아주세요 제발/내 20대를 쭉 함께했군…!  기분 좋은 날엔 항상 여기 와플을 먹엇쥐/이걸 맛없다고 하면...와플대학로.../헤이즐넛 많고 달고 맛있어요/맛있어요!! 크림치즈 완전 꾸덕꾸덕하구용 근데 생각보다 안 달았던 것 같아요 담에 가면 완전 단 거 먹어보고 시퍼요 이거 먹으려고 덕수궁 갈 필요까진 없는데 덕수궁 갔을 때 하나쯤은 사먹을 맛  （╹◡╹）♡/존맛와플임  토핑 뭘 먹어도 맛있음  다 맛있어서 최애 메뉴가 매일 달라지는중  따뜻할때 먹으면 젤 맛있음 식어도 맛있던뎅  뎁혀 먹어도 맛있음  /댓글 알바가 있나요? 맛없어요. 퍽퍽하고 비싸기만 비싸요. 꼭 드셔보고 싶다면 절대 여러 개 시키지말고 하나만 드세요. 제발/맛있엇어요/시청 온김에 사서 즉석 흡입! 따끈하고 바삭하고 부드럽고 달달하고 좋은 느낌 한가득 담긴 와플 덕수궁 근처 올때 마다 계속 생각날듯/맛있어요 따끈해요/대기시간이 문제임/하… 와플대학보다 맛없음…;/인생 최고의 와플집/살면서 먹어본 와플 중에 최고였어요!!! /림벅와플의 맛과 명성을 기대하고 방문한 후 실망한 점이 많아 리뷰남깁니다 1. 주문 후 와플이 나올 때까지 30분이 걸립니다 (참고로 앞에 두팀이 있었습니다) 2.30분이나 걸린다는 것은 즉석으로 제조한 와플을 제공한다는 의미일터인데 제공받은 와플은 따뜻하지 않고 딱딱하고 퍽퍽했습니다.  30분이라는 시간과 4000원이라는 비용을 투자하여 먹기에는 낭비입니...더보기/웨이팅이 많은 게 손님이 많아서가 아니고 그냥 오래걸려서 였어요. 어쩐지 결제는 바로바로 하는데 기다리는 사람 한뭉텅이 있더라니. . . 웨이팅 팀은  3 팀인데 30분 기다려서 받았네요 우하하 /메이플와플이 가장 맛있어요 줄은 길지만 금방 줄어듭니다/그닥/식은 와플 줄 거면 왜 기다리라고 하는지...변해버림  배가 고파서 그냥 먹는다/맛이 바꼇네요.  림벅와플일 때가 더 맛있었던 것 같아요./냄새도 좋고 바삭하니 먹을만 했어요 ㅎ근처 가니까 먹을정도?/너무 과대평가되어있네요 맛있는 벨기에 와플 먹어본적 없는 방문객들이 만든 거품ㅎㅎ  "
3,웨스틴조선서울 아리아,서울 중구 소공로 106 (우)04533,뷔페,"점심 주중 (성인),저녁 월-목 (성인),저녁 금, 주말&공휴일 (성인),점심 주중 (어린이/유아),저녁 월-목 (어린이/유아),저녁 금, 주말&공휴일 (어린이/유아)",99000,4.0,75,301,"신한 카드 조식먹으러 왔는데 jw가 더 훌륭 커피코너 너무오래걸리고 음식도 뭔가 독특하다거나 그런건 없음 딱 기본정도/비싸지만 호텔뷔페 중 최고,,/케익이 예식장 뷔페수준하고 비슷함. 테이블도 다닥다닥 층고도 낮아서 갑갑./직원분들이 친절하다. 그리고 탄산수 서비스는 진짜 좋았다. 그렇다. 카레가 아주 맛있었다. 스테이크가 말라비틀어지거나 양갈비가 좀 느끼하고 목에 넘기기 좀 그러면 카레소스를 찍어먹으면 맛있다. 인도에서 탄두리가 발달한데는 다 이유가 있었다. 그리고 그릴 칸에 스테이크, 양갈비보다 생선구이가 제일맛있다. 헤쉬브라운 맛이 난다. 혹시나 누가 사준다고 아리아가면...더보기/주말 런치 룸 주말이라 그런지 오픈 대기줄이 좀 있다. 비교적 좁다. 서비스는 당연히 좋다. 있을 것만 있다. 랍스타는 하급 사이즈. 딱히 기억나는 것은 김치와 생크림케익. 끝 /플레이버즈 보단 아쉽고 라세느 보다는 괜찮은듯/조선호텔 아리아 조식~ 재료 신선하고 일반뷔페보다 당연 퀄리티 좋고, 호텔뷔페중에서도 상위급임. 나를 위한 토닥토닥 선물, 강추!/음/생각보다 좁고 번잡했지만 주말치곤 빈 테이블이 꽤 있어서 다행이었습니다. 직원분들 친절하시고 빈 그릇 바로바로 치워주시고 위생에 신경쓰는 모습이 좋았습니다. 메뉴들 사실 평균치 하는 지는 모르겠고요. 중식이나 인도 커리들 핫푸드들은 전반적으로 제 입맛에는 안 맞았어요. 디저트 중에 아이스크림 그냥 소프트 인줄 알았는데 요거트? 맛도 날랑 말랑한 그런 아이스...더보기/아리아는 역시 평일 디너가 진리에요. 사람도 그닥 붐비지 않고, 직원분들 응대도 좋습니다. 대게대신 랍스터로 변경한게 더 좋은거 같아요! 부모님과 맛있게 잘 먹었습니다. /조식 뷔페는 음식 수준이 탑클래스는 아니지만, 직원분들 친절하셔서 다 커버 됨. 지나가시면서 인사 다 해주시고 빨리 잘 치워 주시고 오믈렛이나 쌀국수 만드시는 분들도 친절하심. 음식도 충분히 맛있게 먹었다 생각 들 정도는 됨./직원분들 매우 친절하시고 위치 좋아요./맛있어요:) /서비스는 당연히 좋으나 음식이 가성비가 너무 떨어져요 12월부터 랍스터로 바꾼다 해서 먹었는데 질기고 고기도 미리 초벌했던거를 다시 재탕해서 구워서 그런지 너무 질기네요 확실한건 가격 값은 못한다는 겁니다. 2명 29만원 냈는데 그냥 이 가격이면 오마카세를 가는게 좋을 듯 합니다 /평일런치로방문. 가격대비 가성비가 좀 떨어지는듯.. /몆번을 왔어도 이건 아닌것 같습니다./다른 호텔 뷔페들과 비교했을 때 에피타이저가 압도적으로 맛남. 인도 커리 섹션도 따로 있어서 좋다 /대게가 대개 짜다. 많이 못 먹게 하려는 것 같다.  너무하다. /두번은 안갈듯 디저트가 너무너무 심각함... 알타리김치 해산물샐러드관자 전복구이 양갈비 대게다리 커리난 맛있었음/Reasonalble price (to me) & cozy mood                           -Lee, The king of Samsungdong/서울 3대 뷔페 정리  소공동 롯데>>>조선>>>>>>>>>>>>>>>>>>>>>>>>>신라(시장바닥)/생일기념으로 갔었는데  진짜 대박맛있었어요♡/이가격에 이정도 밖에 못하나? 서울 3대부페라더니 말도 안되는 올려치기라고 생각한다 이 부페는 아무리 많이 봐줘도 주말디너도 최고7만원이면 적정할 수준... 솔직히 7만원도 아깝다.. 이가격에 여기 갈바엔 동대문jw가 낫다 하; 점성어 따위를 12만원 넘는 부페에 깔아둘 생각은 누구 머리통에서 나온건지..? 직원들의 친절함만  수준높다./3대 뷔페라고 했는데 그냥 뷔페에요. 그래서 더 실망한 듯./굿굿/너무실망했어요  리뷰평가가좋아서 갔다가 대실망했네요 음식도분위기도 여러가지다평가해서 가격대비 꽝입니다 리뷰를 자기들끼리쓴거같군요/맛집 ~/새우튀김 맛집/양고기나 스테이크는 플레이버즈 보다 나은데 문제는 처음에 구울때만 맛있고 나중에는 구운걸 잔뜩 쌓아둬서 고기가 다 말라 비틀어져 있네요 아니면 상당히 덜익은걸 급히 네오거나 직원들 교육이 시급합니다/요약 :  아리아 갈때는 이것만 기억하자 ! ⭐⭐️️양갈비 대게 전복 새우튀김 디저트⭐️⭐️ 그리고 육류 스시  그리고 그리고 칠리새우 피자 김치 !  (나에게 쓰는) 팁 :  best5 는 빨리 없어지니 ( 후반부에는  잘 안채워져서 먹지 못함 ) 첫접시 먹고 두번째 접시에 저것들을 안먹더라도 일단 쌓아놓자 ^^  저 구성 한접시 / 디저트 / 저 구성 ...더보기/안심스테이크 양송이스프 통새우튀김 칠리새우 중식볶음밥  개인적인best5 창가자리분위기먹으러가기좋음/아 배불러"
