,name,address,sort,menu,mean_price,score,people_give_score,review_count,review_list
0,카페아르크,서울 종로구 인왕산로 3 위쿡 1층 (우)03028,카페,"아메리카노,라떼,리얼쇼콜라,청포도에이드,라벤다허브티",5600,3.3,47,206,"카페에서 일회용품 규제하지 않나요? 여기 일회용 잔에 주더라구요. 루프탑 반 층 아래 화장실은 왜 이용불가인가요? 1.5층 화장실만 이용 가능인데 화장실 한 칸 이에요ㅋㅋㅋㅋ카페가 이렇게나 큰데. 진짜... 그리고 루프탑엔 그 허리 바닥까지 숙여야만 이용가능한 테이블.... 동네 한옥도 그렇고 인왕산도 보여서 루프탑 때문에 가는 거라지만... 카페의 편의성...더보기/커피맛은 평범 루프탑에서 보는 주변 뷰가 탁 트여서 좋았어요/건물 너무예뻐요 다만 사람이 많은데 앉을 장소가 협소 ㅠㅠ 여름되면 루프탑은 좋을거같아으요/루프탑있다. 끝./커피는 맛있고 자리도 편한데 문이 쪼따시만함/노래가 좋네요^_*/루프탑 뷰도 좋고 넓고 커피도 무난히 맛있었습니다./음 직원분들이 서비스가 정말 별로에요  손님은 왕이다.떠받들어라는 절대 아니지만 기본적인 것도 안하는것같아요  그냥 기분 나빠요  리뷰 안쓰거 싶은데  알았음좋겠어요 그 직원들한테 기분나밨던 손님이 있었다는것좀 /인왕산뷰맛집입니다^^루프탑에서 인왕산뷰가 멋집니다~/뷰는 좋은데 콜드브루가.. 콜드브루가 아니네용/음료는 그냥 그렇고 뷰가좋아요 요즘날씨에 딱 바람쐬기좋아요 /정말 기분좋았던 하루를 여기 여직원 때문에 다 망쳐버렸어요.브라우니를 트레이에 담아서 계산하려고 올려놓았더니 계산대 옆 쇼케이스로 거칠게 던지면서, 음료 시킬꺼냐고 딱딱하게 말하는데 정말 기분이 상하더군요. 그래서 뭐라고 했더니, 바빠서 그랬다고… 바쁘기는 뒤에 딱 한팀있었는데..  미안하다거나 죄송하다는 태도 전혀 아니고, 옆에 남직원분때문에 간신히 참았...더보기/여자직원분 태도 정말 별로고(평일 점심 타임) 커피는 비싼 값에 비해 양이 매우 적고 맛은 평범해요 스콘이랑 쿠키는 밀가루 반죽 맛밖에 안나고 맛없어요 초코쿠키가 맛없기가 쉽지 않은데 말이죠/뭐 사람 많아서 스트레스 받을 수 있는건 저도 잘 알고 있습니다만, 모든 사람한테 거만한 태도로 대하는건 정말 좋지 않은 행동인 것 같습니다. 여직원님.  주문하려고 카운터에 갔는데 “저희 몇시까지인지 아시죠?” 정~말 기분 나쁘게 물어보셨는데 그쪽 영업시간을 제가 왜 알아야 할까요?  보통같으면 영업시간이 20시까진데 이용 괜찮으시겠어요? 라고 물어보는게...더보기/아니 뭔 들어가자마자 하는 첫마디가 저희 영업시간 몇시인지 아시죠? 라고 말하는건 뭔가요. 뿐만아니라 그냥 말하는 말투나 행동들이 예의없고 불친절하네요. 밑에 평들 보니까 예전부터 그런것 같은데 여기는 직원관리 안하나요?  서비스업에서 제일 중요한게 손님응대인데 기분나빠서 올생각이 싹 사라지네요./테라스도 이쁘고 커피도 맜있어요/커피맛 나쁘지 않고 주말엔 모르겠으나 평일엔 한적하고 뷰는 별다섯개도 줄만함  ★ 절대비추 지인에 가지말라고 할 집 ★★ 재방문의사 없음/평범 혹은 그이하 ★★★ 괜찮음 누가 가자고하면 다시감 ★★★★ 맛있음 재방문의사 있음 ★★★★★ 추천 찐맛집/루프탑은 관리가 안되어있고 디저트는 군대에서 먹던 파운드 케이크맛/벚꽃명소/주말 이른 오전에 앉아있으니 좋았어요 :)) 빵식사 굿/커피가 특별한 맛은 아닌것 같아요. 응대하시는분들 좀 지쳐보이시더라구요... /공간은 예쁜데 베이커리가... 빵남긴적처음이에요 커피는 그냥저냥 무난한데 손님중에 인플루언서분들^^이 유난히 많아서 사진찍어야된다구 다른손님들 비키라구 눈치줌 ㅠㅠ헝/음료는 평범하지만 종로에서만 가능한 뷰가 다른 아쉬운 점을 상쇄함/가격 대비 비추 /루프탑에 은행 잔뜩 깔려있고 야외 빈백은 더러워져있고 야외테이블도 음료 묻고 난리남 손님응대 불친절 /실내장식.바깥뷰.루프탑 너무 좋고 커피맛도 괜찮아요. 강추!!/우연히 발견한 곳 뷰가 짱  날 좋은날 또 오고 싶은 루프탑/루프탑 관리가 안되고있는 듯/뷰 맛 집 (여름엔 루프탑 더워요)/커피 맛은 평범한 편입니다 루프탑 공간 물론 관리하기 힘드시겠지만 제가 갔을 땐 쓰레기 때문에 너무 지저분했어요 ㅜ 벚꽃 시즌에 뷰가 예쁠 것 같아요 ~/회사 건물 카페라 그런지 1층은 생각보다 너무 시끄럽고 정신없습니다. 끊임없는 직장인분들 러쉬에 차라리 주말이 조용할 것 같다 싶을 정도입니다. 내부 규모에 비해 너무 많은 직원분들 때문에 전체적인 분위기가 산만합니다.  그러나 이 모든걸 루프탑이 다 만회하고도 남습니다. 가을낙엽과 함께 빈백에 누워서 마시는 커피는 꿀맛. 그치만 추워지면 못가지... 여길...더보기/요즘 같은 날씨에 가기 참 좋은 카페예요. /주변과 어우러진 느낌은 예쁜데 크피는  보통, 파운드케이크는 바스러짐,, "
1,세이지핀치,서울 종로구 필운대로1길 8 1층 (우)03039,카페,"피스타치오 크렘브륄레,크렘브륄레,로제 포모도로,올리브미엘,프레그런트",6900,4.4,30,80,"올리브 미엘 8000원  맛있다 예쁜가게 치고 가격이 저렴하다 생각했는데 역시 양이 적다 점심으로 먹지 말고 반드시 밥 먹고 후식으로 먹으쇼/너무 맛있는데 공간이 너무 좁아요,,! /나만 알고 싶다../최고!! 또 갈게요/두번 갔으나 두번 다 못먹음 자리는 4개 비었던데 혼자 일하시는지 줄은있고  줄 세번째였는데 한시간걸림  애매한 시간에 도전해 보세요/최고/너무너무 예쁜 곳/크림브륄레, 와인한잔 주문했습니다 크림브륄레가 올라가 당연히 달콤하고 맛있었어요 수플레같은 빵은 속이 너무 안익었어요. 엄청 부드러운데 속은 반죽그대로였습니다 그리고 양이 정말 적어서 아쉬웠어요. 플레이팅도 허접했어요. 그릇만예쁩니다 와인은 3입마시고 남겼어요. 와인 너무 별로였습니다. 향은 사과향나면서 산미가 너무강해 신맛과 쓴맛이 강했습니다. 마셨을때 ...더보기/너무 맛있고, 일찍 안가면 웨이팅 길어지니 오픈시간 맞춰 일찍 가는거 추천 진짜 맛있음  맛없다는 사람 왜 맛없다하는지 모르겠음..  처음 간다면 사장님께 메뉴 추천받는 것도 좋을 것 같음 음료는 그냥 물 마시세요..! ㅎㅎ/사람들이 맛있는거 많이 먹고 살면 좋겠다  이런거 맛있다 생각하고 살지 않게... /너무 맛있어요! 후추 올리브오일 이런 조화도 최곱니다☺️☺️/너무 맛있음 ㅠㅠㅠㅠ  빵 치즈 후추 올리브 오일 같은 재료 하나하나 다 맛이 느껴지고 잘 어울림 맛있는 대신 양이 좀 적어서 다음엔 1인 2메뉴씩 시켜서 먹고싶음/무화과와 후추와 꿀의 조화.. 후추는 이렇게 쓰는거구나 했답니다. 입안에 향기로움이 계속 남아서 또 오게 됩니다. 넘 맛있어요./진짜 진짜 환상적인 맛임.. /가게만의 색이 확실한 곳 너무 헤비하지 않아서 좋고 깔끔하고 예뻐요! MFT 는 심플하지만 맛이 매력적이고 올리브미엘은 비쥬얼부터 행복합니당 다음에 다른 메뉴도 먹으러 가고싶어요   *플럼그라스는.. 좀 호불호가 있긴해요....!/너무 기대하고 가서 그런가.. 생각보다 별로 ㅜㅜ 특히 시나몬롤?은 정말 맛없었어요,,,/사장님도 친절하시고 맛있고 분위기 좋고 메뉴 참신하고 가격도 괜찮고 나만의 영원히 있어줬음 하는 곳/밑 리뷰들처럼 분위기도 너무 좋고 맛있었어요! :) /Brunch/맛 분위기 어떤 것도 빠지지 않음 사장님도 친절하시구 ㅜㅜ 헤비하지 않고 산뜻하고 깔끔한 느낌 ! 한 번 가면 또 가고 싶어지는 곳/토스트... 좋아하세요? 친절하고 맛있는 토스트를 경험할 수 있어요 음료도 달지 않아 적당하고 가끔 판매하시는 피넛 버터 쿠키도 맛있습니다! 무엇을 주문하든 성공할 수 밖에 없는 천재 토스트들... 먹으러 가십시오.../식사 사이에 공백시 뭐 먹을까 고민하던 차에 먹었는데 정말 너무 맛있었어요!! 다음에는 친구 데꾸가요!!!/아기자기한 내부, 예쁘고 건강한 맛의 토스트, 그리고 친절한 사장님, 따뜻한 매력의 공간이었음,  다만, 음료가 가격대비 아쉬웠음, 레몬그라스티인가를 마셨는데,  레몬물같은 밍밍한 맛이었음,,/장소는 협소하지만 협소해도 갈만한 가치가있는곳 내부의 소박함부터 토스트의 맛 사장님의 활발한 에너지까지 정감가는곳 다만 토스트가 가격에 비해 양이 부족해 이 부분이 약간 아쉬웠다 한조각만 더 있었으면.. ㅠ/토스트 부드럽고 맛있었고 무엇보다 분위기가 너무 좋아요 사장님도 친절하세요"
2,김진목삼,서울 종로구 자하문로1길 51 1층 (우)03041,삼겹살,"통삼겹살 (150g),통목살 (150g),통항정살 (150g)",15666,4.5,91,115,"직원들이 친절한게 너무좋아요. 테이블닦는것, 불판닦아주는것, 고기새로내올때 후드도 한번닦아주는것들이 다 신경써서 닦는게보여서 청결해보여요. 고기도 너무맛있고 구워주는게 아주좋습니다 굿굿/야미야미 겁나게야미 수요일 저녁 5시 웨이팅 없이 먹음 야미 웨이팅하고 먹으면 별로일듯 온누리상품권 됨 좋아용/역시 진목삼이다 라고 할수있겠어요/맛있긴 한데 요새 이정도 고깃집 많지 않나..?싶은 고깃집. 웨이팅 오래할만한 가겐 아니고 근처거나 대기가 길지 않다면 가보는 거 추천!/죄송하지만 1시간넘게 기다려서 먹을정도는 아니네요 그냥 흔한맛입니다/ㅎ ㅏ 인생 돼지고기집입니다  둘이 가서 십만원 넘게 먹고나왔어여,, 일단 찬들 하나하나 조화롭고 맛깔나고여 고기굽기 장인님들이 완벽하게 구워주시고여 고기퀄리티 미쳤어요 정말 이건 세시간 네시간까지기다릴수있음+ㅁ+ 항정살 꼭먹어봐여 님들/단점: 먹고 메스꺼울 만큼 고기가 안 익음.          손님이 구우려 하면 종업원이 방해함.          먹는데 집중할 수 없을 만큼 자질구레한 규칙.          작은 업장, 바글대는 종업원.   장점: 퀄리티 좋고 맛있는 고기.          다양한 소스류, 잘 갖추어진 밑반찬.  총평: 좋은 식당이지만 굳이 멀리서 찾아갈 만한,     ...더보기/최상의 목살 만점!/친절하고 맛있습니다 긴 대기줄이 관건이지요../너무 맛있어요! /웨이팅만 없다면…! /너~~~~~~무 맛있어서 사진을 못찍음  둘이서 4인분 각자 냉면 된찌 조짐 웨이팅이 좀 있었지만 기다릴만큼 맛있어요 직원분들도 다 친절하시고  고기는 걍… 맛있어요  냉면도 진짜 존맛 ㅠ ㅠ  나만 가게 아무도 가지마삼 /고기 맛있게 꾸워주는 집! 개인적으로 삼겹살을 선호해서 목살은 맛있다고 느낀적이 별로 없는데 여기선 맛있게 먹었어여 그리고 저는 마늘 맨날 태워먹는데 마늘도 잘 구워주심ㅎㅎ/비싸고 맛있는 삼겹살 /평일 저녁에 가서 예약은 안됨 콜키지 프리 가능 존맛탱 & 친절../고기 맛있음_ 삼겹살 추천! 반찬 맛있음_ 다 맛있는데 명이나물이 진짜 맛있어요b 직원분들도 친절! /항정살 너무 맛있고 서버분들도 너무친절하십니다/목살 맛집 ♡/말이 필요없는 맛집  단골이 많아질까 겁나는 곳. 친절과 맛. 모두 최고입니다./부드러운 목살 웨이팅이 않은 편 이다 특별한 고기를 기대한다면 실망할수도 있지만 목살 기본의 맛에 충실하면 부드럽게 씹힌다 항정살은 고기 사이에 지방이 촘촘히 있어 굉장히 기름지고  맛있다 다만  계속 먹으면 조금 물릴수도/고기는 다먹어버림 외쳐 갓갓갓/JJMT/인생 돼지고기집 탑2 중에 하나./그냥... 미쳤네요... 너무 맛있어요.. 갈치속젓 훔쳐가고 싶은 맛../존맛탱이에요..ㅠㅠ/말해뭐해 존맛 /쥬ㅕㄴ맛탱 삼겹살 먹은것 중 제일 맛있었음 2인분 절대 모자르고 2인 4인분부터 먹어야 할 듯. 입 짧은 친구랑 가서 사진 찍는것도 잊고 다먹음. 친절하심. /진짜 계속 생각나는 맛이에요. 무엇보다 서비스가 최고에요. 손님으로 와서 기분좋게 돈 아깝지않게 쓰고 갈수있어요. 너무 맛있어요.,,/존맛. 양 적고 웨이팅 필수이나 그만한 가치가 있음. 삼겹살이 최고. /웨이팅 관리가 엉망입니다"
3,스태픽스,서울 종로구 사직로9길 22 102호 (우)03027,카페,cake,6900,3.3,120,536,"날 좋은 평일에 가면 더 좋을것 같아요 음료는 그저그랬어요 커피는 산미 생각보다는 규모가 작았어요 야외 좌석있어서 좋더라구요 전체적인 분위기는 예뻐요 한번쯤 가보기 추천 반려견 동반에 주차 가능해서 그부분때문에 많이들 오시는듯해요/마당에서 바람 쐬며 앉아있기 최고. 근데 실내가 너어어어어어어무 시끄럽고 디저트류가 파운드케이크 딱 하나임. 음료 늦게 나옴 날 좋아지면 하늘 보며 누워있는 용으로 다시 가볼 것 같긴 함!/아늑한 나무와 view 그것으로 최악의 커피는 대체했다./영업안함/식음료 보다는 야외공간, 참새구경이 주 컨텐츠./응대가 좀 별로였다. 커피 양도 너무 적고 브라우니 사이즈도 왓더 뭘 보고 가시는건진 모르겠다만 내가 갔을땐 흐려서 바깥풍경을 즐기지도 못했다. 옆자리 분은 노트북 꺼내자마자 직원분께 나가달라고 요청받음./커피도 케익도 너무 맛없어요…/이렇게 맛 없는 커피는 처음이예요... 반려견이 있다면 모를까.... ㅠ/아늑하고 편안한 공간이 좋습니다. 평일에 가는 걸 추천합니다. 주차 표시가 되어있는데 바로 옆이 카페 주차장이 아니라 민영주차장입니다. 할인없이 시간당 3,000원씩 받으니 참고하세요. 카페나 주차장 입구나 안내가 없어서 남깁니다. /커피는 별로지만 초창기 공간이 주는 매력은 정말 최고였습니다 ㅠㅠ 지금은 너무 붐벼서 매우 비추/사람 많으나 마당과 전망이 좋아서/스태픽스는 언제나 굿/커피는 그닥이지만(특히 아인슈페너) 마당이 끝내주는데요... 하지만 인기 많아져서 그런지 갈 때마다 사람들 바글바글해서 이제 그것마저도.../무난한 커피/날 좋은 날 +사람 없을 때 가면 최고 ㅋㅋ 2020 봄 방문/커피 쏘쏘 파운드케이크 좀 많이 퍽퍽  하지만 분위기는 최고 !/은행나무뷰가 이쁘네요ㅎ 여기저기 인증샷!!난리가 났네ㅎ/오늘가지마세요 촬영한더고 대관해서 영업안함  그리고 촬영이 유세인가 ㅋㅋㅋ 방송귝 갑질들어봐도 요새도 그러도 다니는지 몰랐네 골목도 대여했나?ㅋㅋㅋ /날씨가 다했지만 그래도 조하요/인스타빨인지 앉을자리도 없음. 뷰가 좋은것도 아니고 볼게 있는것도 아니고 커피맛은 그저그렇고 파운드케익도 평범. 자리도 불편해요~/규칙이 더럽게 많음. 그와중에 입구 찾긴 더럽게 어려움. 커피는 핵 맛없음. /생각보다 갬성없고 돗데기시장같음 사장님 친절하시고 파운드케이크 맛있움/마당이 예뻐서 가는 곳/주말에오고 불만족스러워서 평일 낮에 다시 와봤는데.. 역시나 사람 넘 많고 자리잡기 어렵고 음료는 정말 늦게 나옵니다. 커피나 맛있으면..   뷰는 좋지만 다시는 안올듯..../사람이 정말 많아요  무엇보다 음악소리가 너무 크네요 /서울에서 이런 분위기를 느낄 수 있는 곳이 거의 없죠! 야외 정원 너무 좋습니다. 하지만 커피는 너무 맛이 없어요. 바닐라 라떼가 이렇게 맛 없을 수가... 다음에 가게 된다면 에이드를 마셔야겠어요! /평일 낮인데도 사람 진짜 많네여 초코 파운드 케이크랑 아메리카노랑 아인슈페너 시켰는데 케이크 진짜 맛있고 커피는 신맛이 너무 나서 맛이 없었어요. 신 원두는 라떼로 먹으면 맛있다는데 라떼 먹을 걸..../주말이라 밖에는 자리가 없어서 안에 앉았는데 커피 나오는데 30분... 기껏 받아서 마신 아메리카노는 산미가 너무 강하고 탄맛도 많이 나서 절반도 못 마셨네요 음악소리는 왜 그리 큰지 술집에서도 이렇게는 안 틀어놓겠네 싶은 정도.. 괜히 인스타보고 갔다가 돈낭비 시간낭비 했네요/나오자마자 쏟아버린음료.. 하지만 정말 친절한 직원언니들 ㅠ... 바로와서 옷걱정해주신담에 다시 가져다주셨어요.. 진짜 죄송했어요 ㅠㅠ.. 넘 감사합니다.. 너무 좋은기억만 또가야지...ღ ʕ̡̢̡•̫͡•ʔ̢̡̢ ღ..하트/사람 엄청 많네요~ 근데 좋았어요 ㅋㅋ/커피는 못먹을 정도는 아니고 사람 정말 많지만 사진이 취미라면 몇 번 들를만한 곳이에요. 직원 분들 친절한건 모르겠어요. 사람이 너무 많아서 음료 제조하시느라 주문 받으려고 기다리는 손님들은 거의 신경을 못쓰시더라구요./가는길이 힘들었지만 직원분들 너무 친절하시고 얼그레이라떼 너무 맛있게 잘마셨어요 :)"
4,도취 하녹식당,서울 종로구 사직로9가길 12 1층 (우)03027,한정식,"도취식 만월 맡김차림,도취식 상현달 맡김차림",55000,4.3,12,19,"맛은 있는데, 인당 6.5 내고 먹을 인테리어나 메뉴판 상태는 아닌것같아요ㅎㅎ/엄마랑 정말 맛있게 먹고 왔습니다 ~~ 양이 적을까봐 걱정했는데 아주 배부르더라구요 ㅎ 음식 설명도 좋았고 친절했어요.  눈도 입도 즐거운 식사였습니다. 다음에 또 갈게용 :) /상현달 맡김차림으로 예약하고 방문했습니다. 음식이 깔끔하고 좋아요 반찬도 깔끔하고 후식까지 굿이네요 엄마 모시고 갔는데 좋아하셨어요~~ 재방문하고 싶네요!!/장모님 생신날에 예약하고 방문했습니다. 분위기도 맛도 너무 고급스러워서 감동이네요. 장모님께 좋은 기억을 남겨드릴 수 있어서 좋았습니다. 번창하세요! 또 방문하겠습니다./Korean/1. 음식 간이 너무강함. 코스 처음부터 간이 짜서 놀랐음 2. 화장실 매우불편 천장높이가 낮아서 고개를 숙여서 이용해야함 3.가격 생각하시면 솔직히 비추천 4.디저트 맛있음 5.친절하심/가격대비 매우 훌륭해요! 요리 모두 맛있고 세팅도 신경 쓴 느낌 간이 살짝 세고 오히려 캐주얼한 분위기라 친구들이나 연인과 오기에 좋지 연세가 있는 분과 오기에는 비추에요~/가족이랑 같이 방문했는데 가게분위기 차분하고 음식들도 다 맛있었습니다 과하게 배부르지않는. 딱 좋은 포만감 느끼고 왔습니다/저녁코스로 먹었는데 모든 구성이 알차고 맛있었어요! 양도 엄청 푸짐했고 서비스도 넘넘 좋습니다..bb"
