,name,address,sort,menu,mean_price,score,people_give_score,review_count,review_list
0,효뜨,"서울 용산구 한강대로40가길 6 1,2층 (우)04382",베트남음식,"효뜨 샐러드,짜조,튀긴계란,쉬림프 파파야 샐러드,냉분짜",10200,0.0,0,0,
1,손문 대구막창갈매기살 용산점,서울 용산구 새창로 213-9 (우)04376,"육류,고기","차돌박이 (150g),꽃등심 (150g),안창살 (150g),생삼겹살 (150g),생목살 (150g)",24800,4.2,48,120,"막국수가 진짜 신의한수/갈매기살, 돼지막창 먹어봤어요 엄청나게 특별하다 하는 맛은 아니었지만 용산에 왔을 때 양념된 고기가 먹고싶다! 또는 갈매기살과 돼지막창이 먹고싶다! 할 경우에는 이 가게로 와서 먹을거 같아요 ㅋㅋ 갈매기살과 막창이 이미 다 익혀진채로 나와서 먹기도 편했구, 서비스로 주시는 비빔국수와 된장찌개, 기본으로 나오는 미역국까지 전부 맛있었어요 :D  단점이라면 환...더보기/그냥그래요/진짜 짱짱짱짱 맛있다.. 서비스로 주는 막국수도 존맛이고 고기도 다 구워줘서 진짜 편하다.... 너무너무 맛있어서 흡입했어요 ㅠㅠㅠㅠㅠㅠ 또 갈거애요.. 닭갈비도 마싯음 ㅠㅠ 2호점이 더 깔끔해서 추천 ㅎㅎ/아무리 봐도 갈매기살이 아닌 거 같습니다만... 그냥 la돼지갈비 사드시는 게 가성비 좋을 거 같습니다 그저 그랬어요/맛있지만..조금 물렸다 - 갈매기살 (좋음) - 막창(아쉬움. 좀 작다..?)/가려던곳이 닫아서 그냥 들린건데 진짜 맛있음 사람은 항상 북적이고 갈매기살 꼭 먹어야됨/조금 느림 맛있음/말해뭐해 몇년째 단골입니다 용산역 하면 여기부터 생각나요~~/갈매기살이 약간 양념갈비맛?달달한 맛이라 막창보다 좀더 제 취향이었고 같이 먹었던 친구들 다들 맛있다고해서 오랜만에 행복한 시간 보냈습니당 막국수도 서비스라 넘 좋았어요 굿굿/넘맛있음 갈매기살 구워주시고 입에서 살살녹음 가격도저렴함 비빔국수에 싸먹으면 입에서 더녹음.. 존맛탱 재방문의사있음/막창이 훨씬 더 맛있습니다. 다 구워주시는 것고 편하고요. 갈매기 살은 부드럽고 단 갈비맛입니다. 같이 나오는 막국수도 조화롭습니다./맛있어요/여기 두번 방문 모두 성공입니다. 맛+서비스 다 좋아요~~/평점 왜케 높죠ㅠㅠㅠㅠ 갈매기살 넘 심히 달았고 비빔국수는 그냥 그렇습니다. 막창은 맛있어요! /너무 맛있어서 고기 먹다가 중요한걸 놓친 날./대구 막창 맛있음 개인적으로 갈매기살보다 취향/맛있네./갈매기살, 막국수 맛있음 많이 번잡함/와 진짜 맛있어요!! 막창도 맛있긴 한데 저는 갈매기살이 더 취향이네요 입에서 살살 녹아요 쟁반국수 싸 먹으니까 더 맛있어요/진짜 맛있고 직원분들 친절해요~ 국수가 너무 맛있어서 재주문했는데 늦게나와 말씀드렸더니 서비스라며 한그릇 더 주셨어요!! 재방문의사99% ~~ 맛있게 잘먹고 갑니다 :D/맛있어요/존맛/그냥 그랬어요/진짜 맛있었어요.  대기가 있었는데 가치있었어요.  시끌벅쩍 술마시면사 고기먹기 넘 좋았어요 ^^ /껍데기 최고../맛있긴 한데,, 걸레로 테이블 닦는거 보고 기겁 ㅠ/갈매기살이더맛있음 막창은 걍 평범 막국수도 맛있어요 /다 구워주고 올려줌. 맛있음/내 입맛엔 갈매기살 보다 막창"
2,현선이네 용산본점,서울 용산구 한강대로39길 2-13 (우)04376,분식,"현선이 콤보 세트,떡볶이1인분+순대1인분+튀김1인분+김밥1인분+오뎅1인분+쿨피스(대),4,000,4,000,15,000,10,000,4,000",18000,3.2,119,318,"떡볶퀸 유튜브보고 갔는데 거기서 설명하는게 가장 정확해요  순한맛이랑 매운맛이랑 맛이 다르고 제 입맛에는 순한맛이 더 맛있었어요 매운맛 진짜 매워서 다 못 먹었어요 . . . 엽떡 오리지널보다 더 매워요 무진장 빨리 나오고 튀김도 미리 만들어서 식힌거라 천천히먹어도 바삭하고 맛있음  순대는 그냥 순대. 내장 허파는 없는듯/세트메뉴 먹었어요!/술에 분식 가능인거부터 일단 별다섯개^ㅠ^ 정석적인맛, 기본에 충실한 맛 엄청 맛있다! 이건 아니었는데 자꾸 생각남… 2단계였는데 하나도 안매워서 다음엔 매운맛 먹을꺼임!!/소주에 떡볶이&분식 가능해서 좋아요 ㅎ/세트 구성도 좋고 맛도 좋은데 너무 짜요ㅠ 떡볶이랑 어묵국물? 너무 짜더라구요 그것만빼면 다 괜찮은거같아요 /본점이라서 가봤는데… 지극히 평범. /맛에 비해 비싸요/떡볶이는 매운편! 튀김맛집ㅎ/혼자 먹기에도 괜찮은 떡볶이/모두가 인정하는 떡볶이맛집 늘 맛있어요./진짜 최악이네요. 가격이 싼 편도 아닌데 하나부터 열까지 모두 셀프에요 ㅋㅋ 즉석떡볶이를 시켰는데 후라이팬부터 국자랑 모든걸 제가 가져와야하는게 별로네요ㅋ 그냥 매장에서 먹지말고 배달하라는 의미인지뭔지.. 다신 안올거같아요/굿/맛있음 /말해뭐해... 난 이 집 좋아한다/배달이 워낙 잘 되서 그런지 홀에서 먹거나 포장할 경우 불친절 경험 가능. /처음에는 매운맛 떡볶이를 시켰는데 생각보다 너무 매워서 반도 못 먹고 남겼습니다.  저는 원래 매운맛을 잘 먹는 편인데 엽떡 오리지널보다 훨씬 맵습니다. 두번째 방문했을때는 매운맛+ 순한맛 반반 섞어서 먹었는데 정말 맛있었어요 ㅎㅎ/음식위에 영수증을 올려주는 위생 아무도 QR코드 찍으라 하지 않네 가격도 이미 동네 파스타집서 먹는것보다 비싸고/좋아하는 밀떡 분식집. 출출할때 호다닥 먹기도 좋고 술먹고 2-3차로 국물떡볶이에 소주 한 잔 마셔도 매우 좋습니다! 다만 중간맛도 많이 매운 편이니 매운거 잘 못드시는 분은 순한맛으로 ㅠㅠ 순대도 맛있어요!/배부른 분식점/떡복이 뿐만 아니라 어묵이나 튀김 순대 수준이 평균 이상이라 맘에 듦 떡볶이도 맛있음  /쫀맛!!!!!/맛과 양 평범 다만 분위기가 일 끝나고 분식에 맥주 먹기 좋음/가격은 비싸지만 흠없는 맛집 숭실대점만 가봤는데 본점이 훨씬 맛있고 매운맛보단 오리지널이 더 맛있다 매운맛이 숭실점은 기분나쁘게 매운데 여긴 적당히 맵고 맛있었지만 오리지널이 훨씬 맛있어서 굳이 매운 맛 먹을 필요 없을 듯 바빠서 그런지 불친절하고 전체적으로 비싼 거 빼고 맛만 생각하면 맛집임/떡도 그렇고 떡볶이에 들어있는 어묵 영 아님 제대로 된 어묵쓰면 떡볶이맛도 좀 나아질듯/그냥 그래요 양대비 가격이 비싸요. /기대만큼은 아니다/냐미냐미 매웁다/양이 적음 /정말 맛있고 음식이 엄청 빨리 나와서 좋아요 오징어튀김 떡볶이랑 궁합 굿 양이 적고 노래가 너무 시끄러움 근데 그게 여기 컨셉인듯 내 취향이 아닐 뿐/즉떡 내용물이 부실하고 양도 적은편..떡은 다 먹을때까지 간이 안베고.. 쫄면, 볶음밥 추가했는데 30분이 지나도록 안나옴;;;;;; 얘기했더니 옆테이블에 가져다줌??! 볶음밥은 테이블위에 있고..ㅋㅋㅋ 손님끼리 해결하라는건지 멀뚱히 쳐다봄 그 테이블 손님왈, 손 안댔다고 먹어도 된다고ㅋㅋㅋㅋㅋㅋㅋ니나먹어라  코로나가 만연하는 이 시기에 지들 신나게 수다떨...더보기/분식떡볶이!/맛은 글쌔 ... 맛도 변하고 가격도 변하고/여기가 떡볶이집중 젤기본인 학교앞 옛날떡볶이 맛이고 젤 맛남 그담이 반포애플이랑 신당동  시켜먹는건 요즘 신전떡볶이 신사점에 빠짐/너무 친절한 직원! 코로나때문에 밖에서 쪼그려서 먹었는데 중간중간 매장갔더니 계속 모자른것 없냐고 물어보시고 챙겨주신다.  순한맛은 달기만해서 아쉽고 중간맛이 딱좋다. 김밥맛있고 어묵도 맛있음!"
3,일일향,서울 용산구 한강대로40길 26 2층 (우)04386,중화요리,"짜장면,깐풍기 (2~3인기준),육즙 돼지고기 탕수육 (2~3인기준),오렌지 크림새우+호두 (2~3인기준),어향동고 (2~3인기준),마파두부밥",25500,3.7,58,11,"짬뽕밥 당면이 거의 생당면 수준으로 안익음 간짜장은 짜장소스가 떡 수준 꿔바로우는 시킨지 2-3분 만에 나온듯? 미리 튀겨놓고 다시 튀겨주는건 이해하겠다만 씹자마자 돼지고기 냄새가 미친듯이 입안을 지배함 ㅋㅋㅋ 2만원 가까이 하는 금액 누가 사준대도 안감/맛있게 잘먹었어요  육즙탕수육 정말 맛있음/3만원 코스양이 작아요. 탕수육은 돼지고기 냄새가 심하고. 친절하지만 다시는 안갈거 같아요. /매니저님덕에 기분 매우 상하고 밥먹고갑니다/일일향 강남 언주 송파 그리고 여기까지 총 4곳 경험해봤는데 ㅠㅠㅠ 음 개선이 필요할것 같아유…. /매니저 같은 남자 ㅈㄴ 재수없음.. 음식점이 벼슬이냐? ㅈㄴ 어이없네 점심에 사람 많아서 유세 부리는 건지 이렇게 재수없는 거 처음보네/맛은 ㄹㅇ 장난 아니다 특히 탕수육 비싼데도 많이 먹어봤는데 원탑임... 하지만 4점 준 이유는 직원들이 불친절 볶음밥 하나 추가시키려는데 계란후라이 들어간거 있고 안들어간거있다고 똑바로 말하라고 혼내심 나이도 어려보이는 직원이/최근 후기 두개가 답이였네요.  음식은 무난한 맛이었으나 서비스는 0점이네요.   큰 대접 바라는건 아니지만 기본적인 서비스 마인드는 갖추고 영업하셨으면 하네요.  구구절절 말 안하겠습니다. 그냥 체인점 수준 음식 드실려면 가셔도 되나   요리 3-4만원짜리에 식사까지 둘이 5-6만원치  먹는데 동네 분식수준의 서비스받는건 싫으신 분들은 다른데 가세요~/신용산 일일향 지배인님. 별 하나도 아깝네요 예약응대랑 실제 식당도착했을때 말 다르고 대책 간구는 커녕 손님 식사 불편하게 만드네요. 아쉽습니다. /2시전에 도착햇는데 2시까지하는 런치메뉴는 안된다고 하네요 주방이내렷다고... 근데또 다른메뉴는 된다하시고 ...이럴거면 왜 런치2시까지로받는거죠/진짜 맛있어요. 넘사벽 중국집.  요리는 유린기, 탕수육, 어향동고 추천~ but, 멘보샤는 타중식당보다 간이 쎈듯하여 비추.../코스요리는 비추/볶음밥 짜지않고 담백해서 좋았고 면종류는 맛있는데.. 양이좀 적어서 아쉬웠습니다./탕수육 b/1월26일-28일 광고네/점심정식 2.9만원짜리 양도 적고 가성비 최악. 둘이 가서 어른정식(1.5만원선) 2개 시키는게 돈 아끼는거임/주문 누락이 크게 아쉬웠음. 자장 짬뽕 아쉬웠고 볶음밥과 요리는 매우 맛있었습니다./정말맛있어요 짬뽕진짜좋아하는데 맛집 탕수육도 바삭하고좋아요/분위기도 좋고 맛도 최고에요! 너무 짜거나 느끼하지 않아서 좋았어요 :)/어항동고? 표고버섯에 새우살을 채워넣은건데 새우 완전 가득이고 식감도 맛도 너무 좋았다^^ 개인적으로 유린기도 추천!!/여기 중국집은 분위기도 고급지도 맛도 정말 최고에요 짬뽕은 정말 역대급맛집!! ㅎㅎ 탕수육도 맛있어서 주변 친구들도 다 극찬~~!!! 또 가고픈 맛집/추운날에 짬뽕먹으니까 속이 뜨끈하니 너무 좋네요. 가게 깨끗하고 음식 맛있네요~/중식 맛집 분위기도 좋고 짬뽕 얼큰 개운합니다 !! 해장은 항상 이집에서 해요 ㅎ 없으면 안되는 집 !! /여기는 진짜 짬뽕이 최고인거같아요 ㅠㅠ 해산물 잔뜩있고 국물도 얼큰하니 진짜 맛있어요/짬뽕이 맛있다고해서 먹어봤는데 얼큰하니 끝내주세요!/너무 맛있는 중식당집 ㅠㅠ 요리가 너무 맛있어요 같이시킨 짬뽕도 정말 국물 끝내주네요ㅠㅠ 너무 맛나요!!/아는분 추천 받고 왔는데 국물이 진짜 딱 제스타일...  얼큰하면서 너무 맛있어요 ㅋㅋ 탕수육 고기도 엄청 두툼해요 ㅋㅋ 아이들이 맛있다며 좋아하네요!/얼큰한 짬뽕국물에 바싹한 탕쓕~~~  역시 사랑이네요 애들도 짜장 별로 안좋아하는데 한그릇 쓱 하네요 굿뜨^^/짬뽕최고/볶음밥은 맛있네요 탕수육은 고기는 좋으나 소스가 약함/처음 가봤는데 좋네요. ^^"
4,북천,서울 용산구 한강대로38가길 7-2 (우)04386,"돈까스,우동","브라운돈가스,로스가스,화이트돈가스,가스오우동,크림우동",9400,3.9,94,105,"이상하게 가끔 생각나는 맛/가격도 많이 올랐고 예전 맛이 아닌거 같아요... 아쉽네요 /초반에 왕맛탱이었는데 두-세번째 재방문에 평범해져서 눈물 찔끔 /삼각지역 3대 트레저:  전쟁기념관 쿼츠 핸드브루잉 커피 북천 브라운돈까스    사유: 데미글레이즈 소스 자체가 세대를 걸려 이윽고 완성된 것과 같이 녹진하고 생수를 퍽 쓰지도 않은 덕분으로 점도 있는 스프처럼 마냥 폭신함이 있다. 커팅까지 흠 없이 잘 되어 있으며 웨이팅 시 선 주문하고 자리로 들어가면 이미 사이드 반찬 둘이 셋팅이 끝나 있고 생수통 또한...더보기/최애돈까스집 가격이 많이올라서 다소아쉬운가게 그거빼고는 거의깔게없음/로스/매장이 협소하지만 시스템이 잘되어있고 회전율 좋아요. 돈까스가 맛있습니다./삐빅! 삐빅! 삐빅! 삐빅!/별점 높은분들은 관계자인가요? 아무데나서도 먹을수 있는 그런 평범한 맛인데 웨이팅이 왜케 긴지 의문이었으나, 생각해보니 인근에 돈까스파는데가 거의 없네요/브라운 빼곤 별로라 업그레이드 요망.. ㅡㅡㅡㅡㅡㅡㅡㅡㅡㅡㅡ 2천원씩 오르고 맛탱이감/고기가 엄청 두툼한데도. 완전부드러움 대박임요 내가찿던 수제소스맛 셋트에 나오는 우동은. 양은 적은데 깔끔하고 맛있음요 맛집검색으로 왔는데 선택잘했음요 운 좋아서  골목 주차 할수 있었음요 /맛은3.8정도인데 가격대비 맛하면 3드립니당/브라운돈가스는 소스뿌려져서 나오고 과일소스맛도 난다 로스인가 그건 소스 매콤소스로 따로나옴 둘 다 맛있다!/여기 웨이팅 있는데 개인적으로는 그 정도까지는 아닌 것 같아요... 메뉴 중에는 브라운돈까스 추천합니다/브라운돈까스!!!!!!!!/진짜 진짜 진짜 맛있어요/돈까스 냠냠/고기 왕 두툼하고 보기보다 느끼하지 않음 인기 많은데도 초심 잃지 않는 곳 너무 일찍 매진되는 것이 유일한 단점 ㅠ /그냥 그저 그래요../음.. 줄서서 가실 정도는 아니에요~ 제 개인적인 돈까스 맛집 순위는 아래와 같습니다. 돈가스팔월 > 정성돈까스 ≥ 북천 특히 팔월의 안심가츠는 꼭 드셔보시길!!/맛있어요! 고기 두툼하고 소스가 약간 특이하고 맛있어요. 서비스 좋고 소스 나중에 생각나서 다시 찾아올거 같아요. 근데 막 와 역대급 존맛! 이정도까진 아님. 별 하나 뺀 이유는 가격에 비해 너무 분식집에서 먹는 분위기고 수저 반찬 다 셀프에요. 그리고 이렇게 튀김옷이 다 떨어져서 하나 뺐어요. /맛있는데 튀김옷 고기가 분리되는 점, 고기도 두껍지만 튀김옷도 두껍다는 점만 빼면 좋음/소스가 마약적 근데 막 다시가고싶을 정도는../생각보단 평범/두툼한 맛있는 돈까스! 튀김옷이 막 바삭하진 않음/로스까스 추천해요. 고기가 부드럽고 튀김 옷이 바삭합니다.튀김류는 금방 물려서 많이 못 먹는 편이고 돈까스는 특히 다 못먹고 남기는 편인데 북천 돈까스는 한그릇 싹싹 비울 수 있어요. 돈까스가 머금은 기름의 양이 적고, 후추 맛이 강한 편이라 그런 것 같고, 생강초를 같이 줘서 느끼할 때 쯤 깔끔하게 잡아주는게 좋습니다. 다른 식당과 같은 브라운 소스처럼 ...더보기/화이트 돈까스는 크림소스랑 꽤 잘 어울려서 깜놀. 다만 하나 다 먹다보면 조금 느끼해서 할라피뇨 필수. 화이트는 크리미한거 잘드시는분은 혼자 하나 드시고 아니면 두명이상이서 쉐어하시길. 브라운돈까스는 고기질 좋음. 이런 스타일에서 이런 고기맛이 나나 싶었다. 거기에 풍부한 소스랑 조화가 넘나 잘 어울리는게 호.  셋트우동은 쏘쏘. 돈까스자체가 양이 많아서 ...더보기/북천 4점 가자/브라운돈까스 세트 먹음!  종업원 분들 다 친절하셨고  우동, 샐러드도 맛잇고  돈까스 소스도 진해서 내스타일, 경양식 돈까스인데 굵기가 엄청 듀꺼움! 고기 밑간이 너무 좋음!  재방문의사 충분!/가게는 잘 못 없다. 정한 애 잘못임.   주차 공간 없음/ 피크타임 아님+가게 근처를 포기하면 걸어서 10분 내외 공간에서 한두개씩 노상주차 자리가 보이긴 함/ 소스따로는 요청하면 해주심/ 서울 3대 돈까스라는데 그런건 누가 정하는지도 모르겠고, 무슨 기준 인지도 모르겠는데.. 암튼 밑간은 후추간이 좀 쎈편이라 나는 좋았고~ 바삭하게 잘 튀겨지고 기름 잘...더보기/평범하네~~/양도  푸짐하고 가격도 적당해요 맛있게 잘 먹었습니다~~"
5,중화가정 용산역점,서울 용산구 새창로 213 (우)04376,중화요리,"짜장면,짬뽕,볶음짬뽕,게살짜장밥,깐풍기(S)",7800,3.1,30,23,
6,버뮤다삼각지,"서울 용산구 한강대로52길 19 1,2층 (우)04382","멕시칸,브라질","타코,1. 초리조 타코 2. 소고기 타코 3. 새우 타코 4. 갈비 타코 5. 칠리 타코,폭립플래터,추천,16,000,16,000,16,000,16,000",24800,4.4,79,157,"여기는~!!!! 진짜다  손님 오면 초대해서 가는 곳 넘나 존맛탱/맥주랑 쭉쭉 들어가는 맛  몇년전에 갔던덴데 아직두 건재하게 있당  맛있어요 사장님 먼가 힙해 /자극적인 맛. 맛있구 가성비는 좋은데 음악이 좀 커서 대화할 때 조금 크게 말해야해요/전 폭립 너무 맛있었어요!! 직원들 엄청 친절하시구/립 맛있어요 짱ㅁ장짱  칵테일 짱 직원들 엄청 친절하고 worth waiting/오잉 맛있고 친절하기만 한뎅?  근데 느끼한 거 항마력 딸리는 분들은 할라피뇨 요청하시용 /웨이팅할 정도 전혀 아님 아웃백 폭립이 더 맛잇음 소스 맛 너무 강함 ㅠㅠ 그나마 점원분들 친절하셔서 3점/걍한식느낌/맛이 없지는 않은데 매우 한국패치된 맛. 현지 스타일의 맛있는 타코 엔칠라다 등을 먹은 적이 있다면 절대 기대하지 말 것 폭립 등 요리 전체적으로 단 맛이 강함/평이 좋아서 왔는데 기대이하여서 조금 당황스러웠어요 맛이없는건아닌데  엄청 익숙한맛이어서 뭔가 생각해보니 회사 급식 불고기 딱 그 맛.. 엔칠라다에도 퀘사디아에도 같은고기가들어있는/진짜 너무너무너무 맛있어요…(하트)/엔칠라다 진짜 맛있고 크림파스타도 꾸덕하고 짱맛이었어요. 알바생 분들도 친절합니다. 담에 여러명이서 고기 뜯으러 가야지./웨이팅 길긴 한데 기다릴만한 가치 있었어요! 특히 샐러드가 제 입맛에 정말 잘맞더라구요 재방문의사 100% 있습니다 :D/웨이팅 길지만 (일요일 5시30분에 가서 1시간 웨이팅)기다릴만 하다고 생각합니다. 정말 맛있어요! 내부 테이블이 몇개 없어서 웨이팅이 좀 더 긴 것 같긴 한데, 들어가서 먹을때는 쾌적해서 좋았네요!/개맛있음 인정한다/친절의끝판왕  나가는 끝까지 친절하시더군요  대단합니다 /28,000원짜리 폭립주니어의 양이 상당히 많다. 고기를 잘 구웠는지 살이 잘 발라진다. 고기양에 비해 콘샐러드가 작아서 먹다보면 다소 느끼해지니 약간의 조정이 있으면 좋겠다. 2층으로 돼있는데 분위기가 좋고 웨이팅이 있는 편이다. 그래서 테이블 이용시간이 1시간 40분 제한이 걸려있다./대기4팀인데 1시간 30분 웨이팅 참고하세요/폭립이 고기가 많이 붙어 있고, 연해요 2명이 먹기에 충분한 양 퀘사디아도 맛나고!/이걸 음식이라고 내놓나?  통조림, 조미료 병맛~~/분위기는 기대이하 그러나 맛은 기대이상  반전의 핫플, 다른메뉴들도 궁금해짐  ★ 절대비추 지인에 가지말라고 할 집 ★★ 재방문의사 없음/평범 혹은 그이하 ★★★ 괜찮음 누가 가자고하면 다시감 ★★★★ 맛있음 재방문의사 있음 ★★★★★ 추천 찐맛집/폭립, 간이 딱 좋고 고기 야들야들. /스파게티 존맛ㅠ 전반적으로 양 많고 다 맛있음. 가격 비싼편이지만 그만큼 많이줌 ㅋ 공간이 너무 허름함 먼지낀 느낌../퀘사디아 너무 맛있고 전반적으로 맛있고 양도 많아요/나초는 기본안주? 웨이팅 쩌는데 먹어보니 이유를 알겠다 등뼈고기? 단짠 미쳤다 해외출장 잦은 남친도 인정한 제일 맛있는 고기.. 양이 개많다 삼겹살 4인분에 맥주2병에 밥볶아먹는데 여기서는 메인요리 두개에 쥐쥐침/폭립플래터 한 개 먹었는데, 맛있지만 어디서 많이 먹어본 소스의 맛입니다. 감자튀김이 더 맛있음. 시즈닝이 이색적인 향과 맛인데, 중독성있음. 나오는 시간이 조금 길지만 분위기 좋고 꽤 괜찮아서 재방문 의사 있음/맛있고, 양도 좋고, 만족함.  단, 소고기가 좀 질겨서 약간 아쉽지만 만족!/알바직원분들  친절함 ./나초부터 시작해서 다 맛있음 다...! 버섯무덤파스타는 진짜 버섯 왕창 쏟아부어준다 새우도 많이 줌.... 그리고 바쁜데도 엄청 친절하심 다음에는 폭립먹으러 올거야 /폭립 미쳤어요 !!/이게 폭립이구나"
