,name,address,sort,menu,mean_price,score,people_give_score,review_count,review_list
4,앤트러사이트 합정점,서울 마포구 토정로5길 10 (우)04073,커피전문점,"아메리카노(HOT),카페라떼(HOT),플랫화이트(HOT),카페모카(HOT),카푸치노(HOT)",5500,3.5,132,235,"직원분께서 왜이리 화가 나 계시는지.. 전 모르겠어유.. /그냥저냥 괜찮아요/커피는 나쁘지 않은데 계산하시는 직원분...불친절해요/본인 기분 나쁜 티 팍팍 내는 응대를 하면 저는 여기가 잘 안되기를 간절히 바랄 수밖에 없어요ㅋ/직원의 지친 기색때문인지 불친절함..이것또한 컨셉일까..?/레몬마들렌 맛있어요/디카페인 팔아요/맛있고 분위기도 굿!!/힙해 세상힙해서 기분좋았어요 엄청넓구 커피도 맛있어요 ㅎㅎ 한번 화장실에 갇혔었는데 친절하게 구해주셔서 감사했어요 ㅠㅠ 아무튼 공간 자체가 재밌는 곳/매장 컨셉은 호불호가 갈리지만 커피는 맛있었습니다/넓은 공간에 맛있는 커피 디저트는 쏘쏘/굿굿 좋아요/감성 즐기러 가는 곳!  평일에 가도 사람많고 주말에는 비추에요!  드립커피 양보고 좀 놀라긴 했지만 아메리카노 추가되니깐 (일정금액 냈었는지 기억이 잘안나요! )  커피는 정말 맛있어요/오래된 신발공장을 카페로 활용해서 오랜전부터 핫플이었던 장소. 과거의 모습과 현재가 공존하는 듯한, 차가운듯 따뜻한듯한 분위기에서 마시는 커피한잔의 맛은 그 자체로 베리굿!/분위기 쩔....bb/서비스적인 부분인 조금 아쉬움ㅠ/이 카페는 가는 매장마다 직원들이 어쩜  한결같이 싸가지가 없는지 놀라울 따름.  그렇다고 커피가 맛있기를 하나  자리가 깨끗하길 하나...  뭐 하나 제대로 된게 없네.  여러모로 이해 안되는 곳./옛날 신발공장 건물을 재활용한 카페, 시원하게 넓고 힙하다. 의자는 학교의자같이 딱딱하고 화장실은 외부에 한칸씩 밖에 없어서 불편하지만, 분위기와 공간만으로도 한번 가볼만하다.  음료가격이 조금 비싼 편이지만, 커피 종류에 따라서는 원두도 선택가능하고 맛도 괜찮은 편.  최근 거리두기2단계로인해 2인이상은 1시간 이내 이용만 가능하다고 함/장소 넓고 분위기 있다/ 2층에 울림이커서 사람들 대화가 에어팟노이즈캔슬링을 거뜬히 뚫고 들어오니 공부하러는 비추/커피는 맛있고 특유의 분위기도 좋다 다만 거의 모든 콘센트 전원이 안들어옴 2개 자리 정도만 되는거같던데 회전율 높이려고 일부러 전원 차단해놓은듯../힙해지고 싶을 때./디저트 종류가 마음에 쏙 듭니다./커피에서 탕약맛이 납니다. 향미도 맛도 별로. 그리고 2층에 있는 소파가 심하게 낡아있고 더러워요./커피가 넘 맛있고 분위기가 좋아요!!/유명해서 다녀왔는데 전 그냥 그랬어요~/공간은 넓어서 좋은데 커피맛은 보통./일하시는 분들 대다수가 친절하셨으나 유독 불친절하고 예민하신 한 분 때문에 기분이 상했습니다. 차 종류는 맛이 없었습니다. 맛에 비해 너무나 터무니 없는 가격을 제시하는 것이 아닌가 생각이 들었네요. 편안한 분위기 속에서 눈치 안보고 일상 수다를 나누고 싶으신 분들은 다른 카페를 찾아보시는 걸 추천합니다./커피, 브라우니 맛있음. 인테리어 컨셉에 충실한 탓인지 의자가 대체로 불편한 것은 단점./제일 싼 게 7000원이라 좀 비싸지만 분위기는 좋음.근데 여직원 불친절.6/1 마감근무 여직원.인테리어는 정말 예쁨. 아 그리고 주문하려고 한참을 기다렸는데 직원이 없어서 진짜 한참 주문을 못함/버터 팻 트리오는 단언컨대 체고의 블랜딩이다/최악의 레모네이드 마셨는데 설탕결정이 입으로 다들어와서 입안이 모래밭... 섞어보려고 빨대로 바닥을 긁으니 설탕이 엄청 두껍게 안녹아 있었어요/건의드릴께요. 매번 여기서 원두를 샀었는데요. 시음 커피를 항상 주시잖아요. 라떼로로 가능한 지 여쭤보면 추가금액 지불하면 흔쾌히 해주셨어요. 지난 금요일 10시경 매장을 찾았어요. 코로나를 뜷고 굳이 마스크를 쓰고 먼길 걸어 갔어요. 이번에도 원두 구입하며 라떼를 부탁드렸더니 너무나 쌀쌀한 표정으로 안된다고 하시더라구요. 이전에도 항상 가능했던 거고 심지...더보기/버터 팻 트리오"
5,포비 합정점,서울 마포구 양화로3길 66 1층 (우)04023,카페,"LONG BLACK,FLAT WHITE,PLAIN BAGEL,OTHER BAGEL,SPREAD",3220,3.6,146,154,"존맛 탱 커피도 아주 제스타일입니더 /넓은데 의자가 편한건 모르겠어요 베이글 존맛 ㅠㅠ/루프탑이 최고! 베이글 과자?도 맛나요! 의자 불편한 건 맞아요 ㅠㅠㅋ/정갈하고 조용한 카페예요. 공간 자체는 큰 편이고 테이블이 다 낮고 의자는 불편...하지만 ㅎ 커피랑 베이글이 맛있어서 좋아요 /감성 한바가지 카페이긴하지만 음료랑 베이글이 너무 늦게 준비되며 좌석이 편하지 않았다 커피맛이 특이하고 분위기 좋으니 만남장소로 제격!!/아메리카노 노맛이에요 카페 구조가 너무 복잡해여/어제 근처에서 저녁을먹고 후식으로 커피나한잔할까하고 생각하다가 건물외관이 장난아닌 건물안으로 들어갔죠.8시30분 정도됐나.한테이블은 여자두분이 애기를 나누고 같이들어간 여자두분은 원두나 굿즈상품들을보더라고요,근데 직원들은 굉장히분주하드라고요.마감하느라...혹시나 물어봤는데 역시나 마감중이더라고요.모든곳이 코로나때문에 9시에닫는건알지만 테이크아웃도 안되고,머...더보기/직원분들 왜케 힘없고 일하기 싫어하시나요?? 의자는 다 불편했고 화장실 찾아가는것도 미로같고 카페 자체가 불친절한 느낌이었어요/인테리어는 예쁘고 엄청 대형인데 의자고 책상이고 편한 게 하나도 없어요. 한 30분 이야기하다 나올 거면 괜찮을 것 같아요! 재방문 의사는 없습니다./커피는 의외로 맛있었는데…베이글맛집 이라기 보다는 …스프레드 맛집 같아요..개인적으로 좀 많이 질긴 베이글은 불호하는데 여기는 좀 질긴 편입니다. 무엇보다..여기는 매장에서 먹기엔 의자가 너무 불편 하네요..스프레드랑 같이 먹어야 맛있는 베이글 먹을수 있을듯../괜춘한 곳/허니베이글에 무화과 스프레드 조합은 사기   근데 카운터 알바생이 힘이없고 자주오는데 여기 직원들 중에 친절한 직원들 한명도 못봄../베이글 맛있음 ! 공간이 넓어서 좋은데 불편한 좌석이 많아 자주 가진 않게 된다 /넓지만 불편한의자 좌석이 많아 아쉽다 /너무너무 안친절… 일하기 싫으면 그냥 집가서 쉬세요../공간도 넓고 좌석도 다양해서 좋았음! 베이글이랑 크림치즈는 역시 존맛ㅠㅠ/배이글은 맛있는데 자리가 좀 불편해요ㅠ/존맛.존멋./빵은 잘못이 없지만 너무 불쾌한 경험을 해서 다시는 가고싶지 않아졌어요ㅜ 주문받는 두 남자직원 일을 얼마나 오래한지는 모르지만 버벅대고 주문도 잘못 알아듣고 설명도 미흡했어요. 커피내리는 여자직원은 너무 불친절했네요. 말도 끝까지 안듣고 말씹고 고개돌림ㅜ 아무리 오후시간이고 일이 고단하다고 한들 기본 서비스 자세가 잘못된듯.../지난주 일요일에 방문했어요! 포비는 용산과 합정만 가봤는데 역시 합정점이 좋네요! 맛이야 두 지점 다 훌륭하지만 합정점이 공간도 널찍하고 좋아요! (1층 긴 테이블이 좋더라고요) 커피 1잔과 따뜻한 베이글 조합은 역시... 리뷰에 있는 글들이 무슨 느낌인지는 알 거 같아요. 저도 첫 마디의 응대 말투에 같은 느낌을 받았거든요. 근데 그 후에 제 질문에 대한...더보기/맛은 있지만... 친절도가...좀../카페가 크고 넓어서 너무 좋아요! 갓 나온 베이글 말모../일하시는 분들 전반적으로 왜이렇게 안친절할까 전부터 생각해왔지만 굳이 신경쓰지 않으려고 했는데 오늘은 좀 심했던것 같아요.  오늘 있는 내내 느꼈던 불쾌함은 안잊힐것 같네요. /오픈했을때 좋아하며 자주 갔던터라 오랜만에 일부러 다시 왔는데 직원들 매서운 눈빛이며 불친절한 말투며 서툰 서비스며. 공간을 즐기기에 너무 힘들었습니다. 주문하고 진동벨 없이 이름 부른다고 해서 베이글 준비되길 앞에서 계속 기다렸는데 암만 기다려도 차례가 늦어져서 화장실 올라가니 그때부터 준비되었다고 이름 호명이 3초에 한번씩 되고 가고 있다고 크게 말해도...더보기/베이글은 맛있는데 직원이 좀 들리게 얘기해줬으면 좋겠음 /일이 많이 힘든가 봐요 여자분 일 분 남짓 기본적인 주문응대도 많이 힘들어보여요   /집앞인데 베이글은 맛있지만(개인적으론 뉴욕식 베이글 안좋아해서 연희동 ㅇㅂㄹㅆ보다 포비가 더 맛있었음) 자리 불편해서 잘 안가는데.. 커피를 못먹는 몸이 된 후로 어쩌다 한번 가서 디카페인이 있길래 반갑게 시켰는데 디카페인 너무마너ㅏㅓ너너무너무 맛있어여 일단 스타벅스/할리스의 개탄물보다 200배정도 맛잇슴다 커피 좋아하는데 커피못드시는분 스벅을 버리시고 포...더보기/공간 구성이 특이하고 정원도 잘 가꿔져있어서 기분이 좋다. 베이글은 배불러서 못먹었넹/커피는 그냥저냥인데 아포카토는 맛있어요  위에 견과류인지 올려져 있는데 색달랐어요  주문 받으시는 분은 불친절해요  그리고 죄다 품절..  메뉴 고민하기 전에 품절된 걸  미리 말해줬으면 좋았을 것 같아요 /맛있는 베이글 근데 직원이 불친절해요.."
6,빈브라더스 합정점,서울 마포구 토정로 35-1 (우)04083,커피전문점,"핸드드립,원앤원,에스프레소,롱블랙,아메리카노,카푸치노",6166,4.3,88,142,"콜드브루가 깔끔하고 후라이드치킨같이 생긴 당근케이크가 아주 맛나염/※ 심정적으로는 4.5점, 카맵이 .5 점 못줘서 4점 드립니다. ^^   - 몰트 커피 : 3.5 - 과일음료?! : 3.8 - 얼그레이가나슈타르트?! : 4.5 ☆ - 시설/분위기 : 4.7 - 친절도 : 5   /건물 우측 왕큰유리문 열고 들어가면 됩니다ㅎ 어두컴컴하지만 넓어서 좋았어요 콜롬비아는 많이 쓰지 않고 산미 있었고 초코쿠키도 너무 맛있었어요/직원 교육 좀/강남에 매장이 있을 때 즐겨 찾았다. 소규모 로스터리 카페와 다르게 넓직하여 커피를 즐기는 것 뿐 아니라 공부를 하거나 이야기 하기 좋다. 원두 설명이 있는 카드를 주는 것이 좋은데, 맛에 대한 묘사가 단순히 테이스팅 노트를 나열하는 것을 넘어 공감 가기 쉽게 표현되어 있다. 하지만 벨벳 화이트 블렌드는 무언가 아쉬운 느낌./커피 물 양이 좀 많은듯? 다음에는 적게 해달라고 해야지/커피맛 괜춘/커피 진짜 맛있긴 함. 다만 사람 거의 없을 때 갔는데도 두명이 오면 1시간 이내로 있어야 한다고 함. 기본 6천원 이상인데 잠깐 앉아있다 나와도 괜찮으면 가볼만함. 커피 맛 하나로 가는 곳/맛있고 친절해서 자주 가요/에스프레소를 주문하면 설탕 한 조각과 탄산수가 같이 나옴. 몰트 에스프레소 좋았다. 리얼프루츠도 시켰는데 패선후르츠 에이드인 걸 제대로 인지 못하고 주문해서 그냥 주스 정도를 예상했던 일행을 당황시켰다. 하지만 나는 그것도 맛있었음. 철제 의자, 테이블 이런 차가운 내부 공간 느낌이 개인적으로 조금 불편하고 아쉬웠다. (방석 진짜 일어날 때마다 떨어진다!)/합정에서 주차되는 것도 좋고 개방감있는 인테리어도 괜찮더라구요. 투고해서 앉아보지는 않았지만 커피맛도 깔끔. /너무나 친절하신 직원님들.. /커피도 베이커리도 언제나 굿,,,/먹고나서 잔향이 너무 좋았어요/가격대있지만 주차가능 맛좋음 분위기좋음/커피맛집!!/벨벳화이트로 플랫화이트 마셨어요. 보통 8온즈정도 되는 컵에 서빙되는 것 같았는데 진하게 먹고도 싶고 우유를 많이 마시고 싶지 않아서 샷을 짧게 끊고 5온즈정도 되어보이는 컵에 부탁 드렸어요. 엄청 친절히 하나하나 물어봐주시면서 만들어 주셨고 위의 거품도 쫀득했는데 살짝 묽은 듯 했어요. 우유가 적어 더 진했을 텐데... 다음에 다시 가서 다른 원두로 마시...더보기/워낙 유명한곳/커피와 서비스 모두가 만족스러운 곳/라떼짱맛/간만에 방문했는데 디저트 라인업이 핫해졌다./아아 진하고 맛남! 쿠키도 마시따/+ 맛이 약간 바뀐 듯. 예전에는 깔끔한 커피 맛을 느낄 수 있었는데 다시 간 빈브라더스는 뒷맛이 씁쓸했다. 메뉴를 늘리려고 하기 보다는 맛있는 커피를 유지하는 커피숍이 되면 좋겠다.   간만에 맛있는 핸드드립커피를 마셔본 것 같다. 콜드브루 빼고 모든 커피 메뉴의 커피빈을 선택할 수 있다. 일행은 콜드브루를 시켰는데 일반 콜드브루보다 진하다고 하던데 맛있...더보기/어둡지만 좋아요/스콘맛집  커피, 분위기(어두움) 좋아요  약간 시끄럽다 느낄수 있지만 이건 개인차이기에. 주차가 불편한점 빼고는 다 좋습니다. /- 커피맛 : 좋음 - 가격 : 제법 비쌉니다. - 서비스 : 별로임 - 콘센트 : 갯수 별로 없고 위치도 애매함. - 밝기 및 분위기 : 밝은 곳도 있고 어두운 곳도             있습니다. 노트북으로 작업같은 거 하실 분은          배터리만 빵빵하다면 공부하기 좋을 듯 합니다.       하지만 독서 혹은 종이책으로 공부하러 오시는    ...더보기/홍차스콘맛집 커피도 너무맛있음 라떼맛집/맛있고 좋은데 별다섯개는 아님/매장은 너무 음악소리가 크고, 어수선하지만...... 그래도 디카페인 아이스라떼 때문에 찾게 되는 곳/여긴 외진 곳에 있어서 차로 가기좋으나 주차장이 안습;;  주차 스트레스 땜에 안가게됨"
7,몰토베네,서울 마포구 성지3길 67 1층 (우)04072,이탈리안,"마르게리따,살치살 스테이크 (250g),풍기,리구리아,토마토샐러드",26400,4.3,96,134,"짭짤한 듯 맛있어서 하루 동안 두 팀 데리고 방문해서 50만원 가까이 쓴 적 있어요. (내돈내산)/음식이 너무 짬…. 리뷰보고 고심해서 간건데 음식이 짠건 가게 특성이니 그렇다 쳐도 많이 짜다고 미리 말도 안해주고 없고 메뉴판에 적혀있지도 않음 한입 먹어보고 너무 놀라서 덜 짜게 안되냐니까 그건 힘들고 곁들일 할라피뇨는 제공 가능하다구 하심.. 친구는 피자도 입에 안맞고 파스타는 너무 짜서 입도 못대서 그냥 쫄쫄 굶고 나옴..ㅠ 가실분들은 메뉴가 매우매...더보기/맛있어요 피자도 진짜 특이하고 종류별로 다 먹어보고싶어요. 파스타는 오일파스타 먹었는데 너무 맛있었어요.. 그런데 두명이 이렇게 먹으니 약간 배고팠어요. 파스타양이 좀 적어서 다음번에는 샐러드 하나 더 시키던가 해야할듯해요! 다음에 또 방문하고싶어요~예약하고 와야해요ㅠㅠ!/맛있어요.... 특히파스타! 예전에 저장만 해놨다가 우연히 들어갔는데 매우 만족 >_< 직원분도 완전 친절하심!/지인 데리고 꼭 가는집 이탈리아 본토 맛  간이 좀 센편? 주문 전 말하면 덜 짜게 해주심/오늘도 맛있게 즐거운 식사. 신 메뉴도 맛있네요!/오랜만에 들렸는데 여전히 맛있네요~ 만족하고 가요~ 식사 후 바나나 푸딩으로 마무리 하면 딱이애요ㅎ/새로운 메뉴들도 다 맛있네요 언제나 믿고 가는 집입니다!!/전에 맛집으로 자주 갔었는데 피자 위주로 메뉴가 바뀌고 가격이 너무 올라서 아쉽네요. 양이 정말 적은 편입니다. 개인적으로는 맛, 분위기, 서비스, 인테리어를 다 봐도 가격이 이 수준은 아닌거 같은데 너무 강남이나 이태원 비싼 레스토랑 따라 간 것 같습니다./시간의 흔적을 간직한 ㅋㅋㅋ 커트러리(라귀올레)와 접시(브이비씨 까사)가  아주 멋나는 좋은 공간이었어요.  따땃한 물 주는 것도 좋았고요. 가격대는 솔직히 좀 있는데 특별한 날인셈 치고 풍기피자와 시칠리아나 먹었어요. 후렉스~ 피자 한 입 먹는 순간!! 입에서 팡팡팡~ 정말 풍미가 좋더라고요.  눈 동그래져서 오우 대박 눈으로 대화하며 감격에 젖어 두 입...더보기/맛은 나쁘지 않아요. 마르게리타 먹었는데, 얇은 나폴리 화덕피자가 아닌, 통밀로 만든 것 같은 도우의 피자입니다. 얇은 나폴리식 씬피자 기대하고 가시면 안 됩니다. 퐁기 파스타는 면이 살짝 많이 익은 느낌.   직원분들은 드라이합니다. 서빙/계산해주시는 분 다 한번도 미소가 없었고, 서빙하시는 분은 음식 그릇 들고 오셔서, 저희가 그릇 놓을 자리 만드는것을...더보기/피자가 정말 맛있었어요 파스타는 생각보다 종류가 많이 없고 메뉴판은 설명이 부족해서 물어봐야해요 그리고 피클을 안주시더라구요.. 맛은 있었지만 서비스부분은 애매했습니다/피자는 맛있는데 파스타는 별로임 일단 양이 너무 적음/맛있어요/모든 종류의 피자를 먹어보고싶어지는 곳 .. 맛있어요/최고  최고   제 인생 마르게리따 피자에요♡/너무맛있어요 진짜/엔초비 파스타 평소에 잘 안먹는데 생각보다 안 비리고 맛있었고, 풍기 피자도 괜찮았어요 파스타 종류가 1개밖에 없는 점이 아쉬워요/쥰맛탱이거 사장님도 완전 친절하세요~~ 추천 엄청 잘해주세요/너무 맛있어요!! 대체불가/오르조또와 피자가 신선하고 맛있음 근데 모든 메뉴들 양이 새모이만 함 밥 먹고 2차로 먹으러 가도 될 수준/블루리본 여러개 받으신 곳이라 기대치가 높았고, 더욱 평가를 엄격하게 하게 되네요. 살짝 아쉬워요. 현지 느낌을 표방하는 동일 가격대 타 업장에 비해 오리지널 이탈리안스러운 느낌이 덜하고, 주변 상권에 비해 가격 책정이 높게 되어있다는 느낌을 받았습니다. 메뉴 추천을 너무 무난한걸로 받아서 그런가봐요^^;; 예쁜 플레이팅과 인테리어, 친절한 응대 덕분에 경...더보기/피자가 정말 맛있어요! 오르조또도 맛있고 파스타는 해산물 들어간 게 더 맛있는 듯./소개팅 몇번 했어요 여기서 ㅋㅋㅋ 정신없는 중에도 맛있어서 그맛이 생각나 결혼하고 남편이랑 갔네요..>_</   사랑하는 이와 함께한 식사자리였는데, 그 순간이 소중하고 빛날정도로 분위기가 매우 따뜻하고 좋았으며, 음식 맛과 비주얼 또한 훌륭했고, 이 모든것이 아름다운 조화를 이루어지는 그런  곳이였습니다.   직원분의 메뉴 설명부터 와인 초이스, 심지어 일회용 손소독제를 구비를 해두시고, 식수를 자주 채워주시는 등  서비스를 통해 직원분들의 전문성과 서비스에 ...더보기/피자로 유명하다 들었는데 개인적으로는 피자 색다르고 맛있었어요. 보리?가 들어간 버섯 크림 리조또도 맛있었고 파스타는 간이 좀 세긴 했지만 괜춘했어요. 여럿이 가시면 토마토, 크림, 오일 소스 조합으루 드심 좋을 것 같슴당! 워낙 설명 잘 해주셔서 주문할 때 편했음니당. 예약 하고 방문하는 것을 추천하고 안쪽 좌석 보다는 창가석이 더 좋은 것 같아요! 가격...더보기/넘친절하시고 편안한분위기서 맛있게식사했어요/음식이 많이 무겁다. 짜다고 안내받아서 덜 자극적이게 해달라고 했지만 정말 정말 짰다. 콜라 필수! 피자 맛있는데 2조각 이상은 못 먹겠음. 먹고 나면 속이 많이 무겁습니다..:)/오일파스타 굿굿  가지피자 너무 맛있음....  또 먹고 싶음/꼭 예약하고 가야하는곳. 웨이팅 해준다고 해서 11시 40분에 전화로 예약 후 12시 40분 도착했더니 굉장히 불친절하게 ""전화로 예약이 아니라 웨이팅이라고 말씀드렸죠? 앞에 10팀 있고, 지금 빈 곳은 예약 테이블이라서요."" 라고 함. 알겠다하고 근처 카페에서 1시간 더 웨이팅. 1시 50분에 오늘은 자리가 나기 힘들것 같다고 연락옴.ㅋㅋㅋㅋㅋㅋㅋㅋ 총 ...더보기/리뷰들을 보고 기대가 너무 컸던걸까요? 기대이하였습니다.. 메뉴에 적혀있는 가격을 내고 먹을 맛도 퀄리티도 아니였습니다.. 양이 적은건 그렇다쳐도 내용물도 심히 뭐가 없더라구요. 실망만 컸던 것 같습니다. 염도 조절 할 수 있는 점은 독특했습니다./넘 친절하시고 피자도 완전 맛있었어요 또 갈 거예요"
8,교다이야,서울 마포구 성지길 39 (우)04083,"돈까스,우동","가께우동,덴쁘라우동,니꾸우동,오뎅우동,자루붓카케우동",8400,3.6,171,233,
