,name,address,sort,menu,mean_price,score,people_give_score,review_count,review_list
0,어반플랜트 합정,"서울 마포구 독막로4길 3 1, 2층 (우)04072",카페,"Special Caprese,신선한 토마토와 생모짜렐라치즈가 들어간 스페셜 카프리제 샐러드,13,800,추천,14,300,Penne Arrabbiata,매콤한 맛의 토마토 소스 팬네 파스타,8,000,Matcha Chocolate,벨기에산 화이트초콜릿에 말차 향이 더해진 특별한 초콜릿 케이크",13200,4.2,220,612,"분위기와 향, 차 다 괜찮아요!/아메리카노5천원/분위기가 좋고 사진찍기좋아요 지하가 넓지만 공기가 다소 꿉꿉해서 1~2층 추천드립니다. 좌석이 많은 편은 아닙니다/좋아용 친절해요 향기 굿굿/인기가 많은만큼 좋은 자리에 앉기가 쉽지 않습니다.  사람이 많아서 조용한 분위기를 원하신다면 조금 실망스러울 수 있습니다.  1층에 있는 화장실은 남녀 구분이 조금 모호 했습니다.  계단이 많이 가파릅니다.  지하는 층고가 많이 낮습니다.  시켰던 디저트는 좋았습니다.  대신 생각보다 많이 달았습니다.  커피는 일반적인 아메리카노를 주문했는데 산미가 생각...더보기/눈이 다 정화되는듯~분위기도 좋앗고 디저트 잘먹엇어요 /생각보다.... 인스타용 카페라고 생각하고 별 기대없이 갔는데 메뉴들이 다 괜찮다 티라미수 맛있음 식물이 많아서 그런지 의자가 불편해도 분위기가 편안한 느낌이 있다/음악이 좋고 커피가 맛있어요! 좋은 향기가 나서 자주 옵니다./식물원에 온것 같아서 너무 좋아요! 그리고 향기가 너무 좋아요!  매번 기분이 좋아져서 자주 놀러와요!/공간도 예쁘고 힐링되는 곳이에요. 지칠 때 마다 찾아가면 항상 친절하게 맞아주셔서 기분이 좋아집니다☺️ 음료도 맛있어요!/쿰쿰 시큼? 이상한 냄새나요 들어간 입구 층을 2층이라 하고 1,3층 잇어요 앉을 공간은 너무 많은데 그냥 식물만 잔뜩 쌓아놓은 느낌 사람많고 직원들도 많고 오믈렛은 무난햇어요 공간이 별로 좋다고는 못느껴서 다시 방문은 안할듯 1층이 시원하고 3층이 젤 갑갑한 느낌/직원분들도 친절하고 음료도 맛있었어요! 특히 차 시키면 같이 설명서? 종이 하나씩 주는게 귀엽더라구용~ 근데 마감시간이라고 안내해준 직원 한 분이 턱스크를 쓰고 계셔서 조금 찝찝쓰../서비스 미쳤어요 너무 친절해요.../합정에 이런 곳이 있다니/브런치는 맛있었으나 위생이 조금../자주가는곳... 도심속 숲같아요 향기도너무좋고 음식도 맛있어요/맛있고 서비스도 좋아요~~/식물로 인한 상쾌한 기분보다는 덥고 답답한 느낌이 강했어요. 요거트나 레몬에이드 맛있었고 직원분들 대체로 친절합니다./카페 안이 시끄럽지 않고 조용했으며, 식물이 가득하고 조명이 조금 어두운 편이라 아늑한 분위기가 좋았습니다. 자리도 많아요. 근데 안이 겨울인데도 생각보다 많이 따뜻해서 더위를 타면 답답할 수 있을 것 같아요. 저는 겉옷 벗으니 그래도 괜찮았습니다. 그리고 저는 메이플 라떼를 마셨는데, 그냥 라떼랑 차이점이 느껴지지 않았습니다. 그래서 메이플 라떼보다는 그...더보기/3번 방문했는데 식물 가득한곳이라 향이 가득해서 좋았고, 메뉴도 괜찮은거 많고, 친절하셔서 좋아요/들어가자마자 풀향기?가 너무 좋고 식물이 많아서 기분이 좋아져요 커피도 너무 맛있어요! 다음엔 브런치 먹으러 또 올거에요!/연말 모임 하기 딱 좋은데 코로나때매 인원 제한 있어서 아쉽 ㅜ 로나 풀리면 다같이 꼭 가보고 싶은 곳 디저트 맛있어요/멀리 안가고 도심 속에서 자연에 둘러쌓일 수 있어서 너무 좋아요ㅜ  /식물원 같아서 좋았어요~~ 분위기도 넘 좋고  바질파스타 맛있어요~~ 힐링하기 좋은듯! /미접종자 거부 카페/분위기도 좋고 커피도 맛있어요/규모 작아보였는데 대형 카페 식물 냄새가 좋아요/바질 파스타 맛있어요-! 인테리어도 좋구~ 힐링하고와요 ㅎㅎ/비싼가격만큼 익스테리어, 인테리어가 이색적입니다.  디저트도 크게 아쉬울것 없이 잘 마시고 왔습니다만, 제 기준에서는 직원분들이 친절하다는 부분은 크게 못 느꼈네요./도심안에 이런 식물이많고 힐링할수있는 커피숍이 있는줄몰랐네요  직원분들도 말끔허구 친절하셔서 동료들과 맛있게덜 많은 음식들과 커피 잘즐기다 왔습니다 ^^/서울 한복판에서 만난 신기한 플랜트 정글 카페 커피맛도 고소하면서 벨런스가 잘 잡혀서 맛있었어요/친구들이랑 가볍게 놀러갔다가 자연에서 쉬는 느낌이 들어서 너무 좋았어요 :) 커피도 맛잇고 인생카페 찾았습니다 ㅎㅎㅎ/불친절함"
1,크레이지카츠,서울 마포구 포은로2나길 44 (우)04026,"돈까스,우동","반반정식 (200g),로스,히레,16,000,로스카츠정식 (180g),히레카츠정식 (180g),특로스카츠정식 (230g) (당일한정수량)",13000,3.9,283,404,"맛있는거? 맞음. 그렇다고 1시간이상 기다리면서 먹을만한 돈까스는 아님. 동네에 이정도 돈까스집은 하나씩 있지않나싶었음. 줄서지만 않으면 재방문의사 있음. 줄서게되면 더는 안갈거같음/맛있어요!/운 좋게 거의 웨이팅 없이 먹었는데 맛있게 잘 먹었음. 가격이 너무 좋다. 비슷한 퀄리티의(맛이 아님) 돈까스집과 비교하면 최소 1000원에서 3000원정도 저렴하게 느껴졌다. 맛도 먹어본 돈가스중에 세손가락 안에 꼽힘. 추가로 주문한 새우튀김도 맛있었고 양도 많았음!/명성의 가치는 충분히 느낄 수 있었습니다. 등심이 예술이네요 ㅎㅎ 근데 돈까스 튀김 부분이 기름에 쩔어서 눅눅한 점이 아쉬웠습니다. 재방문 의사 있어요! 가까우면 자주 올텐데 아쉽네요/히레 ㅎㅎ/기대가 컸습니다만, 기대만큼은 아니었던 것으로.  두 가지 부분이 아쉽습니다. 첫 번째는 튀김이 바삭하기보다 살짝 눅눅하고 고기와 튀김옷이 살짝 따로 노는 점, 두 번째는 고기 자체의 풍미가 잘 안 느껴진다는 점입니다.  누린내 없이 고소하고 부드러우나 명성에 대한 기대치만큼은 아닙니다.  개인적으로 친구가 주문했던 멘치가 제일 맛있었습니다./가장 유명한 카츠집이라 기대했는데 기대한 만큼 매우 맛있었음 특히 카츠샌드추천함 근데 두번째 방문때는 실망했는데 맛의 기복이 있는 것 같음/돈가스 별로 안좋아하는데 먹어본 돈가스중에선 제일 맛있었음 웨이팅은 길었고 고민하다가 크레이지 카츠 정식으로 시켰는데 후회함 무조건 특로스카츠정식 시킬수 있으면 그걸로 시키는구 추천  난부들부들 고기파라서 로스카츠 부위가 제일 맛있었음 카레는 무난무난/무난무난하게 맛있어요/특로스카츠 맛나요~~~~/히레카츠 먹었어요. 맛은 있는데 1시간 넘게 기다려서까지 먹어야하는지는 의문../너무 기대를 한 모양인지... 정돈만큼은 아니지만? 무난하게 맛있어요! 이런 맛있는 카츠치고는 가격이 싼 편인데... 가격값 이상은 하는 것 같아요/매번 좋았습니다/맛있습니다. 특히 소금에 찍어 먹었더니 굉장한 풍미가 생겨서 오 맛있다를 느낄수 있습니다. 양도 많아서 꽤 배부르게 먹었네요. 안심이 훨씬 맛있는거 같아요 등심은 고기+비계부분이 같이 있는데 제가 비계를 안좋아해서 그런지 안심이 훨씬 맛있다는 생각이 들었습니다. 부드럽고 더 고소하기도 하고요 맛있게 잘 먹었습니다!!/메뉴가 늘고 확장하면서 아쉬운 부분도 있지만 그래도 훌륭/계산해주시는 직원분이 진짜 친절하셨어요. 테이블링으로 웨이팅 걸어두고 기분 좋게 먹고 가요^^ /히레는 부드럽고 촉촉 로스는 퍽퍽  히레 기준 가격대비 아주 훌륭, 1시간 미만으로 웨이팅 할 가치있음. 4점 로스는 주문 ㄴㄴ/직원분들이 친절하시고 매장도 깔끔하네요. 다음에 또 가고싶어요/맛있는데 이정도 하는 돈까스집 너무 많아짐./한정 메뉴 먹었는데 최악이었음 같은 돈까스 2개 나왔는데 1개는 존맛 1개는 너무 질기고 맛이 없었음 맛없는 식당보다 편차있는 식당이 더 별로임 그리고 밥이 너무 맛이 없음 쌀이 너무 퍽퍽함...씹히는게 아니라 부스러지는 느낌임/광고의 힘/평일 4시반에 가서 대기 걸어놓고 5시 오픈하자마자 바로 들어가서 먹었어요. 로스까츠 맛있었습니당 유명식당들 직원이 불친절한 경우도 많던데 여기는 직원들이 엄청 친절해서 인상적이었어요.. 맛도 그런데 친절함이 더 기억에 남네요/안심 맛있어요 등심은 솔직히 퍽퍽한 편. 카와카츠처럼 입에서 녹는 스타일 좋아하시는 분들은 불호일거에요. 30분이상 대기하라고 하면 못하겠지만ㅠㅠ 오픈시간 맞춰가면 웨이팅 적어요 굿. 멘치는 오픈 초기엔 정말 맛있었는데 최근엔 별로드라구요ㅠㅠ 아쉬워라..안심만 드세용../바삭한 돈가스가 맛있어요/1월 12일 그 추운날 도합 1시간의 웨이팅 끝에 먹었는데.. 결코 이정도 웨이팅을 감수할만한 맛은 아니다. 웨이팅이 20분을 넘어간다면 주저없이 돌아 서는게 현명../로스카츠완전 맛있어요 !!!/삐빅! 삐빅! 삐빅! 삐빅! 삐빅!/크레이지 세트로 주문했었구요 사이드로 카츠산도먹었습니다 맛있게 먹었어요 갠적으론 특로스카츠랑 카츠산도 추천해요 이 두개 만족감있게 먹었어요/백종원의 연돈 돈까츠 방송이 세상을 너무 버려놓았다 물론 연돈은 훌륭한 가게지만 돈까쓰 라는 음식을 너무 이상화 시켜 버렸다 돈까스가 뭔가 돼지고기를 빵가루 입혀 튀긴 것이다 크레이지 카츠? 가성비가 너무 떨어진다 이런걸 1시간이나 기다려서 먹었다는게 너무 쓸데없는 짓이었다 품질도 너무 떨어지고 고기가 너무 작다 쓸데없이 음식은 자리에 앉고 20분이나 지나...더보기/맛있어요/맛있게 잘 먹었어요/정말 크레이지하게 맛있어요.ㅎㅎ"
2,오레노라멘 합정본점,서울 마포구 독막로6길 14 (우)04072,일본식라면,"토리쇼유,시오라멘,카라빠이탄,빠이",9000,4.3,372,393,"존맛 사랑해요 /너무짜다 심각함/맛있게 먹었던 기억이 있어 재방문 했는데 다시 보니 노키즈존이네영/닭 굴물이 진하고 사골과 다르게 깔끔한 느낌. 닭 차슈가 넘 맛있었음. 고기 차슈는 야들하고 계란은 맛은 있었지만 국물 보다 차가웠음.  기본은 진짜 찐~~~~한 닭 국물 맛. 매운 건 고추기름? 때문인가 약간 짬뽕 맛이 남.  결론 신기한 맛이었음. 비주얼과 맛도 괜찮았고 왜 인기 있는지 잘 알겠음. 음식도 빨리나옴. 직원분들 친절했음. 다만 먹다보니.....더보기/맛의 벨런스가 미쳤습니다. 국물 면 계란 다 너무 맛잇네요. 느끼하지 않으면서 깊은 맛이 나는게 신기할 정도예요. 라멘은 보통 국물이 진하면 되게 느끼한데 여기는 느끼함이 많이 안느껴져요. 먹으면서 계속 맛잇다고 생각하게 하는 라멘이네요. 그리고 익힌 닭이 고명으로 나오는데 닭은 보통 퍽퍽해서 그 식감 때문에. 그리고 비릿함이 잇어서 닭삶은 고기를 그닥 안...더보기/와썹맨 보고 갔는데 역시 기대만큼 맛있었습니다. 같이간 친구도 좋아했고 국물이 최곱니다./라멘을 갠적으로 넘 짜고 느끼하다고 생각해서 잘 먹지 않는 편인데 맛있었어요! 별로 안짰어요. 저는 저 흰국물 라멘 먹었는데 안느끼하게 칼칼한 맛으로 시켜서 맛있었어요 동행인은 저 간장베이스 라멘 시켰는데 제스탈 아니에요. 넘 짜고 간장라멘 싫어해서. 김치 달라고 해서 같이 먹었는데 딱 좋았어요 고기도 부드럽 /맛있게 잘 먹었어요! 회전이 빨라서 오래 안기다려도 되네요/가게도 깔끔하고 위생적으로 보이구요 바쁜 주말점심시간대임에도 직원분들 응대가 정말 친절했습니다. 맛은 근래 먹은 라멘집중 깔끔했습니다. 돈코츠라멘을 생각하고 오시는분은 취향 안맞을 수 있을지도 모르겠습니다. 닭가슴살도 굉징히 부드러웠고 생각보다 라멘이랑 잘맞아서 맛있게 먹었습니다./참 맛 조아요 수비드 닭고기 야들살살 쪼끔 짭짤해요 ㅎㅎ/웨이팅 오졌는데 회전 금방돌아서 비교적 적당히 들어갔고 차슈추가 계란추가해서 맛있게 먹었습니다. 면무료추가라 맛있게 더 먹었어요./맛잇어요 ㅠㅠ/맛을 떠나서 너무 짜요  국물 먹고싶은데 짜서 먹을수가 없어서 면만 먹었네요 토리빠이탄보다 쇼유가 더 짬 다시는 라멘을 먹지 않을거에요ㅠ/오레노~~ 카취다/딱히,,,/친구가 먹고 울었어요 면추가 되는 거 보고 두 번 울었어요/하이볼 깔끔하나 생레몬 효과 개존맛탱은아닌듯 매운라면으로 먹었는데 약간 내입맛엔 짰다 워낙싱겁게먹긴함 밥을부르긴함 다음번엔 토유나시유먹어봐야징 일행은 매운게 더좋았다고 했는데 난 오리지널이 더좋았다 남의떡이커보이는것인가/맛있어용 라멘 한그릇 먹을 때쯤 느끼하고 물리던데 토리빠이탄은 그런 게 없어요. 차슈도 느끼하거나 퍽퍽하지 않고 맛있습니당 /이 정도면 맛있는 라멘이긴 한데 마지막 쯤에는 조금 물리는 거 같아서... 차슈도 많고 국물은 좋았습니다/토리 빠이탄이 찐이다. 안느끼하고 넘 맛있게 먹었다. 카라 빠이탄은 조미료 같은 매운맛 때문에 육수의 맛이 묻혀서 별로였다./ㅇㅈ/바쁜 가게인데 직원들이 친절함 맛도 있음 /말이 필요없음/여기 너무 맛있어요 ㅠㅠㅠ 차슈도 꼭 추가해서 맛있게 드세요!/토리빠이탄 국물 찐하고 너무 맛있다 카라빠이탄 먹으러 다시와야지/닭은 정말 부드럽고 무료로 리필까지. 괜히 미슐랭이 아니다./아 좋다 웨이팅 없이 먹으니까 더 좋다 /진짜 맛있음!!! 다시 오고 싶은데 웨이팅이 두려움 /너무 맛있다 또 오고 싶다/고명들 하나하나 다 맛있어요/합정동 일대에 무수한 라멘 맛집들이 많이 생겼지만 결국 돌고 돌아 오레노. /토리빠이탄 , 카라빠이탄 jmt/너무 맛있던 집.. 부탄츄 잃은 후 라멘 유목민이었는데 정착할 곳 찾아서 기뻐요"
3,최강금돈까스,서울 마포구 월드컵로3길 31-30 (우)04025,"돈까스,우동","상등심돈까스 (150g),한정판매,12,000,14,000",16000,4.1,220,453,"맛있습니다-!/돈까스 맛남! 샐러드 소스 살짝 에러..!!/안심은 정말 형편없었고 등심은 그나마 좀 먹을 만하네요 예전엔 어땠을 지 모르겠지만.. 가격 생각하면 여기보다 잘하는 곳 정말 많습니다! 고기보단 곁들임으로 승부를 보는 느낌이 강합니다/예 ? 평범하다고요 ?  된장국이 절대 안평범함 ㅠㅠㅠㅠ 그리고 돈까스랑 들기름 조합이 미쳤음  (적는데도 군침이 사악 돌아요 인생돈깟수) /평범한 등심. 평점 높은게 이해가 안된다.  드라이카리가 오히려 낫다.  복분자 요거트? 가 젤 맛있다. /그냥 등심 먹었는데 평범... 너무 기대했나? 특등심 먹어보고싶긴함/웨이팅이 이렇게 길 일인가 싶고 가격 시간 맛 전부 고려했을때 좋은점수 주기 힘들듯/서비스는 매우 친절하신데 맛이 .. 돈까스가 기름에 절어있음 ㅠㅠ/갠적으로 매우 애정하는 곳이어서 맛난거 먹고 싶을 때 잘 가던 곳인데… 맛은 여전히 좋긴 합니다.   하지만 입장 관련 서비스나 안내는 전보다 못한 것 같아 아쉽네요 실수에도 죄송하단 말도 없고….  입장 뒷번호라도 한명인 손님을 좌석이 홀수라 먼저 입장 시켰으면, 다음 입장은 그 앞 번호가 입장해야 하는걸 제대로 확인해야 하는데  그러지 않고 테이블링에 ...더보기/들기름+소금 짱맛있다 카레는...가격대비..너무 별로..담에는 안시킬듯 엄청 친절하심, 키오스크로 메뉴랑 인원수 먼저 주문하고 기다리면됨/들기름에 소금을 찍은 돈까스를 먹자니 감칠맛이 잇네요. 마치 육회를 먹는듯한(고기의 질감말고) 향이 딱 육회입니다. 여기에 익한 돈까츠 튀김까지 섞이니 향. 맛이 약간 강렬하다는 생각이 들지만. 맛있습니다. 고기의 익힘이나 질은 요새 좋은 고기 쓰는 돈카츠 집이 많아서 비슷한 정도 입니다.  이집의 특징은 들기름과 소금의 조화이겠네요.  커리도 추가해서 먹...더보기/주말저녁에 1시간 웨이팅하고 안심돈까스 먹었어요. 웨이팅 예약하면서 메뉴를 미리 주문하는 시스템이지만 손님이 많아 음식을 오래 기다렸어요. 그치만 들기름을 돈까스에 살짝 뿌려먹는 맛은 최고였어요 ㅠㅠㅠ/친절하고 돈까스를 오일에 찍어먹으면 맛있어요~! 다녀본 곳 중 장국이 제일 맛있던 곳이었어요/음.........이 돈을 주고 이것을 먹는다니? 맛은 있지만 9000원이 적당합니다  펙트 : 이돈이면 근처 간코 돈가츠 집갑니다/220306 등심 돈가스 12,000원 특등심 돈가스 16,000원  비계가 붙은 잘 조리된 등심 돈가스, 생각보다 특등심은 균일하게 조리되지 못하는 인상이라 그냥 등심을 추천. 강원도를 컨셉으로 했지만 크게 부각되지는 않고, 들기름이 인상적이어서 함께 먹었을 때 아주 어울린다./지인짜 맛있었어요!! 처음 나왔을 때 양이 좀 적지않나? 했는데 먹고 나니 배부르네요. 고기와 밥 국 모두 향이 가득한 게 너무 좋았어요. 바삭하고 부드럽고.. 후식 요거트까지 완벽./원래 크레이지카츠를 찾아갔다가 웨이팅이 너무 길어서 급선회했습니다. 상등심카츠는 기본적으로 맛있었고, 아무 의미 없이 시킨 드라이카레가 생각 외로 맛있었습니다. 마지막으로 주신 디저트도 너무 좋았어요!/노력의 흔적들이 엿보이고 원육 자체가 좋아 맛이 좋아요. /긴 대기 시간에 비례하는 맛은 아닙니다. 요즘 돈까스가 상향 평준화 되어 기준이 높아져서 그런 지도 모르겠습니다. 일행은 드라이커리 먹고 장염 걸렸습니다../돈까스 맛집 맞습니다~ 다음에도 또 갈 것 같네요 ^^/상등심돈까스가 맛있는데 초창기에 비해 고기퀄이 좀 떨어졌네요 ㅜㅜ 초기의 맛이 그리워요/말모,,,⭐️⭐️⭐️⭐️⭐️ 진짜 대존맛이에요. 엄마가 요리를 잘하셔서 웬만한 음식먹고는 우와~!라는 표현이 안나오는데, 전날 술을 왕창 먹었음에도, 기름진 돈까스가 전혀 느글거리지 않았어요! 뭔가 소고기 스테이크처럼 고소한 맛도 났고 엄청엄청엄청엄청 부드러웠어요. 단점은 웨이팅인데, 추운날 웨이팅 할 곳이 마땅치않아 아쉬웠어요ㅠ 넘 추오,,, (웨이팅 등...더보기/상등심이 넘모 부드러오여 서비스도 되게 친절하세요 꼭 가세요 돈카츠 원탑임/상등심 돈까스 맛있었고 양은 진짜 많이 먹는 사람들 아니면 적당한 수준이었습니다. 서비스는 바쁘신 와중에도 접객 친절하시고 디자트까지 적당했어요 ㅎㅎ/돈까스부터 샐러드, 된장국, 후식까지 성의가 느껴지긴 하지만. 선택과 집중이 필요해보입니다. 가격에 비해 메인인 돈까스가 너~무 작아서 키즈돈까스 주문한줄 알았습니다./부드럽고 맛있습니다. 최고~ 오미자 요거트도 맛있어요.  메뉴판에 샐러드 드레싱이 옷 소매에 안 묻게 조심하라고 친절히 써있는데도 저는 못 보고 옷을 해먹었으니 다른 분들은 꼭 조심하세요/바빠서 서비스 기대 안하고 가야할듯요, 저희는 자리가 안쪽에 2곳 입구 키친쪽 2곳이 있었는데 사람많아 부산한데 더 부산할거 같아서 안쪽으로 달라고 부탁을 드렸는데 꼭 입구 키친쪽 앉으라고 하더라고요. 나중에 세분 같이 앉아야한다고 하시던데 (그자리옆에 혼식하시던 분이 있었음) 그런 세팅부분은 그냥 칸막이면 옮기면 되는 부분인데 이해가 안갔어요 그리고 저희...더보기/일단은 친절한거는 합격, 문제는 돈까스 제가먹은언 너무튀겨 딱딱해진느낌이어 그냥 이집이 원래 이런가 했지만 눈앞에서 다른 사람용 등심잘라질때보니 그냥 내꺼만 잘못튀긴듯? 아니면 조리하시는분이 아직숙련되지못한듯? 등심보다는 안심이 먹을만하고 밥은 맛있으나 된장국은 청국장냄새 싫어하는 사람에게는 불호일듯 왜이런 독특한 냄새를 가진 된장을 같이주는지 이해가 안감...더보기/묵직하고 깔끔담백했어요. 등심, 상등심, 안심 시켜서 먹어봤구요 갠적으론 안심보단 등심추천해요 요거트는 많이 상큼해서 다 먹진 못했어요 카레도 시켜봤는데 전 비추... ㅎ/유명한데 친절하시고 깔끔해서 5점 드립니다 맛이야 뭐 안심이 등심보다 굳/맛있고 친절깔끔/맛있어요/바삭하고 도톰해서 맛있어요"
