,name,address,sort,menu,mean_price,score,people_give_score,review_count,review_list
0,옥경이네건생선,서울 중구 퇴계로85길 7 (우)04576,"해물,생선","반건조 서대조림 (소),반건조 장대조림 (소),반건조 간재미탕 (소),반건조 민어구이 (소),반건조 민어찜 (소),반건조 병어조림",25000,3.2,30,145,"가성비 떨어지고 불친절의 대명사 유튜브에서 보고 갔는데 많이 실망스럽/서빙하는 아줌마 한분 태도때문에 다시는 안갈 듯. 불친절해서 오랜만에 모인 자리 분위기 안좋아짐 그렇게 대기해서 들어온 손님한테 본인들이 주문 누락해놓고 오히려 짜증내고 맛도 그 시간,태도 대비하면 특별하진 않아요 비싸기만한; 갑오징어는 두께만 두껍지 별로 촉촉하지 않고 질긴편입니다 민어찜은 민어도 얇고 질이 좋다기보단 옆에 무침 맛으로 먹음/신당중앙시장에 쥐 엄청 많은데 거기 왜 좋다고들 가는지 모르게땅/매체를 몇번타서 요즘 다시 유명세를 타긴 하지만. 핵창렬이라 동네 주민은 안가는 곳...../인기가 좋아져서인지 자꾸 가격을 올림.  갑오징어 구이 소짜가 2만9천원인건 바가지 가격이다 싶게 그정도로 특별할것도 기본으로 깔리는 반찬이 먹을만한게 있는것도 아님. 재방문 할 집은 아니다 싶게 왜 사람들이 줄서서 들어가는지 위생면으로나 서비스면 포함 공감은 안감. 생맥주 맛과 온도도 별로였음. 성시경이 하는 방송을 나도 봤지만 그 연예인이 맛집이라 하는...더보기/전참시 비맛집 성시경맛집  마른갑오징어구이 민어찜/술집이지만 민어 구이 시켜서 식사로 먹었는데 정말 감동적인 맛이네요… 식사는 다만,,,반찬이 없어서 식사로 먹기는 좀 그렇고.....비싸서 못먹은다는 민어…. 어머니 사드리려구요 어머니가 아주아주 좋아하실 것 같습니다.  갑오징어는 개인적으로 생각보다 질겨서, 둘이서 소짜 시키면 나중엔 좀 질렸어요 셋 이상이실시 작은거 시키셔서 다른 메뉴량 함께 드세요/맛은 보통입니다 건생선은 어디서 어떻게 먹어도 보통이상은 합니다 전통시장이라하여 저렴함 가성비를 생각하시면 안되는곳입니다 별을 두개만 주는이유는 가격이 사악함니다 건생선을 좋아하고 자주먹다보니 이정도로 비싼집은 처음이라  놀랐읍니다 전국 최고인듯 가격만 빼면 보통이라고 생각되는집이네요/갑오징어구이 먹고 눈이 휘둥그레. 세상에 이런 맛이!/생각보다 별로 소 자 시켰는데 중자 시키라고함 사람많음  가격 비쌈/핫한 시간에 방문하면 음식나오는데 삼십분 이상 걸려요. 제가 방문했을때 대부분 테이블이 빈상에 술만 마시고 있고 몇번의 컴플레인 후에야 음식을 받을 수 있었어요. 근데 음식받으면 맛있어서 기분 풀림,,  별점 두개 뺀 이유는 - 다녀와서 배탈이 났다,,,/갑오징어에 소주각 :)/갑오징어 최고/밥집아닌 술집/평소에 둘이서 한끼 한술상  6~7만원 먹는다면 그냥 소소  날잡고 둘이서 돈좀주고 맛난거 먹자 하기엔 많이 부족한 맛과 가격  /리뷰가 왜 보이지 않죠? 손님.많다고 손님을 진상이라고 들리게 욕 하는집, 말하는걸 들키자 카운터 지키미가 도망가서 주문을 거부하는 집, 언젠가 음식의 진실은 들어나게 됩니다./비싸고 사람많은 거 말고는 흠이…? /마요네즈 혐오하는데, 여긴 먹습니다/너무 비쌈/갑오징어 맛나요/예전에 수요미식회에 나온거 보고 갔는데 너무 실망했네요 동대문 생선 골목이 훨씬 더 좋아요"
1,직화장인,서울 중구 난계로11길 5 1층 (우)04575,"육류,고기",꽃화목살,16000,5.0,9,13,돼지고기가 살살녹아요 연속 이틀갔어요/여기 정말 맛있어서 혼밥하러갔는데 진짜 맛있음/꽃목살 오겹 이 집 필수코스/고기도 너무 맛있는데 반찬도 너무너무 짱짱 고기먹기 전 밥 한그릇 뚝딱 테이블에도 엄청 신경써주시공.. 잘먹었습니다~~~~~~/맛있어유/진짜 최고ㅋㅋㅋ 삼겹보단 목살이 더 나음 반찬도 다 맛있고 찌게 맛있음 볶음밥은 사람에 따라서는 젓갈 때문에 호불호 갈릴 수 있을 것 같음/돼지고기가 살살녹아여
2,무명,서울 중구 퇴계로87길 30 1층 (우)04575,일식,"스키야키 미국산(150g),DINNER PM5:00-AM02:00,24,900,하와이안크림새우,DINNER,7,000,7,000",17450,3.9,24,9,"맛은 있습니다.  외산 고기도 충분히 좋아요 가게가 좀 좁고 음악이 큰게 단점이라면 단점이네요. 다만 무제한이라 무턱대고 먹다보면 한동안 간장 맛에 물립니다. 적당히 드시고 적당히 즐기면 아주 좋은 집입니다  두번째 가니까 다시는 못갈 것 같네요.. 많이 물려요…./왈왈왈왈왈왈!!!크르릉...킁...왈왈왈왈왈!!!!!!컹컹왈왈왈왈왈왈!!!!!!가성비 좋으나 줄서서 먹기엔...살짝 고민되는 맛/맛있음!! 근데 일식특성상 살짝 물림주의 /웨이팅 너무 심했지만 그럼에도 불구하고 정말 맛있게 잘 먹었어요!!! 가성비짱짱맨!!!!!!!♡ /오랫만에 만난 일본인 지인과 갔는데 호불호가없을듯한 식사였네요 술을 마실수없어 넘아쉬울만큼ㅠㅠ 가격이 자주가기에는 좀부담스럽긴 하지만 좋아하는 사람이 있다면 같이한번가세요. 단점은 넘좁고 주차는 힘들듯하고 메뉴가 넘단순한게 시샤모,카라아게 정도 추가 메뉴가 있음 좋을꺼같습니다./좀 좁지만 음식이 맛있고 친절하세요! 노래 소리가 큰 건 크게 불편하지 않았어요/직원분들이 굉장히 친절하심 야채 무한리필인 점이 가격대비 괜춘한듯(버섯 짱 많이 줌) 하지만 미국산 소고기는 별로  국물많은편이 아니고 자작하게 먹는 스타일이라 샤브샤브 생각하면 비추. 인테리어 특이한데 테이블간 간격 매우 좁은편/밖에 우풍 들어옴 신발 좋아하는 사람은 모르겠으나 정신 사나움 창가자리 합석 불편 10월 밤바람에 한시간 웨이팅 왕별루 맛은 그럭저럭 직원분 친절 채소 리필 가능/테이블 간격 굉장히 좁은데 가림판 전혀 없음. 손님 별로 없는 데도 굳이 굳이 안쪽부터 순서대로 앉힘. (한 칸 띄워앉기/2m거리두기 전혀X) 직원들 오픈키친에서 마스크 내리고 떠들며 매장노래 따라부름.  수저 줄 때 맨손으로 입 닿는 부분 잡고 줌..(진짜 여기서 충격. 물로 씻어서 씀) 야채 상태도 별로. 새송이는 얼려놨다 녹였는지 쌔까맣고, 알배추는 ...더보기/가게 총 다섯테이블인데 도착했을 때 내부에 한 팀만 식사중이였음 너무 더운데 일행이 아직 안 와서 먼저 들어가 있으려고 했더니 절대 안 된다고 하네요^^ 일행 도착 후 기분이 상한 상태로 식사를 하고 계산할 때 여쭤보니 먼저 들어와있으면 안 되는게 사장님 지침이라고 하네요  그럼 주방에서 음식 하실 때 마스크 안 끼시던데 그것도 사장님 지침이냐고 물어봤더니...더보기/조던이라 하고싶었을것같다/맛있는데 조금 짜다ㅠ 글고 국물이 거의 없던데 .. 이게 원조인지 뭔지는 모르겠지만 국물이 있는 자글자글한 게 더 내스탈이었다 하지만 그럼에도 불구하고 존맛이긴 함!/웨이팅 오지는데, 진짜 내 최애 맛집...♥ 분위기 쩔고 점원들도 친절 사장님 친절 독특. 가서 실망한적 한번도 없음  너무 조아/맛있어요. 스키야키치고 가격이 너무 좋아요. /맛있음과 더불어 친절하신 직원분들까지 최공 :-)/사실 웨이팅 때문에 안에 못들어가봤다 ㅠㅠ 그래도 분위기는 너무 좋아보였음/또 가고 싶은 곳입니다./맛있는데 가성비 좋고 직원들이 친절하고 청결한 식당이 세상에 존재할까?  하더라...그런데 웨이팅이 길다...역시 세상은 공평함/맛있음 /푸짐하고 친절하고 맛있어요!!/야채, 고기 진짜 푸짐하고 국물도 너무 맛있어요! 치킨 가라아게도 맛있어요/처음 갔는데 친절히 설명도 잘 해주시고, 맛있게 먹고 왔네요.  밤에가니 찾기가 ㅎㅎㅎ/맛있어요 ㅠㅠ "
3,계류관,"서울 중구 퇴계로87길 15-17 1층 102,103호 (우)04576",닭요리,"물막국수,고기된장 막국수,참나무 능이장작구이,닭편육,닭모래집 대파튀김,닭모듬전",14000,4.2,25,77,"맛인었어요 야들야들해요/닭 모듬전 두번 드세요/참나무능이장작구이라 닭고기 육질이 부드러워요 찰밥 품은 통닭이라 안에는 쫀득한 찹쌀이랑 능이버섯,은행 등등이 넣어 있어서 한끼 보양식 먹는 맛이예요 담백하고 맛있답니다/비쥬얼 맛집. 맛은 어딘가 모르게 아쉽다. 닭이 퍽퍽해서 촉촉한 소스가 있으면 좋을듯.. 된장국수는 너무 짜고 물린다/트럭 통닭의 고급화/저만 알래요.... 매번 갈때마다 사람이 늘어나서 아쉬움 ㅠㅠ 진짜 맛잇어요...♥️/맛있어요/닭똥집튀김은 맛있습니다/장작구이는 맛없기도 힘드니까요 맛있어요! 겉에 껍질 쫄깃하고요 살은 유달리 부드럽다거나 퍽퍽한 느낌은 없었어요 안에 찹쌀밥이 정말 맛나요/기대 많이 하고 갔는데 생각보다는 그저 그랬네요 ㅎㅎ 장작구이 먹었는데 전반적으로 촉촉하다기 보단 퍼석한 느낌이었어요 ㅜ 분위기나 식기는 깔끔하니 좋았네요~/진짜 개맛존맛/처음 생길 때와 뭔가 달라짐. 대파튀김은 너무 느끼해졌고. 닭은 좀 가격에 비해 작아진 느낌./와 이집 미쳤네.. 잘하네 누룽지통닭스타일 많이 먹었지만 여기가 원탑, 똥집 튀김 무조건 추천 퀄리티 작살/장작구이는 언제나 맛있음! /장작구이 존맛...된장국수는 뭔가 기본으로 나오는 된장소스랑 베이스가 똑같은 느낌?이라 그런지 좀 물리고 짠 느낌이 있었어요 다시 간다면 국수말고 다른 걸 먹어볼 듯/닭똥집 튀김만 2번 먹었는데 넘 맛있어요 한방통닭도 먹어보고싶어요/전을 먹을바엔 닭 한마리를 더 시키세요…. /so so/1시간 넘게 기다렸눈데 진짜 맛있게 먹었어요  밑반찬도 넘나 맛있고요 굿/정말맛있어요2명이서 닭한마리랑 대파튀김 하나면 배터져요 (막걸리 1개)/맛있어요/가리봉동 넘 시름"
4,땡초곱창,서울 중구 퇴계로87길 54 (우)04575,"곱창,막창","야채곱창,양념구이,소금구이,땡초곱창,오돌뼈,뼈없는닭발",12000,4.0,22,100,맛도 맛이지만 친절해서 좋아요~~ 저녁 시간 대 웨이팅 주의!/진짜맛있음/종종 가는 곳인데 첫입에는 뭔가 밍밍해서 괜히 왔나 생각하다가 계속 먹게되는 맛. 그리고 여기는 볶음밥 먹으러 온다./정말 맛있어요 이제 알았다는게 아쉬운..자주 가렵니다/존맛!! 양도 많고 맛있어용 /땡초 매워서 혼났지만 맛있음/남자사장 있을때 가면 항상 기분잡쳐서나옴 참고하세요 /젋은사람들이 좋아할맛.. 야채곱창은 좀 매콤해요/왜 계속 생각나는 건가요.. 구이든 땡초든 여기가최고 /야채곱창 먹으러 1시간씩 4번왔다 넘맛있어요/먹다가 찍어서 양이 좀 적어보이는데 2인분 치고 양 많아요. 야채곱창 양이 12000원인거 생각해보면 그냥 그런느낌. 엄청 맛있다고 유튜브에서 보고 찾아갔는데 생각보다 그냥 그래요 40분 걸려서 찾아올 맛은 아님 야채곱창을 좋아해서 여기저기 다니는 걸 좋아하는데 제 기준 1순위는 중계동 삼성곱창입니다 2위는 노량진 곱창의전설 3위는 잠실새내 컵앤곱/야채곱창만 먹어봤지만 정말 맛있고 복음밥 시키실땐 꼭꼭 치즈 추가!! 치즈용암을 보실수 있습니다 ㅋㅋ 그리고 조금 매운편이니 매운거 못드시는분은 소금구이도 같이 시켜 드시면 좋을거 같아요~/엄마아빠가 처음 곱창이란 음식을 사줬던 집 그리고 내가 제일 좋아하는 음식이 곱창이 되어버리고~  9살 때 청계천에 데리고 갔었는데~벌써 20년이 다 되어간다~ 삼촌이 사장님이 되셨고 항상 이모님들도 모두 친절하시다.  내 생각에는...평점이 깎인 건... 경쟁곱창집인가?싶다 가끔 더 매운 날도 더 맛있는 날도 아주 미묘한 차이가 있기도 하지만 야곱이랑 볶...더보기/개존맛/어릴 적 중앙시장 뒷길 포장마차에서 연탄불에 구워 먹던 돼지부속 양념구이의 맛은 이제는 추억속으로 사라졌다./전역파티한 곳/굿굿 괜찮네 양념장 채소도 맘에들고
