,name,address,sort,menu,mean_price,score,people_give_score,review_count,review_list
0,살롱순라,서울 종로구 율곡로10길 75 (우)03134,이탈리안,표기안함,표기안함,3.8,52,251,
1,잘빠진메밀 익선동점,서울 종로구 율곡로8길 73 1층 (우)03134,국수,"순메밀 수육정식(,물/비빔국수 (250g)+수육 4점 비빔 +1000원,12,000,유자의빠진수육(반접시/한접시),한접시 +6000원,8,000,9,000,9,000",10000,3.7,51,233,"나 메밀 좋아하네/맛있어요! 근데 술 판매 하면서 1시간 반 시간 제한 있는건 너무 야속해요ㅠㅠ/막국수는 건강해지는 맛! 서비스로 주신 수육도 정말정말 맛있었어요 ㅠㅠ 직원분들 너무 친절하시고, 담엔 막걸리 뿌시러 방문할 예정이에요 ^^ /맛있게 잘 먹음. 음식이랑 막걸리 좋음. 자릿수가 많지는 않아서 저녁시간대 걸리면 웨이팅 있음. 화장실 (구조적인 문제 같지만) 조금만 더 물기 없이 깨끗하면 좋을듯./브레이크 타임 3시인거 지우든가 아님 3시까지 영업하든가 하세요   블로그에서 최근에 올라온 후기보고 브레이크 타임 3시것도 확인했고 라스트 오더 2시 30분이라고 해서 2시 10분에 방문했더니 직원분들이 식사 하시면서 지금 브레이크 타임이라고 나가라 하더군요 그래서 제가 아직 아니지 않냐고 하니깐 얼버무리며 아니라고 가라고 하길래 그냥 나왔습니다 아무리 ...더보기/특색은 없고 명성에 비해 무난한 맛  /두번 방문했어요 왜냐면 존맛탱 데려가는 사람들마다 너무 맛있다고 해요 가격도 많이 비싸지 않은 편 비빔메밀국수가 맛있어요 수육 작은 사이즈로 시키니 두명이서 모자랐어요 걍 큰 거 시키세요 그런데….! 전은 그냥 그래요 전은 제가 하는 게 더 맛있을 듯 별로 손 안가요/한옥 분위기가 아주 좋고 음식도 맛있어요 막걸리 샘플러도 여러가지술 맛볼수있어 좋아요/주말저녁 웨이팅 그리 길지 않았고 맛 상당히 만족하고 좋네요 추천합니다~/제가 올해 들어 갔던 곳 중에 가장 서비스가 좋았어요. 사장님 정말 맛있었고 잘 먹고 갑니다/이렇게 13000원.. ㅎ.. 점심에는 그냥 8-9000원 짜리 드시는게 이득이실듯/물막은 그냥 그랬어요. 소스 넣어 먹으면 흔한 냉면맛되고, 그냥 먹기엔 육수 자체는 맛나지만 면에 베지 않아 아쉬웠어요. 담엔 비냉으로 먹고 후기 남길게요.  추가로 비냉 먹으러 갔습니다. 수육 완전 실하고 4점인데도 배 불러요. 물막보다는 비막이 아무래도 간이 되서 더 나은고 같아요! 맵찔이로써 살짝 매콤함니다/불친절. 그냥 냉동만두맛 이상. 맛없음. /깔끔하게 잘 나오고 맛있네요. 다만 장소가 좁아 웨이팅 있으면 1시간30분 밖에 이용 못하니 방문 시 참고하세요/순메밀정식 2시반전에 시켰는데 2시반쯤 수육없이 국수만갖다줌 별거아닌데 이런걸로 기분상하게하는곳 국수맛도그저그렇고 다시는안가고싶음/:> 전체적으로 깔끔하고 정갈하며 맛도 무던하니 추천할만 해요 다만 좁고 작아 웨이팅은 감안하고 방문하세요/맛집이에용 깔끔하게 나옵니당 다만 수육인가가 가격대비 적긴 했어여… 전골은 굿 막국수도 슴슴하니 먹기좋앗어요/여기 손만두 아니지않나요? 같이 들어간 만두 인터넷에파는 싸구려 만두 맛이랑 똑같던데 (h브랜드) 집에서 만드는게 낫네요 절대 맛집아님/화려하고 이색적인 그런 음식들은 아니었습니다. 건강하고 깔끔하지만 깊이는 있는 미니멀한 느낌으로 좋았습니다. 분위기도 괜찮고 소소한게 근처 국악당이나 창덕궁 다녀오고 방문하면 더 좋을것같네요/국물도 진하구 맛있어요/입에 쫙쫙 붙는 맛은 아니지만 건강해지는 맛과 함께 아기자기함이 넘치는 곳./맛집이라고 하기엔 맛은 없지만 직원들의 서비스는 괜찮네요 밝게 일하는 모습이 참 보기 좋아요.  큼직한 손만두가 나쁘지않았어요 만두국 이라는데 음.... 메밀국수도 흠...보쌈은 장충동에서 먹던 보쌈 처럼 부드럽고 좋긴해요  sns멋집으로는 매우 괜찮지만 식사하러 가기엔 지인들과 가기에는 좀 부적합해요 그냥 간단하게 막걸리한잔 하기는 좋아요/리뷰보고 왔는데 ㅜㅜ 속았네요 왜이리 사람이 많은건지 이해불가요 만두전골 맛도 밍밍하고 양도 적고 수육은 퍽퍽하고 기름기만ㅡㅡ 넘 느끼하기만 마늘이랑 고추라도 있으면 배고프니 다먹었을텐데 이건~~완전 꽝 진짜 배고파서 왔는데도 남기고가요 ㅎㅎ/일단 수육은 맛없음. 그리고 수육에 마늘도 없이...학센도 아니고 식초무라니...  이단 만두전골 ? 맛없음. 삼단 막걸리 최저5천원 바가지  카카오맵 댓글 왕뻥/수육 만점 만두전골 80점/만두전골!! 너무 맛있어서 하나도 안남기고 국물까지 다먹었습니다 사이드 메뉴도 전체적으로 담백한 느낌이라 좋았구요 남자 사장님도  너무 친절하게 대해주셔서 너무 감사했습니다 이분 덕분에 담에 한번 더 오고 싶어졌어요!!ㅎㅎ/음식이 전체적으로 자극적이지 않아서 좋구 특히 만두전골!!강추입니다 그리구 홀이랑 주방?왔다갓다 하시는 남자분이 잘생기셔서 좋앗습니다/국수와 전병의 조합이 너무 좋아요 !  다음엔 전골 먹으러 올 예정이에요 슴슴하면서 담백한게 취저네요 !/만두전골도 존맛이구 분위기도 조녜...★/추운날 만두전골 쵝오입니다. 술안주로 모둠환상도 짱맛!  바쁠때는 피하는게 좋긴해요~ 자리고 좁아서  30분이상 기다리는 거라면 보통인 맛일수 있어요. 그래도 담백하고 건강한 맛을 찾으시고 여러가지 막걸리랑 먹는거라면 완전 강추입니다."
2,오죽이네,서울 종로구 돈화문로11가길 25 (우)03133,닭요리,"닭매운탕 (소),옻매운탕,쭈꾸미 (중),쭈삼겹 (중)",33750,4.3,114,281,"국물이~~크~~/변하지않는맛. 계속하세요./칼칼하니 진짜 너무 맛있는데 저녁에 진짜 진짜 진짜x100000시끄러워요 술취해서 목쉬어라 얘기할수있을땐 괜찮을거같은데,,멀쩡한 상태로 대화 절대 안됨ㅋㅋ/정말 맛있어요../닭냄새가 좀 나지만 무난무난했던 맛_술안주/마늘맛 좋아하면 추천/한 시간 기다렸음.. 또 가고 싶은 존맛/왜다 댓글이 좋을까요? 평만보고 갔는데  닭 파 양파 쥐골이만한 감자가 소자에 2만 5천이예요? 라면 사리 볶음밥 추가하니 거진 3만원 나온네요 거기다가 주차까지   그렇정도로 맛집아니고 완전 평법하고 비싸기만 하네여  볶음밥이 3천원이데 비주얼이 이장도예여.. 돈♬♩♩ 하고 싶은면 와서 드세요~/떡 면 엄청 좋아하는사람이라 라면사리 떡사리 수제비사리시켜서 행복하게먹었어요... 국물너무맛있고... 국물조금자작해도맛있고... 배부른데 라면사리 한번더 넣어먹고 볶음밥두개볶았는데 배불러도 맛있어서 들어가더라구여 그냥먹으면 심심한느낌으로 맛있는데 남은국물하구 살짝같이먹으면 더맛있습니다.../211227 국물맛최고/별 것 없는 것 같은데 오게 되는 맛 자리 좁고 시끌시끌/진짜 맛있어요 볶음밥 드실 때 국물이랑 같이 드셔 보세요... 극락의 맛•••/이날 나는 죽었다/그냥...웨이팅해서 먹을 정도는 아닌 거 같아요..30분 넘게 기다렸지만 그닥 보람은 없었네요  충분히 맛있는 닭도리탕이지만 웨이팅 할만큼 특별한 닭도리탕은 아닙니다 /가끔 잊고 지내다가 딱 생각나는 맛입니다. 그리고 복음밥 필수 입니다. 매우 만족하고 다시 방문할 생각입니다!/라면이랑 감자사리 필수!!! 적당히 매운 육수에 다진 마늘이 많이 들어가있어서 맛있었어용. 밖에서 봤을 땐 작은 가게인가 싶었는데 안으로 들어가니 굉장히 넓었고 사람들로 가득차있었습니다. 밥 먹고 바로 옆 익선동 골목 산책하기에도 좋아요. 크리스마스 점심 훌륭했어요 ㅎㅎ /됸마탱/맛있음 칼국수면 2개 넣어서 먹었더니 너무 배부름/볶음밥은 좀 별로임 근데 칼국수 사리 넣어서 좀 졸여먹으면 그렇게 마시씀 볶음밥은 양념이 좀 아까울정도/맛은 당연히 있고 가게가 엄청 깨끗하고 친절하십니다!! 볶음밥은 꼭 드세용 /존맛. 닭볶음탕처럼 생겼는데 국물에서는 매운탕 맛이 나서 너무 신기하고 맛있었어요./마늘향이 많이 나는 닭매운탕 칼칼하니 맛있다 재방문 의사 있음/칼국수사리 두 개 추가해서 먹어야지!/특출나지 않지만 술이랑 먹기 좋음/특별한 맛은 아닙니다.. 맛있읍니다./생각보다 매콤하고 맛있습니다!/오늘 갈거에요 주원아 사랑해/국물 쫄이면 사장님이 눈치주신다./국물에서 마늘맛 나는 게 너무 좋았어요!/사진은 그렇게 맛있어 보이게 나오진 않았지만 진짜 맛있었어요 칼칼하고 존맛 ㅠㅠ 하나 아쉬운건 닭이 좀 작더라구요 그래도 맛있게 먹었습니다 bb/미쳤음/정말 너무 맛있어요ㅠㅠㅠ 해장으로도 딱이고 술안주로도 딱이에요 진짜 순삭했어요 최고"
3,서울집시,서울 종로구 서순라길 107 (우)03134,"호프,요리주점","볼케이노 감자샐러드,중화풍 산초 아게다시도후,하몽과 아보카도,초리조 테이터 탓,사천식 라구 파스타,태국식 당면 샐러드",11300,4.2,60,95,"분위기가 좋아 앞에 바로 창덕궁 담벼락 보이고 나무도 이쁘고 맥주도 다양하고 맛있었는데 직원분이 너무 친절하게 설명 잘해주셨음..  메뉴도 신기한거 많고 또 가고싶다/음식이 맥주와 패어링 되지는 않음 맥주 따로 음식 따로 직원이 매우 불친절함/맥주 좋아하는 사람들이라면 누구나 이름을 들어봤을 곳. 음식도 기대 이상이었다. /파스타 맛있고 분위기좋다/맥주 맛있어요 음식도 먹을만해요 돌담길 옆이 좋네요 날 좋을 때 밖 벤치에 앉아서 여유부려봐야겟어요/토요일, 웨이팅 했습니다 30분 정도 했는데 후회 안합니다  아.. 감자셀러드... 진짜 감자 안좋아하는데 크리미 하니 입에서 살살 녹습니다.. 아.. 파스타.. 이게 은근히 맵고 칼칼한데 맥주랑 너무 잘 어울립니다..  맥주는 후기 처럼 비쌉니다. 그냥 마시고 죽자! 처럼 맥주를 대하기 보다는 약간 간술 처럼 생각하시면 될 거 같아요  1차보단 2차가 적...더보기/맥주가 비싼건 한잔에 9500원인데 슬퍼요  하지만 맛있다는거… 안주도 괜찮아요! /노키즈존입니다. 오후 3시 어렵게 찾아갔더니만 문전박대ㅎㅎㅎ 인스타에 고지 하시지 그러셨냐 하니 맥주집이라 말 안해도 다들 아신다네요ㅋㅋㅋㅋㅋ 그러면 영국에 있는 수백만개 펍들은 왜 노키즈존이 아닐까요ㅋㅋㅋ 서울 브루어리, 핸드앤몰트, 맥파이, 크래머리, 스탠서울, 펀더멘탈, 어매이징 브루어리 다 노키즈존 아니었구요. 노키즈존은 당연한게 아니에요. 굳이 그...더보기/두부랑 맥주랑 개마쉿슴/라구파스타 먹는데 아그작해서 봤는데  저 사진에 있는거 나왔어요 근데 저건 2번째 나온거구  첫번째 나온건 저거 크기 2배 였고요 씹다가 어금니쪽에서 아그작해서 뱉어서 보여줬더니 바로 돼지고기뼈 라고 하시면서 자기네 잘못없단식으로만 얘기해서 알겠다고 하고 그냥 먹는데 친구도 먹자마자 바로 저거 또 씹어서 두번째로 나오는건 문제 있는거 아니냐 하면서 얘기하니...더보기/메뉴판에 있던 맥주 다 먹어봤는데 다 존맛. 안주는 감자 샐러드 시켰는데 그냥저냥~~밥 먹고 맥주 부시러 가는 곳/맥주 라인업 항상 만족 사워 많음 의외로 안주도 괜찮다. 합리적인 가격과 양 맥주 좋아하면 찾아서 갈 만함/음식마다 마라맛이 너무 강해서 먹기 힘들었어요 맛있지만...  맥주와 분위기는 좋습니다!/콸콸콸 맥주도 맛잇구 냠냠냠 안주도 맛잇구 분위기도 좋고 부족한 것은 내 주머니의 돈 뿐이다/최고/이곳은 찐이다. 맥주맛,안주맛,공간분위기,음악,직원들의 친절함. 다 완벽했고 올해 간 집 중에서 무조건 남한테 추천하고 재방문의사 100프로인 곳이었다. + 처음갔는데 메뉴 잘 시킨 나를 칭찬한다. 고수 싫지 않다면 꼭 저 소면 시키시길. 짭짤하고 자극적인 다른 메뉴들에 상큼함을 추가 시켜준다. /맛도 서비스도 분위기도 너무 좋아요 즉흥적으로 왔는데 간단하게 먹기 좋아요! 수제맥주여서 가격대가 있지만 좋은 경험이고 자주오고싶어요/서비스 최악. 불친절. 음식 서빙하는 사람이 발가락 다 보이게 반바지에 맨발에 쓰레빠 신고 서빙하는거 처음 봄/맥주는 갠춘한데 안경 안쓰신 분 불친절하시고.... 결정적으로 어떤 교회다니시는 분이 제 우산을 바꿔가셔서 아주 기분이 나쁩니다.... 허허.. /분위기가 너무 좋다. 맥주가 이렇게 맛있을수가있을까. 향신료나 독특한 음식에 거부감 없다면 고를만한 안주도 다양하다. /전부터 가보고 싶었던 이곳 서로 의견 맞아서 드디어 고고! 감자 샐러드와 사천 파스타 꿀맛 맥주도 추천받아 마시는데 산뜻한데 또 은근 진해서 입맛에 잘맞음 날씨 풀리면 또 가고 싶어지는 곳/독특한 수제맥주 특히 신맛의 맥주는 처음 경험해본 짜릿함. 감자샐러드의 소스가 익숙한듯 맛나다. 분위기 또한 최고 살짝 보이는 조선의 담장까지/맥주 짱맛.../전반적으로 만족/사랑해... 서울집시... /낮술하기 좋은 날 술도 맛나고 주변 분위기도 넘 좋다~/생각만큼 , 웨이팅 30-40분의 가치만큼은 ... 한번 방문한거로 만족/서울 최고의 펍!/음식은 특이하고 괜찮지만 간이 좀 센편이라 어떤 맥주랑은 괜찮고 어떤 맥주랑은 잘 안맞고 그랬어요. 탭리스트가 다양한 편이라 좋고, 크래프트비어인점 감안하더라도 싼편은 아니에요~/돌담+맥주의맛+비추적추적 = 크으으/맥주 안주 분위기 모두 맛집임 ㅋㅋ"
4,이경문순대곱창,서울 종로구 돈화문로11나길 5 (우)03133,순대,"순대곱창전골 (소),사골순대국,얼큰이순대국,얼큰이술국,모듬,순대고기 (소)",13800,3.6,86,263,"맛으로는 무척 메리트 있는 집. 단지 여자 친구를 데려올 수 있느냐고 묻는다면 쉽게 답하지 못할 것 같다./순대국 좋아하고 인스타든어디든 맛집이라고하길래 찾아갔는데  원래 시장에서도 밥 잘먹고 나이많으신분들이 하는 식당이면 어느정도 이해를 하면서 먹는편인대 여긴 어나더레벨이에요,,, 테이블이며 테이블 칸막이에 국물 다 튀어있는데 안닦은지 오래됐는지 딱딱하게 굳어있고 먹으면서 최대한 안볼려고 노력했는데  진짜 제일 비위상했던건 물안에 까만거 떠다녀서 바로 밥맛떨어...더보기/오래된 단골집.. 조금씩 sns에 뜨더니  할배들의 낮술성지에서 이젠 2030전용 식당! 솔직히 가게 보자마자 느낌 나올텐데 굳이 들어가서 위생을 논할필요는 없을듯하네요 사실 오바할정도로 비위생적인건 또 아닙니다/내 기준에서는 살짝 맵기는 했는데 잘 먹고 옴/위생 보소 ㅋㅋㅋㅋㅋㅋㅋㅋㅋㅋㅋㅋㅋㅋㅋㅋㅋㅋㅋㅋㅋㅋㅋㅋㅋㅋㅋㅋㅋㅋㅋㅋㅋㅋㅋㅋㅋㅋㅋㅋㅋㅋㅋㅋㅋㅋㅋㅋㅋㅋㅋㅋㅋㅋㅋㅋㅋㅋㅋㅋㅋ/양 많고 맛도 얼큰 고소해서 해장하기 너무 좋음! 근데 위생적으로 예민한 분들은 좀가기 힘들수도? 볶음밥도 달라고 하면 공기밥에 김 참기름도 주심.. 맛도리/점점 배짱장사하네요 일행 15분 늦어서 먼저 주문하고 끓이면 오자마자 먹으려는데 그것도 안된다고 하네요;;; 손절합니다/위생때문에 비추. 다 신경 안 쓰고 양많고 맛 적당하고 싼 안주에 술 많이 먹고싶다 하면 이만한데 없음./바퀴벌레 맛집/두명이서 소짜 시키려니  중짜 시키라고 눈치 엄청 줍니다. 빈자리 있음에도 좁은자리 강요합니다. 위생상태 엉망입니다. 노포들이 방송 타고 , 장사 잘되면 1. 가격이 오른다. 2.불친절해진다. 3.맛이 없어진다. 여기도 그러한 과정이 눈에 잘 보입니다. 이래저래 기분 잡치고 왔습니다./위생 저세상 +좁고 시끌벅적 +맛도 그정도인지도 모르겠음… 그냥 그렇던데  위생 우욱욱/맛은 있으나  위생이…. 자리도 엄청 불편하고 좌식테이블도 좁아서 사람 손 밟기도 하고 양말도 안 신은 사람들 보면 입맛 떨어져서 재방의사 없습니다/노포로 맛 인정 국물은 찐  소주 안주로 베스트 다만 떨어지는 위생과 불편한 좌석동선이 일하시는 직원분들도 버거워 그 불친절함이 손님에게 전가됨/정말 맛있고 양도 많아서 대만족이었는데 다 먹어갈 무렵 건더기 위에 새끼바퀴벌레 죽은 게 붙어있어서 정말 비위 상했습니다 날파리 정도라면 아무렇지 않게 건져내고 계속 먹었을 것을 정확히 바퀴벌레인 걸 확인하고나니 도저히 남은 음식을 먹을 수가 없더군요.  밥 사주는 친구가 혹시 서운해할까 싶어 티도 못 내고 클레임도 못 걸고 그냥 조용히 젓가락 내려놨네요....더보기/맛있는지는 모르겠는데 기본적인 위생상태가 엉망이에요ㅠㅜ 바닥에 휴지 굴러다니고 식탁사이 칸막이에도 음식물 다 묻어있고요… 굳이 찾아와서 먹고싶지 않네요/졸라맛있음 위생별로지만 소주가 다 소독시켜줌/가성비도 짱! 맛도 짱~~!/아재감성 최고맛집/썩 친절하시진 않지만 맛이 다한 집 ㅠㅡㅜ,,, 여름엔 핵 더울듯,,, 근데 자꾸 생각나는 집!/ㄹㅇ인생맛집 ㅠ 맛에 비해 평점이 과소평가됨. 양이 진짜진짜 많음 ㅠ 한여름 장마로 불쾌지수 최악일때도 먹으러 오고싶은 맛임. 인스타 사진 뭐 그런거 다 필요없고 맛만 찾는다 하면 진짜 추천 ㅠ/진짜 맛있었습니다 양이 많아서 볶음밥 못 먹었는데 아쉬웠어요ㅠ/스멜도 별로 안나고 칼칼하고 맛있습니다. 무엇보다 양이 무진장 많아요.. 두 명이서 소 시켰는데 볶음밥은 커녕 곱창도 조금 남겼어요 ㅠㅠ 다음에는 3명으로 가서 소시키고 볶음밥도 먹는 걸로../와.. 인생순대국  양 많고, 맛있고 사장님 친근하시고 ㅎㅎ/착한 순대국^^*♡ 초심 잃지 마시길...^^*♡/인생전골집..... 이모님들때매 소주1병먹을거 3병먹엇자나욧!!!!ㅠㅠㅠㅠㅠ 이모님들 시크한듯 대왕친절하심....... /마이쩡/맛도 물론이고 일하시는 어머니들도 착하시고 정말 꼭 오세요/얼큰이 2인분 포장했는데, 웬만한 순대국집 5인분은 될듯;;;/내 마음 속 넘버원 순대국/아재감성. 술이 술술 들어가는곳  종로에서 위생은 기대하면 안되고 맛으로 가격으로 승부하는곳! 여자 3명 중짜리 너무 배터지고 밥볶을거라면 소짜시키구 밥볶는걸 추천함니다.  곱창이 야들거리구 냄새가 1두안나서 너무 맛있게 잘먹음. 또 갈듯"
5,맛나분식,서울 종로구 돈화문로6가길 40 1층 (우)03138,분식,"김밥,오뎅 (1꼬지),떡볶이 (1인분),순대 (1인분),계란 (2개)",2000,3.5,24,42,
6,하이웨이스트 익선점,서울 종로구 돈화문로11다길 18 (우)03133,카페,"아메리카노,카페라떼,에스프레소,크림 라떼,스카치 라떼",6600,3.4,55,404,"여기 가냐고 익선동 다른 카페를 못가봤어요 .. 다른 곳 가려고 하면 여기 케이크들이 자꾸 눈에 아른거림 ㅠㅠ ㅇㅏ무래도 다 먹어봐야지 다른 곳 갈 수 있을 것 같아여 /자연채광이라 좋아요 가격은 아쉬워요/낮과 밤 분위기가 틀린 케잌맛집. 차한잔하기 좋은곳 ..근데 여종업원 불친절.../남직원들 주문한다고했는데 제대로 듣지도않고 나랑 얘기하는 도중에 양해없이  다른 손님이랑 대화함..:;;;; 커피는 마싯~ 내부는 시끄럽~/안 사도 구경은 가는 곳. 스콘, 케이크 모두 괜찮음. 선물했을 때 반응 좋음./사람은 많지만..예쁘고 꾸덕 묵직한 케이크 최고에요/가격은 깡패지만 밖에 지나가다가 안에 진열된 베이커리에 반해서 들어갔습니다 /와…이 비주얼!! 유럽온듯^^ 음악도 케잌도 굿!! 커피가 좀 더 쌀 순 없을까요? 나 6500원짜리 순두부 먹고왔는데^^/사람 많움/사람 붐빌 때 가서 정신 없지만 음료와 디저트 모두 맛있음/카페 분위기와 디저트가 너무 잘 어울리네용/좋아요 ㅎㅎ 사람많은건 익선동이라 어쩔수 없네요/가게는 확실히 이쁜 곳  그치만 빵과 음료가 너무 달다 가격만큼 맛있지않음 손님이 많고 웨이팅있음/분위기 좋고 예쁘긴 한디 커피맛도 케익맛도 별루입니다. 걍 사진찍으러 간다고 생각하세요. 아 케익은 파리와 함께입니다 똥파리 겁나 날려요/이쁜것보다 맛나기까지해요 근데 커피도...친절도는 보통 사람이 넘 많아서 자리를 맡아야하고 스콘보다 케크가맛나요 곰돌케크도너무나귀요미/재방문의사 소개의사 없어요/다른 건 모르겠고 바질스콘이 진짜 존맛탱 화장실은 남녀구분 x  /직원분들도 친절하시고 당근케익, 시그니처 커피도 맛있었어요~/Dessert /레몬치즈케이크 존맛 근데 솔직히 음료 가격 너무 비싸요 진심/치즈케이크 맛집/카페 외관이랑 내부 분위기 너무 좋아서 살고싶을 정도..  케이크랑 스콘 종류도 많아서 사진찍느라 정신이 없었다 진짜 다 좋은데 노래소리가 너무 컸고 친구가 블루베리 레몬에이드? 아이스티? 시켰는데 아메리카노 주신,, 너무 바빠 보이셔서 그냥 마셨는데 이것빼곤 다 괜찮았다 오후 될 수록 사람이 많아져서 + 음악소리 = 조용한 편은 아니다 스콘이랑 케이크도 ...더보기/블루베리 치즈 너무 맛남/스콘이랑 앙버터땜에 또 오고싶음 /빵집인줄알았는데 아메리카노집... 같이 나온 플렛화이트는 뜨거운데 왜 유리잔에 주나...-1 /인테리어 맛집/커피 : 5 케잌 : 2 분위기 : 4 친절 : 2 값 : 익선동물가/커피는 맛있음. 케이크는 처음에 가짜인 줄 알았는데 진짜였음. 착각할 정도로 예쁘고 윤기가 좌르르 들어갔을 땐 손님이 별로 없어서 조용하고 햇빛도 들어오니 좋았는데 사람들 점심 먹고 디저트 먹으러 들어오면서부터 엄청 시끄러워짐.  다들 밥 먹을 때 카페 가시고 다들 카페 갈 때 밥 드시러 가시길/예쁜데 코로나때문에 걱정됨/음악 시끄럽고 케잌도 썩... 느끼한편이에요  비추"
