,name,address,sort,menu,mean_price,score,people_give_score,review_count,review_list
0,놀부만두,서울 동대문구 망우로16길 15 (우)02499,분식,"고기통만두 (10개),김치만두 (8개),냉모밀,비빔모밀,온모밀,유부우동",5166,3.8,37,87,"냉모밀이랑 고기만두 넘넘 맛나요 /만두맛있어요 다만 만두는 카드결제든 현금결제는 상관없이 부가세가 따로 붙어요 메뉴판에도 적혀있네요 원래 메뉴판에 부가세 포함된 금액으로 적어두시지않나.../김치만두 너무 맛없네요 ㅠㅠ 두부랑 당면만 들어잇고.../고기만두 별 다섯개 김치만두 별 세개 무조건 고기추천/만두 맛집~모밀도 맛남~우리동네에 있었으면 하는가게~만두가격이 쫌 ~/항상포장해먹는데 동대문구  만두원탑 최고맛집이요!!/모밀맛집/고기만두 모밀 맛있음/모밀 나름 맛있어요/메밀소바와 떡만두국 만두모두 넘 맛있어요. 특히 가족 모두가 너무 친절하고 좋아요! 한달에 3번은 꼭 가서 먹고있어요./만두랑 냉모밀 맛있음 /고기 만두랑 쫄면이랑 간단하게 먹기 좋은 집 집앞에 간단히 먹고 들어가는 동네 음식점 느낌! 원래 고기만두 보다 김치만두 파인데 여기는 고기만두가 더 나았다/만두 정말 맛없습니다. 태어나서 먹어본 만두 중에 제일 맛없다./만두랑 온모밀 맛있어서, 가면 항상 배 터지도록 먹었었는데... 시립대 졸업 후 갈 기회가 없었지만, 그래도 자주 생각이 나네요. ㅎㅎ/모밀이 정말로 맛있다. 맑은데 진하고 겨자의 톡쏘는 향이 계속 먹게된다!! 하지만 다른메뉴는 안 시켜도 될 것같다 ;-) 모밀만 먹는거 추천! /김치만두피가 딱딱하고 밀가루 덩어리 씹는 맛,, 태어나서 첨 경험해본 만두의 맛이었습니다 반면에 고기만두는 무난하게 맛있어요!/카드결제 되냐고 물었더니 표정 변하시고.  만두 4000원이라고 붙여있는데 카드결제로 두개 포장하니 8800원 결제함.. 가게 그어디에도 카드로 결제하면 수수료 더 받는다던지 구두로 설명받은것도 없는데.. 문자내역을 나중에 확인해서 따지지도 못했네요. /맛은 있지만 김치만두 맨손으로 집어서 접시에 놓는건..아니올시다  돈만지고 부채질하고 손이 바쁘신거같은데.../점심시간 1시쯤에 갔는데 3팀정도 웨이팅 있었고 포장 손님도 많았어요! 밖에서 만두 찌는 사장님이 너무 친절하셨어요! 계속 차 조심하라고 더우니까 들어오시라 등  챙겨주사고 심지어 손님 아닌 학생들까지 차 조심하라고 하더라구요ㅎㅎ 들어와서 모밀에 사리추가하고 고기만두 한판 시켰어요! 밖에서 웨이팅 적을때 주문도 같이 받아서 앉아마자 모밀이 왔어요! 더운날이...더보기/다 썼는데 날라갔ㅠ 진짜진짜 맛있어요. 전 만두는 그닥이고 모밀을 진짜 좋아해서 갔는데 만두안먹었으면 억울했을뻔...고기만두 끝장입니다. 집만두 좋아하시면 세판은 드실 수 있을듯!!전 간장 안 찍어먹거든요. 모밀과 드실거면 그냥 드세요. 진짜 맛있어요ㅠㅠ쓰면서 또 먹고싶어요ㅠㅠ 아!!그리고 직원분들 사장님 진짜 다들 친절하세요. 젊으신 직원분들도 나이지긋하...더보기/우선 이곳은 고기만두와 모밀이 가장 훌륭합니다. 만두는 야들야들 촉촉하고 모밀은 쫄깃 탱탱한데 육수에서 감칠맛이 납니다. 작은 가게가 항상 붐비는데도 친절함을 잃지 않는 직원분들 덕에 항상 기분 좋게 찾아갑니다. 제가 돈이 진짜 많고 건강에 신경 안 쓰는 사람이었으면 매일 가서 모밀과 만두를 잔뜩 먹었을거에요. 하지만 돈 없는 새럼이라 참습니다.  追: 적...더보기/고기만두 방금 사서 포장해와서 먹었는데 잘못찐건지 어떤지 모르겠는데.. 만두피가 서로 완전히 다 달라붙어서 떡처럼 되고, 먹으려고 조심해서 떼어내는데도 만두가 산산조각 나네요.  만두속 맛은 괜찮던데 이렇게 다 피가 떡지고 찢어져버리면 그게 만두라고 해야할지 뭐라고 해야할지 애매하네요..  만두엔 10% 부가세 추가로 더 붙이는것도 좀 그랬구요./고기만두 꼭드세요, 피가 내용물이 다 비칠 정도로 얇고 쫀득쫀득하고 만두소도 육즙이 장난아니에요! 혼자 3판도 먹을 수 있겠던데 메밀이랑 먹어서 1판만 먹음  메밀은 더운 날씨에 먹기 딱 좋았습니다/냉모밀 최고/모밀 맛나요~~^^/그냥 최고다+잘됬으면 좋겠다/수제만두는 잡맛이 없고 모밀은 진하고 밀가루 냄새가 안 남."
1,이모네왕파전,서울 동대문구 회기로28길 12-3 (우)02446,"호프,요리주점","해물파전,김치전,김치치즈파전,꼬치,고추튀김",10600,3.4,48,121,"갓갓갓성비 2차 장소로 딱이에요/낮술은 파전에 동동주지 회기파전골목에 점심에도 여는 파전집이야 고추튀김도 꼭 같이 먹어봐/★2번째 방문입니다. (2021.02.09 방문이 처음)★   세트메뉴마다 떡볶이 들어있는 게 마음에 안 들어서 파전 단품 하나만 시킴. 어차피 전만 먹으러 온 거고, 나중에 전 세트 하나 더 시킬 생각이라 별 생각 없이 전이랑 소주 시킴. 근데 주문 받던 분이 ㅈㄴ 크게 혼잣말로 들으란듯이 ""차라리 세트를 시키지""하면서 혀를 차고 감. 일단 여기서 1차 ...더보기/파전 맛있고 막걸리 좋습니다/짜요/안주 양 지이이인짜 많고 맛있어요!-! 막걸리도 종류 다양해서 넘넘 조아요♡♥ 해물파전도 바삭바삭하고 해물 많이 들어가있구 김치전도 치즈 양 짱 많아요ㅠㅠㅠㅠ 파전 땡길 때 오면 딱 좋을 거 같아요~!~!/술맛이 사악 돌아요 ㅎ/글두 가끔가는데... 갈 적...마다...실망만.. 이제 그만 잊어얄 듯한..곳.. 내 추억 가득한 곳인데.. 잊기 싫어 가끔이라도 찾는데../신입생때 추억에 젖어 다시가뵜으나...추억은 추억으로만 남겨놓자/냠냠/저렴해서 얇은 지갑 걱정없이 먹을 수 있는 곳. /싸다... 파전이 맛있음  항아리 막걸리랑 곱창 전골은 추천하지 않음../친근하고 좋았음/가격 대비 양 정말 푸짐해요 친절도는 보통입니다/떡볶이 하나에 막걸리 한병클리어. 가격보고 조금씩 나올줄알았는데 완전 배터지게 먹음/가성비가 엄청 좋았어요! 역시 대학가 앞/들어가자마자 길 막는다고 비키라고 하고 주문 받으실 생각도 안하시네요/추억의 장소.  회기에서 막걸리 먹을만한데가 파전골목말고는 딱히 갈만한 곳이 읎~다  파전골목은 두 집만 다녔는데 특별한 이유는 없고 상대적으로 편해서./가성비 굿 떡볶이 맛집/파전집이라 화장실 더러울까봐 걱정했는데 화장실 상태가 양호해서 너무 좋았어요. 그리고 세트 메뉴 구성도 다양해서 골라 먹는 재미가 있습니다 추천해요/가성비 압도적 i셋트 두명이서 먹기에 엄청많음. 단품과 막걸리 한잔시켜도 충분히 먹을듯. 맛도 맛있음. 결론 아ㅠ 양이 너무 많다ㅠ/무난지비/여전한 가격 여전한 맛 사람만 드릅게 많음/파전이 눅눅해요.. 계란말이는 계란향만나구요 /세트 메뉴 시켰는데 떡볶이만 나오고  한 20분 지나고  다른 메뉴가 안 나오길래 떡볶이만 계산 하고 간다고 하니 그건 안된다고 주방에 제촉 했다는데 그리고 5분후 인가 파전나오고  파전도 식어서 기름덩어리 ㅡㅡ 일반코스 요리 도 이 기다리는 시간보다 더 빠를듯... 비교 하고 싶지 않지만 종로  광장시장 가서 빈대떡 만드는법 좀 배우시길 바랍니다 회기 파...더보기/너무두껍고 기름맛이강함.../위생은 엉망 전을 새카만 장갑으로 뒤집고 수저는 끈적인다. 심지어 주문한 음식도 안 나와서 짜증이 나있는데 할머니가 와서 건빵이 들어있던 그릇을 그릇이 부족하다는 구실 말도 안 하고 탁하고 가져가버려서 폭발해서 대판 싸우고 나옴ㅡㅡ/위생이 엉망임. 왜 다들 여기 가는지 모르겠다. 안좋은 기억들만 남고 다시는 가고싶지 않은 곳./맛있어요~^^/양 정말 많고 가격저렴  맛도 괜츈"
2,망우로30,서울 동대문구 망우로 30-1 (우)02494,카페,"무하과스콘,크림치즈스콘",3800,3.9,25,135,"주택을 개조한 멋진 카페가 생겼어 인터리어와 그림, 오브제들이 멋져 마당이 있어 개랑 오는 사람들도 있고 개방감이 있어 사람이 많으면 좀 좁을것 같기는 해 사진찍기는 추천해/디카페인러에겐 감사할 따름이죠. 음료 맛도, 양도 나이스함/어제 카페방문후 미접종자여서 주문하고 퇴실하게되어 실수로 진동벨을 주머니에 들고와버렸네요! 연락처가없어서 여기에 남김니다 날씨가 너무추워서 곧 가져다 드리게씁니다/인테리어가 귀엽고  특히 밖이 예븐거 같아요  맛은 무난해요/회기에 좋은 갬성카페/코로나때문에 밖에 앉고 싶어서 갔는데 앉아서 떠들기 딱 좋다/그냥 괜찮아요 주차장이 있는게 강점/아인슈페너 먹었는데 크림 꾸덕하고 달달하니 딱 적당하고 커피도 맛있었어요ㅎㅎ 외관도 예쁘고 또가겠습니당! ㅎ/음료맛있어요. 근데 늘 저녁 때 가서 그런가 자리가 없었어요../과제하기 좋았어요ㅎㅎ 분위기 좋아요/회기가 발전 중인가봐여 ㅋㅋㅋㅋ 생긴지 2년정도 된거같은데, 처음 가봐요! 제주도 놀러온 느낌이네요! 자리 넓은편이고 편하게 놀다갑니당!/5월5일에 방문했는데 어린이날이라 사람이 많더라구요 코로나라 따닥따닥붙어앉기싫어서 음료랑 커피맛나는쿠키 테이크아웃했어용 음료랑 쿠키맛은 보통이구 분위기는 밖에가 너무 좋습니다 다만 주문받는 여자직원이 다소 불친절하더라구요/아메리카노에서 계속 느끼한 맛이 나서 못 마시겠더라구요.. 원두 관리가 제대로 안 된건지... 그래도 즐거운 시간 보내다가 갑니다!/커피맛은 무난하고, 카페가 아늑해서 편안한 느낌이에요.  /스콘은 맛있었지만 음료는 그냥 쏘쏘,,흔한 맛이었어요 그리고 사장님인지 알바생분인지 모르겠지만 주문받을때 불친절하시다가 실수하실때는 친절하시다가.. /커피가 맛없는데 벽돌 의자 그냥 한 시간 정도 머물 만함/열대후르츠에이드 특별하고 맛있어요ㅎㅎ 스콘도 데워주셔서 따뜻했어요. 집이 멀어서 다시 가보기 힘든게 아쉬울 정도 ㅠ/주차장 굿 아인슈페너 굿/인테리어, 분위기 다 좋고 무엇보다 커피가 정말 맛있다"
3,베러댄,서울 동대문구 망우로 34 진성빌딩 1층 (우)02494,카페,"아메리카노,카페라떼,시그니처 라떼,밀크티 (ICE),ultimate 초콜릿",5300,3.6,20,115,"인테리어 이쁘고 넓고 깔끔. 디저트도 평타 이상은 함. 단점은 인테리어 분위기 다 헤치는 카페 노래,,,, 아이돌 노래 그런거 틀음.. 카페 갬성 다 깸...음악 소리도 매우 큰 편..노래만 바꾸면 딱 좋은 카페.,,,ㅠ /꺄악 너무 분위기도 좋고 맛있어요!!/루이비똥~/토요일 1시쯤 일하시는 여자직원분 주문 받으실 때 응대가 좀 불편했어요. /저도 크로플이랑 커피는 실망이었어요... 공간이 아까워요 ㅜㅜ/크로플 뭐가 맛있는지 잘 모르겠어요. 바쁘지도 않은데, 바로 구워주는 것도 아니고, 미적지근한 크로플에 아이스크림 올려주고. 아메리카노는 왜 화장품 맛 나죠ㅠㅠㅠ 그리고 점원분이 사장님이신지는 모르겠는데 너무 불친절해요. 인사는 바라지도 않아요. 큐알코드 좀 늦게 찍었다고 눈치주시고 기다리는 사람도 없었는데, 표정이 왜 왔냐 이런 느낌이라 기분이 너무 나빠...더보기/굿굿 분위기 좋아요/넓고 쾌적! 하지만 시그니처음료가 별로여서 아쉬웠음. 보통 크림라떼는 음료와 크림을 입으로 마셨을 때 같이 마셔져야 맛있는데 크림이 너무 꾸덕해서 라떼가 절대로 안마셔진다.ㅜ 위에 파우더도 과하게 많이 뿌려져서 보기엔 이쁘지만 입에선 별로였다. 하지만 친구가 마신 바닐라라떼는 괜찮았다고 하네용!/쾌적하고 좋아요/공간도 넓고 커피도 맛있어요. 커피는 곡물향 위주이고 고소한 맛입니다. 플랫화이트가 맛있어요./넓고 쾌적해요/와 전 여기 크로플 맛집이라고 생각해요 진짜ㅠㅠ 크로플도 맛있는데 음료도 괜찮고 넓고 쾌적해서 좋았습니다!! /아아 쟈스민 시나몬아이스크림와플 무난. 퀄리티있는 디저트들은 아니니까 기대까진 필요없음. 손으로 먹는게 아닌데 와플주면서 포크랑 나이프는 챙겨주세요 찾으니까 몇개필요하시냐고 하지말고/넓고 크고 시원하고 좋앙용/자리 넓고 쾌적해서 좋은데 알바분이 너무너무 불친절하네요.. 묻는 말에도 고개만 끄덕거리시고 크로와상 좀 데워주실 수 있냐 여쭸더니 아.. 데워드려요? 라고 하시네요ㅜ 다신 안갈 듯합니다/근래 가본 카페 중에 가장 마음에 들었다 일단 천장이 높아서 확- 트이는 마음! 공간이 넓고 인테리어도 좋아서 너무 마음에 들었고 음료가격도 괜찮은 편. 음료맛은 나쁘지 않았다 다만 브라우니는 너무 아쉬웠다 디저트류는 고민을 좀 해보셔야 할 듯.../인테리어 시원시원해서 예쁘고 음료도 맛있는 편이에요✔︎  디저트는 조금 비싼 것 같아요~/좋아요 디저트류도 맛잇어요"
4,한시십일분,서울 동대문구 망우로 66 지하1층 (우)02496,카페,"아메리카노,카페라떼,크림라떼,밀크티,11분 라떼",4800,4.9,16,61,"예쁘면 다 맛있음 양이 쫌 적다/커피도 스콘도 맛있었고 소소 귀여워요ㅜ/강아지도 이쁘구 사장님도 엄청 착하시고 너무너무 맘에 드는 카페임니다 (^^)/너무너무 조아요/나만 알고싶은 숨은 카페 음료도 직접 가져다주시고, 분위기마저 있어서 조용히 스터디하거나 가벼운 대화정도 하기에 최고인 카페입니다! 강아지 소소랑 간간히 놀아주는것도 힐링이네요/숨은 카페맛집 분위기맛집/다른 세상에 온 기분/시그니처 라떼 맛있고 좋아요ㅎㅅㅎ/카페가 넓고 분위기 좋다 쪼금 어둡다 강아지가 귀엽다 근데 가끔 짖는다/분위기 진짜 좋고 강쥐 귀엽 ㅎㅎ과제하기 젛아유/분위기 너무 좋아요.. 걍 첨 가자마자 반함 글고 ‘소소’라는 강아지가 돌아다니는데 너무 귀여워요ㅠㅠㅠ 음료도 너무 맛있는데 디저트가...존맛 스콘도 너무 맛있고 크로플 진짜 개맛있음ㅠ 위에 아이스크림이 올라가서 더 맛있어요 진심 사장님도 친절하시고 정말 좋은 카페에요ㅠ 얘기하면 루미큐브도 할 수 있어요!/커피 맛있네요."
