,name,address,sort,menu,mean_price,score,people_give_score,review_count,review_list
0,더피터커피,서울 중구 퇴계로 411 (우)04570,카페,"아메리카노(HOT),카페라떼(HOT),바닐라라떼(HOT),카페모카(HOT),플랫화이트(HOT)",5060,3.8,50,239,"커피는 쏘쏘, 퀸아망 까눌레 강추 2층 자리는 인스타 감성이라 불편하고 3층은 2층보단 낫지만 통으로 된 긴 좌석이라 모르는 사람이랑 앉는게 불편한 분들은 비추 약간 스벅에 있는 6인 책상이 2개 연달아 붙어있는 st ?   하니칼국수 갔다가 그냥 예뻐서 들어왔는데 베이커리 맛집 찾고 가서 기분이 좋네요/1. 빵은 맛 있는데 커피는 별로임. 2. Aesthetic 위주로 꾸민거라 오랫동안 있기에는 의자가 불편할 수 있어요.  3. 애견동반이라 좋음. 4. 스태프 친절함. 5. wifi 잘 터짐. /동그라미 통창이 매력적인 동네 카페 자리나 테이블이 대부분 불편함 크로와상도 특출나게 맛있는 편은 아님/커피 맛있음 크로아상 에그타르트 맛있음/맛은 좋은데 내부에서 먹기는 좀 불편해요.. 포장해왔어요/맛있어요!!! /빵도 커피도 괜찮았으나 자리가 딱딱해서 불편했어요 건물이 좁고 긴 구조라 여러층 올라가야 해요/큰 도로변에 있는줄 알고 헷갈렸지만 잘 찾았다! 층이 높고 카페가 넓은건 아니여서 3층에서 먹음~! 커피 크레마 넘 좋았고 빵도 무난무난 쿠이나방 달달한 크로와살 느낌 존맛 후추소금빵은 후추향이 쫌 강해서 맵긴했다/공간이 좁고 계단만 높음/최근에 주인이 바뀌면서 스탭분들도 다 바뀐 것 같은데 갈수록 운영이 실망스러워지네요. 솔직히 예전에도 매니저분 제외하면 직원분들이 친절하지는 않았지만 '그럼에도 불구하고' 방문하는 카페였는데 더이상은 가지 않을 것 같아요. 인테리어랑 레시피만 전달받은 수준인데, 최근 방문에서는 커피 맛도 실망스러웠고 빵 맛도 일정하게 유지가 안 되고 있는 듯 하고요. 카운...더보기/까놀레 너무 맛있어요 /베이커리종류도 꽤 있고 커피도 무난무난/앙버터랑 소시지빵 맛있어용 얼그레이빵은 노맛/ㅣ시간되면 쫓아내요 ㅜㅜ/빵 너무 맛있고 카페 분위기도 넘나 좋아욤 ㅠㅠ /빵 존맛 앙버터 바질크림치즈어쩌고 등등  분위기예쁨/여기 자주오는데 직원 전용 엘리베이터좀 만들어주세요.... 커피맛, 빵, 분위기 모든 게 다 조화로운데 딱하나 계단이 너무 가파르고 한여름에 5층은 진짜 숨넘어갈듯.... 손님용은 그다지 필요없으니 작게라도 직원용 하나 만들어주셨으면 좋겠어요. /페스츄리류가 특히 맛있어요 근데 가격대가 좀 있는 편/one of my favorite cafes in seoul—bright yet cozy and great for studying. their grain latte is my favorite but they also have a pretty solid selection of breads/pastries/7/24 방문 B번 아메리카노. 메뉴판에 설명한 맛 하나도 안 남 얼그레이 플라워 밀크티. 맛이 연하다 가격비쌈 까놀라. 겉에 넘 질겨서 안 잘림 찢어먹다가 오래된간지 질겅거려서 안 먹음 ㅠ  3층까지 있는데 1층에만 직원 있어서 소통 어려움 /커피......../카페와 베이커리류가 모두 맛있으나 카페가 조금 협소하다. 그 나름의 감성이 있는데 나랑은 잘 안맞는 것 같다./크로와상 맛있음 루프탑은 신당 뭐 볼 건 별로 없지만 걍 신당에 루프탑 카페가 생긴 거 자체로 별을 주겠음,,, 2층인다 3층인가 큰 테이블 있는데 말고는 자리 다 불편함 근데 처음 생겼을 때에 비해 빵 종류가 좀 줄어든듯? /불친절.. 인사 한마디를 안하심.. 되려 내가 안녕하세요봇 하고옴.. 자리도 진짜 불편함../분위기도 좋구 빵도 맛있어요:)/크로아상 대박이에요../빵에서 나옴 컷팅해놓고 먹어서 볼수있었음  이조각에 있던기 제일 컸고 다른 조각에도 있었음  이게뭘까요? 역겹 /엄청 좋지도 나쁘지도 않은....굳이 찾아갈 필요는 없는 것 같아요  쑥크림 들어간 커피는 맛있었습니다! 바닐라라떼는 별로 안달다고 합니다/크로아상 맛있어요 가게 너무 예쁜데 자리는 불편해요ㅠㅡㅠ /커피가 넘 미지근해요..."
1,주신당,서울 중구 퇴계로 411 (우)04570,칵테일바,표기안함,표기안함,3.8,34,121,
2,심세정,서울 중구 퇴계로 409-11 1층 (우)04570,디저트카페,"아메리카노,카페라떼,밀크티,티라미수비엔나",5375,3.2,53,180,"빵이 노출되어 있는게 좀 찝찝하고 주방에 있는 분이 머리 치렁치렁한채로 빵 포장하고 있는게 좀 그렇긴 하지만 빵 맛있었어요. /위생이 최악입니다...홀관리를 아예 안하는거 같아요 테이블이 더럽길래 물티슈 얻어서 닦았는데 너무 충격적으로 시커멓게 묻어 나왔어요...그거까지 찍어서 올릴라다가 맙니다../심세정 조아효/방역 최악입니다. QR코드 찍지도 않습니다. 사람들 가득차서 마스크 착용한 손님 하나도 못봤고, 제지하는 직원들도 없고요. 노마스크로 대화하고 먹고 음료 마셔대는 분위기에 창문이나 문 좀 5분 만이라도 열어 달라니, 손님 하나 때문에 다른 손님에게 방해될 수 없다고 단칼에 거절하는 알바생 태도에 기가 찼습니다. 코시국에 확진자 급증하는 때에, 모두를 위해 ...더보기/생일초꽂으려고했는데 다깨진 케익을 팔고있음  ㅡㅡ 기분별로에요 이런케익을 누가팔아요/분위기 좋고 시그니처 메뉴가 맛이 좋아요^^/원두는 고소한 향 베이커리가 전문 느낌으로 맘에들었음  친절하고 갬성ㅇㅇ/불친절.../카페 이름에 세정이 들어가는거랑 대비되게 카페가 너무 지저분해요... 안은 모르겠고 야외 자리가 있는데 진짜.. ㅠㅠ 의자도 그렇고 소파? 같은 것도 그렇고.. 위에 쳐다봤는데 가로등 쪽에 거미줄 엄청 많은데 바로 밑에 자리가 있어서 찝찝하고 옆에 사다리 같은 것도 먼지 엄청 많고..../마감시간 1시간 조금 넘게 두고 방문했습니다. 카운터에서 메뉴를 고르고 있었는데 남자 직원분이 여자 직원분한테 이렇게 마감 앞두고 띄엄띄엄오는게 힘들다는 식으로 말씀을 하시는데 손님입장에서는 기분이 좋지 않았습니다. 그리고 충분히 들릴만한 거리였고요. 그냥 먹지말고 나갈까라는 생각이 들정도였습니다. 커피맛도 너무 쓰고 텁텁하고 별로였는데 맛은 둘째치고 서비...더보기/2층은 자리가 별로에요 인스타 감성 이뻐요^^/uhm.../몽키브레드, 레몬타르트, 바나나시나몬 파운드 먹었는데 타르트랑 파운드는 진짜 맛있어요!! 몽키브레드는 맛있긴한데 두개에 비해 조금 평범쓰ㅎㅎ 커피는 달달한 디저트랑 먹기에 적당하고 매장 분위기나 직원친절도도 괜찮았습니다.  오늘 16시쯤 방문하니까 자리가 조금 차긴했는데 회전율이 높아서 괜찮았어요/인스타 감성 카페느낌이고 1층은 시원하나 2층은 매우 덥다 들어가면 빵이 보기좋게(먹고싶게) 진열되어 있고 거기에 이끌려 여러 빵을 집게 되는 수순 바게트는 에프에 다시 구워먹으면 맛있을 것 같으나 매장에서 그냥 바로 먹기엔 좀 비추 포장 ㄱ ㄱ  (밤치즈는 맛있, 단호박크림치즈는 치즈는 많은데 조화가 애매, 레터링 케이크는 괜춘, 소라빵?은 안에 크림 느...더보기/레몬 머랭 타르트가 오래된 거라 그런지 아래쪽 파이 부분과 크림이 합체를 했네요.. 그냥 다 녹아내려서 먹기 너무 불편하고 원하는 식감도 아니었어요./Good/자리 얼마없고 2층 머리박을 곳 많아요/초코빵 네개사서 까눌레?인가 그건 존맛탱이고 나머지는 그럭저럭이라 남겼어요. 바닐라라떼도 그럭저럭 분위기는 신식이라 뭔가 힙하고 좋습니다. 신당에 핫한카페같은 느낌 근데 요새 커피랑 빵 맛집이 많아서 높은별점주기는 어렵네요. 크루아상도 조금 느끼 ㅜㅜ 버터가 당연히 많이 들어가긴 하지만 그래도.. 여튼 까눌레? 먹으러는 또 가고싶네요ㅋㅋ/맛있는데 빵을 살때마다 맛이 약간 바뀌는 느낌...?/음료는 무엇을 시키더라도 퀄리티 개저렴함 게다가 위생 무엇... 마감시간 직전에 갔다가  불친절에 놀라고 설거지 대충하는 거 보고 뜨헉 함.... 거기다 빵가루 흩날리고 손을 대던 도마를 그냥 빗자루? 같은 걸로만 쓸어내고 끝내는 거 보고 두번 다시 안 감/생각보다 그냥 그랬어요 막 손이 가는 빵이 별로 없는..?/좋앟어용 헤헤/맛있고 다 좋은데 내부 테이블 간격이 좁아서 조금 걱정되요/리모델링하기 전엔 사람도 별로 안 많고 빵도 맛있고 특히 2층 빈백 있는데가 완전 좋았는데 리모델링 한 이후로 자리도 불편해지고 빵도 맛있는거 별로 안 나와서 안 감 ㅠ 인스타 감성 카페 돼버림/진짜 많이 갔었는데 점점 맛이 떨어짐. 빵도 이제 맛집으로 꼽을 수 없다. 손님이 많으면 음료 퀄리티가 심각하다.  이 주변에 갈만한 베이커리 카페가 없어서 울며 겨자먹기로 가는데.. 나아지길 바라요./항상 뭔가 애매함... 케이크종류는 맛있는데 빵은 좀 별로/무난무난해요~ 돈 아깝진 않습니다./분위기도 좋고~ 빵도 커피도 맛잇음 초코크루아상을 못먹고 나온게 한이당.. 다음에 가서 초코크루아상 꼭 먹어야겠음요 파운드케익도 이정도 양에 가격이면 훌륭하다거 생각합니당/팥버터 바게트만 맛있음.  그런데 두개 사서 먹어보니 하난 너무 짜고, 하난 무염버터처럼 아무 맛 안나서 물어보니   무염버터에 직접 소금을 뿌린다함. 한마디로 복불복이 있는 맛임...;;;    나머지는 개인적으로 다 별로. 거기에 천장 낮고 의자 불편한 전형적인 인스타 갬성 카페. 오래 있을 수 없음. /빨미까레 맛없음 사지마세요/좋아요/바게트가 먹고 싶어서 갔었는데 잠봉이 있더라고요? 바게트는 통이고 잠봉은 단면이 보였는데 잠봉의 단면을 보니 잠봉에 쓴 바게트에 기공이 잘 보이지 않고 빽빽한 단면이어서 형편 없더라고요? 그래서 아 저런 바게트로 잠봉을 만들다니 바게트 사봤자 형편없는 바게트겠구나 싶었어요. 근데 이미 온 거 햄이랑 버터 맛으로 커버되는 잠봉이나 사먹어보자 싶었는데 아니나 ...더보기"
3,카페 아포테케리,서울 중구 퇴계로 409-9 (우)04570,카페,"아메리카노,카페라떼,아인슈페너 (ICE),자몽티,자몽에이드",5800,3.5,53,143,"노래 좋고 음료도 굿/피스타치오 라떼가 진짜 너무 맛있습니다 인생에서 먹어본 라떼 중에 손에 꼽게 맛있어요 이거. 리뷰 남기려고 로그인도 했네요 사장님도 친절하시고 진짜 개맛집/분위기 좋고 크로플 맛있고 음료도 괜찮음/비싸요 맛은 평범 분위기는 괜찮아요/피스타치오라떼/동네카페치고 나쁘지않아요. 가격대 조금 있는편이고 막 엄청 맛있지는 않아요/이렇게ㅜ맛없는 비엔나커피를 비싸게 받다니/좋아요 신당동의 명소구요 신당동 시그니쳐가게에요/너무 추워요…. 너무추워… 동상걸릴거같음/응대에 일관성이 너무 없네요 테이블 정리해주는거나 자리 대기 안내도 그렇고... 그냥 적당한 감성카페 같아요/별 한 개도 아까움/내부자체는 테이블간에 간격도있고 나쁘지않은데 커피는 좀애매해요 바닐라라떼를 마셨는데 그냥 시럽넣은 카페라떼를 마신느낌/좀 추웠어요ㅠ/크로플 완전 맛있었어요!!! 크로플맛집!!!/커피 맛있고 적당히 친절하시고 인테리어 모던하니 좋음./캠핑의자 분위기 아인슈페너 아포가토 둘다 맛있늠/안쪽에 프라이빗한 자리 앉으려고 했는데 사장님이 단체석이라고 못 앉게 하심… 그러다가 저희가 밖에 앉고 다른 사람들 오니까 그 분들은 그냥 거기 앉더라구요. 주말이라 이해하자 했지만 솔직히 조금 많이 아쉬웠어요. 테이블 자리를 호스팅 해주시면서 음료 픽업은 셀프..? 뭔가 어울리지 않는 느낌이었고 그냥 자리 선택권 없어서 아쉬웠음 음료 맛은 좋았지만 솔직히...더보기/냉난방 안됨 너무 춥당 아늑함이 없음 뭔가 되게 힙한 느낌내려고 애쓴느낌  막상 감각은 별로 없는 느낌/공간도 넓고 노래도 좋아서 음료도 맛있게 먹었어요◡̈   레몬에이드 추천!! 크로플은 그냥저냥 다른데와 비슷한것 같아요/영업 안하면 안 한다고 공지좀 부탁드려용 ㅜ/아인슈페너 맛있다 공간도 꽤 괜찮음/정말 예전부터 가장 많이 오는 카페 3곳 중 하나인데, 요즘 바뀌어도 너무 바뀐 것 같다... 예전과 같은 느낌이 하나도 없다. 커피도 예전보다 맛이 못하다. 이곳의 아인슈페너와 플랫화이트가 적어도 내 입맛에는 최고였는데... 아쉽다./인스타 감성 cafe답게 창렬임 그래도 인스타 자주하는 친구는 분위기 좋다함ㅋㅋ 하겐다즈 아이스크림이랑 앙버터 크로플 맛있음/커피. 피자가 맛있어요. 추천합니다 /다회용 잔에 커피 받아도 문제없다는 건 증빙 되었는데.. 왜 계속 일회용 잔에 주는지 모르겠습니다.  환경문제는 모두의 문제입니다. 사장님 기후변화 의식이 절실해요./의외로 대화 나누기에 편한 장소. 음료는 인상 깊지 않았지만 피자는 한 번 더 먹고 싶단 생각이 듭니다./가성비 최악 창렬 그 자체.  아인슈페너 잔 정말 코딱지만하고 한 180ml? 얼음 빼면 더 적을듯. 양 정말 적고 그렇다고 특출나게 맛있지도 않음. 그냥 다른 개인카페에서도 맛볼 수 있는 평범 그 자체. 하지만 가격은 6500원ㅋㅋㅋㅋㅋㅋㅋㅋ 거기에 스터디카페처럼 큰 테이블 있고 의자 다닥다닥 있어서 분위기도 별로고, 사람 좀 차면 시장바닥처럼 시끄러움....더보기/쾌적하고 음료가 맛있습니다! 내부에 화장실도 있습니다!/신당동 떡볶이 먹으러 갔다가 들렀어요!  저녁에도 조명이 이쁘더라구요. 맥주와 피자도 파는 카페. 공간이 마음에 들어서 또 방문할 것 같습니다./여기 분위기 좋아요! 토피넛라떼 존맛♥ /좋아요 좋아요"
4,하니칼국수,서울 중구 퇴계로 411-15 1층 (우)04570,국수,"돼지갈비,저녁메뉴 17:00 이후가능,15,000,추천,11,000,8,000,9,000",15000,3.1,75,441,"존맛 ;/저는 줄 안서고 바로 먹었는데 괜찮았어요. 밥 말아먹으니 좋음. 줄 서서 먹을 맛은 아님. /기다려서 먹을정도는 아니에요. 인스타에서 핫하고 알곤이는 특이한 메뉴라 엄청 기대하고 갔는데 간이 너무 셈 ㅠㅠ 수육과 동그랑땡은 맛있었어요ㅋㅋ 아무튼 먼길 가서 기다려 먹을 정도는 절대 아님.. 또 먹으러 오고싶단 생각은 안들었음/가볼만해요 정말 알탕에 칼국수면 넣은 맛이에요 생각하는 그맛인데 칼칼 시원은 아니고 알곤이 많고 밥도 공짜 무한리필이에요 바쁜데도 직원분들이 진짜 친절...!/1인1메뉴 시켜야 하구요.  술과 함께 먹다가 국물이 차가워져 한번 데워달라고 하며 추가 돼지갈비 시켰는데 원.래. 는. 국물을 데워줄수 없다고 코에 점이 있으신분께서 말씀을 하시는데 표정을 잊을수가 없네요.   하나 시켜서 나눠 먹는것도 아니고 음식만 아닌 주류와 함께 먹는 곳이면 데워줄수 있지 않나요?    1시간 이상 기다려서 먹을 맛은 아니구요 더구...더보기/줄서는식당 알곤이칼국수+수육맛집/수요일 오후 7시 4명 15분 웨이팅 했습니다. 해장 칼국수 먹었습니다.  내장이 들어가서 기름 가득한 찐하고 간이 매우 강해요 시원하고 칼칼한 맛이 아닌 눅진하고 매콤한 맛이라 사실 해장이라기보단..... 어머니가 해주신 몸에좋은 맛이라기보단 아~주 불량시품같은 맛이네요  저는 갠적으로 이런 자극적인 몸에 안좋을 것 같은 맛을 좋아해서 다시 올 것 같지만...더보기/나쁘진않았는데 기다려서 먹을정도로 엄청 맛있지도 않았던../엄청 기대하고 30분 웨이팅 끝에 들어갔는데,  칼국수 국물이 너무 식어있어서 별로였던 ㅠㅠ 칼칼한게 술안주로 그만이었고, 동그랑땡도 맛있었어요~  뜨끈하게 먹어보고싶어 한번쯤 더 가보고싶지만, 웨이팅이 있다면 굳이../엄청 기대했으나 굉장히 별로였던집 맛이 이상하다? 국물이 짜다..? 아님 가장 기본인데 칼국수면이 안익어서 나옴 ㅋㅋㅋㅋ 한입먹었을때 그 역한밀가루 향이 올라오고 딱딱하고 국물에도 그 향이 새어나와서 거의 다 남겼네요 /짜고간 쎈 특이한 알곤이 칼국수와 수육 맛집/손님은 죄다 20대초반. 다들 칼국수는 죄다 남기고 인스타용 사진만 찍고있었음. 한마디로 요즘 핫플에 왔다고 증거남기러 가는 곳. 진짜 알탕 좋아하시는 분들은 아저씨들 많은 노포가세요. 기본이 안된 맛/짭니다.. 가격대비 비쌈.... 다조리해논거에 국물 부어준거같아요ㅋㅋㅋ 국수가 덜익음...ㅋㅋ 어차피 이제 안올꺼니까ㅋㅋ/칼국수보다 공깃밥이 더 좋아요! 그래서 밥은 알아서 먹을 수 있도록 셀프바 준비 되어 있더라고요 김치가 너무 맛있어요 그래서 수육이 새우젓도 맛있어요 동그랑땡도 간장이랑 같이 먹으면 육즙이 미쳤어요. 육향 있어요 감안하세요! 소주 좋아하시는 분들에게 천국일듯/간이 세고 짜고 맛있어요 면 양은 적당하고 알고니는 많이 들어있어서 대식가 기준 양 적당합니다! 또 방문하고픈 집이에요/알곤이가 꽤나 실하게 들어있음. 생각보다 맵고 자극적인 편. 칼국수, 수육 추천. 갈비, 동그랑땡 비추. 웨이팅할 정도까진 아니지만 한 번쯤은 가봐도 괜찮음./진짜 자극적인데 맛있다 알과 곤이가 생각보다 꽤 실하게 들어있어서 놀랐다 ㄴㅇㄱ/21.12.8 별2개 알곤이와 재첩하나씩 시켜서 먹었는데 노래소리 너무 시끄러워서 정신이 하나도 없고 곤이칼국수 너무 짜고 칼국수 양이 넘 적었습니다...  22.1.19 저도 모르게 또 찾아와서 먹었습니다.. 대기시간이 40분정도 있었는데 전보다 맛도 덜짜지고 양도 많아졌어요ㅜㅜ직원분들도 넘 친절하시고 짱맛!! /동네 주민이고, 옆에 병원갔다가 저녁 먹으려고 들렀음. 칼국수집이면 칼국수 면이 메인아닌가? 알곤이 칼국수라 알곤이 많이 들어있는건 좋은데 면도 있어야지… 걸쭉하고 짜디짠 국물에 면도 없이 알곤이 건져먹다가 질리고 이빨이 아파서(물론 이건 개인적인 문제) 반도 더 남은 거 포장 요청했더니 안된다네? 포장 판매 제품있다고 떡하니 붙혀놓고 비조리만 포장된다고?...더보기/여섯시반쯤 영업시간에 대해 문의를 했고, 여덟시 전에 도착하면 식사를 할 수 있다고 안내 받았습니다.  일곱시반쯤 식당에 도착했지만 주방마감이 8시이고 지금 웨이팅이 있어 자체적으로 웨이팅 마감을해서 식사가 불가능하다고 하네요.   식사를 못해 맛은 어떤지 모르겠으나 서비스는 상당히 떨어집니다. /한번이면 족한, 자극적인, 진부한/내가 집에서 해도 저 정도는 함/자극적이고 알이랑 곤이가 많다 비싸긴 하지만 맛있다…/알곤이칼국수는 평범한 맛이었음...차라리 내장칼국수가 훨씬더 맛났음.. 전체적으로 그닥이었음/웨이팅할 정도는 절대 아님/먹어도 먹어도 줄지않는 알..! 진한 매운탕 먹는 느낌이라 좋았어요. 전 짠거 좋아하는 편이라 입맛에 잘 맞았어요. 낮에 갔는데 주변 거리외향과는 문여는 순간 젊은 분위기 짱짱~만족감 100 채워주는 양이었어요. 90년대 음악나와서 레트로 감성채워주시고. 고니알칼국수라...흔하지 않은 메뉴인데. 오랜만에 신박한 음식 발견해서 좋았어요. 근데 고니와 알이 반...더보기/지인이 가자고 해서 오전에 갔는데 알곤이가 들어갔는데도 국물의 깊이가 없어 조금 놀랐어요;;/방송에 나왔다고 젊은사람들 줄서있음...  식당이라기보다는 점심부터 술집 분위기... 클럽음악 등을 크게 틀어놓고 정신이 없음.  김치는 아주 매운 맛. 곤이국수도 매움. 둘이 같이 먹으면 더 매움. 가격은 비쌈./깊은 맛이 안나고 맵기만해요../솔직 후기..  짜다,맵다,저렴한 맛, 음식집 No 술집 안주 ok 제첩칼국수는 소금물 알고니칼국수는 텁텁 msg 알고니 자체는 맛좋았어요. 다시오고싶지는 않네요./존맛인디요? 박수치면서먹음/밥 무한리필! 노래 넘 조음!!!!!  이대로 쭉 가주시길!!!!!!!!/소금과 msg 범벅"
5,우미회전초밥 신당점,서울 중구 퇴계로 397 (우)04569,"초밥,롤","오도로(1ps),우동,소바,대마끼,초록접시,빨간접시",3483,3.9,53,62,"맛도 평범하고 장점이라면 위에 올라가는 생선 사이즈가 크다는건데 가격 생각하면 별로 그런 것 같지도 않고 굳이 여기서 줄서서 먹어야하나? 싶음/가격은 비싸지만,  초밥에 올려진 회 크기가 어마무시함. 재방문 의사 있음. 추천./먹고.. 배탈이 났네요ㅠㅜ/초밥에 이렇게 큰 회를 올려주는 집은 처음본다 맛도 휼륭합니다잉/가성비 최고!!!! 연어초밥의 연어두께는 상상을 초월합니다./이번에 방문했을 때 결재도 잘못했고 갈때마다 맘에 안드는 점이 있지만 초밥은 매우 매우 맛있어요/마치 흐르는 강물을 거꾸로 거슬러 오르는 연어를 그 자리에서 뜯어먹는 불곰이 된 듯한 기분이랄까.. 초밥에 들어가는 생선 크기와 두께가ㄷㄷㄷㄷ/연어초밥 먹으러 가는 곳 /연어가 무슨 고깃덩어리 같이 커요;; 연어 초밥이 두툼해서 먹어 볼 만 하구요 다른 초밥은 별로 특색이 있진 않았어요 글고 포장을 회전하는 접시에서 골라가라 그래서 신기... / 연어초밥이 맛있어요...! 도톰해서 씹는 맛이 제대로임   +) 연어 집중적으로 조질라고 또 방문함/연어가 정말 두툼해요 가격도 괜찮고 맛도 있어요♡/저녁에 가볍게 요기위한 혼밥하기 좋은 집이예요 맛은 딱 가격 만큼 ㅎㅎ/최고예요/가짓수는 적지만 한접시 한접시 양이 엄청 나요! 전복(오분자기?) 빼고는 다 맛있었어요 /찾아서가기보단 근처 지나가다 들르기 좋은 곳/너무 같은것만 돌고, 그닥.../요즘 차~암 찾기힘든 초절임 숙성 고등어 초밥을 여기에서 지대로 맛볼 수 있슴. 물론 제철에만 가능. 전혀 안비리고 정말 맛있슴. 장어 성개알 청어알 등등도 항상 퀄러티 좋음. 회전율 좋아서 항상 신선하고 솔직히 이정도 가격에 이정도 깔끔하고 군더더기 없이 하는 집 서울에서 찾기 힘들다고 봄. /존맛/가격대 맞는 초밥집 괜춘함 /재방문의사 - 강력/연어초밥 맛있어요 종류가 많지 않아 아쉬웠어요 역 바로 앞이라 편했네요/기대하고 갔는데 그냥저냥냥.. 먹었습니다  종류가 비슷한 것만 돌고(말하면 주셔요)  그래도 맛있고 회도 커욤 /맛있고 회가 엄청 두툼해서 좋아요 이 가격에 이 정도로 두툼하게 얹은 회가 올라가는데 가게 유지가 가능하신게 신기할 정도네요 부디 번창하세요/그냥그래요.. ^^ 계속같은거만 도네요/두꺼운 연어살이 필요할 때 요긴할 것 같습니다/저렴한 가격에 배 터지게 먹을 수 있음 ㅠㅠ 모밀은 ㅂㄹ 차라리 우동이 ㄱㅊ /무난해요! 연어좋아하시는분은 꼭 가보세용/회가 비교적 두껍고 커서 좋음. 종류가 다양하자 않고, 연어 초밥이 많이 나오는게 단점. 가성비 괜찮은것 같음. /교통편리, 무난한 맛/빨간집시와 녹색접시 비율이 아쉽네요. 그냥 한접시 3000원짜리  초밥집입니다. 그리고 역시나 연어 말고는 그다지 맛집이라고 하기엔... 참고로 전 연어를  즐기는 편이 아닙니다. 그리고 더운 여름철엔 조심해 드십시요. 드시고 탈난 사례가 꽤 있습니다./연어초밥 먹으러 가는곳 맛집"
